11:45:57.047123 ARP, Request who-has 10.12.19.23 (ff:ff:ff:ff:ff:ff) tell 10.12.100.44, length 46
11:45:57.247933 IP 10.12.100.44.55668 > 10.12.19.23.23: Flags [.], ack 3264816852, win 1024, length 0
11:45:57.247955 IP 10.12.100.44.55668 > 10.12.19.23.135: Flags [.], ack 3264816852, win 1024, length 0
11:45:57.247957 IP 10.12.100.44.55668 > 10.12.19.23.53: Flags [.], ack 3264816852, win 1024, length 0
11:45:57.247959 IP 10.12.100.44.55668 > 10.12.19.23.199: Flags [.], ack 3264816852, win 1024, length 0
11:45:57.247961 IP 10.12.100.44.55668 > 10.12.19.23.993: Flags [.], ack 3264816852, win 1024, length 0
11:45:57.248100 IP 10.12.100.44.55668 > 10.12.19.23.8080: Flags [.], ack 3264816852, win 1024, length 0
11:45:57.248107 IP 10.12.100.44.55668 > 10.12.19.23.1723: Flags [.], ack 3264816852, win 1024, length 0
11:45:57.248109 IP 10.12.100.44.55668 > 10.12.19.23.587: Flags [.], ack 3264816852, win 1024, length 0
11:45:57.248111 IP 10.12.100.44.55668 > 10.12.19.23.113: Flags [.], ack 3264816852, win 1024, length 0
11:45:57.248112 IP 10.12.100.44.55668 > 10.12.19.23.5900: Flags [.], ack 3264816852, win 1024, length 0
11:45:58.300165 IP 10.12.100.44.55669 > 10.12.19.23.5900: Flags [.], ack 3264751317, win 1024, length 0
11:45:58.300186 IP 10.12.100.44.55669 > 10.12.19.23.113: Flags [.], ack 3264751317, win 1024, length 0
11:45:58.300188 IP 10.12.100.44.55669 > 10.12.19.23.587: Flags [.], ack 3264751317, win 1024, length 0
11:45:58.300190 IP 10.12.100.44.55669 > 10.12.19.23.1723: Flags [.], ack 3264751317, win 1024, length 0
11:45:58.300259 IP 10.12.100.44.55669 > 10.12.19.23.8080: Flags [.], ack 3264751317, win 1024, length 0
11:45:58.300262 IP 10.12.100.44.55669 > 10.12.19.23.993: Flags [.], ack 3264751317, win 1024, length 0
11:45:58.300264 IP 10.12.100.44.55669 > 10.12.19.23.199: Flags [.], ack 3264751317, win 1024, length 0
11:45:58.300265 IP 10.12.100.44.55669 > 10.12.19.23.53: Flags [.], ack 3264751317, win 1024, length 0
11:45:58.300328 IP 10.12.100.44.55669 > 10.12.19.23.135: Flags [.], ack 3264751317, win 1024, length 0
11:45:58.300331 IP 10.12.100.44.55669 > 10.12.19.23.23: Flags [.], ack 3264751317, win 1024, length 0
11:45:58.350214 IP 10.12.100.44.55668 > 10.12.19.23.143: Flags [.], ack 3264816852, win 1024, length 0
11:45:58.352714 IP 10.12.100.44.55668 > 10.12.19.23.21: Flags [.], ack 3264816852, win 1024, length 0
11:45:58.352723 IP 10.12.100.44.55668 > 10.12.19.23.554: Flags [.], ack 3264816852, win 1024, length 0
11:45:58.352725 IP 10.12.100.44.55668 > 10.12.19.23.3389: Flags [.], ack 3264816852, win 1024, length 0
11:45:58.352727 IP 10.12.100.44.55668 > 10.12.19.23.22: Flags [.], ack 3264816852, win 1024, length 0
11:45:58.352773 IP 10.12.100.44.55668 > 10.12.19.23.110: Flags [.], ack 3264816852, win 1024, length 0
11:45:58.352776 IP 10.12.100.44.55668 > 10.12.19.23.8888: Flags [.], ack 3264816852, win 1024, length 0
11:45:58.352778 IP 10.12.100.44.55668 > 10.12.19.23.256: Flags [.], ack 3264816852, win 1024, length 0
11:45:58.352818 IP 10.12.100.44.55668 > 10.12.19.23.995: Flags [.], ack 3264816852, win 1024, length 0
11:45:58.352859 IP 10.12.100.44.55668 > 10.12.19.23.3306: Flags [.], ack 3264816852, win 1024, length 0
11:45:58.400857 IP 10.12.100.44.55669 > 10.12.19.23.143: Flags [.], ack 3264751317, win 1024, length 0
11:45:58.403289 IP 10.12.100.44.55669 > 10.12.19.23.3306: Flags [.], ack 3264751317, win 1024, length 0
11:45:58.403298 IP 10.12.100.44.55669 > 10.12.19.23.995: Flags [.], ack 3264751317, win 1024, length 0
11:45:58.403299 IP 10.12.100.44.55669 > 10.12.19.23.256: Flags [.], ack 3264751317, win 1024, length 0
11:45:58.403301 IP 10.12.100.44.55669 > 10.12.19.23.8888: Flags [.], ack 3264751317, win 1024, length 0
11:45:58.403348 IP 10.12.100.44.55669 > 10.12.19.23.110: Flags [.], ack 3264751317, win 1024, length 0
11:45:58.403351 IP 10.12.100.44.55669 > 10.12.19.23.22: Flags [.], ack 3264751317, win 1024, length 0
11:45:58.403534 IP 10.12.100.44.55669 > 10.12.19.23.3389: Flags [.], ack 3264751317, win 1024, length 0
11:45:58.403541 IP 10.12.100.44.55669 > 10.12.19.23.554: Flags [.], ack 3264751317, win 1024, length 0
11:45:58.403543 IP 10.12.100.44.55669 > 10.12.19.23.21: Flags [.], ack 3264751317, win 1024, length 0
11:45:58.451439 IP 10.12.100.44.55668 > 10.12.19.23.111: Flags [.], ack 3264816852, win 1024, length 0
11:45:58.453831 IP 10.12.100.44.55668 > 10.12.19.23.25: Flags [.], ack 3264816852, win 1024, length 0
11:45:58.453855 IP 10.12.100.44.55668 > 10.12.19.23.139: Flags [.], ack 3264816852, win 1024, length 0
11:45:58.453857 IP 10.12.100.44.55668 > 10.12.19.23.445: Flags [.], ack 3264816852, win 1024, length 0
11:45:58.453859 IP 10.12.100.44.55668 > 10.12.19.23.443: Flags [.], ack 3264816852, win 1024, length 0
11:45:58.453899 IP 10.12.100.44.55668 > 10.12.19.23.1720: Flags [.], ack 3264816852, win 1024, length 0
11:45:58.453902 IP 10.12.100.44.55668 > 10.12.19.23.1025: Flags [.], ack 3264816852, win 1024, length 0
11:45:58.453972 IP 10.12.100.44.55668 > 10.12.19.23.80: Flags [.], ack 3264816852, win 1024, length 0
11:45:58.454042 IP 10.12.100.44.55668 > 10.12.19.23.4045: Flags [.], ack 3264816852, win 1024, length 0
11:45:58.454058 IP 10.12.100.44.55668 > 10.12.19.23.6792: Flags [.], ack 3264816852, win 1024, length 0
11:45:58.501853 IP 10.12.100.44.55669 > 10.12.19.23.111: Flags [.], ack 3264751317, win 1024, length 0
11:45:58.504426 IP 10.12.100.44.55669 > 10.12.19.23.6792: Flags [.], ack 3264751317, win 1024, length 0
11:45:58.504436 IP 10.12.100.44.55669 > 10.12.19.23.4045: Flags [.], ack 3264751317, win 1024, length 0
11:45:58.504451 IP 10.12.100.44.55669 > 10.12.19.23.80: Flags [.], ack 3264751317, win 1024, length 0
11:45:58.504493 IP 10.12.100.44.55669 > 10.12.19.23.1025: Flags [.], ack 3264751317, win 1024, length 0
11:45:58.504495 IP 10.12.100.44.55669 > 10.12.19.23.1720: Flags [.], ack 3264751317, win 1024, length 0
11:45:58.504556 IP 10.12.100.44.55669 > 10.12.19.23.443: Flags [.], ack 3264751317, win 1024, length 0
11:45:58.504635 IP 10.12.100.44.55669 > 10.12.19.23.445: Flags [.], ack 3264751317, win 1024, length 0
11:45:58.504638 IP 10.12.100.44.55669 > 10.12.19.23.139: Flags [.], ack 3264751317, win 1024, length 0
11:45:58.504780 IP 10.12.100.44.55669 > 10.12.19.23.25: Flags [.], ack 3264751317, win 1024, length 0
11:45:58.552997 IP 10.12.100.44.55668 > 10.12.19.23.4: Flags [.], ack 3264816852, win 1024, length 0
11:45:58.555351 IP 10.12.100.44.55668 > 10.12.19.23.6502: Flags [.], ack 3264816852, win 1024, length 0
11:45:58.555359 IP 10.12.100.44.55668 > 10.12.19.23.3809: Flags [.], ack 3264816852, win 1024, length 0
11:45:58.555471 IP 10.12.100.44.55668 > 10.12.19.23.2021: Flags [.], ack 3264816852, win 1024, length 0
11:45:58.555480 IP 10.12.100.44.55668 > 10.12.19.23.85: Flags [.], ack 3264816852, win 1024, length 0
11:45:58.555482 IP 10.12.100.44.55668 > 10.12.19.23.1234: Flags [.], ack 3264816852, win 1024, length 0
11:45:58.555484 IP 10.12.100.44.55668 > 10.12.19.23.1126: Flags [.], ack 3264816852, win 1024, length 0
11:45:58.555485 IP 10.12.100.44.55668 > 10.12.19.23.3971: Flags [.], ack 3264816852, win 1024, length 0
11:45:58.555531 IP 10.12.100.44.55668 > 10.12.19.23.8084: Flags [.], ack 3264816852, win 1024, length 0
11:45:58.555534 IP 10.12.100.44.55668 > 10.12.19.23.1073: Flags [.], ack 3264816852, win 1024, length 0
11:45:58.603216 IP 10.12.100.44.55669 > 10.12.19.23.4: Flags [.], ack 3264751317, win 1024, length 0
11:45:58.605824 IP 10.12.100.44.55669 > 10.12.19.23.1073: Flags [.], ack 3264751317, win 1024, length 0
11:45:58.605846 IP 10.12.100.44.55669 > 10.12.19.23.8084: Flags [.], ack 3264751317, win 1024, length 0
11:45:58.605847 IP 10.12.100.44.55669 > 10.12.19.23.3971: Flags [.], ack 3264751317, win 1024, length 0
11:45:58.605849 IP 10.12.100.44.55669 > 10.12.19.23.1126: Flags [.], ack 3264751317, win 1024, length 0
11:45:58.605850 IP 10.12.100.44.55669 > 10.12.19.23.1234: Flags [.], ack 3264751317, win 1024, length 0
11:45:58.605896 IP 10.12.100.44.55669 > 10.12.19.23.85: Flags [.], ack 3264751317, win 1024, length 0
11:45:58.605899 IP 10.12.100.44.55669 > 10.12.19.23.2021: Flags [.], ack 3264751317, win 1024, length 0
11:45:58.605901 IP 10.12.100.44.55669 > 10.12.19.23.3809: Flags [.], ack 3264751317, win 1024, length 0
11:45:58.605938 IP 10.12.100.44.55669 > 10.12.19.23.6502: Flags [.], ack 3264751317, win 1024, length 0
11:45:59.658084 IP 10.12.100.44.55670 > 10.12.19.23.6502: Flags [.], ack 3264947926, win 1024, length 0
11:45:59.658106 IP 10.12.100.44.55670 > 10.12.19.23.3809: Flags [.], ack 3264947926, win 1024, length 0
11:45:59.658108 IP 10.12.100.44.55670 > 10.12.19.23.2021: Flags [.], ack 3264947926, win 1024, length 0
11:45:59.658110 IP 10.12.100.44.55670 > 10.12.19.23.85: Flags [.], ack 3264947926, win 1024, length 0
11:45:59.658176 IP 10.12.100.44.55670 > 10.12.19.23.1234: Flags [.], ack 3264947926, win 1024, length 0
11:45:59.658180 IP 10.12.100.44.55670 > 10.12.19.23.1126: Flags [.], ack 3264947926, win 1024, length 0
11:45:59.658182 IP 10.12.100.44.55670 > 10.12.19.23.3971: Flags [.], ack 3264947926, win 1024, length 0
11:45:59.658229 IP 10.12.100.44.55670 > 10.12.19.23.8084: Flags [.], ack 3264947926, win 1024, length 0
11:45:59.658232 IP 10.12.100.44.55670 > 10.12.19.23.1073: Flags [.], ack 3264947926, win 1024, length 0
11:45:59.658234 IP 10.12.100.44.55670 > 10.12.19.23.4: Flags [.], ack 3264947926, win 1024, length 0
11:45:59.658235 IP 10.12.100.44.55670 > 10.12.19.23.25: Flags [.], ack 3264947926, win 1024, length 0
11:45:59.658306 IP 10.12.100.44.55670 > 10.12.19.23.139: Flags [.], ack 3264947926, win 1024, length 0
11:45:59.658314 IP 10.12.100.44.55670 > 10.12.19.23.445: Flags [.], ack 3264947926, win 1024, length 0
11:45:59.708392 IP 10.12.100.44.55670 > 10.12.19.23.1720: Flags [.], ack 3264947926, win 1024, length 0
11:45:59.708415 IP 10.12.100.44.55670 > 10.12.19.23.1025: Flags [.], ack 3264947926, win 1024, length 0
11:45:59.708417 IP 10.12.100.44.55670 > 10.12.19.23.4045: Flags [.], ack 3264947926, win 1024, length 0
11:45:59.708419 IP 10.12.100.44.55670 > 10.12.19.23.6792: Flags [.], ack 3264947926, win 1024, length 0
11:45:59.708420 IP 10.12.100.44.55670 > 10.12.19.23.111: Flags [.], ack 3264947926, win 1024, length 0
11:45:59.708421 IP 10.12.100.44.55670 > 10.12.19.23.21: Flags [.], ack 3264947926, win 1024, length 0
11:45:59.708469 IP 10.12.100.44.55670 > 10.12.19.23.554: Flags [.], ack 3264947926, win 1024, length 0
11:45:59.708472 IP 10.12.100.44.55670 > 10.12.19.23.3389: Flags [.], ack 3264947926, win 1024, length 0
11:45:59.708474 IP 10.12.100.44.55670 > 10.12.19.23.22: Flags [.], ack 3264947926, win 1024, length 0
11:45:59.711061 IP 10.12.100.44.55670 > 10.12.19.23.110: Flags [.], ack 3264947926, win 1024, length 0
11:45:59.711083 IP 10.12.100.44.55670 > 10.12.19.23.8888: Flags [.], ack 3264947926, win 1024, length 0
11:45:59.711085 IP 10.12.100.44.55670 > 10.12.19.23.256: Flags [.], ack 3264947926, win 1024, length 0
11:45:59.711086 IP 10.12.100.44.55670 > 10.12.19.23.995: Flags [.], ack 3264947926, win 1024, length 0
11:45:59.759173 IP 10.12.100.44.55671 > 10.12.19.23.443: Flags [.], ack 3281594324, win 1024, length 0
11:45:59.759207 IP 10.12.100.44.55670 > 10.12.19.23.3306: Flags [.], ack 3264947926, win 1024, length 0
11:45:59.759210 IP 10.12.100.44.55670 > 10.12.19.23.143: Flags [.], ack 3264947926, win 1024, length 0
11:45:59.759212 IP 10.12.100.44.55670 > 10.12.19.23.23: Flags [.], ack 3264947926, win 1024, length 0
11:45:59.759291 IP 10.12.100.44.55670 > 10.12.19.23.135: Flags [.], ack 3264947926, win 1024, length 0
11:45:59.759294 IP 10.12.100.44.55670 > 10.12.19.23.53: Flags [.], ack 3264947926, win 1024, length 0
11:45:59.759296 IP 10.12.100.44.55670 > 10.12.19.23.199: Flags [.], ack 3264947926, win 1024, length 0
11:45:59.759442 IP 10.12.100.44.55670 > 10.12.19.23.993: Flags [.], ack 3264947926, win 1024, length 0
11:45:59.759449 IP 10.12.100.44.55670 > 10.12.19.23.8080: Flags [.], ack 3264947926, win 1024, length 0
11:45:59.762055 IP 10.12.100.44.55670 > 10.12.19.23.1723: Flags [.], ack 3264947926, win 1024, length 0
11:45:59.762062 IP 10.12.100.44.55670 > 10.12.19.23.587: Flags [.], ack 3264947926, win 1024, length 0
11:45:59.762064 IP 10.12.100.44.55670 > 10.12.19.23.113: Flags [.], ack 3264947926, win 1024, length 0
11:45:59.762066 IP 10.12.100.44.55670 > 10.12.19.23.5900: Flags [.], ack 3264947926, win 1024, length 0
11:45:59.814386 IP 10.12.100.44.55668 > 10.12.19.23.1026: Flags [.], ack 3264816852, win 1024, length 0
11:45:59.866851 IP 10.12.100.44.55669 > 10.12.19.23.1026: Flags [.], ack 3264751317, win 1024, length 0
11:45:59.866874 IP 10.12.100.44.55668 > 10.12.19.23.6059: Flags [.], ack 3264816852, win 1024, length 0
11:45:59.866877 IP 10.12.100.44.55668 > 10.12.19.23.1500: Flags [.], ack 3264816852, win 1024, length 0
11:45:59.866878 IP 10.12.100.44.55668 > 10.12.19.23.49176: Flags [.], ack 3264816852, win 1024, length 0
11:45:59.866880 IP 10.12.100.44.55668 > 10.12.19.23.44442: Flags [.], ack 3264816852, win 1024, length 0
11:45:59.866929 IP 10.12.100.44.55668 > 10.12.19.23.6779: Flags [.], ack 3264816852, win 1024, length 0
11:45:59.866933 IP 10.12.100.44.55668 > 10.12.19.23.5226: Flags [.], ack 3264816852, win 1024, length 0
11:45:59.866935 IP 10.12.100.44.55668 > 10.12.19.23.5906: Flags [.], ack 3264816852, win 1024, length 0
11:45:59.867039 IP 10.12.100.44.55668 > 10.12.19.23.1310: Flags [.], ack 3264816852, win 1024, length 0
11:45:59.918125 IP 10.12.100.44.55669 > 10.12.19.23.1310: Flags [.], ack 3264751317, win 1024, length 0
11:45:59.918174 IP 10.12.100.44.55669 > 10.12.19.23.5906: Flags [.], ack 3264751317, win 1024, length 0
11:45:59.918176 IP 10.12.100.44.55669 > 10.12.19.23.5226: Flags [.], ack 3264751317, win 1024, length 0
11:45:59.918178 IP 10.12.100.44.55669 > 10.12.19.23.6779: Flags [.], ack 3264751317, win 1024, length 0
11:45:59.918180 IP 10.12.100.44.55669 > 10.12.19.23.44442: Flags [.], ack 3264751317, win 1024, length 0
11:45:59.918264 IP 10.12.100.44.55669 > 10.12.19.23.49176: Flags [.], ack 3264751317, win 1024, length 0
11:45:59.918267 IP 10.12.100.44.55669 > 10.12.19.23.1500: Flags [.], ack 3264751317, win 1024, length 0
11:45:59.918269 IP 10.12.100.44.55669 > 10.12.19.23.6059: Flags [.], ack 3264751317, win 1024, length 0
11:45:59.918310 IP 10.12.100.44.55670 > 10.12.19.23.1026: Flags [.], ack 3264947926, win 1024, length 0
11:45:59.969008 IP 10.12.100.44.55670 > 10.12.19.23.6059: Flags [.], ack 3264947926, win 1024, length 0
11:45:59.969030 IP 10.12.100.44.55670 > 10.12.19.23.1500: Flags [.], ack 3264947926, win 1024, length 0
11:45:59.969032 IP 10.12.100.44.55670 > 10.12.19.23.49176: Flags [.], ack 3264947926, win 1024, length 0
11:45:59.969034 IP 10.12.100.44.55670 > 10.12.19.23.44442: Flags [.], ack 3264947926, win 1024, length 0
11:45:59.969035 IP 10.12.100.44.55670 > 10.12.19.23.6779: Flags [.], ack 3264947926, win 1024, length 0
11:45:59.969089 IP 10.12.100.44.55670 > 10.12.19.23.5226: Flags [.], ack 3264947926, win 1024, length 0
11:45:59.969092 IP 10.12.100.44.55670 > 10.12.19.23.5906: Flags [.], ack 3264947926, win 1024, length 0
11:45:59.969093 IP 10.12.100.44.55670 > 10.12.19.23.1310: Flags [.], ack 3264947926, win 1024, length 0
11:45:59.969134 IP 10.12.100.44.55668 > 10.12.19.23.8654: Flags [.], ack 3264816852, win 1024, length 0
11:46:00.019228 IP 10.12.100.44.55668 > 10.12.19.23.50389: Flags [.], ack 3264816852, win 1024, length 0
11:46:00.019250 IP 10.12.100.44.55668 > 10.12.19.23.1455: Flags [.], ack 3264816852, win 1024, length 0
11:46:00.019252 IP 10.12.100.44.55668 > 10.12.19.23.18101: Flags [.], ack 3264816852, win 1024, length 0
11:46:00.019254 IP 10.12.100.44.55668 > 10.12.19.23.7676: Flags [.], ack 3264816852, win 1024, length 0
11:46:00.019300 IP 10.12.100.44.55668 > 10.12.19.23.7921: Flags [.], ack 3264816852, win 1024, length 0
11:46:00.019316 IP 10.12.100.44.55668 > 10.12.19.23.9593: Flags [.], ack 3264816852, win 1024, length 0
11:46:00.021899 IP 10.12.100.44.55669 > 10.12.19.23.8654: Flags [.], ack 3264751317, win 1024, length 0
11:46:00.021921 IP 10.12.100.44.55668 > 10.12.19.23.3914: Flags [.], ack 3264816852, win 1024, length 0
11:46:00.021923 IP 10.12.100.44.55668 > 10.12.19.23.497: Flags [.], ack 3264816852, win 1024, length 0
11:46:00.069544 IP 10.12.100.44.55669 > 10.12.19.23.9593: Flags [.], ack 3264751317, win 1024, length 0
11:46:00.069586 IP 10.12.100.44.55669 > 10.12.19.23.7921: Flags [.], ack 3264751317, win 1024, length 0
11:46:00.069588 IP 10.12.100.44.55669 > 10.12.19.23.7676: Flags [.], ack 3264751317, win 1024, length 0
11:46:00.069589 IP 10.12.100.44.55669 > 10.12.19.23.18101: Flags [.], ack 3264751317, win 1024, length 0
11:46:00.069649 IP 10.12.100.44.55669 > 10.12.19.23.1455: Flags [.], ack 3264751317, win 1024, length 0
11:46:00.069652 IP 10.12.100.44.55669 > 10.12.19.23.50389: Flags [.], ack 3264751317, win 1024, length 0
11:46:00.072368 IP 10.12.100.44.55669 > 10.12.19.23.497: Flags [.], ack 3264751317, win 1024, length 0
11:46:00.072377 IP 10.12.100.44.55669 > 10.12.19.23.3914: Flags [.], ack 3264751317, win 1024, length 0
11:46:00.072413 IP 10.12.100.44.55670 > 10.12.19.23.8654: Flags [.], ack 3264947926, win 1024, length 0
11:46:00.120199 IP 10.12.100.44.55670 > 10.12.19.23.50389: Flags [.], ack 3264947926, win 1024, length 0
11:46:00.120223 IP 10.12.100.44.55670 > 10.12.19.23.1455: Flags [.], ack 3264947926, win 1024, length 0
11:46:00.120225 IP 10.12.100.44.55670 > 10.12.19.23.18101: Flags [.], ack 3264947926, win 1024, length 0
11:46:00.120226 IP 10.12.100.44.55670 > 10.12.19.23.7676: Flags [.], ack 3264947926, win 1024, length 0
11:46:00.120304 IP 10.12.100.44.55670 > 10.12.19.23.7921: Flags [.], ack 3264947926, win 1024, length 0
11:46:00.120308 IP 10.12.100.44.55670 > 10.12.19.23.9593: Flags [.], ack 3264947926, win 1024, length 0
11:46:00.122655 IP 10.12.100.44.55670 > 10.12.19.23.3914: Flags [.], ack 3264947926, win 1024, length 0
11:46:00.122665 IP 10.12.100.44.55670 > 10.12.19.23.497: Flags [.], ack 3264947926, win 1024, length 0
11:46:00.122666 IP 10.12.100.44.55668 > 10.12.19.23.7741: Flags [.], ack 3264816852, win 1024, length 0
11:46:00.171353 IP 10.12.100.44.55668 > 10.12.19.23.2002: Flags [.], ack 3264816852, win 1024, length 0
11:46:00.171403 IP 10.12.100.44.55668 > 10.12.19.23.19780: Flags [.], ack 3264816852, win 1024, length 0
11:46:00.171405 IP 10.12.100.44.55668 > 10.12.19.23.5102: Flags [.], ack 3264816852, win 1024, length 0
11:46:00.171445 IP 10.12.100.44.55668 > 10.12.19.23.15004: Flags [.], ack 3264816852, win 1024, length 0
11:46:00.171448 IP 10.12.100.44.55668 > 10.12.19.23.1433: Flags [.], ack 3264816852, win 1024, length 0
11:46:00.171450 IP 10.12.100.44.55668 > 10.12.19.23.61532: Flags [.], ack 3264816852, win 1024, length 0
11:46:00.174035 IP 10.12.100.44.55669 > 10.12.19.23.7741: Flags [.], ack 3264751317, win 1024, length 0
11:46:00.174058 IP 10.12.100.44.55668 > 10.12.19.23.3880: Flags [.], ack 3264816852, win 1024, length 0
11:46:00.174060 IP 10.12.100.44.55668 > 10.12.19.23.55555: Flags [.], ack 3264816852, win 1024, length 0
11:46:00.221405 IP 10.12.100.44.55669 > 10.12.19.23.2002: Flags [.], ack 3264751317, win 1024, length 0
11:46:00.223743 IP 10.12.100.44.55669 > 10.12.19.23.61532: Flags [.], ack 3264751317, win 1024, length 0
11:46:00.223753 IP 10.12.100.44.55669 > 10.12.19.23.1433: Flags [.], ack 3264751317, win 1024, length 0
11:46:00.223755 IP 10.12.100.44.55669 > 10.12.19.23.15004: Flags [.], ack 3264751317, win 1024, length 0
11:46:00.223757 IP 10.12.100.44.55669 > 10.12.19.23.5102: Flags [.], ack 3264751317, win 1024, length 0
11:46:00.223758 IP 10.12.100.44.55669 > 10.12.19.23.19780: Flags [.], ack 3264751317, win 1024, length 0
11:46:00.226328 IP 10.12.100.44.55669 > 10.12.19.23.55555: Flags [.], ack 3264751317, win 1024, length 0
11:46:00.226336 IP 10.12.100.44.55669 > 10.12.19.23.3880: Flags [.], ack 3264751317, win 1024, length 0
11:46:00.226338 IP 10.12.100.44.55670 > 10.12.19.23.7741: Flags [.], ack 3264947926, win 1024, length 0
11:46:00.271386 IP 10.12.100.44.55670 > 10.12.19.23.2002: Flags [.], ack 3264947926, win 1024, length 0
11:46:00.273885 IP 10.12.100.44.55670 > 10.12.19.23.5102: Flags [.], ack 3264947926, win 1024, length 0
11:46:00.273907 IP 10.12.100.44.55670 > 10.12.19.23.15004: Flags [.], ack 3264947926, win 1024, length 0
11:46:00.273972 IP 10.12.100.44.55670 > 10.12.19.23.1433: Flags [.], ack 3264947926, win 1024, length 0
11:46:00.273976 IP 10.12.100.44.55670 > 10.12.19.23.61532: Flags [.], ack 3264947926, win 1024, length 0
11:46:00.276191 IP 10.12.100.44.55670 > 10.12.19.23.19780: Flags [.], ack 3264947926, win 1024, length 0
11:46:00.278363 IP 10.12.100.44.55670 > 10.12.19.23.3880: Flags [.], ack 3264947926, win 1024, length 0
11:46:00.278376 IP 10.12.100.44.55670 > 10.12.19.23.55555: Flags [.], ack 3264947926, win 1024, length 0
11:46:00.278378 IP 10.12.100.44.55668 > 10.12.19.23.1580: Flags [.], ack 3264816852, win 1024, length 0
11:46:00.321678 IP 10.12.100.44.55668 > 10.12.19.23.16000: Flags [.], ack 3264816852, win 1024, length 0
11:46:00.324358 IP 10.12.100.44.55668 > 10.12.19.23.1114: Flags [.], ack 3264816852, win 1024, length 0
11:46:00.324366 IP 10.12.100.44.55668 > 10.12.19.23.32771: Flags [.], ack 3264816852, win 1024, length 0
11:46:00.324369 IP 10.12.100.44.55668 > 10.12.19.23.1037: Flags [.], ack 3264816852, win 1024, length 0
11:46:00.324370 IP 10.12.100.44.55668 > 10.12.19.23.9290: Flags [.], ack 3264816852, win 1024, length 0
11:46:00.326895 IP 10.12.100.44.55668 > 10.12.19.23.10180: Flags [.], ack 3264816852, win 1024, length 0
11:46:00.329381 IP 10.12.100.44.55669 > 10.12.19.23.1580: Flags [.], ack 3264751317, win 1024, length 0
11:46:00.329402 IP 10.12.100.44.55668 > 10.12.19.23.7627: Flags [.], ack 3264816852, win 1024, length 0
11:46:00.329403 IP 10.12.100.44.55668 > 10.12.19.23.2046: Flags [.], ack 3264816852, win 1024, length 0
11:46:00.372070 IP 10.12.100.44.55669 > 10.12.19.23.16000: Flags [.], ack 3264751317, win 1024, length 0
11:46:00.374897 IP 10.12.100.44.55669 > 10.12.19.23.9290: Flags [.], ack 3264751317, win 1024, length 0
11:46:00.374908 IP 10.12.100.44.55669 > 10.12.19.23.1037: Flags [.], ack 3264751317, win 1024, length 0
11:46:00.374984 IP 10.12.100.44.55669 > 10.12.19.23.32771: Flags [.], ack 3264751317, win 1024, length 0
11:46:00.374992 IP 10.12.100.44.55669 > 10.12.19.23.1114: Flags [.], ack 3264751317, win 1024, length 0
11:46:00.377345 IP 10.12.100.44.55669 > 10.12.19.23.10180: Flags [.], ack 3264751317, win 1024, length 0
11:46:00.379502 IP 10.12.100.44.55669 > 10.12.19.23.2046: Flags [.], ack 3264751317, win 1024, length 0
11:46:00.379522 IP 10.12.100.44.55669 > 10.12.19.23.7627: Flags [.], ack 3264751317, win 1024, length 0
11:46:00.379524 IP 10.12.100.44.55670 > 10.12.19.23.1580: Flags [.], ack 3264947926, win 1024, length 0
11:46:00.422296 IP 10.12.100.44.55670 > 10.12.19.23.16000: Flags [.], ack 3264947926, win 1024, length 0
11:46:00.425225 IP 10.12.100.44.55670 > 10.12.19.23.1114: Flags [.], ack 3264947926, win 1024, length 0
11:46:00.425234 IP 10.12.100.44.55670 > 10.12.19.23.32771: Flags [.], ack 3264947926, win 1024, length 0
11:46:00.425236 IP 10.12.100.44.55670 > 10.12.19.23.1037: Flags [.], ack 3264947926, win 1024, length 0
11:46:00.425238 IP 10.12.100.44.55670 > 10.12.19.23.9290: Flags [.], ack 3264947926, win 1024, length 0
11:46:00.427674 IP 10.12.100.44.55670 > 10.12.19.23.10180: Flags [.], ack 3264947926, win 1024, length 0
11:46:00.430037 IP 10.12.100.44.55670 > 10.12.19.23.7627: Flags [.], ack 3264947926, win 1024, length 0
11:46:00.430046 IP 10.12.100.44.55670 > 10.12.19.23.2046: Flags [.], ack 3264947926, win 1024, length 0
11:46:00.430048 IP 10.12.100.44.55668 > 10.12.19.23.524: Flags [.], ack 3264816852, win 1024, length 0
11:46:00.472505 IP 10.12.100.44.55668 > 10.12.19.23.2106: Flags [.], ack 3264816852, win 1024, length 0
11:46:00.475585 IP 10.12.100.44.55668 > 10.12.19.23.2049: Flags [.], ack 3264816852, win 1024, length 0
11:46:00.475608 IP 10.12.100.44.55668 > 10.12.19.23.7512: Flags [.], ack 3264816852, win 1024, length 0
11:46:00.475610 IP 10.12.100.44.55668 > 10.12.19.23.9009: Flags [.], ack 3264816852, win 1024, length 0
11:46:00.475612 IP 10.12.100.44.55668 > 10.12.19.23.667: Flags [.], ack 3264816852, win 1024, length 0
11:46:00.478205 IP 10.12.100.44.55668 > 10.12.19.23.16018: Flags [.], ack 3264816852, win 1024, length 0
11:46:00.480455 IP 10.12.100.44.55669 > 10.12.19.23.524: Flags [.], ack 3264751317, win 1024, length 0
11:46:00.480477 IP 10.12.100.44.55668 > 10.12.19.23.563: Flags [.], ack 3264816852, win 1024, length 0
11:46:00.480479 IP 10.12.100.44.55668 > 10.12.19.23.1123: Flags [.], ack 3264816852, win 1024, length 0
11:46:00.522672 IP 10.12.100.44.55669 > 10.12.19.23.2106: Flags [.], ack 3264751317, win 1024, length 0
11:46:00.526104 IP 10.12.100.44.55669 > 10.12.19.23.667: Flags [.], ack 3264751317, win 1024, length 0
11:46:00.526113 IP 10.12.100.44.55669 > 10.12.19.23.9009: Flags [.], ack 3264751317, win 1024, length 0
11:46:00.526115 IP 10.12.100.44.55669 > 10.12.19.23.7512: Flags [.], ack 3264751317, win 1024, length 0
11:46:00.526117 IP 10.12.100.44.55669 > 10.12.19.23.2049: Flags [.], ack 3264751317, win 1024, length 0
11:46:00.528522 IP 10.12.100.44.55669 > 10.12.19.23.16018: Flags [.], ack 3264751317, win 1024, length 0
11:46:00.531021 IP 10.12.100.44.55669 > 10.12.19.23.1123: Flags [.], ack 3264751317, win 1024, length 0
11:46:00.531031 IP 10.12.100.44.55669 > 10.12.19.23.563: Flags [.], ack 3264751317, win 1024, length 0
11:46:00.531032 IP 10.12.100.44.55670 > 10.12.19.23.524: Flags [.], ack 3264947926, win 1024, length 0
11:46:00.572936 IP 10.12.100.44.55670 > 10.12.19.23.2106: Flags [.], ack 3264947926, win 1024, length 0
11:46:00.576327 IP 10.12.100.44.55670 > 10.12.19.23.2049: Flags [.], ack 3264947926, win 1024, length 0
11:46:00.576352 IP 10.12.100.44.55670 > 10.12.19.23.7512: Flags [.], ack 3264947926, win 1024, length 0
11:46:00.576354 IP 10.12.100.44.55670 > 10.12.19.23.9009: Flags [.], ack 3264947926, win 1024, length 0
11:46:00.576356 IP 10.12.100.44.55670 > 10.12.19.23.667: Flags [.], ack 3264947926, win 1024, length 0
11:46:00.578764 IP 10.12.100.44.55670 > 10.12.19.23.16018: Flags [.], ack 3264947926, win 1024, length 0
11:46:00.581416 IP 10.12.100.44.55670 > 10.12.19.23.563: Flags [.], ack 3264947926, win 1024, length 0
11:46:00.581424 IP 10.12.100.44.55670 > 10.12.19.23.1123: Flags [.], ack 3264947926, win 1024, length 0
11:46:00.581426 IP 10.12.100.44.55668 > 10.12.19.23.4444: Flags [.], ack 3264816852, win 1024, length 0
11:46:00.623176 IP 10.12.100.44.55668 > 10.12.19.23.7443: Flags [.], ack 3264816852, win 1024, length 0
11:46:00.626699 IP 10.12.100.44.55668 > 10.12.19.23.30718: Flags [.], ack 3264816852, win 1024, length 0
11:46:00.626718 IP 10.12.100.44.55668 > 10.12.19.23.1187: Flags [.], ack 3264816852, win 1024, length 0
11:46:00.626735 IP 10.12.100.44.55668 > 10.12.19.23.10621: Flags [.], ack 3264816852, win 1024, length 0
11:46:00.626737 IP 10.12.100.44.55668 > 10.12.19.23.5009: Flags [.], ack 3264816852, win 1024, length 0
11:46:00.629084 IP 10.12.100.44.55668 > 10.12.19.23.2301: Flags [.], ack 3264816852, win 1024, length 0
11:46:00.631796 IP 10.12.100.44.55669 > 10.12.19.23.4444: Flags [.], ack 3264751317, win 1024, length 0
11:46:00.631836 IP 10.12.100.44.55668 > 10.12.19.23.13456: Flags [.], ack 3264816852, win 1024, length 0
11:46:00.631839 IP 10.12.100.44.55668 > 10.12.19.23.10778: Flags [.], ack 3264816852, win 1024, length 0
11:46:00.673295 IP 10.12.100.44.55669 > 10.12.19.23.7443: Flags [.], ack 3264751317, win 1024, length 0
11:46:00.677242 IP 10.12.100.44.55669 > 10.12.19.23.5009: Flags [.], ack 3264751317, win 1024, length 0
11:46:00.677268 IP 10.12.100.44.55669 > 10.12.19.23.10621: Flags [.], ack 3264751317, win 1024, length 0
11:46:00.677270 IP 10.12.100.44.55669 > 10.12.19.23.1187: Flags [.], ack 3264751317, win 1024, length 0
11:46:00.677283 IP 10.12.100.44.55669 > 10.12.19.23.30718: Flags [.], ack 3264751317, win 1024, length 0
11:46:00.679491 IP 10.12.100.44.55669 > 10.12.19.23.2301: Flags [.], ack 3264751317, win 1024, length 0
11:46:00.681920 IP 10.12.100.44.55669 > 10.12.19.23.10778: Flags [.], ack 3264751317, win 1024, length 0
11:46:00.681932 IP 10.12.100.44.55669 > 10.12.19.23.13456: Flags [.], ack 3264751317, win 1024, length 0
11:46:00.681935 IP 10.12.100.44.55670 > 10.12.19.23.4444: Flags [.], ack 3264947926, win 1024, length 0
11:46:00.723361 IP 10.12.100.44.55670 > 10.12.19.23.7443: Flags [.], ack 3264947926, win 1024, length 0
11:46:00.727783 IP 10.12.100.44.55670 > 10.12.19.23.30718: Flags [.], ack 3264947926, win 1024, length 0
11:46:00.727809 IP 10.12.100.44.55670 > 10.12.19.23.1187: Flags [.], ack 3264947926, win 1024, length 0
11:46:00.727811 IP 10.12.100.44.55670 > 10.12.19.23.10621: Flags [.], ack 3264947926, win 1024, length 0
11:46:00.727888 IP 10.12.100.44.55670 > 10.12.19.23.5009: Flags [.], ack 3264947926, win 1024, length 0
11:46:00.730344 IP 10.12.100.44.55670 > 10.12.19.23.2301: Flags [.], ack 3264947926, win 1024, length 0
11:46:00.732516 IP 10.12.100.44.55670 > 10.12.19.23.13456: Flags [.], ack 3264947926, win 1024, length 0
11:46:00.732525 IP 10.12.100.44.55670 > 10.12.19.23.10778: Flags [.], ack 3264947926, win 1024, length 0
11:46:00.732527 IP 10.12.100.44.55668 > 10.12.19.23.6106: Flags [.], ack 3264816852, win 1024, length 0
11:46:00.774120 IP 10.12.100.44.55668 > 10.12.19.23.1055: Flags [.], ack 3264816852, win 1024, length 0
11:46:00.778195 IP 10.12.100.44.55668 > 10.12.19.23.9594: Flags [.], ack 3264816852, win 1024, length 0
11:46:00.778204 IP 10.12.100.44.55668 > 10.12.19.23.1060: Flags [.], ack 3264816852, win 1024, length 0
11:46:00.778206 IP 10.12.100.44.55668 > 10.12.19.23.7004: Flags [.], ack 3264816852, win 1024, length 0
11:46:00.778208 IP 10.12.100.44.55668 > 10.12.19.23.70: Flags [.], ack 3264816852, win 1024, length 0
11:46:00.780431 IP 10.12.100.44.55668 > 10.12.19.23.1072: Flags [.], ack 3264816852, win 1024, length 0
11:46:00.782518 IP 10.12.100.44.55668 > 10.12.19.23.500: Flags [.], ack 3264816852, win 1024, length 0
11:46:00.784835 IP 10.12.100.44.55669 > 10.12.19.23.6106: Flags [.], ack 3264751317, win 1024, length 0
11:46:00.784843 IP 10.12.100.44.55668 > 10.12.19.23.16012: Flags [.], ack 3264816852, win 1024, length 0
11:46:00.824371 IP 10.12.100.44.55669 > 10.12.19.23.1055: Flags [.], ack 3264751317, win 1024, length 0
11:46:00.828854 IP 10.12.100.44.55669 > 10.12.19.23.70: Flags [.], ack 3264751317, win 1024, length 0
11:46:00.828883 IP 10.12.100.44.55669 > 10.12.19.23.7004: Flags [.], ack 3264751317, win 1024, length 0
11:46:00.828885 IP 10.12.100.44.55669 > 10.12.19.23.1060: Flags [.], ack 3264751317, win 1024, length 0
11:46:00.828887 IP 10.12.100.44.55669 > 10.12.19.23.9594: Flags [.], ack 3264751317, win 1024, length 0
11:46:00.831335 IP 10.12.100.44.55669 > 10.12.19.23.1072: Flags [.], ack 3264751317, win 1024, length 0
11:46:00.833726 IP 10.12.100.44.55669 > 10.12.19.23.500: Flags [.], ack 3264751317, win 1024, length 0
11:46:00.835944 IP 10.12.100.44.55669 > 10.12.19.23.16012: Flags [.], ack 3264751317, win 1024, length 0
11:46:00.835954 IP 10.12.100.44.55670 > 10.12.19.23.6106: Flags [.], ack 3264947926, win 1024, length 0
11:46:00.874656 IP 10.12.100.44.55670 > 10.12.19.23.1055: Flags [.], ack 3264947926, win 1024, length 0
11:46:00.879615 IP 10.12.100.44.55670 > 10.12.19.23.9594: Flags [.], ack 3264947926, win 1024, length 0
11:46:00.879629 IP 10.12.100.44.55670 > 10.12.19.23.1060: Flags [.], ack 3264947926, win 1024, length 0
11:46:00.879631 IP 10.12.100.44.55670 > 10.12.19.23.7004: Flags [.], ack 3264947926, win 1024, length 0
11:46:00.879633 IP 10.12.100.44.55670 > 10.12.19.23.70: Flags [.], ack 3264947926, win 1024, length 0
11:46:00.881906 IP 10.12.100.44.55670 > 10.12.19.23.1072: Flags [.], ack 3264947926, win 1024, length 0
11:46:00.884130 IP 10.12.100.44.55670 > 10.12.19.23.500: Flags [.], ack 3264947926, win 1024, length 0
11:46:00.886586 IP 10.12.100.44.55670 > 10.12.19.23.16012: Flags [.], ack 3264947926, win 1024, length 0
11:46:00.886651 IP 10.12.100.44.55668 > 10.12.19.23.1097: Flags [.], ack 3264816852, win 1024, length 0
11:46:00.925151 IP 10.12.100.44.55668 > 10.12.19.23.2190: Flags [.], ack 3264816852, win 1024, length 0
11:46:00.930508 IP 10.12.100.44.55668 > 10.12.19.23.5033: Flags [.], ack 3264816852, win 1024, length 0
11:46:00.930516 IP 10.12.100.44.55668 > 10.12.19.23.1641: Flags [.], ack 3264816852, win 1024, length 0
11:46:00.930518 IP 10.12.100.44.55668 > 10.12.19.23.5960: Flags [.], ack 3264816852, win 1024, length 0
11:46:00.930534 IP 10.12.100.44.55668 > 10.12.19.23.211: Flags [.], ack 3264816852, win 1024, length 0
11:46:00.932586 IP 10.12.100.44.55668 > 10.12.19.23.3030: Flags [.], ack 3264816852, win 1024, length 0
11:46:00.935082 IP 10.12.100.44.55668 > 10.12.19.23.212: Flags [.], ack 3264816852, win 1024, length 0
11:46:00.937457 IP 10.12.100.44.55669 > 10.12.19.23.1097: Flags [.], ack 3264751317, win 1024, length 0
11:46:00.937465 IP 10.12.100.44.55668 > 10.12.19.23.4900: Flags [.], ack 3264816852, win 1024, length 0
11:46:00.975340 IP 10.12.100.44.55669 > 10.12.19.23.2190: Flags [.], ack 3264751317, win 1024, length 0
11:46:00.981039 IP 10.12.100.44.55669 > 10.12.19.23.211: Flags [.], ack 3264751317, win 1024, length 0
11:46:00.981047 IP 10.12.100.44.55669 > 10.12.19.23.5960: Flags [.], ack 3264751317, win 1024, length 0
11:46:00.981049 IP 10.12.100.44.55669 > 10.12.19.23.1641: Flags [.], ack 3264751317, win 1024, length 0
11:46:00.981090 IP 10.12.100.44.55669 > 10.12.19.23.5033: Flags [.], ack 3264751317, win 1024, length 0
11:46:00.983466 IP 10.12.100.44.55669 > 10.12.19.23.3030: Flags [.], ack 3264751317, win 1024, length 0
11:46:00.985843 IP 10.12.100.44.55669 > 10.12.19.23.212: Flags [.], ack 3264751317, win 1024, length 0
11:46:00.988170 IP 10.12.100.44.55669 > 10.12.19.23.4900: Flags [.], ack 3264751317, win 1024, length 0
11:46:00.988177 IP 10.12.100.44.55670 > 10.12.19.23.1097: Flags [.], ack 3264947926, win 1024, length 0
11:46:01.025723 IP 10.12.100.44.55672 > 10.12.19.23.443: Flags [.], ack 3231261908, win 1024, length 0
11:46:01.031917 IP 10.12.100.44.55670 > 10.12.19.23.5033: Flags [.], ack 3264947926, win 1024, length 0
11:46:01.031940 IP 10.12.100.44.55670 > 10.12.19.23.1641: Flags [.], ack 3264947926, win 1024, length 0
11:46:01.031942 IP 10.12.100.44.55670 > 10.12.19.23.5960: Flags [.], ack 3264947926, win 1024, length 0
11:46:01.031944 IP 10.12.100.44.55670 > 10.12.19.23.211: Flags [.], ack 3264947926, win 1024, length 0
11:46:01.034425 IP 10.12.100.44.55670 > 10.12.19.23.3030: Flags [.], ack 3264947926, win 1024, length 0
11:46:01.036726 IP 10.12.100.44.55670 > 10.12.19.23.212: Flags [.], ack 3264947926, win 1024, length 0
11:46:01.039037 IP 10.12.100.44.55670 > 10.12.19.23.4900: Flags [.], ack 3264947926, win 1024, length 0
11:46:01.039044 IP 10.12.100.44.55670 > 10.12.19.23.2190: Flags [.], ack 3264947926, win 1024, length 0
11:46:01.078057 IP 10.12.100.44.55668 > 10.12.19.23.1183: Flags [.], ack 3264816852, win 1024, length 0
11:46:01.078079 IP 10.12.100.44.55668 > 10.12.19.23.1583: Flags [.], ack 3264816852, win 1024, length 0
11:46:01.078082 IP 10.12.100.44.55668 > 10.12.19.23.2383: Flags [.], ack 3264816852, win 1024, length 0
11:46:01.078083 IP 10.12.100.44.55668 > 10.12.19.23.10012: Flags [.], ack 3264816852, win 1024, length 0
11:46:01.078085 IP 10.12.100.44.55668 > 10.12.19.23.311: Flags [.], ack 3264816852, win 1024, length 0
11:46:01.078086 IP 10.12.100.44.55668 > 10.12.19.23.1236: Flags [.], ack 3264816852, win 1024, length 0
11:46:01.078154 IP 10.12.100.44.55668 > 10.12.19.23.6547: Flags [.], ack 3264816852, win 1024, length 0
11:46:01.078157 IP 10.12.100.44.55668 > 10.12.19.23.5850: Flags [.], ack 3264816852, win 1024, length 0
11:46:01.078159 IP 10.12.100.44.55668 > 10.12.19.23.1112: Flags [.], ack 3264816852, win 1024, length 0
11:46:01.078160 IP 10.12.100.44.55668 > 10.12.19.23.8994: Flags [.], ack 3264816852, win 1024, length 0
11:46:01.078206 IP 10.12.100.44.55668 > 10.12.19.23.3369: Flags [.], ack 3264816852, win 1024, length 0
11:46:01.078209 IP 10.12.100.44.55668 > 10.12.19.23.366: Flags [.], ack 3264816852, win 1024, length 0
11:46:01.078211 IP 10.12.100.44.55668 > 10.12.19.23.9944: Flags [.], ack 3264816852, win 1024, length 0
11:46:01.078212 IP 10.12.100.44.55668 > 10.12.19.23.981: Flags [.], ack 3264816852, win 1024, length 0
11:46:01.078274 IP 10.12.100.44.55668 > 10.12.19.23.10629: Flags [.], ack 3264816852, win 1024, length 0
11:46:01.078277 IP 10.12.100.44.55668 > 10.12.19.23.5000: Flags [.], ack 3264816852, win 1024, length 0
11:46:01.078279 IP 10.12.100.44.55668 > 10.12.19.23.3493: Flags [.], ack 3264816852, win 1024, length 0
11:46:01.078331 IP 10.12.100.44.55668 > 10.12.19.23.1217: Flags [.], ack 3264816852, win 1024, length 0
11:46:01.078334 IP 10.12.100.44.55668 > 10.12.19.23.6692: Flags [.], ack 3264816852, win 1024, length 0
11:46:01.078335 IP 10.12.100.44.55668 > 10.12.19.23.801: Flags [.], ack 3264816852, win 1024, length 0
11:46:01.078374 IP 10.12.100.44.55668 > 10.12.19.23.5101: Flags [.], ack 3264816852, win 1024, length 0
11:46:01.078417 IP 10.12.100.44.55668 > 10.12.19.23.1998: Flags [.], ack 3264816852, win 1024, length 0
11:46:01.078420 IP 10.12.100.44.55668 > 10.12.19.23.2001: Flags [.], ack 3264816852, win 1024, length 0
11:46:01.078422 IP 10.12.100.44.55668 > 10.12.19.23.1556: Flags [.], ack 3264816852, win 1024, length 0
11:46:01.078423 IP 10.12.100.44.55668 > 10.12.19.23.5555: Flags [.], ack 3264816852, win 1024, length 0
11:46:01.078482 IP 10.12.100.44.55668 > 10.12.19.23.5859: Flags [.], ack 3264816852, win 1024, length 0
11:46:01.078485 IP 10.12.100.44.55668 > 10.12.19.23.32785: Flags [.], ack 3264816852, win 1024, length 0
11:46:01.078487 IP 10.12.100.44.55668 > 10.12.19.23.691: Flags [.], ack 3264816852, win 1024, length 0
11:46:01.078489 IP 10.12.100.44.55668 > 10.12.19.23.1058: Flags [.], ack 3264816852, win 1024, length 0
11:46:01.078601 IP 10.12.100.44.55668 > 10.12.19.23.1166: Flags [.], ack 3264816852, win 1024, length 0
11:46:01.078606 IP 10.12.100.44.55668 > 10.12.19.23.1107: Flags [.], ack 3264816852, win 1024, length 0
11:46:01.078608 IP 10.12.100.44.55668 > 10.12.19.23.5961: Flags [.], ack 3264816852, win 1024, length 0
11:46:01.078609 IP 10.12.100.44.55668 > 10.12.19.23.2500: Flags [.], ack 3264816852, win 1024, length 0
11:46:01.078687 IP 10.12.100.44.55668 > 10.12.19.23.843: Flags [.], ack 3264816852, win 1024, length 0
11:46:01.082582 IP 10.12.100.44.55668 > 10.12.19.23.1063: Flags [.], ack 3264816852, win 1024, length 0
11:46:01.082604 IP 10.12.100.44.55668 > 10.12.19.23.2042: Flags [.], ack 3264816852, win 1024, length 0
11:46:01.082606 IP 10.12.100.44.55668 > 10.12.19.23.50800: Flags [.], ack 3264816852, win 1024, length 0
11:46:01.082608 IP 10.12.100.44.55668 > 10.12.19.23.5987: Flags [.], ack 3264816852, win 1024, length 0
11:46:01.085104 IP 10.12.100.44.55668 > 10.12.19.23.65389: Flags [.], ack 3264816852, win 1024, length 0
11:46:01.087601 IP 10.12.100.44.55668 > 10.12.19.23.55056: Flags [.], ack 3264816852, win 1024, length 0
11:46:01.089982 IP 10.12.100.44.55668 > 10.12.19.23.8400: Flags [.], ack 3264816852, win 1024, length 0
11:46:01.089990 IP 10.12.100.44.55668 > 10.12.19.23.2401: Flags [.], ack 3264816852, win 1024, length 0
11:46:01.128296 IP 10.12.100.44.55669 > 10.12.19.23.8994: Flags [.], ack 3264751317, win 1024, length 0
11:46:01.128332 IP 10.12.100.44.55669 > 10.12.19.23.1112: Flags [.], ack 3264751317, win 1024, length 0
11:46:01.128334 IP 10.12.100.44.55669 > 10.12.19.23.5850: Flags [.], ack 3264751317, win 1024, length 0
11:46:01.128336 IP 10.12.100.44.55669 > 10.12.19.23.6547: Flags [.], ack 3264751317, win 1024, length 0
11:46:01.128337 IP 10.12.100.44.55669 > 10.12.19.23.1236: Flags [.], ack 3264751317, win 1024, length 0
11:46:01.128353 IP 10.12.100.44.55669 > 10.12.19.23.311: Flags [.], ack 3264751317, win 1024, length 0
