16:21:46.185930 ARP, Request who-has 10.12.19.23 (ff:ff:ff:ff:ff:ff) tell 10.12.100.171, length 46
16:21:46.185980 ARP, Reply 10.12.19.23 is-at 08:00:27:d1:82:df, length 28
16:21:46.386778 IP 10.12.100.171.43770 > 10.12.19.23.8888: Flags [.], ack 4201513115, win 1024, length 0
16:21:46.386832 IP 10.12.100.171.43770 > 10.12.19.23.445: Flags [.], ack 4201513115, win 1024, length 0
16:21:46.386834 IP 10.12.100.171.43770 > 10.12.19.23.5900: Flags [.], ack 4201513115, win 1024, length 0
16:21:46.386835 IP 10.12.100.171.43770 > 10.12.19.23.1720: Flags [.], ack 4201513115, win 1024, length 0
16:21:46.386837 IP 10.12.100.171.43770 > 10.12.19.23.111: Flags [.], ack 4201513115, win 1024, length 0
16:21:46.386838 IP 10.12.100.171.43770 > 10.12.19.23.110: Flags [.], ack 4201513115, win 1024, length 0
16:21:46.386840 IP 10.12.100.171.43770 > 10.12.19.23.21: Flags [.], ack 4201513115, win 1024, length 0
16:21:46.386841 IP 10.12.100.171.43770 > 10.12.19.23.25: Flags [.], ack 4201513115, win 1024, length 0
16:21:46.386893 IP 10.12.100.171.43770 > 10.12.19.23.3306: Flags [.], ack 4201513115, win 1024, length 0
16:21:46.386897 IP 10.12.100.171.43770 > 10.12.19.23.1025: Flags [.], ack 4201513115, win 1024, length 0
16:21:47.438848 IP 10.12.100.171.43771 > 10.12.19.23.1025: Flags [.], ack 4201578650, win 1024, length 0
16:21:47.438871 IP 10.12.100.171.43771 > 10.12.19.23.3306: Flags [.], ack 4201578650, win 1024, length 0
16:21:47.438873 IP 10.12.100.171.43771 > 10.12.19.23.25: Flags [.], ack 4201578650, win 1024, length 0
16:21:47.438874 IP 10.12.100.171.43771 > 10.12.19.23.21: Flags [.], ack 4201578650, win 1024, length 0
16:21:47.438876 IP 10.12.100.171.43771 > 10.12.19.23.110: Flags [.], ack 4201578650, win 1024, length 0
16:21:47.438877 IP 10.12.100.171.43771 > 10.12.19.23.111: Flags [.], ack 4201578650, win 1024, length 0
16:21:47.438981 IP 10.12.100.171.43771 > 10.12.19.23.1720: Flags [.], ack 4201578650, win 1024, length 0
16:21:47.438984 IP 10.12.100.171.43771 > 10.12.19.23.5900: Flags [.], ack 4201578650, win 1024, length 0
16:21:47.438986 IP 10.12.100.171.43771 > 10.12.19.23.445: Flags [.], ack 4201578650, win 1024, length 0
16:21:47.439057 IP 10.12.100.171.43771 > 10.12.19.23.8888: Flags [.], ack 4201578650, win 1024, length 0
16:21:47.490065 IP 10.12.100.171.43770 > 10.12.19.23.443: Flags [.], ack 4201513115, win 1024, length 0
16:21:47.490097 IP 10.12.19.23.443 > 10.12.100.171.43770: Flags [R], seq 4201513115, win 0, length 0
16:21:47.490111 IP 10.12.100.171.43770 > 10.12.19.23.8080: Flags [.], ack 4201513115, win 1024, length 0
16:21:47.490115 IP 10.12.100.171.43770 > 10.12.19.23.53: Flags [.], ack 4201513115, win 1024, length 0
16:21:47.490116 IP 10.12.100.171.43770 > 10.12.19.23.135: Flags [.], ack 4201513115, win 1024, length 0
16:21:47.490118 IP 10.12.100.171.43770 > 10.12.19.23.80: Flags [.], ack 4201513115, win 1024, length 0
16:21:47.490139 IP 10.12.19.23.80 > 10.12.100.171.43770: Flags [R], seq 4201513115, win 0, length 0
16:21:47.490148 IP 10.12.100.171.43770 > 10.12.19.23.587: Flags [.], ack 4201513115, win 1024, length 0
16:21:47.490150 IP 10.12.100.171.43770 > 10.12.19.23.995: Flags [.], ack 4201513115, win 1024, length 0
16:21:47.490152 IP 10.12.100.171.43770 > 10.12.19.23.23: Flags [.], ack 4201513115, win 1024, length 0
16:21:47.490154 IP 10.12.100.171.43770 > 10.12.19.23.554: Flags [.], ack 4201513115, win 1024, length 0
16:21:47.490277 IP 10.12.100.171.43770 > 10.12.19.23.256: Flags [.], ack 4201513115, win 1024, length 0
16:21:47.540262 IP 10.12.100.171.43771 > 10.12.19.23.23: Flags [.], ack 4201578650, win 1024, length 0
16:21:47.540270 IP 10.12.100.171.43771 > 10.12.19.23.995: Flags [.], ack 4201578650, win 1024, length 0
16:21:47.540272 IP 10.12.100.171.43771 > 10.12.19.23.587: Flags [.], ack 4201578650, win 1024, length 0
16:21:47.540273 IP 10.12.100.171.43771 > 10.12.19.23.80: Flags [.], ack 4201578650, win 1024, length 0
16:21:47.540282 IP 10.12.19.23.80 > 10.12.100.171.43771: Flags [R], seq 4201578650, win 0, length 0
16:21:47.540292 IP 10.12.100.171.43771 > 10.12.19.23.135: Flags [.], ack 4201578650, win 1024, length 0
16:21:47.540382 IP 10.12.100.171.43771 > 10.12.19.23.53: Flags [.], ack 4201578650, win 1024, length 0
16:21:47.540385 IP 10.12.100.171.43771 > 10.12.19.23.8080: Flags [.], ack 4201578650, win 1024, length 0
16:21:47.540426 IP 10.12.100.171.43771 > 10.12.19.23.443: Flags [.], ack 4201578650, win 1024, length 0
16:21:47.540447 IP 10.12.19.23.443 > 10.12.100.171.43771: Flags [R], seq 4201578650, win 0, length 0
16:21:47.542806 IP 10.12.100.171.43771 > 10.12.19.23.256: Flags [.], ack 4201578650, win 1024, length 0
16:21:47.542814 IP 10.12.100.171.43771 > 10.12.19.23.554: Flags [.], ack 4201578650, win 1024, length 0
16:21:48.594777 IP 10.12.100.171.43772 > 10.12.19.23.554: Flags [.], ack 4201382041, win 1024, length 0
16:21:48.594800 IP 10.12.100.171.43772 > 10.12.19.23.256: Flags [.], ack 4201382041, win 1024, length 0
16:21:48.594802 IP 10.12.100.171.43772 > 10.12.19.23.8080: Flags [.], ack 4201382041, win 1024, length 0
16:21:48.594803 IP 10.12.100.171.43772 > 10.12.19.23.53: Flags [.], ack 4201382041, win 1024, length 0
16:21:48.594805 IP 10.12.100.171.43772 > 10.12.19.23.135: Flags [.], ack 4201382041, win 1024, length 0
16:21:48.594806 IP 10.12.100.171.43772 > 10.12.19.23.587: Flags [.], ack 4201382041, win 1024, length 0
16:21:48.594808 IP 10.12.100.171.43772 > 10.12.19.23.995: Flags [.], ack 4201382041, win 1024, length 0
16:21:48.594871 IP 10.12.100.171.43772 > 10.12.19.23.23: Flags [.], ack 4201382041, win 1024, length 0
16:21:48.594875 IP 10.12.100.171.43772 > 10.12.19.23.8888: Flags [.], ack 4201382041, win 1024, length 0
16:21:48.594876 IP 10.12.100.171.43772 > 10.12.19.23.445: Flags [.], ack 4201382041, win 1024, length 0
16:21:48.644953 IP 10.12.100.171.43772 > 10.12.19.23.5900: Flags [.], ack 4201382041, win 1024, length 0
16:21:48.644962 IP 10.12.100.171.43772 > 10.12.19.23.1720: Flags [.], ack 4201382041, win 1024, length 0
16:21:48.645001 IP 10.12.100.171.43772 > 10.12.19.23.111: Flags [.], ack 4201382041, win 1024, length 0
16:21:48.645004 IP 10.12.100.171.43772 > 10.12.19.23.110: Flags [.], ack 4201382041, win 1024, length 0
16:21:48.645006 IP 10.12.100.171.43772 > 10.12.19.23.21: Flags [.], ack 4201382041, win 1024, length 0
16:21:48.645007 IP 10.12.100.171.43772 > 10.12.19.23.25: Flags [.], ack 4201382041, win 1024, length 0
16:21:48.645091 IP 10.12.100.171.43772 > 10.12.19.23.3306: Flags [.], ack 4201382041, win 1024, length 0
16:21:48.647607 IP 10.12.100.171.43772 > 10.12.19.23.1025: Flags [.], ack 4201382041, win 1024, length 0
16:21:48.647629 IP 10.12.100.171.43770 > 10.12.19.23.143: Flags [.], ack 4201513115, win 1024, length 0
16:21:48.647688 IP 10.12.100.171.43770 > 10.12.19.23.22: Flags [.], ack 4201513115, win 1024, length 0
16:21:48.695448 IP 10.12.100.171.43770 > 10.12.19.23.113: Flags [.], ack 4201513115, win 1024, length 0
16:21:48.695497 IP 10.12.100.171.43770 > 10.12.19.23.139: Flags [.], ack 4201513115, win 1024, length 0
16:21:48.695499 IP 10.12.100.171.43770 > 10.12.19.23.199: Flags [.], ack 4201513115, win 1024, length 0
16:21:48.695501 IP 10.12.100.171.43770 > 10.12.19.23.3389: Flags [.], ack 4201513115, win 1024, length 0
16:21:48.695502 IP 10.12.100.171.43770 > 10.12.19.23.1723: Flags [.], ack 4201513115, win 1024, length 0
16:21:48.695504 IP 10.12.100.171.43770 > 10.12.19.23.993: Flags [.], ack 4201513115, win 1024, length 0
16:21:48.695506 IP 10.12.100.171.43770 > 10.12.19.23.8222: Flags [.], ack 4201513115, win 1024, length 0
16:21:48.697799 IP 10.12.100.171.43771 > 10.12.19.23.22: Flags [.], ack 4201578650, win 1024, length 0
16:21:48.697807 IP 10.12.100.171.43771 > 10.12.19.23.143: Flags [.], ack 4201578650, win 1024, length 0
16:21:48.697809 IP 10.12.100.171.43770 > 10.12.19.23.5003: Flags [.], ack 4201513115, win 1024, length 0
16:21:48.745484 IP 10.12.100.171.43771 > 10.12.19.23.113: Flags [.], ack 4201578650, win 1024, length 0
16:21:48.747677 IP 10.12.100.171.43771 > 10.12.19.23.8222: Flags [.], ack 4201578650, win 1024, length 0
16:21:48.747697 IP 10.12.100.171.43771 > 10.12.19.23.993: Flags [.], ack 4201578650, win 1024, length 0
16:21:48.747699 IP 10.12.100.171.43771 > 10.12.19.23.1723: Flags [.], ack 4201578650, win 1024, length 0
16:21:48.747701 IP 10.12.100.171.43771 > 10.12.19.23.3389: Flags [.], ack 4201578650, win 1024, length 0
16:21:48.747754 IP 10.12.100.171.43771 > 10.12.19.23.199: Flags [.], ack 4201578650, win 1024, length 0
16:21:48.747758 IP 10.12.100.171.43771 > 10.12.19.23.139: Flags [.], ack 4201578650, win 1024, length 0
16:21:48.749923 IP 10.12.100.171.43771 > 10.12.19.23.5003: Flags [.], ack 4201578650, win 1024, length 0
16:21:48.749935 IP 10.12.100.171.43772 > 10.12.19.23.143: Flags [.], ack 4201382041, win 1024, length 0
16:21:48.749937 IP 10.12.100.171.43772 > 10.12.19.23.22: Flags [.], ack 4201382041, win 1024, length 0
16:21:48.795649 IP 10.12.100.171.43773 > 10.12.19.23.443: Flags [.], ack 4218290587, win 1024, length 0
16:21:48.795685 IP 10.12.19.23.443 > 10.12.100.171.43773: Flags [R], seq 4218290587, win 0, length 0
16:21:48.797880 IP 10.12.100.171.43772 > 10.12.19.23.139: Flags [.], ack 4201382041, win 1024, length 0
16:21:48.797893 IP 10.12.100.171.43772 > 10.12.19.23.199: Flags [.], ack 4201382041, win 1024, length 0
16:21:48.797894 IP 10.12.100.171.43772 > 10.12.19.23.3389: Flags [.], ack 4201382041, win 1024, length 0
16:21:48.797953 IP 10.12.100.171.43772 > 10.12.19.23.1723: Flags [.], ack 4201382041, win 1024, length 0
16:21:48.797957 IP 10.12.100.171.43772 > 10.12.19.23.993: Flags [.], ack 4201382041, win 1024, length 0
16:21:48.797999 IP 10.12.100.171.43772 > 10.12.19.23.8222: Flags [.], ack 4201382041, win 1024, length 0
16:21:48.800160 IP 10.12.100.171.43772 > 10.12.19.23.5003: Flags [.], ack 4201382041, win 1024, length 0
16:21:48.800173 IP 10.12.100.171.43772 > 10.12.19.23.113: Flags [.], ack 4201382041, win 1024, length 0
16:21:48.800175 IP 10.12.100.171.43770 > 10.12.19.23.280: Flags [.], ack 4201513115, win 1024, length 0
16:21:48.850638 IP 10.12.100.171.43771 > 10.12.19.23.280: Flags [.], ack 4201578650, win 1024, length 0
16:21:48.900850 IP 10.12.100.171.43772 > 10.12.19.23.280: Flags [.], ack 4201382041, win 1024, length 0
16:21:48.951304 IP 10.12.100.171.43770 > 10.12.19.23.32778: Flags [.], ack 4201513115, win 1024, length 0
16:21:49.003976 IP 10.12.100.171.43771 > 10.12.19.23.32778: Flags [.], ack 4201578650, win 1024, length 0
16:21:49.003998 IP 10.12.100.171.43770 > 10.12.19.23.9102: Flags [.], ack 4201513115, win 1024, length 0
16:21:49.004000 IP 10.12.100.171.43770 > 10.12.19.23.1455: Flags [.], ack 4201513115, win 1024, length 0
16:21:49.004002 IP 10.12.100.171.43770 > 10.12.19.23.50003: Flags [.], ack 4201513115, win 1024, length 0
16:21:49.004003 IP 10.12.100.171.43770 > 10.12.19.23.38292: Flags [.], ack 4201513115, win 1024, length 0
16:21:49.004004 IP 10.12.100.171.43770 > 10.12.19.23.1126: Flags [.], ack 4201513115, win 1024, length 0
16:21:49.004059 IP 10.12.100.171.43770 > 10.12.19.23.6667: Flags [.], ack 4201513115, win 1024, length 0
16:21:49.054808 IP 10.12.100.171.43771 > 10.12.19.23.6667: Flags [.], ack 4201578650, win 1024, length 0
16:21:49.054821 IP 10.12.100.171.43771 > 10.12.19.23.1126: Flags [.], ack 4201578650, win 1024, length 0
16:21:49.054823 IP 10.12.100.171.43771 > 10.12.19.23.38292: Flags [.], ack 4201578650, win 1024, length 0
16:21:49.054824 IP 10.12.100.171.43771 > 10.12.19.23.50003: Flags [.], ack 4201578650, win 1024, length 0
16:21:49.054879 IP 10.12.100.171.43771 > 10.12.19.23.1455: Flags [.], ack 4201578650, win 1024, length 0
16:21:49.054883 IP 10.12.100.171.43771 > 10.12.19.23.9102: Flags [.], ack 4201578650, win 1024, length 0
16:21:49.054884 IP 10.12.100.171.43772 > 10.12.19.23.32778: Flags [.], ack 4201382041, win 1024, length 0
16:21:49.105227 IP 10.12.100.171.43772 > 10.12.19.23.9102: Flags [.], ack 4201382041, win 1024, length 0
16:21:49.105250 IP 10.12.100.171.43772 > 10.12.19.23.1455: Flags [.], ack 4201382041, win 1024, length 0
16:21:49.105251 IP 10.12.100.171.43772 > 10.12.19.23.50003: Flags [.], ack 4201382041, win 1024, length 0
16:21:49.105253 IP 10.12.100.171.43772 > 10.12.19.23.38292: Flags [.], ack 4201382041, win 1024, length 0
16:21:49.105305 IP 10.12.100.171.43772 > 10.12.19.23.1126: Flags [.], ack 4201382041, win 1024, length 0
16:21:49.105309 IP 10.12.100.171.43772 > 10.12.19.23.6667: Flags [.], ack 4201382041, win 1024, length 0
16:21:49.105310 IP 10.12.100.171.43770 > 10.12.19.23.6668: Flags [.], ack 4201513115, win 1024, length 0
16:21:49.155822 IP 10.12.100.171.43771 > 10.12.19.23.6668: Flags [.], ack 4201578650, win 1024, length 0
16:21:49.155841 IP 10.12.100.171.43770 > 10.12.19.23.32773: Flags [.], ack 4201513115, win 1024, length 0
16:21:49.155843 IP 10.12.100.171.43770 > 10.12.19.23.20005: Flags [.], ack 4201513115, win 1024, length 0
16:21:49.155844 IP 10.12.100.171.43770 > 10.12.19.23.1201: Flags [.], ack 4201513115, win 1024, length 0
16:21:49.155890 IP 10.12.100.171.43770 > 10.12.19.23.19283: Flags [.], ack 4201513115, win 1024, length 0
16:21:49.155894 IP 10.12.100.171.43770 > 10.12.19.23.808: Flags [.], ack 4201513115, win 1024, length 0
16:21:49.155895 IP 10.12.100.171.43770 > 10.12.19.23.14000: Flags [.], ack 4201513115, win 1024, length 0
16:21:49.206130 IP 10.12.100.171.43771 > 10.12.19.23.14000: Flags [.], ack 4201578650, win 1024, length 0
16:21:49.206179 IP 10.12.100.171.43771 > 10.12.19.23.808: Flags [.], ack 4201578650, win 1024, length 0
16:21:49.206182 IP 10.12.100.171.43771 > 10.12.19.23.19283: Flags [.], ack 4201578650, win 1024, length 0
16:21:49.206183 IP 10.12.100.171.43771 > 10.12.19.23.1201: Flags [.], ack 4201578650, win 1024, length 0
16:21:49.206185 IP 10.12.100.171.43771 > 10.12.19.23.20005: Flags [.], ack 4201578650, win 1024, length 0
16:21:49.206186 IP 10.12.100.171.43771 > 10.12.19.23.32773: Flags [.], ack 4201578650, win 1024, length 0
16:21:49.206297 IP 10.12.100.171.43772 > 10.12.19.23.6668: Flags [.], ack 4201382041, win 1024, length 0
16:21:49.257164 IP 10.12.100.171.43772 > 10.12.19.23.32773: Flags [.], ack 4201382041, win 1024, length 0
16:21:49.257175 IP 10.12.100.171.43772 > 10.12.19.23.20005: Flags [.], ack 4201382041, win 1024, length 0
16:21:49.257177 IP 10.12.100.171.43772 > 10.12.19.23.1201: Flags [.], ack 4201382041, win 1024, length 0
16:21:49.257178 IP 10.12.100.171.43772 > 10.12.19.23.19283: Flags [.], ack 4201382041, win 1024, length 0
16:21:49.257263 IP 10.12.100.171.43772 > 10.12.19.23.808: Flags [.], ack 4201382041, win 1024, length 0
16:21:49.257267 IP 10.12.100.171.43772 > 10.12.19.23.14000: Flags [.], ack 4201382041, win 1024, length 0
16:21:49.257283 IP 10.12.100.171.43770 > 10.12.19.23.3851: Flags [.], ack 4201513115, win 1024, length 0
16:21:49.308022 IP 10.12.100.171.43771 > 10.12.19.23.3851: Flags [.], ack 4201578650, win 1024, length 0
16:21:49.308046 IP 10.12.100.171.43770 > 10.12.19.23.1088: Flags [.], ack 4201513115, win 1024, length 0
16:21:49.308048 IP 10.12.100.171.43770 > 10.12.19.23.6901: Flags [.], ack 4201513115, win 1024, length 0
16:21:49.308050 IP 10.12.100.171.43770 > 10.12.19.23.5718: Flags [.], ack 4201513115, win 1024, length 0
16:21:49.308051 IP 10.12.100.171.43770 > 10.12.19.23.1583: Flags [.], ack 4201513115, win 1024, length 0
16:21:49.308053 IP 10.12.100.171.43770 > 10.12.19.23.1049: Flags [.], ack 4201513115, win 1024, length 0
16:21:49.308100 IP 10.12.100.171.43770 > 10.12.19.23.9535: Flags [.], ack 4201513115, win 1024, length 0
16:21:49.359187 IP 10.12.100.171.43771 > 10.12.19.23.9535: Flags [.], ack 4201578650, win 1024, length 0
16:21:49.359199 IP 10.12.100.171.43771 > 10.12.19.23.1049: Flags [.], ack 4201578650, win 1024, length 0
16:21:49.359201 IP 10.12.100.171.43771 > 10.12.19.23.1583: Flags [.], ack 4201578650, win 1024, length 0
16:21:49.359202 IP 10.12.100.171.43771 > 10.12.19.23.5718: Flags [.], ack 4201578650, win 1024, length 0
16:21:49.359203 IP 10.12.100.171.43771 > 10.12.19.23.6901: Flags [.], ack 4201578650, win 1024, length 0
16:21:49.359262 IP 10.12.100.171.43771 > 10.12.19.23.1088: Flags [.], ack 4201578650, win 1024, length 0
16:21:49.359266 IP 10.12.100.171.43772 > 10.12.19.23.3851: Flags [.], ack 4201382041, win 1024, length 0
16:21:49.409453 IP 10.12.100.171.43772 > 10.12.19.23.1088: Flags [.], ack 4201382041, win 1024, length 0
16:21:49.409480 IP 10.12.100.171.43772 > 10.12.19.23.6901: Flags [.], ack 4201382041, win 1024, length 0
16:21:49.409562 IP 10.12.100.171.43772 > 10.12.19.23.5718: Flags [.], ack 4201382041, win 1024, length 0
16:21:49.409571 IP 10.12.100.171.43772 > 10.12.19.23.1583: Flags [.], ack 4201382041, win 1024, length 0
16:21:49.409586 IP 10.12.100.171.43772 > 10.12.19.23.1049: Flags [.], ack 4201382041, win 1024, length 0
16:21:49.409588 IP 10.12.100.171.43772 > 10.12.19.23.9535: Flags [.], ack 4201382041, win 1024, length 0
16:21:49.409589 IP 10.12.100.171.43770 > 10.12.19.23.12174: Flags [.], ack 4201513115, win 1024, length 0
16:21:49.460617 IP 10.12.100.171.43771 > 10.12.19.23.12174: Flags [.], ack 4201578650, win 1024, length 0
16:21:49.460639 IP 10.12.100.171.43770 > 10.12.19.23.1026: Flags [.], ack 4201513115, win 1024, length 0
16:21:49.460641 IP 10.12.100.171.43770 > 10.12.19.23.144: Flags [.], ack 4201513115, win 1024, length 0
16:21:49.460642 IP 10.12.100.171.43770 > 10.12.19.23.1000: Flags [.], ack 4201513115, win 1024, length 0
16:21:49.460644 IP 10.12.100.171.43770 > 10.12.19.23.20000: Flags [.], ack 4201513115, win 1024, length 0
16:21:49.460699 IP 10.12.100.171.43770 > 10.12.19.23.161: Flags [.], ack 4201513115, win 1024, length 0
16:21:49.460703 IP 10.12.100.171.43770 > 10.12.19.23.2605: Flags [.], ack 4201513115, win 1024, length 0
16:21:49.510915 IP 10.12.100.171.43771 > 10.12.19.23.2605: Flags [.], ack 4201578650, win 1024, length 0
16:21:49.510938 IP 10.12.100.171.43771 > 10.12.19.23.161: Flags [.], ack 4201578650, win 1024, length 0
16:21:49.510940 IP 10.12.100.171.43771 > 10.12.19.23.20000: Flags [.], ack 4201578650, win 1024, length 0
16:21:49.510942 IP 10.12.100.171.43771 > 10.12.19.23.1000: Flags [.], ack 4201578650, win 1024, length 0
16:21:49.510992 IP 10.12.100.171.43771 > 10.12.19.23.144: Flags [.], ack 4201578650, win 1024, length 0
16:21:49.510996 IP 10.12.100.171.43771 > 10.12.19.23.1026: Flags [.], ack 4201578650, win 1024, length 0
16:21:49.510998 IP 10.12.100.171.43772 > 10.12.19.23.12174: Flags [.], ack 4201382041, win 1024, length 0
16:21:49.561099 IP 10.12.100.171.43772 > 10.12.19.23.1026: Flags [.], ack 4201382041, win 1024, length 0
16:21:49.561116 IP 10.12.100.171.43772 > 10.12.19.23.144: Flags [.], ack 4201382041, win 1024, length 0
16:21:49.561117 IP 10.12.100.171.43772 > 10.12.19.23.1000: Flags [.], ack 4201382041, win 1024, length 0
16:21:49.561119 IP 10.12.100.171.43772 > 10.12.19.23.20000: Flags [.], ack 4201382041, win 1024, length 0
16:21:49.561120 IP 10.12.100.171.43772 > 10.12.19.23.161: Flags [.], ack 4201382041, win 1024, length 0
16:21:49.561174 IP 10.12.100.171.43772 > 10.12.19.23.2605: Flags [.], ack 4201382041, win 1024, length 0
16:21:49.561178 IP 10.12.100.171.43770 > 10.12.19.23.50006: Flags [.], ack 4201513115, win 1024, length 0
16:21:49.611384 IP 10.12.100.171.43771 > 10.12.19.23.50006: Flags [.], ack 4201578650, win 1024, length 0
16:21:49.611406 IP 10.12.100.171.43770 > 10.12.19.23.5222: Flags [.], ack 4201513115, win 1024, length 0
16:21:49.611407 IP 10.12.100.171.43770 > 10.12.19.23.52869: Flags [.], ack 4201513115, win 1024, length 0
16:21:49.611409 IP 10.12.100.171.43770 > 10.12.19.23.1035: Flags [.], ack 4201513115, win 1024, length 0
16:21:49.611410 IP 10.12.100.171.43770 > 10.12.19.23.27000: Flags [.], ack 4201513115, win 1024, length 0
16:21:49.611412 IP 10.12.100.171.43770 > 10.12.19.23.8000: Flags [.], ack 4201513115, win 1024, length 0
16:21:49.611443 IP 10.12.100.171.43770 > 10.12.19.23.6002: Flags [.], ack 4201513115, win 1024, length 0
16:21:49.658217 IP 10.12.3.13.57621 > 10.12.255.255.57621: UDP, length 44
16:21:49.661429 IP 10.12.100.171.43771 > 10.12.19.23.1035: Flags [.], ack 4201578650, win 1024, length 0
16:21:49.661437 IP 10.12.100.171.43771 > 10.12.19.23.52869: Flags [.], ack 4201578650, win 1024, length 0
16:21:49.661439 IP 10.12.100.171.43771 > 10.12.19.23.5222: Flags [.], ack 4201578650, win 1024, length 0
16:21:49.661440 IP 10.12.100.171.43772 > 10.12.19.23.50006: Flags [.], ack 4201382041, win 1024, length 0
16:21:49.663842 IP 10.12.100.171.43771 > 10.12.19.23.6002: Flags [.], ack 4201578650, win 1024, length 0
16:21:49.663862 IP 10.12.100.171.43771 > 10.12.19.23.8000: Flags [.], ack 4201578650, win 1024, length 0
16:21:49.663864 IP 10.12.100.171.43771 > 10.12.19.23.27000: Flags [.], ack 4201578650, win 1024, length 0
16:21:49.711733 IP 10.12.100.171.43772 > 10.12.19.23.5222: Flags [.], ack 4201382041, win 1024, length 0
16:21:49.711758 IP 10.12.100.171.43772 > 10.12.19.23.52869: Flags [.], ack 4201382041, win 1024, length 0
16:21:49.711760 IP 10.12.100.171.43772 > 10.12.19.23.1035: Flags [.], ack 4201382041, win 1024, length 0
16:21:49.711761 IP 10.12.100.171.43770 > 10.12.19.23.2701: Flags [.], ack 4201513115, win 1024, length 0
16:21:49.714157 IP 10.12.100.171.43772 > 10.12.19.23.27000: Flags [.], ack 4201382041, win 1024, length 0
16:21:49.714164 IP 10.12.100.171.43772 > 10.12.19.23.8000: Flags [.], ack 4201382041, win 1024, length 0
16:21:49.714165 IP 10.12.100.171.43772 > 10.12.19.23.6002: Flags [.], ack 4201382041, win 1024, length 0
16:21:49.762318 IP 10.12.100.171.43771 > 10.12.19.23.2701: Flags [.], ack 4201578650, win 1024, length 0
16:21:49.762335 IP 10.12.100.171.43770 > 10.12.19.23.720: Flags [.], ack 4201513115, win 1024, length 0
16:21:49.762337 IP 10.12.100.171.43770 > 10.12.19.23.7741: Flags [.], ack 4201513115, win 1024, length 0
16:21:49.762339 IP 10.12.100.171.43770 > 10.12.19.23.8181: Flags [.], ack 4201513115, win 1024, length 0
16:21:49.764774 IP 10.12.100.171.43770 > 10.12.19.23.7002: Flags [.], ack 4201513115, win 1024, length 0
16:21:49.764781 IP 10.12.100.171.43770 > 10.12.19.23.2366: Flags [.], ack 4201513115, win 1024, length 0
16:21:49.764782 IP 10.12.100.171.43770 > 10.12.19.23.3030: Flags [.], ack 4201513115, win 1024, length 0
16:21:49.812609 IP 10.12.100.171.43771 > 10.12.19.23.8181: Flags [.], ack 4201578650, win 1024, length 0
16:21:49.812631 IP 10.12.100.171.43771 > 10.12.19.23.7741: Flags [.], ack 4201578650, win 1024, length 0
16:21:49.812633 IP 10.12.100.171.43771 > 10.12.19.23.720: Flags [.], ack 4201578650, win 1024, length 0
16:21:49.812635 IP 10.12.100.171.43772 > 10.12.19.23.2701: Flags [.], ack 4201382041, win 1024, length 0
16:21:49.815059 IP 10.12.100.171.43771 > 10.12.19.23.3030: Flags [.], ack 4201578650, win 1024, length 0
16:21:49.815067 IP 10.12.100.171.43771 > 10.12.19.23.2366: Flags [.], ack 4201578650, win 1024, length 0
16:21:49.815068 IP 10.12.100.171.43771 > 10.12.19.23.7002: Flags [.], ack 4201578650, win 1024, length 0
16:21:49.863148 IP 10.12.100.171.43772 > 10.12.19.23.720: Flags [.], ack 4201382041, win 1024, length 0
16:21:49.863157 IP 10.12.100.171.43772 > 10.12.19.23.7741: Flags [.], ack 4201382041, win 1024, length 0
16:21:49.863159 IP 10.12.100.171.43772 > 10.12.19.23.8181: Flags [.], ack 4201382041, win 1024, length 0
16:21:49.863215 IP 10.12.100.171.43770 > 10.12.19.23.179: Flags [.], ack 4201513115, win 1024, length 0
16:21:49.865561 IP 10.12.100.171.43772 > 10.12.19.23.7002: Flags [.], ack 4201382041, win 1024, length 0
16:21:49.865569 IP 10.12.100.171.43772 > 10.12.19.23.2366: Flags [.], ack 4201382041, win 1024, length 0
16:21:49.865570 IP 10.12.100.171.43772 > 10.12.19.23.3030: Flags [.], ack 4201382041, win 1024, length 0
16:21:49.913481 IP 10.12.100.171.43771 > 10.12.19.23.179: Flags [.], ack 4201578650, win 1024, length 0
16:21:49.913517 IP 10.12.100.171.43770 > 10.12.19.23.32772: Flags [.], ack 4201513115, win 1024, length 0
16:21:49.913520 IP 10.12.100.171.43770 > 10.12.19.23.425: Flags [.], ack 4201513115, win 1024, length 0
16:21:49.913521 IP 10.12.100.171.43770 > 10.12.19.23.2046: Flags [.], ack 4201513115, win 1024, length 0
16:21:49.915886 IP 10.12.100.171.43770 > 10.12.19.23.3703: Flags [.], ack 4201513115, win 1024, length 0
16:21:49.915893 IP 10.12.100.171.43770 > 10.12.19.23.5080: Flags [.], ack 4201513115, win 1024, length 0
16:21:49.915895 IP 10.12.100.171.43770 > 10.12.19.23.50389: Flags [.], ack 4201513115, win 1024, length 0
16:21:49.963644 IP 10.12.100.171.43771 > 10.12.19.23.2046: Flags [.], ack 4201578650, win 1024, length 0
16:21:49.963653 IP 10.12.100.171.43771 > 10.12.19.23.425: Flags [.], ack 4201578650, win 1024, length 0
16:21:49.963655 IP 10.12.100.171.43771 > 10.12.19.23.32772: Flags [.], ack 4201578650, win 1024, length 0
16:21:49.963657 IP 10.12.100.171.43772 > 10.12.19.23.179: Flags [.], ack 4201382041, win 1024, length 0
16:21:49.966290 IP 10.12.100.171.43771 > 10.12.19.23.50389: Flags [.], ack 4201578650, win 1024, length 0
16:21:49.966297 IP 10.12.100.171.43771 > 10.12.19.23.5080: Flags [.], ack 4201578650, win 1024, length 0
16:21:49.966355 IP 10.12.100.171.43771 > 10.12.19.23.3703: Flags [.], ack 4201578650, win 1024, length 0
16:21:50.013915 IP 10.12.100.171.43772 > 10.12.19.23.32772: Flags [.], ack 4201382041, win 1024, length 0
16:21:50.013937 IP 10.12.100.171.43772 > 10.12.19.23.425: Flags [.], ack 4201382041, win 1024, length 0
16:21:50.013939 IP 10.12.100.171.43772 > 10.12.19.23.2046: Flags [.], ack 4201382041, win 1024, length 0
16:21:50.013941 IP 10.12.100.171.43770 > 10.12.19.23.5825: Flags [.], ack 4201513115, win 1024, length 0
16:21:50.016808 IP 10.12.100.171.43772 > 10.12.19.23.3703: Flags [.], ack 4201382041, win 1024, length 0
16:21:50.016815 IP 10.12.100.171.43772 > 10.12.19.23.5080: Flags [.], ack 4201382041, win 1024, length 0
16:21:50.016817 IP 10.12.100.171.43772 > 10.12.19.23.50389: Flags [.], ack 4201382041, win 1024, length 0
16:21:50.064290 IP 10.12.100.171.43774 > 10.12.19.23.443: Flags [.], ack 4167959195, win 1024, length 0
16:21:50.064310 IP 10.12.19.23.443 > 10.12.100.171.43774: Flags [R], seq 4167959195, win 0, length 0
16:21:50.064322 IP 10.12.100.171.43771 > 10.12.19.23.5825: Flags [.], ack 4201578650, win 1024, length 0
16:21:50.064368 IP 10.12.100.171.43770 > 10.12.19.23.3000: Flags [.], ack 4201513115, win 1024, length 0
16:21:50.064370 IP 10.12.100.171.43770 > 10.12.19.23.2121: Flags [.], ack 4201513115, win 1024, length 0
16:21:50.067249 IP 10.12.100.171.43770 > 10.12.19.23.15003: Flags [.], ack 4201513115, win 1024, length 0
16:21:50.067256 IP 10.12.100.171.43770 > 10.12.19.23.3390: Flags [.], ack 4201513115, win 1024, length 0
16:21:50.067361 IP 10.12.100.171.43770 > 10.12.19.23.3260: Flags [.], ack 4201513115, win 1024, length 0
16:21:50.117918 IP 10.12.100.171.43771 > 10.12.19.23.3260: Flags [.], ack 4201578650, win 1024, length 0
16:21:50.168506 IP 10.12.100.171.43772 > 10.12.19.23.3260: Flags [.], ack 4201382041, win 1024, length 0
16:21:50.221276 IP 10.12.100.171.43771 > 10.12.19.23.3390: Flags [.], ack 4201578650, win 1024, length 0
16:21:50.221311 IP 10.12.100.171.43771 > 10.12.19.23.15003: Flags [.], ack 4201578650, win 1024, length 0
16:21:50.221313 IP 10.12.100.171.43771 > 10.12.19.23.2121: Flags [.], ack 4201578650, win 1024, length 0
16:21:50.221315 IP 10.12.100.171.43771 > 10.12.19.23.3000: Flags [.], ack 4201578650, win 1024, length 0
16:21:50.271389 IP 10.12.100.171.43772 > 10.12.19.23.3000: Flags [.], ack 4201382041, win 1024, length 0
16:21:50.271400 IP 10.12.100.171.43772 > 10.12.19.23.2121: Flags [.], ack 4201382041, win 1024, length 0
16:21:50.271402 IP 10.12.100.171.43772 > 10.12.19.23.15003: Flags [.], ack 4201382041, win 1024, length 0
16:21:50.271404 IP 10.12.100.171.43772 > 10.12.19.23.3390: Flags [.], ack 4201382041, win 1024, length 0
16:21:50.322160 IP 10.12.100.171.43772 > 10.12.19.23.5825: Flags [.], ack 4201382041, win 1024, length 0
16:21:50.322196 IP 10.12.100.171.43770 > 10.12.19.23.6502: Flags [.], ack 4201513115, win 1024, length 0
16:21:50.322197 IP 10.12.100.171.43770 > 10.12.19.23.1087: Flags [.], ack 4201513115, win 1024, length 0
16:21:50.322199 IP 10.12.100.171.43770 > 10.12.19.23.1059: Flags [.], ack 4201513115, win 1024, length 0
16:21:50.373229 IP 10.12.100.171.43771 > 10.12.19.23.1059: Flags [.], ack 4201578650, win 1024, length 0
16:21:50.373242 IP 10.12.100.171.43771 > 10.12.19.23.1087: Flags [.], ack 4201578650, win 1024, length 0
16:21:50.373244 IP 10.12.100.171.43771 > 10.12.19.23.6502: Flags [.], ack 4201578650, win 1024, length 0
16:21:50.373245 IP 10.12.100.171.43770 > 10.12.19.23.55055: Flags [.], ack 4201513115, win 1024, length 0
16:21:50.424434 IP 10.12.100.171.43771 > 10.12.19.23.55055: Flags [.], ack 4201578650, win 1024, length 0
16:21:50.424485 IP 10.12.100.171.43772 > 10.12.19.23.6502: Flags [.], ack 4201382041, win 1024, length 0
16:21:50.424486 IP 10.12.100.171.43772 > 10.12.19.23.1087: Flags [.], ack 4201382041, win 1024, length 0
16:21:50.424488 IP 10.12.100.171.43772 > 10.12.19.23.1059: Flags [.], ack 4201382041, win 1024, length 0
16:21:50.474755 IP 10.12.100.171.43772 > 10.12.19.23.55055: Flags [.], ack 4201382041, win 1024, length 0
16:21:50.474774 IP 10.12.100.171.43770 > 10.12.19.23.19: Flags [.], ack 4201513115, win 1024, length 0
16:21:50.474789 IP 10.12.100.171.43770 > 10.12.19.23.9101: Flags [.], ack 4201513115, win 1024, length 0
16:21:50.474790 IP 10.12.100.171.43770 > 10.12.19.23.1111: Flags [.], ack 4201513115, win 1024, length 0
16:21:50.525104 IP 10.12.100.171.43771 > 10.12.19.23.1111: Flags [.], ack 4201578650, win 1024, length 0
16:21:50.525128 IP 10.12.100.171.43771 > 10.12.19.23.9101: Flags [.], ack 4201578650, win 1024, length 0
16:21:50.525130 IP 10.12.100.171.43771 > 10.12.19.23.19: Flags [.], ack 4201578650, win 1024, length 0
16:21:50.525132 IP 10.12.100.171.43770 > 10.12.19.23.4343: Flags [.], ack 4201513115, win 1024, length 0
16:21:50.575454 IP 10.12.100.171.43771 > 10.12.19.23.4343: Flags [.], ack 4201578650, win 1024, length 0
16:21:50.575478 IP 10.12.100.171.43772 > 10.12.19.23.19: Flags [.], ack 4201382041, win 1024, length 0
16:21:50.575480 IP 10.12.100.171.43772 > 10.12.19.23.9101: Flags [.], ack 4201382041, win 1024, length 0
16:21:50.575481 IP 10.12.100.171.43772 > 10.12.19.23.1111: Flags [.], ack 4201382041, win 1024, length 0
16:21:50.625841 IP 10.12.100.171.43772 > 10.12.19.23.4343: Flags [.], ack 4201382041, win 1024, length 0
16:21:50.625863 IP 10.12.100.171.43770 > 10.12.19.23.7676: Flags [.], ack 4201513115, win 1024, length 0
16:21:50.625865 IP 10.12.100.171.43770 > 10.12.19.23.5904: Flags [.], ack 4201513115, win 1024, length 0
16:21:50.625866 IP 10.12.100.171.43770 > 10.12.19.23.5959: Flags [.], ack 4201513115, win 1024, length 0
16:21:50.676939 IP 10.12.100.171.43771 > 10.12.19.23.5959: Flags [.], ack 4201578650, win 1024, length 0
16:21:50.676948 IP 10.12.100.171.43771 > 10.12.19.23.5904: Flags [.], ack 4201578650, win 1024, length 0
16:21:50.677011 IP 10.12.100.171.43771 > 10.12.19.23.7676: Flags [.], ack 4201578650, win 1024, length 0
16:21:50.677015 IP 10.12.100.171.43770 > 10.12.19.23.4224: Flags [.], ack 4201513115, win 1024, length 0
16:21:50.727374 IP 10.12.100.171.43771 > 10.12.19.23.4224: Flags [.], ack 4201578650, win 1024, length 0
16:21:50.727397 IP 10.12.100.171.43772 > 10.12.19.23.7676: Flags [.], ack 4201382041, win 1024, length 0
16:21:50.727399 IP 10.12.100.171.43772 > 10.12.19.23.5904: Flags [.], ack 4201382041, win 1024, length 0
16:21:50.727400 IP 10.12.100.171.43772 > 10.12.19.23.5959: Flags [.], ack 4201382041, win 1024, length 0
16:21:50.777614 IP 10.12.100.171.43772 > 10.12.19.23.4224: Flags [.], ack 4201382041, win 1024, length 0
16:21:50.777638 IP 10.12.100.171.43770 > 10.12.19.23.5431: Flags [.], ack 4201513115, win 1024, length 0
16:21:50.777655 IP 10.12.100.171.43770 > 10.12.19.23.32780: Flags [.], ack 4201513115, win 1024, length 0
16:21:50.777656 IP 10.12.100.171.43770 > 10.12.19.23.49176: Flags [.], ack 4201513115, win 1024, length 0
16:21:50.827626 IP 10.12.100.171.43770 > 10.12.19.23.2049: Flags [.], ack 4201513115, win 1024, length 0
16:21:50.830098 IP 10.12.100.171.43771 > 10.12.19.23.49176: Flags [.], ack 4201578650, win 1024, length 0
16:21:50.830105 IP 10.12.100.171.43771 > 10.12.19.23.32780: Flags [.], ack 4201578650, win 1024, length 0
16:21:50.830106 IP 10.12.100.171.43771 > 10.12.19.23.5431: Flags [.], ack 4201578650, win 1024, length 0
16:21:50.877645 IP 10.12.100.171.43771 > 10.12.19.23.2049: Flags [.], ack 4201578650, win 1024, length 0
16:21:50.880425 IP 10.12.100.171.43772 > 10.12.19.23.5431: Flags [.], ack 4201382041, win 1024, length 0
16:21:50.880432 IP 10.12.100.171.43772 > 10.12.19.23.32780: Flags [.], ack 4201382041, win 1024, length 0
16:21:50.880434 IP 10.12.100.171.43772 > 10.12.19.23.49176: Flags [.], ack 4201382041, win 1024, length 0
16:21:50.928071 IP 10.12.100.171.43772 > 10.12.19.23.2049: Flags [.], ack 4201382041, win 1024, length 0
16:21:50.930798 IP 10.12.100.171.43770 > 10.12.19.23.1300: Flags [.], ack 4201513115, win 1024, length 0
16:21:50.930805 IP 10.12.100.171.43770 > 10.12.19.23.65000: Flags [.], ack 4201513115, win 1024, length 0
16:21:50.930807 IP 10.12.100.171.43770 > 10.12.19.23.9010: Flags [.], ack 4201513115, win 1024, length 0
16:21:50.978954 IP 10.12.100.171.43770 > 10.12.19.23.259: Flags [.], ack 4201513115, win 1024, length 0
16:21:50.981423 IP 10.12.100.171.43771 > 10.12.19.23.9010: Flags [.], ack 4201578650, win 1024, length 0
16:21:50.981430 IP 10.12.100.171.43771 > 10.12.19.23.65000: Flags [.], ack 4201578650, win 1024, length 0
16:21:50.981431 IP 10.12.100.171.43771 > 10.12.19.23.1300: Flags [.], ack 4201578650, win 1024, length 0
16:21:51.029085 IP 10.12.100.171.43771 > 10.12.19.23.259: Flags [.], ack 4201578650, win 1024, length 0
16:21:51.031898 IP 10.12.100.171.43772 > 10.12.19.23.1300: Flags [.], ack 4201382041, win 1024, length 0
16:21:51.031906 IP 10.12.100.171.43772 > 10.12.19.23.65000: Flags [.], ack 4201382041, win 1024, length 0
16:21:51.031908 IP 10.12.100.171.43772 > 10.12.19.23.9010: Flags [.], ack 4201382041, win 1024, length 0
16:21:51.079216 IP 10.12.100.171.43772 > 10.12.19.23.259: Flags [.], ack 4201382041, win 1024, length 0
16:21:51.082606 IP 10.12.100.171.43770 > 10.12.19.23.50636: Flags [.], ack 4201513115, win 1024, length 0
16:21:51.082626 IP 10.12.100.171.43770 > 10.12.19.23.1067: Flags [.], ack 4201513115, win 1024, length 0
16:21:51.082628 IP 10.12.100.171.43770 > 10.12.19.23.3323: Flags [.], ack 4201513115, win 1024, length 0
16:21:51.129516 IP 10.12.100.171.43770 > 10.12.19.23.11111: Flags [.], ack 4201513115, win 1024, length 0
16:21:51.132824 IP 10.12.100.171.43771 > 10.12.19.23.3323: Flags [.], ack 4201578650, win 1024, length 0
16:21:51.132835 IP 10.12.100.171.43771 > 10.12.19.23.1067: Flags [.], ack 4201578650, win 1024, length 0
16:21:51.132837 IP 10.12.100.171.43771 > 10.12.19.23.50636: Flags [.], ack 4201578650, win 1024, length 0
16:21:51.179846 IP 10.12.100.171.43771 > 10.12.19.23.11111: Flags [.], ack 4201578650, win 1024, length 0
16:21:51.182823 IP 10.12.100.171.43772 > 10.12.19.23.3323: Flags [.], ack 4201382041, win 1024, length 0
16:21:51.185363 IP 10.12.100.171.43772 > 10.12.19.23.50636: Flags [.], ack 4201382041, win 1024, length 0
16:21:51.185372 IP 10.12.100.171.43772 > 10.12.19.23.1067: Flags [.], ack 4201382041, win 1024, length 0
16:21:51.230908 IP 10.12.100.171.43772 > 10.12.19.23.11111: Flags [.], ack 4201382041, win 1024, length 0
16:21:51.233260 IP 10.12.100.171.43770 > 10.12.19.23.6009: Flags [.], ack 4201513115, win 1024, length 0
16:21:51.235797 IP 10.12.100.171.43770 > 10.12.19.23.55056: Flags [.], ack 4201513115, win 1024, length 0
16:21:51.235819 IP 10.12.100.171.43770 > 10.12.19.23.2288: Flags [.], ack 4201513115, win 1024, length 0
16:21:51.280964 IP 10.12.100.171.43770 > 10.12.19.23.8500: Flags [.], ack 4201513115, win 1024, length 0
16:21:51.283656 IP 10.12.100.171.43771 > 10.12.19.23.6009: Flags [.], ack 4201578650, win 1024, length 0
16:21:51.285839 IP 10.12.100.171.43771 > 10.12.19.23.55056: Flags [.], ack 4201578650, win 1024, length 0
16:21:51.288070 IP 10.12.100.171.43771 > 10.12.19.23.2288: Flags [.], ack 4201578650, win 1024, length 0
16:21:51.331274 IP 10.12.100.171.43775 > 10.12.19.23.443: Flags [.], ack 4184736667, win 1024, length 0
16:21:51.331306 IP 10.12.19.23.443 > 10.12.100.171.43775: Flags [R], seq 4184736667, win 0, length 0
16:21:51.334001 IP 10.12.100.171.43772 > 10.12.19.23.6009: Flags [.], ack 4201382041, win 1024, length 0
16:21:51.336360 IP 10.12.100.171.43772 > 10.12.19.23.55056: Flags [.], ack 4201382041, win 1024, length 0
16:21:51.338615 IP 10.12.100.171.43772 > 10.12.19.23.2288: Flags [.], ack 4201382041, win 1024, length 0
16:21:51.388678 IP 10.12.100.171.43771 > 10.12.19.23.8500: Flags [.], ack 4201578650, win 1024, length 0
16:21:51.391005 IP 10.12.100.171.43770 > 10.12.19.23.1277: Flags [.], ack 4201513115, win 1024, length 0
16:21:51.439076 IP 10.12.100.171.43772 > 10.12.19.23.8500: Flags [.], ack 4201382041, win 1024, length 0
16:21:51.441437 IP 10.12.100.171.43771 > 10.12.19.23.1277: Flags [.], ack 4201578650, win 1024, length 0
16:21:51.489218 IP 10.12.100.171.43770 > 10.12.19.23.32779: Flags [.], ack 4201513115, win 1024, length 0
16:21:51.491757 IP 10.12.100.171.43772 > 10.12.19.23.1277: Flags [.], ack 4201382041, win 1024, length 0
16:21:51.539468 IP 10.12.100.171.43771 > 10.12.19.23.32779: Flags [.], ack 4201578650, win 1024, length 0
16:21:51.542161 IP 10.12.100.171.43770 > 10.12.19.23.3659: Flags [.], ack 4201513115, win 1024, length 0
16:21:51.590124 IP 10.12.100.171.43772 > 10.12.19.23.32779: Flags [.], ack 4201382041, win 1024, length 0
16:21:51.592525 IP 10.12.100.171.43771 > 10.12.19.23.3659: Flags [.], ack 4201578650, win 1024, length 0
16:21:51.640420 IP 10.12.100.171.43770 > 10.12.19.23.9099: Flags [.], ack 4201513115, win 1024, length 0
16:21:51.642529 IP 10.12.100.171.43772 > 10.12.19.23.3659: Flags [.], ack 4201382041, win 1024, length 0
16:21:51.690763 IP 10.12.100.171.43771 > 10.12.19.23.9099: Flags [.], ack 4201578650, win 1024, length 0
16:21:51.693111 IP 10.12.100.171.43770 > 10.12.19.23.6007: Flags [.], ack 4201513115, win 1024, length 0
16:21:51.740927 IP 10.12.100.171.43772 > 10.12.19.23.9099: Flags [.], ack 4201382041, win 1024, length 0
16:21:51.743135 IP 10.12.100.171.43771 > 10.12.19.23.6007: Flags [.], ack 4201578650, win 1024, length 0
16:21:51.791351 IP 10.12.100.171.43770 > 10.12.19.23.5907: Flags [.], ack 4201513115, win 1024, length 0
16:21:51.793759 IP 10.12.100.171.43772 > 10.12.19.23.6007: Flags [.], ack 4201382041, win 1024, length 0
16:21:51.841434 IP 10.12.100.171.43771 > 10.12.19.23.5907: Flags [.], ack 4201578650, win 1024, length 0
16:21:51.844108 IP 10.12.100.171.43770 > 10.12.19.23.40193: Flags [.], ack 4201513115, win 1024, length 0
16:21:51.892086 IP 10.12.100.171.43772 > 10.12.19.23.5907: Flags [.], ack 4201382041, win 1024, length 0
16:21:51.894305 IP 10.12.100.171.43771 > 10.12.19.23.40193: Flags [.], ack 4201578650, win 1024, length 0
16:21:51.942419 IP 10.12.100.171.43770 > 10.12.19.23.777: Flags [.], ack 4201513115, win 1024, length 0
16:21:51.944956 IP 10.12.100.171.43772 > 10.12.19.23.40193: Flags [.], ack 4201382041, win 1024, length 0
16:21:51.993483 IP 10.12.100.171.43771 > 10.12.19.23.777: Flags [.], ack 4201578650, win 1024, length 0
16:21:51.995888 IP 10.12.100.171.43770 > 10.12.19.23.9998: Flags [.], ack 4201513115, win 1024, length 0
16:21:52.043757 IP 10.12.100.171.43772 > 10.12.19.23.777: Flags [.], ack 4201382041, win 1024, length 0
16:21:52.046262 IP 10.12.100.171.43771 > 10.12.19.23.9998: Flags [.], ack 4201578650, win 1024, length 0
16:21:52.094082 IP 10.12.100.171.43770 > 10.12.19.23.1131: Flags [.], ack 4201513115, win 1024, length 0
16:21:52.096576 IP 10.12.100.171.43772 > 10.12.19.23.9998: Flags [.], ack 4201382041, win 1024, length 0
16:21:52.145203 IP 10.12.100.171.43771 > 10.12.19.23.1131: Flags [.], ack 4201578650, win 1024, length 0
