11:43:17.422001 ARP, Request who-has 10.12.19.23 (ff:ff:ff:ff:ff:ff) tell 10.12.100.44, length 46
11:43:17.622822 IP 10.12.100.44.64486 > 10.12.19.23.3306: Flags [F], seq 2219911413, win 1024, length 0
11:43:17.622864 IP 10.12.100.44.64486 > 10.12.19.23.113: Flags [F], seq 2219911413, win 1024, length 0
11:43:17.622866 IP 10.12.100.44.64486 > 10.12.19.23.21: Flags [F], seq 2219911413, win 1024, length 0
11:43:17.622867 IP 10.12.100.44.64486 > 10.12.19.23.1720: Flags [F], seq 2219911413, win 1024, length 0
11:43:17.622944 IP 10.12.100.44.64486 > 10.12.19.23.587: Flags [F], seq 2219911413, win 1024, length 0
11:43:17.622946 IP 10.12.100.44.64486 > 10.12.19.23.8888: Flags [F], seq 2219911413, win 1024, length 0
11:43:17.622947 IP 10.12.100.44.64486 > 10.12.19.23.5900: Flags [F], seq 2219911413, win 1024, length 0
11:43:17.623010 IP 10.12.100.44.64486 > 10.12.19.23.1025: Flags [F], seq 2219911413, win 1024, length 0
11:43:17.623013 IP 10.12.100.44.64486 > 10.12.19.23.143: Flags [F], seq 2219911413, win 1024, length 0
11:43:17.623082 IP 10.12.100.44.64486 > 10.12.19.23.995: Flags [F], seq 2219911413, win 1024, length 0
11:43:18.674878 IP 10.12.100.44.64487 > 10.12.19.23.995: Flags [F], seq 2219845876, win 1024, length 0
11:43:18.674897 IP 10.12.100.44.64487 > 10.12.19.23.143: Flags [F], seq 2219845876, win 1024, length 0
11:43:18.674898 IP 10.12.100.44.64487 > 10.12.19.23.1025: Flags [F], seq 2219845876, win 1024, length 0
11:43:18.674899 IP 10.12.100.44.64487 > 10.12.19.23.5900: Flags [F], seq 2219845876, win 1024, length 0
11:43:18.674900 IP 10.12.100.44.64487 > 10.12.19.23.8888: Flags [F], seq 2219845876, win 1024, length 0
11:43:18.674955 IP 10.12.100.44.64487 > 10.12.19.23.587: Flags [F], seq 2219845876, win 1024, length 0
11:43:18.674958 IP 10.12.100.44.64487 > 10.12.19.23.1720: Flags [F], seq 2219845876, win 1024, length 0
11:43:18.674959 IP 10.12.100.44.64487 > 10.12.19.23.21: Flags [F], seq 2219845876, win 1024, length 0
11:43:18.675075 IP 10.12.100.44.64487 > 10.12.19.23.113: Flags [F], seq 2219845876, win 1024, length 0
11:43:18.675080 IP 10.12.100.44.64487 > 10.12.19.23.3306: Flags [F], seq 2219845876, win 1024, length 0
11:43:18.725125 IP 10.12.100.44.64486 > 10.12.19.23.53: Flags [F], seq 2219911413, win 1024, length 0
11:43:18.725144 IP 10.12.100.44.64486 > 10.12.19.23.25: Flags [F], seq 2219911413, win 1024, length 0
11:43:18.725145 IP 10.12.100.44.64486 > 10.12.19.23.80: Flags [F], seq 2219911413, win 1024, length 0
11:43:18.725150 IP 10.12.100.44.64486 > 10.12.19.23.256: Flags [F], seq 2219911413, win 1024, length 0
11:43:18.725151 IP 10.12.100.44.64486 > 10.12.19.23.554: Flags [F], seq 2219911413, win 1024, length 0
11:43:18.725152 IP 10.12.100.44.64486 > 10.12.19.23.8080: Flags [F], seq 2219911413, win 1024, length 0
11:43:18.725234 IP 10.12.100.44.64486 > 10.12.19.23.993: Flags [F], seq 2219911413, win 1024, length 0
11:43:18.725236 IP 10.12.100.44.64486 > 10.12.19.23.110: Flags [F], seq 2219911413, win 1024, length 0
11:43:18.727825 IP 10.12.100.44.64486 > 10.12.19.23.1723: Flags [F], seq 2219911413, win 1024, length 0
11:43:18.727834 IP 10.12.100.44.64486 > 10.12.19.23.135: Flags [F], seq 2219911413, win 1024, length 0
11:43:18.775390 IP 10.12.100.44.64487 > 10.12.19.23.110: Flags [F], seq 2219845876, win 1024, length 0
11:43:18.775408 IP 10.12.100.44.64487 > 10.12.19.23.993: Flags [F], seq 2219845876, win 1024, length 0
11:43:18.775409 IP 10.12.100.44.64487 > 10.12.19.23.8080: Flags [F], seq 2219845876, win 1024, length 0
11:43:18.775411 IP 10.12.100.44.64487 > 10.12.19.23.554: Flags [F], seq 2219845876, win 1024, length 0
11:43:18.775452 IP 10.12.100.44.64487 > 10.12.19.23.256: Flags [F], seq 2219845876, win 1024, length 0
11:43:18.775454 IP 10.12.100.44.64487 > 10.12.19.23.80: Flags [F], seq 2219845876, win 1024, length 0
11:43:18.775458 IP 10.12.100.44.64487 > 10.12.19.23.25: Flags [F], seq 2219845876, win 1024, length 0
11:43:18.775559 IP 10.12.100.44.64487 > 10.12.19.23.53: Flags [F], seq 2219845876, win 1024, length 0
11:43:18.778152 IP 10.12.100.44.64487 > 10.12.19.23.135: Flags [F], seq 2219845876, win 1024, length 0
11:43:18.778157 IP 10.12.100.44.64487 > 10.12.19.23.1723: Flags [F], seq 2219845876, win 1024, length 0
11:43:18.826288 IP 10.12.100.44.64486 > 10.12.19.23.199: Flags [F], seq 2219911413, win 1024, length 0
11:43:18.826305 IP 10.12.100.44.64486 > 10.12.19.23.23: Flags [F], seq 2219911413, win 1024, length 0
11:43:18.826306 IP 10.12.100.44.64486 > 10.12.19.23.3389: Flags [F], seq 2219911413, win 1024, length 0
11:43:18.826307 IP 10.12.100.44.64486 > 10.12.19.23.443: Flags [F], seq 2219911413, win 1024, length 0
11:43:18.826332 IP 10.12.100.44.64486 > 10.12.19.23.139: Flags [F], seq 2219911413, win 1024, length 0
11:43:18.826414 IP 10.12.100.44.64486 > 10.12.19.23.111: Flags [F], seq 2219911413, win 1024, length 0
11:43:18.826417 IP 10.12.100.44.64486 > 10.12.19.23.445: Flags [F], seq 2219911413, win 1024, length 0
11:43:18.826418 IP 10.12.100.44.64486 > 10.12.19.23.22: Flags [F], seq 2219911413, win 1024, length 0
11:43:18.828874 IP 10.12.100.44.64486 > 10.12.19.23.1947: Flags [F], seq 2219911413, win 1024, length 0
11:43:18.828904 IP 10.12.100.44.64486 > 10.12.19.23.5544: Flags [F], seq 2219911413, win 1024, length 0
11:43:18.877416 IP 10.12.100.44.64487 > 10.12.19.23.22: Flags [F], seq 2219845876, win 1024, length 0
11:43:18.877445 IP 10.12.100.44.64487 > 10.12.19.23.445: Flags [F], seq 2219845876, win 1024, length 0
11:43:18.877459 IP 10.12.100.44.64487 > 10.12.19.23.111: Flags [F], seq 2219845876, win 1024, length 0
11:43:18.877460 IP 10.12.100.44.64487 > 10.12.19.23.139: Flags [F], seq 2219845876, win 1024, length 0
11:43:18.877503 IP 10.12.100.44.64487 > 10.12.19.23.443: Flags [F], seq 2219845876, win 1024, length 0
11:43:18.877527 IP 10.12.100.44.64487 > 10.12.19.23.3389: Flags [F], seq 2219845876, win 1024, length 0
11:43:18.877529 IP 10.12.100.44.64487 > 10.12.19.23.23: Flags [F], seq 2219845876, win 1024, length 0
11:43:18.877606 IP 10.12.100.44.64487 > 10.12.19.23.199: Flags [F], seq 2219845876, win 1024, length 0
11:43:18.880166 IP 10.12.100.44.64487 > 10.12.19.23.5544: Flags [F], seq 2219845876, win 1024, length 0
11:43:18.880172 IP 10.12.100.44.64487 > 10.12.19.23.1947: Flags [F], seq 2219845876, win 1024, length 0
11:43:18.927708 IP 10.12.100.44.64486 > 10.12.19.23.5877: Flags [F], seq 2219911413, win 1024, length 0
11:43:18.927742 IP 10.12.100.44.64486 > 10.12.19.23.1113: Flags [F], seq 2219911413, win 1024, length 0
11:43:18.927743 IP 10.12.100.44.64486 > 10.12.19.23.3371: Flags [F], seq 2219911413, win 1024, length 0
11:43:18.927744 IP 10.12.100.44.64486 > 10.12.19.23.8333: Flags [F], seq 2219911413, win 1024, length 0
11:43:18.927758 IP 10.12.100.44.64486 > 10.12.19.23.7911: Flags [F], seq 2219911413, win 1024, length 0
11:43:18.930074 IP 10.12.100.44.64486 > 10.12.19.23.2048: Flags [F], seq 2219911413, win 1024, length 0
11:43:18.930083 IP 10.12.100.44.64486 > 10.12.19.23.3814: Flags [F], seq 2219911413, win 1024, length 0
11:43:18.930144 IP 10.12.100.44.64486 > 10.12.19.23.1049: Flags [F], seq 2219911413, win 1024, length 0
11:43:18.932489 IP 10.12.100.44.64486 > 10.12.19.23.1050: Flags [F], seq 2219911413, win 1024, length 0
11:43:18.932496 IP 10.12.100.44.64486 > 10.12.19.23.9009: Flags [F], seq 2219911413, win 1024, length 0
11:43:18.977991 IP 10.12.100.44.64487 > 10.12.19.23.3371: Flags [F], seq 2219845876, win 1024, length 0
11:43:18.978009 IP 10.12.100.44.64487 > 10.12.19.23.1113: Flags [F], seq 2219845876, win 1024, length 0
11:43:18.978011 IP 10.12.100.44.64487 > 10.12.19.23.5877: Flags [F], seq 2219845876, win 1024, length 0
11:43:18.980321 IP 10.12.100.44.64487 > 10.12.19.23.1049: Flags [F], seq 2219845876, win 1024, length 0
11:43:18.980329 IP 10.12.100.44.64487 > 10.12.19.23.3814: Flags [F], seq 2219845876, win 1024, length 0
11:43:18.980331 IP 10.12.100.44.64487 > 10.12.19.23.2048: Flags [F], seq 2219845876, win 1024, length 0
11:43:18.980332 IP 10.12.100.44.64487 > 10.12.19.23.7911: Flags [F], seq 2219845876, win 1024, length 0
11:43:18.980349 IP 10.12.100.44.64487 > 10.12.19.23.8333: Flags [F], seq 2219845876, win 1024, length 0
11:43:18.982842 IP 10.12.100.44.64487 > 10.12.19.23.9009: Flags [F], seq 2219845876, win 1024, length 0
11:43:18.982848 IP 10.12.100.44.64487 > 10.12.19.23.1050: Flags [F], seq 2219845876, win 1024, length 0
11:43:20.032661 IP 10.12.100.44.64488 > 10.12.19.23.1050: Flags [F], seq 2220042487, win 1024, length 0
11:43:20.032678 IP 10.12.100.44.64488 > 10.12.19.23.9009: Flags [F], seq 2220042487, win 1024, length 0
11:43:20.032679 IP 10.12.100.44.64488 > 10.12.19.23.8333: Flags [F], seq 2220042487, win 1024, length 0
11:43:20.032726 IP 10.12.100.44.64488 > 10.12.19.23.7911: Flags [F], seq 2220042487, win 1024, length 0
11:43:20.032741 IP 10.12.100.44.64488 > 10.12.19.23.2048: Flags [F], seq 2220042487, win 1024, length 0
11:43:20.032742 IP 10.12.100.44.64488 > 10.12.19.23.3814: Flags [F], seq 2220042487, win 1024, length 0
11:43:20.032841 IP 10.12.100.44.64488 > 10.12.19.23.1049: Flags [F], seq 2220042487, win 1024, length 0
11:43:20.032860 IP 10.12.100.44.64488 > 10.12.19.23.5877: Flags [F], seq 2220042487, win 1024, length 0
11:43:20.082903 IP 10.12.100.44.64488 > 10.12.19.23.1113: Flags [F], seq 2220042487, win 1024, length 0
11:43:20.082914 IP 10.12.100.44.64488 > 10.12.19.23.3371: Flags [F], seq 2220042487, win 1024, length 0
11:43:20.082916 IP 10.12.100.44.64488 > 10.12.19.23.1947: Flags [F], seq 2220042487, win 1024, length 0
11:43:20.082917 IP 10.12.100.44.64488 > 10.12.19.23.5544: Flags [F], seq 2220042487, win 1024, length 0
11:43:20.082978 IP 10.12.100.44.64488 > 10.12.19.23.199: Flags [F], seq 2220042487, win 1024, length 0
11:43:20.082980 IP 10.12.100.44.64488 > 10.12.19.23.23: Flags [F], seq 2220042487, win 1024, length 0
11:43:20.085628 IP 10.12.100.44.64488 > 10.12.19.23.3389: Flags [F], seq 2220042487, win 1024, length 0
11:43:20.085635 IP 10.12.100.44.64488 > 10.12.19.23.139: Flags [F], seq 2220042487, win 1024, length 0
11:43:20.132935 IP 10.12.100.44.64489 > 10.12.19.23.443: Flags [F], seq 2236688885, win 1024, length 0
11:43:20.135392 IP 10.12.100.44.64488 > 10.12.19.23.111: Flags [F], seq 2220042487, win 1024, length 0
11:43:20.135437 IP 10.12.100.44.64488 > 10.12.19.23.445: Flags [F], seq 2220042487, win 1024, length 0
11:43:20.135438 IP 10.12.100.44.64488 > 10.12.19.23.22: Flags [F], seq 2220042487, win 1024, length 0
11:43:20.135439 IP 10.12.100.44.64488 > 10.12.19.23.1723: Flags [F], seq 2220042487, win 1024, length 0
11:43:20.135441 IP 10.12.100.44.64488 > 10.12.19.23.135: Flags [F], seq 2220042487, win 1024, length 0
11:43:20.138034 IP 10.12.100.44.64488 > 10.12.19.23.53: Flags [F], seq 2220042487, win 1024, length 0
11:43:20.138040 IP 10.12.100.44.64488 > 10.12.19.23.25: Flags [F], seq 2220042487, win 1024, length 0
11:43:20.188187 IP 10.12.100.44.64488 > 10.12.19.23.80: Flags [F], seq 2220042487, win 1024, length 0
11:43:20.240892 IP 10.12.100.44.64488 > 10.12.19.23.256: Flags [F], seq 2220042487, win 1024, length 0
11:43:20.240908 IP 10.12.100.44.64488 > 10.12.19.23.554: Flags [F], seq 2220042487, win 1024, length 0
11:43:20.240910 IP 10.12.100.44.64488 > 10.12.19.23.8080: Flags [F], seq 2220042487, win 1024, length 0
11:43:20.240911 IP 10.12.100.44.64488 > 10.12.19.23.993: Flags [F], seq 2220042487, win 1024, length 0
11:43:20.240912 IP 10.12.100.44.64488 > 10.12.19.23.110: Flags [F], seq 2220042487, win 1024, length 0
11:43:20.291509 IP 10.12.100.44.64488 > 10.12.19.23.3306: Flags [F], seq 2220042487, win 1024, length 0
11:43:20.291528 IP 10.12.100.44.64488 > 10.12.19.23.113: Flags [F], seq 2220042487, win 1024, length 0
11:43:20.291530 IP 10.12.100.44.64488 > 10.12.19.23.21: Flags [F], seq 2220042487, win 1024, length 0
11:43:20.291531 IP 10.12.100.44.64488 > 10.12.19.23.1720: Flags [F], seq 2220042487, win 1024, length 0
11:43:20.291594 IP 10.12.100.44.64488 > 10.12.19.23.587: Flags [F], seq 2220042487, win 1024, length 0
11:43:20.341733 IP 10.12.100.44.64488 > 10.12.19.23.8888: Flags [F], seq 2220042487, win 1024, length 0
11:43:20.341766 IP 10.12.100.44.64488 > 10.12.19.23.5900: Flags [F], seq 2220042487, win 1024, length 0
11:43:20.341767 IP 10.12.100.44.64488 > 10.12.19.23.1025: Flags [F], seq 2220042487, win 1024, length 0
11:43:20.341769 IP 10.12.100.44.64488 > 10.12.19.23.143: Flags [F], seq 2220042487, win 1024, length 0
11:43:20.341770 IP 10.12.100.44.64488 > 10.12.19.23.995: Flags [F], seq 2220042487, win 1024, length 0
11:43:20.392394 IP 10.12.100.44.64486 > 10.12.19.23.2045: Flags [F], seq 2219911413, win 1024, length 0
11:43:20.392424 IP 10.12.100.44.64486 > 10.12.19.23.1105: Flags [F], seq 2219911413, win 1024, length 0
11:43:20.392425 IP 10.12.100.44.64486 > 10.12.19.23.2401: Flags [F], seq 2219911413, win 1024, length 0
11:43:20.392426 IP 10.12.100.44.64486 > 10.12.19.23.10215: Flags [F], seq 2219911413, win 1024, length 0
11:43:20.392487 IP 10.12.100.44.64486 > 10.12.19.23.407: Flags [F], seq 2219911413, win 1024, length 0
11:43:20.442472 IP 10.12.100.44.64487 > 10.12.19.23.1105: Flags [F], seq 2219845876, win 1024, length 0
11:43:20.442490 IP 10.12.100.44.64487 > 10.12.19.23.2045: Flags [F], seq 2219845876, win 1024, length 0
11:43:20.445019 IP 10.12.100.44.64487 > 10.12.19.23.407: Flags [F], seq 2219845876, win 1024, length 0
11:43:20.445028 IP 10.12.100.44.64487 > 10.12.19.23.10215: Flags [F], seq 2219845876, win 1024, length 0
11:43:20.445029 IP 10.12.100.44.64487 > 10.12.19.23.2401: Flags [F], seq 2219845876, win 1024, length 0
11:43:20.492787 IP 10.12.100.44.64488 > 10.12.19.23.2045: Flags [F], seq 2220042487, win 1024, length 0
11:43:20.492818 IP 10.12.100.44.64488 > 10.12.19.23.1105: Flags [F], seq 2220042487, win 1024, length 0
11:43:20.495507 IP 10.12.100.44.64488 > 10.12.19.23.2401: Flags [F], seq 2220042487, win 1024, length 0
11:43:20.495512 IP 10.12.100.44.64488 > 10.12.19.23.10215: Flags [F], seq 2220042487, win 1024, length 0
11:43:20.495514 IP 10.12.100.44.64488 > 10.12.19.23.407: Flags [F], seq 2220042487, win 1024, length 0
11:43:20.543008 IP 10.12.100.44.64486 > 10.12.19.23.1233: Flags [F], seq 2219911413, win 1024, length 0
11:43:20.543036 IP 10.12.100.44.64486 > 10.12.19.23.9999: Flags [F], seq 2219911413, win 1024, length 0
11:43:20.546091 IP 10.12.100.44.64486 > 10.12.19.23.18988: Flags [F], seq 2219911413, win 1024, length 0
11:43:20.546116 IP 10.12.100.44.64486 > 10.12.19.23.9594: Flags [F], seq 2219911413, win 1024, length 0
11:43:20.546117 IP 10.12.100.44.64486 > 10.12.19.23.9917: Flags [F], seq 2219911413, win 1024, length 0
11:43:20.593240 IP 10.12.100.44.64487 > 10.12.19.23.9999: Flags [F], seq 2219845876, win 1024, length 0
11:43:20.593257 IP 10.12.100.44.64487 > 10.12.19.23.1233: Flags [F], seq 2219845876, win 1024, length 0
11:43:20.596472 IP 10.12.100.44.64487 > 10.12.19.23.9917: Flags [F], seq 2219845876, win 1024, length 0
11:43:20.596478 IP 10.12.100.44.64487 > 10.12.19.23.9594: Flags [F], seq 2219845876, win 1024, length 0
11:43:20.596480 IP 10.12.100.44.64487 > 10.12.19.23.18988: Flags [F], seq 2219845876, win 1024, length 0
11:43:20.644012 IP 10.12.100.44.64488 > 10.12.19.23.1233: Flags [F], seq 2220042487, win 1024, length 0
11:43:20.644032 IP 10.12.100.44.64488 > 10.12.19.23.9999: Flags [F], seq 2220042487, win 1024, length 0
11:43:20.646888 IP 10.12.100.44.64488 > 10.12.19.23.18988: Flags [F], seq 2220042487, win 1024, length 0
11:43:20.646897 IP 10.12.100.44.64488 > 10.12.19.23.9594: Flags [F], seq 2220042487, win 1024, length 0
11:43:20.646898 IP 10.12.100.44.64488 > 10.12.19.23.9917: Flags [F], seq 2220042487, win 1024, length 0
11:43:20.694199 IP 10.12.100.44.64486 > 10.12.19.23.8090: Flags [F], seq 2219911413, win 1024, length 0
11:43:20.694216 IP 10.12.100.44.64486 > 10.12.19.23.1700: Flags [F], seq 2219911413, win 1024, length 0
11:43:20.697201 IP 10.12.100.44.64486 > 10.12.19.23.49155: Flags [F], seq 2219911413, win 1024, length 0
11:43:20.697209 IP 10.12.100.44.64486 > 10.12.19.23.26214: Flags [F], seq 2219911413, win 1024, length 0
11:43:20.697210 IP 10.12.100.44.64486 > 10.12.19.23.25735: Flags [F], seq 2219911413, win 1024, length 0
11:43:20.744166 IP 10.12.100.44.64487 > 10.12.19.23.8090: Flags [F], seq 2219845876, win 1024, length 0
11:43:20.746584 IP 10.12.100.44.64487 > 10.12.19.23.1700: Flags [F], seq 2219845876, win 1024, length 0
11:43:20.749117 IP 10.12.100.44.64487 > 10.12.19.23.25735: Flags [F], seq 2219845876, win 1024, length 0
11:43:20.749124 IP 10.12.100.44.64487 > 10.12.19.23.26214: Flags [F], seq 2219845876, win 1024, length 0
11:43:20.749125 IP 10.12.100.44.64487 > 10.12.19.23.49155: Flags [F], seq 2219845876, win 1024, length 0
11:43:20.794495 IP 10.12.100.44.64488 > 10.12.19.23.8090: Flags [F], seq 2220042487, win 1024, length 0
11:43:20.797071 IP 10.12.100.44.64488 > 10.12.19.23.1700: Flags [F], seq 2220042487, win 1024, length 0
11:43:20.799598 IP 10.12.100.44.64488 > 10.12.19.23.49155: Flags [F], seq 2220042487, win 1024, length 0
11:43:20.799618 IP 10.12.100.44.64488 > 10.12.19.23.26214: Flags [F], seq 2220042487, win 1024, length 0
11:43:20.799722 IP 10.12.100.44.64488 > 10.12.19.23.25735: Flags [F], seq 2220042487, win 1024, length 0
11:43:20.845292 IP 10.12.100.44.64486 > 10.12.19.23.3659: Flags [F], seq 2219911413, win 1024, length 0
11:43:20.847720 IP 10.12.100.44.64486 > 10.12.19.23.777: Flags [F], seq 2219911413, win 1024, length 0
11:43:20.849919 IP 10.12.100.44.64486 > 10.12.19.23.9080: Flags [F], seq 2219911413, win 1024, length 0
11:43:20.849926 IP 10.12.100.44.64486 > 10.12.19.23.1138: Flags [F], seq 2219911413, win 1024, length 0
11:43:20.849973 IP 10.12.100.44.64486 > 10.12.19.23.5298: Flags [F], seq 2219911413, win 1024, length 0
11:43:20.895386 IP 10.12.100.44.64487 > 10.12.19.23.3659: Flags [F], seq 2219845876, win 1024, length 0
11:43:20.897882 IP 10.12.100.44.64487 > 10.12.19.23.777: Flags [F], seq 2219845876, win 1024, length 0
11:43:20.900134 IP 10.12.100.44.64487 > 10.12.19.23.5298: Flags [F], seq 2219845876, win 1024, length 0
11:43:20.900142 IP 10.12.100.44.64487 > 10.12.19.23.1138: Flags [F], seq 2219845876, win 1024, length 0
11:43:20.900143 IP 10.12.100.44.64487 > 10.12.19.23.9080: Flags [F], seq 2219845876, win 1024, length 0
11:43:20.945620 IP 10.12.100.44.64488 > 10.12.19.23.3659: Flags [F], seq 2220042487, win 1024, length 0
11:43:20.948202 IP 10.12.100.44.64488 > 10.12.19.23.777: Flags [F], seq 2220042487, win 1024, length 0
11:43:20.950339 IP 10.12.100.44.64488 > 10.12.19.23.9080: Flags [F], seq 2220042487, win 1024, length 0
11:43:20.950346 IP 10.12.100.44.64488 > 10.12.19.23.1138: Flags [F], seq 2220042487, win 1024, length 0
11:43:20.950405 IP 10.12.100.44.64488 > 10.12.19.23.5298: Flags [F], seq 2220042487, win 1024, length 0
11:43:20.995737 IP 10.12.100.44.64486 > 10.12.19.23.631: Flags [F], seq 2219911413, win 1024, length 0
11:43:20.998774 IP 10.12.100.44.64486 > 10.12.19.23.1036: Flags [F], seq 2219911413, win 1024, length 0
11:43:21.001062 IP 10.12.100.44.64486 > 10.12.19.23.1151: Flags [F], seq 2219911413, win 1024, length 0
11:43:21.001068 IP 10.12.100.44.64486 > 10.12.19.23.9898: Flags [F], seq 2219911413, win 1024, length 0
11:43:21.001069 IP 10.12.100.44.64486 > 10.12.19.23.458: Flags [F], seq 2219911413, win 1024, length 0
11:43:21.046064 IP 10.12.100.44.64487 > 10.12.19.23.631: Flags [F], seq 2219845876, win 1024, length 0
11:43:21.049301 IP 10.12.100.44.64487 > 10.12.19.23.1036: Flags [F], seq 2219845876, win 1024, length 0
11:43:21.051706 IP 10.12.100.44.64487 > 10.12.19.23.458: Flags [F], seq 2219845876, win 1024, length 0
11:43:21.051712 IP 10.12.100.44.64487 > 10.12.19.23.9898: Flags [F], seq 2219845876, win 1024, length 0
11:43:21.051845 IP 10.12.100.44.64487 > 10.12.19.23.1151: Flags [F], seq 2219845876, win 1024, length 0
11:43:21.096580 IP 10.12.100.44.64488 > 10.12.19.23.631: Flags [F], seq 2220042487, win 1024, length 0
11:43:21.099741 IP 10.12.100.44.64488 > 10.12.19.23.1036: Flags [F], seq 2220042487, win 1024, length 0
11:43:21.102273 IP 10.12.100.44.64488 > 10.12.19.23.1151: Flags [F], seq 2220042487, win 1024, length 0
11:43:21.102291 IP 10.12.100.44.64488 > 10.12.19.23.9898: Flags [F], seq 2220042487, win 1024, length 0
11:43:21.102292 IP 10.12.100.44.64488 > 10.12.19.23.458: Flags [F], seq 2220042487, win 1024, length 0
11:43:21.146761 IP 10.12.100.44.64486 > 10.12.19.23.32768: Flags [F], seq 2219911413, win 1024, length 0
11:43:21.149895 IP 10.12.100.44.64486 > 10.12.19.23.10025: Flags [F], seq 2219911413, win 1024, length 0
11:43:21.152464 IP 10.12.100.44.64486 > 10.12.19.23.5566: Flags [F], seq 2219911413, win 1024, length 0
11:43:21.152472 IP 10.12.100.44.64486 > 10.12.19.23.9415: Flags [F], seq 2219911413, win 1024, length 0
11:43:21.152473 IP 10.12.100.44.64486 > 10.12.19.23.722: Flags [F], seq 2219911413, win 1024, length 0
11:43:21.196943 IP 10.12.100.44.64487 > 10.12.19.23.32768: Flags [F], seq 2219845876, win 1024, length 0
11:43:21.200493 IP 10.12.100.44.64487 > 10.12.19.23.10025: Flags [F], seq 2219845876, win 1024, length 0
11:43:21.202915 IP 10.12.100.44.64487 > 10.12.19.23.722: Flags [F], seq 2219845876, win 1024, length 0
11:43:21.202922 IP 10.12.100.44.64487 > 10.12.19.23.9415: Flags [F], seq 2219845876, win 1024, length 0
11:43:21.202923 IP 10.12.100.44.64487 > 10.12.19.23.5566: Flags [F], seq 2219845876, win 1024, length 0
11:43:21.246992 IP 10.12.100.44.64488 > 10.12.19.23.32768: Flags [F], seq 2220042487, win 1024, length 0
11:43:21.251128 IP 10.12.100.44.64488 > 10.12.19.23.10025: Flags [F], seq 2220042487, win 1024, length 0
11:43:21.253426 IP 10.12.100.44.64488 > 10.12.19.23.5566: Flags [F], seq 2220042487, win 1024, length 0
11:43:21.253432 IP 10.12.100.44.64488 > 10.12.19.23.9415: Flags [F], seq 2220042487, win 1024, length 0
11:43:21.253491 IP 10.12.100.44.64488 > 10.12.19.23.722: Flags [F], seq 2220042487, win 1024, length 0
11:43:21.297068 IP 10.12.100.44.64486 > 10.12.19.23.3351: Flags [F], seq 2219911413, win 1024, length 0
11:43:21.301842 IP 10.12.100.44.64486 > 10.12.19.23.1092: Flags [F], seq 2219911413, win 1024, length 0
11:43:21.304074 IP 10.12.100.44.64486 > 10.12.19.23.1972: Flags [F], seq 2219911413, win 1024, length 0
11:43:21.304092 IP 10.12.100.44.64486 > 10.12.19.23.1719: Flags [F], seq 2219911413, win 1024, length 0
11:43:21.304094 IP 10.12.100.44.64486 > 10.12.19.23.19780: Flags [F], seq 2219911413, win 1024, length 0
11:43:21.347266 IP 10.12.100.44.64487 > 10.12.19.23.3351: Flags [F], seq 2219845876, win 1024, length 0
11:43:21.352027 IP 10.12.100.44.64487 > 10.12.19.23.1092: Flags [F], seq 2219845876, win 1024, length 0
11:43:21.354283 IP 10.12.100.44.64487 > 10.12.19.23.19780: Flags [F], seq 2219845876, win 1024, length 0
11:43:21.354292 IP 10.12.100.44.64487 > 10.12.19.23.1719: Flags [F], seq 2219845876, win 1024, length 0
11:43:21.354294 IP 10.12.100.44.64487 > 10.12.19.23.1972: Flags [F], seq 2219845876, win 1024, length 0
11:43:21.398568 IP 10.12.100.44.64490 > 10.12.19.23.443: Flags [F], seq 2253466357, win 1024, length 0
11:43:21.402470 IP 10.12.100.44.64488 > 10.12.19.23.1092: Flags [F], seq 2220042487, win 1024, length 0
11:43:21.404657 IP 10.12.100.44.64488 > 10.12.19.23.1972: Flags [F], seq 2220042487, win 1024, length 0
11:43:21.404670 IP 10.12.100.44.64488 > 10.12.19.23.1719: Flags [F], seq 2220042487, win 1024, length 0
11:43:21.404672 IP 10.12.100.44.64488 > 10.12.19.23.19780: Flags [F], seq 2220042487, win 1024, length 0
11:43:21.451053 IP 10.12.100.44.64488 > 10.12.19.23.3351: Flags [F], seq 2220042487, win 1024, length 0
11:43:21.451071 IP 10.12.100.44.64486 > 10.12.19.23.8082: Flags [F], seq 2219911413, win 1024, length 0
11:43:21.451073 IP 10.12.100.44.64486 > 10.12.19.23.543: Flags [F], seq 2219911413, win 1024, length 0
11:43:21.451074 IP 10.12.100.44.64486 > 10.12.19.23.4001: Flags [F], seq 2219911413, win 1024, length 0
11:43:21.451136 IP 10.12.100.44.64486 > 10.12.19.23.1192: Flags [F], seq 2219911413, win 1024, length 0
11:43:21.451138 IP 10.12.100.44.64486 > 10.12.19.23.8701: Flags [F], seq 2219911413, win 1024, length 0
11:43:21.451189 IP 10.12.100.44.64486 > 10.12.19.23.3: Flags [F], seq 2219911413, win 1024, length 0
11:43:21.451191 IP 10.12.100.44.64486 > 10.12.19.23.52822: Flags [F], seq 2219911413, win 1024, length 0
11:43:21.451250 IP 10.12.100.44.64486 > 10.12.19.23.2170: Flags [F], seq 2219911413, win 1024, length 0
11:43:21.451255 IP 10.12.100.44.64486 > 10.12.19.23.873: Flags [F], seq 2219911413, win 1024, length 0
11:43:21.451256 IP 10.12.100.44.64486 > 10.12.19.23.6009: Flags [F], seq 2219911413, win 1024, length 0
11:43:21.451308 IP 10.12.100.44.64486 > 10.12.19.23.1864: Flags [F], seq 2219911413, win 1024, length 0
11:43:21.451310 IP 10.12.100.44.64486 > 10.12.19.23.1062: Flags [F], seq 2219911413, win 1024, length 0
11:43:21.451350 IP 10.12.100.44.64486 > 10.12.19.23.1126: Flags [F], seq 2219911413, win 1024, length 0
11:43:21.451352 IP 10.12.100.44.64486 > 10.12.19.23.5666: Flags [F], seq 2219911413, win 1024, length 0
11:43:21.451395 IP 10.12.100.44.64486 > 10.12.19.23.306: Flags [F], seq 2219911413, win 1024, length 0
11:43:21.451397 IP 10.12.100.44.64486 > 10.12.19.23.2007: Flags [F], seq 2219911413, win 1024, length 0
11:43:21.451439 IP 10.12.100.44.64486 > 10.12.19.23.5003: Flags [F], seq 2219911413, win 1024, length 0
11:43:21.451441 IP 10.12.100.44.64486 > 10.12.19.23.5959: Flags [F], seq 2219911413, win 1024, length 0
11:43:21.451481 IP 10.12.100.44.64486 > 10.12.19.23.57294: Flags [F], seq 2219911413, win 1024, length 0
11:43:21.451483 IP 10.12.100.44.64486 > 10.12.19.23.5280: Flags [F], seq 2219911413, win 1024, length 0
11:43:21.451484 IP 10.12.100.44.64486 > 10.12.19.23.9944: Flags [F], seq 2219911413, win 1024, length 0
11:43:21.451570 IP 10.12.100.44.64486 > 10.12.19.23.5061: Flags [F], seq 2219911413, win 1024, length 0
11:43:21.451572 IP 10.12.100.44.64486 > 10.12.19.23.5120: Flags [F], seq 2219911413, win 1024, length 0
11:43:21.451573 IP 10.12.100.44.64486 > 10.12.19.23.5054: Flags [F], seq 2219911413, win 1024, length 0
11:43:21.451646 IP 10.12.100.44.64486 > 10.12.19.23.4045: Flags [F], seq 2219911413, win 1024, length 0
11:43:21.451649 IP 10.12.100.44.64486 > 10.12.19.23.5414: Flags [F], seq 2219911413, win 1024, length 0
11:43:21.451758 IP 10.12.100.44.64486 > 10.12.19.23.4005: Flags [F], seq 2219911413, win 1024, length 0
11:43:21.451776 IP 10.12.100.44.64486 > 10.12.19.23.541: Flags [F], seq 2219911413, win 1024, length 0
11:43:21.451777 IP 10.12.100.44.64486 > 10.12.19.23.545: Flags [F], seq 2219911413, win 1024, length 0
11:43:21.451779 IP 10.12.100.44.64486 > 10.12.19.23.749: Flags [F], seq 2219911413, win 1024, length 0
11:43:21.451780 IP 10.12.100.44.64486 > 10.12.19.23.3211: Flags [F], seq 2219911413, win 1024, length 0
11:43:21.451781 IP 10.12.100.44.64486 > 10.12.19.23.12174: Flags [F], seq 2219911413, win 1024, length 0
11:43:21.451782 IP 10.12.100.44.64486 > 10.12.19.23.119: Flags [F], seq 2219911413, win 1024, length 0
11:43:21.451817 IP 10.12.100.44.64486 > 10.12.19.23.1091: Flags [F], seq 2219911413, win 1024, length 0
11:43:21.451854 IP 10.12.100.44.64486 > 10.12.19.23.1169: Flags [F], seq 2219911413, win 1024, length 0
11:43:21.451856 IP 10.12.100.44.64486 > 10.12.19.23.1801: Flags [F], seq 2219911413, win 1024, length 0
11:43:21.451892 IP 10.12.100.44.64486 > 10.12.19.23.1065: Flags [F], seq 2219911413, win 1024, length 0
11:43:21.451918 IP 10.12.100.44.64486 > 10.12.19.23.8083: Flags [F], seq 2219911413, win 1024, length 0
11:43:21.451920 IP 10.12.100.44.64486 > 10.12.19.23.3878: Flags [F], seq 2219911413, win 1024, length 0
11:43:21.451956 IP 10.12.100.44.64486 > 10.12.19.23.5051: Flags [F], seq 2219911413, win 1024, length 0
11:43:21.451958 IP 10.12.100.44.64486 > 10.12.19.23.12265: Flags [F], seq 2219911413, win 1024, length 0
11:43:21.451993 IP 10.12.100.44.64486 > 10.12.19.23.32780: Flags [F], seq 2219911413, win 1024, length 0
11:43:21.452054 IP 10.12.100.44.64486 > 10.12.19.23.1028: Flags [F], seq 2219911413, win 1024, length 0
11:43:21.452058 IP 10.12.100.44.64486 > 10.12.19.23.52848: Flags [F], seq 2219911413, win 1024, length 0
11:43:21.452120 IP 10.12.100.44.64486 > 10.12.19.23.8443: Flags [F], seq 2219911413, win 1024, length 0
11:43:21.452123 IP 10.12.100.44.64486 > 10.12.19.23.1107: Flags [F], seq 2219911413, win 1024, length 0
11:43:21.452124 IP 10.12.100.44.64486 > 10.12.19.23.1044: Flags [F], seq 2219911413, win 1024, length 0
11:43:21.452125 IP 10.12.100.44.64486 > 10.12.19.23.2608: Flags [F], seq 2219911413, win 1024, length 0
11:43:21.452170 IP 10.12.100.44.64486 > 10.12.19.23.179: Flags [F], seq 2219911413, win 1024, length 0
11:43:21.454451 IP 10.12.100.44.64486 > 10.12.19.23.211: Flags [F], seq 2219911413, win 1024, length 0
11:43:21.454457 IP 10.12.100.44.64486 > 10.12.19.23.8093: Flags [F], seq 2219911413, win 1024, length 0
11:43:21.454458 IP 10.12.100.44.64486 > 10.12.19.23.7625: Flags [F], seq 2219911413, win 1024, length 0
11:43:21.454503 IP 10.12.100.44.64486 > 10.12.19.23.5962: Flags [F], seq 2219911413, win 1024, length 0
11:43:21.454506 IP 10.12.100.44.64486 > 10.12.19.23.1234: Flags [F], seq 2219911413, win 1024, length 0
11:43:21.454540 IP 10.12.100.44.64486 > 10.12.19.23.125: Flags [F], seq 2219911413, win 1024, length 0
11:43:21.454542 IP 10.12.100.44.64486 > 10.12.19.23.1805: Flags [F], seq 2219911413, win 1024, length 0
11:43:21.454621 IP 10.12.100.44.64486 > 10.12.19.23.1761: Flags [F], seq 2219911413, win 1024, length 0
11:43:21.454624 IP 10.12.100.44.64486 > 10.12.19.23.32777: Flags [F], seq 2219911413, win 1024, length 0
11:43:21.454663 IP 10.12.100.44.64486 > 10.12.19.23.1051: Flags [F], seq 2219911413, win 1024, length 0
11:43:21.454665 IP 10.12.100.44.64486 > 10.12.19.23.1271: Flags [F], seq 2219911413, win 1024, length 0
11:43:21.454705 IP 10.12.100.44.64486 > 10.12.19.23.4002: Flags [F], seq 2219911413, win 1024, length 0
11:43:21.456884 IP 10.12.100.44.64486 > 10.12.19.23.20: Flags [F], seq 2219911413, win 1024, length 0
11:43:21.456892 IP 10.12.100.44.64486 > 10.12.19.23.49176: Flags [F], seq 2219911413, win 1024, length 0
11:43:21.456943 IP 10.12.100.44.64486 > 10.12.19.23.3517: Flags [F], seq 2219911413, win 1024, length 0
11:43:21.501873 IP 10.12.100.44.64487 > 10.12.19.23.4005: Flags [F], seq 2219845876, win 1024, length 0
11:43:21.501904 IP 10.12.100.44.64487 > 10.12.19.23.5414: Flags [F], seq 2219845876, win 1024, length 0
11:43:21.501905 IP 10.12.100.44.64487 > 10.12.19.23.4045: Flags [F], seq 2219845876, win 1024, length 0
11:43:21.501906 IP 10.12.100.44.64487 > 10.12.19.23.5054: Flags [F], seq 2219845876, win 1024, length 0
11:43:21.501907 IP 10.12.100.44.64487 > 10.12.19.23.5120: Flags [F], seq 2219845876, win 1024, length 0
11:43:21.501908 IP 10.12.100.44.64487 > 10.12.19.23.5061: Flags [F], seq 2219845876, win 1024, length 0
11:43:21.501985 IP 10.12.100.44.64487 > 10.12.19.23.9944: Flags [F], seq 2219845876, win 1024, length 0
11:43:21.501988 IP 10.12.100.44.64487 > 10.12.19.23.5280: Flags [F], seq 2219845876, win 1024, length 0
11:43:21.501989 IP 10.12.100.44.64487 > 10.12.19.23.57294: Flags [F], seq 2219845876, win 1024, length 0
11:43:21.501990 IP 10.12.100.44.64487 > 10.12.19.23.5959: Flags [F], seq 2219845876, win 1024, length 0
11:43:21.502065 IP 10.12.100.44.64487 > 10.12.19.23.5003: Flags [F], seq 2219845876, win 1024, length 0
11:43:21.502067 IP 10.12.100.44.64487 > 10.12.19.23.2007: Flags [F], seq 2219845876, win 1024, length 0
11:43:21.502069 IP 10.12.100.44.64487 > 10.12.19.23.306: Flags [F], seq 2219845876, win 1024, length 0
11:43:21.502141 IP 10.12.100.44.64487 > 10.12.19.23.5666: Flags [F], seq 2219845876, win 1024, length 0
11:43:21.502143 IP 10.12.100.44.64487 > 10.12.19.23.1126: Flags [F], seq 2219845876, win 1024, length 0
11:43:21.502210 IP 10.12.100.44.64487 > 10.12.19.23.1062: Flags [F], seq 2219845876, win 1024, length 0
11:43:21.502212 IP 10.12.100.44.64487 > 10.12.19.23.1864: Flags [F], seq 2219845876, win 1024, length 0
11:43:21.502213 IP 10.12.100.44.64487 > 10.12.19.23.6009: Flags [F], seq 2219845876, win 1024, length 0
11:43:21.502262 IP 10.12.100.44.64487 > 10.12.19.23.873: Flags [F], seq 2219845876, win 1024, length 0
11:43:21.502312 IP 10.12.100.44.64487 > 10.12.19.23.2170: Flags [F], seq 2219845876, win 1024, length 0
11:43:21.502314 IP 10.12.100.44.64487 > 10.12.19.23.52822: Flags [F], seq 2219845876, win 1024, length 0
11:43:21.502381 IP 10.12.100.44.64487 > 10.12.19.23.3: Flags [F], seq 2219845876, win 1024, length 0
11:43:21.502383 IP 10.12.100.44.64487 > 10.12.19.23.8701: Flags [F], seq 2219845876, win 1024, length 0
11:43:21.502385 IP 10.12.100.44.64487 > 10.12.19.23.1192: Flags [F], seq 2219845876, win 1024, length 0
11:43:21.502434 IP 10.12.100.44.64487 > 10.12.19.23.4001: Flags [F], seq 2219845876, win 1024, length 0
11:43:21.502483 IP 10.12.100.44.64487 > 10.12.19.23.543: Flags [F], seq 2219845876, win 1024, length 0
11:43:21.502485 IP 10.12.100.44.64487 > 10.12.19.23.8082: Flags [F], seq 2219845876, win 1024, length 0
11:43:21.502536 IP 10.12.100.44.64486 > 10.12.19.23.5904: Flags [F], seq 2219911413, win 1024, length 0
11:43:21.504994 IP 10.12.100.44.64487 > 10.12.19.23.4002: Flags [F], seq 2219845876, win 1024, length 0
11:43:21.505002 IP 10.12.100.44.64487 > 10.12.19.23.1271: Flags [F], seq 2219845876, win 1024, length 0
11:43:21.505003 IP 10.12.100.44.64487 > 10.12.19.23.1051: Flags [F], seq 2219845876, win 1024, length 0
11:43:21.505004 IP 10.12.100.44.64487 > 10.12.19.23.32777: Flags [F], seq 2219845876, win 1024, length 0
11:43:21.505005 IP 10.12.100.44.64487 > 10.12.19.23.1761: Flags [F], seq 2219845876, win 1024, length 0
11:43:21.505055 IP 10.12.100.44.64487 > 10.12.19.23.1805: Flags [F], seq 2219845876, win 1024, length 0
11:43:21.505057 IP 10.12.100.44.64487 > 10.12.19.23.125: Flags [F], seq 2219845876, win 1024, length 0
11:43:21.505059 IP 10.12.100.44.64487 > 10.12.19.23.1234: Flags [F], seq 2219845876, win 1024, length 0
11:43:21.505097 IP 10.12.100.44.64487 > 10.12.19.23.5962: Flags [F], seq 2219845876, win 1024, length 0
11:43:21.505138 IP 10.12.100.44.64487 > 10.12.19.23.7625: Flags [F], seq 2219845876, win 1024, length 0
11:43:21.505209 IP 10.12.100.44.64487 > 10.12.19.23.8093: Flags [F], seq 2219845876, win 1024, length 0
11:43:21.505212 IP 10.12.100.44.64487 > 10.12.19.23.211: Flags [F], seq 2219845876, win 1024, length 0
11:43:21.505277 IP 10.12.100.44.64487 > 10.12.19.23.179: Flags [F], seq 2219845876, win 1024, length 0
11:43:21.505284 IP 10.12.100.44.64487 > 10.12.19.23.2608: Flags [F], seq 2219845876, win 1024, length 0
11:43:21.505286 IP 10.12.100.44.64487 > 10.12.19.23.1044: Flags [F], seq 2219845876, win 1024, length 0
11:43:21.505300 IP 10.12.100.44.64487 > 10.12.19.23.1107: Flags [F], seq 2219845876, win 1024, length 0
11:43:21.505360 IP 10.12.100.44.64487 > 10.12.19.23.8443: Flags [F], seq 2219845876, win 1024, length 0
11:43:21.505362 IP 10.12.100.44.64487 > 10.12.19.23.52848: Flags [F], seq 2219845876, win 1024, length 0
11:43:21.505363 IP 10.12.100.44.64487 > 10.12.19.23.1028: Flags [F], seq 2219845876, win 1024, length 0
11:43:21.505490 IP 10.12.100.44.64487 > 10.12.19.23.32780: Flags [F], seq 2219845876, win 1024, length 0
11:43:21.505497 IP 10.12.100.44.64487 > 10.12.19.23.12265: Flags [F], seq 2219845876, win 1024, length 0
11:43:21.505498 IP 10.12.100.44.64487 > 10.12.19.23.5051: Flags [F], seq 2219845876, win 1024, length 0
11:43:21.505499 IP 10.12.100.44.64487 > 10.12.19.23.3878: Flags [F], seq 2219845876, win 1024, length 0
11:43:21.505560 IP 10.12.100.44.64487 > 10.12.19.23.8083: Flags [F], seq 2219845876, win 1024, length 0
11:43:21.505562 IP 10.12.100.44.64487 > 10.12.19.23.1065: Flags [F], seq 2219845876, win 1024, length 0
11:43:21.505633 IP 10.12.100.44.64487 > 10.12.19.23.1801: Flags [F], seq 2219845876, win 1024, length 0
11:43:21.505635 IP 10.12.100.44.64487 > 10.12.19.23.1169: Flags [F], seq 2219845876, win 1024, length 0
11:43:21.505636 IP 10.12.100.44.64487 > 10.12.19.23.1091: Flags [F], seq 2219845876, win 1024, length 0
11:43:21.505685 IP 10.12.100.44.64487 > 10.12.19.23.119: Flags [F], seq 2219845876, win 1024, length 0
11:43:21.505729 IP 10.12.100.44.64487 > 10.12.19.23.12174: Flags [F], seq 2219845876, win 1024, length 0
11:43:21.505731 IP 10.12.100.44.64487 > 10.12.19.23.3211: Flags [F], seq 2219845876, win 1024, length 0
11:43:21.505875 IP 10.12.100.44.64487 > 10.12.19.23.749: Flags [F], seq 2219845876, win 1024, length 0
11:43:21.505881 IP 10.12.100.44.64487 > 10.12.19.23.545: Flags [F], seq 2219845876, win 1024, length 0
11:43:21.505883 IP 10.12.100.44.64487 > 10.12.19.23.541: Flags [F], seq 2219845876, win 1024, length 0
11:43:21.508339 IP 10.12.100.44.64487 > 10.12.19.23.3517: Flags [F], seq 2219845876, win 1024, length 0
11:43:21.508345 IP 10.12.100.44.64487 > 10.12.19.23.49176: Flags [F], seq 2219845876, win 1024, length 0
11:43:21.508346 IP 10.12.100.44.64487 > 10.12.19.23.20: Flags [F], seq 2219845876, win 1024, length 0
11:43:21.553078 IP 10.12.100.44.64487 > 10.12.19.23.5904: Flags [F], seq 2219845876, win 1024, length 0
11:43:21.553096 IP 10.12.100.44.64488 > 10.12.19.23.8082: Flags [F], seq 2220042487, win 1024, length 0
11:43:21.553097 IP 10.12.100.44.64488 > 10.12.19.23.543: Flags [F], seq 2220042487, win 1024, length 0
11:43:21.553098 IP 10.12.100.44.64488 > 10.12.19.23.4001: Flags [F], seq 2220042487, win 1024, length 0
11:43:21.553111 IP 10.12.100.44.64488 > 10.12.19.23.1192: Flags [F], seq 2220042487, win 1024, length 0
11:43:21.553112 IP 10.12.100.44.64488 > 10.12.19.23.8701: Flags [F], seq 2220042487, win 1024, length 0
11:43:21.553156 IP 10.12.100.44.64488 > 10.12.19.23.3: Flags [F], seq 2220042487, win 1024, length 0
11:43:21.553159 IP 10.12.100.44.64488 > 10.12.19.23.52822: Flags [F], seq 2220042487, win 1024, length 0
11:43:21.553160 IP 10.12.100.44.64488 > 10.12.19.23.2170: Flags [F], seq 2220042487, win 1024, length 0
11:43:21.553270 IP 10.12.100.44.64488 > 10.12.19.23.873: Flags [F], seq 2220042487, win 1024, length 0
11:43:21.553277 IP 10.12.100.44.64488 > 10.12.19.23.6009: Flags [F], seq 2220042487, win 1024, length 0
11:43:21.553278 IP 10.12.100.44.64488 > 10.12.19.23.1864: Flags [F], seq 2220042487, win 1024, length 0
11:43:21.553279 IP 10.12.100.44.64488 > 10.12.19.23.1062: Flags [F], seq 2220042487, win 1024, length 0
11:43:21.553280 IP 10.12.100.44.64488 > 10.12.19.23.1126: Flags [F], seq 2220042487, win 1024, length 0
11:43:21.553327 IP 10.12.100.44.64488 > 10.12.19.23.5666: Flags [F], seq 2220042487, win 1024, length 0
11:43:21.553344 IP 10.12.100.44.64488 > 10.12.19.23.306: Flags [F], seq 2220042487, win 1024, length 0
11:43:21.553398 IP 10.12.100.44.64488 > 10.12.19.23.2007: Flags [F], seq 2220042487, win 1024, length 0
11:43:21.553465 IP 10.12.100.44.64488 > 10.12.19.23.5003: Flags [F], seq 2220042487, win 1024, length 0
11:43:21.553467 IP 10.12.100.44.64488 > 10.12.19.23.5959: Flags [F], seq 2220042487, win 1024, length 0
11:43:21.553468 IP 10.12.100.44.64488 > 10.12.19.23.57294: Flags [F], seq 2220042487, win 1024, length 0
11:43:21.553536 IP 10.12.100.44.64488 > 10.12.19.23.5280: Flags [F], seq 2220042487, win 1024, length 0
11:43:21.553539 IP 10.12.100.44.64488 > 10.12.19.23.9944: Flags [F], seq 2220042487, win 1024, length 0
11:43:21.553540 IP 10.12.100.44.64488 > 10.12.19.23.5061: Flags [F], seq 2220042487, win 1024, length 0
11:43:21.553607 IP 10.12.100.44.64488 > 10.12.19.23.5120: Flags [F], seq 2220042487, win 1024, length 0
11:43:21.553674 IP 10.12.100.44.64488 > 10.12.19.23.5054: Flags [F], seq 2220042487, win 1024, length 0
11:43:21.553676 IP 10.12.100.44.64488 > 10.12.19.23.4045: Flags [F], seq 2220042487, win 1024, length 0
11:43:21.553677 IP 10.12.100.44.64488 > 10.12.19.23.5414: Flags [F], seq 2220042487, win 1024, length 0
11:43:21.553768 IP 10.12.100.44.64488 > 10.12.19.23.4005: Flags [F], seq 2220042487, win 1024, length 0
11:43:21.555952 IP 10.12.100.44.64488 > 10.12.19.23.541: Flags [F], seq 2220042487, win 1024, length 0
