16:19:49.991275 IP 10.12.8.8.5353 > 224.0.0.251.5353: 0*- [0q] 2/0/3 (Cache flush) PTR e2r8p8.local., (Cache flush) PTR e2r8p8.local. (201)
16:19:49.991293 IP6 fe80::10dd:1752:aa4f:2f4a.5353 > ff02::fb.5353: 0*- [0q] 2/0/3 (Cache flush) PTR e2r8p8.local., (Cache flush) PTR e2r8p8.local. (201)
16:19:50.670222 IP 10.12.3.13.57621 > 10.12.255.255.57621: UDP, length 44
16:19:50.684278 IP6 fe80::10dd:1752:aa4f:2f4a > ff02::2: ICMP6, router solicitation, length 16
16:19:50.959464 IP 10.12.8.8.137 > 10.12.255.255.137: NBT UDP PACKET(137): REGISTRATION; REQUEST; BROADCAST
16:19:50.959758 IP 10.12.13.3.137 > 10.12.255.255.137: NBT UDP PACKET(137): REFRESH(8); REQUEST; BROADCAST
16:19:51.159174 ARP, Request who-has 10.12.254.254 tell 10.12.5.2, length 46
16:19:51.458479 IP 10.12.8.8.5353 > 224.0.0.251.5353: 0 [1au] PTR (QM)? _sleep-proxy._udp.local. (64)
16:19:51.458507 IP6 fe80::10dd:1752:aa4f:2f4a.5353 > ff02::fb.5353: 0 [1au] PTR (QM)? _sleep-proxy._udp.local. (64)
16:19:51.601481 IP 10.12.8.8.5353 > 224.0.0.251.5353: 0*- [0q] 15/0/5 (Cache flush) TXT "", PTR _ssh._tcp.local., PTR e2r8p8._ssh._tcp.local., TXT "model=iMac18,3" "osxvers=16", (Cache flush) TXT "", PTR _sftp-ssh._tcp.local., PTR e2r8p8._sftp-ssh._tcp.local., (Cache flush) SRV e2r8p8.local.:22 0 0, (Cache flush) SRV e2r8p8.local.:22 0 0, (Cache flush) TXT "uuid=EDC3E5C2-6A89-5589-A585-2AFBCEA10794", PTR _workstation._tcp.local., PTR e2r8p8 [78:7b:8a:c4:e4:5a]._workstation._tcp.local., (Cache flush) SRV e2r8p8.local.:9 0 0, (Cache flush) AAAA fe80::10dd:1752:aa4f:2f4a, (Cache flush) A 10.12.8.8 (553)
16:19:51.601503 IP6 fe80::10dd:1752:aa4f:2f4a.5353 > ff02::fb.5353: 0*- [0q] 15/0/5 (Cache flush) TXT "", PTR _ssh._tcp.local., PTR e2r8p8._ssh._tcp.local., TXT "model=iMac18,3" "osxvers=16", (Cache flush) TXT "", PTR _sftp-ssh._tcp.local., PTR e2r8p8._sftp-ssh._tcp.local., (Cache flush) SRV e2r8p8.local.:22 0 0, (Cache flush) SRV e2r8p8.local.:22 0 0, (Cache flush) TXT "uuid=EDC3E5C2-6A89-5589-A585-2AFBCEA10794", PTR _workstation._tcp.local., PTR e2r8p8 [78:7b:8a:c4:e4:5a]._workstation._tcp.local., (Cache flush) SRV e2r8p8.local.:9 0 0, (Cache flush) AAAA fe80::10dd:1752:aa4f:2f4a, (Cache flush) A 10.12.8.8 (553)
16:19:52.437279 ARP, Request who-has 10.12.254.254 tell 10.12.5.2, length 46
16:19:52.738679 IP 10.12.5.2.5353 > 224.0.0.251.5353: 0 [14q] [1au] PTR (QU)? _airport._tcp.local. PTR (QU)? _googlecast._tcp.local. PTR (QU)? _airplay._tcp.local. PTR (QU)? _raop._tcp.local. PTR (QU)? _privet._tcp.local. PTR (QU)? _uscan._tcp.local. PTR (QU)? _uscans._tcp.local. PTR (QU)? _ippusb._tcp.local. PTR (QU)? _scanner._tcp.local. PTR (QU)? _ipp._tcp.local. PTR (QU)? _ipps._tcp.local. PTR (QU)? _printer._tcp.local. PTR (QU)? _pdl-datastream._tcp.local. PTR (QU)? _ptp._tcp.local. (246)
16:19:52.738706 IP6 fe80::10dd:2073:d7f6:c153.5353 > ff02::fb.5353: 0 [14q] [1au] PTR (QU)? _airport._tcp.local. PTR (QU)? _googlecast._tcp.local. PTR (QU)? _airplay._tcp.local. PTR (QU)? _raop._tcp.local. PTR (QU)? _privet._tcp.local. PTR (QU)? _uscan._tcp.local. PTR (QU)? _uscans._tcp.local. PTR (QU)? _ippusb._tcp.local. PTR (QU)? _scanner._tcp.local. PTR (QU)? _ipp._tcp.local. PTR (QU)? _ipps._tcp.local. PTR (QU)? _printer._tcp.local. PTR (QU)? _pdl-datastream._tcp.local. PTR (QU)? _ptp._tcp.local. (246)
16:19:52.866924 IP 10.12.8.8.137 > 10.12.255.255.137: NBT UDP PACKET(137): REGISTRATION; REQUEST; BROADCAST
16:19:52.867410 IP 10.12.13.3.137 > 10.12.255.255.137: NBT UDP PACKET(137): REFRESH(8); REQUEST; BROADCAST
16:19:52.960498 IP 10.12.5.2.5353 > 224.0.0.251.5353: 0 [3q] [3n] [1au] ANY (QU)? e2r5p2._ssh._tcp.local. ANY (QU)? e2r5p2._sftp-ssh._tcp.local. ANY (QU)? e2r5p2 [78:7b:8a:c2:e1:9d]._workstation._tcp.local. (199)
16:19:52.960526 IP6 fe80::10dd:2073:d7f6:c153.5353 > ff02::fb.5353: 0 [3q] [3n] [1au] ANY (QU)? e2r5p2._ssh._tcp.local. ANY (QU)? e2r5p2._sftp-ssh._tcp.local. ANY (QU)? e2r5p2 [78:7b:8a:c2:e1:9d]._workstation._tcp.local. (199)
16:19:53.042290 ARP, Request who-has 10.12.19.23 (ff:ff:ff:ff:ff:ff) tell 10.12.100.171, length 46
16:19:53.042306 ARP, Reply 10.12.19.23 is-at 08:00:27:d1:82:df, length 28
16:19:53.210686 IP 10.12.5.2.5353 > 224.0.0.251.5353: 0 [3q] [3n] [1au] ANY (QM)? e2r5p2._ssh._tcp.local. ANY (QM)? e2r5p2._sftp-ssh._tcp.local. ANY (QM)? e2r5p2 [78:7b:8a:c2:e1:9d]._workstation._tcp.local. (199)
16:19:53.210704 IP6 fe80::10dd:2073:d7f6:c153.5353 > ff02::fb.5353: 0 [3q] [3n] [1au] ANY (QM)? e2r5p2._ssh._tcp.local. ANY (QM)? e2r5p2._sftp-ssh._tcp.local. ANY (QM)? e2r5p2 [78:7b:8a:c2:e1:9d]._workstation._tcp.local. (199)
16:19:53.242919 IP 10.12.100.171.64191 > 10.12.19.23.443: Flags [F], seq 4041255758, win 1024, length 0
16:19:53.242948 IP 10.12.19.23.443 > 10.12.100.171.64191: Flags [R.], seq 0, ack 4041255759, win 0, length 0
16:19:53.242961 IP 10.12.100.171.64191 > 10.12.19.23.3389: Flags [F], seq 4041255758, win 1024, length 0
16:19:53.242963 IP 10.12.100.171.64191 > 10.12.19.23.23: Flags [F], seq 4041255758, win 1024, length 0
16:19:53.242964 IP 10.12.100.171.64191 > 10.12.19.23.3306: Flags [F], seq 4041255758, win 1024, length 0
16:19:53.242965 IP 10.12.100.171.64191 > 10.12.19.23.1025: Flags [F], seq 4041255758, win 1024, length 0
16:19:53.243025 IP 10.12.100.171.64191 > 10.12.19.23.21: Flags [F], seq 4041255758, win 1024, length 0
16:19:53.243027 IP 10.12.100.171.64191 > 10.12.19.23.199: Flags [F], seq 4041255758, win 1024, length 0
16:19:53.243028 IP 10.12.100.171.64191 > 10.12.19.23.139: Flags [F], seq 4041255758, win 1024, length 0
16:19:53.243029 IP 10.12.100.171.64191 > 10.12.19.23.113: Flags [F], seq 4041255758, win 1024, length 0
16:19:53.243104 IP 10.12.100.171.64191 > 10.12.19.23.110: Flags [F], seq 4041255758, win 1024, length 0
16:19:53.463160 IP 10.12.5.2.5353 > 224.0.0.251.5353: 0 [3q] [3n] [1au] ANY (QM)? e2r5p2._ssh._tcp.local. ANY (QM)? e2r5p2._sftp-ssh._tcp.local. ANY (QM)? e2r5p2 [78:7b:8a:c2:e1:9d]._workstation._tcp.local. (199)
16:19:53.463175 IP6 fe80::10dd:2073:d7f6:c153.5353 > ff02::fb.5353: 0 [3q] [3n] [1au] ANY (QM)? e2r5p2._ssh._tcp.local. ANY (QM)? e2r5p2._sftp-ssh._tcp.local. ANY (QM)? e2r5p2 [78:7b:8a:c2:e1:9d]._workstation._tcp.local. (199)
16:19:53.712873 IP 10.12.5.2.5353 > 224.0.0.251.5353: 0*- [0q] 13/0/7 (Cache flush) TXT "", PTR _ssh._tcp.local., PTR e2r5p2._ssh._tcp.local., TXT "model=iMac18,3" "osxvers=16", (Cache flush) TXT "", PTR _sftp-ssh._tcp.local., PTR e2r5p2._sftp-ssh._tcp.local., (Cache flush) SRV e2r5p2.local.:22 0 0, (Cache flush) SRV e2r5p2.local.:22 0 0, (Cache flush) TXT "uuid=38891AA8-6CBD-53CF-BC1F-0DD2E655DFBD", PTR _workstation._tcp.local., PTR e2r5p2 [78:7b:8a:c2:e1:9d]._workstation._tcp.local., (Cache flush) SRV e2r5p2.local.:9 0 0 (553)
16:19:53.712904 IP6 fe80::10dd:2073:d7f6:c153.5353 > ff02::fb.5353: 0*- [0q] 13/0/7 (Cache flush) TXT "", PTR _ssh._tcp.local., PTR e2r5p2._ssh._tcp.local., TXT "model=iMac18,3" "osxvers=16", (Cache flush) TXT "", PTR _sftp-ssh._tcp.local., PTR e2r5p2._sftp-ssh._tcp.local., (Cache flush) SRV e2r5p2.local.:22 0 0, (Cache flush) SRV e2r5p2.local.:22 0 0, (Cache flush) TXT "uuid=38891AA8-6CBD-53CF-BC1F-0DD2E655DFBD", PTR _workstation._tcp.local., PTR e2r5p2 [78:7b:8a:c2:e1:9d]._workstation._tcp.local., (Cache flush) SRV e2r5p2.local.:9 0 0 (553)
16:19:53.813546 IP 10.12.5.2.5353 > 224.0.0.251.5353: 0 [14q] [1au] PTR (QM)? _airport._tcp.local. PTR (QM)? _googlecast._tcp.local. PTR (QM)? _airplay._tcp.local. PTR (QM)? _raop._tcp.local. PTR (QM)? _privet._tcp.local. PTR (QM)? _uscan._tcp.local. PTR (QM)? _uscans._tcp.local. PTR (QM)? _ippusb._tcp.local. PTR (QM)? _scanner._tcp.local. PTR (QM)? _ipp._tcp.local. PTR (QM)? _ipps._tcp.local. PTR (QM)? _printer._tcp.local. PTR (QM)? _pdl-datastream._tcp.local. PTR (QM)? _ptp._tcp.local. (246)
16:19:53.813562 IP6 fe80::10dd:2073:d7f6:c153.5353 > ff02::fb.5353: 0 [14q] [1au] PTR (QM)? _airport._tcp.local. PTR (QM)? _googlecast._tcp.local. PTR (QM)? _airplay._tcp.local. PTR (QM)? _raop._tcp.local. PTR (QM)? _privet._tcp.local. PTR (QM)? _uscan._tcp.local. PTR (QM)? _uscans._tcp.local. PTR (QM)? _ippusb._tcp.local. PTR (QM)? _scanner._tcp.local. PTR (QM)? _ipp._tcp.local. PTR (QM)? _ipps._tcp.local. PTR (QM)? _printer._tcp.local. PTR (QM)? _pdl-datastream._tcp.local. PTR (QM)? _ptp._tcp.local. (246)
16:19:53.991243 IP 10.12.8.8.5353 > 224.0.0.251.5353: 0*- [0q] 17/0/7 (Cache flush) TXT "", PTR _ssh._tcp.local., PTR e2r8p8._ssh._tcp.local., TXT "model=iMac18,3" "osxvers=16", (Cache flush) TXT "", PTR _sftp-ssh._tcp.local., PTR e2r8p8._sftp-ssh._tcp.local., (Cache flush) SRV e2r8p8.local.:22 0 0, (Cache flush) SRV e2r8p8.local.:22 0 0, (Cache flush) TXT "uuid=EDC3E5C2-6A89-5589-A585-2AFBCEA10794", PTR _workstation._tcp.local., PTR e2r8p8 [78:7b:8a:c4:e4:5a]._workstation._tcp.local., (Cache flush) SRV e2r8p8.local.:9 0 0, (Cache flush) PTR e2r8p8.local., (Cache flush) PTR e2r8p8.local., (Cache flush) AAAA fe80::10dd:1752:aa4f:2f4a, (Cache flush) A 10.12.8.8 (707)
16:19:53.991258 IP6 fe80::10dd:1752:aa4f:2f4a.5353 > ff02::fb.5353: 0*- [0q] 17/0/7 (Cache flush) TXT "", PTR _ssh._tcp.local., PTR e2r8p8._ssh._tcp.local., TXT "model=iMac18,3" "osxvers=16", (Cache flush) TXT "", PTR _sftp-ssh._tcp.local., PTR e2r8p8._sftp-ssh._tcp.local., (Cache flush) SRV e2r8p8.local.:22 0 0, (Cache flush) SRV e2r8p8.local.:22 0 0, (Cache flush) TXT "uuid=EDC3E5C2-6A89-5589-A585-2AFBCEA10794", PTR _workstation._tcp.local., PTR e2r8p8 [78:7b:8a:c4:e4:5a]._workstation._tcp.local., (Cache flush) SRV e2r8p8.local.:9 0 0, (Cache flush) PTR e2r8p8.local., (Cache flush) PTR e2r8p8.local., (Cache flush) AAAA fe80::10dd:1752:aa4f:2f4a, (Cache flush) A 10.12.8.8 (707)
16:19:54.295168 IP 10.12.100.171.64192 > 10.12.19.23.110: Flags [F], seq 4041321295, win 1024, length 0
16:19:54.295186 IP 10.12.100.171.64192 > 10.12.19.23.113: Flags [F], seq 4041321295, win 1024, length 0
16:19:54.295187 IP 10.12.100.171.64192 > 10.12.19.23.139: Flags [F], seq 4041321295, win 1024, length 0
16:19:54.295188 IP 10.12.100.171.64192 > 10.12.19.23.199: Flags [F], seq 4041321295, win 1024, length 0
16:19:54.295301 IP 10.12.100.171.64192 > 10.12.19.23.21: Flags [F], seq 4041321295, win 1024, length 0
16:19:54.295303 IP 10.12.100.171.64192 > 10.12.19.23.1025: Flags [F], seq 4041321295, win 1024, length 0
16:19:54.295389 IP 10.12.100.171.64192 > 10.12.19.23.3306: Flags [F], seq 4041321295, win 1024, length 0
16:19:54.295489 IP 10.12.100.171.64192 > 10.12.19.23.23: Flags [F], seq 4041321295, win 1024, length 0
16:19:54.295491 IP 10.12.100.171.64192 > 10.12.19.23.3389: Flags [F], seq 4041321295, win 1024, length 0
16:19:54.295578 IP 10.12.100.171.64191 > 10.12.19.23.995: Flags [F], seq 4041255758, win 1024, length 0
16:19:54.295657 IP 10.12.100.171.64191 > 10.12.19.23.587: Flags [F], seq 4041255758, win 1024, length 0
16:19:54.295703 IP 10.12.100.171.64191 > 10.12.19.23.53: Flags [F], seq 4041255758, win 1024, length 0
16:19:54.295815 IP 10.12.100.171.64191 > 10.12.19.23.25: Flags [F], seq 4041255758, win 1024, length 0
16:19:54.295818 IP 10.12.100.171.64191 > 10.12.19.23.445: Flags [F], seq 4041255758, win 1024, length 0
16:19:54.295819 IP 10.12.100.171.64191 > 10.12.19.23.135: Flags [F], seq 4041255758, win 1024, length 0
16:19:54.295820 IP 10.12.100.171.64191 > 10.12.19.23.8080: Flags [F], seq 4041255758, win 1024, length 0
16:19:54.295821 IP 10.12.100.171.64191 > 10.12.19.23.554: Flags [F], seq 4041255758, win 1024, length 0
16:19:54.295868 IP 10.12.100.171.64191 > 10.12.19.23.22: Flags [F], seq 4041255758, win 1024, length 0
16:19:54.295870 IP 10.12.100.171.64191 > 10.12.19.23.143: Flags [F], seq 4041255758, win 1024, length 0
16:19:54.295916 IP 10.12.100.171.64191 > 10.12.19.23.111: Flags [F], seq 4041255758, win 1024, length 0
16:19:54.295918 IP 10.12.100.171.64191 > 10.12.19.23.5900: Flags [F], seq 4041255758, win 1024, length 0
16:19:54.345183 IP 10.12.100.171.64191 > 10.12.19.23.80: Flags [F], seq 4041255758, win 1024, length 0
16:19:54.345209 IP 10.12.100.171.64191 > 10.12.19.23.993: Flags [F], seq 4041255758, win 1024, length 0
16:19:54.347736 IP 10.12.100.171.64192 > 10.12.19.23.5900: Flags [F], seq 4041321295, win 1024, length 0
16:19:54.347756 IP 10.12.100.171.64192 > 10.12.19.23.111: Flags [F], seq 4041321295, win 1024, length 0
16:19:54.347757 IP 10.12.100.171.64192 > 10.12.19.23.143: Flags [F], seq 4041321295, win 1024, length 0
16:19:54.347758 IP 10.12.100.171.64192 > 10.12.19.23.22: Flags [F], seq 4041321295, win 1024, length 0
16:19:54.347759 IP 10.12.100.171.64192 > 10.12.19.23.554: Flags [F], seq 4041321295, win 1024, length 0
16:19:54.347841 IP 10.12.100.171.64192 > 10.12.19.23.8080: Flags [F], seq 4041321295, win 1024, length 0
16:19:54.347843 IP 10.12.100.171.64192 > 10.12.19.23.135: Flags [F], seq 4041321295, win 1024, length 0
16:19:54.347844 IP 10.12.100.171.64192 > 10.12.19.23.445: Flags [F], seq 4041321295, win 1024, length 0
16:19:54.347943 IP 10.12.100.171.64192 > 10.12.19.23.25: Flags [F], seq 4041321295, win 1024, length 0
16:19:54.347963 IP 10.12.100.171.64192 > 10.12.19.23.53: Flags [F], seq 4041321295, win 1024, length 0
16:19:54.347964 IP 10.12.100.171.64192 > 10.12.19.23.587: Flags [F], seq 4041321295, win 1024, length 0
16:19:54.347965 IP 10.12.100.171.64192 > 10.12.19.23.995: Flags [F], seq 4041321295, win 1024, length 0
16:19:54.347966 IP 10.12.100.171.64191 > 10.12.19.23.1720: Flags [F], seq 4041255758, win 1024, length 0
16:19:54.348011 IP 10.12.100.171.64191 > 10.12.19.23.256: Flags [F], seq 4041255758, win 1024, length 0
16:19:54.348013 IP 10.12.100.171.64191 > 10.12.19.23.8888: Flags [F], seq 4041255758, win 1024, length 0
16:19:54.348053 IP 10.12.100.171.64191 > 10.12.19.23.1723: Flags [F], seq 4041255758, win 1024, length 0
16:19:54.348104 IP 10.12.100.171.64191 > 10.12.19.23.5987: Flags [F], seq 4041255758, win 1024, length 0
16:19:54.348108 IP 10.12.100.171.64191 > 10.12.19.23.2119: Flags [F], seq 4041255758, win 1024, length 0
16:19:54.348109 IP 10.12.100.171.64191 > 10.12.19.23.1287: Flags [F], seq 4041255758, win 1024, length 0
16:19:54.395574 IP 10.12.100.171.64192 > 10.12.19.23.993: Flags [F], seq 4041321295, win 1024, length 0
16:19:54.395591 IP 10.12.100.171.64192 > 10.12.19.23.80: Flags [F], seq 4041321295, win 1024, length 0
16:19:54.398026 IP 10.12.100.171.64191 > 10.12.19.23.2800: Flags [F], seq 4041255758, win 1024, length 0
16:19:54.398035 IP 10.12.100.171.64191 > 10.12.19.23.18101: Flags [F], seq 4041255758, win 1024, length 0
16:19:54.398069 IP 10.12.100.171.64191 > 10.12.19.23.2106: Flags [F], seq 4041255758, win 1024, length 0
16:19:54.398071 IP 10.12.100.171.64191 > 10.12.19.23.32773: Flags [F], seq 4041255758, win 1024, length 0
16:19:54.398072 IP 10.12.100.171.64191 > 10.12.19.23.4567: Flags [F], seq 4041255758, win 1024, length 0
16:19:54.398113 IP 10.12.100.171.64191 > 10.12.19.23.30951: Flags [F], seq 4041255758, win 1024, length 0
16:19:54.398147 IP 10.12.100.171.64191 > 10.12.19.23.1049: Flags [F], seq 4041255758, win 1024, length 0
16:19:54.398149 IP 10.12.100.171.64191 > 10.12.19.23.5922: Flags [F], seq 4041255758, win 1024, length 0
16:19:54.398151 IP 10.12.100.171.64191 > 10.12.19.23.12265: Flags [F], seq 4041255758, win 1024, length 0
16:19:54.398189 IP 10.12.100.171.64191 > 10.12.19.23.3301: Flags [F], seq 4041255758, win 1024, length 0
16:19:54.398224 IP 10.12.100.171.64191 > 10.12.19.23.1151: Flags [F], seq 4041255758, win 1024, length 0
16:19:54.400733 IP 10.12.100.171.64192 > 10.12.19.23.1287: Flags [F], seq 4041321295, win 1024, length 0
16:19:54.400738 IP 10.12.100.171.64192 > 10.12.19.23.2119: Flags [F], seq 4041321295, win 1024, length 0
16:19:54.400739 IP 10.12.100.171.64192 > 10.12.19.23.5987: Flags [F], seq 4041321295, win 1024, length 0
16:19:54.400740 IP 10.12.100.171.64192 > 10.12.19.23.1723: Flags [F], seq 4041321295, win 1024, length 0
16:19:54.400787 IP 10.12.100.171.64192 > 10.12.19.23.8888: Flags [F], seq 4041321295, win 1024, length 0
16:19:54.400789 IP 10.12.100.171.64192 > 10.12.19.23.256: Flags [F], seq 4041321295, win 1024, length 0
16:19:54.400829 IP 10.12.100.171.64192 > 10.12.19.23.1720: Flags [F], seq 4041321295, win 1024, length 0
16:19:54.400854 IP 10.12.100.171.64191 > 10.12.19.23.1501: Flags [F], seq 4041255758, win 1024, length 0
16:19:54.445855 IP 10.12.100.171.64191 > 10.12.19.23.6667: Flags [F], seq 4041255758, win 1024, length 0
16:19:54.445875 IP 10.12.100.171.64191 > 10.12.19.23.1085: Flags [F], seq 4041255758, win 1024, length 0
16:19:54.448460 IP 10.12.100.171.64192 > 10.12.19.23.1151: Flags [F], seq 4041321295, win 1024, length 0
16:19:54.448486 IP 10.12.100.171.64192 > 10.12.19.23.3301: Flags [F], seq 4041321295, win 1024, length 0
16:19:54.448487 IP 10.12.100.171.64192 > 10.12.19.23.12265: Flags [F], seq 4041321295, win 1024, length 0
16:19:54.448549 IP 10.12.100.171.64192 > 10.12.19.23.5922: Flags [F], seq 4041321295, win 1024, length 0
16:19:54.448551 IP 10.12.100.171.64192 > 10.12.19.23.1049: Flags [F], seq 4041321295, win 1024, length 0
16:19:54.448552 IP 10.12.100.171.64192 > 10.12.19.23.30951: Flags [F], seq 4041321295, win 1024, length 0
16:19:54.448609 IP 10.12.100.171.64192 > 10.12.19.23.4567: Flags [F], seq 4041321295, win 1024, length 0
16:19:54.448611 IP 10.12.100.171.64192 > 10.12.19.23.32773: Flags [F], seq 4041321295, win 1024, length 0
16:19:54.448747 IP 10.12.100.171.64192 > 10.12.19.23.2106: Flags [F], seq 4041321295, win 1024, length 0
16:19:54.448764 IP 10.12.100.171.64192 > 10.12.19.23.18101: Flags [F], seq 4041321295, win 1024, length 0
16:19:54.448765 IP 10.12.100.171.64192 > 10.12.19.23.2800: Flags [F], seq 4041321295, win 1024, length 0
16:19:54.451127 IP 10.12.100.171.64192 > 10.12.19.23.1501: Flags [F], seq 4041321295, win 1024, length 0
16:19:54.451146 IP 10.12.100.171.64191 > 10.12.19.23.9415: Flags [F], seq 4041255758, win 1024, length 0
16:19:54.451147 IP 10.12.100.171.64191 > 10.12.19.23.5915: Flags [F], seq 4041255758, win 1024, length 0
16:19:54.451148 IP 10.12.100.171.64191 > 10.12.19.23.4998: Flags [F], seq 4041255758, win 1024, length 0
16:19:54.451310 IP 10.12.100.171.64191 > 10.12.19.23.16001: Flags [F], seq 4041255758, win 1024, length 0
16:19:54.451317 IP 10.12.100.171.64191 > 10.12.19.23.2008: Flags [F], seq 4041255758, win 1024, length 0
16:19:54.451318 IP 10.12.100.171.64191 > 10.12.19.23.1524: Flags [F], seq 4041255758, win 1024, length 0
16:19:54.451319 IP 10.12.100.171.64191 > 10.12.19.23.646: Flags [F], seq 4041255758, win 1024, length 0
16:19:54.496077 IP 10.12.100.171.64194 > 10.12.19.23.443: Flags [F], seq 4058032718, win 1024, length 0
16:19:54.496122 IP 10.12.19.23.443 > 10.12.100.171.64194: Flags [R.], seq 0, ack 4058032719, win 0, length 0
16:19:54.496136 IP 10.12.100.171.64192 > 10.12.19.23.1085: Flags [F], seq 4041321295, win 1024, length 0
16:19:54.498506 IP 10.12.100.171.64192 > 10.12.19.23.6667: Flags [F], seq 4041321295, win 1024, length 0
16:19:54.498513 IP 10.12.100.171.64191 > 10.12.19.23.1947: Flags [F], seq 4041255758, win 1024, length 0
16:19:54.501042 IP 10.12.100.171.64191 > 10.12.19.23.16992: Flags [F], seq 4041255758, win 1024, length 0
16:19:54.501047 IP 10.12.100.171.64191 > 10.12.19.23.7920: Flags [F], seq 4041255758, win 1024, length 0
16:19:54.501048 IP 10.12.100.171.64191 > 10.12.19.23.9099: Flags [F], seq 4041255758, win 1024, length 0
16:19:54.501049 IP 10.12.100.171.64191 > 10.12.19.23.3851: Flags [F], seq 4041255758, win 1024, length 0
16:19:54.501118 IP 10.12.100.171.64191 > 10.12.19.23.6004: Flags [F], seq 4041255758, win 1024, length 0
16:19:54.501120 IP 10.12.100.171.64191 > 10.12.19.23.1443: Flags [F], seq 4041255758, win 1024, length 0
16:19:54.501121 IP 10.12.100.171.64191 > 10.12.19.23.32783: Flags [F], seq 4041255758, win 1024, length 0
16:19:54.501122 IP 10.12.100.171.64191 > 10.12.19.23.280: Flags [F], seq 4041255758, win 1024, length 0
16:19:54.501184 IP 10.12.100.171.64191 > 10.12.19.23.5822: Flags [F], seq 4041255758, win 1024, length 0
16:19:54.503483 IP 10.12.100.171.64192 > 10.12.19.23.646: Flags [F], seq 4041321295, win 1024, length 0
16:19:54.503489 IP 10.12.100.171.64192 > 10.12.19.23.1524: Flags [F], seq 4041321295, win 1024, length 0
16:19:54.503490 IP 10.12.100.171.64192 > 10.12.19.23.2008: Flags [F], seq 4041321295, win 1024, length 0
16:19:54.503491 IP 10.12.100.171.64192 > 10.12.19.23.16001: Flags [F], seq 4041321295, win 1024, length 0
16:19:54.503553 IP 10.12.100.171.64192 > 10.12.19.23.4998: Flags [F], seq 4041321295, win 1024, length 0
16:19:54.503556 IP 10.12.100.171.64192 > 10.12.19.23.5915: Flags [F], seq 4041321295, win 1024, length 0
16:19:54.503557 IP 10.12.100.171.64192 > 10.12.19.23.9415: Flags [F], seq 4041321295, win 1024, length 0
16:19:54.503652 IP 10.12.100.171.64191 > 10.12.19.23.9081: Flags [F], seq 4041255758, win 1024, length 0
16:19:54.553805 IP 10.12.100.171.64192 > 10.12.19.23.9081: Flags [F], seq 4041321295, win 1024, length 0
16:19:54.604182 IP 10.12.100.171.64192 > 10.12.19.23.5822: Flags [F], seq 4041321295, win 1024, length 0
16:19:54.656959 IP 10.12.100.171.64192 > 10.12.19.23.280: Flags [F], seq 4041321295, win 1024, length 0
16:19:54.656978 IP 10.12.100.171.64192 > 10.12.19.23.32783: Flags [F], seq 4041321295, win 1024, length 0
16:19:54.656979 IP 10.12.100.171.64192 > 10.12.19.23.1443: Flags [F], seq 4041321295, win 1024, length 0
16:19:54.656980 IP 10.12.100.171.64192 > 10.12.19.23.6004: Flags [F], seq 4041321295, win 1024, length 0
16:19:54.656981 IP 10.12.100.171.64192 > 10.12.19.23.3851: Flags [F], seq 4041321295, win 1024, length 0
16:19:54.657019 IP 10.12.100.171.64192 > 10.12.19.23.9099: Flags [F], seq 4041321295, win 1024, length 0
16:19:54.657021 IP 10.12.100.171.64192 > 10.12.19.23.7920: Flags [F], seq 4041321295, win 1024, length 0
16:19:54.657022 IP 10.12.100.171.64192 > 10.12.19.23.16992: Flags [F], seq 4041321295, win 1024, length 0
16:19:54.657107 IP 10.12.100.171.64192 > 10.12.19.23.1947: Flags [F], seq 4041321295, win 1024, length 0
16:19:54.657109 IP 10.12.100.171.64191 > 10.12.19.23.4449: Flags [F], seq 4041255758, win 1024, length 0
16:19:54.657110 IP 10.12.100.171.64191 > 10.12.19.23.89: Flags [F], seq 4041255758, win 1024, length 0
16:19:54.657163 IP 10.12.100.171.64191 > 10.12.19.23.109: Flags [F], seq 4041255758, win 1024, length 0
16:19:54.657210 IP 10.12.100.171.64191 > 10.12.19.23.2601: Flags [F], seq 4041255758, win 1024, length 0
16:19:54.657212 IP 10.12.100.171.64191 > 10.12.19.23.7000: Flags [F], seq 4041255758, win 1024, length 0
16:19:54.657213 IP 10.12.100.171.64191 > 10.12.19.23.911: Flags [F], seq 4041255758, win 1024, length 0
16:19:54.657214 IP 10.12.100.171.64191 > 10.12.19.23.2500: Flags [F], seq 4041255758, win 1024, length 0
16:19:54.707300 IP 10.12.100.171.64192 > 10.12.19.23.2601: Flags [F], seq 4041321295, win 1024, length 0
16:19:54.707321 IP 10.12.100.171.64192 > 10.12.19.23.109: Flags [F], seq 4041321295, win 1024, length 0
16:19:54.707323 IP 10.12.100.171.64192 > 10.12.19.23.89: Flags [F], seq 4041321295, win 1024, length 0
16:19:54.707324 IP 10.12.100.171.64192 > 10.12.19.23.4449: Flags [F], seq 4041321295, win 1024, length 0
16:19:54.707369 IP 10.12.100.171.64191 > 10.12.19.23.22939: Flags [F], seq 4041255758, win 1024, length 0
16:19:54.707371 IP 10.12.100.171.64191 > 10.12.19.23.32770: Flags [F], seq 4041255758, win 1024, length 0
16:19:54.707373 IP 10.12.100.171.64191 > 10.12.19.23.3814: Flags [F], seq 4041255758, win 1024, length 0
16:19:54.707440 IP 10.12.100.171.64191 > 10.12.19.23.12000: Flags [F], seq 4041255758, win 1024, length 0
16:19:54.707442 IP 10.12.100.171.64191 > 10.12.19.23.3493: Flags [F], seq 4041255758, win 1024, length 0
16:19:54.707443 IP 10.12.100.171.64191 > 10.12.19.23.5555: Flags [F], seq 4041255758, win 1024, length 0
16:19:54.707483 IP 10.12.100.171.64191 > 10.12.19.23.4446: Flags [F], seq 4041255758, win 1024, length 0
16:19:54.707516 IP 10.12.100.171.64191 > 10.12.19.23.1600: Flags [F], seq 4041255758, win 1024, length 0
16:19:54.707518 IP 10.12.100.171.64191 > 10.12.19.23.6100: Flags [F], seq 4041255758, win 1024, length 0
16:19:54.709979 IP 10.12.100.171.64192 > 10.12.19.23.2500: Flags [F], seq 4041321295, win 1024, length 0
16:19:54.709984 IP 10.12.100.171.64192 > 10.12.19.23.911: Flags [F], seq 4041321295, win 1024, length 0
16:19:54.709985 IP 10.12.100.171.64192 > 10.12.19.23.7000: Flags [F], seq 4041321295, win 1024, length 0
16:19:54.713084 IP 10.12.5.2.5353 > 224.0.0.251.5353: 0*- [0q] 13/0/7 (Cache flush) TXT "", PTR _ssh._tcp.local., PTR e2r5p2._ssh._tcp.local., TXT "model=iMac18,3" "osxvers=16", (Cache flush) TXT "", PTR _sftp-ssh._tcp.local., PTR e2r5p2._sftp-ssh._tcp.local., (Cache flush) SRV e2r5p2.local.:22 0 0, (Cache flush) SRV e2r5p2.local.:22 0 0, (Cache flush) TXT "uuid=38891AA8-6CBD-53CF-BC1F-0DD2E655DFBD", PTR _workstation._tcp.local., PTR e2r5p2 [78:7b:8a:c2:e1:9d]._workstation._tcp.local., (Cache flush) SRV e2r5p2.local.:9 0 0 (553)
16:19:54.713093 IP6 fe80::10dd:2073:d7f6:c153.5353 > ff02::fb.5353: 0*- [0q] 13/0/7 (Cache flush) TXT "", PTR _ssh._tcp.local., PTR e2r5p2._ssh._tcp.local., TXT "model=iMac18,3" "osxvers=16", (Cache flush) TXT "", PTR _sftp-ssh._tcp.local., PTR e2r5p2._sftp-ssh._tcp.local., (Cache flush) SRV e2r5p2.local.:22 0 0, (Cache flush) SRV e2r5p2.local.:22 0 0, (Cache flush) TXT "uuid=38891AA8-6CBD-53CF-BC1F-0DD2E655DFBD", PTR _workstation._tcp.local., PTR e2r5p2 [78:7b:8a:c2:e1:9d]._workstation._tcp.local., (Cache flush) SRV e2r5p2.local.:9 0 0 (553)
16:19:54.757780 IP 10.12.100.171.64192 > 10.12.19.23.6100: Flags [F], seq 4041321295, win 1024, length 0
16:19:54.757786 IP 10.12.100.171.64192 > 10.12.19.23.1600: Flags [F], seq 4041321295, win 1024, length 0
16:19:54.757828 IP 10.12.100.171.64192 > 10.12.19.23.4446: Flags [F], seq 4041321295, win 1024, length 0
16:19:54.757830 IP 10.12.100.171.64192 > 10.12.19.23.5555: Flags [F], seq 4041321295, win 1024, length 0
16:19:54.757831 IP 10.12.100.171.64192 > 10.12.19.23.3493: Flags [F], seq 4041321295, win 1024, length 0
16:19:54.757871 IP 10.12.100.171.64192 > 10.12.19.23.12000: Flags [F], seq 4041321295, win 1024, length 0
16:19:54.757873 IP 10.12.100.171.64192 > 10.12.19.23.3814: Flags [F], seq 4041321295, win 1024, length 0
16:19:54.757874 IP 10.12.100.171.64192 > 10.12.19.23.32770: Flags [F], seq 4041321295, win 1024, length 0
16:19:54.758038 IP 10.12.100.171.64192 > 10.12.19.23.22939: Flags [F], seq 4041321295, win 1024, length 0
16:19:54.758043 IP 10.12.100.171.64191 > 10.12.19.23.9878: Flags [F], seq 4041255758, win 1024, length 0
16:19:54.758044 IP 10.12.100.171.64191 > 10.12.19.23.9944: Flags [F], seq 4041255758, win 1024, length 0
16:19:54.758045 IP 10.12.100.171.64191 > 10.12.19.23.765: Flags [F], seq 4041255758, win 1024, length 0
16:19:54.758123 IP 10.12.100.171.64191 > 10.12.19.23.8042: Flags [F], seq 4041255758, win 1024, length 0
16:19:54.760662 IP 10.12.100.171.64191 > 10.12.19.23.4111: Flags [F], seq 4041255758, win 1024, length 0
16:19:54.760667 IP 10.12.100.171.64191 > 10.12.19.23.84: Flags [F], seq 4041255758, win 1024, length 0
16:19:54.760668 IP 10.12.100.171.64191 > 10.12.19.23.3517: Flags [F], seq 4041255758, win 1024, length 0
16:19:54.808285 IP 10.12.100.171.64192 > 10.12.19.23.8042: Flags [F], seq 4041321295, win 1024, length 0
16:19:54.808302 IP 10.12.100.171.64192 > 10.12.19.23.765: Flags [F], seq 4041321295, win 1024, length 0
16:19:54.808304 IP 10.12.100.171.64192 > 10.12.19.23.9944: Flags [F], seq 4041321295, win 1024, length 0
16:19:54.808304 IP 10.12.100.171.64192 > 10.12.19.23.9878: Flags [F], seq 4041321295, win 1024, length 0
16:19:54.808305 IP 10.12.100.171.64191 > 10.12.19.23.1002: Flags [F], seq 4041255758, win 1024, length 0
16:19:54.808360 IP 10.12.100.171.64191 > 10.12.19.23.32769: Flags [F], seq 4041255758, win 1024, length 0
16:19:54.808362 IP 10.12.100.171.64191 > 10.12.19.23.8099: Flags [F], seq 4041255758, win 1024, length 0
16:19:54.808363 IP 10.12.100.171.64191 > 10.12.19.23.2190: Flags [F], seq 4041255758, win 1024, length 0
16:19:54.808364 IP 10.12.100.171.64191 > 10.12.19.23.9111: Flags [F], seq 4041255758, win 1024, length 0
16:19:54.808433 IP 10.12.100.171.64191 > 10.12.19.23.88: Flags [F], seq 4041255758, win 1024, length 0
16:19:54.808435 IP 10.12.100.171.64191 > 10.12.19.23.17: Flags [F], seq 4041255758, win 1024, length 0
16:19:54.808436 IP 10.12.100.171.64191 > 10.12.19.23.8443: Flags [F], seq 4041255758, win 1024, length 0
16:19:54.808536 IP 10.12.100.171.64191 > 10.12.19.23.1163: Flags [F], seq 4041255758, win 1024, length 0
16:19:54.811117 IP 10.12.100.171.64192 > 10.12.19.23.3517: Flags [F], seq 4041321295, win 1024, length 0
16:19:54.811122 IP 10.12.100.171.64192 > 10.12.19.23.84: Flags [F], seq 4041321295, win 1024, length 0
16:19:54.811123 IP 10.12.100.171.64192 > 10.12.19.23.4111: Flags [F], seq 4041321295, win 1024, length 0
16:19:54.858444 IP 10.12.100.171.64191 > 10.12.19.23.8088: Flags [F], seq 4041255758, win 1024, length 0
16:19:54.858463 IP 10.12.100.171.64191 > 10.12.19.23.9999: Flags [F], seq 4041255758, win 1024, length 0
16:19:54.858464 IP 10.12.100.171.64191 > 10.12.19.23.32785: Flags [F], seq 4041255758, win 1024, length 0
16:19:54.858553 IP 10.12.100.171.64191 > 10.12.19.23.10001: Flags [F], seq 4041255758, win 1024, length 0
16:19:54.860845 IP 10.12.100.171.64192 > 10.12.19.23.1163: Flags [F], seq 4041321295, win 1024, length 0
16:19:54.860851 IP 10.12.100.171.64192 > 10.12.19.23.8443: Flags [F], seq 4041321295, win 1024, length 0
16:19:54.860852 IP 10.12.100.171.64192 > 10.12.19.23.17: Flags [F], seq 4041321295, win 1024, length 0
16:19:54.860853 IP 10.12.100.171.64192 > 10.12.19.23.88: Flags [F], seq 4041321295, win 1024, length 0
16:19:54.860898 IP 10.12.100.171.64192 > 10.12.19.23.9111: Flags [F], seq 4041321295, win 1024, length 0
16:19:54.860900 IP 10.12.100.171.64192 > 10.12.19.23.2190: Flags [F], seq 4041321295, win 1024, length 0
16:19:54.860901 IP 10.12.100.171.64192 > 10.12.19.23.8099: Flags [F], seq 4041321295, win 1024, length 0
16:19:54.861027 IP 10.12.100.171.64192 > 10.12.19.23.32769: Flags [F], seq 4041321295, win 1024, length 0
16:19:54.861045 IP 10.12.100.171.64192 > 10.12.19.23.1002: Flags [F], seq 4041321295, win 1024, length 0
16:19:54.863265 IP 10.12.100.171.64191 > 10.12.19.23.8300: Flags [F], seq 4041255758, win 1024, length 0
16:19:54.863283 IP 10.12.100.171.64191 > 10.12.19.23.2047: Flags [F], seq 4041255758, win 1024, length 0
16:19:54.863284 IP 10.12.100.171.64191 > 10.12.19.23.4004: Flags [F], seq 4041255758, win 1024, length 0
16:19:54.909657 IP 10.12.100.171.64192 > 10.12.19.23.10001: Flags [F], seq 4041321295, win 1024, length 0
16:19:54.909675 IP 10.12.100.171.64192 > 10.12.19.23.32785: Flags [F], seq 4041321295, win 1024, length 0
16:19:54.909676 IP 10.12.100.171.64192 > 10.12.19.23.9999: Flags [F], seq 4041321295, win 1024, length 0
16:19:54.909678 IP 10.12.100.171.64192 > 10.12.19.23.8088: Flags [F], seq 4041321295, win 1024, length 0
16:19:54.911870 IP 10.12.100.171.64191 > 10.12.19.23.50389: Flags [F], seq 4041255758, win 1024, length 0
16:19:54.911877 IP 10.12.100.171.64191 > 10.12.19.23.1687: Flags [F], seq 4041255758, win 1024, length 0
16:19:54.911930 IP 10.12.100.171.64191 > 10.12.19.23.4006: Flags [F], seq 4041255758, win 1024, length 0
16:19:54.911933 IP 10.12.100.171.64191 > 10.12.19.23.6646: Flags [F], seq 4041255758, win 1024, length 0
16:19:54.911934 IP 10.12.100.171.64191 > 10.12.19.23.9009: Flags [F], seq 4041255758, win 1024, length 0
16:19:54.911971 IP 10.12.100.171.64191 > 10.12.19.23.2179: Flags [F], seq 4041255758, win 1024, length 0
16:19:54.911974 IP 10.12.100.171.64191 > 10.12.19.23.1812: Flags [F], seq 4041255758, win 1024, length 0
16:19:54.911975 IP 10.12.100.171.64191 > 10.12.19.23.691: Flags [F], seq 4041255758, win 1024, length 0
16:19:54.912017 IP 10.12.100.171.64191 > 10.12.19.23.2910: Flags [F], seq 4041255758, win 1024, length 0
16:19:54.914124 IP 10.12.100.171.64192 > 10.12.19.23.4004: Flags [F], seq 4041321295, win 1024, length 0
16:19:54.914130 IP 10.12.100.171.64192 > 10.12.19.23.2047: Flags [F], seq 4041321295, win 1024, length 0
16:19:54.914131 IP 10.12.100.171.64192 > 10.12.19.23.8300: Flags [F], seq 4041321295, win 1024, length 0
16:19:54.960116 IP 10.12.100.171.64191 > 10.12.19.23.41511: Flags [F], seq 4041255758, win 1024, length 0
16:19:54.960135 IP 10.12.100.171.64191 > 10.12.19.23.7496: Flags [F], seq 4041255758, win 1024, length 0
16:19:54.960136 IP 10.12.100.171.64191 > 10.12.19.23.2006: Flags [F], seq 4041255758, win 1024, length 0
16:19:54.960137 IP 10.12.100.171.64191 > 10.12.19.23.5080: Flags [F], seq 4041255758, win 1024, length 0
16:19:54.962653 IP 10.12.100.171.64192 > 10.12.19.23.2910: Flags [F], seq 4041321295, win 1024, length 0
16:19:54.962660 IP 10.12.100.171.64192 > 10.12.19.23.691: Flags [F], seq 4041321295, win 1024, length 0
16:19:54.962661 IP 10.12.100.171.64192 > 10.12.19.23.1812: Flags [F], seq 4041321295, win 1024, length 0
16:19:54.962661 IP 10.12.100.171.64192 > 10.12.19.23.2179: Flags [F], seq 4041321295, win 1024, length 0
16:19:54.962730 IP 10.12.100.171.64192 > 10.12.19.23.9009: Flags [F], seq 4041321295, win 1024, length 0
16:19:54.962732 IP 10.12.100.171.64192 > 10.12.19.23.6646: Flags [F], seq 4041321295, win 1024, length 0
16:19:54.962733 IP 10.12.100.171.64192 > 10.12.19.23.4006: Flags [F], seq 4041321295, win 1024, length 0
16:19:54.962734 IP 10.12.100.171.64192 > 10.12.19.23.1687: Flags [F], seq 4041321295, win 1024, length 0
16:19:54.962791 IP 10.12.100.171.64192 > 10.12.19.23.50389: Flags [F], seq 4041321295, win 1024, length 0
16:19:54.965238 IP 10.12.100.171.64191 > 10.12.19.23.56738: Flags [F], seq 4041255758, win 1024, length 0
16:19:54.965243 IP 10.12.100.171.64191 > 10.12.19.23.163: Flags [F], seq 4041255758, win 1024, length 0
16:19:54.965244 IP 10.12.100.171.64191 > 10.12.19.23.1023: Flags [F], seq 4041255758, win 1024, length 0
16:19:55.010541 IP 10.12.100.171.64192 > 10.12.19.23.5080: Flags [F], seq 4041321295, win 1024, length 0
16:19:55.010571 IP 10.12.100.171.64192 > 10.12.19.23.2006: Flags [F], seq 4041321295, win 1024, length 0
16:19:55.010572 IP 10.12.100.171.64192 > 10.12.19.23.7496: Flags [F], seq 4041321295, win 1024, length 0
16:19:55.010573 IP 10.12.100.171.64192 > 10.12.19.23.41511: Flags [F], seq 4041321295, win 1024, length 0
16:19:55.013009 IP 10.12.100.171.64191 > 10.12.19.23.1533: Flags [F], seq 4041255758, win 1024, length 0
16:19:55.013016 IP 10.12.100.171.64191 > 10.12.19.23.2811: Flags [F], seq 4041255758, win 1024, length 0
16:19:55.013017 IP 10.12.100.171.64191 > 10.12.19.23.722: Flags [F], seq 4041255758, win 1024, length 0
16:19:55.013018 IP 10.12.100.171.64191 > 10.12.19.23.8001: Flags [F], seq 4041255758, win 1024, length 0
16:19:55.013108 IP 10.12.100.171.64191 > 10.12.19.23.666: Flags [F], seq 4041255758, win 1024, length 0
16:19:55.013110 IP 10.12.100.171.64191 > 10.12.19.23.49154: Flags [F], seq 4041255758, win 1024, length 0
16:19:55.013162 IP 10.12.100.171.64191 > 10.12.19.23.2920: Flags [F], seq 4041255758, win 1024, length 0
16:19:55.013244 IP 10.12.100.171.64191 > 10.12.19.23.254: Flags [F], seq 4041255758, win 1024, length 0
16:19:55.013261 IP 10.12.100.171.64191 > 10.12.19.23.5190: Flags [F], seq 4041255758, win 1024, length 0
16:19:55.015656 IP 10.12.100.171.64192 > 10.12.19.23.1023: Flags [F], seq 4041321295, win 1024, length 0
16:19:55.015663 IP 10.12.100.171.64192 > 10.12.19.23.163: Flags [F], seq 4041321295, win 1024, length 0
16:19:55.015664 IP 10.12.100.171.64192 > 10.12.19.23.56738: Flags [F], seq 4041321295, win 1024, length 0
16:19:55.060861 IP 10.12.100.171.64191 > 10.12.19.23.11967: Flags [F], seq 4041255758, win 1024, length 0
16:19:55.060880 IP 10.12.100.171.64191 > 10.12.19.23.146: Flags [F], seq 4041255758, win 1024, length 0
16:19:55.060881 IP 10.12.100.171.64191 > 10.12.19.23.3880: Flags [F], seq 4041255758, win 1024, length 0
16:19:55.060882 IP 10.12.100.171.64191 > 10.12.19.23.5560: Flags [F], seq 4041255758, win 1024, length 0
16:19:55.063257 IP 10.12.100.171.64192 > 10.12.19.23.254: Flags [F], seq 4041321295, win 1024, length 0
16:19:55.063263 IP 10.12.100.171.64192 > 10.12.19.23.2920: Flags [F], seq 4041321295, win 1024, length 0
16:19:55.063310 IP 10.12.100.171.64192 > 10.12.19.23.49154: Flags [F], seq 4041321295, win 1024, length 0
16:19:55.063313 IP 10.12.100.171.64192 > 10.12.19.23.666: Flags [F], seq 4041321295, win 1024, length 0
16:19:55.063314 IP 10.12.100.171.64192 > 10.12.19.23.8001: Flags [F], seq 4041321295, win 1024, length 0
16:19:55.063315 IP 10.12.100.171.64192 > 10.12.19.23.722: Flags [F], seq 4041321295, win 1024, length 0
16:19:55.063502 IP 10.12.100.171.64192 > 10.12.19.23.2811: Flags [F], seq 4041321295, win 1024, length 0
16:19:55.063525 IP 10.12.100.171.64192 > 10.12.19.23.1533: Flags [F], seq 4041321295, win 1024, length 0
16:19:55.065676 IP 10.12.100.171.64192 > 10.12.19.23.5190: Flags [F], seq 4041321295, win 1024, length 0
16:19:55.065682 IP 10.12.100.171.64191 > 10.12.19.23.1594: Flags [F], seq 4041255758, win 1024, length 0
16:19:55.065683 IP 10.12.100.171.64191 > 10.12.19.23.705: Flags [F], seq 4041255758, win 1024, length 0
16:19:55.068029 IP 10.12.100.171.64191 > 10.12.19.23.541: Flags [F], seq 4041255758, win 1024, length 0
16:19:55.111216 IP 10.12.100.171.64192 > 10.12.19.23.5560: Flags [F], seq 4041321295, win 1024, length 0
16:19:55.111246 IP 10.12.100.171.64192 > 10.12.19.23.3880: Flags [F], seq 4041321295, win 1024, length 0
16:19:55.111247 IP 10.12.100.171.64192 > 10.12.19.23.146: Flags [F], seq 4041321295, win 1024, length 0
16:19:55.111248 IP 10.12.100.171.64192 > 10.12.19.23.11967: Flags [F], seq 4041321295, win 1024, length 0
16:19:55.113842 IP 10.12.100.171.64191 > 10.12.19.23.6001: Flags [F], seq 4041255758, win 1024, length 0
16:19:55.113848 IP 10.12.100.171.64191 > 10.12.19.23.40193: Flags [F], seq 4041255758, win 1024, length 0
16:19:55.113927 IP 10.12.100.171.64191 > 10.12.19.23.2967: Flags [F], seq 4041255758, win 1024, length 0
16:19:55.113929 IP 10.12.100.171.64191 > 10.12.19.23.10012: Flags [F], seq 4041255758, win 1024, length 0
16:19:55.113979 IP 10.12.100.171.64191 > 10.12.19.23.514: Flags [F], seq 4041255758, win 1024, length 0
16:19:55.114081 IP 10.12.100.171.64191 > 10.12.19.23.1165: Flags [F], seq 4041255758, win 1024, length 0
16:19:55.114087 IP 10.12.100.171.64191 > 10.12.19.23.1073: Flags [F], seq 4041255758, win 1024, length 0
16:19:55.114088 IP 10.12.100.171.64191 > 10.12.19.23.1108: Flags [F], seq 4041255758, win 1024, length 0
16:19:55.116480 IP 10.12.100.171.64192 > 10.12.19.23.705: Flags [F], seq 4041321295, win 1024, length 0
16:19:55.116494 IP 10.12.100.171.64192 > 10.12.19.23.1594: Flags [F], seq 4041321295, win 1024, length 0
16:19:55.116495 IP 10.12.100.171.64191 > 10.12.19.23.3809: Flags [F], seq 4041255758, win 1024, length 0
16:19:55.118750 IP 10.12.100.171.64192 > 10.12.19.23.541: Flags [F], seq 4041321295, win 1024, length 0
16:19:55.161407 IP 10.12.100.171.64191 > 10.12.19.23.10003: Flags [F], seq 4041255758, win 1024, length 0
16:19:55.161414 IP 10.12.100.171.64191 > 10.12.19.23.19842: Flags [F], seq 4041255758, win 1024, length 0
16:19:55.161415 IP 10.12.100.171.64191 > 10.12.19.23.1147: Flags [F], seq 4041255758, win 1024, length 0
16:19:55.161416 IP 10.12.100.171.64191 > 10.12.19.23.161: Flags [F], seq 4041255758, win 1024, length 0
16:19:55.164167 IP 10.12.100.171.64192 > 10.12.19.23.1108: Flags [F], seq 4041321295, win 1024, length 0
16:19:55.164187 IP 10.12.100.171.64192 > 10.12.19.23.1073: Flags [F], seq 4041321295, win 1024, length 0
16:19:55.164189 IP 10.12.100.171.64192 > 10.12.19.23.1165: Flags [F], seq 4041321295, win 1024, length 0
16:19:55.164190 IP 10.12.100.171.64192 > 10.12.19.23.514: Flags [F], seq 4041321295, win 1024, length 0
16:19:55.164250 IP 10.12.100.171.64192 > 10.12.19.23.10012: Flags [F], seq 4041321295, win 1024, length 0
16:19:55.164252 IP 10.12.100.171.64192 > 10.12.19.23.2967: Flags [F], seq 4041321295, win 1024, length 0
16:19:55.164253 IP 10.12.100.171.64192 > 10.12.19.23.40193: Flags [F], seq 4041321295, win 1024, length 0
