16:18:56.442910 IP 10.12.10.1.5353 > 224.0.0.251.5353: 0 [10q] PTR (QM)? _privet._tcp.local. PTR (QM)? _uscan._tcp.local. PTR (QM)? _uscans._tcp.local. PTR (QM)? _ippusb._tcp.local. PTR (QM)? _scanner._tcp.local. PTR (QM)? _ipp._tcp.local. PTR (QM)? _ipps._tcp.local. PTR (QM)? _printer._tcp.local. PTR (QM)? _pdl-datastream._tcp.local. PTR (QM)? _ptp._tcp.local. (163)
16:18:56.442937 IP6 fe80::10ff:9e5:978:2f7e.5353 > ff02::fb.5353: 0 [10q] PTR (QM)? _privet._tcp.local. PTR (QM)? _uscan._tcp.local. PTR (QM)? _uscans._tcp.local. PTR (QM)? _ippusb._tcp.local. PTR (QM)? _scanner._tcp.local. PTR (QM)? _ipp._tcp.local. PTR (QM)? _ipps._tcp.local. PTR (QM)? _printer._tcp.local. PTR (QM)? _pdl-datastream._tcp.local. PTR (QM)? _ptp._tcp.local. (163)
16:18:57.402921 IP 10.12.3.13.57621 > 10.12.255.255.57621: UDP, length 44
16:18:57.962921 ARP, Request who-has 10.12.19.23 (ff:ff:ff:ff:ff:ff) tell 10.12.100.171, length 46
16:18:57.962936 ARP, Reply 10.12.19.23 is-at 08:00:27:d1:82:df, length 28
16:18:58.163645 IP 10.12.100.171.44369 > 10.12.19.23.22: Flags [none], win 1024, length 0
16:18:58.163662 IP 10.12.100.171.44369 > 10.12.19.23.5900: Flags [none], win 1024, length 0
16:18:58.163664 IP 10.12.100.171.44369 > 10.12.19.23.256: Flags [none], win 1024, length 0
16:18:58.163664 IP 10.12.100.171.44369 > 10.12.19.23.554: Flags [none], win 1024, length 0
16:18:58.163665 IP 10.12.100.171.44369 > 10.12.19.23.8888: Flags [none], win 1024, length 0
16:18:58.163705 IP 10.12.100.171.44369 > 10.12.19.23.993: Flags [none], win 1024, length 0
16:18:58.163708 IP 10.12.100.171.44369 > 10.12.19.23.25: Flags [none], win 1024, length 0
16:18:58.163708 IP 10.12.100.171.44369 > 10.12.19.23.80: Flags [none], win 1024, length 0
16:18:58.163859 IP 10.12.100.171.44369 > 10.12.19.23.8080: Flags [none], win 1024, length 0
16:18:58.163864 IP 10.12.100.171.44369 > 10.12.19.23.1025: Flags [none], win 1024, length 0
16:18:59.214439 IP 10.12.100.171.44370 > 10.12.19.23.1025: Flags [none], win 1024, length 0
16:18:59.214457 IP 10.12.100.171.44370 > 10.12.19.23.8080: Flags [none], win 1024, length 0
16:18:59.214458 IP 10.12.100.171.44370 > 10.12.19.23.80: Flags [none], win 1024, length 0
16:18:59.214560 IP 10.12.100.171.44370 > 10.12.19.23.25: Flags [none], win 1024, length 0
16:18:59.214756 IP 10.12.100.171.44370 > 10.12.19.23.993: Flags [none], win 1024, length 0
16:18:59.214761 IP 10.12.100.171.44370 > 10.12.19.23.8888: Flags [none], win 1024, length 0
16:18:59.214762 IP 10.12.100.171.44370 > 10.12.19.23.554: Flags [none], win 1024, length 0
16:18:59.214803 IP 10.12.100.171.44370 > 10.12.19.23.256: Flags [none], win 1024, length 0
16:18:59.214806 IP 10.12.100.171.44370 > 10.12.19.23.5900: Flags [none], win 1024, length 0
16:18:59.214807 IP 10.12.100.171.44370 > 10.12.19.23.22: Flags [none], win 1024, length 0
16:18:59.264532 IP 10.12.100.171.44369 > 10.12.19.23.3389: Flags [none], win 1024, length 0
16:18:59.264551 IP 10.12.100.171.44369 > 10.12.19.23.199: Flags [none], win 1024, length 0
16:18:59.266948 IP 10.12.100.171.44369 > 10.12.19.23.135: Flags [none], win 1024, length 0
16:18:59.266969 IP 10.12.100.171.44369 > 10.12.19.23.1723: Flags [none], win 1024, length 0
16:18:59.266970 IP 10.12.100.171.44369 > 10.12.19.23.1720: Flags [none], win 1024, length 0
16:18:59.267066 IP 10.12.100.171.44369 > 10.12.19.23.113: Flags [none], win 1024, length 0
16:18:59.267068 IP 10.12.100.171.44369 > 10.12.19.23.53: Flags [none], win 1024, length 0
16:18:59.267145 IP 10.12.100.171.44369 > 10.12.19.23.111: Flags [none], win 1024, length 0
16:18:59.267147 IP 10.12.100.171.44369 > 10.12.19.23.587: Flags [none], win 1024, length 0
16:18:59.267255 IP 10.12.100.171.44369 > 10.12.19.23.3306: Flags [none], win 1024, length 0
16:18:59.314870 IP 10.12.100.171.44370 > 10.12.19.23.199: Flags [none], win 1024, length 0
16:18:59.314887 IP 10.12.100.171.44370 > 10.12.19.23.3389: Flags [none], win 1024, length 0
16:18:59.317235 IP 10.12.100.171.44370 > 10.12.19.23.587: Flags [none], win 1024, length 0
16:18:59.317240 IP 10.12.100.171.44370 > 10.12.19.23.111: Flags [none], win 1024, length 0
16:18:59.317242 IP 10.12.100.171.44370 > 10.12.19.23.53: Flags [none], win 1024, length 0
16:18:59.317242 IP 10.12.100.171.44370 > 10.12.19.23.113: Flags [none], win 1024, length 0
16:18:59.317290 IP 10.12.100.171.44370 > 10.12.19.23.1720: Flags [none], win 1024, length 0
16:18:59.317292 IP 10.12.100.171.44370 > 10.12.19.23.1723: Flags [none], win 1024, length 0
16:18:59.317293 IP 10.12.100.171.44370 > 10.12.19.23.135: Flags [none], win 1024, length 0
16:18:59.319745 IP 10.12.100.171.44370 > 10.12.19.23.3306: Flags [none], win 1024, length 0
16:18:59.365047 IP 10.12.100.171.44369 > 10.12.19.23.445: Flags [none], win 1024, length 0
16:18:59.365066 IP 10.12.100.171.44369 > 10.12.19.23.21: Flags [none], win 1024, length 0
16:18:59.367675 IP 10.12.100.171.44369 > 10.12.19.23.139: Flags [none], win 1024, length 0
16:18:59.367683 IP 10.12.100.171.44369 > 10.12.19.23.23: Flags [none], win 1024, length 0
16:18:59.367684 IP 10.12.100.171.44369 > 10.12.19.23.443: Flags [none], win 1024, length 0
16:18:59.367700 IP 10.12.19.23.443 > 10.12.100.171.44369: Flags [R.], seq 0, ack 2300591161, win 0, length 0
16:18:59.367712 IP 10.12.100.171.44369 > 10.12.19.23.995: Flags [none], win 1024, length 0
16:18:59.367800 IP 10.12.100.171.44369 > 10.12.19.23.110: Flags [none], win 1024, length 0
16:18:59.367802 IP 10.12.100.171.44369 > 10.12.19.23.143: Flags [none], win 1024, length 0
16:18:59.367803 IP 10.12.100.171.44369 > 10.12.19.23.1783: Flags [none], win 1024, length 0
16:18:59.370269 IP 10.12.100.171.44369 > 10.12.19.23.389: Flags [none], win 1024, length 0
16:18:59.415311 IP 10.12.100.171.44370 > 10.12.19.23.21: Flags [none], win 1024, length 0
16:18:59.415329 IP 10.12.100.171.44370 > 10.12.19.23.445: Flags [none], win 1024, length 0
16:18:59.417992 IP 10.12.100.171.44370 > 10.12.19.23.1783: Flags [none], win 1024, length 0
16:18:59.417999 IP 10.12.100.171.44370 > 10.12.19.23.143: Flags [none], win 1024, length 0
16:18:59.418000 IP 10.12.100.171.44370 > 10.12.19.23.110: Flags [none], win 1024, length 0
16:18:59.418046 IP 10.12.100.171.44370 > 10.12.19.23.995: Flags [none], win 1024, length 0
16:18:59.418048 IP 10.12.100.171.44370 > 10.12.19.23.443: Flags [none], win 1024, length 0
16:18:59.418063 IP 10.12.19.23.443 > 10.12.100.171.44370: Flags [R.], seq 0, ack 2300656696, win 0, length 0
16:18:59.418074 IP 10.12.100.171.44370 > 10.12.19.23.23: Flags [none], win 1024, length 0
16:18:59.418151 IP 10.12.100.171.44370 > 10.12.19.23.139: Flags [none], win 1024, length 0
16:18:59.420621 IP 10.12.100.171.44370 > 10.12.19.23.389: Flags [none], win 1024, length 0
16:18:59.449319 IP 10.12.10.1.5353 > 224.0.0.251.5353: 0 [10q] PTR (QM)? _privet._tcp.local. PTR (QM)? _uscan._tcp.local. PTR (QM)? _uscans._tcp.local. PTR (QM)? _ippusb._tcp.local. PTR (QM)? _scanner._tcp.local. PTR (QM)? _ipp._tcp.local. PTR (QM)? _ipps._tcp.local. PTR (QM)? _printer._tcp.local. PTR (QM)? _pdl-datastream._tcp.local. PTR (QM)? _ptp._tcp.local. (163)
16:18:59.449328 IP6 fe80::10ff:9e5:978:2f7e.5353 > ff02::fb.5353: 0 [10q] PTR (QM)? _privet._tcp.local. PTR (QM)? _uscan._tcp.local. PTR (QM)? _uscans._tcp.local. PTR (QM)? _ippusb._tcp.local. PTR (QM)? _scanner._tcp.local. PTR (QM)? _ipp._tcp.local. PTR (QM)? _ipps._tcp.local. PTR (QM)? _printer._tcp.local. PTR (QM)? _pdl-datastream._tcp.local. PTR (QM)? _ptp._tcp.local. (163)
16:18:59.465584 IP 10.12.100.171.44369 > 10.12.19.23.9101: Flags [none], win 1024, length 0
16:18:59.465589 IP 10.12.100.171.44369 > 10.12.19.23.2909: Flags [none], win 1024, length 0
16:18:59.468461 IP 10.12.100.171.44369 > 10.12.19.23.8084: Flags [none], win 1024, length 0
16:18:59.468466 IP 10.12.100.171.44369 > 10.12.19.23.19350: Flags [none], win 1024, length 0
16:18:59.468468 IP 10.12.100.171.44369 > 10.12.19.23.1352: Flags [none], win 1024, length 0
16:18:59.468469 IP 10.12.100.171.44369 > 10.12.19.23.800: Flags [none], win 1024, length 0
16:18:59.468514 IP 10.12.100.171.44369 > 10.12.19.23.3301: Flags [none], win 1024, length 0
16:18:59.468516 IP 10.12.100.171.44369 > 10.12.19.23.6006: Flags [none], win 1024, length 0
16:18:59.468556 IP 10.12.100.171.44369 > 10.12.19.23.5566: Flags [none], win 1024, length 0
16:18:59.470871 IP 10.12.100.171.44369 > 10.12.19.23.3371: Flags [none], win 1024, length 0
16:18:59.515963 IP 10.12.100.171.44370 > 10.12.19.23.2909: Flags [none], win 1024, length 0
16:18:59.515980 IP 10.12.100.171.44370 > 10.12.19.23.9101: Flags [none], win 1024, length 0
16:18:59.518868 IP 10.12.100.171.44370 > 10.12.19.23.5566: Flags [none], win 1024, length 0
16:18:59.518874 IP 10.12.100.171.44370 > 10.12.19.23.6006: Flags [none], win 1024, length 0
16:18:59.518875 IP 10.12.100.171.44370 > 10.12.19.23.3301: Flags [none], win 1024, length 0
16:18:59.518876 IP 10.12.100.171.44370 > 10.12.19.23.800: Flags [none], win 1024, length 0
16:18:59.518953 IP 10.12.100.171.44370 > 10.12.19.23.1352: Flags [none], win 1024, length 0
16:18:59.519007 IP 10.12.100.171.44370 > 10.12.19.23.19350: Flags [none], win 1024, length 0
16:18:59.519009 IP 10.12.100.171.44370 > 10.12.19.23.8084: Flags [none], win 1024, length 0
16:18:59.521551 IP 10.12.100.171.44370 > 10.12.19.23.3371: Flags [none], win 1024, length 0
16:19:00.061697 IP 10.12.10.1.5353 > 224.0.0.251.5353: 0 [4q] PTR (QM)? _airport._tcp.local. PTR (QM)? _googlecast._tcp.local. PTR (QM)? _airplay._tcp.local. PTR (QM)? _raop._tcp.local. (82)
16:19:00.061712 IP6 fe80::10ff:9e5:978:2f7e.5353 > ff02::fb.5353: 0 [4q] PTR (QM)? _airport._tcp.local. PTR (QM)? _googlecast._tcp.local. PTR (QM)? _airplay._tcp.local. PTR (QM)? _raop._tcp.local. (82)
16:19:00.573034 IP 10.12.100.171.44371 > 10.12.19.23.3371: Flags [none], win 1024, length 0
16:19:00.573078 IP 10.12.100.171.44371 > 10.12.19.23.8084: Flags [none], win 1024, length 0
16:19:00.573079 IP 10.12.100.171.44371 > 10.12.19.23.19350: Flags [none], win 1024, length 0
16:19:00.573080 IP 10.12.100.171.44371 > 10.12.19.23.1352: Flags [none], win 1024, length 0
16:19:00.573081 IP 10.12.100.171.44371 > 10.12.19.23.800: Flags [none], win 1024, length 0
16:19:00.573142 IP 10.12.100.171.44371 > 10.12.19.23.3301: Flags [none], win 1024, length 0
16:19:00.573144 IP 10.12.100.171.44371 > 10.12.19.23.6006: Flags [none], win 1024, length 0
16:19:00.573145 IP 10.12.100.171.44371 > 10.12.19.23.5566: Flags [none], win 1024, length 0
16:19:00.623110 IP 10.12.100.171.44371 > 10.12.19.23.9101: Flags [none], win 1024, length 0
16:19:00.623127 IP 10.12.100.171.44371 > 10.12.19.23.2909: Flags [none], win 1024, length 0
16:19:00.623129 IP 10.12.100.171.44371 > 10.12.19.23.389: Flags [none], win 1024, length 0
16:19:00.625674 IP 10.12.100.171.44371 > 10.12.19.23.139: Flags [none], win 1024, length 0
16:19:00.625680 IP 10.12.100.171.44371 > 10.12.19.23.23: Flags [none], win 1024, length 0
16:19:00.625681 IP 10.12.100.171.44371 > 10.12.19.23.995: Flags [none], win 1024, length 0
16:19:00.625763 IP 10.12.100.171.44371 > 10.12.19.23.110: Flags [none], win 1024, length 0
16:19:00.625768 IP 10.12.100.171.44371 > 10.12.19.23.143: Flags [none], win 1024, length 0
16:19:00.673235 IP 10.12.100.171.44372 > 10.12.19.23.443: Flags [none], win 1024, length 0
16:19:00.673260 IP 10.12.19.23.443 > 10.12.100.171.44372: Flags [R.], seq 0, ack 2283814201, win 0, length 0
16:19:00.673273 IP 10.12.100.171.44371 > 10.12.19.23.1783: Flags [none], win 1024, length 0
16:19:00.673275 IP 10.12.100.171.44371 > 10.12.19.23.445: Flags [none], win 1024, length 0
16:19:00.676183 IP 10.12.100.171.44371 > 10.12.19.23.21: Flags [none], win 1024, length 0
16:19:00.676188 IP 10.12.100.171.44371 > 10.12.19.23.3306: Flags [none], win 1024, length 0
16:19:00.676189 IP 10.12.100.171.44371 > 10.12.19.23.135: Flags [none], win 1024, length 0
16:19:00.676190 IP 10.12.100.171.44371 > 10.12.19.23.1723: Flags [none], win 1024, length 0
16:19:00.676236 IP 10.12.100.171.44371 > 10.12.19.23.1720: Flags [none], win 1024, length 0
16:19:00.726750 IP 10.12.100.171.44371 > 10.12.19.23.113: Flags [none], win 1024, length 0
16:19:00.779560 IP 10.12.100.171.44371 > 10.12.19.23.53: Flags [none], win 1024, length 0
16:19:00.779577 IP 10.12.100.171.44371 > 10.12.19.23.111: Flags [none], win 1024, length 0
16:19:00.779578 IP 10.12.100.171.44371 > 10.12.19.23.587: Flags [none], win 1024, length 0
16:19:00.779579 IP 10.12.100.171.44371 > 10.12.19.23.3389: Flags [none], win 1024, length 0
16:19:00.779580 IP 10.12.100.171.44371 > 10.12.19.23.199: Flags [none], win 1024, length 0
16:19:00.829567 IP 10.12.100.171.44371 > 10.12.19.23.22: Flags [none], win 1024, length 0
16:19:00.829596 IP 10.12.100.171.44371 > 10.12.19.23.5900: Flags [none], win 1024, length 0
16:19:00.831700 IP 10.12.100.171.44371 > 10.12.19.23.256: Flags [none], win 1024, length 0
16:19:00.831706 IP 10.12.100.171.44371 > 10.12.19.23.554: Flags [none], win 1024, length 0
16:19:00.831757 IP 10.12.100.171.44371 > 10.12.19.23.8888: Flags [none], win 1024, length 0
16:19:00.880348 IP 10.12.100.171.44371 > 10.12.19.23.993: Flags [none], win 1024, length 0
16:19:00.880365 IP 10.12.100.171.44371 > 10.12.19.23.25: Flags [none], win 1024, length 0
16:19:00.882735 IP 10.12.100.171.44371 > 10.12.19.23.80: Flags [none], win 1024, length 0
16:19:00.882749 IP 10.12.100.171.44371 > 10.12.19.23.8080: Flags [none], win 1024, length 0
16:19:00.882801 IP 10.12.100.171.44371 > 10.12.19.23.1025: Flags [none], win 1024, length 0
16:19:00.931474 IP 10.12.100.171.44369 > 10.12.19.23.2710: Flags [none], win 1024, length 0
16:19:00.931490 IP 10.12.100.171.44369 > 10.12.19.23.1721: Flags [none], win 1024, length 0
16:19:00.933606 IP 10.12.100.171.44369 > 10.12.19.23.5825: Flags [none], win 1024, length 0
16:19:00.933613 IP 10.12.100.171.44369 > 10.12.19.23.4000: Flags [none], win 1024, length 0
16:19:00.933615 IP 10.12.100.171.44369 > 10.12.19.23.24800: Flags [none], win 1024, length 0
16:19:00.982494 IP 10.12.100.171.44370 > 10.12.19.23.1721: Flags [none], win 1024, length 0
16:19:00.982511 IP 10.12.100.171.44370 > 10.12.19.23.2710: Flags [none], win 1024, length 0
16:19:00.985034 IP 10.12.100.171.44370 > 10.12.19.23.24800: Flags [none], win 1024, length 0
16:19:00.985052 IP 10.12.100.171.44370 > 10.12.19.23.4000: Flags [none], win 1024, length 0
16:19:00.985053 IP 10.12.100.171.44370 > 10.12.19.23.5825: Flags [none], win 1024, length 0
16:19:01.032632 IP 10.12.100.171.44371 > 10.12.19.23.1721: Flags [none], win 1024, length 0
16:19:01.035069 IP 10.12.100.171.44371 > 10.12.19.23.5825: Flags [none], win 1024, length 0
16:19:01.035088 IP 10.12.100.171.44371 > 10.12.19.23.4000: Flags [none], win 1024, length 0
16:19:01.035089 IP 10.12.100.171.44371 > 10.12.19.23.24800: Flags [none], win 1024, length 0
16:19:01.035090 IP 10.12.100.171.44371 > 10.12.19.23.2710: Flags [none], win 1024, length 0
16:19:01.082743 IP 10.12.100.171.44369 > 10.12.19.23.2910: Flags [none], win 1024, length 0
16:19:01.085567 IP 10.12.100.171.44369 > 10.12.19.23.50006: Flags [none], win 1024, length 0
16:19:01.085572 IP 10.12.100.171.44369 > 10.12.19.23.1024: Flags [none], win 1024, length 0
16:19:01.085573 IP 10.12.100.171.44369 > 10.12.19.23.8031: Flags [none], win 1024, length 0
16:19:01.085640 IP 10.12.100.171.44369 > 10.12.19.23.4998: Flags [none], win 1024, length 0
16:19:01.133001 IP 10.12.100.171.44370 > 10.12.19.23.2910: Flags [none], win 1024, length 0
16:19:01.136091 IP 10.12.100.171.44370 > 10.12.19.23.4998: Flags [none], win 1024, length 0
16:19:01.136096 IP 10.12.100.171.44370 > 10.12.19.23.8031: Flags [none], win 1024, length 0
16:19:01.136098 IP 10.12.100.171.44370 > 10.12.19.23.1024: Flags [none], win 1024, length 0
16:19:01.136099 IP 10.12.100.171.44370 > 10.12.19.23.50006: Flags [none], win 1024, length 0
16:19:01.183087 IP 10.12.100.171.44371 > 10.12.19.23.2910: Flags [none], win 1024, length 0
16:19:01.186747 IP 10.12.100.171.44371 > 10.12.19.23.50006: Flags [none], win 1024, length 0
16:19:01.186792 IP 10.12.100.171.44371 > 10.12.19.23.1024: Flags [none], win 1024, length 0
16:19:01.186793 IP 10.12.100.171.44371 > 10.12.19.23.8031: Flags [none], win 1024, length 0
16:19:01.186794 IP 10.12.100.171.44371 > 10.12.19.23.4998: Flags [none], win 1024, length 0
16:19:01.233265 IP 10.12.100.171.44369 > 10.12.19.23.5903: Flags [none], win 1024, length 0
16:19:01.237300 IP 10.12.100.171.44369 > 10.12.19.23.1045: Flags [none], win 1024, length 0
16:19:01.237306 IP 10.12.100.171.44369 > 10.12.19.23.5051: Flags [none], win 1024, length 0
16:19:01.237307 IP 10.12.100.171.44369 > 10.12.19.23.7777: Flags [none], win 1024, length 0
16:19:01.237353 IP 10.12.100.171.44369 > 10.12.19.23.7800: Flags [none], win 1024, length 0
16:19:01.283326 IP 10.12.100.171.44370 > 10.12.19.23.5903: Flags [none], win 1024, length 0
16:19:01.288061 IP 10.12.100.171.44370 > 10.12.19.23.7800: Flags [none], win 1024, length 0
16:19:01.288067 IP 10.12.100.171.44370 > 10.12.19.23.7777: Flags [none], win 1024, length 0
16:19:01.288068 IP 10.12.100.171.44370 > 10.12.19.23.5051: Flags [none], win 1024, length 0
16:19:01.288104 IP 10.12.100.171.44370 > 10.12.19.23.1045: Flags [none], win 1024, length 0
16:19:01.334503 IP 10.12.100.171.44371 > 10.12.19.23.5903: Flags [none], win 1024, length 0
16:19:01.338573 IP 10.12.100.171.44371 > 10.12.19.23.1045: Flags [none], win 1024, length 0
16:19:01.338578 IP 10.12.100.171.44371 > 10.12.19.23.5051: Flags [none], win 1024, length 0
16:19:01.338579 IP 10.12.100.171.44371 > 10.12.19.23.7777: Flags [none], win 1024, length 0
16:19:01.338580 IP 10.12.100.171.44371 > 10.12.19.23.7800: Flags [none], win 1024, length 0
16:19:01.384758 IP 10.12.100.171.44369 > 10.12.19.23.5910: Flags [none], win 1024, length 0
16:19:01.389074 IP 10.12.100.171.44369 > 10.12.19.23.52848: Flags [none], win 1024, length 0
16:19:01.389100 IP 10.12.100.171.44369 > 10.12.19.23.2383: Flags [none], win 1024, length 0
16:19:01.389101 IP 10.12.100.171.44369 > 10.12.19.23.12345: Flags [none], win 1024, length 0
16:19:01.389102 IP 10.12.100.171.44369 > 10.12.19.23.2998: Flags [none], win 1024, length 0
16:19:01.435533 IP 10.12.100.171.44370 > 10.12.19.23.5910: Flags [none], win 1024, length 0
16:19:01.439712 IP 10.12.100.171.44370 > 10.12.19.23.2998: Flags [none], win 1024, length 0
16:19:01.439735 IP 10.12.100.171.44370 > 10.12.19.23.12345: Flags [none], win 1024, length 0
16:19:01.439737 IP 10.12.100.171.44370 > 10.12.19.23.2383: Flags [none], win 1024, length 0
16:19:01.439737 IP 10.12.100.171.44370 > 10.12.19.23.52848: Flags [none], win 1024, length 0
16:19:01.485883 IP 10.12.100.171.44371 > 10.12.19.23.5910: Flags [none], win 1024, length 0
16:19:01.490267 IP 10.12.100.171.44371 > 10.12.19.23.52848: Flags [none], win 1024, length 0
16:19:01.490272 IP 10.12.100.171.44371 > 10.12.19.23.2383: Flags [none], win 1024, length 0
16:19:01.490273 IP 10.12.100.171.44371 > 10.12.19.23.12345: Flags [none], win 1024, length 0
16:19:01.490274 IP 10.12.100.171.44371 > 10.12.19.23.2998: Flags [none], win 1024, length 0
16:19:01.536178 IP 10.12.100.171.44369 > 10.12.19.23.211: Flags [none], win 1024, length 0
16:19:01.540959 IP 10.12.100.171.44369 > 10.12.19.23.19780: Flags [none], win 1024, length 0
16:19:01.540966 IP 10.12.100.171.44369 > 10.12.19.23.7999: Flags [none], win 1024, length 0
16:19:01.540967 IP 10.12.100.171.44369 > 10.12.19.23.1063: Flags [none], win 1024, length 0
16:19:01.541027 IP 10.12.100.171.44369 > 10.12.19.23.1111: Flags [none], win 1024, length 0
16:19:01.586369 IP 10.12.100.171.44370 > 10.12.19.23.211: Flags [none], win 1024, length 0
16:19:01.591711 IP 10.12.100.171.44370 > 10.12.19.23.1111: Flags [none], win 1024, length 0
16:19:01.591717 IP 10.12.100.171.44370 > 10.12.19.23.1063: Flags [none], win 1024, length 0
16:19:01.591719 IP 10.12.100.171.44370 > 10.12.19.23.7999: Flags [none], win 1024, length 0
16:19:01.591720 IP 10.12.100.171.44370 > 10.12.19.23.19780: Flags [none], win 1024, length 0
16:19:01.636583 IP 10.12.100.171.44371 > 10.12.19.23.211: Flags [none], win 1024, length 0
16:19:01.642573 IP 10.12.100.171.44371 > 10.12.19.23.19780: Flags [none], win 1024, length 0
16:19:01.642578 IP 10.12.100.171.44371 > 10.12.19.23.7999: Flags [none], win 1024, length 0
16:19:01.642579 IP 10.12.100.171.44371 > 10.12.19.23.1063: Flags [none], win 1024, length 0
16:19:01.642638 IP 10.12.100.171.44371 > 10.12.19.23.1111: Flags [none], win 1024, length 0
16:19:01.687275 IP 10.12.100.171.44369 > 10.12.19.23.9290: Flags [none], win 1024, length 0
16:19:01.693141 IP 10.12.100.171.44369 > 10.12.19.23.60020: Flags [none], win 1024, length 0
16:19:01.693146 IP 10.12.100.171.44369 > 10.12.19.23.49155: Flags [none], win 1024, length 0
16:19:01.693147 IP 10.12.100.171.44369 > 10.12.19.23.1152: Flags [none], win 1024, length 0
16:19:01.693148 IP 10.12.100.171.44369 > 10.12.19.23.1106: Flags [none], win 1024, length 0
16:19:01.737602 IP 10.12.100.171.44370 > 10.12.19.23.9290: Flags [none], win 1024, length 0
16:19:01.743794 IP 10.12.100.171.44370 > 10.12.19.23.1106: Flags [none], win 1024, length 0
16:19:01.743811 IP 10.12.100.171.44370 > 10.12.19.23.1152: Flags [none], win 1024, length 0
16:19:01.743813 IP 10.12.100.171.44370 > 10.12.19.23.49155: Flags [none], win 1024, length 0
16:19:01.743814 IP 10.12.100.171.44370 > 10.12.19.23.60020: Flags [none], win 1024, length 0
16:19:01.788333 IP 10.12.100.171.44371 > 10.12.19.23.9290: Flags [none], win 1024, length 0
16:19:01.794292 IP 10.12.100.171.44371 > 10.12.19.23.60020: Flags [none], win 1024, length 0
16:19:01.794298 IP 10.12.100.171.44371 > 10.12.19.23.49155: Flags [none], win 1024, length 0
16:19:01.794299 IP 10.12.100.171.44371 > 10.12.19.23.1152: Flags [none], win 1024, length 0
16:19:01.794300 IP 10.12.100.171.44371 > 10.12.19.23.1106: Flags [none], win 1024, length 0
16:19:01.838866 IP 10.12.100.171.44369 > 10.12.19.23.5033: Flags [none], win 1024, length 0
16:19:01.845263 IP 10.12.100.171.44369 > 10.12.19.23.513: Flags [none], win 1024, length 0
16:19:01.845269 IP 10.12.100.171.44369 > 10.12.19.23.514: Flags [none], win 1024, length 0
16:19:01.845270 IP 10.12.100.171.44369 > 10.12.19.23.1095: Flags [none], win 1024, length 0
16:19:01.845321 IP 10.12.100.171.44369 > 10.12.19.23.2366: Flags [none], win 1024, length 0
16:19:01.876321 IP 10.12.10.1.57621 > 10.12.255.255.57621: UDP, length 44
16:19:01.890239 IP 10.12.100.171.44370 > 10.12.19.23.5033: Flags [none], win 1024, length 0
16:19:01.895439 IP 10.12.100.171.44370 > 10.12.19.23.2366: Flags [none], win 1024, length 0
16:19:01.895444 IP 10.12.100.171.44370 > 10.12.19.23.1095: Flags [none], win 1024, length 0
16:19:01.895445 IP 10.12.100.171.44370 > 10.12.19.23.514: Flags [none], win 1024, length 0
16:19:01.895484 IP 10.12.100.171.44370 > 10.12.19.23.513: Flags [none], win 1024, length 0
16:19:01.940528 IP 10.12.100.171.44373 > 10.12.19.23.443: Flags [none], win 1024, length 0
16:19:01.940549 IP 10.12.19.23.443 > 10.12.100.171.44373: Flags [R.], seq 0, ack 2334146105, win 0, length 0
16:19:01.946018 IP 10.12.100.171.44371 > 10.12.19.23.513: Flags [none], win 1024, length 0
16:19:01.946025 IP 10.12.100.171.44371 > 10.12.19.23.514: Flags [none], win 1024, length 0
16:19:01.946026 IP 10.12.100.171.44371 > 10.12.19.23.1095: Flags [none], win 1024, length 0
16:19:01.946027 IP 10.12.100.171.44371 > 10.12.19.23.2366: Flags [none], win 1024, length 0
16:19:01.959368 IP 10.12.10.1.5353 > 224.0.0.251.5353: 0 PTR (QU)? _spotify-connect._tcp.local. (45)
16:19:01.959376 IP6 fe80::10ff:9e5:978:2f7e.5353 > ff02::fb.5353: 0 PTR (QU)? _spotify-connect._tcp.local. (45)
16:19:01.993277 IP 10.12.100.171.44371 > 10.12.19.23.5033: Flags [none], win 1024, length 0
16:19:01.993293 IP 10.12.100.171.44369 > 10.12.19.23.4449: Flags [none], win 1024, length 0
16:19:01.993294 IP 10.12.100.171.44369 > 10.12.19.23.9418: Flags [none], win 1024, length 0
16:19:01.993295 IP 10.12.100.171.44369 > 10.12.19.23.7: Flags [none], win 1024, length 0
16:19:01.993381 IP 10.12.100.171.44369 > 10.12.19.23.7627: Flags [none], win 1024, length 0
16:19:01.993383 IP 10.12.100.171.44369 > 10.12.19.23.7103: Flags [none], win 1024, length 0
16:19:01.993384 IP 10.12.100.171.44369 > 10.12.19.23.1521: Flags [none], win 1024, length 0
16:19:01.993459 IP 10.12.100.171.44369 > 10.12.19.23.19101: Flags [none], win 1024, length 0
16:19:01.993462 IP 10.12.100.171.44369 > 10.12.19.23.7625: Flags [none], win 1024, length 0
16:19:01.993462 IP 10.12.100.171.44369 > 10.12.19.23.3211: Flags [none], win 1024, length 0
16:19:01.993463 IP 10.12.100.171.44369 > 10.12.19.23.1089: Flags [none], win 1024, length 0
16:19:01.993565 IP 10.12.100.171.44369 > 10.12.19.23.500: Flags [none], win 1024, length 0
16:19:01.993571 IP 10.12.100.171.44369 > 10.12.19.23.1130: Flags [none], win 1024, length 0
16:19:01.993572 IP 10.12.100.171.44369 > 10.12.19.23.1641: Flags [none], win 1024, length 0
16:19:01.993614 IP 10.12.100.171.44369 > 10.12.19.23.2811: Flags [none], win 1024, length 0
16:19:01.993616 IP 10.12.100.171.44369 > 10.12.19.23.1501: Flags [none], win 1024, length 0
16:19:01.993617 IP 10.12.100.171.44369 > 10.12.19.23.5000: Flags [none], win 1024, length 0
16:19:01.993706 IP 10.12.100.171.44369 > 10.12.19.23.1102: Flags [none], win 1024, length 0
16:19:01.993725 IP 10.12.100.171.44369 > 10.12.19.23.9503: Flags [none], win 1024, length 0
16:19:01.993726 IP 10.12.100.171.44369 > 10.12.19.23.8994: Flags [none], win 1024, length 0
16:19:01.993727 IP 10.12.100.171.44369 > 10.12.19.23.3690: Flags [none], win 1024, length 0
16:19:01.993728 IP 10.12.100.171.44369 > 10.12.19.23.8290: Flags [none], win 1024, length 0
16:19:01.993773 IP 10.12.100.171.44369 > 10.12.19.23.34572: Flags [none], win 1024, length 0
16:19:01.993775 IP 10.12.100.171.44369 > 10.12.19.23.3737: Flags [none], win 1024, length 0
16:19:01.993776 IP 10.12.100.171.44369 > 10.12.19.23.1032: Flags [none], win 1024, length 0
16:19:01.993904 IP 10.12.100.171.44369 > 10.12.19.23.7025: Flags [none], win 1024, length 0
16:19:01.993909 IP 10.12.100.171.44369 > 10.12.19.23.32780: Flags [none], win 1024, length 0
16:19:01.993957 IP 10.12.100.171.44369 > 10.12.19.23.1131: Flags [none], win 1024, length 0
16:19:01.993959 IP 10.12.100.171.44369 > 10.12.19.23.21571: Flags [none], win 1024, length 0
16:19:01.993960 IP 10.12.100.171.44369 > 10.12.19.23.62078: Flags [none], win 1024, length 0
16:19:01.993993 IP 10.12.100.171.44369 > 10.12.19.23.2065: Flags [none], win 1024, length 0
16:19:01.993995 IP 10.12.100.171.44369 > 10.12.19.23.3920: Flags [none], win 1024, length 0
16:19:01.993995 IP 10.12.100.171.44369 > 10.12.19.23.40193: Flags [none], win 1024, length 0
16:19:01.994034 IP 10.12.100.171.44369 > 10.12.19.23.1069: Flags [none], win 1024, length 0
16:19:01.994067 IP 10.12.100.171.44369 > 10.12.19.23.1093: Flags [none], win 1024, length 0
16:19:01.994069 IP 10.12.100.171.44369 > 10.12.19.23.2500: Flags [none], win 1024, length 0
16:19:01.994070 IP 10.12.100.171.44369 > 10.12.19.23.1071: Flags [none], win 1024, length 0
16:19:01.994145 IP 10.12.100.171.44369 > 10.12.19.23.8443: Flags [none], win 1024, length 0
16:19:01.994151 IP 10.12.100.171.44369 > 10.12.19.23.34573: Flags [none], win 1024, length 0
16:19:01.994152 IP 10.12.100.171.44369 > 10.12.19.23.1074: Flags [none], win 1024, length 0
16:19:01.994188 IP 10.12.100.171.44369 > 10.12.19.23.726: Flags [none], win 1024, length 0
16:19:01.994190 IP 10.12.100.171.44369 > 10.12.19.23.843: Flags [none], win 1024, length 0
16:19:01.994191 IP 10.12.100.171.44369 > 10.12.19.23.4125: Flags [none], win 1024, length 0
16:19:01.994328 IP 10.12.100.171.44369 > 10.12.19.23.3995: Flags [none], win 1024, length 0
16:19:01.994334 IP 10.12.100.171.44369 > 10.12.19.23.1145: Flags [none], win 1024, length 0
16:19:01.994335 IP 10.12.100.171.44369 > 10.12.19.23.1277: Flags [none], win 1024, length 0
16:19:01.994336 IP 10.12.100.171.44369 > 10.12.19.23.1065: Flags [none], win 1024, length 0
16:19:01.994378 IP 10.12.100.171.44369 > 10.12.19.23.7007: Flags [none], win 1024, length 0
16:19:01.994380 IP 10.12.100.171.44369 > 10.12.19.23.49158: Flags [none], win 1024, length 0
16:19:01.994381 IP 10.12.100.171.44369 > 10.12.19.23.3030: Flags [none], win 1024, length 0
16:19:01.996908 IP 10.12.100.171.44369 > 10.12.19.23.10009: Flags [none], win 1024, length 0
16:19:01.996919 IP 10.12.100.171.44369 > 10.12.19.23.17877: Flags [none], win 1024, length 0
16:19:01.996996 IP 10.12.100.171.44369 > 10.12.19.23.32768: Flags [none], win 1024, length 0
16:19:01.996999 IP 10.12.100.171.44369 > 10.12.19.23.1107: Flags [none], win 1024, length 0
16:19:01.997000 IP 10.12.100.171.44369 > 10.12.19.23.2605: Flags [none], win 1024, length 0
16:19:01.997001 IP 10.12.100.171.44369 > 10.12.19.23.417: Flags [none], win 1024, length 0
16:19:01.997002 IP 10.12.100.171.44369 > 10.12.19.23.3283: Flags [none], win 1024, length 0
16:19:01.997003 IP 10.12.100.171.44369 > 10.12.19.23.2260: Flags [none], win 1024, length 0
16:19:01.997069 IP 10.12.100.171.44369 > 10.12.19.23.106: Flags [none], win 1024, length 0
16:19:01.997071 IP 10.12.100.171.44369 > 10.12.19.23.32775: Flags [none], win 1024, length 0
16:19:01.997072 IP 10.12.100.171.44369 > 10.12.19.23.9040: Flags [none], win 1024, length 0
16:19:01.997130 IP 10.12.100.171.44369 > 10.12.19.23.6580: Flags [none], win 1024, length 0
16:19:01.997133 IP 10.12.100.171.44369 > 10.12.19.23.2399: Flags [none], win 1024, length 0
16:19:01.997134 IP 10.12.100.171.44369 > 10.12.19.23.5915: Flags [none], win 1024, length 0
16:19:01.997135 IP 10.12.100.171.44369 > 10.12.19.23.12000: Flags [none], win 1024, length 0
16:19:02.043483 IP 10.12.100.171.44370 > 10.12.19.23.7103: Flags [none], win 1024, length 0
16:19:02.043501 IP 10.12.100.171.44370 > 10.12.19.23.7627: Flags [none], win 1024, length 0
16:19:02.043502 IP 10.12.100.171.44370 > 10.12.19.23.7: Flags [none], win 1024, length 0
16:19:02.043503 IP 10.12.100.171.44370 > 10.12.19.23.9418: Flags [none], win 1024, length 0
16:19:02.043504 IP 10.12.100.171.44370 > 10.12.19.23.4449: Flags [none], win 1024, length 0
16:19:02.043552 IP 10.12.100.171.44369 > 10.12.19.23.9929: Flags [none], win 1024, length 0
16:19:02.046122 IP 10.12.100.171.44370 > 10.12.19.23.3030: Flags [none], win 1024, length 0
16:19:02.046129 IP 10.12.100.171.44370 > 10.12.19.23.49158: Flags [none], win 1024, length 0
16:19:02.046130 IP 10.12.100.171.44370 > 10.12.19.23.7007: Flags [none], win 1024, length 0
16:19:02.046131 IP 10.12.100.171.44370 > 10.12.19.23.1065: Flags [none], win 1024, length 0
16:19:02.046132 IP 10.12.100.171.44370 > 10.12.19.23.1277: Flags [none], win 1024, length 0
16:19:02.046179 IP 10.12.100.171.44370 > 10.12.19.23.1145: Flags [none], win 1024, length 0
16:19:02.046181 IP 10.12.100.171.44370 > 10.12.19.23.3995: Flags [none], win 1024, length 0
16:19:02.046182 IP 10.12.100.171.44370 > 10.12.19.23.4125: Flags [none], win 1024, length 0
16:19:02.046250 IP 10.12.100.171.44370 > 10.12.19.23.843: Flags [none], win 1024, length 0
16:19:02.046252 IP 10.12.100.171.44370 > 10.12.19.23.726: Flags [none], win 1024, length 0
16:19:02.046253 IP 10.12.100.171.44370 > 10.12.19.23.1074: Flags [none], win 1024, length 0
16:19:02.046253 IP 10.12.100.171.44370 > 10.12.19.23.34573: Flags [none], win 1024, length 0
16:19:02.046315 IP 10.12.100.171.44370 > 10.12.19.23.8443: Flags [none], win 1024, length 0
16:19:02.046317 IP 10.12.100.171.44370 > 10.12.19.23.1071: Flags [none], win 1024, length 0
16:19:02.046318 IP 10.12.100.171.44370 > 10.12.19.23.2500: Flags [none], win 1024, length 0
16:19:02.046389 IP 10.12.100.171.44370 > 10.12.19.23.1093: Flags [none], win 1024, length 0
16:19:02.046392 IP 10.12.100.171.44370 > 10.12.19.23.1069: Flags [none], win 1024, length 0
16:19:02.046393 IP 10.12.100.171.44370 > 10.12.19.23.40193: Flags [none], win 1024, length 0
16:19:02.046444 IP 10.12.100.171.44370 > 10.12.19.23.3920: Flags [none], win 1024, length 0
16:19:02.046481 IP 10.12.100.171.44370 > 10.12.19.23.2065: Flags [none], win 1024, length 0
16:19:02.046483 IP 10.12.100.171.44370 > 10.12.19.23.62078: Flags [none], win 1024, length 0
16:19:02.046484 IP 10.12.100.171.44370 > 10.12.19.23.21571: Flags [none], win 1024, length 0
16:19:02.046522 IP 10.12.100.171.44370 > 10.12.19.23.1131: Flags [none], win 1024, length 0
16:19:02.046555 IP 10.12.100.171.44370 > 10.12.19.23.32780: Flags [none], win 1024, length 0
16:19:02.046556 IP 10.12.100.171.44370 > 10.12.19.23.7025: Flags [none], win 1024, length 0
16:19:02.046557 IP 10.12.100.171.44370 > 10.12.19.23.1032: Flags [none], win 1024, length 0
16:19:02.046595 IP 10.12.100.171.44370 > 10.12.19.23.3737: Flags [none], win 1024, length 0
16:19:02.046634 IP 10.12.100.171.44370 > 10.12.19.23.34572: Flags [none], win 1024, length 0
16:19:02.046636 IP 10.12.100.171.44370 > 10.12.19.23.8290: Flags [none], win 1024, length 0
16:19:02.046637 IP 10.12.100.171.44370 > 10.12.19.23.3690: Flags [none], win 1024, length 0
16:19:02.046638 IP 10.12.100.171.44370 > 10.12.19.23.8994: Flags [none], win 1024, length 0
16:19:02.046706 IP 10.12.100.171.44370 > 10.12.19.23.9503: Flags [none], win 1024, length 0
16:19:02.046708 IP 10.12.100.171.44370 > 10.12.19.23.1102: Flags [none], win 1024, length 0
16:19:02.046709 IP 10.12.100.171.44370 > 10.12.19.23.5000: Flags [none], win 1024, length 0
16:19:02.046765 IP 10.12.100.171.44370 > 10.12.19.23.1501: Flags [none], win 1024, length 0
16:19:02.046767 IP 10.12.100.171.44370 > 10.12.19.23.2811: Flags [none], win 1024, length 0
16:19:02.046768 IP 10.12.100.171.44370 > 10.12.19.23.1641: Flags [none], win 1024, length 0
16:19:02.046805 IP 10.12.100.171.44370 > 10.12.19.23.1130: Flags [none], win 1024, length 0
16:19:02.046832 IP 10.12.100.171.44370 > 10.12.19.23.500: Flags [none], win 1024, length 0
16:19:02.046834 IP 10.12.100.171.44370 > 10.12.19.23.1089: Flags [none], win 1024, length 0
16:19:02.046835 IP 10.12.100.171.44370 > 10.12.19.23.3211: Flags [none], win 1024, length 0
16:19:02.046874 IP 10.12.100.171.44370 > 10.12.19.23.7625: Flags [none], win 1024, length 0
16:19:02.046875 IP 10.12.100.171.44370 > 10.12.19.23.19101: Flags [none], win 1024, length 0
16:19:02.046913 IP 10.12.100.171.44370 > 10.12.19.23.1521: Flags [none], win 1024, length 0
16:19:02.049509 IP 10.12.100.171.44370 > 10.12.19.23.12000: Flags [none], win 1024, length 0
16:19:02.049515 IP 10.12.100.171.44370 > 10.12.19.23.5915: Flags [none], win 1024, length 0
16:19:02.049516 IP 10.12.100.171.44370 > 10.12.19.23.2399: Flags [none], win 1024, length 0
16:19:02.049561 IP 10.12.100.171.44370 > 10.12.19.23.6580: Flags [none], win 1024, length 0
16:19:02.049606 IP 10.12.100.171.44370 > 10.12.19.23.9040: Flags [none], win 1024, length 0
16:19:02.049608 IP 10.12.100.171.44370 > 10.12.19.23.32775: Flags [none], win 1024, length 0
16:19:02.049609 IP 10.12.100.171.44370 > 10.12.19.23.106: Flags [none], win 1024, length 0
16:19:02.049610 IP 10.12.100.171.44370 > 10.12.19.23.2260: Flags [none], win 1024, length 0
16:19:02.049671 IP 10.12.100.171.44370 > 10.12.19.23.3283: Flags [none], win 1024, length 0
16:19:02.049673 IP 10.12.100.171.44370 > 10.12.19.23.417: Flags [none], win 1024, length 0
16:19:02.049674 IP 10.12.100.171.44370 > 10.12.19.23.2605: Flags [none], win 1024, length 0
16:19:02.049741 IP 10.12.100.171.44370 > 10.12.19.23.1107: Flags [none], win 1024, length 0
16:19:02.049743 IP 10.12.100.171.44370 > 10.12.19.23.32768: Flags [none], win 1024, length 0
16:19:02.049744 IP 10.12.100.171.44370 > 10.12.19.23.17877: Flags [none], win 1024, length 0
16:19:02.049799 IP 10.12.100.171.44370 > 10.12.19.23.10009: Flags [none], win 1024, length 0
16:19:02.093773 IP 10.12.100.171.44370 > 10.12.19.23.9929: Flags [none], win 1024, length 0
16:19:02.093790 IP 10.12.100.171.44371 > 10.12.19.23.4449: Flags [none], win 1024, length 0
16:19:02.093791 IP 10.12.100.171.44371 > 10.12.19.23.9418: Flags [none], win 1024, length 0
16:19:02.093792 IP 10.12.100.171.44371 > 10.12.19.23.7: Flags [none], win 1024, length 0
16:19:02.093793 IP 10.12.100.171.44371 > 10.12.19.23.7627: Flags [none], win 1024, length 0
16:19:02.093844 IP 10.12.100.171.44371 > 10.12.19.23.7103: Flags [none], win 1024, length 0
16:19:02.096600 IP 10.12.100.171.44371 > 10.12.19.23.21571: Flags [none], win 1024, length 0
16:19:02.096606 IP 10.12.100.171.44371 > 10.12.19.23.62078: Flags [none], win 1024, length 0
16:19:02.096607 IP 10.12.100.171.44371 > 10.12.19.23.2065: Flags [none], win 1024, length 0
16:19:02.096608 IP 10.12.100.171.44371 > 10.12.19.23.3920: Flags [none], win 1024, length 0
16:19:02.096609 IP 10.12.100.171.44371 > 10.12.19.23.40193: Flags [none], win 1024, length 0
16:19:02.096656 IP 10.12.100.171.44371 > 10.12.19.23.1069: Flags [none], win 1024, length 0
16:19:02.096658 IP 10.12.100.171.44371 > 10.12.19.23.1093: Flags [none], win 1024, length 0
16:19:02.096659 IP 10.12.100.171.44371 > 10.12.19.23.2500: Flags [none], win 1024, length 0
16:19:02.096695 IP 10.12.100.171.44371 > 10.12.19.23.1071: Flags [none], win 1024, length 0
16:19:02.096806 IP 10.12.100.171.44371 > 10.12.19.23.8443: Flags [none], win 1024, length 0
16:19:02.096812 IP 10.12.100.171.44371 > 10.12.19.23.34573: Flags [none], win 1024, length 0
16:19:02.096813 IP 10.12.100.171.44371 > 10.12.19.23.1074: Flags [none], win 1024, length 0
16:19:02.096814 IP 10.12.100.171.44371 > 10.12.19.23.726: Flags [none], win 1024, length 0
16:19:02.096815 IP 10.12.100.171.44371 > 10.12.19.23.843: Flags [none], win 1024, length 0
16:19:02.096862 IP 10.12.100.171.44371 > 10.12.19.23.4125: Flags [none], win 1024, length 0
16:19:02.096864 IP 10.12.100.171.44371 > 10.12.19.23.3995: Flags [none], win 1024, length 0
16:19:02.096865 IP 10.12.100.171.44371 > 10.12.19.23.1145: Flags [none], win 1024, length 0
16:19:02.096990 IP 10.12.100.171.44371 > 10.12.19.23.1277: Flags [none], win 1024, length 0
16:19:02.096996 IP 10.12.100.171.44371 > 10.12.19.23.1065: Flags [none], win 1024, length 0
16:19:02.096997 IP 10.12.100.171.44371 > 10.12.19.23.7007: Flags [none], win 1024, length 0
16:19:02.096998 IP 10.12.100.171.44371 > 10.12.19.23.49158: Flags [none], win 1024, length 0
16:19:02.096999 IP 10.12.100.171.44371 > 10.12.19.23.3030: Flags [none], win 1024, length 0
16:19:02.099462 IP 10.12.100.171.44371 > 10.12.19.23.1521: Flags [none], win 1024, length 0
16:19:02.099504 IP 10.12.100.171.44371 > 10.12.19.23.19101: Flags [none], win 1024, length 0
16:19:02.099510 IP 10.12.100.171.44371 > 10.12.19.23.7625: Flags [none], win 1024, length 0
16:19:02.099511 IP 10.12.100.171.44371 > 10.12.19.23.3211: Flags [none], win 1024, length 0
16:19:02.099512 IP 10.12.100.171.44371 > 10.12.19.23.1089: Flags [none], win 1024, length 0
16:19:02.099513 IP 10.12.100.171.44371 > 10.12.19.23.500: Flags [none], win 1024, length 0
16:19:02.099578 IP 10.12.100.171.44371 > 10.12.19.23.1130: Flags [none], win 1024, length 0
16:19:02.099590 IP 10.12.100.171.44371 > 10.12.19.23.1641: Flags [none], win 1024, length 0
16:19:02.099591 IP 10.12.100.171.44371 > 10.12.19.23.2811: Flags [none], win 1024, length 0
16:19:02.099592 IP 10.12.100.171.44371 > 10.12.19.23.1501: Flags [none], win 1024, length 0
16:19:02.099660 IP 10.12.100.171.44371 > 10.12.19.23.5000: Flags [none], win 1024, length 0
16:19:02.099662 IP 10.12.100.171.44371 > 10.12.19.23.1102: Flags [none], win 1024, length 0
16:19:02.099702 IP 10.12.100.171.44371 > 10.12.19.23.9503: Flags [none], win 1024, length 0
16:19:02.099704 IP 10.12.100.171.44371 > 10.12.19.23.8994: Flags [none], win 1024, length 0
16:19:02.099750 IP 10.12.100.171.44371 > 10.12.19.23.3690: Flags [none], win 1024, length 0
16:19:02.099752 IP 10.12.100.171.44371 > 10.12.19.23.8290: Flags [none], win 1024, length 0
16:19:02.099753 IP 10.12.100.171.44371 > 10.12.19.23.34572: Flags [none], win 1024, length 0
16:19:02.099813 IP 10.12.100.171.44371 > 10.12.19.23.3737: Flags [none], win 1024, length 0
16:19:02.099815 IP 10.12.100.171.44371 > 10.12.19.23.1032: Flags [none], win 1024, length 0
16:19:02.099816 IP 10.12.100.171.44371 > 10.12.19.23.7025: Flags [none], win 1024, length 0
16:19:02.099890 IP 10.12.100.171.44371 > 10.12.19.23.32780: Flags [none], win 1024, length 0
