11:53:26.193425 ARP, Request who-has 10.12.19.23 (ff:ff:ff:ff:ff:ff) tell 10.12.100.44, length 46
11:53:26.394162 IP 10.12.100.44 > 10.12.19.23:  ip-proto-139 0
11:53:26.394195 IP 10.12.100.44 > 10.12.19.23:  ip-proto-150 0
11:53:26.394197 IP 10.12.100.44 > 10.12.19.23:  ip-proto-119 0
11:53:26.394198 IP 10.12.100.44 > 10.12.19.23:  ip-proto-118 0
11:53:26.394199 IP 10.12.100.44 > 10.12.19.23:  ip-proto-140 0
11:53:26.394201 IP 10.12.100.44 > 10.12.19.23:  ip-proto-75 0
11:53:26.394282 IP 10.12.100.44 > 10.12.19.23:  ip-proto-136 0
11:53:26.394285 IP 10.12.100.44 > 10.12.19.23:  ip-proto-20 0
11:53:26.394286 IP 10.12.100.44 > 10.12.19.23:  ip-proto-79 0
11:53:26.394333 IP 10.12.100.44 > 10.12.19.23:  ip-proto-237 0
11:53:27.445205 IP 10.12.100.44 > 10.12.19.23:  ip-proto-237 0
11:53:27.445225 IP 10.12.100.44 > 10.12.19.23:  ip-proto-79 0
11:53:27.445227 IP 10.12.100.44 > 10.12.19.23:  ip-proto-20 0
11:53:27.445228 IP 10.12.100.44 > 10.12.19.23:  ip-proto-136 0
11:53:27.445230 IP 10.12.100.44 > 10.12.19.23:  ip-proto-75 0
11:53:27.445305 IP 10.12.100.44 > 10.12.19.23:  ip-proto-140 0
11:53:27.445307 IP 10.12.100.44 > 10.12.19.23:  ip-proto-118 0
11:53:27.445309 IP 10.12.100.44 > 10.12.19.23:  ip-proto-119 0
11:53:27.445360 IP 10.12.100.44 > 10.12.19.23:  ip-proto-150 0
11:53:27.445362 IP 10.12.100.44 > 10.12.19.23:  ip-proto-139 0
11:53:27.495796 IP 10.12.100.44 > 10.12.19.23:  ip-proto-95 0
11:53:27.495816 IP 10.12.100.44 > 10.12.19.23:  ip-proto-170 0
11:53:27.495818 IP 10.12.100.44 > 10.12.19.23:  ip-proto-176 0
11:53:27.495819 IP 10.12.100.44 > 10.12.19.23:  ip-proto-217 0
11:53:27.495820 IP 10.12.100.44 > 10.12.19.23:  ip-proto-111 0
11:53:27.495822 IP 10.12.100.44 > 10.12.19.23:  ip-proto-3 0
11:53:27.495823 IP 10.12.100.44 > 10.12.19.23:  ip-proto-12 0
11:53:27.495905 IP 10.12.100.44 > 10.12.19.23:  ip-proto-73 0
11:53:27.495908 IP 10.12.100.44 > 10.12.19.23:  ip-proto-147 0
11:53:27.495909 IP 10.12.100.44 > 10.12.19.23:  ip-proto-42 0
11:53:27.546369 IP 10.12.100.44 > 10.12.19.23:  ip-proto-42 0
11:53:27.546390 IP 10.12.100.44 > 10.12.19.23:  ip-proto-147 0
11:53:27.546392 IP 10.12.100.44 > 10.12.19.23:  ip-proto-73 0
11:53:27.546394 IP 10.12.100.44 > 10.12.19.23:  ip-proto-12 0
11:53:27.546521 IP 10.12.100.44 > 10.12.19.23:  ip-proto-3 0
11:53:27.546526 IP 10.12.100.44 > 10.12.19.23:  ip-proto-111 0
11:53:27.546528 IP 10.12.100.44 > 10.12.19.23:  ip-proto-217 0
11:53:27.546529 IP 10.12.100.44 > 10.12.19.23:  ip-proto-176 0
11:53:27.546531 IP 10.12.100.44 > 10.12.19.23:  ip-proto-170 0
11:53:27.546532 IP 10.12.100.44 > 10.12.19.23:  ip-proto-95 0
11:53:27.596770 IP 10.12.100.44 > 10.12.19.23:  ip-proto-211 0
11:53:27.596790 IP 10.12.100.44 > 10.12.19.23:  ip-proto-92 0
11:53:27.596791 IP 10.12.100.44 > 10.12.19.23:  ip-proto-61 0
11:53:27.596793 IP 10.12.100.44 > 10.12.19.23:  ip-proto-244 0
11:53:27.596846 IP 10.12.100.44 > 10.12.19.23:  ip-proto-221 0
11:53:27.596849 IP 10.12.100.44 > 10.12.19.23: [|ip6]
11:53:27.596851 IP 10.12.100.44 > 10.12.19.23:  ip-proto-29 0
11:53:27.596898 IP 10.12.100.44 > 10.12.19.23:  ip-proto-122 0
11:53:27.596901 IP 10.12.100.44 > 10.12.19.23:  ip-proto-198 0
11:53:27.596902 IP 10.12.100.44 > 10.12.19.23:  ip-proto-178 0
11:53:27.646841 IP 10.12.100.44 > 10.12.19.23:  ip-proto-211 0
11:53:27.649357 IP 10.12.100.44 > 10.12.19.23:  ip-proto-178 0
11:53:27.649364 IP 10.12.100.44 > 10.12.19.23:  ip-proto-198 0
11:53:27.649401 IP 10.12.100.44 > 10.12.19.23:  ip-proto-122 0
11:53:27.649404 IP 10.12.100.44 > 10.12.19.23:  ip-proto-29 0
11:53:27.649405 IP 10.12.100.44 > 10.12.19.23: [|ip6]
11:53:27.649499 IP 10.12.100.44 > 10.12.19.23:  ip-proto-221 0
11:53:27.649520 IP 10.12.100.44 > 10.12.19.23:  ip-proto-244 0
11:53:27.649521 IP 10.12.100.44 > 10.12.19.23:  ip-proto-61 0
11:53:27.649522 IP 10.12.100.44 > 10.12.19.23:  ip-proto-92 0
11:53:27.697424 IP 10.12.100.44 > 10.12.19.23:  ip-proto-44 0
11:53:27.699961 IP 10.12.100.44 > 10.12.19.23: [|IPCOMP]
11:53:27.699969 IP 10.12.100.44 > 10.12.19.23:  ip-proto-188 0
11:53:27.699971 IP 10.12.100.44 > 10.12.19.23:  ip-proto-226 0
11:53:27.699972 IP 10.12.100.44 > 10.12.19.23:  ip-proto-13 0
11:53:27.699974 IP 10.12.100.44 > 10.12.19.23:  ip-proto-171 0
11:53:27.700020 IP 10.12.100.44 > 10.12.19.23:  ip-proto-78 0
11:53:27.700023 IP 10.12.100.44 > 10.12.19.23:  ip-proto-0 0
11:53:27.700024 IP 10.12.100.44 > 10.12.19.23:  ip-proto-162 0
11:53:27.700101 IP 10.12.100.44 > 10.12.19.23:  ip-proto-24 0
11:53:27.747644 IP 10.12.100.44 > 10.12.19.23:  ip-proto-44 0
11:53:27.750148 IP 10.12.100.44 > 10.12.19.23:  ip-proto-162 0
11:53:27.750155 IP 10.12.100.44 > 10.12.19.23:  ip-proto-0 0
11:53:27.750156 IP 10.12.100.44 > 10.12.19.23:  ip-proto-78 0
11:53:27.750158 IP 10.12.100.44 > 10.12.19.23:  ip-proto-171 0
11:53:27.750159 IP 10.12.100.44 > 10.12.19.23:  ip-proto-13 0
11:53:27.750210 IP 10.12.100.44 > 10.12.19.23:  ip-proto-226 0
11:53:27.750310 IP 10.12.100.44 > 10.12.19.23:  ip-proto-188 0
11:53:27.750312 IP 10.12.100.44 > 10.12.19.23: [|IPCOMP]
11:53:27.752787 IP 10.12.100.44 > 10.12.19.23:  ip-proto-24 0
11:53:27.798018 IP 10.12.100.44 > 10.12.19.23:  ip-proto-70 0
11:53:27.800606 IP 10.12.100.44 > 10.12.19.23:  ip-proto-245 0
11:53:27.800613 IP 10.12.100.44 > 10.12.19.23: [|vrrp]
11:53:27.800614 IP 10.12.100.44 > 10.12.19.23:  ip-proto-151 0
11:53:27.800652 IP 10.12.100.44 > 10.12.19.23:  ip-proto-219 0
11:53:27.800654 IP 10.12.100.44 > 10.12.19.23:  ip-proto-105 0
11:53:27.800655 IP 10.12.100.44 > 10.12.19.23:  ip-proto-123 0
11:53:27.800698 IP 10.12.100.44 > 10.12.19.23:  ip-proto-158 0
11:53:27.800750 IP 10.12.100.44 > 10.12.19.23:  ip-proto-166 0
11:53:27.803267 IP 10.12.100.44 > 10.12.19.23:  ip-proto-22 0
11:53:27.848351 IP 10.12.100.44 > 10.12.19.23:  ip-proto-70 0
11:53:27.851173 IP 10.12.100.44 > 10.12.19.23:  ip-proto-166 0
11:53:27.851180 IP 10.12.100.44 > 10.12.19.23:  ip-proto-158 0
11:53:27.851196 IP 10.12.100.44 > 10.12.19.23:  ip-proto-123 0
11:53:27.851198 IP 10.12.100.44 > 10.12.19.23:  ip-proto-105 0
11:53:27.851256 IP 10.12.100.44 > 10.12.19.23:  ip-proto-219 0
11:53:27.851258 IP 10.12.100.44 > 10.12.19.23:  ip-proto-151 0
11:53:27.851259 IP 10.12.100.44 > 10.12.19.23: [|vrrp]
11:53:27.851327 IP 10.12.100.44 > 10.12.19.23:  ip-proto-245 0
11:53:27.853881 IP 10.12.100.44 > 10.12.19.23:  ip-proto-22 0
11:53:27.898635 IP 10.12.100.44 > 10.12.19.23:  ip-proto-64 0
11:53:27.901695 IP 10.12.100.44 > 10.12.19.23: igrp: [|igrp]
11:53:27.901716 IP 10.12.100.44 > 10.12.19.23:  ip-proto-137 0
11:53:27.901718 IP 10.12.100.44 > 10.12.19.23:  ip-proto-213 0
11:53:27.901764 IP 10.12.100.44 > 10.12.19.23:  ip-proto-165 0
11:53:27.901801 IP 10.12.100.44 > 10.12.19.23:  ip-proto-90 0
11:53:27.901803 IP 10.12.100.44 > 10.12.19.23:  ip-proto-86 0
11:53:27.901804 IP 10.12.100.44 > 10.12.19.23:  ip-proto-99 0
11:53:27.901914 IP 10.12.100.44 > 10.12.19.23:  ip-proto-232 0
11:53:27.904275 IP 10.12.100.44 > 10.12.19.23:  ip-proto-160 0
11:53:27.948784 IP 10.12.100.44 > 10.12.19.23:  ip-proto-64 0
11:53:27.951854 IP 10.12.100.44 > 10.12.19.23:  ip-proto-213 0
11:53:27.951888 IP 10.12.100.44 > 10.12.19.23:  ip-proto-137 0
11:53:27.951890 IP 10.12.100.44 > 10.12.19.23: igrp: [|igrp]
11:53:27.954000 IP 10.12.100.44 > 10.12.19.23:  ip-proto-232 0
11:53:27.954007 IP 10.12.100.44 > 10.12.19.23:  ip-proto-99 0
11:53:27.954009 IP 10.12.100.44 > 10.12.19.23:  ip-proto-86 0
11:53:27.954010 IP 10.12.100.44 > 10.12.19.23:  ip-proto-90 0
11:53:27.954058 IP 10.12.100.44 > 10.12.19.23:  ip-proto-165 0
11:53:27.956613 IP 10.12.100.44 > 10.12.19.23:  ip-proto-160 0
11:53:27.999621 IP 10.12.100.44 > 10.12.19.23:  ip-proto-28 0
11:53:28.002171 IP 10.12.100.44 > 10.12.19.23:  ip-proto-183 0
11:53:28.002178 IP 10.12.100.44.57032 > 10.12.19.23.80: Flags [.], ack 4044752257, win 1024, length 0
11:53:28.002206 IP 10.12.100.44 > 10.12.19.23:  ip-proto-241 0
11:53:28.004467 IP 10.12.100.44 > 10.12.19.23:  ip-proto-120 0
11:53:28.004499 IP 10.12.100.44 > 10.12.19.23:  ip-proto-94 0
11:53:28.004501 IP 10.12.100.44 > 10.12.19.23:  ip-proto-224 0
11:53:28.004502 IP 10.12.100.44 > 10.12.19.23:  ip-proto-135 0
11:53:28.004556 IP 10.12.100.44 > 10.12.19.23:  ip-proto-200 0
11:53:28.006970 IP 10.12.100.44 > 10.12.19.23:  ip-proto-16 0
11:53:28.050236 IP 10.12.100.44 > 10.12.19.23:  ip-proto-28 0
11:53:28.052783 IP 10.12.100.44 > 10.12.19.23:  ip-proto-241 0
11:53:28.052790 IP 10.12.100.44.57033 > 10.12.19.23.80: Flags [.], ack 782840716, win 1024, length 0
11:53:28.052816 IP 10.12.100.44 > 10.12.19.23:  ip-proto-183 0
11:53:28.055355 IP 10.12.100.44 > 10.12.19.23:  ip-proto-200 0
11:53:28.055374 IP 10.12.100.44 > 10.12.19.23:  ip-proto-135 0
11:53:28.055376 IP 10.12.100.44 > 10.12.19.23:  ip-proto-224 0
11:53:28.055377 IP 10.12.100.44 > 10.12.19.23:  ip-proto-94 0
11:53:28.055461 IP 10.12.100.44 > 10.12.19.23:  ip-proto-120 0
11:53:28.057999 IP 10.12.100.44 > 10.12.19.23:  ip-proto-16 0
11:53:28.100444 IP 10.12.100.44 > 10.12.19.23:  ip-proto-195 0
11:53:28.102832 IP 10.12.100.44 > 10.12.19.23:  ip-proto-34 0
11:53:28.102840 IP 10.12.100.44 > 10.12.19.23:  ip-proto-60 0
11:53:28.105231 IP 10.12.100.44 > 10.12.19.23:  ip-proto-187 0
11:53:28.107596 IP 10.12.100.44 > 10.12.19.23:  ip-proto-199 0
11:53:28.107604 IP 10.12.100.44 > 10.12.19.23:  ip-proto-210 0
11:53:28.107605 IP 10.12.100.44 > 10.12.19.23:  ip-proto-192 0
11:53:28.107607 IP 10.12.100.44 > 10.12.19.23:  ip-proto-251 0
11:53:28.107662 IP 10.12.100.44 > 10.12.19.23:  ip-proto-21 0
11:53:28.109835 IP 10.12.100.44 > 10.12.19.23:  ip-proto-215 0
11:53:28.150768 IP 10.12.100.44 > 10.12.19.23:  ip-proto-195 0
11:53:28.153336 IP 10.12.100.44 > 10.12.19.23:  ip-proto-60 0
11:53:28.153426 IP 10.12.100.44 > 10.12.19.23:  ip-proto-34 0
11:53:28.155947 IP 10.12.100.44 > 10.12.19.23:  ip-proto-187 0
11:53:28.158109 IP 10.12.100.44 > 10.12.19.23:  ip-proto-21 0
11:53:28.158117 IP 10.12.100.44 > 10.12.19.23:  ip-proto-251 0
11:53:28.158118 IP 10.12.100.44 > 10.12.19.23:  ip-proto-192 0
11:53:28.158134 IP 10.12.100.44 > 10.12.19.23:  ip-proto-210 0
11:53:28.158136 IP 10.12.100.44 > 10.12.19.23:  ip-proto-199 0
11:53:28.160730 IP 10.12.100.44 > 10.12.19.23:  ip-proto-215 0
11:53:29.205741 IP 10.12.100.44 > 10.12.19.23:  ip-proto-215 0
11:53:29.205760 IP 10.12.100.44 > 10.12.19.23:  ip-proto-199 0
11:53:29.205761 IP 10.12.100.44 > 10.12.19.23:  ip-proto-210 0
11:53:29.205763 IP 10.12.100.44 > 10.12.19.23:  ip-proto-192 0
11:53:29.205764 IP 10.12.100.44 > 10.12.19.23:  ip-proto-251 0
11:53:29.205821 IP 10.12.100.44 > 10.12.19.23:  ip-proto-21 0
11:53:29.205824 IP 10.12.100.44 > 10.12.19.23:  ip-proto-187 0
11:53:29.205825 IP 10.12.100.44 > 10.12.19.23:  ip-proto-34 0
11:53:29.205870 IP 10.12.100.44 > 10.12.19.23:  ip-proto-60 0
11:53:29.205873 IP 10.12.100.44 > 10.12.19.23:  ip-proto-195 0
11:53:29.205874 IP 10.12.100.44 > 10.12.19.23:  ip-proto-16 0
11:53:29.205948 IP 10.12.100.44 > 10.12.19.23:  ip-proto-120 0
11:53:29.205951 IP 10.12.100.44 > 10.12.19.23:  ip-proto-94 0
11:53:29.205952 IP 10.12.100.44 > 10.12.19.23:  ip-proto-224 0
11:53:29.205953 IP 10.12.100.44 > 10.12.19.23:  ip-proto-135 0
11:53:29.206032 IP 10.12.100.44 > 10.12.19.23:  ip-proto-200 0
11:53:29.206035 IP 10.12.100.44 > 10.12.19.23:  ip-proto-183 0
11:53:29.206036 IP 10.12.100.44 > 10.12.19.23:  ip-proto-241 0
11:53:29.206162 IP 10.12.100.44 > 10.12.19.23:  ip-proto-28 0
11:53:29.206192 IP 10.12.100.44 > 10.12.19.23:  ip-proto-160 0
11:53:29.206194 IP 10.12.100.44 > 10.12.19.23:  ip-proto-165 0
11:53:29.277952 IP 10.12.100.44 > 10.12.19.23:  ip-proto-90 0
11:53:29.280070 IP 10.12.100.44 > 10.12.19.23:  ip-proto-86 0
11:53:29.280079 IP 10.12.100.44 > 10.12.19.23:  ip-proto-99 0
11:53:29.280081 IP 10.12.100.44 > 10.12.19.23:  ip-proto-232 0
11:53:29.280139 IP 10.12.100.44 > 10.12.19.23: igrp: [|igrp]
11:53:29.280141 IP 10.12.100.44 > 10.12.19.23:  ip-proto-137 0
11:53:29.280143 IP 10.12.100.44 > 10.12.19.23:  ip-proto-213 0
11:53:29.280193 IP 10.12.100.44 > 10.12.19.23:  ip-proto-64 0
11:53:29.280196 IP 10.12.100.44 > 10.12.19.23:  ip-proto-22 0
11:53:29.280232 IP 10.12.100.44 > 10.12.19.23:  ip-proto-245 0
11:53:29.280235 IP 10.12.100.44 > 10.12.19.23: [|vrrp]
11:53:29.280268 IP 10.12.100.44 > 10.12.19.23:  ip-proto-151 0
11:53:29.280294 IP 10.12.100.44 > 10.12.19.23:  ip-proto-219 0
11:53:29.280336 IP 10.12.100.44 > 10.12.19.23:  ip-proto-105 0
11:53:29.280338 IP 10.12.100.44 > 10.12.19.23:  ip-proto-123 0
11:53:29.280385 IP 10.12.100.44 > 10.12.19.23:  ip-proto-158 0
11:53:29.280388 IP 10.12.100.44 > 10.12.19.23:  ip-proto-166 0
11:53:29.280389 IP 10.12.100.44 > 10.12.19.23:  ip-proto-70 0
11:53:29.280422 IP 10.12.100.44 > 10.12.19.23:  ip-proto-24 0
11:53:29.280424 IP 10.12.100.44 > 10.12.19.23: [|IPCOMP]
11:53:29.280488 IP 10.12.100.44 > 10.12.19.23:  ip-proto-188 0
11:53:29.350697 IP 10.12.100.44.57035 > 10.12.19.23.80: Flags [.], ack 4206069382, win 1024, length 0
11:53:29.353059 IP 10.12.100.44 > 10.12.19.23:  ip-proto-226 0
11:53:29.353070 IP 10.12.100.44 > 10.12.19.23:  ip-proto-13 0
11:53:29.353072 IP 10.12.100.44 > 10.12.19.23:  ip-proto-171 0
11:53:29.353073 IP 10.12.100.44 > 10.12.19.23:  ip-proto-78 0
11:53:29.353075 IP 10.12.100.44 > 10.12.19.23:  ip-proto-0 0
11:53:29.353149 IP 10.12.100.44 > 10.12.19.23:  ip-proto-162 0
11:53:29.353151 IP 10.12.100.44 > 10.12.19.23:  ip-proto-44 0
11:53:29.353153 IP 10.12.100.44 > 10.12.19.23:  ip-proto-92 0
11:53:29.353224 IP 10.12.100.44 > 10.12.19.23:  ip-proto-61 0
11:53:29.353226 IP 10.12.100.44 > 10.12.19.23:  ip-proto-244 0
11:53:29.353294 IP 10.12.100.44 > 10.12.19.23:  ip-proto-221 0
11:53:29.353364 IP 10.12.100.44 > 10.12.19.23: [|ip6]
11:53:29.353366 IP 10.12.100.44 > 10.12.19.23:  ip-proto-29 0
11:53:29.353416 IP 10.12.100.44 > 10.12.19.23:  ip-proto-122 0
11:53:29.353418 IP 10.12.100.44 > 10.12.19.23:  ip-proto-198 0
11:53:29.353420 IP 10.12.100.44 > 10.12.19.23:  ip-proto-178 0
11:53:29.353421 IP 10.12.100.44 > 10.12.19.23:  ip-proto-211 0
11:53:29.353496 IP 10.12.100.44 > 10.12.19.23:  ip-proto-95 0
11:53:29.353499 IP 10.12.100.44 > 10.12.19.23:  ip-proto-170 0
11:53:29.353500 IP 10.12.100.44 > 10.12.19.23:  ip-proto-176 0
11:53:29.425439 IP 10.12.100.44 > 10.12.19.23:  ip-proto-217 0
11:53:29.425485 IP 10.12.100.44 > 10.12.19.23:  ip-proto-111 0
11:53:29.425486 IP 10.12.100.44 > 10.12.19.23:  ip-proto-3 0
11:53:29.425488 IP 10.12.100.44 > 10.12.19.23:  ip-proto-12 0
11:53:29.425489 IP 10.12.100.44 > 10.12.19.23:  ip-proto-73 0
11:53:29.425555 IP 10.12.100.44 > 10.12.19.23:  ip-proto-147 0
11:53:29.425557 IP 10.12.100.44 > 10.12.19.23:  ip-proto-42 0
11:53:29.425608 IP 10.12.100.44 > 10.12.19.23:  ip-proto-139 0
11:53:29.425610 IP 10.12.100.44 > 10.12.19.23:  ip-proto-150 0
11:53:29.425677 IP 10.12.100.44 > 10.12.19.23:  ip-proto-119 0
11:53:29.425680 IP 10.12.100.44 > 10.12.19.23:  ip-proto-118 0
11:53:29.425681 IP 10.12.100.44 > 10.12.19.23:  ip-proto-140 0
11:53:29.425727 IP 10.12.100.44 > 10.12.19.23:  ip-proto-75 0
11:53:29.425788 IP 10.12.100.44 > 10.12.19.23:  ip-proto-136 0
11:53:29.425790 IP 10.12.100.44 > 10.12.19.23:  ip-proto-20 0
11:53:29.425792 IP 10.12.100.44 > 10.12.19.23:  ip-proto-79 0
11:53:29.425860 IP 10.12.100.44 > 10.12.19.23:  ip-proto-237 0
11:53:29.425862 IP 10.12.100.44 > 10.12.19.23:  ip-proto-134 0
11:53:29.425929 IP 10.12.100.44 > 10.12.19.23:  ip-proto-250 0
11:53:29.425971 IP 10.12.100.44 > 10.12.19.23: [|egp]
11:53:29.425973 IP 10.12.100.44 > 10.12.19.23:  ip-proto-175 0
11:53:29.425987 IP 10.12.100.44 > 10.12.19.23:  ip-proto-214 0
11:53:29.426046 IP 10.12.100.44 > 10.12.19.23:  ip-proto-149 0
11:53:29.426049 IP 10.12.100.44 > 10.12.19.23:  ip-proto-81 0
11:53:29.426050 IP 10.12.100.44 > 10.12.19.23:  ip-proto-85 0
11:53:29.426134 IP 10.12.100.44 > 10.12.19.23: [|pim]
11:53:29.426150 IP 10.12.100.44 > 10.12.19.23:  ip-proto-49 0
11:53:29.426151 IP 10.12.100.44 > 10.12.19.23:  ip-proto-100 0
11:53:29.426268 IP 10.12.100.44 > 10.12.19.23:  ip-proto-153 0
11:53:29.426276 IP 10.12.100.44 > 10.12.19.23:  ip-proto-130 0
11:53:29.426278 IP 10.12.100.44 > 10.12.19.23:  ip-proto-218 0
11:53:29.426279 IP 10.12.100.44 > 10.12.19.23:  ip-proto-65 0
11:53:29.426281 IP 10.12.100.44 > 10.12.19.23:  ip-proto-115 0
11:53:29.426320 IP 10.12.100.44 > 10.12.19.23: ICMP echo request, id 26528, seq 0, length 8
11:53:29.426359 IP 10.12.100.44 > 10.12.19.23:  ip-proto-238 0
11:53:29.489164 IP 10.12.100.44 > 10.12.19.23:  ip-proto-238 0
11:53:29.489185 IP 10.12.100.44 > 10.12.19.23: ICMP echo request, id 2087, seq 0, length 8
11:53:29.489215 IP 10.12.100.44 > 10.12.19.23:  ip-proto-115 0
11:53:29.489218 IP 10.12.100.44 > 10.12.19.23:  ip-proto-65 0
11:53:29.489219 IP 10.12.100.44 > 10.12.19.23:  ip-proto-218 0
11:53:29.489221 IP 10.12.100.44 > 10.12.19.23:  ip-proto-130 0
11:53:29.489222 IP 10.12.100.44 > 10.12.19.23:  ip-proto-153 0
11:53:29.489314 IP 10.12.100.44 > 10.12.19.23:  ip-proto-100 0
11:53:29.489442 IP 10.12.100.44 > 10.12.19.23:  ip-proto-49 0
11:53:29.489449 IP 10.12.100.44 > 10.12.19.23: [|pim]
11:53:29.489463 IP 10.12.100.44 > 10.12.19.23:  ip-proto-85 0
11:53:29.489465 IP 10.12.100.44 > 10.12.19.23:  ip-proto-81 0
11:53:29.489526 IP 10.12.100.44 > 10.12.19.23:  ip-proto-149 0
11:53:29.489529 IP 10.12.100.44 > 10.12.19.23:  ip-proto-214 0
11:53:29.489713 IP 10.12.100.44 > 10.12.19.23:  ip-proto-175 0
11:53:29.489721 IP 10.12.100.44 > 10.12.19.23: [|egp]
11:53:29.489723 IP 10.12.100.44 > 10.12.19.23:  ip-proto-250 0
11:53:29.489724 IP 10.12.100.44 > 10.12.19.23:  ip-proto-134 0
11:53:29.489726 IP 10.12.100.44 > 10.12.19.23:  ip-proto-104 0
11:53:29.489802 IP 10.12.100.44 > 10.12.19.23:  ip-proto-68 0
11:53:29.489804 IP 10.12.100.44 > 10.12.19.23:  ip-proto-168 0
11:53:29.489872 IP 10.12.100.44 > 10.12.19.23:  ip-proto-228 0
11:53:29.489875 IP 10.12.100.44 > 10.12.19.23:  ip-proto-204 0
11:53:29.489876 IP 10.12.100.44 > 10.12.19.23:  ip-proto-184 0
11:53:29.489929 IP 10.12.100.44 > 10.12.19.23:  ip-proto-102 0
11:53:29.489987 IP 10.12.100.44.57032 > 10.12.19.23.40125: UDP, length 0
11:53:29.490004 IP 10.12.100.44 > 10.12.19.23:  ip-proto-19 0
11:53:29.490005 IP 10.12.100.44 > 10.12.19.23:  ip-proto-18 0
11:53:29.490056 IP 10.12.100.44 > 10.12.19.23:  ip-proto-38 0
11:53:29.490059 IP 10.12.100.44 > 10.12.19.23:  ip-proto-236 0
11:53:29.490061 IP 10.12.100.44 > 10.12.19.23:  ip-proto-152 0
11:53:29.490158 IP 10.12.100.44 > 10.12.19.23:  ip-proto-117 0
11:53:29.490160 IP 10.12.100.44 > 10.12.19.23:  ip-proto-179 0
11:53:29.490162 IP 10.12.100.44 > 10.12.19.23:  ip-proto-193 0
11:53:29.490240 IP 10.12.100.44 > 10.12.19.23:  ip-proto-37 0
11:53:29.552799 IP 10.12.100.44 > 10.12.19.23:  ip-proto-37 0
11:53:29.552819 IP 10.12.100.44 > 10.12.19.23:  ip-proto-193 0
11:53:29.552820 IP 10.12.100.44 > 10.12.19.23:  ip-proto-179 0
11:53:29.552822 IP 10.12.100.44 > 10.12.19.23:  ip-proto-117 0
11:53:29.552823 IP 10.12.100.44 > 10.12.19.23:  ip-proto-152 0
11:53:29.552863 IP 10.12.100.44 > 10.12.19.23:  ip-proto-236 0
11:53:29.552865 IP 10.12.100.44 > 10.12.19.23:  ip-proto-38 0
11:53:29.552866 IP 10.12.100.44 > 10.12.19.23:  ip-proto-18 0
11:53:29.552912 IP 10.12.100.44 > 10.12.19.23:  ip-proto-19 0
11:53:29.552964 IP 10.12.100.44.57033 > 10.12.19.23.40125: UDP, length 0
11:53:29.552968 IP 10.12.100.44 > 10.12.19.23:  ip-proto-102 0
11:53:29.552969 IP 10.12.100.44 > 10.12.19.23:  ip-proto-184 0
11:53:29.552971 IP 10.12.100.44 > 10.12.19.23:  ip-proto-204 0
11:53:29.552972 IP 10.12.100.44 > 10.12.19.23:  ip-proto-228 0
11:53:29.553011 IP 10.12.100.44 > 10.12.19.23:  ip-proto-168 0
11:53:29.553014 IP 10.12.100.44 > 10.12.19.23:  ip-proto-68 0
11:53:29.553052 IP 10.12.100.44 > 10.12.19.23:  ip-proto-104 0
11:53:29.553086 IP 10.12.100.44 > 10.12.19.23:  ip-proto-134 0
11:53:29.553089 IP 10.12.100.44 > 10.12.19.23:  ip-proto-250 0
11:53:29.553090 IP 10.12.100.44 > 10.12.19.23: [|egp]
11:53:29.553091 IP 10.12.100.44 > 10.12.19.23:  ip-proto-175 0
11:53:29.553190 IP 10.12.100.44 > 10.12.19.23:  ip-proto-214 0
11:53:29.553192 IP 10.12.100.44 > 10.12.19.23:  ip-proto-149 0
11:53:29.553290 IP 10.12.100.44 > 10.12.19.23:  ip-proto-81 0
11:53:29.553293 IP 10.12.100.44 > 10.12.19.23:  ip-proto-85 0
11:53:29.553294 IP 10.12.100.44 > 10.12.19.23: [|pim]
11:53:29.553393 IP 10.12.100.44 > 10.12.19.23:  ip-proto-49 0
11:53:29.553395 IP 10.12.100.44 > 10.12.19.23:  ip-proto-100 0
11:53:29.553490 IP 10.12.100.44 > 10.12.19.23:  ip-proto-153 0
11:53:29.553493 IP 10.12.100.44 > 10.12.19.23:  ip-proto-130 0
11:53:29.553495 IP 10.12.100.44 > 10.12.19.23:  ip-proto-218 0
11:53:29.553651 IP 10.12.100.44 > 10.12.19.23:  ip-proto-65 0
11:53:29.553659 IP 10.12.100.44 > 10.12.19.23:  ip-proto-115 0
11:53:29.553660 IP 10.12.100.44 > 10.12.19.23: ICMP echo request, id 3635, seq 0, length 8
11:53:29.553685 IP 10.12.100.44 > 10.12.19.23:  ip-proto-238 0
11:53:29.619782 IP 10.12.100.44 > 10.12.19.23:  ip-proto-104 0
11:53:29.619811 IP 10.12.100.44 > 10.12.19.23:  ip-proto-68 0
11:53:29.619812 IP 10.12.100.44 > 10.12.19.23:  ip-proto-168 0
11:53:29.619828 IP 10.12.100.44 > 10.12.19.23:  ip-proto-228 0
11:53:29.619830 IP 10.12.100.44 > 10.12.19.23:  ip-proto-204 0
11:53:29.619895 IP 10.12.100.44 > 10.12.19.23:  ip-proto-184 0
11:53:29.619898 IP 10.12.100.44 > 10.12.19.23:  ip-proto-102 0
11:53:29.619899 IP 10.12.100.44.57034 > 10.12.19.23.40125: UDP, length 0
11:53:29.619941 IP 10.12.100.44 > 10.12.19.23:  ip-proto-19 0
11:53:29.619991 IP 10.12.100.44 > 10.12.19.23:  ip-proto-18 0
11:53:29.619994 IP 10.12.100.44 > 10.12.19.23:  ip-proto-38 0
11:53:29.619995 IP 10.12.100.44 > 10.12.19.23:  ip-proto-236 0
11:53:29.619996 IP 10.12.100.44 > 10.12.19.23:  ip-proto-152 0
11:53:29.620073 IP 10.12.100.44 > 10.12.19.23:  ip-proto-117 0
11:53:29.620075 IP 10.12.100.44 > 10.12.19.23:  ip-proto-179 0
11:53:29.620076 IP 10.12.100.44 > 10.12.19.23:  ip-proto-193 0
11:53:29.620078 IP 10.12.100.44 > 10.12.19.23:  ip-proto-37 0
11:53:29.620196 IP 10.12.100.44 > 10.12.19.23:  ip-proto-96 0
11:53:29.620216 IP 10.12.100.44 > 10.12.19.23:  ip-proto-84 0
11:53:29.620218 IP 10.12.100.44 > 10.12.19.23:  ip-proto-109 0
11:53:29.620219 IP 10.12.100.44 > 10.12.19.23:  ip-proto-76 0
11:53:29.620220 IP 10.12.100.44 > 10.12.19.23:  ip-proto-239 0
11:53:29.620221 IP 10.12.100.44 > 10.12.19.23:  ip-proto-69 0
11:53:29.620266 IP 10.12.100.44 > 10.12.19.23:  ip-proto-208 0
11:53:29.620268 IP 10.12.100.44 > 10.12.19.23:  ip-proto-98 0
11:53:29.620269 IP 10.12.100.44 > 10.12.19.23:  ip-proto-110 0
11:53:29.620356 IP 10.12.100.44 > 10.12.19.23:  ip-proto-190 0
11:53:29.620361 IP 10.12.100.44 > 10.12.19.23:  ip-proto-144 0
11:53:29.674496 IP 10.12.100.44 > 10.12.19.23:  ip-proto-144 0
11:53:29.674518 IP 10.12.100.44 > 10.12.19.23:  ip-proto-190 0
11:53:29.674519 IP 10.12.100.44 > 10.12.19.23:  ip-proto-110 0
11:53:29.674521 IP 10.12.100.44 > 10.12.19.23:  ip-proto-98 0
11:53:29.674522 IP 10.12.100.44 > 10.12.19.23:  ip-proto-208 0
11:53:29.674524 IP 10.12.100.44 > 10.12.19.23:  ip-proto-69 0
11:53:29.674525 IP 10.12.100.44 > 10.12.19.23:  ip-proto-239 0
11:53:29.674526 IP 10.12.100.44 > 10.12.19.23:  ip-proto-76 0
11:53:29.674607 IP 10.12.100.44 > 10.12.19.23:  ip-proto-109 0
11:53:29.674611 IP 10.12.100.44 > 10.12.19.23:  ip-proto-84 0
11:53:29.674612 IP 10.12.100.44 > 10.12.19.23:  ip-proto-96 0
11:53:29.674614 IP 10.12.100.44 > 10.12.19.23:  ip-proto-82 0
11:53:29.674615 IP 10.12.100.44 > 10.12.19.23:  ip-proto-36 0
11:53:29.674616 IP 10.12.100.44 > 10.12.19.23:  ip-proto-216 0
11:53:29.674617 IP 10.12.100.44 > 10.12.19.23:  ip-proto-180 0
11:53:29.674660 IP 10.12.100.44 > 10.12.19.23:  ip-proto-181 0
11:53:29.674662 IP [Invalid packet|dccp]
11:53:29.674751 IP 10.12.100.44 > 10.12.19.23:  ip-proto-30 0
11:53:29.674760 IP 10.12.100.44 > 10.12.19.23:  ip-proto-205 0
11:53:29.674762 IP 10.12.100.44 > 10.12.19.23: [|ESP]
11:53:29.674940 IP 10.12.100.44 > 10.12.19.23: [|AH]
11:53:29.674947 IP 10.12.100.44 > 10.12.19.23:  ip-proto-35 0
11:53:29.674948 IP 10.12.100.44 > 10.12.19.23:  ip-proto-156 0
11:53:29.674949 IP 10.12.100.44 > 10.12.19.23:  ip-proto-248 0
11:53:29.674951 IP 10.12.100.44 > 10.12.19.23:  ip-proto-10 0
11:53:29.675024 IP 10.12.100.44 > 10.12.19.23:  ip-proto-143 0
11:53:29.675027 IP 10.12.100.44 > 10.12.19.23:  ip-proto-125 0
11:53:29.675028 IP 10.12.100.44 > 10.12.19.23:  ip-proto-129 0
11:53:29.729205 IP 10.12.100.44 > 10.12.19.23:  ip-proto-129 0
11:53:29.729258 IP 10.12.100.44 > 10.12.19.23:  ip-proto-125 0
11:53:29.729276 IP 10.12.100.44 > 10.12.19.23:  ip-proto-143 0
11:53:29.729278 IP 10.12.100.44 > 10.12.19.23:  ip-proto-10 0
11:53:29.729279 IP 10.12.100.44 > 10.12.19.23:  ip-proto-248 0
11:53:29.729372 IP 10.12.100.44 > 10.12.19.23:  ip-proto-156 0
11:53:29.729375 IP 10.12.100.44 > 10.12.19.23:  ip-proto-35 0
11:53:29.729376 IP 10.12.100.44 > 10.12.19.23: [|AH]
11:53:29.729378 IP 10.12.100.44 > 10.12.19.23: [|ESP]
11:53:29.729379 IP 10.12.100.44 > 10.12.19.23:  ip-proto-205 0
11:53:29.729434 IP 10.12.100.44 > 10.12.19.23:  ip-proto-30 0
11:53:29.729539 IP [Invalid packet|dccp]
11:53:29.729546 IP 10.12.100.44 > 10.12.19.23:  ip-proto-181 0
11:53:29.729598 IP 10.12.100.44 > 10.12.19.23:  ip-proto-180 0
11:53:29.729644 IP 10.12.100.44 > 10.12.19.23:  ip-proto-216 0
11:53:29.729646 IP 10.12.100.44 > 10.12.19.23:  ip-proto-36 0
11:53:29.729648 IP 10.12.100.44 > 10.12.19.23:  ip-proto-82 0
11:53:29.729684 IP 10.12.100.44 > 10.12.19.23:  ip-proto-96 0
11:53:29.729686 IP 10.12.100.44 > 10.12.19.23:  ip-proto-84 0
11:53:29.729687 IP 10.12.100.44 > 10.12.19.23:  ip-proto-109 0
11:53:29.729756 IP 10.12.100.44 > 10.12.19.23:  ip-proto-76 0
11:53:29.729759 IP 10.12.100.44 > 10.12.19.23:  ip-proto-239 0
11:53:29.729760 IP 10.12.100.44 > 10.12.19.23:  ip-proto-69 0
11:53:29.729835 IP 10.12.100.44 > 10.12.19.23:  ip-proto-208 0
11:53:29.729883 IP 10.12.100.44 > 10.12.19.23:  ip-proto-98 0
11:53:29.729886 IP 10.12.100.44 > 10.12.19.23:  ip-proto-110 0
11:53:29.729887 IP 10.12.100.44 > 10.12.19.23:  ip-proto-190 0
11:53:29.729976 IP 10.12.100.44 > 10.12.19.23:  ip-proto-144 0
11:53:29.782353 IP 10.12.100.44 > 10.12.19.23:  ip-proto-82 0
11:53:29.782379 IP 10.12.100.44 > 10.12.19.23:  ip-proto-36 0
11:53:29.782380 IP 10.12.100.44 > 10.12.19.23:  ip-proto-216 0
11:53:29.782381 IP 10.12.100.44 > 10.12.19.23:  ip-proto-180 0
11:53:29.782398 IP 10.12.100.44 > 10.12.19.23:  ip-proto-181 0
11:53:29.782463 IP [Invalid packet|dccp]
11:53:29.782506 IP 10.12.100.44 > 10.12.19.23:  ip-proto-30 0
11:53:29.782509 IP 10.12.100.44 > 10.12.19.23:  ip-proto-205 0
11:53:29.782511 IP 10.12.100.44 > 10.12.19.23: [|ESP]
11:53:29.782512 IP 10.12.100.44 > 10.12.19.23: [|AH]
11:53:29.782611 IP 10.12.100.44 > 10.12.19.23:  ip-proto-35 0
11:53:29.782631 IP 10.12.100.44 > 10.12.19.23:  ip-proto-156 0
11:53:29.782632 IP 10.12.100.44 > 10.12.19.23:  ip-proto-248 0
11:53:29.782634 IP 10.12.100.44 > 10.12.19.23:  ip-proto-10 0
11:53:29.782635 IP 10.12.100.44 > 10.12.19.23:  ip-proto-143 0
11:53:29.782680 IP 10.12.100.44 > 10.12.19.23:  ip-proto-125 0
11:53:29.782720 IP 10.12.100.44 > 10.12.19.23:  ip-proto-129 0
11:53:29.782722 IP 10.12.100.44 > 10.12.19.23:  ip-proto-154 0
11:53:29.782724 IP 10.12.100.44 > 10.12.19.23:  ip-proto-243 0
11:53:29.785198 IP 10.12.100.44 > 10.12.19.23:  ip-proto-174 0
11:53:29.785204 IP 10.12.100.44 > 10.12.19.23: 
		 [|rsvp]
11:53:29.785206 IP 10.12.100.44 > 10.12.19.23:  ip-proto-131 0
11:53:29.785207 IP 10.12.100.44 > 10.12.19.23:  ip-proto-157 0
11:53:29.785255 IP 10.12.100.44 > 10.12.19.23:  ip-proto-141 0
11:53:29.785257 IP 10.12.100.44 > 10.12.19.23:  ip-proto-194 0
11:53:29.785258 IP 10.12.100.44 > 10.12.19.23:  [|ospf2]
11:53:29.785291 IP 10.12.100.44 > 10.12.19.23: igmp query v1 [gaddr 189.127.0.0]
11:53:29.785294 IP 10.12.100.44 > 10.12.19.23:  ip-proto-177 0
11:53:29.836644 IP 10.12.100.44 > 10.12.19.23:  ip-proto-243 0
11:53:29.836657 IP 10.12.100.44 > 10.12.19.23:  ip-proto-154 0
11:53:29.836658 IP 10.12.100.44 > 10.12.19.23:  ip-proto-127 0
11:53:29.836701 IP 10.12.100.44 > 10.12.19.23:  ip-proto-222 0
11:53:29.836704 IP 10.12.100.44 > 10.12.19.23:  ip-proto-80 0
11:53:29.836705 IP 10.12.100.44 > 10.12.19.23:  ip-proto-235 0
11:53:29.836774 IP 10.12.100.44 > 10.12.19.23:  ip-proto-253 0
11:53:29.836781 IP 10.12.100.44 > 10.12.19.23:  ip-proto-56 0
11:53:29.836783 IP 10.12.100.44 > 10.12.19.23:  ip-proto-159 0
11:53:29.836824 IP 10.12.100.44 > 10.12.19.23:  ip-proto-43 0
11:53:29.836826 IP 10.12.100.44 > 10.12.19.23:  ip-proto-97 0
11:53:29.836828 IP 10.12.100.44 > 10.12.19.23:  ip-proto-255 0
11:53:29.836829 IP 10.12.100.44 > 10.12.19.23:  ip-proto-133 0
11:53:29.836938 IP 10.12.100.44 > 10.12.19.23: [|ip] (ipip-proto-4)
11:53:29.836963 IP 10.12.100.44 > 10.12.19.23:  ip-proto-220 0
11:53:29.836966 IP 10.12.100.44 > 10.12.19.23:  ip-proto-116 0
11:53:29.836967 IP 10.12.100.44 > 10.12.19.23:  ip-proto-246 0
11:53:29.836968 IP 10.12.100.44 > 10.12.19.23:  ip-proto-126 0
11:53:29.836969 IP 10.12.100.44 > 10.12.19.23:  ip-proto-107 0
11:53:29.839402 IP 10.12.100.44 > 10.12.19.23:  ip-proto-177 0
11:53:29.839414 IP 10.12.100.44 > 10.12.19.23: igmp query v1 [gaddr 189.127.0.0]
11:53:29.839416 IP 10.12.100.44 > 10.12.19.23:  [|ospf2]
11:53:29.839472 IP 10.12.100.44 > 10.12.19.23:  ip-proto-194 0
11:53:29.839475 IP 10.12.100.44 > 10.12.19.23:  ip-proto-141 0
11:53:29.839477 IP 10.12.100.44 > 10.12.19.23:  ip-proto-157 0
11:53:29.839520 IP 10.12.100.44 > 10.12.19.23:  ip-proto-131 0
11:53:29.839522 IP 10.12.100.44 > 10.12.19.23: 
		 [|rsvp]
11:53:29.839523 IP 10.12.100.44 > 10.12.19.23:  ip-proto-174 0
11:53:29.891505 IP 10.12.100.44 > 10.12.19.23:  ip-proto-107 0
11:53:29.891552 IP 10.12.100.44 > 10.12.19.23:  ip-proto-126 0
11:53:29.891554 IP 10.12.100.44 > 10.12.19.23:  ip-proto-246 0
11:53:29.891555 IP 10.12.100.44 > 10.12.19.23:  ip-proto-116 0
11:53:29.891557 IP 10.12.100.44 > 10.12.19.23:  ip-proto-220 0
11:53:29.891558 IP 10.12.100.44 > 10.12.19.23: [|ip] (ipip-proto-4)
11:53:29.891606 IP 10.12.100.44 > 10.12.19.23:  ip-proto-133 0
11:53:29.891609 IP 10.12.100.44 > 10.12.19.23:  ip-proto-255 0
11:53:29.891610 IP 10.12.100.44 > 10.12.19.23:  ip-proto-97 0
11:53:29.891643 IP 10.12.100.44 > 10.12.19.23:  ip-proto-43 0
11:53:29.891645 IP 10.12.100.44 > 10.12.19.23:  ip-proto-159 0
11:53:29.891680 IP 10.12.100.44 > 10.12.19.23:  ip-proto-56 0
11:53:29.891683 IP 10.12.100.44 > 10.12.19.23:  ip-proto-253 0
11:53:29.891718 IP 10.12.100.44 > 10.12.19.23:  ip-proto-235 0
11:53:29.891720 IP 10.12.100.44 > 10.12.19.23:  ip-proto-80 0
11:53:29.891755 IP 10.12.100.44 > 10.12.19.23:  ip-proto-222 0
11:53:29.891797 IP 10.12.100.44 > 10.12.19.23:  ip-proto-127 0
11:53:29.891799 IP 10.12.100.44 > 10.12.19.23:  ip-proto-154 0
11:53:29.891884 IP 10.12.100.44 > 10.12.19.23:  ip-proto-243 0
11:53:29.894388 IP 10.12.100.44 > 10.12.19.23:  ip-proto-174 0
11:53:29.894394 IP 10.12.100.44 > 10.12.19.23: 
		 [|rsvp]
11:53:29.894396 IP 10.12.100.44 > 10.12.19.23:  ip-proto-131 0
11:53:29.894397 IP 10.12.100.44 > 10.12.19.23:  ip-proto-157 0
11:53:29.894398 IP 10.12.100.44 > 10.12.19.23:  ip-proto-141 0
11:53:29.894399 IP 10.12.100.44 > 10.12.19.23:  ip-proto-194 0
11:53:29.894450 IP 10.12.100.44 > 10.12.19.23:  [|ospf2]
11:53:29.894453 IP 10.12.100.44 > 10.12.19.23: igmp query v1 [gaddr 189.127.0.0]
11:53:29.894454 IP 10.12.100.44 > 10.12.19.23:  ip-proto-177 0
11:53:29.944580 IP 10.12.100.44 > 10.12.19.23:  ip-proto-127 0
11:53:29.944600 IP 10.12.100.44 > 10.12.19.23:  ip-proto-222 0
11:53:29.944602 IP 10.12.100.44 > 10.12.19.23:  ip-proto-80 0
11:53:29.944603 IP 10.12.100.44 > 10.12.19.23:  ip-proto-235 0
11:53:29.944605 IP 10.12.100.44 > 10.12.19.23:  ip-proto-253 0
11:53:29.944648 IP 10.12.100.44 > 10.12.19.23:  ip-proto-56 0
11:53:29.944651 IP 10.12.100.44 > 10.12.19.23:  ip-proto-159 0
11:53:29.944652 IP 10.12.100.44 > 10.12.19.23:  ip-proto-43 0
11:53:29.944739 IP 10.12.100.44 > 10.12.19.23:  ip-proto-97 0
11:53:29.944747 IP 10.12.100.44 > 10.12.19.23:  ip-proto-255 0
11:53:29.944749 IP 10.12.100.44 > 10.12.19.23:  ip-proto-133 0
11:53:29.944750 IP 10.12.100.44 > 10.12.19.23: [|ip] (ipip-proto-4)
11:53:29.944752 IP 10.12.100.44 > 10.12.19.23:  ip-proto-220 0
11:53:29.944801 IP 10.12.100.44 > 10.12.19.23:  ip-proto-116 0
11:53:29.944839 IP 10.12.100.44 > 10.12.19.23:  ip-proto-246 0
11:53:29.944841 IP 10.12.100.44 > 10.12.19.23:  ip-proto-126 0
11:53:29.944842 IP 10.12.100.44 > 10.12.19.23:  ip-proto-107 0
11:53:29.944923 IP 10.12.100.44 > 10.12.19.23:  ip-proto-167 0
11:53:29.944930 IP 10.12.100.44 > 10.12.19.23:  ip-proto-40 0
11:53:29.947457 IP 10.12.100.44.57032 > 10.12.19.23.80: sctp (1) [INIT] [init tag: 1576149223] [rwnd: 32768] [OS: 10] [MIS: 2048] [init TSN: 2571241457] 
11:53:29.947465 IP 10.12.100.44 > 10.12.19.23:  ip-proto-7 0
11:53:29.947467 IP 10.12.100.44 > 10.12.19.23:  ip-proto-155 0
11:53:29.947468 IP 10.12.100.44 > 10.12.19.23:  ip-proto-161 0
11:53:29.947583 IP 10.12.100.44 > 10.12.19.23:  ip-proto-173 0
11:53:29.947585 IP 10.12.100.44 > 10.12.19.23:  ip-proto-23 0
11:53:29.947663 IP 10.12.100.44 > 10.12.19.23:  ip-proto-128 0
11:53:29.947665 IP 10.12.100.44 > 10.12.19.23:  ip-proto-145 0
11:53:29.947720 IP 10.12.100.44 > 10.12.19.23:  ip-proto-5 0
11:53:29.999372 IP 10.12.100.44 > 10.12.19.23:  ip-proto-40 0
11:53:29.999402 IP 10.12.100.44 > 10.12.19.23:  ip-proto-167 0
11:53:29.999403 IP 10.12.100.44 > 10.12.19.23:  ip-proto-186 0
11:53:29.999404 IP 10.12.100.44 > 10.12.19.23:  ip-proto-58 0
11:53:29.999405 IP 10.12.100.44 > 10.12.19.23:  ip-proto-138 0
11:53:29.999494 IP 10.12.100.44 > 10.12.19.23:  ip-proto-230 0
11:53:29.999497 IP 10.12.100.44 > 10.12.19.23:  ip-proto-57 0
11:53:29.999588 IP 10.12.100.44 > 10.12.19.23:  ip-proto-196 0
11:53:29.999591 IP 10.12.100.44 > 10.12.19.23:  ip-proto-124 0
11:53:29.999593 IP 10.12.100.44 > 10.12.19.23:  ip-proto-229 0
11:53:29.999636 IP 10.12.100.44 > 10.12.19.23:  ip-proto-234 0
11:53:29.999674 IP 10.12.100.44 > 10.12.19.23:  ip-proto-83 0
11:53:29.999676 IP 10.12.100.44 > 10.12.19.23:  ip-proto-209 0
11:53:29.999678 IP 10.12.100.44 > 10.12.19.23:  ip-proto-11 0
11:53:29.999721 IP 10.12.100.44 > 10.12.19.23:  ip-proto-101 0
11:53:29.999765 IP 10.12.100.44 > 10.12.19.23:  ip-proto-121 0
11:53:29.999767 IP 10.12.100.44 > 10.12.19.23:  ip-proto-66 0
11:53:29.999768 IP 10.12.100.44 > 10.12.19.23:  ip-proto-15 0
11:53:29.999811 IP 10.12.100.44 > 10.12.19.23:  ip-proto-254 0
11:53:30.002306 IP 10.12.100.44 > 10.12.19.23:  ip-proto-5 0
11:53:30.002325 IP 10.12.100.44 > 10.12.19.23:  ip-proto-145 0
11:53:30.002379 IP 10.12.100.44 > 10.12.19.23:  ip-proto-128 0
11:53:30.002382 IP 10.12.100.44 > 10.12.19.23:  ip-proto-23 0
11:53:30.002440 IP 10.12.100.44 > 10.12.19.23:  ip-proto-173 0
11:53:30.002443 IP 10.12.100.44 > 10.12.19.23:  ip-proto-161 0
11:53:30.002444 IP 10.12.100.44 > 10.12.19.23:  ip-proto-155 0
11:53:30.002508 IP 10.12.100.44 > 10.12.19.23:  ip-proto-7 0
11:53:30.002511 IP 10.12.100.44.57033 > 10.12.19.23.80: sctp (1) [INIT] [init tag: 940793815] [rwnd: 32768] [OS: 10] [MIS: 2048] [init TSN: 3966369935] 
11:53:30.052490 IP 10.12.100.44 > 10.12.19.23:  ip-proto-254 0
11:53:30.052517 IP 10.12.100.44 > 10.12.19.23:  ip-proto-15 0
11:53:30.052518 IP 10.12.100.44 > 10.12.19.23:  ip-proto-66 0
11:53:30.052519 IP 10.12.100.44 > 10.12.19.23:  ip-proto-121 0
11:53:30.052534 IP 10.12.100.44 > 10.12.19.23:  ip-proto-101 0
11:53:30.052585 IP 10.12.100.44 > 10.12.19.23:  ip-proto-11 0
11:53:30.052588 IP 10.12.100.44 > 10.12.19.23:  ip-proto-209 0
11:53:30.052589 IP 10.12.100.44 > 10.12.19.23:  ip-proto-83 0
11:53:30.052657 IP 10.12.100.44 > 10.12.19.23:  ip-proto-234 0
11:53:30.052725 IP 10.12.100.44 > 10.12.19.23:  ip-proto-229 0
11:53:30.052727 IP 10.12.100.44 > 10.12.19.23:  ip-proto-124 0
11:53:30.052728 IP 10.12.100.44 > 10.12.19.23:  ip-proto-196 0
11:53:30.052762 IP 10.12.100.44 > 10.12.19.23:  ip-proto-57 0
11:53:30.052764 IP 10.12.100.44 > 10.12.19.23:  ip-proto-230 0
11:53:30.052766 IP 10.12.100.44 > 10.12.19.23:  ip-proto-138 0
11:53:30.052832 IP 10.12.100.44 > 10.12.19.23:  ip-proto-58 0
11:53:30.052834 IP 10.12.100.44 > 10.12.19.23:  ip-proto-186 0
11:53:30.052901 IP 10.12.100.44 > 10.12.19.23:  ip-proto-167 0
11:53:30.052969 IP 10.12.100.44 > 10.12.19.23:  ip-proto-40 0
11:53:30.055528 IP 10.12.100.44.57034 > 10.12.19.23.80: sctp (1) [INIT] [init tag: 1121815994] [rwnd: 32768] [OS: 10] [MIS: 2048] [init TSN: 147500655] 
11:53:30.055537 IP 10.12.100.44 > 10.12.19.23:  ip-proto-7 0
11:53:30.055538 IP 10.12.100.44 > 10.12.19.23:  ip-proto-155 0
11:53:30.055540 IP 10.12.100.44 > 10.12.19.23:  ip-proto-161 0
11:53:30.055541 IP 10.12.100.44 > 10.12.19.23:  ip-proto-173 0
11:53:30.055585 IP 10.12.100.44 > 10.12.19.23:  ip-proto-23 0
11:53:30.055588 IP 10.12.100.44 > 10.12.19.23:  ip-proto-128 0
11:53:30.055589 IP 10.12.100.44 > 10.12.19.23:  ip-proto-145 0
11:53:30.055626 IP 10.12.100.44 > 10.12.19.23:  ip-proto-5 0
11:53:30.107266 IP 10.12.100.44 > 10.12.19.23:  ip-proto-186 0
11:53:30.107298 IP 10.12.100.44 > 10.12.19.23:  ip-proto-58 0
11:53:30.107300 IP 10.12.100.44 > 10.12.19.23:  ip-proto-138 0
11:53:30.107302 IP 10.12.100.44 > 10.12.19.23:  ip-proto-230 0
11:53:30.107318 IP 10.12.100.44 > 10.12.19.23:  ip-proto-57 0
11:53:30.107319 IP 10.12.100.44 > 10.12.19.23:  ip-proto-196 0
11:53:30.107384 IP 10.12.100.44 > 10.12.19.23:  ip-proto-124 0
11:53:30.107388 IP 10.12.100.44 > 10.12.19.23:  ip-proto-229 0
11:53:30.107389 IP 10.12.100.44 > 10.12.19.23:  ip-proto-234 0
11:53:30.107390 IP 10.12.100.44 > 10.12.19.23:  ip-proto-83 0
11:53:30.107391 IP 10.12.100.44 > 10.12.19.23:  ip-proto-209 0
11:53:30.107460 IP 10.12.100.44 > 10.12.19.23:  ip-proto-11 0
11:53:30.107463 IP 10.12.100.44 > 10.12.19.23:  ip-proto-101 0
11:53:30.107489 IP 10.12.100.44 > 10.12.19.23:  ip-proto-121 0
11:53:30.107559 IP 10.12.100.44 > 10.12.19.23:  ip-proto-66 0
11:53:30.107562 IP 10.12.100.44 > 10.12.19.23:  ip-proto-15 0
11:53:30.107563 IP 10.12.100.44 > 10.12.19.23:  ip-proto-254 0
11:53:30.107632 IP 10.12.100.44 > 10.12.19.23:  ip-proto-74 0
11:53:30.107634 IP 10.12.100.44 > 10.12.19.23:  ip-proto-189 0
11:53:30.110226 IP 10.12.100.44 > 10.12.19.23:  ip-proto-25 0
11:53:30.110237 IP 10.12.100.44 > 10.12.19.23:  ip-proto-91 0
11:53:30.110238 IP 10.12.100.44 > 10.12.19.23:  ip-proto-233 0
11:53:30.110239 IP 10.12.100.44 > 10.12.19.23:  ip-proto-163 0
11:53:30.110241 IP 10.12.100.44 > 10.12.19.23:  ip-proto-191 0
11:53:30.110242 IP 10.12.100.44 > 10.12.19.23:  ip-proto-93 0
11:53:30.110278 IP 10.12.100.44 > 10.12.19.23:  ip-proto-146 0
11:53:30.110281 IP 10.12.100.44 > 10.12.19.23: [|mobile]
11:53:30.110282 IP 10.12.100.44 > 10.12.19.23:  ip-proto-202 0
11:53:30.161621 IP 10.12.100.44 > 10.12.19.23:  ip-proto-189 0
11:53:30.161653 IP 10.12.100.44 > 10.12.19.23:  ip-proto-74 0
11:53:30.161655 IP 10.12.100.44 > 10.12.19.23:  ip-proto-27 0
11:53:30.161711 IP 10.12.100.44 > 10.12.19.23:  ip-proto-185 0
11:53:30.161714 IP 10.12.100.44 > 10.12.19.23:  ip-proto-39 0
11:53:30.161715 IP 10.12.100.44 > 10.12.19.23:  ip-proto-207 0
11:53:30.161716 IP 10.12.100.44 > 10.12.19.23:  ip-proto-26 0
11:53:30.161781 IP 10.12.100.44 > 10.12.19.23:  ip-proto-148 0
11:53:30.161784 IP 10.12.100.44 > 10.12.19.23:  ip-proto-240 0
11:53:30.161785 IP 10.12.100.44 > 10.12.19.23: 10.12.100.44 > 10.12.19.23: [|pgm]
11:53:30.161786 IP 10.12.100.44 > 10.12.19.23:  ip-proto-169 0
11:53:30.161903 IP 10.12.100.44 > 10.12.19.23:  ip-proto-212 0
11:53:30.161925 IP 10.12.100.44 > 10.12.19.23:  ip-proto-48 0
11:53:30.161926 IP 10.12.100.44 > 10.12.19.23:  ip-proto-242 0
11:53:30.161927 IP 10.12.100.44 > 10.12.19.23:  ip-proto-59 0
11:53:30.161928 IP 10.12.100.44 > 10.12.19.23:  ip-proto-142 0
11:53:30.161930 IP 10.12.100.44 > 10.12.19.23:  ip-proto-114 0
11:53:30.161986 IP 10.12.100.44 > 10.12.19.23:  ip-proto-62 0
11:53:30.161988 IP 10.12.100.44 > 10.12.19.23:  ip-proto-201 0
11:53:30.164588 IP 10.12.100.44 > 10.12.19.23:  ip-proto-202 0
11:53:30.164594 IP 10.12.100.44 > 10.12.19.23: [|mobile]
11:53:30.164595 IP 10.12.100.44 > 10.12.19.23:  ip-proto-146 0
11:53:30.164597 IP 10.12.100.44 > 10.12.19.23:  ip-proto-93 0
11:53:30.164644 IP 10.12.100.44 > 10.12.19.23:  ip-proto-191 0
11:53:30.164672 IP 10.12.100.44 > 10.12.19.23:  ip-proto-163 0
11:53:30.164674 IP 10.12.100.44 > 10.12.19.23:  ip-proto-233 0
11:53:30.164707 IP 10.12.100.44 > 10.12.19.23:  ip-proto-91 0
11:53:30.164722 IP 10.12.100.44 > 10.12.19.23:  ip-proto-25 0
11:53:30.216461 IP 10.12.100.44 > 10.12.19.23:  ip-proto-201 0
11:53:30.216469 IP 10.12.100.44 > 10.12.19.23:  ip-proto-62 0
11:53:30.216471 IP 10.12.100.44 > 10.12.19.23:  ip-proto-114 0
11:53:30.216472 IP 10.12.100.44 > 10.12.19.23:  ip-proto-142 0
11:53:30.216527 IP 10.12.100.44 > 10.12.19.23:  ip-proto-59 0
11:53:30.216529 IP 10.12.100.44 > 10.12.19.23:  ip-proto-242 0
11:53:30.216531 IP 10.12.100.44 > 10.12.19.23:  ip-proto-48 0
11:53:30.216570 IP 10.12.100.44 > 10.12.19.23:  ip-proto-212 0
11:53:30.216606 IP 10.12.100.44 > 10.12.19.23:  ip-proto-169 0
11:53:30.216609 IP 10.12.100.44 > 10.12.19.23: 10.12.100.44 > 10.12.19.23: [|pgm]
11:53:30.216610 IP 10.12.100.44 > 10.12.19.23:  ip-proto-240 0
11:53:30.216725 IP 10.12.100.44 > 10.12.19.23:  ip-proto-148 0
11:53:30.216732 IP 10.12.100.44 > 10.12.19.23:  ip-proto-26 0
11:53:30.216733 IP 10.12.100.44 > 10.12.19.23:  ip-proto-207 0
11:53:30.216734 IP 10.12.100.44 > 10.12.19.23:  ip-proto-39 0
11:53:30.216735 IP 10.12.100.44 > 10.12.19.23:  ip-proto-185 0
11:53:30.216737 IP 10.12.100.44 > 10.12.19.23:  ip-proto-27 0
11:53:30.216803 IP 10.12.100.44 > 10.12.19.23:  ip-proto-74 0
11:53:30.216806 IP 10.12.100.44 > 10.12.19.23:  ip-proto-189 0
11:53:30.219341 IP 10.12.100.44 > 10.12.19.23:  ip-proto-25 0
11:53:30.219348 IP 10.12.100.44 > 10.12.19.23:  ip-proto-91 0
11:53:30.219349 IP 10.12.100.44 > 10.12.19.23:  ip-proto-233 0
11:53:30.219351 IP 10.12.100.44 > 10.12.19.23:  ip-proto-163 0
11:53:30.219395 IP 10.12.100.44 > 10.12.19.23:  ip-proto-191 0
11:53:30.219397 IP 10.12.100.44 > 10.12.19.23:  ip-proto-93 0
11:53:30.219399 IP 10.12.100.44 > 10.12.19.23:  ip-proto-146 0
11:53:30.219435 IP 10.12.100.44 > 10.12.19.23: [|mobile]
11:53:30.219437 IP 10.12.100.44 > 10.12.19.23:  ip-proto-202 0
11:53:30.271184 IP 10.12.100.44 > 10.12.19.23:  ip-proto-27 0
11:53:30.271214 IP 10.12.100.44 > 10.12.19.23:  ip-proto-185 0
11:53:30.271216 IP 10.12.100.44 > 10.12.19.23:  ip-proto-39 0
11:53:30.271217 IP 10.12.100.44 > 10.12.19.23:  ip-proto-207 0
11:53:30.271218 IP 10.12.100.44 > 10.12.19.23:  ip-proto-26 0
11:53:30.271294 IP 10.12.100.44 > 10.12.19.23:  ip-proto-148 0
11:53:30.271312 IP 10.12.100.44 > 10.12.19.23:  ip-proto-240 0
11:53:30.271314 IP 10.12.100.44 > 10.12.19.23: 10.12.100.44 > 10.12.19.23: [|pgm]
11:53:30.271385 IP 10.12.100.44 > 10.12.19.23:  ip-proto-169 0
11:53:30.271387 IP 10.12.100.44 > 10.12.19.23:  ip-proto-212 0
11:53:30.271441 IP 10.12.100.44 > 10.12.19.23:  ip-proto-48 0
11:53:30.271443 IP 10.12.100.44 > 10.12.19.23:  ip-proto-242 0
11:53:30.271444 IP 10.12.100.44 > 10.12.19.23:  ip-proto-59 0
11:53:30.271492 IP 10.12.100.44 > 10.12.19.23:  ip-proto-142 0
11:53:30.271495 IP 10.12.100.44 > 10.12.19.23:  ip-proto-114 0
11:53:30.271496 IP 10.12.100.44 > 10.12.19.23:  ip-proto-62 0
11:53:30.271563 IP 10.12.100.44 > 10.12.19.23:  ip-proto-201 0
11:53:30.271565 IP 10.12.100.44 > 10.12.19.23:  ip-proto-14 0
11:53:30.271633 IP 10.12.100.44 > 10.12.19.23:  ip-proto-182 0
11:53:30.274253 IP 10.12.100.44 > 10.12.19.23:  ip-proto-197 0
11:53:30.274326 IP 10.12.100.44 > 10.12.19.23:  ip-proto-227 0
11:53:30.274339 IP 10.12.100.44 > 10.12.19.23:  ip-proto-45 0
11:53:30.274341 IP 10.12.100.44 > 10.12.19.23:  nd 0
11:53:30.274355 IP 10.12.100.44 > 10.12.19.23:  ip-proto-87 0
11:53:30.274409 IP 10.12.100.44 > 10.12.19.23:  ip-proto-206 0
11:53:30.274412 IP 10.12.100.44 > 10.12.19.23:  ip-proto-67 0
11:53:30.274483 IP 10.12.100.44 > 10.12.19.23:  ip-proto-71 0
11:53:30.274485 IP 10.12.100.44 > 10.12.19.23:  ip-proto-231 0
11:53:30.325685 IP 10.12.100.44 > 10.12.19.23:  ip-proto-182 0
11:53:30.325705 IP 10.12.100.44 > 10.12.19.23:  ip-proto-14 0
11:53:30.325707 IP 10.12.100.44 > 10.12.19.23:  ip-proto-31 0
11:53:30.325708 IP 10.12.100.44 > 10.12.19.23:  ip-proto-72 0
11:53:30.325709 IP 10.12.100.44 > 10.12.19.23:  ip-proto-223 0
11:53:30.325751 IP 10.12.100.44 > 10.12.19.23:  ip-proto-172 0
11:53:30.325754 IP 10.12.100.44 > 10.12.19.23:  ip-proto-247 0
11:53:30.325756 IP 10.12.100.44 > 10.12.19.23:  ip-proto-52 0
11:53:30.325848 IP 10.12.100.44 > 10.12.19.23:  ip-proto-53 0
11:53:30.325857 IP 10.12.100.44 > 10.12.19.23:  ip-proto-203 0
11:53:30.325858 IP 10.12.100.44 > 10.12.19.23:  ip-proto-252 0
11:53:30.325860 IP 10.12.100.44 > 10.12.19.23:  ip-proto-32 0
11:53:30.325861 IP 10.12.100.44 > 10.12.19.23:  ip-proto-249 0
11:53:30.325862 IP 10.12.100.44 > 10.12.19.23: 
		 packet exceeded snapshot
11:53:30.325953 IP 10.12.100.44 > 10.12.19.23:  ip-proto-54 0
11:53:30.325968 IP 10.12.100.44 > 10.12.19.23:  ip-proto-63 0
11:53:30.326017 IP 10.12.100.44 > 10.12.19.23: [|gre]
11:53:30.326019 IP 10.12.100.44 > 10.12.19.23:  ip-proto-106 0
11:53:30.326021 IP 10.12.100.44 > 10.12.19.23:  ip-proto-164 0
11:53:30.328601 IP 10.12.100.44 > 10.12.19.23:  ip-proto-231 0
11:53:30.328607 IP 10.12.100.44 > 10.12.19.23:  ip-proto-71 0
11:53:30.328609 IP 10.12.100.44 > 10.12.19.23:  ip-proto-67 0
11:53:30.328648 IP 10.12.100.44 > 10.12.19.23:  ip-proto-206 0
11:53:30.328650 IP 10.12.100.44 > 10.12.19.23:  ip-proto-87 0
11:53:30.328651 IP 10.12.100.44 > 10.12.19.23:  nd 0
11:53:30.328652 IP 10.12.100.44 > 10.12.19.23:  ip-proto-45 0
11:53:30.328693 IP 10.12.100.44 > 10.12.19.23:  ip-proto-227 0
11:53:30.328695 IP 10.12.100.44 > 10.12.19.23:  ip-proto-197 0
11:53:30.380253 IP 10.12.100.44 > 10.12.19.23:  ip-proto-164 0
11:53:30.380301 IP 10.12.100.44 > 10.12.19.23:  ip-proto-106 0
11:53:30.380303 IP 10.12.100.44 > 10.12.19.23: [|gre]
11:53:30.380304 IP 10.12.100.44 > 10.12.19.23:  ip-proto-63 0
11:53:30.380306 IP 10.12.100.44 > 10.12.19.23:  ip-proto-54 0
11:53:30.380307 IP 10.12.100.44 > 10.12.19.23: 
		 packet exceeded snapshot
11:53:30.380308 IP 10.12.100.44 > 10.12.19.23:  ip-proto-249 0
11:53:30.380374 IP 10.12.100.44 > 10.12.19.23:  ip-proto-32 0
11:53:30.380376 IP 10.12.100.44 > 10.12.19.23:  ip-proto-252 0
11:53:30.380378 IP 10.12.100.44 > 10.12.19.23:  ip-proto-203 0
11:53:30.380414 IP 10.12.100.44 > 10.12.19.23:  ip-proto-53 0
11:53:30.380527 IP 10.12.100.44 > 10.12.19.23:  ip-proto-52 0
11:53:30.380534 IP 10.12.100.44 > 10.12.19.23:  ip-proto-247 0
11:53:30.380536 IP 10.12.100.44 > 10.12.19.23:  ip-proto-172 0
11:53:30.380537 IP 10.12.100.44 > 10.12.19.23:  ip-proto-223 0
11:53:30.380538 IP 10.12.100.44 > 10.12.19.23:  ip-proto-72 0
11:53:30.380583 IP 10.12.100.44 > 10.12.19.23:  ip-proto-31 0
11:53:30.380585 IP 10.12.100.44 > 10.12.19.23:  ip-proto-14 0
11:53:30.380586 IP 10.12.100.44 > 10.12.19.23:  ip-proto-182 0
11:53:30.383197 IP 10.12.100.44 > 10.12.19.23:  ip-proto-197 0
11:53:30.383204 IP 10.12.100.44 > 10.12.19.23:  ip-proto-227 0
11:53:30.383206 IP 10.12.100.44 > 10.12.19.23:  ip-proto-45 0
11:53:30.383207 IP 10.12.100.44 > 10.12.19.23:  nd 0
11:53:30.383253 IP 10.12.100.44 > 10.12.19.23:  ip-proto-87 0
11:53:30.383256 IP 10.12.100.44 > 10.12.19.23:  ip-proto-206 0
11:53:30.383257 IP 10.12.100.44 > 10.12.19.23:  ip-proto-67 0
11:53:30.383296 IP 10.12.100.44 > 10.12.19.23:  ip-proto-71 0
11:53:30.383332 IP 10.12.100.44 > 10.12.19.23:  ip-proto-231 0
11:53:30.433113 IP 10.12.100.44 > 10.12.19.23:  ip-proto-53 0
11:53:30.433139 IP 10.12.100.44 > 10.12.19.23:  ip-proto-203 0
11:53:30.433141 IP 10.12.100.44 > 10.12.19.23:  ip-proto-252 0
11:53:30.433142 IP 10.12.100.44 > 10.12.19.23:  ip-proto-32 0
11:53:30.433203 IP 10.12.100.44 > 10.12.19.23:  ip-proto-249 0
11:53:30.433220 IP 10.12.100.44 > 10.12.19.23: 
		 packet exceeded snapshot
11:53:30.433222 IP 10.12.100.44 > 10.12.19.23:  ip-proto-54 0
11:53:30.433276 IP 10.12.100.44 > 10.12.19.23:  ip-proto-63 0
11:53:30.433278 IP 10.12.100.44 > 10.12.19.23: [|gre]
11:53:30.433280 IP 10.12.100.44 > 10.12.19.23:  ip-proto-106 0
11:53:30.433346 IP 10.12.100.44 > 10.12.19.23:  ip-proto-164 0
11:53:30.435619 IP 10.12.100.44 > 10.12.19.23:  ip-proto-31 0
11:53:30.435638 IP 10.12.100.44 > 10.12.19.23:  ip-proto-72 0
11:53:30.435640 IP 10.12.100.44 > 10.12.19.23:  ip-proto-223 0
11:53:30.435641 IP 10.12.100.44 > 10.12.19.23:  ip-proto-172 0
11:53:30.435694 IP 10.12.100.44 > 10.12.19.23:  ip-proto-247 0
11:53:30.435697 IP 10.12.100.44 > 10.12.19.23:  ip-proto-52 0
11:53:30.435698 IP 10.12.100.44 > 10.12.19.23:  ip-proto-225 0
11:53:30.489943 IP 10.12.100.44 > 10.12.19.23:  ip-proto-225 0
11:53:30.544702 IP 10.12.100.44 > 10.12.19.23:  ip-proto-225 0
11:53:33.078359 ARP, Reply 10.12.100.44 is-at 08:00:27:32:44:68, length 46
