11:36:23.874227 ARP, Request who-has 10.12.19.23 (ff:ff:ff:ff:ff:ff) tell 10.12.100.44, length 46
11:36:24.074754 IP 10.12.100.44.64912 > 10.12.19.23.1025: Flags [S], seq 2124068436, win 1024, options [mss 1460], length 0
11:36:24.074781 IP 10.12.100.44.64912 > 10.12.19.23.3389: Flags [S], seq 2124068436, win 1024, options [mss 1460], length 0
11:36:24.074783 IP 10.12.100.44.64912 > 10.12.19.23.995: Flags [S], seq 2124068436, win 1024, options [mss 1460], length 0
11:36:24.074785 IP 10.12.100.44.64912 > 10.12.19.23.143: Flags [S], seq 2124068436, win 1024, options [mss 1460], length 0
11:36:24.074786 IP 10.12.100.44.64912 > 10.12.19.23.113: Flags [S], seq 2124068436, win 1024, options [mss 1460], length 0
11:36:24.074788 IP 10.12.100.44.64912 > 10.12.19.23.8888: Flags [S], seq 2124068436, win 1024, options [mss 1460], length 0
11:36:24.074872 IP 10.12.100.44.64912 > 10.12.19.23.25: Flags [S], seq 2124068436, win 1024, options [mss 1460], length 0
11:36:24.074876 IP 10.12.100.44.64912 > 10.12.19.23.554: Flags [S], seq 2124068436, win 1024, options [mss 1460], length 0
11:36:24.074878 IP 10.12.100.44.64912 > 10.12.19.23.111: Flags [S], seq 2124068436, win 1024, options [mss 1460], length 0
11:36:24.074879 IP 10.12.100.44.64912 > 10.12.19.23.8080: Flags [S], seq 2124068436, win 1024, options [mss 1460], length 0
11:36:25.126172 IP 10.12.100.44.64913 > 10.12.19.23.8080: Flags [S], seq 2124133973, win 1024, options [mss 1460], length 0
11:36:25.126221 IP 10.12.100.44.64913 > 10.12.19.23.111: Flags [S], seq 2124133973, win 1024, options [mss 1460], length 0
11:36:25.126223 IP 10.12.100.44.64913 > 10.12.19.23.554: Flags [S], seq 2124133973, win 1024, options [mss 1460], length 0
11:36:25.126225 IP 10.12.100.44.64913 > 10.12.19.23.25: Flags [S], seq 2124133973, win 1024, options [mss 1460], length 0
11:36:25.126226 IP 10.12.100.44.64913 > 10.12.19.23.8888: Flags [S], seq 2124133973, win 1024, options [mss 1460], length 0
11:36:25.126350 IP 10.12.100.44.64913 > 10.12.19.23.113: Flags [S], seq 2124133973, win 1024, options [mss 1460], length 0
11:36:25.126369 IP 10.12.100.44.64913 > 10.12.19.23.143: Flags [S], seq 2124133973, win 1024, options [mss 1460], length 0
11:36:25.126370 IP 10.12.100.44.64913 > 10.12.19.23.995: Flags [S], seq 2124133973, win 1024, options [mss 1460], length 0
11:36:25.126439 IP 10.12.100.44.64913 > 10.12.19.23.3389: Flags [S], seq 2124133973, win 1024, options [mss 1460], length 0
11:36:25.126442 IP 10.12.100.44.64913 > 10.12.19.23.1025: Flags [S], seq 2124133973, win 1024, options [mss 1460], length 0
11:36:25.176424 IP 10.12.100.44.64912 > 10.12.19.23.445: Flags [S], seq 2124068436, win 1024, options [mss 1460], length 0
11:36:25.176437 IP 10.12.100.44.64912 > 10.12.19.23.135: Flags [S], seq 2124068436, win 1024, options [mss 1460], length 0
11:36:25.176439 IP 10.12.100.44.64912 > 10.12.19.23.443: Flags [S], seq 2124068436, win 1024, options [mss 1460], length 0
11:36:25.176463 IP 10.12.100.44.64912 > 10.12.19.23.1723: Flags [S], seq 2124068436, win 1024, options [mss 1460], length 0
11:36:25.176557 IP 10.12.100.44.64912 > 10.12.19.23.139: Flags [S], seq 2124068436, win 1024, options [mss 1460], length 0
11:36:25.176561 IP 10.12.100.44.64912 > 10.12.19.23.256: Flags [S], seq 2124068436, win 1024, options [mss 1460], length 0
11:36:25.179096 IP 10.12.100.44.64912 > 10.12.19.23.5900: Flags [S], seq 2124068436, win 1024, options [mss 1460], length 0
11:36:25.179105 IP 10.12.100.44.64912 > 10.12.19.23.80: Flags [S], seq 2124068436, win 1024, options [mss 1460], length 0
11:36:25.179126 IP 10.12.100.44.64912 > 10.12.19.23.587: Flags [S], seq 2124068436, win 1024, options [mss 1460], length 0
11:36:25.179129 IP 10.12.100.44.64912 > 10.12.19.23.110: Flags [S], seq 2124068436, win 1024, options [mss 1460], length 0
11:36:25.179343 IP 10.12.100.44.64912 > 10.12.19.23.80: Flags [R], seq 2124068437, win 0, length 0
11:36:25.226775 IP 10.12.100.44.64913 > 10.12.19.23.256: Flags [S], seq 2124133973, win 1024, options [mss 1460], length 0
11:36:25.226828 IP 10.12.100.44.64913 > 10.12.19.23.139: Flags [S], seq 2124133973, win 1024, options [mss 1460], length 0
11:36:25.226830 IP 10.12.100.44.64913 > 10.12.19.23.1723: Flags [S], seq 2124133973, win 1024, options [mss 1460], length 0
11:36:25.226832 IP 10.12.100.44.64913 > 10.12.19.23.443: Flags [S], seq 2124133973, win 1024, options [mss 1460], length 0
11:36:25.226871 IP 10.12.100.44.64913 > 10.12.19.23.135: Flags [S], seq 2124133973, win 1024, options [mss 1460], length 0
11:36:25.226874 IP 10.12.100.44.64913 > 10.12.19.23.445: Flags [S], seq 2124133973, win 1024, options [mss 1460], length 0
11:36:25.229533 IP 10.12.100.44.64913 > 10.12.19.23.110: Flags [S], seq 2124133973, win 1024, options [mss 1460], length 0
11:36:25.229542 IP 10.12.100.44.64913 > 10.12.19.23.587: Flags [S], seq 2124133973, win 1024, options [mss 1460], length 0
11:36:25.229544 IP 10.12.100.44.64913 > 10.12.19.23.80: Flags [S], seq 2124133973, win 1024, options [mss 1460], length 0
11:36:25.229593 IP 10.12.100.44.64913 > 10.12.19.23.5900: Flags [S], seq 2124133973, win 1024, options [mss 1460], length 0
11:36:25.229769 IP 10.12.100.44.64913 > 10.12.19.23.80: Flags [R], seq 2124133974, win 0, length 0
11:36:26.280836 IP 10.12.100.44.64914 > 10.12.19.23.5900: Flags [S], seq 2123937366, win 1024, options [mss 1460], length 0
11:36:26.280887 IP 10.12.100.44.64914 > 10.12.19.23.587: Flags [S], seq 2123937366, win 1024, options [mss 1460], length 0
11:36:26.280890 IP 10.12.100.44.64914 > 10.12.19.23.110: Flags [S], seq 2123937366, win 1024, options [mss 1460], length 0
11:36:26.280891 IP 10.12.100.44.64914 > 10.12.19.23.445: Flags [S], seq 2123937366, win 1024, options [mss 1460], length 0
11:36:26.280893 IP 10.12.100.44.64914 > 10.12.19.23.135: Flags [S], seq 2123937366, win 1024, options [mss 1460], length 0
11:36:26.280894 IP 10.12.100.44.64914 > 10.12.19.23.1723: Flags [S], seq 2123937366, win 1024, options [mss 1460], length 0
11:36:26.280983 IP 10.12.100.44.64914 > 10.12.19.23.139: Flags [S], seq 2123937366, win 1024, options [mss 1460], length 0
11:36:26.280987 IP 10.12.100.44.64914 > 10.12.19.23.256: Flags [S], seq 2123937366, win 1024, options [mss 1460], length 0
11:36:26.281002 IP 10.12.100.44.64914 > 10.12.19.23.1025: Flags [S], seq 2123937366, win 1024, options [mss 1460], length 0
11:36:26.281062 IP 10.12.100.44.64914 > 10.12.19.23.3389: Flags [S], seq 2123937366, win 1024, options [mss 1460], length 0
11:36:26.331779 IP 10.12.100.44.64914 > 10.12.19.23.995: Flags [S], seq 2123937366, win 1024, options [mss 1460], length 0
11:36:26.331799 IP 10.12.100.44.64914 > 10.12.19.23.143: Flags [S], seq 2123937366, win 1024, options [mss 1460], length 0
11:36:26.331801 IP 10.12.100.44.64914 > 10.12.19.23.113: Flags [S], seq 2123937366, win 1024, options [mss 1460], length 0
11:36:26.331803 IP 10.12.100.44.64914 > 10.12.19.23.8888: Flags [S], seq 2123937366, win 1024, options [mss 1460], length 0
11:36:26.331842 IP 10.12.100.44.64914 > 10.12.19.23.25: Flags [S], seq 2123937366, win 1024, options [mss 1460], length 0
11:36:26.331845 IP 10.12.100.44.64914 > 10.12.19.23.554: Flags [S], seq 2123937366, win 1024, options [mss 1460], length 0
11:36:26.331847 IP 10.12.100.44.64914 > 10.12.19.23.111: Flags [S], seq 2123937366, win 1024, options [mss 1460], length 0
11:36:26.331848 IP 10.12.100.44.64914 > 10.12.19.23.8080: Flags [S], seq 2123937366, win 1024, options [mss 1460], length 0
11:36:26.331894 IP 10.12.100.44.64912 > 10.12.19.23.21: Flags [S], seq 2124068436, win 1024, options [mss 1460], length 0
11:36:26.331898 IP 10.12.100.44.64912 > 10.12.19.23.53: Flags [S], seq 2124068436, win 1024, options [mss 1460], length 0
11:36:26.382038 IP 10.12.100.44.64912 > 10.12.19.23.199: Flags [S], seq 2124068436, win 1024, options [mss 1460], length 0
11:36:26.382062 IP 10.12.100.44.64912 > 10.12.19.23.3306: Flags [S], seq 2124068436, win 1024, options [mss 1460], length 0
11:36:26.382064 IP 10.12.100.44.64912 > 10.12.19.23.22: Flags [S], seq 2124068436, win 1024, options [mss 1460], length 0
11:36:26.382066 IP 10.12.100.44.64912 > 10.12.19.23.23: Flags [S], seq 2124068436, win 1024, options [mss 1460], length 0
11:36:26.382067 IP 10.12.100.44.64912 > 10.12.19.23.993: Flags [S], seq 2124068436, win 1024, options [mss 1460], length 0
11:36:26.382069 IP 10.12.100.44.64912 > 10.12.19.23.1720: Flags [S], seq 2124068436, win 1024, options [mss 1460], length 0
11:36:26.384368 IP 10.12.100.44.64913 > 10.12.19.23.53: Flags [S], seq 2124133973, win 1024, options [mss 1460], length 0
11:36:26.384386 IP 10.12.100.44.64913 > 10.12.19.23.21: Flags [S], seq 2124133973, win 1024, options [mss 1460], length 0
11:36:26.384388 IP 10.12.100.44.64912 > 10.12.19.23.4449: Flags [S], seq 2124068436, win 1024, options [mss 1460], length 0
11:36:26.384390 IP 10.12.100.44.64912 > 10.12.19.23.2601: Flags [S], seq 2124068436, win 1024, options [mss 1460], length 0
11:36:26.432484 IP 10.12.100.44.64913 > 10.12.19.23.1720: Flags [S], seq 2124133973, win 1024, options [mss 1460], length 0
11:36:26.432534 IP 10.12.100.44.64913 > 10.12.19.23.993: Flags [S], seq 2124133973, win 1024, options [mss 1460], length 0
11:36:26.432536 IP 10.12.100.44.64913 > 10.12.19.23.23: Flags [S], seq 2124133973, win 1024, options [mss 1460], length 0
11:36:26.432538 IP 10.12.100.44.64913 > 10.12.19.23.22: Flags [S], seq 2124133973, win 1024, options [mss 1460], length 0
11:36:26.432540 IP 10.12.100.44.64913 > 10.12.19.23.3306: Flags [S], seq 2124133973, win 1024, options [mss 1460], length 0
11:36:26.432541 IP 10.12.100.44.64913 > 10.12.19.23.199: Flags [S], seq 2124133973, win 1024, options [mss 1460], length 0
11:36:26.434739 IP 10.12.100.44.64913 > 10.12.19.23.2601: Flags [S], seq 2124133973, win 1024, options [mss 1460], length 0
11:36:26.434768 IP 10.12.100.44.64913 > 10.12.19.23.4449: Flags [S], seq 2124133973, win 1024, options [mss 1460], length 0
11:36:26.434770 IP 10.12.100.44.64914 > 10.12.19.23.21: Flags [S], seq 2123937366, win 1024, options [mss 1460], length 0
11:36:26.434772 IP 10.12.100.44.64914 > 10.12.19.23.53: Flags [S], seq 2123937366, win 1024, options [mss 1460], length 0
11:36:26.482723 IP 10.12.100.44.64915 > 10.12.19.23.443: Flags [S], seq 2140845908, win 1024, options [mss 1460], length 0
11:36:26.482776 IP 10.12.100.44.64914 > 10.12.19.23.199: Flags [S], seq 2123937366, win 1024, options [mss 1460], length 0
11:36:26.482791 IP 10.12.100.44.64914 > 10.12.19.23.3306: Flags [S], seq 2123937366, win 1024, options [mss 1460], length 0
11:36:26.482793 IP 10.12.100.44.64914 > 10.12.19.23.22: Flags [S], seq 2123937366, win 1024, options [mss 1460], length 0
11:36:26.482795 IP 10.12.100.44.64914 > 10.12.19.23.23: Flags [S], seq 2123937366, win 1024, options [mss 1460], length 0
11:36:26.482796 IP 10.12.100.44.64914 > 10.12.19.23.993: Flags [S], seq 2123937366, win 1024, options [mss 1460], length 0
11:36:26.485300 IP 10.12.100.44.64914 > 10.12.19.23.4449: Flags [S], seq 2123937366, win 1024, options [mss 1460], length 0
11:36:26.485324 IP 10.12.100.44.64914 > 10.12.19.23.2601: Flags [S], seq 2123937366, win 1024, options [mss 1460], length 0
11:36:26.485326 IP 10.12.100.44.64914 > 10.12.19.23.1720: Flags [S], seq 2123937366, win 1024, options [mss 1460], length 0
11:36:26.485328 IP 10.12.100.44.64912 > 10.12.19.23.2033: Flags [S], seq 2124068436, win 1024, options [mss 1460], length 0
11:36:26.535477 IP 10.12.100.44.64913 > 10.12.19.23.2033: Flags [S], seq 2124133973, win 1024, options [mss 1460], length 0
11:36:26.586261 IP 10.12.100.44.64914 > 10.12.19.23.2033: Flags [S], seq 2123937366, win 1024, options [mss 1460], length 0
11:36:26.636515 IP 10.12.100.44.64912 > 10.12.19.23.2045: Flags [S], seq 2124068436, win 1024, options [mss 1460], length 0
11:36:26.689271 IP 10.12.100.44.64913 > 10.12.19.23.2045: Flags [S], seq 2124133973, win 1024, options [mss 1460], length 0
11:36:26.689296 IP 10.12.100.44.64912 > 10.12.19.23.425: Flags [S], seq 2124068436, win 1024, options [mss 1460], length 0
11:36:26.689298 IP 10.12.100.44.64912 > 10.12.19.23.1875: Flags [S], seq 2124068436, win 1024, options [mss 1460], length 0
11:36:26.689300 IP 10.12.100.44.64912 > 10.12.19.23.787: Flags [S], seq 2124068436, win 1024, options [mss 1460], length 0
11:36:26.689301 IP 10.12.100.44.64912 > 10.12.19.23.4445: Flags [S], seq 2124068436, win 1024, options [mss 1460], length 0
11:36:26.689371 IP 10.12.100.44.64912 > 10.12.19.23.11967: Flags [S], seq 2124068436, win 1024, options [mss 1460], length 0
11:36:26.689375 IP 10.12.100.44.64912 > 10.12.19.23.1121: Flags [S], seq 2124068436, win 1024, options [mss 1460], length 0
11:36:26.739377 IP 10.12.100.44.64913 > 10.12.19.23.787: Flags [S], seq 2124133973, win 1024, options [mss 1460], length 0
11:36:26.739411 IP 10.12.100.44.64913 > 10.12.19.23.1875: Flags [S], seq 2124133973, win 1024, options [mss 1460], length 0
11:36:26.739426 IP 10.12.100.44.64913 > 10.12.19.23.425: Flags [S], seq 2124133973, win 1024, options [mss 1460], length 0
11:36:26.739427 IP 10.12.100.44.64914 > 10.12.19.23.2045: Flags [S], seq 2123937366, win 1024, options [mss 1460], length 0
11:36:26.741847 IP 10.12.100.44.64913 > 10.12.19.23.1121: Flags [S], seq 2124133973, win 1024, options [mss 1460], length 0
11:36:26.741869 IP 10.12.100.44.64913 > 10.12.19.23.11967: Flags [S], seq 2124133973, win 1024, options [mss 1460], length 0
11:36:26.741871 IP 10.12.100.44.64913 > 10.12.19.23.4445: Flags [S], seq 2124133973, win 1024, options [mss 1460], length 0
11:36:26.789683 IP 10.12.100.44.64914 > 10.12.19.23.425: Flags [S], seq 2123937366, win 1024, options [mss 1460], length 0
11:36:26.789755 IP 10.12.100.44.64914 > 10.12.19.23.1875: Flags [S], seq 2123937366, win 1024, options [mss 1460], length 0
11:36:26.789758 IP 10.12.100.44.64914 > 10.12.19.23.787: Flags [S], seq 2123937366, win 1024, options [mss 1460], length 0
11:36:26.789760 IP 10.12.100.44.64912 > 10.12.19.23.2260: Flags [S], seq 2124068436, win 1024, options [mss 1460], length 0
11:36:26.792388 IP 10.12.100.44.64914 > 10.12.19.23.4445: Flags [S], seq 2123937366, win 1024, options [mss 1460], length 0
11:36:26.792397 IP 10.12.100.44.64914 > 10.12.19.23.11967: Flags [S], seq 2123937366, win 1024, options [mss 1460], length 0
11:36:26.792399 IP 10.12.100.44.64914 > 10.12.19.23.1121: Flags [S], seq 2123937366, win 1024, options [mss 1460], length 0
11:36:26.840839 IP 10.12.100.44.64913 > 10.12.19.23.2260: Flags [S], seq 2124133973, win 1024, options [mss 1460], length 0
11:36:26.840860 IP 10.12.100.44.64912 > 10.12.19.23.3690: Flags [S], seq 2124068436, win 1024, options [mss 1460], length 0
11:36:26.840952 IP 10.12.100.44.64912 > 10.12.19.23.51103: Flags [S], seq 2124068436, win 1024, options [mss 1460], length 0
11:36:26.841054 IP 10.12.100.44.64912 > 10.12.19.23.9220: Flags [S], seq 2124068436, win 1024, options [mss 1460], length 0
11:36:26.843625 IP 10.12.100.44.64912 > 10.12.19.23.20828: Flags [S], seq 2124068436, win 1024, options [mss 1460], length 0
11:36:26.843634 IP 10.12.100.44.64912 > 10.12.19.23.4446: Flags [S], seq 2124068436, win 1024, options [mss 1460], length 0
11:36:26.843636 IP 10.12.100.44.64912 > 10.12.19.23.1110: Flags [S], seq 2124068436, win 1024, options [mss 1460], length 0
11:36:26.891288 IP 10.12.100.44.64913 > 10.12.19.23.9220: Flags [S], seq 2124133973, win 1024, options [mss 1460], length 0
11:36:26.891325 IP 10.12.100.44.64913 > 10.12.19.23.51103: Flags [S], seq 2124133973, win 1024, options [mss 1460], length 0
11:36:26.891327 IP 10.12.100.44.64913 > 10.12.19.23.3690: Flags [S], seq 2124133973, win 1024, options [mss 1460], length 0
11:36:26.891329 IP 10.12.100.44.64914 > 10.12.19.23.2260: Flags [S], seq 2123937366, win 1024, options [mss 1460], length 0
11:36:26.894103 IP 10.12.100.44.64913 > 10.12.19.23.1110: Flags [S], seq 2124133973, win 1024, options [mss 1460], length 0
11:36:26.894130 IP 10.12.100.44.64913 > 10.12.19.23.4446: Flags [S], seq 2124133973, win 1024, options [mss 1460], length 0
11:36:26.894132 IP 10.12.100.44.64913 > 10.12.19.23.20828: Flags [S], seq 2124133973, win 1024, options [mss 1460], length 0
11:36:26.941439 IP 10.12.100.44.64914 > 10.12.19.23.3690: Flags [S], seq 2123937366, win 1024, options [mss 1460], length 0
11:36:26.941474 IP 10.12.100.44.64914 > 10.12.19.23.51103: Flags [S], seq 2123937366, win 1024, options [mss 1460], length 0
11:36:26.941476 IP 10.12.100.44.64914 > 10.12.19.23.9220: Flags [S], seq 2123937366, win 1024, options [mss 1460], length 0
11:36:26.941531 IP 10.12.100.44.64912 > 10.12.19.23.1123: Flags [S], seq 2124068436, win 1024, options [mss 1460], length 0
11:36:26.944421 IP 10.12.100.44.64914 > 10.12.19.23.20828: Flags [S], seq 2123937366, win 1024, options [mss 1460], length 0
11:36:26.944431 IP 10.12.100.44.64914 > 10.12.19.23.4446: Flags [S], seq 2123937366, win 1024, options [mss 1460], length 0
11:36:26.944433 IP 10.12.100.44.64914 > 10.12.19.23.1110: Flags [S], seq 2123937366, win 1024, options [mss 1460], length 0
11:36:26.991612 IP 10.12.100.44.64912 > 10.12.19.23.843: Flags [S], seq 2124068436, win 1024, options [mss 1460], length 0
11:36:26.991646 IP 10.12.100.44.64912 > 10.12.19.23.5566: Flags [S], seq 2124068436, win 1024, options [mss 1460], length 0
11:36:26.991648 IP 10.12.100.44.64912 > 10.12.19.23.32778: Flags [S], seq 2124068436, win 1024, options [mss 1460], length 0
11:36:26.994025 IP 10.12.100.44.64913 > 10.12.19.23.1123: Flags [S], seq 2124133973, win 1024, options [mss 1460], length 0
11:36:26.996362 IP 10.12.100.44.64912 > 10.12.19.23.5850: Flags [S], seq 2124068436, win 1024, options [mss 1460], length 0
11:36:26.996382 IP 10.12.100.44.64912 > 10.12.19.23.2967: Flags [S], seq 2124068436, win 1024, options [mss 1460], length 0
11:36:26.996384 IP 10.12.100.44.64912 > 10.12.19.23.8045: Flags [S], seq 2124068436, win 1024, options [mss 1460], length 0
11:36:27.041973 IP 10.12.100.44.64913 > 10.12.19.23.32778: Flags [S], seq 2124133973, win 1024, options [mss 1460], length 0
11:36:27.041997 IP 10.12.100.44.64913 > 10.12.19.23.5566: Flags [S], seq 2124133973, win 1024, options [mss 1460], length 0
11:36:27.041999 IP 10.12.100.44.64913 > 10.12.19.23.843: Flags [S], seq 2124133973, win 1024, options [mss 1460], length 0
11:36:27.044441 IP 10.12.100.44.64914 > 10.12.19.23.1123: Flags [S], seq 2123937366, win 1024, options [mss 1460], length 0
11:36:27.046579 IP 10.12.100.44.64913 > 10.12.19.23.8045: Flags [S], seq 2124133973, win 1024, options [mss 1460], length 0
11:36:27.046591 IP 10.12.100.44.64913 > 10.12.19.23.2967: Flags [S], seq 2124133973, win 1024, options [mss 1460], length 0
11:36:27.046593 IP 10.12.100.44.64913 > 10.12.19.23.5850: Flags [S], seq 2124133973, win 1024, options [mss 1460], length 0
11:36:27.092418 IP 10.12.100.44.64914 > 10.12.19.23.843: Flags [S], seq 2123937366, win 1024, options [mss 1460], length 0
11:36:27.092442 IP 10.12.100.44.64914 > 10.12.19.23.5566: Flags [S], seq 2123937366, win 1024, options [mss 1460], length 0
11:36:27.092444 IP 10.12.100.44.64914 > 10.12.19.23.32778: Flags [S], seq 2123937366, win 1024, options [mss 1460], length 0
11:36:27.094881 IP 10.12.100.44.64912 > 10.12.19.23.1078: Flags [S], seq 2124068436, win 1024, options [mss 1460], length 0
11:36:27.097342 IP 10.12.100.44.64914 > 10.12.19.23.5850: Flags [S], seq 2123937366, win 1024, options [mss 1460], length 0
11:36:27.097360 IP 10.12.100.44.64914 > 10.12.19.23.2967: Flags [S], seq 2123937366, win 1024, options [mss 1460], length 0
11:36:27.097362 IP 10.12.100.44.64914 > 10.12.19.23.8045: Flags [S], seq 2123937366, win 1024, options [mss 1460], length 0
11:36:27.142533 IP 10.12.100.44.64912 > 10.12.19.23.2144: Flags [S], seq 2124068436, win 1024, options [mss 1460], length 0
11:36:27.142556 IP 10.12.100.44.64912 > 10.12.19.23.5859: Flags [S], seq 2124068436, win 1024, options [mss 1460], length 0
11:36:27.142558 IP 10.12.100.44.64912 > 10.12.19.23.1054: Flags [S], seq 2124068436, win 1024, options [mss 1460], length 0
11:36:27.145101 IP 10.12.100.44.64913 > 10.12.19.23.1078: Flags [S], seq 2124133973, win 1024, options [mss 1460], length 0
11:36:27.147461 IP 10.12.100.44.64912 > 10.12.19.23.6156: Flags [S], seq 2124068436, win 1024, options [mss 1460], length 0
11:36:27.147477 IP 10.12.100.44.64912 > 10.12.19.23.2725: Flags [S], seq 2124068436, win 1024, options [mss 1460], length 0
11:36:27.147479 IP 10.12.100.44.64912 > 10.12.19.23.10243: Flags [S], seq 2124068436, win 1024, options [mss 1460], length 0
11:36:27.192682 IP 10.12.100.44.64913 > 10.12.19.23.1054: Flags [S], seq 2124133973, win 1024, options [mss 1460], length 0
11:36:27.192705 IP 10.12.100.44.64913 > 10.12.19.23.5859: Flags [S], seq 2124133973, win 1024, options [mss 1460], length 0
11:36:27.192707 IP 10.12.100.44.64913 > 10.12.19.23.2144: Flags [S], seq 2124133973, win 1024, options [mss 1460], length 0
11:36:27.195406 IP 10.12.100.44.64914 > 10.12.19.23.1078: Flags [S], seq 2123937366, win 1024, options [mss 1460], length 0
11:36:27.197740 IP 10.12.100.44.64913 > 10.12.19.23.10243: Flags [S], seq 2124133973, win 1024, options [mss 1460], length 0
11:36:27.197759 IP 10.12.100.44.64913 > 10.12.19.23.2725: Flags [S], seq 2124133973, win 1024, options [mss 1460], length 0
11:36:27.197761 IP 10.12.100.44.64913 > 10.12.19.23.6156: Flags [S], seq 2124133973, win 1024, options [mss 1460], length 0
11:36:27.242841 IP 10.12.100.44.64914 > 10.12.19.23.2144: Flags [S], seq 2123937366, win 1024, options [mss 1460], length 0
11:36:27.242916 IP 10.12.100.44.64914 > 10.12.19.23.5859: Flags [S], seq 2123937366, win 1024, options [mss 1460], length 0
11:36:27.242918 IP 10.12.100.44.64914 > 10.12.19.23.1054: Flags [S], seq 2123937366, win 1024, options [mss 1460], length 0
11:36:27.245627 IP 10.12.100.44.64912 > 10.12.19.23.340: Flags [S], seq 2124068436, win 1024, options [mss 1460], length 0
11:36:27.248226 IP 10.12.100.44.64914 > 10.12.19.23.6156: Flags [S], seq 2123937366, win 1024, options [mss 1460], length 0
11:36:27.248238 IP 10.12.100.44.64914 > 10.12.19.23.2725: Flags [S], seq 2123937366, win 1024, options [mss 1460], length 0
11:36:27.248240 IP 10.12.100.44.64914 > 10.12.19.23.10243: Flags [S], seq 2123937366, win 1024, options [mss 1460], length 0
11:36:27.293147 IP 10.12.100.44.64912 > 10.12.19.23.10617: Flags [S], seq 2124068436, win 1024, options [mss 1460], length 0
11:36:27.293194 IP 10.12.100.44.64912 > 10.12.19.23.57797: Flags [S], seq 2124068436, win 1024, options [mss 1460], length 0
11:36:27.293196 IP 10.12.100.44.64912 > 10.12.19.23.1145: Flags [S], seq 2124068436, win 1024, options [mss 1460], length 0
11:36:27.295617 IP 10.12.100.44.64913 > 10.12.19.23.340: Flags [S], seq 2124133973, win 1024, options [mss 1460], length 0
11:36:27.298652 IP 10.12.100.44.64912 > 10.12.19.23.1045: Flags [S], seq 2124068436, win 1024, options [mss 1460], length 0
11:36:27.298660 IP 10.12.100.44.64912 > 10.12.19.23.1026: Flags [S], seq 2124068436, win 1024, options [mss 1460], length 0
11:36:27.298674 IP 10.12.100.44.64912 > 10.12.19.23.631: Flags [S], seq 2124068436, win 1024, options [mss 1460], length 0
11:36:27.343388 IP 10.12.100.44.64913 > 10.12.19.23.1145: Flags [S], seq 2124133973, win 1024, options [mss 1460], length 0
11:36:27.343430 IP 10.12.100.44.64913 > 10.12.19.23.57797: Flags [S], seq 2124133973, win 1024, options [mss 1460], length 0
11:36:27.343432 IP 10.12.100.44.64913 > 10.12.19.23.10617: Flags [S], seq 2124133973, win 1024, options [mss 1460], length 0
11:36:27.345947 IP 10.12.100.44.64914 > 10.12.19.23.340: Flags [S], seq 2123937366, win 1024, options [mss 1460], length 0
11:36:27.349055 IP 10.12.100.44.64913 > 10.12.19.23.631: Flags [S], seq 2124133973, win 1024, options [mss 1460], length 0
11:36:27.349088 IP 10.12.100.44.64913 > 10.12.19.23.1026: Flags [S], seq 2124133973, win 1024, options [mss 1460], length 0
11:36:27.349103 IP 10.12.100.44.64913 > 10.12.19.23.1045: Flags [S], seq 2124133973, win 1024, options [mss 1460], length 0
11:36:27.393628 IP 10.12.100.44.64914 > 10.12.19.23.10617: Flags [S], seq 2123937366, win 1024, options [mss 1460], length 0
11:36:27.393662 IP 10.12.100.44.64914 > 10.12.19.23.57797: Flags [S], seq 2123937366, win 1024, options [mss 1460], length 0
11:36:27.393664 IP 10.12.100.44.64914 > 10.12.19.23.1145: Flags [S], seq 2123937366, win 1024, options [mss 1460], length 0
11:36:27.396507 IP 10.12.100.44.64912 > 10.12.19.23.7778: Flags [S], seq 2124068436, win 1024, options [mss 1460], length 0
11:36:27.399283 IP 10.12.100.44.64914 > 10.12.19.23.1045: Flags [S], seq 2123937366, win 1024, options [mss 1460], length 0
11:36:27.399293 IP 10.12.100.44.64914 > 10.12.19.23.1026: Flags [S], seq 2123937366, win 1024, options [mss 1460], length 0
11:36:27.399295 IP 10.12.100.44.64914 > 10.12.19.23.631: Flags [S], seq 2123937366, win 1024, options [mss 1460], length 0
11:36:27.443776 IP 10.12.100.44.64912 > 10.12.19.23.5862: Flags [S], seq 2124068436, win 1024, options [mss 1460], length 0
11:36:27.443789 IP 10.12.100.44.64912 > 10.12.19.23.726: Flags [S], seq 2124068436, win 1024, options [mss 1460], length 0
11:36:27.443790 IP 10.12.100.44.64912 > 10.12.19.23.3826: Flags [S], seq 2124068436, win 1024, options [mss 1460], length 0
11:36:27.446653 IP 10.12.100.44.64913 > 10.12.19.23.7778: Flags [S], seq 2124133973, win 1024, options [mss 1460], length 0
11:36:27.449666 IP 10.12.100.44.64912 > 10.12.19.23.1089: Flags [S], seq 2124068436, win 1024, options [mss 1460], length 0
11:36:27.449673 IP 10.12.100.44.64912 > 10.12.19.23.2718: Flags [S], seq 2124068436, win 1024, options [mss 1460], length 0
11:36:27.449675 IP 10.12.100.44.64912 > 10.12.19.23.625: Flags [S], seq 2124068436, win 1024, options [mss 1460], length 0
11:36:27.493916 IP 10.12.100.44.64913 > 10.12.19.23.3826: Flags [S], seq 2124133973, win 1024, options [mss 1460], length 0
11:36:27.493940 IP 10.12.100.44.64913 > 10.12.19.23.726: Flags [S], seq 2124133973, win 1024, options [mss 1460], length 0
11:36:27.493941 IP 10.12.100.44.64913 > 10.12.19.23.5862: Flags [S], seq 2124133973, win 1024, options [mss 1460], length 0
11:36:27.497251 IP 10.12.100.44.64914 > 10.12.19.23.7778: Flags [S], seq 2123937366, win 1024, options [mss 1460], length 0
11:36:27.500282 IP 10.12.100.44.64913 > 10.12.19.23.625: Flags [S], seq 2124133973, win 1024, options [mss 1460], length 0
11:36:27.500316 IP 10.12.100.44.64913 > 10.12.19.23.2718: Flags [S], seq 2124133973, win 1024, options [mss 1460], length 0
11:36:27.500318 IP 10.12.100.44.64913 > 10.12.19.23.1089: Flags [S], seq 2124133973, win 1024, options [mss 1460], length 0
11:36:27.544182 IP 10.12.100.44.64914 > 10.12.19.23.5862: Flags [S], seq 2123937366, win 1024, options [mss 1460], length 0
11:36:27.544202 IP 10.12.100.44.64914 > 10.12.19.23.726: Flags [S], seq 2123937366, win 1024, options [mss 1460], length 0
11:36:27.544204 IP 10.12.100.44.64914 > 10.12.19.23.3826: Flags [S], seq 2123937366, win 1024, options [mss 1460], length 0
11:36:27.547775 IP 10.12.100.44.64912 > 10.12.19.23.1233: Flags [S], seq 2124068436, win 1024, options [mss 1460], length 0
11:36:27.550499 IP 10.12.100.44.64914 > 10.12.19.23.1089: Flags [S], seq 2123937366, win 1024, options [mss 1460], length 0
11:36:27.550508 IP 10.12.100.44.64914 > 10.12.19.23.2718: Flags [S], seq 2123937366, win 1024, options [mss 1460], length 0
11:36:27.550559 IP 10.12.100.44.64914 > 10.12.19.23.625: Flags [S], seq 2123937366, win 1024, options [mss 1460], length 0
11:36:27.595369 IP 10.12.100.44.64912 > 10.12.19.23.5925: Flags [S], seq 2124068436, win 1024, options [mss 1460], length 0
11:36:27.595381 IP 10.12.100.44.64912 > 10.12.19.23.5825: Flags [S], seq 2124068436, win 1024, options [mss 1460], length 0
11:36:27.595383 IP 10.12.100.44.64912 > 10.12.19.23.2251: Flags [S], seq 2124068436, win 1024, options [mss 1460], length 0
11:36:27.598270 IP 10.12.100.44.64913 > 10.12.19.23.1233: Flags [S], seq 2124133973, win 1024, options [mss 1460], length 0
11:36:27.601045 IP 10.12.100.44.64912 > 10.12.19.23.1974: Flags [S], seq 2124068436, win 1024, options [mss 1460], length 0
11:36:27.601052 IP 10.12.100.44.64912 > 10.12.19.23.16992: Flags [S], seq 2124068436, win 1024, options [mss 1460], length 0
11:36:27.601110 IP 10.12.100.44.64912 > 10.12.19.23.56738: Flags [S], seq 2124068436, win 1024, options [mss 1460], length 0
11:36:27.645562 IP 10.12.100.44.64913 > 10.12.19.23.2251: Flags [S], seq 2124133973, win 1024, options [mss 1460], length 0
11:36:27.645585 IP 10.12.100.44.64913 > 10.12.19.23.5825: Flags [S], seq 2124133973, win 1024, options [mss 1460], length 0
11:36:27.645588 IP 10.12.100.44.64913 > 10.12.19.23.5925: Flags [S], seq 2124133973, win 1024, options [mss 1460], length 0
11:36:27.648801 IP 10.12.100.44.64914 > 10.12.19.23.1233: Flags [S], seq 2123937366, win 1024, options [mss 1460], length 0
11:36:27.651293 IP 10.12.100.44.64913 > 10.12.19.23.56738: Flags [S], seq 2124133973, win 1024, options [mss 1460], length 0
11:36:27.651301 IP 10.12.100.44.64913 > 10.12.19.23.16992: Flags [S], seq 2124133973, win 1024, options [mss 1460], length 0
11:36:27.651304 IP 10.12.100.44.64913 > 10.12.19.23.1974: Flags [S], seq 2124133973, win 1024, options [mss 1460], length 0
11:36:27.695758 IP 10.12.100.44.64914 > 10.12.19.23.5925: Flags [S], seq 2123937366, win 1024, options [mss 1460], length 0
11:36:27.695780 IP 10.12.100.44.64914 > 10.12.19.23.5825: Flags [S], seq 2123937366, win 1024, options [mss 1460], length 0
11:36:27.695783 IP 10.12.100.44.64914 > 10.12.19.23.2251: Flags [S], seq 2123937366, win 1024, options [mss 1460], length 0
11:36:27.699206 IP 10.12.100.44.64912 > 10.12.19.23.6580: Flags [S], seq 2124068436, win 1024, options [mss 1460], length 0
11:36:27.701666 IP 10.12.100.44.64914 > 10.12.19.23.1974: Flags [S], seq 2123937366, win 1024, options [mss 1460], length 0
11:36:27.701687 IP 10.12.100.44.64914 > 10.12.19.23.16992: Flags [S], seq 2123937366, win 1024, options [mss 1460], length 0
11:36:27.701689 IP 10.12.100.44.64914 > 10.12.19.23.56738: Flags [S], seq 2123937366, win 1024, options [mss 1460], length 0
11:36:27.746041 IP 10.12.100.44.64916 > 10.12.19.23.443: Flags [S], seq 2090513492, win 1024, options [mss 1460], length 0
11:36:27.746096 IP 10.12.100.44.64912 > 10.12.19.23.3168: Flags [S], seq 2124068436, win 1024, options [mss 1460], length 0
11:36:27.746100 IP 10.12.100.44.64912 > 10.12.19.23.2702: Flags [S], seq 2124068436, win 1024, options [mss 1460], length 0
11:36:27.749805 IP 10.12.100.44.64913 > 10.12.19.23.6580: Flags [S], seq 2124133973, win 1024, options [mss 1460], length 0
11:36:27.752339 IP 10.12.100.44.64912 > 10.12.19.23.6667: Flags [S], seq 2124068436, win 1024, options [mss 1460], length 0
11:36:27.752359 IP 10.12.100.44.64912 > 10.12.19.23.20005: Flags [S], seq 2124068436, win 1024, options [mss 1460], length 0
11:36:27.752361 IP 10.12.100.44.64912 > 10.12.19.23.50003: Flags [S], seq 2124068436, win 1024, options [mss 1460], length 0
11:36:27.802472 IP 10.12.100.44.64913 > 10.12.19.23.50003: Flags [S], seq 2124133973, win 1024, options [mss 1460], length 0
11:36:27.853564 IP 10.12.100.44.64914 > 10.12.19.23.50003: Flags [S], seq 2123937366, win 1024, options [mss 1460], length 0
11:36:27.907162 IP 10.12.100.44.64913 > 10.12.19.23.20005: Flags [S], seq 2124133973, win 1024, options [mss 1460], length 0
11:36:27.907184 IP 10.12.100.44.64913 > 10.12.19.23.6667: Flags [S], seq 2124133973, win 1024, options [mss 1460], length 0
11:36:27.907186 IP 10.12.100.44.64914 > 10.12.19.23.6580: Flags [S], seq 2123937366, win 1024, options [mss 1460], length 0
11:36:27.907188 IP 10.12.100.44.64913 > 10.12.19.23.2702: Flags [S], seq 2124133973, win 1024, options [mss 1460], length 0
11:36:27.957385 IP 10.12.100.44.64914 > 10.12.19.23.2702: Flags [S], seq 2123937366, win 1024, options [mss 1460], length 0
11:36:27.957422 IP 10.12.100.44.64914 > 10.12.19.23.6667: Flags [S], seq 2123937366, win 1024, options [mss 1460], length 0
11:36:27.957424 IP 10.12.100.44.64914 > 10.12.19.23.20005: Flags [S], seq 2123937366, win 1024, options [mss 1460], length 0
11:36:27.957426 IP 10.12.100.44.64913 > 10.12.19.23.3168: Flags [S], seq 2124133973, win 1024, options [mss 1460], length 0
11:36:28.007614 IP 10.12.100.44.64914 > 10.12.19.23.3168: Flags [S], seq 2123937366, win 1024, options [mss 1460], length 0
11:36:28.007631 IP 10.12.100.44.64912 > 10.12.19.23.6566: Flags [S], seq 2124068436, win 1024, options [mss 1460], length 0
11:36:28.007633 IP 10.12.100.44.64912 > 10.12.19.23.1524: Flags [S], seq 2124068436, win 1024, options [mss 1460], length 0
11:36:28.007634 IP 10.12.100.44.64912 > 10.12.19.23.34573: Flags [S], seq 2124068436, win 1024, options [mss 1460], length 0
11:36:28.058033 IP 10.12.100.44.64913 > 10.12.19.23.34573: Flags [S], seq 2124133973, win 1024, options [mss 1460], length 0
11:36:28.058068 IP 10.12.100.44.64913 > 10.12.19.23.1524: Flags [S], seq 2124133973, win 1024, options [mss 1460], length 0
11:36:28.058070 IP 10.12.100.44.64913 > 10.12.19.23.6566: Flags [S], seq 2124133973, win 1024, options [mss 1460], length 0
11:36:28.058072 IP 10.12.100.44.64912 > 10.12.19.23.6007: Flags [S], seq 2124068436, win 1024, options [mss 1460], length 0
11:36:28.108317 IP 10.12.100.44.64913 > 10.12.19.23.6007: Flags [S], seq 2124133973, win 1024, options [mss 1460], length 0
11:36:28.108340 IP 10.12.100.44.64914 > 10.12.19.23.6566: Flags [S], seq 2123937366, win 1024, options [mss 1460], length 0
11:36:28.108342 IP 10.12.100.44.64914 > 10.12.19.23.1524: Flags [S], seq 2123937366, win 1024, options [mss 1460], length 0
11:36:28.108344 IP 10.12.100.44.64914 > 10.12.19.23.34573: Flags [S], seq 2123937366, win 1024, options [mss 1460], length 0
11:36:28.158354 IP 10.12.100.44.64914 > 10.12.19.23.6007: Flags [S], seq 2123937366, win 1024, options [mss 1460], length 0
11:36:28.160797 IP 10.12.100.44.64912 > 10.12.19.23.9090: Flags [S], seq 2124068436, win 1024, options [mss 1460], length 0
11:36:28.160806 IP 10.12.100.44.64912 > 10.12.19.23.4998: Flags [S], seq 2124068436, win 1024, options [mss 1460], length 0
11:36:28.160808 IP 10.12.100.44.64912 > 10.12.19.23.6699: Flags [S], seq 2124068436, win 1024, options [mss 1460], length 0
11:36:28.208868 IP 10.12.100.44.64912 > 10.12.19.23.5054: Flags [S], seq 2124068436, win 1024, options [mss 1460], length 0
11:36:28.211223 IP 10.12.100.44.64913 > 10.12.19.23.6699: Flags [S], seq 2124133973, win 1024, options [mss 1460], length 0
11:36:28.211233 IP 10.12.100.44.64913 > 10.12.19.23.4998: Flags [S], seq 2124133973, win 1024, options [mss 1460], length 0
11:36:28.211235 IP 10.12.100.44.64913 > 10.12.19.23.9090: Flags [S], seq 2124133973, win 1024, options [mss 1460], length 0
11:36:28.259390 IP 10.12.100.44.64913 > 10.12.19.23.5054: Flags [S], seq 2124133973, win 1024, options [mss 1460], length 0
11:36:28.261881 IP 10.12.100.44.64914 > 10.12.19.23.9090: Flags [S], seq 2123937366, win 1024, options [mss 1460], length 0
11:36:28.261915 IP 10.12.100.44.64914 > 10.12.19.23.4998: Flags [S], seq 2123937366, win 1024, options [mss 1460], length 0
11:36:28.261917 IP 10.12.100.44.64914 > 10.12.19.23.6699: Flags [S], seq 2123937366, win 1024, options [mss 1460], length 0
11:36:28.310106 IP 10.12.100.44.64914 > 10.12.19.23.5054: Flags [S], seq 2123937366, win 1024, options [mss 1460], length 0
11:36:28.312494 IP 10.12.100.44.64912 > 10.12.19.23.1719: Flags [S], seq 2124068436, win 1024, options [mss 1460], length 0
11:36:28.312502 IP 10.12.100.44.64912 > 10.12.19.23.9100: Flags [S], seq 2124068436, win 1024, options [mss 1460], length 0
11:36:28.312504 IP 10.12.100.44.64912 > 10.12.19.23.44501: Flags [S], seq 2124068436, win 1024, options [mss 1460], length 0
11:36:28.360438 IP 10.12.100.44.64912 > 10.12.19.23.16080: Flags [S], seq 2124068436, win 1024, options [mss 1460], length 0
11:36:28.362915 IP 10.12.100.44.64913 > 10.12.19.23.44501: Flags [S], seq 2124133973, win 1024, options [mss 1460], length 0
11:36:28.362935 IP 10.12.100.44.64913 > 10.12.19.23.9100: Flags [S], seq 2124133973, win 1024, options [mss 1460], length 0
11:36:28.362938 IP 10.12.100.44.64913 > 10.12.19.23.1719: Flags [S], seq 2124133973, win 1024, options [mss 1460], length 0
11:36:28.410666 IP 10.12.100.44.64913 > 10.12.19.23.16080: Flags [S], seq 2124133973, win 1024, options [mss 1460], length 0
11:36:28.413288 IP 10.12.100.44.64914 > 10.12.19.23.1719: Flags [S], seq 2123937366, win 1024, options [mss 1460], length 0
11:36:28.413296 IP 10.12.100.44.64914 > 10.12.19.23.9100: Flags [S], seq 2123937366, win 1024, options [mss 1460], length 0
11:36:28.413299 IP 10.12.100.44.64914 > 10.12.19.23.44501: Flags [S], seq 2123937366, win 1024, options [mss 1460], length 0
11:36:28.460876 IP 10.12.100.44.64914 > 10.12.19.23.16080: Flags [S], seq 2123937366, win 1024, options [mss 1460], length 0
11:36:28.463816 IP 10.12.100.44.64912 > 10.12.19.23.7: Flags [S], seq 2124068436, win 1024, options [mss 1460], length 0
11:36:28.463824 IP 10.12.100.44.64912 > 10.12.19.23.9050: Flags [S], seq 2124068436, win 1024, options [mss 1460], length 0
11:36:28.463826 IP 10.12.100.44.64912 > 10.12.19.23.3322: Flags [S], seq 2124068436, win 1024, options [mss 1460], length 0
11:36:28.511317 IP 10.12.100.44.64912 > 10.12.19.23.8031: Flags [S], seq 2124068436, win 1024, options [mss 1460], length 0
11:36:28.514303 IP 10.12.100.44.64913 > 10.12.19.23.3322: Flags [S], seq 2124133973, win 1024, options [mss 1460], length 0
11:36:28.514311 IP 10.12.100.44.64913 > 10.12.19.23.9050: Flags [S], seq 2124133973, win 1024, options [mss 1460], length 0
11:36:28.514313 IP 10.12.100.44.64913 > 10.12.19.23.7: Flags [S], seq 2124133973, win 1024, options [mss 1460], length 0
11:36:28.561601 IP 10.12.100.44.64913 > 10.12.19.23.8031: Flags [S], seq 2124133973, win 1024, options [mss 1460], length 0
11:36:28.564610 IP 10.12.100.44.64914 > 10.12.19.23.7: Flags [S], seq 2123937366, win 1024, options [mss 1460], length 0
11:36:28.564619 IP 10.12.100.44.64914 > 10.12.19.23.9050: Flags [S], seq 2123937366, win 1024, options [mss 1460], length 0
11:36:28.564621 IP 10.12.100.44.64914 > 10.12.19.23.3322: Flags [S], seq 2123937366, win 1024, options [mss 1460], length 0
11:36:28.611783 IP 10.12.100.44.64914 > 10.12.19.23.8031: Flags [S], seq 2123937366, win 1024, options [mss 1460], length 0
11:36:28.615156 IP 10.12.100.44.64912 > 10.12.19.23.1050: Flags [S], seq 2124068436, win 1024, options [mss 1460], length 0
11:36:28.615165 IP 10.12.100.44.64912 > 10.12.19.23.9290: Flags [S], seq 2124068436, win 1024, options [mss 1460], length 0
11:36:28.615167 IP 10.12.100.44.64912 > 10.12.19.23.2135: Flags [S], seq 2124068436, win 1024, options [mss 1460], length 0
11:36:28.661851 IP 10.12.100.44.64912 > 10.12.19.23.1138: Flags [S], seq 2124068436, win 1024, options [mss 1460], length 0
11:36:28.665780 IP 10.12.100.44.64913 > 10.12.19.23.2135: Flags [S], seq 2124133973, win 1024, options [mss 1460], length 0
11:36:28.665789 IP 10.12.100.44.64913 > 10.12.19.23.9290: Flags [S], seq 2124133973, win 1024, options [mss 1460], length 0
11:36:28.665791 IP 10.12.100.44.64913 > 10.12.19.23.1050: Flags [S], seq 2124133973, win 1024, options [mss 1460], length 0
11:36:28.711927 IP 10.12.100.44.64913 > 10.12.19.23.1138: Flags [S], seq 2124133973, win 1024, options [mss 1460], length 0
11:36:28.716484 IP 10.12.100.44.64914 > 10.12.19.23.1050: Flags [S], seq 2123937366, win 1024, options [mss 1460], length 0
11:36:28.716491 IP 10.12.100.44.64914 > 10.12.19.23.9290: Flags [S], seq 2123937366, win 1024, options [mss 1460], length 0
11:36:28.716494 IP 10.12.100.44.64914 > 10.12.19.23.2135: Flags [S], seq 2123937366, win 1024, options [mss 1460], length 0
11:36:28.762845 IP 10.12.100.44.64914 > 10.12.19.23.1138: Flags [S], seq 2123937366, win 1024, options [mss 1460], length 0
11:36:28.767133 IP 10.12.100.44.64912 > 10.12.19.23.524: Flags [S], seq 2124068436, win 1024, options [mss 1460], length 0
11:36:28.767155 IP 10.12.100.44.64912 > 10.12.19.23.49153: Flags [S], seq 2124068436, win 1024, options [mss 1460], length 0
