11:38:01.887187 ARP, Request who-has 10.12.19.23 (ff:ff:ff:ff:ff:ff) tell 10.12.100.44, length 46
11:38:02.087768 IP 10.12.100.44.37085 > 10.12.19.23.8888: Flags [S], seq 499020906, win 29200, options [mss 1460,sackOK,TS val 6599223 ecr 0,nop,wscale 7], length 0
11:38:02.087792 IP 10.12.100.44.50429 > 10.12.19.23.25: Flags [S], seq 3357880300, win 29200, options [mss 1460,sackOK,TS val 6599223 ecr 0,nop,wscale 7], length 0
11:38:02.087794 IP 10.12.100.44.47952 > 10.12.19.23.1723: Flags [S], seq 22938875, win 29200, options [mss 1460,sackOK,TS val 6599223 ecr 0,nop,wscale 7], length 0
11:38:02.087795 IP 10.12.100.44.33978 > 10.12.19.23.80: Flags [S], seq 441531300, win 29200, options [mss 1460,sackOK,TS val 6599223 ecr 0,nop,wscale 7], length 0
11:38:02.087826 IP 10.12.100.44.49687 > 10.12.19.23.199: Flags [S], seq 4210412006, win 29200, options [mss 1460,sackOK,TS val 6599223 ecr 0,nop,wscale 7], length 0
11:38:02.087829 IP 10.12.100.44.45731 > 10.12.19.23.139: Flags [S], seq 2227416308, win 29200, options [mss 1460,sackOK,TS val 6599223 ecr 0,nop,wscale 7], length 0
11:38:02.087921 IP 10.12.100.44.47022 > 10.12.19.23.587: Flags [S], seq 3369925286, win 29200, options [mss 1460,sackOK,TS val 6599223 ecr 0,nop,wscale 7], length 0
11:38:02.087925 IP 10.12.100.44.55220 > 10.12.19.23.993: Flags [S], seq 1718976979, win 29200, options [mss 1460,sackOK,TS val 6599223 ecr 0,nop,wscale 7], length 0
11:38:02.087926 IP 10.12.100.44.33978 > 10.12.19.23.80: Flags [.], ack 2580696107, win 229, options [nop,nop,TS val 6599223 ecr 826028301], length 0
11:38:02.087996 IP 10.12.100.44.60425 > 10.12.19.23.3389: Flags [S], seq 3480223233, win 29200, options [mss 1460,sackOK,TS val 6599223 ecr 0,nop,wscale 7], length 0
11:38:02.087999 IP 10.12.100.44.53011 > 10.12.19.23.110: Flags [S], seq 1052447022, win 29200, options [mss 1460,sackOK,TS val 6599223 ecr 0,nop,wscale 7], length 0
11:38:02.088054 IP 10.12.100.44.33978 > 10.12.19.23.80: Flags [R.], seq 0, ack 1, win 229, options [nop,nop,TS val 6599223 ecr 826028301], length 0
11:38:02.088058 IP 10.12.100.44.50038 > 10.12.19.23.143: Flags [S], seq 431381183, win 29200, options [mss 1460,sackOK,TS val 6599223 ecr 0,nop,wscale 7], length 0
11:38:02.088118 IP 10.12.100.44.46810 > 10.12.19.23.554: Flags [S], seq 1286801128, win 29200, options [mss 1460,sackOK,TS val 6599223 ecr 0,nop,wscale 7], length 0
11:38:03.085961 IP 10.12.100.44.50429 > 10.12.19.23.25: Flags [S], seq 3357880300, win 29200, options [mss 1460,sackOK,TS val 6599473 ecr 0,nop,wscale 7], length 0
11:38:03.085986 IP 10.12.100.44.47952 > 10.12.19.23.1723: Flags [S], seq 22938875, win 29200, options [mss 1460,sackOK,TS val 6599473 ecr 0,nop,wscale 7], length 0
11:38:03.085988 IP 10.12.100.44.49687 > 10.12.19.23.199: Flags [S], seq 4210412006, win 29200, options [mss 1460,sackOK,TS val 6599473 ecr 0,nop,wscale 7], length 0
11:38:03.085990 IP 10.12.100.44.45731 > 10.12.19.23.139: Flags [S], seq 2227416308, win 29200, options [mss 1460,sackOK,TS val 6599473 ecr 0,nop,wscale 7], length 0
11:38:03.085991 IP 10.12.100.44.47022 > 10.12.19.23.587: Flags [S], seq 3369925286, win 29200, options [mss 1460,sackOK,TS val 6599473 ecr 0,nop,wscale 7], length 0
11:38:03.085993 IP 10.12.100.44.55220 > 10.12.19.23.993: Flags [S], seq 1718976979, win 29200, options [mss 1460,sackOK,TS val 6599473 ecr 0,nop,wscale 7], length 0
11:38:03.085995 IP 10.12.100.44.60425 > 10.12.19.23.3389: Flags [S], seq 3480223233, win 29200, options [mss 1460,sackOK,TS val 6599473 ecr 0,nop,wscale 7], length 0
11:38:03.085996 IP 10.12.100.44.53011 > 10.12.19.23.110: Flags [S], seq 1052447022, win 29200, options [mss 1460,sackOK,TS val 6599473 ecr 0,nop,wscale 7], length 0
11:38:03.085998 IP 10.12.100.44.50038 > 10.12.19.23.143: Flags [S], seq 431381183, win 29200, options [mss 1460,sackOK,TS val 6599473 ecr 0,nop,wscale 7], length 0
11:38:03.085999 IP 10.12.100.44.46810 > 10.12.19.23.554: Flags [S], seq 1286801128, win 29200, options [mss 1460,sackOK,TS val 6599473 ecr 0,nop,wscale 7], length 0
11:38:03.139288 IP 10.12.100.44.46811 > 10.12.19.23.554: Flags [S], seq 1695196598, win 29200, options [mss 1460,sackOK,TS val 6599486 ecr 0,nop,wscale 7], length 0
11:38:03.139396 IP 10.12.100.44.50041 > 10.12.19.23.143: Flags [S], seq 604361367, win 29200, options [mss 1460,sackOK,TS val 6599486 ecr 0,nop,wscale 7], length 0
11:38:03.139401 IP 10.12.100.44.53016 > 10.12.19.23.110: Flags [S], seq 3474940742, win 29200, options [mss 1460,sackOK,TS val 6599486 ecr 0,nop,wscale 7], length 0
11:38:03.139403 IP 10.12.100.44.60432 > 10.12.19.23.3389: Flags [S], seq 644183584, win 29200, options [mss 1460,sackOK,TS val 6599486 ecr 0,nop,wscale 7], length 0
11:38:03.139405 IP 10.12.100.44.55229 > 10.12.19.23.993: Flags [S], seq 3192874603, win 29200, options [mss 1460,sackOK,TS val 6599486 ecr 0,nop,wscale 7], length 0
11:38:03.139406 IP 10.12.100.44.47033 > 10.12.19.23.587: Flags [S], seq 2779348596, win 29200, options [mss 1460,sackOK,TS val 6599486 ecr 0,nop,wscale 7], length 0
11:38:03.139408 IP 10.12.100.44.45744 > 10.12.19.23.139: Flags [S], seq 1284081679, win 29200, options [mss 1460,sackOK,TS val 6599486 ecr 0,nop,wscale 7], length 0
11:38:03.139470 IP 10.12.100.44.49702 > 10.12.19.23.199: Flags [S], seq 3876499914, win 29200, options [mss 1460,sackOK,TS val 6599486 ecr 0,nop,wscale 7], length 0
11:38:03.139474 IP 10.12.100.44.47970 > 10.12.19.23.1723: Flags [S], seq 2145459430, win 29200, options [mss 1460,sackOK,TS val 6599486 ecr 0,nop,wscale 7], length 0
11:38:03.139475 IP 10.12.100.44.50449 > 10.12.19.23.25: Flags [S], seq 3215779162, win 29200, options [mss 1460,sackOK,TS val 6599486 ecr 0,nop,wscale 7], length 0
11:38:03.139542 IP 10.12.100.44.37107 > 10.12.19.23.8888: Flags [S], seq 3888037904, win 29200, options [mss 1460,sackOK,TS val 6599486 ecr 0,nop,wscale 7], length 0
11:38:03.189282 IP 10.12.100.44.52495 > 10.12.19.23.53: Flags [S], seq 193007412, win 29200, options [mss 1460,sackOK,TS val 6599498 ecr 0,nop,wscale 7], length 0
11:38:03.189301 IP 10.12.100.44.51891 > 10.12.19.23.1025: Flags [S], seq 129882254, win 29200, options [mss 1460,sackOK,TS val 6599498 ecr 0,nop,wscale 7], length 0
11:38:03.189304 IP 10.12.100.44.42631 > 10.12.19.23.445: Flags [S], seq 3635425186, win 29200, options [mss 1460,sackOK,TS val 6599498 ecr 0,nop,wscale 7], length 0
11:38:03.189434 IP 10.12.100.44.57691 > 10.12.19.23.22: Flags [S], seq 3491388996, win 29200, options [mss 1460,sackOK,TS val 6599499 ecr 0,nop,wscale 7], length 0
11:38:03.189444 IP 10.12.100.44.33290 > 10.12.19.23.1720: Flags [S], seq 1262468609, win 29200, options [mss 1460,sackOK,TS val 6599499 ecr 0,nop,wscale 7], length 0
11:38:03.189446 IP 10.12.100.44.56179 > 10.12.19.23.135: Flags [S], seq 226904457, win 29200, options [mss 1460,sackOK,TS val 6599499 ecr 0,nop,wscale 7], length 0
11:38:03.189447 IP 10.12.100.44.60471 > 10.12.19.23.443: Flags [S], seq 2117220254, win 29200, options [mss 1460,sackOK,TS val 6599499 ecr 0,nop,wscale 7], length 0
11:38:03.189474 IP 10.12.100.44.50207 > 10.12.19.23.3306: Flags [S], seq 4281540817, win 29200, options [mss 1460,sackOK,TS val 6599499 ecr 0,nop,wscale 7], length 0
11:38:03.189523 IP 10.12.100.44.56205 > 10.12.19.23.21: Flags [S], seq 2535701377, win 29200, options [mss 1460,sackOK,TS val 6599499 ecr 0,nop,wscale 7], length 0
11:38:03.189585 IP 10.12.100.44.49191 > 10.12.19.23.111: Flags [S], seq 770008384, win 29200, options [mss 1460,sackOK,TS val 6599499 ecr 0,nop,wscale 7], length 0
11:38:03.189589 IP 10.12.100.44.52980 > 10.12.19.23.8080: Flags [S], seq 1461670289, win 29200, options [mss 1460,sackOK,TS val 6599499 ecr 0,nop,wscale 7], length 0
11:38:03.189663 IP 10.12.100.44.57845 > 10.12.19.23.995: Flags [S], seq 107979235, win 29200, options [mss 1460,sackOK,TS val 6599499 ecr 0,nop,wscale 7], length 0
11:38:03.189666 IP 10.12.100.44.56527 > 10.12.19.23.113: Flags [S], seq 2275141066, win 29200, options [mss 1460,sackOK,TS val 6599499 ecr 0,nop,wscale 7], length 0
11:38:03.189711 IP 10.12.100.44.53986 > 10.12.19.23.23: Flags [S], seq 1840989944, win 29200, options [mss 1460,sackOK,TS val 6599499 ecr 0,nop,wscale 7], length 0
11:38:03.189739 IP 10.12.100.44.54451 > 10.12.19.23.5900: Flags [S], seq 3498718545, win 29200, options [mss 1460,sackOK,TS val 6599499 ecr 0,nop,wscale 7], length 0
11:38:03.189795 IP 10.12.100.44.51353 > 10.12.19.23.256: Flags [S], seq 2901404415, win 29200, options [mss 1460,sackOK,TS val 6599499 ecr 0,nop,wscale 7], length 0
11:38:03.189813 IP 10.12.100.44.46279 > 10.12.19.23.106: Flags [S], seq 508020064, win 29200, options [mss 1460,sackOK,TS val 6599499 ecr 0,nop,wscale 7], length 0
11:38:03.189857 IP 10.12.100.44.33349 > 10.12.19.23.5120: Flags [S], seq 4078244018, win 29200, options [mss 1460,sackOK,TS val 6599499 ecr 0,nop,wscale 7], length 0
11:38:03.189928 IP 10.12.100.44.42414 > 10.12.19.23.902: Flags [S], seq 1486214219, win 29200, options [mss 1460,sackOK,TS val 6599499 ecr 0,nop,wscale 7], length 0
11:38:03.189932 IP 10.12.100.44.41004 > 10.12.19.23.88: Flags [S], seq 3948688417, win 29200, options [mss 1460,sackOK,TS val 6599499 ecr 0,nop,wscale 7], length 0
11:38:03.190017 IP 10.12.100.44.35478 > 10.12.19.23.9102: Flags [S], seq 635607685, win 29200, options [mss 1460,sackOK,TS val 6599499 ecr 0,nop,wscale 7], length 0
11:38:03.190020 IP 10.12.100.44.48919 > 10.12.19.23.33354: Flags [S], seq 1214084667, win 29200, options [mss 1460,sackOK,TS val 6599499 ecr 0,nop,wscale 7], length 0
11:38:03.190089 IP 10.12.100.44.39686 > 10.12.19.23.6666: Flags [S], seq 2885924761, win 29200, options [mss 1460,sackOK,TS val 6599499 ecr 0,nop,wscale 7], length 0
11:38:03.190093 IP 10.12.100.44.49526 > 10.12.19.23.2020: Flags [S], seq 2823174745, win 29200, options [mss 1460,sackOK,TS val 6599499 ecr 0,nop,wscale 7], length 0
11:38:03.239606 IP 10.12.100.44.42653 > 10.12.19.23.445: Flags [S], seq 916051965, win 29200, options [mss 1460,sackOK,TS val 6599511 ecr 0,nop,wscale 7], length 0
11:38:03.239645 IP 10.12.100.44.51915 > 10.12.19.23.1025: Flags [S], seq 3682902228, win 29200, options [mss 1460,sackOK,TS val 6599511 ecr 0,nop,wscale 7], length 0
11:38:03.239647 IP 10.12.100.44.52521 > 10.12.19.23.53: Flags [S], seq 2851746444, win 29200, options [mss 1460,sackOK,TS val 6599511 ecr 0,nop,wscale 7], length 0
11:38:03.239649 IP 10.12.100.44.49209 > 10.12.19.23.111: Flags [S], seq 2104849597, win 29200, options [mss 1460,sackOK,TS val 6599511 ecr 0,nop,wscale 7], length 0
11:38:03.239651 IP 10.12.100.44.56225 > 10.12.19.23.21: Flags [S], seq 3811025258, win 29200, options [mss 1460,sackOK,TS val 6599511 ecr 0,nop,wscale 7], length 0
11:38:03.239652 IP 10.12.100.44.50229 > 10.12.19.23.3306: Flags [S], seq 999363538, win 29200, options [mss 1460,sackOK,TS val 6599511 ecr 0,nop,wscale 7], length 0
11:38:03.239766 IP 10.12.100.44.56204 > 10.12.19.23.135: Flags [S], seq 2979814584, win 29200, options [mss 1460,sackOK,TS val 6599511 ecr 0,nop,wscale 7], length 0
11:38:03.239777 IP 10.12.100.44.33317 > 10.12.19.23.1720: Flags [S], seq 916016454, win 29200, options [mss 1460,sackOK,TS val 6599511 ecr 0,nop,wscale 7], length 0
11:38:03.239779 IP 10.12.100.44.57720 > 10.12.19.23.22: Flags [S], seq 137953259, win 29200, options [mss 1460,sackOK,TS val 6599511 ecr 0,nop,wscale 7], length 0
11:38:03.239836 IP 10.12.100.44.51371 > 10.12.19.23.256: Flags [S], seq 3019800632, win 29200, options [mss 1460,sackOK,TS val 6599511 ecr 0,nop,wscale 7], length 0
11:38:03.239839 IP 10.12.100.44.54471 > 10.12.19.23.5900: Flags [S], seq 1896295767, win 29200, options [mss 1460,sackOK,TS val 6599511 ecr 0,nop,wscale 7], length 0
11:38:03.239910 IP 10.12.100.44.54008 > 10.12.19.23.23: Flags [S], seq 4214313835, win 29200, options [mss 1460,sackOK,TS val 6599511 ecr 0,nop,wscale 7], length 0
11:38:03.239914 IP 10.12.100.44.56551 > 10.12.19.23.113: Flags [S], seq 2454599796, win 29200, options [mss 1460,sackOK,TS val 6599511 ecr 0,nop,wscale 7], length 0
11:38:03.240036 IP 10.12.100.44.57871 > 10.12.19.23.995: Flags [S], seq 1342075078, win 29200, options [mss 1460,sackOK,TS val 6599511 ecr 0,nop,wscale 7], length 0
11:38:03.240043 IP 10.12.100.44.53008 > 10.12.19.23.8080: Flags [S], seq 2112203297, win 29200, options [mss 1460,sackOK,TS val 6599511 ecr 0,nop,wscale 7], length 0
11:38:03.240102 IP 10.12.100.44.48937 > 10.12.19.23.33354: Flags [S], seq 4007684402, win 29200, options [mss 1460,sackOK,TS val 6599511 ecr 0,nop,wscale 7], length 0
11:38:03.240251 IP 10.12.100.44.35498 > 10.12.19.23.9102: Flags [S], seq 780447512, win 29200, options [mss 1460,sackOK,TS val 6599511 ecr 0,nop,wscale 7], length 0
11:38:03.240274 IP 10.12.100.44.41026 > 10.12.19.23.88: Flags [S], seq 3251283357, win 29200, options [mss 1460,sackOK,TS val 6599511 ecr 0,nop,wscale 7], length 0
11:38:03.240275 IP 10.12.100.44.42438 > 10.12.19.23.902: Flags [S], seq 646987737, win 29200, options [mss 1460,sackOK,TS val 6599511 ecr 0,nop,wscale 7], length 0
11:38:03.240345 IP 10.12.100.44.33375 > 10.12.19.23.5120: Flags [S], seq 3308628141, win 29200, options [mss 1460,sackOK,TS val 6599511 ecr 0,nop,wscale 7], length 0
11:38:03.240348 IP 10.12.100.44.46307 > 10.12.19.23.106: Flags [S], seq 1422495502, win 29200, options [mss 1460,sackOK,TS val 6599511 ecr 0,nop,wscale 7], length 0
11:38:03.240439 IP 10.12.100.44.49548 > 10.12.19.23.2020: Flags [S], seq 1618812048, win 29200, options [mss 1460,sackOK,TS val 6599511 ecr 0,nop,wscale 7], length 0
11:38:03.240443 IP 10.12.100.44.39710 > 10.12.19.23.6666: Flags [S], seq 4284797489, win 29200, options [mss 1460,sackOK,TS val 6599511 ecr 0,nop,wscale 7], length 0
11:38:03.289569 IP 10.12.100.44.34319 > 10.12.19.23.548: Flags [S], seq 738519143, win 29200, options [mss 1460,sackOK,TS val 6599524 ecr 0,nop,wscale 7], length 0
11:38:03.289612 IP 10.12.100.44.55770 > 10.12.19.23.9878: Flags [S], seq 488815367, win 29200, options [mss 1460,sackOK,TS val 6599524 ecr 0,nop,wscale 7], length 0
11:38:03.289614 IP 10.12.100.44.50769 > 10.12.19.23.2047: Flags [S], seq 3596867458, win 29200, options [mss 1460,sackOK,TS val 6599524 ecr 0,nop,wscale 7], length 0
11:38:03.289698 IP 10.12.100.44.57672 > 10.12.19.23.161: Flags [S], seq 1485239970, win 29200, options [mss 1460,sackOK,TS val 6599524 ecr 0,nop,wscale 7], length 0
11:38:03.289702 IP 10.12.100.44.42286 > 10.12.19.23.19315: Flags [S], seq 2763868585, win 29200, options [mss 1460,sackOK,TS val 6599524 ecr 0,nop,wscale 7], length 0
11:38:03.289837 IP 10.12.100.44.37658 > 10.12.19.23.1086: Flags [S], seq 198229809, win 29200, options [mss 1460,sackOK,TS val 6599524 ecr 0,nop,wscale 7], length 0
11:38:03.289840 IP 10.12.100.44.36433 > 10.12.19.23.5962: Flags [S], seq 2274312783, win 29200, options [mss 1460,sackOK,TS val 6599524 ecr 0,nop,wscale 7], length 0
11:38:03.289902 IP 10.12.100.44.53902 > 10.12.19.23.1070: Flags [S], seq 416298279, win 29200, options [mss 1460,sackOK,TS val 6599524 ecr 0,nop,wscale 7], length 0
11:38:03.289918 IP 10.12.100.44.32830 > 10.12.19.23.3369: Flags [S], seq 383421731, win 29200, options [mss 1460,sackOK,TS val 6599524 ecr 0,nop,wscale 7], length 0
11:38:03.289977 IP 10.12.100.44.37825 > 10.12.19.23.7200: Flags [S], seq 1929832974, win 29200, options [mss 1460,sackOK,TS val 6599524 ecr 0,nop,wscale 7], length 0
11:38:03.290003 IP 10.12.100.44.60453 > 10.12.19.23.1233: Flags [S], seq 1204101352, win 29200, options [mss 1460,sackOK,TS val 6599524 ecr 0,nop,wscale 7], length 0
11:38:03.290005 IP 10.12.100.44.38067 > 10.12.19.23.311: Flags [S], seq 2404789394, win 29200, options [mss 1460,sackOK,TS val 6599524 ecr 0,nop,wscale 7], length 0
11:38:03.290104 IP 10.12.100.44.39315 > 10.12.19.23.990: Flags [S], seq 1415270321, win 29200, options [mss 1460,sackOK,TS val 6599524 ecr 0,nop,wscale 7], length 0
11:38:03.290107 IP 10.12.100.44.57223 > 10.12.19.23.5030: Flags [S], seq 468378897, win 29200, options [mss 1460,sackOK,TS val 6599524 ecr 0,nop,wscale 7], length 0
11:38:03.290109 IP 10.12.100.44.58372 > 10.12.19.23.2725: Flags [S], seq 3809087024, win 29200, options [mss 1460,sackOK,TS val 6599524 ecr 0,nop,wscale 7], length 0
11:38:03.290155 IP 10.12.100.44.55782 > 10.12.19.23.8400: Flags [S], seq 22595238, win 29200, options [mss 1460,sackOK,TS val 6599524 ecr 0,nop,wscale 7], length 0
11:38:03.290246 IP 10.12.100.44.38895 > 10.12.19.23.5922: Flags [S], seq 4098485782, win 29200, options [mss 1460,sackOK,TS val 6599524 ecr 0,nop,wscale 7], length 0
11:38:03.290303 IP 10.12.100.44.44158 > 10.12.19.23.1024: Flags [S], seq 2956579884, win 29200, options [mss 1460,sackOK,TS val 6599524 ecr 0,nop,wscale 7], length 0
11:38:03.290306 IP 10.12.100.44.53611 > 10.12.19.23.6580: Flags [S], seq 1018094846, win 29200, options [mss 1460,sackOK,TS val 6599524 ecr 0,nop,wscale 7], length 0
11:38:03.290346 IP 10.12.100.44.58626 > 10.12.19.23.1: Flags [S], seq 1293611101, win 29200, options [mss 1460,sackOK,TS val 6599524 ecr 0,nop,wscale 7], length 0
11:38:03.290420 IP 10.12.100.44.41496 > 10.12.19.23.16080: Flags [S], seq 4130013486, win 29200, options [mss 1460,sackOK,TS val 6599524 ecr 0,nop,wscale 7], length 0
11:38:03.290446 IP 10.12.100.44.43115 > 10.12.19.23.55056: Flags [S], seq 1856348225, win 29200, options [mss 1460,sackOK,TS val 6599524 ecr 0,nop,wscale 7], length 0
11:38:03.290448 IP 10.12.100.44.53882 > 10.12.19.23.5226: Flags [S], seq 2504753325, win 29200, options [mss 1460,sackOK,TS val 6599524 ecr 0,nop,wscale 7], length 0
11:38:03.339531 IP 10.12.100.44.34342 > 10.12.19.23.548: Flags [S], seq 633334647, win 29200, options [mss 1460,sackOK,TS val 6599536 ecr 0,nop,wscale 7], length 0
11:38:03.339605 IP 10.12.100.44.55793 > 10.12.19.23.9878: Flags [S], seq 1066312247, win 29200, options [mss 1460,sackOK,TS val 6599536 ecr 0,nop,wscale 7], length 0
11:38:03.339609 IP 10.12.100.44.50792 > 10.12.19.23.2047: Flags [S], seq 72461255, win 29200, options [mss 1460,sackOK,TS val 6599536 ecr 0,nop,wscale 7], length 0
11:38:03.339702 IP 10.12.100.44.57695 > 10.12.19.23.161: Flags [S], seq 2782864299, win 29200, options [mss 1460,sackOK,TS val 6599536 ecr 0,nop,wscale 7], length 0
11:38:03.339761 IP 10.12.100.44.42309 > 10.12.19.23.19315: Flags [S], seq 650310940, win 29200, options [mss 1460,sackOK,TS val 6599536 ecr 0,nop,wscale 7], length 0
11:38:03.339765 IP 10.12.100.44.37681 > 10.12.19.23.1086: Flags [S], seq 523019741, win 29200, options [mss 1460,sackOK,TS val 6599536 ecr 0,nop,wscale 7], length 0
11:38:03.339879 IP 10.12.100.44.36456 > 10.12.19.23.5962: Flags [S], seq 3132809493, win 29200, options [mss 1460,sackOK,TS val 6599536 ecr 0,nop,wscale 7], length 0
11:38:03.339899 IP 10.12.100.44.53925 > 10.12.19.23.1070: Flags [S], seq 3411570244, win 29200, options [mss 1460,sackOK,TS val 6599536 ecr 0,nop,wscale 7], length 0
11:38:03.340054 IP 10.12.100.44.32853 > 10.12.19.23.3369: Flags [S], seq 4074625479, win 29200, options [mss 1460,sackOK,TS val 6599536 ecr 0,nop,wscale 7], length 0
11:38:03.340057 IP 10.12.100.44.38088 > 10.12.19.23.311: Flags [S], seq 1210834991, win 29200, options [mss 1460,sackOK,TS val 6599536 ecr 0,nop,wscale 7], length 0
11:38:03.340117 IP 10.12.100.44.60476 > 10.12.19.23.1233: Flags [S], seq 3178731007, win 29200, options [mss 1460,sackOK,TS val 6599536 ecr 0,nop,wscale 7], length 0
11:38:03.340162 IP 10.12.100.44.37850 > 10.12.19.23.7200: Flags [S], seq 4272961991, win 29200, options [mss 1460,sackOK,TS val 6599536 ecr 0,nop,wscale 7], length 0
11:38:03.340208 IP 10.12.100.44.55802 > 10.12.19.23.8400: Flags [S], seq 553437957, win 29200, options [mss 1460,sackOK,TS val 6599536 ecr 0,nop,wscale 7], length 0
11:38:03.340310 IP 10.12.100.44.58394 > 10.12.19.23.2725: Flags [S], seq 990356660, win 29200, options [mss 1460,sackOK,TS val 6599536 ecr 0,nop,wscale 7], length 0
11:38:03.340324 IP 10.12.100.44.57247 > 10.12.19.23.5030: Flags [S], seq 1037769872, win 29200, options [mss 1460,sackOK,TS val 6599536 ecr 0,nop,wscale 7], length 0
11:38:03.340326 IP 10.12.100.44.39341 > 10.12.19.23.990: Flags [S], seq 893788195, win 29200, options [mss 1460,sackOK,TS val 6599536 ecr 0,nop,wscale 7], length 0
11:38:03.340393 IP 10.12.100.44.53632 > 10.12.19.23.6580: Flags [S], seq 3312251311, win 29200, options [mss 1460,sackOK,TS val 6599536 ecr 0,nop,wscale 7], length 0
11:38:03.340397 IP 10.12.100.44.44181 > 10.12.19.23.1024: Flags [S], seq 2206802579, win 29200, options [mss 1460,sackOK,TS val 6599536 ecr 0,nop,wscale 7], length 0
11:38:03.340398 IP 10.12.100.44.38920 > 10.12.19.23.5922: Flags [S], seq 67265703, win 29200, options [mss 1460,sackOK,TS val 6599536 ecr 0,nop,wscale 7], length 0
11:38:03.340472 IP 10.12.100.44.41518 > 10.12.19.23.16080: Flags [S], seq 3108090467, win 29200, options [mss 1460,sackOK,TS val 6599536 ecr 0,nop,wscale 7], length 0
11:38:03.340477 IP 10.12.100.44.58650 > 10.12.19.23.1: Flags [S], seq 3011176599, win 29200, options [mss 1460,sackOK,TS val 6599536 ecr 0,nop,wscale 7], length 0
11:38:03.340494 IP 10.12.100.44.53904 > 10.12.19.23.5226: Flags [S], seq 2824269414, win 29200, options [mss 1460,sackOK,TS val 6599536 ecr 0,nop,wscale 7], length 0
11:38:03.340632 IP 10.12.100.44.43139 > 10.12.19.23.55056: Flags [S], seq 337407526, win 29200, options [mss 1460,sackOK,TS val 6599536 ecr 0,nop,wscale 7], length 0
11:38:03.389581 IP 10.12.100.44.38847 > 10.12.19.23.8652: Flags [S], seq 2548638998, win 29200, options [mss 1460,sackOK,TS val 6599548 ecr 0,nop,wscale 7], length 0
11:38:03.389605 IP 10.12.100.44.59782 > 10.12.19.23.2809: Flags [S], seq 460288420, win 29200, options [mss 1460,sackOK,TS val 6599549 ecr 0,nop,wscale 7], length 0
11:38:03.389669 IP 10.12.100.44.48843 > 10.12.19.23.10082: Flags [S], seq 3220828842, win 29200, options [mss 1460,sackOK,TS val 6599549 ecr 0,nop,wscale 7], length 0
11:38:03.389685 IP 10.12.100.44.50936 > 10.12.19.23.3: Flags [S], seq 2465961619, win 29200, options [mss 1460,sackOK,TS val 6599549 ecr 0,nop,wscale 7], length 0
11:38:03.389744 IP 10.12.100.44.54991 > 10.12.19.23.4567: Flags [S], seq 3647032346, win 29200, options [mss 1460,sackOK,TS val 6599549 ecr 0,nop,wscale 7], length 0
11:38:03.389912 IP 10.12.100.44.38568 > 10.12.19.23.1310: Flags [S], seq 2653004936, win 29200, options [mss 1460,sackOK,TS val 6599549 ecr 0,nop,wscale 7], length 0
11:38:03.389922 IP 10.12.100.44.52176 > 10.12.19.23.27356: Flags [S], seq 226631608, win 29200, options [mss 1460,sackOK,TS val 6599549 ecr 0,nop,wscale 7], length 0
11:38:03.389924 IP 10.12.100.44.33120 > 10.12.19.23.9593: Flags [S], seq 3657243144, win 29200, options [mss 1460,sackOK,TS val 6599549 ecr 0,nop,wscale 7], length 0
11:38:03.390018 IP 10.12.100.44.33262 > 10.12.19.23.1300: Flags [S], seq 2701473965, win 29200, options [mss 1460,sackOK,TS val 6599549 ecr 0,nop,wscale 7], length 0
11:38:03.390022 IP 10.12.100.44.49241 > 10.12.19.23.24: Flags [S], seq 2420793729, win 29200, options [mss 1460,sackOK,TS val 6599549 ecr 0,nop,wscale 7], length 0
11:38:03.390168 IP 10.12.100.44.44370 > 10.12.19.23.593: Flags [S], seq 4112194614, win 29200, options [mss 1460,sackOK,TS val 6599549 ecr 0,nop,wscale 7], length 0
11:38:03.390176 IP 10.12.100.44.42764 > 10.12.19.23.2605: Flags [S], seq 1932523473, win 29200, options [mss 1460,sackOK,TS val 6599549 ecr 0,nop,wscale 7], length 0
11:38:03.390289 IP 10.12.100.44.36121 > 10.12.19.23.27000: Flags [S], seq 2256091801, win 29200, options [mss 1460,sackOK,TS val 6599549 ecr 0,nop,wscale 7], length 0
11:38:03.390297 IP 10.12.100.44.57319 > 10.12.19.23.7019: Flags [S], seq 1036222209, win 29200, options [mss 1460,sackOK,TS val 6599549 ecr 0,nop,wscale 7], length 0
11:38:03.390299 IP 10.12.100.44.55683 > 10.12.19.23.2401: Flags [S], seq 4204452489, win 29200, options [mss 1460,sackOK,TS val 6599549 ecr 0,nop,wscale 7], length 0
11:38:03.390345 IP 10.12.100.44.34657 > 10.12.19.23.1056: Flags [S], seq 4148363024, win 29200, options [mss 1460,sackOK,TS val 6599549 ecr 0,nop,wscale 7], length 0
11:38:03.390348 IP 10.12.100.44.43869 > 10.12.19.23.2135: Flags [S], seq 4215423660, win 29200, options [mss 1460,sackOK,TS val 6599549 ecr 0,nop,wscale 7], length 0
11:38:03.390410 IP 10.12.100.44.54297 > 10.12.19.23.1058: Flags [S], seq 3164008139, win 29200, options [mss 1460,sackOK,TS val 6599549 ecr 0,nop,wscale 7], length 0
11:38:03.390432 IP 10.12.100.44.48483 > 10.12.19.23.2607: Flags [S], seq 535964752, win 29200, options [mss 1460,sackOK,TS val 6599549 ecr 0,nop,wscale 7], length 0
11:38:03.390486 IP 10.12.100.44.33242 > 10.12.19.23.17877: Flags [S], seq 987308194, win 29200, options [mss 1460,sackOK,TS val 6599549 ecr 0,nop,wscale 7], length 0
11:38:03.390515 IP 10.12.100.44.55117 > 10.12.19.23.5002: Flags [S], seq 2911718333, win 29200, options [mss 1460,sackOK,TS val 6599549 ecr 0,nop,wscale 7], length 0
11:38:03.390518 IP 10.12.100.44.42541 > 10.12.19.23.84: Flags [S], seq 3931380650, win 29200, options [mss 1460,sackOK,TS val 6599549 ecr 0,nop,wscale 7], length 0
11:38:03.390519 IP 10.12.100.44.45291 > 10.12.19.23.1247: Flags [S], seq 3488559178, win 29200, options [mss 1460,sackOK,TS val 6599549 ecr 0,nop,wscale 7], length 0
11:38:03.439553 IP 10.12.100.44.38870 > 10.12.19.23.8652: Flags [S], seq 812213576, win 29200, options [mss 1460,sackOK,TS val 6599561 ecr 0,nop,wscale 7], length 0
11:38:03.439669 IP 10.12.100.44.59805 > 10.12.19.23.2809: Flags [S], seq 2855980510, win 29200, options [mss 1460,sackOK,TS val 6599561 ecr 0,nop,wscale 7], length 0
11:38:03.439673 IP 10.12.100.44.48866 > 10.12.19.23.10082: Flags [S], seq 2080540408, win 29200, options [mss 1460,sackOK,TS val 6599561 ecr 0,nop,wscale 7], length 0
11:38:03.439722 IP 10.12.100.44.50959 > 10.12.19.23.3: Flags [S], seq 3773835553, win 29200, options [mss 1460,sackOK,TS val 6599561 ecr 0,nop,wscale 7], length 0
11:38:03.439799 IP 10.12.100.44.55014 > 10.12.19.23.4567: Flags [S], seq 479538514, win 29200, options [mss 1460,sackOK,TS val 6599561 ecr 0,nop,wscale 7], length 0
11:38:03.439802 IP 10.12.100.44.38591 > 10.12.19.23.1310: Flags [S], seq 3359079785, win 29200, options [mss 1460,sackOK,TS val 6599561 ecr 0,nop,wscale 7], length 0
11:38:03.439908 IP 10.12.100.44.52199 > 10.12.19.23.27356: Flags [S], seq 3810968636, win 29200, options [mss 1460,sackOK,TS val 6599561 ecr 0,nop,wscale 7], length 0
11:38:03.439916 IP 10.12.100.44.33143 > 10.12.19.23.9593: Flags [S], seq 2222767753, win 29200, options [mss 1460,sackOK,TS val 6599561 ecr 0,nop,wscale 7], length 0
11:38:03.440002 IP 10.12.100.44.33285 > 10.12.19.23.1300: Flags [S], seq 4065123431, win 29200, options [mss 1460,sackOK,TS val 6599561 ecr 0,nop,wscale 7], length 0
11:38:03.440057 IP 10.12.100.44.49264 > 10.12.19.23.24: Flags [S], seq 4245112668, win 29200, options [mss 1460,sackOK,TS val 6599561 ecr 0,nop,wscale 7], length 0
11:38:03.440200 IP 10.12.100.44.44393 > 10.12.19.23.593: Flags [S], seq 2047209842, win 29200, options [mss 1460,sackOK,TS val 6599561 ecr 0,nop,wscale 7], length 0
11:38:03.440207 IP 10.12.100.44.42787 > 10.12.19.23.2605: Flags [S], seq 4033578822, win 29200, options [mss 1460,sackOK,TS val 6599561 ecr 0,nop,wscale 7], length 0
11:38:03.440240 IP 10.12.100.44.36144 > 10.12.19.23.27000: Flags [S], seq 1715173155, win 29200, options [mss 1460,sackOK,TS val 6599561 ecr 0,nop,wscale 7], length 0
11:38:03.440243 IP 10.12.100.44.57342 > 10.12.19.23.7019: Flags [S], seq 944384287, win 29200, options [mss 1460,sackOK,TS val 6599561 ecr 0,nop,wscale 7], length 0
11:38:03.440346 IP 10.12.100.44.55706 > 10.12.19.23.2401: Flags [S], seq 2053658148, win 29200, options [mss 1460,sackOK,TS val 6599561 ecr 0,nop,wscale 7], length 0
11:38:03.440353 IP 10.12.100.44.34680 > 10.12.19.23.1056: Flags [S], seq 2903256874, win 29200, options [mss 1460,sackOK,TS val 6599561 ecr 0,nop,wscale 7], length 0
11:38:03.440516 IP 10.12.100.44.43892 > 10.12.19.23.2135: Flags [S], seq 1312139753, win 29200, options [mss 1460,sackOK,TS val 6599561 ecr 0,nop,wscale 7], length 0
11:38:03.440523 IP 10.12.100.44.54320 > 10.12.19.23.1058: Flags [S], seq 2945397783, win 29200, options [mss 1460,sackOK,TS val 6599561 ecr 0,nop,wscale 7], length 0
11:38:03.440525 IP 10.12.100.44.33264 > 10.12.19.23.17877: Flags [S], seq 676506577, win 29200, options [mss 1460,sackOK,TS val 6599561 ecr 0,nop,wscale 7], length 0
11:38:03.440639 IP 10.12.100.44.48507 > 10.12.19.23.2607: Flags [S], seq 1617208196, win 29200, options [mss 1460,sackOK,TS val 6599561 ecr 0,nop,wscale 7], length 0
11:38:03.440657 IP 10.12.100.44.45312 > 10.12.19.23.1247: Flags [S], seq 2211480479, win 29200, options [mss 1460,sackOK,TS val 6599561 ecr 0,nop,wscale 7], length 0
11:38:03.440785 IP 10.12.100.44.42564 > 10.12.19.23.84: Flags [S], seq 1459906268, win 29200, options [mss 1460,sackOK,TS val 6599561 ecr 0,nop,wscale 7], length 0
11:38:03.440882 IP 10.12.100.44.55142 > 10.12.19.23.5002: Flags [S], seq 2097195774, win 29200, options [mss 1460,sackOK,TS val 6599561 ecr 0,nop,wscale 7], length 0
11:38:03.490384 IP 10.12.100.44.43325 > 10.12.19.23.1052: Flags [S], seq 2396803766, win 29200, options [mss 1460,sackOK,TS val 6599574 ecr 0,nop,wscale 7], length 0
11:38:03.490422 IP 10.12.100.44.49964 > 10.12.19.23.901: Flags [S], seq 3929961083, win 29200, options [mss 1460,sackOK,TS val 6599574 ecr 0,nop,wscale 7], length 0
11:38:03.490424 IP 10.12.100.44.33562 > 10.12.19.23.1054: Flags [S], seq 1161743611, win 29200, options [mss 1460,sackOK,TS val 6599574 ecr 0,nop,wscale 7], length 0
11:38:03.490587 IP 10.12.100.44.42266 > 10.12.19.23.5859: Flags [S], seq 2808050326, win 29200, options [mss 1460,sackOK,TS val 6599574 ecr 0,nop,wscale 7], length 0
11:38:03.490695 IP 10.12.100.44.44674 > 10.12.19.23.5298: Flags [S], seq 489841617, win 29200, options [mss 1460,sackOK,TS val 6599574 ecr 0,nop,wscale 7], length 0
11:38:03.490800 IP 10.12.100.44.51917 > 10.12.19.23.340: Flags [S], seq 1349086567, win 29200, options [mss 1460,sackOK,TS val 6599574 ecr 0,nop,wscale 7], length 0
11:38:03.490894 IP 10.12.100.44.50598 > 10.12.19.23.50500: Flags [S], seq 640558256, win 29200, options [mss 1460,sackOK,TS val 6599574 ecr 0,nop,wscale 7], length 0
11:38:03.490986 IP 10.12.100.44.40322 > 10.12.19.23.6003: Flags [S], seq 2806452545, win 29200, options [mss 1460,sackOK,TS val 6599574 ecr 0,nop,wscale 7], length 0
11:38:03.491077 IP 10.12.100.44.42492 > 10.12.19.23.1067: Flags [S], seq 3194820574, win 29200, options [mss 1460,sackOK,TS val 6599574 ecr 0,nop,wscale 7], length 0
11:38:03.491248 IP 10.12.100.44.36280 > 10.12.19.23.12174: Flags [S], seq 206600541, win 29200, options [mss 1460,sackOK,TS val 6599574 ecr 0,nop,wscale 7], length 0
11:38:03.491336 IP 10.12.100.44.33179 > 10.12.19.23.1999: Flags [S], seq 1754522221, win 29200, options [mss 1460,sackOK,TS val 6599574 ecr 0,nop,wscale 7], length 0
11:38:03.491340 IP 10.12.100.44.45564 > 10.12.19.23.5500: Flags [S], seq 3416637047, win 29200, options [mss 1460,sackOK,TS val 6599574 ecr 0,nop,wscale 7], length 0
11:38:03.491342 IP 10.12.100.44.39708 > 10.12.19.23.1218: Flags [S], seq 1317786664, win 29200, options [mss 1460,sackOK,TS val 6599574 ecr 0,nop,wscale 7], length 0
11:38:03.491396 IP 10.12.100.44.51022 > 10.12.19.23.2710: Flags [S], seq 2106054735, win 29200, options [mss 1460,sackOK,TS val 6599574 ecr 0,nop,wscale 7], length 0
11:38:03.491437 IP 10.12.100.44.50331 > 10.12.19.23.3324: Flags [S], seq 186417968, win 29200, options [mss 1460,sackOK,TS val 6599574 ecr 0,nop,wscale 7], length 0
11:38:03.491440 IP 10.12.100.44.45130 > 10.12.19.23.5815: Flags [S], seq 1923428901, win 29200, options [mss 1460,sackOK,TS val 6599574 ecr 0,nop,wscale 7], length 0
11:38:03.491442 IP 10.12.100.44.40071 > 10.12.19.23.9968: Flags [S], seq 1592228506, win 29200, options [mss 1460,sackOK,TS val 6599574 ecr 0,nop,wscale 7], length 0
11:38:03.491483 IP 10.12.100.44.48861 > 10.12.19.23.49159: Flags [S], seq 1686372862, win 29200, options [mss 1460,sackOK,TS val 6599574 ecr 0,nop,wscale 7], length 0
11:38:03.491486 IP 10.12.100.44.41580 > 10.12.19.23.56737: Flags [S], seq 3833948936, win 29200, options [mss 1460,sackOK,TS val 6599574 ecr 0,nop,wscale 7], length 0
11:38:03.491527 IP 10.12.100.44.35769 > 10.12.19.23.1077: Flags [S], seq 1006735378, win 29200, options [mss 1460,sackOK,TS val 6599574 ecr 0,nop,wscale 7], length 0
11:38:03.491530 IP 10.12.100.44.53352 > 10.12.19.23.19780: Flags [S], seq 4092922582, win 29200, options [mss 1460,sackOK,TS val 6599574 ecr 0,nop,wscale 7], length 0
11:38:03.491570 IP 10.12.100.44.45125 > 10.12.19.23.1099: Flags [S], seq 2933272840, win 29200, options [mss 1460,sackOK,TS val 6599574 ecr 0,nop,wscale 7], length 0
11:38:03.491573 IP 10.12.100.44.55765 > 10.12.19.23.4321: Flags [S], seq 339459044, win 29200, options [mss 1460,sackOK,TS val 6599574 ecr 0,nop,wscale 7], length 0
11:38:03.540344 IP 10.12.100.44.43348 > 10.12.19.23.1052: Flags [S], seq 3872471927, win 29200, options [mss 1460,sackOK,TS val 6599586 ecr 0,nop,wscale 7], length 0
11:38:03.540380 IP 10.12.100.44.49987 > 10.12.19.23.901: Flags [S], seq 559013864, win 29200, options [mss 1460,sackOK,TS val 6599586 ecr 0,nop,wscale 7], length 0
11:38:03.540446 IP 10.12.100.44.33585 > 10.12.19.23.1054: Flags [S], seq 2246782970, win 29200, options [mss 1460,sackOK,TS val 6599586 ecr 0,nop,wscale 7], length 0
11:38:03.540594 IP 10.12.100.44.42289 > 10.12.19.23.5859: Flags [S], seq 3467917864, win 29200, options [mss 1460,sackOK,TS val 6599586 ecr 0,nop,wscale 7], length 0
11:38:03.540755 IP 10.12.100.44.44697 > 10.12.19.23.5298: Flags [S], seq 1382270703, win 29200, options [mss 1460,sackOK,TS val 6599586 ecr 0,nop,wscale 7], length 0
11:38:03.540771 IP 10.12.100.44.51940 > 10.12.19.23.340: Flags [S], seq 3737599529, win 29200, options [mss 1460,sackOK,TS val 6599586 ecr 0,nop,wscale 7], length 0
11:38:03.540964 IP 10.12.100.44.50621 > 10.12.19.23.50500: Flags [S], seq 757501360, win 29200, options [mss 1460,sackOK,TS val 6599586 ecr 0,nop,wscale 7], length 0
11:38:03.541011 IP 10.12.100.44.40345 > 10.12.19.23.6003: Flags [S], seq 377796221, win 29200, options [mss 1460,sackOK,TS val 6599586 ecr 0,nop,wscale 7], length 0
11:38:03.541013 IP 10.12.100.44.42515 > 10.12.19.23.1067: Flags [S], seq 1960073055, win 29200, options [mss 1460,sackOK,TS val 6599586 ecr 0,nop,wscale 7], length 0
11:38:03.541253 IP 10.12.100.44.36303 > 10.12.19.23.12174: Flags [S], seq 1979497697, win 29200, options [mss 1460,sackOK,TS val 6599586 ecr 0,nop,wscale 7], length 0
11:38:03.541317 IP 10.12.100.44.33202 > 10.12.19.23.1999: Flags [S], seq 510389516, win 29200, options [mss 1460,sackOK,TS val 6599586 ecr 0,nop,wscale 7], length 0
11:38:03.541321 IP 10.12.100.44.45587 > 10.12.19.23.5500: Flags [S], seq 2382621325, win 29200, options [mss 1460,sackOK,TS val 6599586 ecr 0,nop,wscale 7], length 0
11:38:03.541464 IP 10.12.100.44.51044 > 10.12.19.23.2710: Flags [S], seq 24320752, win 29200, options [mss 1460,sackOK,TS val 6599587 ecr 0,nop,wscale 7], length 0
11:38:03.541468 IP 10.12.100.44.39732 > 10.12.19.23.1218: Flags [S], seq 2676947852, win 29200, options [mss 1460,sackOK,TS val 6599587 ecr 0,nop,wscale 7], length 0
11:38:03.541539 IP 10.12.100.44.41599 > 10.12.19.23.56737: Flags [S], seq 3307192404, win 29200, options [mss 1460,sackOK,TS val 6599587 ecr 0,nop,wscale 7], length 0
11:38:03.541542 IP 10.12.100.44.48882 > 10.12.19.23.49159: Flags [S], seq 129300071, win 29200, options [mss 1460,sackOK,TS val 6599587 ecr 0,nop,wscale 7], length 0
11:38:03.541612 IP 10.12.100.44.40094 > 10.12.19.23.9968: Flags [S], seq 1586157835, win 29200, options [mss 1460,sackOK,TS val 6599587 ecr 0,nop,wscale 7], length 0
11:38:03.541615 IP 10.12.100.44.45155 > 10.12.19.23.5815: Flags [S], seq 3525448483, win 29200, options [mss 1460,sackOK,TS val 6599587 ecr 0,nop,wscale 7], length 0
11:38:03.541685 IP 10.12.100.44.50358 > 10.12.19.23.3324: Flags [S], seq 2366332160, win 29200, options [mss 1460,sackOK,TS val 6599587 ecr 0,nop,wscale 7], length 0
11:38:03.541754 IP 10.12.100.44.55785 > 10.12.19.23.4321: Flags [S], seq 230928408, win 29200, options [mss 1460,sackOK,TS val 6599587 ecr 0,nop,wscale 7], length 0
11:38:03.541802 IP 10.12.100.44.45147 > 10.12.19.23.1099: Flags [S], seq 4069315568, win 29200, options [mss 1460,sackOK,TS val 6599587 ecr 0,nop,wscale 7], length 0
11:38:03.541804 IP 10.12.100.44.53376 > 10.12.19.23.19780: Flags [S], seq 3825987355, win 29200, options [mss 1460,sackOK,TS val 6599587 ecr 0,nop,wscale 7], length 0
11:38:03.541851 IP 10.12.100.44.35795 > 10.12.19.23.1077: Flags [S], seq 962285474, win 29200, options [mss 1460,sackOK,TS val 6599587 ecr 0,nop,wscale 7], length 0
11:38:03.590674 IP 10.12.100.44.43868 > 10.12.19.23.8181: Flags [S], seq 4021439112, win 29200, options [mss 1460,sackOK,TS val 6599599 ecr 0,nop,wscale 7], length 0
11:38:03.590696 IP 10.12.100.44.56617 > 10.12.19.23.1217: Flags [S], seq 3437549771, win 29200, options [mss 1460,sackOK,TS val 6599599 ecr 0,nop,wscale 7], length 0
11:38:03.590698 IP 10.12.100.44.47451 > 10.12.19.23.9898: Flags [S], seq 3563626446, win 29200, options [mss 1460,sackOK,TS val 6599599 ecr 0,nop,wscale 7], length 0
11:38:03.590700 IP 10.12.100.44.46345 > 10.12.19.23.90: Flags [S], seq 3157779950, win 29200, options [mss 1460,sackOK,TS val 6599599 ecr 0,nop,wscale 7], length 0
11:38:03.590806 IP 10.12.100.44.38529 > 10.12.19.23.9618: Flags [S], seq 162782128, win 29200, options [mss 1460,sackOK,TS val 6599599 ecr 0,nop,wscale 7], length 0
11:38:03.590810 IP 10.12.100.44.34335 > 10.12.19.23.1718: Flags [S], seq 2527218084, win 29200, options [mss 1460,sackOK,TS val 6599599 ecr 0,nop,wscale 7], length 0
11:38:03.590944 IP 10.12.100.44.40192 > 10.12.19.23.2119: Flags [S], seq 1416613780, win 29200, options [mss 1460,sackOK,TS val 6599599 ecr 0,nop,wscale 7], length 0
11:38:03.590952 IP 10.12.100.44.51443 > 10.12.19.23.79: Flags [S], seq 4220867468, win 29200, options [mss 1460,sackOK,TS val 6599599 ecr 0,nop,wscale 7], length 0
11:38:03.591082 IP 10.12.100.44.45328 > 10.12.19.23.458: Flags [S], seq 1357879641, win 29200, options [mss 1460,sackOK,TS val 6599599 ecr 0,nop,wscale 7], length 0
11:38:03.591242 IP 10.12.100.44.46064 > 10.12.19.23.711: Flags [S], seq 1664389218, win 29200, options [mss 1460,sackOK,TS val 6599599 ecr 0,nop,wscale 7], length 0
11:38:03.591352 IP 10.12.100.44.52357 > 10.12.19.23.2525: Flags [S], seq 2354801568, win 29200, options [mss 1460,sackOK,TS val 6599599 ecr 0,nop,wscale 7], length 0
11:38:03.591435 IP 10.12.100.44.44300 > 10.12.19.23.4998: Flags [S], seq 1594828441, win 29200, options [mss 1460,sackOK,TS val 6599599 ecr 0,nop,wscale 7], length 0
11:38:03.591491 IP 10.12.100.44.50426 > 10.12.19.23.999: Flags [S], seq 4099900873, win 29200, options [mss 1460,sackOK,TS val 6599599 ecr 0,nop,wscale 7], length 0
11:38:03.591507 IP 10.12.100.44.33867 > 10.12.19.23.1047: Flags [S], seq 2084686498, win 29200, options [mss 1460,sackOK,TS val 6599599 ecr 0,nop,wscale 7], length 0
11:38:03.591621 IP 10.12.100.44.46690 > 10.12.19.23.4002: Flags [S], seq 2857145887, win 29200, options [mss 1460,sackOK,TS val 6599599 ecr 0,nop,wscale 7], length 0
11:38:03.591629 IP 10.12.100.44.38240 > 10.12.19.23.1141: Flags [S], seq 269179622, win 29200, options [mss 1460,sackOK,TS val 6599599 ecr 0,nop,wscale 7], length 0
11:38:03.591631 IP 10.12.100.44.55582 > 10.12.19.23.4006: Flags [S], seq 1466188443, win 29200, options [mss 1460,sackOK,TS val 6599599 ecr 0,nop,wscale 7], length 0
11:38:03.591677 IP 10.12.100.44.60659 > 10.12.19.23.10215: Flags [S], seq 4293050070, win 29200, options [mss 1460,sackOK,TS val 6599599 ecr 0,nop,wscale 7], length 0
11:38:03.591681 IP 10.12.100.44.43959 > 10.12.19.23.4001: Flags [S], seq 5642987, win 29200, options [mss 1460,sackOK,TS val 6599599 ecr 0,nop,wscale 7], length 0
11:38:03.591741 IP 10.12.100.44.36387 > 10.12.19.23.4126: Flags [S], seq 2627004390, win 29200, options [mss 1460,sackOK,TS val 6599599 ecr 0,nop,wscale 7], length 0
11:38:03.591744 IP 10.12.100.44.46795 > 10.12.19.23.3801: Flags [S], seq 981369583, win 29200, options [mss 1460,sackOK,TS val 6599599 ecr 0,nop,wscale 7], length 0
