16:17:03.588002 IP 10.12.3.7.5353 > 224.0.0.251.5353: 0 [1a] [4q] PTR (QU)? _afpovertcp._tcp.local. PTR (QU)? _smb._tcp.local. PTR (QU)? _rfb._tcp.local. PTR (QU)? _adisk._tcp.local. (97)
16:17:03.588020 IP6 fe80::10ea:23a2:b9e7:a465.5353 > ff02::fb.5353: 0 [1a] [4q] PTR (QU)? _afpovertcp._tcp.local. PTR (QU)? _smb._tcp.local. PTR (QU)? _rfb._tcp.local. PTR (QU)? _adisk._tcp.local. (97)
16:17:03.681815 IP 10.12.3.4.5353 > 224.0.0.251.5353: 0 [4q] [5n] [1au] ANY (QU)? e2r3p4._ssh._tcp.local. ANY (QU)? e2r3p4._sftp-ssh._tcp.local. ANY (QU)? e2r3p4.local. ANY (QU)? e2r3p4 [78:7b:8a:c4:ee:a1]._workstation._tcp.local. (249)
16:17:03.681832 IP6 fe80::183b:97d9:c5d1:a420.5353 > ff02::fb.5353: 0 [4q] [5n] [1au] ANY (QU)? e2r3p4._ssh._tcp.local. ANY (QU)? e2r3p4._sftp-ssh._tcp.local. ANY (QU)? e2r3p4.local. ANY (QU)? e2r3p4 [78:7b:8a:c4:ee:a1]._workstation._tcp.local. (249)
16:17:03.931634 IP 10.12.3.4.5353 > 224.0.0.251.5353: 0 [4q] [5n] [1au] ANY (QM)? e2r3p4._ssh._tcp.local. ANY (QM)? e2r3p4._sftp-ssh._tcp.local. ANY (QM)? e2r3p4.local. ANY (QM)? e2r3p4 [78:7b:8a:c4:ee:a1]._workstation._tcp.local. (249)
16:17:03.931663 IP6 fe80::183b:97d9:c5d1:a420.5353 > ff02::fb.5353: 0 [4q] [5n] [1au] ANY (QM)? e2r3p4._ssh._tcp.local. ANY (QM)? e2r3p4._sftp-ssh._tcp.local. ANY (QM)? e2r3p4.local. ANY (QM)? e2r3p4 [78:7b:8a:c4:ee:a1]._workstation._tcp.local. (249)
16:17:04.182286 IP 10.12.3.4.5353 > 224.0.0.251.5353: 0 [4q] [5n] [1au] ANY (QM)? e2r3p4._ssh._tcp.local. ANY (QM)? e2r3p4._sftp-ssh._tcp.local. ANY (QM)? e2r3p4.local. ANY (QM)? e2r3p4 [78:7b:8a:c4:ee:a1]._workstation._tcp.local. (249)
16:17:04.182303 IP6 fe80::183b:97d9:c5d1:a420.5353 > ff02::fb.5353: 0 [4q] [5n] [1au] ANY (QM)? e2r3p4._ssh._tcp.local. ANY (QM)? e2r3p4._sftp-ssh._tcp.local. ANY (QM)? e2r3p4.local. ANY (QM)? e2r3p4 [78:7b:8a:c4:ee:a1]._workstation._tcp.local. (249)
16:17:04.285611 IP 10.12.3.4.5353 > 224.0.0.251.5353: 0*- [0q] 2/0/3 (Cache flush) PTR e2r3p4.local., (Cache flush) PTR e2r3p4.local. (201)
16:17:04.285626 IP6 fe80::183b:97d9:c5d1:a420.5353 > ff02::fb.5353: 0*- [0q] 2/0/3 (Cache flush) PTR e2r3p4.local., (Cache flush) PTR e2r3p4.local. (201)
16:17:04.391047 IP 10.12.3.4.5353 > 224.0.0.251.5353: 0 [1au] PTR (QM)? _sleep-proxy._udp.local. (64)
16:17:04.391074 IP6 fe80::183b:97d9:c5d1:a420.5353 > ff02::fb.5353: 0 [1au] PTR (QM)? _sleep-proxy._udp.local. (64)
16:17:04.492698 IP 10.12.3.4.5353 > 224.0.0.251.5353: 0*- [0q] 15/0/5 (Cache flush) TXT "", PTR _ssh._tcp.local., PTR e2r3p4._ssh._tcp.local., TXT "model=iMac18,3" "osxvers=16", (Cache flush) TXT "", PTR _sftp-ssh._tcp.local., PTR e2r3p4._sftp-ssh._tcp.local., (Cache flush) SRV e2r3p4.local.:22 0 0, (Cache flush) SRV e2r3p4.local.:22 0 0, (Cache flush) TXT "uuid=F1591A8F-873C-5C1A-9D47-E622C40A1FB1", PTR _workstation._tcp.local., PTR e2r3p4 [78:7b:8a:c4:ee:a1]._workstation._tcp.local., (Cache flush) AAAA fe80::183b:97d9:c5d1:a420, (Cache flush) SRV e2r3p4.local.:9 0 0, (Cache flush) A 10.12.3.4 (553)
16:17:04.492714 IP6 fe80::183b:97d9:c5d1:a420.5353 > ff02::fb.5353: 0*- [0q] 15/0/5 (Cache flush) TXT "", PTR _ssh._tcp.local., PTR e2r3p4._ssh._tcp.local., TXT "model=iMac18,3" "osxvers=16", (Cache flush) TXT "", PTR _sftp-ssh._tcp.local., PTR e2r3p4._sftp-ssh._tcp.local., (Cache flush) SRV e2r3p4.local.:22 0 0, (Cache flush) SRV e2r3p4.local.:22 0 0, (Cache flush) TXT "uuid=F1591A8F-873C-5C1A-9D47-E622C40A1FB1", PTR _workstation._tcp.local., PTR e2r3p4 [78:7b:8a:c4:ee:a1]._workstation._tcp.local., (Cache flush) AAAA fe80::183b:97d9:c5d1:a420, (Cache flush) SRV e2r3p4.local.:9 0 0, (Cache flush) A 10.12.3.4 (553)
16:17:04.594276 IP 10.12.3.7.5353 > 224.0.0.251.5353: 0 [1a] [4q] PTR (QM)? _afpovertcp._tcp.local. PTR (QM)? _smb._tcp.local. PTR (QM)? _rfb._tcp.local. PTR (QM)? _adisk._tcp.local. (97)
16:17:04.594292 IP6 fe80::10ea:23a2:b9e7:a465.5353 > ff02::fb.5353: 0 [1a] [4q] PTR (QM)? _afpovertcp._tcp.local. PTR (QM)? _smb._tcp.local. PTR (QM)? _rfb._tcp.local. PTR (QM)? _adisk._tcp.local. (97)
16:17:05.497252 IP 10.12.3.4.5353 > 224.0.0.251.5353: 0*- [0q] 15/0/5 (Cache flush) TXT "", PTR _ssh._tcp.local., PTR e2r3p4._ssh._tcp.local., TXT "model=iMac18,3" "osxvers=16", (Cache flush) TXT "", PTR _sftp-ssh._tcp.local., PTR e2r3p4._sftp-ssh._tcp.local., (Cache flush) SRV e2r3p4.local.:22 0 0, (Cache flush) SRV e2r3p4.local.:22 0 0, (Cache flush) TXT "uuid=F1591A8F-873C-5C1A-9D47-E622C40A1FB1", PTR _workstation._tcp.local., PTR e2r3p4 [78:7b:8a:c4:ee:a1]._workstation._tcp.local., (Cache flush) AAAA fe80::183b:97d9:c5d1:a420, (Cache flush) SRV e2r3p4.local.:9 0 0, (Cache flush) A 10.12.3.4 (553)
16:17:05.497268 IP6 fe80::183b:97d9:c5d1:a420.5353 > ff02::fb.5353: 0*- [0q] 15/0/5 (Cache flush) TXT "", PTR _ssh._tcp.local., PTR e2r3p4._ssh._tcp.local., TXT "model=iMac18,3" "osxvers=16", (Cache flush) TXT "", PTR _sftp-ssh._tcp.local., PTR e2r3p4._sftp-ssh._tcp.local., (Cache flush) SRV e2r3p4.local.:22 0 0, (Cache flush) SRV e2r3p4.local.:22 0 0, (Cache flush) TXT "uuid=F1591A8F-873C-5C1A-9D47-E622C40A1FB1", PTR _workstation._tcp.local., PTR e2r3p4 [78:7b:8a:c4:ee:a1]._workstation._tcp.local., (Cache flush) AAAA fe80::183b:97d9:c5d1:a420, (Cache flush) SRV e2r3p4.local.:9 0 0, (Cache flush) A 10.12.3.4 (553)
16:17:05.823164 ARP, Request who-has 169.254.255.255 tell 10.12.3.4, length 46
16:17:06.286287 IP 10.12.3.4.5353 > 224.0.0.251.5353: 0*- [0q] 2/0/3 (Cache flush) PTR e2r3p4.local., (Cache flush) PTR e2r3p4.local. (201)
16:17:06.286302 IP6 fe80::183b:97d9:c5d1:a420.5353 > ff02::fb.5353: 0*- [0q] 2/0/3 (Cache flush) PTR e2r3p4.local., (Cache flush) PTR e2r3p4.local. (201)
16:17:07.396261 IP 10.12.3.4.5353 > 224.0.0.251.5353: 0 [1au] PTR (QM)? _sleep-proxy._udp.local. (64)
16:17:07.396278 IP6 fe80::183b:97d9:c5d1:a420.5353 > ff02::fb.5353: 0 [1au] PTR (QM)? _sleep-proxy._udp.local. (64)
16:17:07.501749 IP 10.12.3.4.5353 > 224.0.0.251.5353: 0*- [0q] 15/0/5 (Cache flush) TXT "", PTR _ssh._tcp.local., PTR e2r3p4._ssh._tcp.local., TXT "model=iMac18,3" "osxvers=16", (Cache flush) TXT "", PTR _sftp-ssh._tcp.local., PTR e2r3p4._sftp-ssh._tcp.local., (Cache flush) SRV e2r3p4.local.:22 0 0, (Cache flush) SRV e2r3p4.local.:22 0 0, (Cache flush) TXT "uuid=F1591A8F-873C-5C1A-9D47-E622C40A1FB1", PTR _workstation._tcp.local., PTR e2r3p4 [78:7b:8a:c4:ee:a1]._workstation._tcp.local., (Cache flush) AAAA fe80::183b:97d9:c5d1:a420, (Cache flush) SRV e2r3p4.local.:9 0 0, (Cache flush) A 10.12.3.4 (553)
16:17:07.501766 IP6 fe80::183b:97d9:c5d1:a420.5353 > ff02::fb.5353: 0*- [0q] 15/0/5 (Cache flush) TXT "", PTR _ssh._tcp.local., PTR e2r3p4._ssh._tcp.local., TXT "model=iMac18,3" "osxvers=16", (Cache flush) TXT "", PTR _sftp-ssh._tcp.local., PTR e2r3p4._sftp-ssh._tcp.local., (Cache flush) SRV e2r3p4.local.:22 0 0, (Cache flush) SRV e2r3p4.local.:22 0 0, (Cache flush) TXT "uuid=F1591A8F-873C-5C1A-9D47-E622C40A1FB1", PTR _workstation._tcp.local., PTR e2r3p4 [78:7b:8a:c4:ee:a1]._workstation._tcp.local., (Cache flush) AAAA fe80::183b:97d9:c5d1:a420, (Cache flush) SRV e2r3p4.local.:9 0 0, (Cache flush) A 10.12.3.4 (553)
16:17:08.151930 ARP, Request who-has 169.254.255.255 tell 10.12.3.4, length 46
16:17:08.151942 IP6 fe80::183b:97d9:c5d1:a420 > ff02::2: ICMP6, router solicitation, length 16
16:17:08.331497 ARP, Request who-has 10.12.254.254 tell 10.12.3.4, length 46
16:17:08.476647 ARP, Request who-has 169.254.255.255 tell 10.12.3.4, length 46
16:17:08.796737 ARP, Request who-has 169.254.255.255 tell 10.12.3.4, length 46
16:17:10.290091 IP 10.12.3.4.5353 > 224.0.0.251.5353: 0*- [0q] 17/0/7 (Cache flush) TXT "", PTR _ssh._tcp.local., PTR e2r3p4._ssh._tcp.local., TXT "model=iMac18,3" "osxvers=16", (Cache flush) TXT "", PTR _sftp-ssh._tcp.local., PTR e2r3p4._sftp-ssh._tcp.local., (Cache flush) SRV e2r3p4.local.:22 0 0, (Cache flush) SRV e2r3p4.local.:22 0 0, (Cache flush) PTR e2r3p4.local., (Cache flush) TXT "uuid=F1591A8F-873C-5C1A-9D47-E622C40A1FB1", PTR _workstation._tcp.local., PTR e2r3p4 [78:7b:8a:c4:ee:a1]._workstation._tcp.local., (Cache flush) PTR e2r3p4.local., (Cache flush) AAAA fe80::183b:97d9:c5d1:a420, (Cache flush) SRV e2r3p4.local.:9 0 0, (Cache flush) A 10.12.3.4 (707)
16:17:10.290106 IP6 fe80::183b:97d9:c5d1:a420.5353 > ff02::fb.5353: 0*- [0q] 17/0/7 (Cache flush) TXT "", PTR _ssh._tcp.local., PTR e2r3p4._ssh._tcp.local., TXT "model=iMac18,3" "osxvers=16", (Cache flush) TXT "", PTR _sftp-ssh._tcp.local., PTR e2r3p4._sftp-ssh._tcp.local., (Cache flush) SRV e2r3p4.local.:22 0 0, (Cache flush) SRV e2r3p4.local.:22 0 0, (Cache flush) PTR e2r3p4.local., (Cache flush) TXT "uuid=F1591A8F-873C-5C1A-9D47-E622C40A1FB1", PTR _workstation._tcp.local., PTR e2r3p4 [78:7b:8a:c4:ee:a1]._workstation._tcp.local., (Cache flush) PTR e2r3p4.local., (Cache flush) AAAA fe80::183b:97d9:c5d1:a420, (Cache flush) SRV e2r3p4.local.:9 0 0, (Cache flush) A 10.12.3.4 (707)
16:17:10.803530 IP 10.12.3.4.137 > 10.12.255.255.137: NBT UDP PACKET(137): REGISTRATION; REQUEST; BROADCAST
16:17:10.803810 IP 10.12.1.1.137 > 10.12.255.255.137: NBT UDP PACKET(137): REFRESH(8); REQUEST; BROADCAST
16:17:10.966754 IP 10.12.3.13.57621 > 10.12.255.255.57621: UDP, length 44
16:17:11.138601 ARP, Request who-has 10.12.19.23 (ff:ff:ff:ff:ff:ff) tell 10.12.100.171, length 46
16:17:11.138691 ARP, Reply 10.12.19.23 is-at 08:00:27:d1:82:df, length 28
16:17:11.339028 IP 10.12.100.171.58812 > 10.12.19.23.20679: UDP, length 0
16:17:11.339070 IP 10.12.100.171.58812 > 10.12.19.23.23557: UDP, length 0
16:17:11.339072 IP 10.12.100.171.58812 > 10.12.19.23.49198: UDP, length 0
16:17:11.339074 IP 10.12.100.171.58812 > 10.12.19.23.1040: UDP, length 0
16:17:11.339075 IP 10.12.100.171.58812 > 10.12.19.23.51905: UDP, length 0
16:17:11.339089 IP 10.12.100.171.58812 > 10.12.19.23.20031: UDP, length 0
16:17:11.339142 IP 10.12.100.171.58812 > 10.12.19.23.17205: UDP, length 0
16:17:11.339185 IP 10.12.100.171.58812 > 10.12.19.23.3283: UDP, length 0
16:17:11.339187 IP 10.12.100.171.58812 > 10.12.19.23.5351: UDP, length 2
16:17:11.339189 IP 10.12.100.171.58812 > 10.12.19.23.37144: UDP, length 0
16:17:12.391825 IP 10.12.100.171.58813 > 10.12.19.23.37144: UDP, length 0
16:17:12.391846 IP 10.12.100.171.58813 > 10.12.19.23.5351: UDP, length 2
16:17:12.391848 IP 10.12.100.171.58813 > 10.12.19.23.3283: UDP, length 0
16:17:12.391849 IP 10.12.100.171.58813 > 10.12.19.23.17205: UDP, length 0
16:17:12.391889 IP 10.12.100.171.58813 > 10.12.19.23.20031: UDP, length 0
16:17:12.391893 IP 10.12.100.171.58813 > 10.12.19.23.51905: UDP, length 0
16:17:12.391894 IP 10.12.100.171.58813 > 10.12.19.23.1040: UDP, length 0
16:17:12.391966 IP 10.12.100.171.58813 > 10.12.19.23.49198: UDP, length 0
16:17:12.391973 IP 10.12.100.171.58813 > 10.12.19.23.23557: UDP, length 0
16:17:12.391974 IP 10.12.100.171.58813 > 10.12.19.23.20679: UDP, length 0
16:17:12.441992 IP 10.12.100.171.58812 > 10.12.19.23.49393: UDP, length 0
16:17:12.442000 IP 10.12.100.171.58812 > 10.12.19.23.17615: UDP, length 0
16:17:12.442002 IP 10.12.100.171.58812 > 10.12.19.23.20752: UDP, length 0
16:17:12.442003 IP 10.12.100.171.58812 > 10.12.19.23.58419: UDP, length 0
16:17:12.442058 IP 10.12.100.171.58812 > 10.12.19.23.23531: UDP, length 0
16:17:12.442076 IP 10.12.100.171.58812 > 10.12.19.23.3659: UDP, length 0
16:17:12.442078 IP 10.12.100.171.58812 > 10.12.19.23.41446: UDP, length 0
16:17:12.442131 IP 10.12.100.171.58812 > 10.12.19.23.32772: UDP, length 0
16:17:12.444456 IP 10.12.100.171.58812 > 10.12.19.23.786: UDP, length 0
16:17:12.444477 IP 10.12.100.171.58812 > 10.12.19.23.22695: UDP, length 0
16:17:12.492628 IP 10.12.100.171.58813 > 10.12.19.23.32772: UDP, length 0
16:17:12.492662 IP 10.12.100.171.58813 > 10.12.19.23.41446: UDP, length 0
16:17:12.492663 IP 10.12.100.171.58813 > 10.12.19.23.3659: UDP, length 0
16:17:12.492665 IP 10.12.100.171.58813 > 10.12.19.23.23531: UDP, length 0
16:17:12.492666 IP 10.12.100.171.58813 > 10.12.19.23.58419: UDP, length 0
16:17:12.492668 IP 10.12.100.171.58813 > 10.12.19.23.20752: UDP, length 0
16:17:12.492794 IP 10.12.100.171.58813 > 10.12.19.23.17615: UDP, length 0
16:17:12.492797 IP 10.12.100.171.58813 > 10.12.19.23.49393: UDP, length 0
16:17:12.495160 IP 10.12.100.171.58813 > 10.12.19.23.22695: UDP, length 0
16:17:12.495179 IP 10.12.100.171.58813 > 10.12.19.23.786: UDP, length 0
16:17:12.542985 IP 10.12.100.171.58812 > 10.12.19.23.19718: UDP, length 0
16:17:12.542992 IP 10.12.100.171.58812 > 10.12.19.23.32771: UDP, length 0
16:17:12.542994 IP 10.12.100.171.58812 > 10.12.19.23.9020: UDP, length 0
16:17:12.542995 IP 10.12.100.171.58812 > 10.12.19.23.44190: UDP, length 0
16:17:12.542996 IP 10.12.100.171.58812 > 10.12.19.23.16948: UDP, length 0
16:17:12.543054 IP 10.12.100.171.58812 > 10.12.19.23.49: UDP, length 0
16:17:12.543057 IP 10.12.100.171.58812 > 10.12.19.23.17487: UDP, length 0
16:17:12.543059 IP 10.12.100.171.58812 > 10.12.19.23.17616: UDP, length 0
16:17:12.545559 IP 10.12.100.171.58812 > 10.12.19.23.64513: UDP, length 0
16:17:12.545565 IP 10.12.100.171.58812 > 10.12.19.23.57410: UDP, length 0
16:17:12.593860 IP 10.12.100.171.58813 > 10.12.19.23.17616: UDP, length 0
16:17:12.593882 IP 10.12.100.171.58813 > 10.12.19.23.17487: UDP, length 0
16:17:12.593883 IP 10.12.100.171.58813 > 10.12.19.23.49: UDP, length 0
16:17:12.593885 IP 10.12.100.171.58813 > 10.12.19.23.16948: UDP, length 0
16:17:12.593919 IP 10.12.100.171.58813 > 10.12.19.23.44190: UDP, length 0
16:17:12.593922 IP 10.12.100.171.58813 > 10.12.19.23.9020: UDP, length 0
16:17:12.593923 IP 10.12.100.171.58813 > 10.12.19.23.32771: UDP, length 0
16:17:12.593977 IP 10.12.100.171.58813 > 10.12.19.23.19718: UDP, length 0
16:17:12.596609 IP 10.12.100.171.58813 > 10.12.19.23.57410: UDP, length 0
16:17:12.596712 IP 10.12.100.171.58813 > 10.12.19.23.64513: UDP, length 0
16:17:12.598300 IP6 fe80::183b:97d9:c5d1:a420 > ff02::2: ICMP6, router solicitation, length 16
16:17:12.644112 IP 10.12.100.171.58812 > 10.12.19.23.36893: UDP, length 0
16:17:12.644121 IP 10.12.100.171.58812 > 10.12.19.23.35702: UDP, length 0
16:17:12.644123 IP 10.12.100.171.58812 > 10.12.19.23.1064: UDP, length 0
16:17:12.644124 IP 10.12.100.171.58812 > 10.12.19.23.16862: UDP, length 0
16:17:12.644126 IP 10.12.100.171.58812 > 10.12.19.23.23679: UDP, length 0
16:17:12.644177 IP 10.12.100.171.58812 > 10.12.19.23.39213: UDP, length 0
16:17:12.644180 IP 10.12.100.171.58812 > 10.12.19.23.1043: UDP, length 0
16:17:12.644224 IP 10.12.100.171.58812 > 10.12.19.23.5353: 0 PTR (QM)? _services._dns-sd._udp.local. (46)
16:17:12.646942 IP 10.12.100.171.58812 > 10.12.19.23.54114: UDP, length 0
16:17:12.646961 IP 10.12.100.171.58812 > 10.12.19.23.20717: UDP, length 0
16:17:12.694868 IP 10.12.100.171.58813 > 10.12.19.23.5353: 0 PTR (QM)? _services._dns-sd._udp.local. (46)
16:17:12.694890 IP 10.12.100.171.58813 > 10.12.19.23.1043: UDP, length 0
16:17:12.694891 IP 10.12.100.171.58813 > 10.12.19.23.39213: UDP, length 0
16:17:12.694893 IP 10.12.100.171.58813 > 10.12.19.23.23679: UDP, length 0
16:17:12.694894 IP 10.12.100.171.58813 > 10.12.19.23.16862: UDP, length 0
16:17:12.694895 IP 10.12.100.171.58813 > 10.12.19.23.1064: UDP, length 0
16:17:12.694897 IP 10.12.100.171.58813 > 10.12.19.23.35702: UDP, length 0
16:17:12.694952 IP 10.12.100.171.58813 > 10.12.19.23.36893: UDP, length 0
16:17:12.697364 IP 10.12.100.171.58813 > 10.12.19.23.20717: UDP, length 0
16:17:12.697372 IP 10.12.100.171.58813 > 10.12.19.23.54114: UDP, length 0
16:17:12.745234 IP 10.12.100.171.58812 > 10.12.19.23.38498: UDP, length 0
16:17:12.745267 IP 10.12.100.171.58812 > 10.12.19.23.21702: UDP, length 0
16:17:12.745268 IP 10.12.100.171.58812 > 10.12.19.23.31891: UDP, length 0
16:17:12.745270 IP 10.12.100.171.58812 > 10.12.19.23.61370: UDP, length 0
16:17:12.745319 IP 10.12.100.171.58812 > 10.12.19.23.49163: UDP, length 0
16:17:12.745322 IP 10.12.100.171.58812 > 10.12.19.23.4045: UDP, length 0
16:17:12.745323 IP 10.12.100.171.58812 > 10.12.19.23.16972: UDP, length 0
16:17:12.745388 IP 10.12.100.171.58812 > 10.12.19.23.21698: UDP, length 0
16:17:12.747687 IP 10.12.100.171.58812 > 10.12.19.23.49157: UDP, length 0
16:17:12.747706 IP 10.12.100.171.58812 > 10.12.19.23.49193: UDP, length 0
16:17:12.767917 IP 10.12.3.4.137 > 10.12.255.255.137: NBT UDP PACKET(137): REGISTRATION; REQUEST; BROADCAST
16:17:12.768402 IP 10.12.1.1.137 > 10.12.255.255.137: NBT UDP PACKET(137): REFRESH(8); REQUEST; BROADCAST
16:17:12.796326 IP 10.12.100.171.58813 > 10.12.19.23.21698: UDP, length 0
16:17:12.796361 IP 10.12.100.171.58813 > 10.12.19.23.16972: UDP, length 0
16:17:12.796363 IP 10.12.100.171.58813 > 10.12.19.23.4045: UDP, length 0
16:17:12.796379 IP 10.12.100.171.58813 > 10.12.19.23.49163: UDP, length 0
16:17:12.796381 IP 10.12.100.171.58813 > 10.12.19.23.61370: UDP, length 0
16:17:12.796382 IP 10.12.100.171.58813 > 10.12.19.23.31891: UDP, length 0
16:17:12.796455 IP 10.12.100.171.58813 > 10.12.19.23.21702: UDP, length 0
16:17:12.796473 IP 10.12.100.171.58813 > 10.12.19.23.38498: UDP, length 0
16:17:12.798810 IP 10.12.100.171.58813 > 10.12.19.23.49193: UDP, length 0
16:17:12.798829 IP 10.12.100.171.58813 > 10.12.19.23.49157: UDP, length 0
16:17:12.846522 IP 10.12.100.171.58812 > 10.12.19.23.139: UDP, length 0
16:17:12.846547 IP 10.12.100.171.58812 > 10.12.19.23.43824: UDP, length 0
16:17:12.846548 IP 10.12.100.171.58812 > 10.12.19.23.49202: UDP, length 0
16:17:12.846550 IP 10.12.100.171.58812 > 10.12.19.23.28465: UDP, length 0
16:17:12.846636 IP 10.12.100.171.58812 > 10.12.19.23.21710: UDP, length 0
16:17:12.846639 IP 10.12.100.171.58812 > 10.12.19.23.25003: UDP, length 0
16:17:12.846743 IP 10.12.100.171.58812 > 10.12.19.23.1455: UDP, length 0
16:17:12.849224 IP 10.12.100.171.58812 > 10.12.19.23.16839: UDP, length 0
16:17:12.849246 IP 10.12.100.171.58812 > 10.12.19.23.21261: UDP, length 0
16:17:12.849247 IP 10.12.100.171.58812 > 10.12.19.23.3703: UDP, length 0
16:17:12.896939 IP 10.12.100.171.58813 > 10.12.19.23.1455: UDP, length 0
16:17:12.896962 IP 10.12.100.171.58813 > 10.12.19.23.25003: UDP, length 0
16:17:12.896963 IP 10.12.100.171.58813 > 10.12.19.23.21710: UDP, length 0
16:17:12.896965 IP 10.12.100.171.58813 > 10.12.19.23.28465: UDP, length 0
16:17:12.896966 IP 10.12.100.171.58813 > 10.12.19.23.49202: UDP, length 0
16:17:12.896967 IP 10.12.100.171.58813 > 10.12.19.23.43824: UDP, length 0
16:17:12.897025 IP 10.12.100.171.58813 > 10.12.19.23.139: UDP, length 0
16:17:12.899742 IP 10.12.100.171.58813 > 10.12.19.23.3703: UDP, length 0
16:17:12.899748 IP 10.12.100.171.58813 > 10.12.19.23.21261: UDP, length 0
16:17:12.899749 IP 10.12.100.171.58813 > 10.12.19.23.16839: UDP, length 0
16:17:12.947191 IP 10.12.100.171.58812 > 10.12.19.23.61412: UDP, length 0
16:17:12.947211 IP 10.12.100.171.58812 > 10.12.19.23.22739: UDP, length 0
16:17:12.947213 IP 10.12.100.171.58812 > 10.12.19.23.49158: UDP, length 0
16:17:12.947214 IP 10.12.100.171.58812 > 10.12.19.23.26407: UDP, length 0
16:17:12.947215 IP 10.12.100.171.58812 > 10.12.19.23.19: UDP, length 0
16:17:12.947266 IP 10.12.100.171.58812 > 10.12.19.23.9877: UDP, length 0
16:17:12.947269 IP 10.12.100.171.58812 > 10.12.19.23.29810: UDP, length 0
16:17:12.950225 IP 10.12.100.171.58812 > 10.12.19.23.41058: UDP, length 0
16:17:12.950231 IP 10.12.100.171.58812 > 10.12.19.23.19789: UDP, length 0
16:17:12.950233 IP 10.12.100.171.58812 > 10.12.19.23.1007: UDP, length 0
16:17:12.998114 IP 10.12.100.171.58813 > 10.12.19.23.29810: UDP, length 0
16:17:12.998137 IP 10.12.100.171.58813 > 10.12.19.23.9877: UDP, length 0
16:17:12.998149 IP 10.12.100.171.58813 > 10.12.19.23.19: UDP, length 0
16:17:12.998273 IP 10.12.100.171.58813 > 10.12.19.23.26407: UDP, length 0
16:17:12.998281 IP 10.12.100.171.58813 > 10.12.19.23.49158: UDP, length 0
16:17:12.998283 IP 10.12.100.171.58813 > 10.12.19.23.22739: UDP, length 0
16:17:12.998284 IP 10.12.100.171.58813 > 10.12.19.23.61412: UDP, length 0
16:17:13.000837 IP 10.12.100.171.58813 > 10.12.19.23.1007: UDP, length 0
16:17:13.000843 IP 10.12.100.171.58813 > 10.12.19.23.19789: UDP, length 0
16:17:13.000845 IP 10.12.100.171.58813 > 10.12.19.23.41058: UDP, length 0
16:17:13.048227 IP 10.12.100.171.58812 > 10.12.19.23.6970: UDP, length 0
16:17:13.048234 IP 10.12.100.171.58812 > 10.12.19.23.31365: UDP, length 0
16:17:13.048235 IP 10.12.100.171.58812 > 10.12.19.23.47772: UDP, length 0
16:17:13.050835 IP 10.12.100.171.58812 > 10.12.19.23.21360: UDP, length 0
16:17:13.050842 IP 10.12.100.171.58812 > 10.12.19.23.19728: UDP, length 0
16:17:13.050844 IP 10.12.100.171.58812 > 10.12.19.23.1069: UDP, length 0
16:17:13.050845 IP 10.12.100.171.58812 > 10.12.19.23.49186: UDP, length 0
16:17:13.053254 IP 10.12.100.171.58812 > 10.12.19.23.593: UDP, length 0
16:17:13.053262 IP 10.12.100.171.58812 > 10.12.19.23.20288: UDP, length 0
16:17:13.053280 IP 10.12.100.171.58812 > 10.12.19.23.36458: UDP, length 0
16:17:13.099524 IP 10.12.100.171.58813 > 10.12.19.23.47772: UDP, length 0
16:17:13.099545 IP 10.12.100.171.58813 > 10.12.19.23.31365: UDP, length 0
16:17:13.099546 IP 10.12.100.171.58813 > 10.12.19.23.6970: UDP, length 0
16:17:13.102088 IP 10.12.100.171.58813 > 10.12.19.23.49186: UDP, length 0
16:17:13.102094 IP 10.12.100.171.58813 > 10.12.19.23.1069: UDP, length 0
16:17:13.102135 IP 10.12.100.171.58813 > 10.12.19.23.19728: UDP, length 0
16:17:13.102137 IP 10.12.100.171.58813 > 10.12.19.23.21360: UDP, length 0
16:17:13.104515 IP 10.12.100.171.58813 > 10.12.19.23.36458: UDP, length 0
16:17:13.104602 IP 10.12.100.171.58813 > 10.12.19.23.20288: UDP, length 0
16:17:13.104605 IP 10.12.100.171.58813 > 10.12.19.23.593: UDP, length 0
16:17:13.150090 IP 10.12.100.171.58812 > 10.12.19.23.35438: UDP, length 0
16:17:13.150097 IP 10.12.100.171.58812 > 10.12.19.23.18996: UDP, length 0
16:17:13.150114 IP 10.12.100.171.58812 > 10.12.19.23.27444: UDP, length 0
16:17:13.152363 IP 10.12.100.171.58812 > 10.12.19.23.20129: UDP, length 0
16:17:13.152384 IP 10.12.100.171.58812 > 10.12.19.23.21524: UDP, length 0
16:17:13.152386 IP 10.12.100.171.58812 > 10.12.19.23.50164: UDP, length 0
16:17:13.152387 IP 10.12.100.171.58812 > 10.12.19.23.18830: UDP, length 0
16:17:13.154737 IP 10.12.100.171.58812 > 10.12.19.23.28369: UDP, length 0
16:17:13.154744 IP 10.12.100.171.58812 > 10.12.19.23.1072: UDP, length 0
16:17:13.154745 IP 10.12.100.171.58812 > 10.12.19.23.21206: UDP, length 0
16:17:13.200931 IP 10.12.100.171.58813 > 10.12.19.23.27444: UDP, length 0
16:17:13.200951 IP 10.12.100.171.58813 > 10.12.19.23.18996: UDP, length 0
16:17:13.200953 IP 10.12.100.171.58813 > 10.12.19.23.35438: UDP, length 0
16:17:13.203530 IP 10.12.100.171.58813 > 10.12.19.23.18830: UDP, length 0
16:17:13.203550 IP 10.12.100.171.58813 > 10.12.19.23.50164: UDP, length 0
16:17:13.203551 IP 10.12.100.171.58813 > 10.12.19.23.21524: UDP, length 0
16:17:13.203552 IP 10.12.100.171.58813 > 10.12.19.23.20129: UDP, length 0
16:17:13.205945 IP 10.12.100.171.58813 > 10.12.19.23.21206: UDP, length 0
16:17:13.205965 IP 10.12.100.171.58813 > 10.12.19.23.1072: UDP, length 0
16:17:13.205967 IP 10.12.100.171.58813 > 10.12.19.23.28369: UDP, length 0
16:17:13.251080 IP 10.12.100.171.58812 > 10.12.19.23.1761: UDP, length 0
16:17:13.251087 IP 10.12.100.171.58812 > 10.12.19.23.33717: UDP, length 0
16:17:13.251088 IP 10.12.100.171.58812 > 10.12.19.23.24854: UDP, length 0
16:17:13.253856 IP 10.12.100.171.58812 > 10.12.19.23.50497: UDP, length 0
16:17:13.253863 IP 10.12.100.171.58812 > 10.12.19.23.3456:  [|vat]
16:17:13.253865 IP 10.12.100.171.58812 > 10.12.19.23.17939: UDP, length 0
16:17:13.253926 IP 10.12.100.171.58812 > 10.12.19.23.27482: UDP, length 0
16:17:13.256331 IP 10.12.100.171.58812 > 10.12.19.23.137: NBT UDP PACKET(137): QUERY; REQUEST; BROADCAST
16:17:13.256351 IP 10.12.100.171.58812 > 10.12.19.23.5010: UDP, length 0
16:17:13.256352 IP 10.12.100.171.58812 > 10.12.19.23.5060: SIP
16:17:13.301824 IP 10.12.100.171.58813 > 10.12.19.23.24854: UDP, length 0
16:17:13.301846 IP 10.12.100.171.58813 > 10.12.19.23.33717: UDP, length 0
16:17:13.301847 IP 10.12.100.171.58813 > 10.12.19.23.1761: UDP, length 0
16:17:13.304211 IP 10.12.100.171.58813 > 10.12.19.23.27482: UDP, length 0
16:17:13.304217 IP 10.12.100.171.58813 > 10.12.19.23.17939: UDP, length 0
16:17:13.304219 IP 10.12.100.171.58813 > 10.12.19.23.3456:  [|vat]
16:17:13.304220 IP 10.12.100.171.58813 > 10.12.19.23.50497: UDP, length 0
16:17:13.306335 IP 10.12.100.171.58813 > 10.12.19.23.137: NBT UDP PACKET(137): QUERY; REQUEST; BROADCAST
16:17:13.308683 IP 10.12.100.171.58813 > 10.12.19.23.5060: SIP
16:17:13.308715 IP 10.12.100.171.58813 > 10.12.19.23.5010: UDP, length 0
16:17:13.353049 IP 10.12.100.171.58812 > 10.12.19.23.49175: UDP, length 0
16:17:13.353057 IP 10.12.100.171.58812 > 10.12.19.23.19017: UDP, length 0
16:17:13.353059 IP 10.12.100.171.58812 > 10.12.19.23.1033: UDP, length 0
16:17:13.355452 IP 10.12.100.171.58812 > 10.12.19.23.17754: UDP, length 0
16:17:13.355471 IP 10.12.100.171.58812 > 10.12.19.23.17: UDP, length 0
16:17:13.355473 IP 10.12.100.171.58812 > 10.12.19.23.19315: UDP, length 0
16:17:13.355487 IP 10.12.100.171.58812 > 10.12.19.23.8900: UDP, length 0
16:17:13.357880 IP 10.12.100.171.58812 > 10.12.19.23.49195: UDP, length 0
16:17:13.360207 IP 10.12.100.171.58812 > 10.12.19.23.22055: UDP, length 0
16:17:13.360226 IP 10.12.100.171.58812 > 10.12.19.23.1021: UDP, length 0
16:17:13.403416 IP 10.12.100.171.58813 > 10.12.19.23.1033: UDP, length 0
16:17:13.403449 IP 10.12.100.171.58813 > 10.12.19.23.19017: UDP, length 0
16:17:13.403450 IP 10.12.100.171.58813 > 10.12.19.23.49175: UDP, length 0
16:17:13.405979 IP 10.12.100.171.58813 > 10.12.19.23.8900: UDP, length 0
16:17:13.405985 IP 10.12.100.171.58813 > 10.12.19.23.19315: UDP, length 0
16:17:13.405987 IP 10.12.100.171.58813 > 10.12.19.23.17: UDP, length 0
16:17:13.406045 IP 10.12.100.171.58813 > 10.12.19.23.17754: UDP, length 0
16:17:13.408447 IP 10.12.100.171.58813 > 10.12.19.23.49195: UDP, length 0
16:17:13.411024 IP 10.12.100.171.58813 > 10.12.19.23.1021: UDP, length 0
16:17:13.411030 IP 10.12.100.171.58813 > 10.12.19.23.22055: UDP, length 0
16:17:13.453638 IP 10.12.100.171.58812 > 10.12.19.23.44334: UDP, length 0
16:17:13.453644 IP 10.12.100.171.58812 > 10.12.19.23.2222: UDP, length 0
16:17:13.453645 IP 10.12.100.171.58812 > 10.12.19.23.45441: UDP, length 0
16:17:13.456452 IP 10.12.100.171.58812 > 10.12.19.23.1008: UDP, length 0
16:17:13.456473 IP 10.12.100.171.58812 > 10.12.19.23.40805: UDP, length 0
16:17:13.456475 IP 10.12.100.171.58812 > 10.12.19.23.34580: UDP, length 0
16:17:13.456477 IP 10.12.100.171.58812 > 10.12.19.23.21803: UDP, length 0
16:17:13.458778 IP 10.12.100.171.58812 > 10.12.19.23.41308: UDP, length 0
16:17:13.461453 IP 10.12.100.171.58812 > 10.12.19.23.49174: UDP, length 0
16:17:13.461460 IP 10.12.100.171.58812 > 10.12.19.23.49213: UDP, length 0
16:17:13.503951 IP 10.12.100.171.58813 > 10.12.19.23.45441: UDP, length 0
16:17:13.504004 IP 10.12.100.171.58813 > 10.12.19.23.2222: UDP, length 0
16:17:13.504007 IP 10.12.100.171.58813 > 10.12.19.23.44334: UDP, length 0
16:17:13.506828 IP 10.12.100.171.58813 > 10.12.19.23.21803: UDP, length 0
16:17:13.506835 IP 10.12.100.171.58813 > 10.12.19.23.34580: UDP, length 0
16:17:13.506837 IP 10.12.100.171.58813 > 10.12.19.23.40805: UDP, length 0
16:17:13.506838 IP 10.12.100.171.58813 > 10.12.19.23.1008: UDP, length 0
16:17:13.509291 IP 10.12.100.171.58813 > 10.12.19.23.41308: UDP, length 0
16:17:13.511727 IP 10.12.100.171.58813 > 10.12.19.23.49213: UDP, length 0
16:17:13.511733 IP 10.12.100.171.58813 > 10.12.19.23.49174: UDP, length 0
16:17:13.554132 IP 10.12.100.171.58812 > 10.12.19.23.58075: UDP, length 0
16:17:13.554142 IP 10.12.100.171.58812 > 10.12.19.23.19624: UDP, length 0
16:17:13.554144 IP 10.12.100.171.58812 > 10.12.19.23.21902: UDP, length 0
16:17:13.557343 IP 10.12.100.171.58812 > 10.12.19.23.17673: UDP, length 0
16:17:13.557350 IP 10.12.100.171.58812 > 10.12.19.23.49191: UDP, length 0
16:17:13.557351 IP 10.12.100.171.58812 > 10.12.19.23.20249: UDP, length 0
16:17:13.557441 IP 10.12.100.171.58812 > 10.12.19.23.22996: UDP, length 0
16:17:13.559868 IP 10.12.100.171.58812 > 10.12.19.23.539: UDP, length 0
16:17:13.562195 IP 10.12.100.171.58812 > 10.12.19.23.17185: UDP, length 64
16:17:13.562201 IP 10.12.100.171.58812 > 10.12.19.23.1056: UDP, length 0
16:17:13.604550 IP 10.12.100.171.58813 > 10.12.19.23.21902: UDP, length 0
16:17:13.604584 IP 10.12.100.171.58813 > 10.12.19.23.19624: UDP, length 0
16:17:13.604585 IP 10.12.100.171.58813 > 10.12.19.23.58075: UDP, length 0
16:17:13.607957 IP 10.12.100.171.58813 > 10.12.19.23.22996: UDP, length 0
16:17:13.608004 IP 10.12.100.171.58813 > 10.12.19.23.20249: UDP, length 0
16:17:13.608007 IP 10.12.100.171.58813 > 10.12.19.23.49191: UDP, length 0
16:17:13.608009 IP 10.12.100.171.58813 > 10.12.19.23.17673: UDP, length 0
16:17:13.610313 IP 10.12.100.171.58813 > 10.12.19.23.539: UDP, length 0
16:17:13.612656 IP 10.12.100.171.58813 > 10.12.19.23.1056: UDP, length 0
16:17:13.612663 IP 10.12.100.171.58813 > 10.12.19.23.17185: UDP, length 64
16:17:13.654591 IP 10.12.100.171.58812 > 10.12.19.23.112: UDP, length 0
16:17:13.654598 IP 10.12.100.171.58812 > 10.12.19.23.21344: UDP, length 0
16:17:13.656867 IP 10.12.100.171.58812 > 10.12.19.23.514: [|syslog]
16:17:13.659296 IP 10.12.100.171.58812 > 10.12.19.23.21358: UDP, length 0
16:17:13.659303 IP 10.12.100.171.58812 > 10.12.19.23.42434: UDP, length 0
16:17:13.659304 IP 10.12.100.171.58812 > 10.12.19.23.51717: UDP, length 0
16:17:13.659305 IP 10.12.100.171.58812 > 10.12.19.23.135: UDP, length 0
16:17:13.661896 IP 10.12.100.171.58812 > 10.12.19.23.23781: UDP, length 0
16:17:13.663986 IP 10.12.100.171.58812 > 10.12.19.23.21354: UDP, length 0
16:17:13.664004 IP 10.12.100.171.58812 > 10.12.19.23.42431: UDP, length 0
16:17:13.704981 IP 10.12.100.171.58813 > 10.12.19.23.21344: UDP, length 0
16:17:13.705005 IP 10.12.100.171.58813 > 10.12.19.23.112: UDP, length 0
16:17:13.707604 IP 10.12.100.171.58813 > 10.12.19.23.514: [|syslog]
16:17:13.710090 IP 10.12.100.171.58813 > 10.12.19.23.135: UDP, length 0
16:17:13.710096 IP 10.12.100.171.58813 > 10.12.19.23.51717: UDP, length 0
16:17:13.710098 IP 10.12.100.171.58813 > 10.12.19.23.42434: UDP, length 0
16:17:13.710156 IP 10.12.100.171.58813 > 10.12.19.23.21358: UDP, length 0
16:17:13.712568 IP 10.12.100.171.58813 > 10.12.19.23.23781: UDP, length 0
16:17:13.714820 IP 10.12.100.171.58813 > 10.12.19.23.42431: UDP, length 0
16:17:13.714827 IP 10.12.100.171.58813 > 10.12.19.23.21354: UDP, length 0
16:17:13.755325 IP 10.12.100.171.58812 > 10.12.19.23.1028: UDP, length 0
16:17:13.755355 IP 10.12.100.171.58812 > 10.12.19.23.18004: UDP, length 0
16:17:13.757886 IP 10.12.100.171.58812 > 10.12.19.23.49170: UDP, length 0
16:17:13.760428 IP 10.12.100.171.58812 > 10.12.19.23.17184: UDP, length 0
16:17:13.760436 IP 10.12.100.171.58812 > 10.12.19.23.57813: UDP, length 0
16:17:13.760437 IP 10.12.100.171.58812 > 10.12.19.23.17683: UDP, length 0
16:17:13.760438 IP 10.12.100.171.58812 > 10.12.19.23.19047: UDP, length 0
16:17:13.762636 IP 10.12.100.171.58812 > 10.12.19.23.42056: UDP, length 0
16:17:13.765079 IP 10.12.100.171.58812 > 10.12.19.23.45818: UDP, length 0
16:17:13.765098 IP 10.12.100.171.58812 > 10.12.19.23.33459: UDP, length 0
16:17:13.806569 IP 10.12.100.171.58813 > 10.12.19.23.18004: UDP, length 0
16:17:13.806588 IP 10.12.100.171.58813 > 10.12.19.23.1028: UDP, length 0
16:17:13.808844 IP 10.12.100.171.58813 > 10.12.19.23.49170: UDP, length 0
16:17:13.811410 IP 10.12.100.171.58813 > 10.12.19.23.19047: UDP, length 0
16:17:13.811417 IP 10.12.100.171.58813 > 10.12.19.23.17683: UDP, length 0
16:17:13.811418 IP 10.12.100.171.58813 > 10.12.19.23.57813: UDP, length 0
16:17:13.811420 IP 10.12.100.171.58813 > 10.12.19.23.17184: UDP, length 0
16:17:13.813800 IP 10.12.100.171.58813 > 10.12.19.23.42056: UDP, length 0
16:17:13.816307 IP 10.12.100.171.58813 > 10.12.19.23.33459: UDP, length 0
16:17:13.816313 IP 10.12.100.171.58813 > 10.12.19.23.45818: UDP, length 0
16:17:13.856780 IP 10.12.100.171.58812 > 10.12.19.23.1049: UDP, length 0
16:17:13.856800 IP 10.12.100.171.58812 > 10.12.19.23.19120: UDP, length 0
16:17:13.859291 IP 10.12.100.171.58812 > 10.12.19.23.49216: UDP, length 0
16:17:13.861750 IP 10.12.100.171.58812 > 10.12.19.23.21454: UDP, length 0
16:17:13.861757 IP 10.12.100.171.58812 > 10.12.19.23.1090: UDP, length 0
16:17:13.861758 IP 10.12.100.171.58812 > 10.12.19.23.17146: UDP, length 0
16:17:13.861759 IP 10.12.100.171.58812 > 10.12.19.23.55544: UDP, length 0
16:17:13.864286 IP 10.12.100.171.58812 > 10.12.19.23.623: UDP, length 0
16:17:13.866367 IP 10.12.100.171.58812 > 10.12.19.23.639: UDP, length 0
16:17:13.866373 IP 10.12.100.171.58812 > 10.12.19.23.16838: UDP, length 0
16:17:13.907520 IP 10.12.100.171.58813 > 10.12.19.23.19120: UDP, length 0
16:17:13.907541 IP 10.12.100.171.58813 > 10.12.19.23.1049: UDP, length 0
16:17:13.909977 IP 10.12.100.171.58813 > 10.12.19.23.49216: UDP, length 0
16:17:13.912431 IP 10.12.100.171.58813 > 10.12.19.23.55544: UDP, length 0
16:17:13.912457 IP 10.12.100.171.58813 > 10.12.19.23.17146: UDP, length 0
16:17:13.912459 IP 10.12.100.171.58813 > 10.12.19.23.1090: UDP, length 0
16:17:13.912460 IP 10.12.100.171.58813 > 10.12.19.23.21454: UDP, length 0
16:17:13.914827 IP 10.12.100.171.58813 > 10.12.19.23.623: UDP, length 0
16:17:13.917292 IP 10.12.100.171.58813 > 10.12.19.23.16838: UDP, length 0
16:17:13.917305 IP 10.12.100.171.58813 > 10.12.19.23.639: UDP, length 0
16:17:13.958401 IP 10.12.100.171.58812 > 10.12.19.23.16548: UDP, length 0
16:17:13.958434 IP 10.12.100.171.58812 > 10.12.19.23.32770: UDP, length 0
16:17:13.960823 IP 10.12.100.171.58812 > 10.12.19.23.657: UDP, length 0
16:17:13.963298 IP 10.12.100.171.58812 > 10.12.19.23.20710: UDP, length 0
16:17:13.963306 IP 10.12.100.171.58812 > 10.12.19.23.49306: UDP, length 0
16:17:13.963307 IP 10.12.100.171.58812 > 10.12.19.23.16433: UDP, length 0
16:17:13.963389 IP 10.12.100.171.58812 > 10.12.19.23.30656: UDP, length 0
16:17:13.965817 IP 10.12.100.171.58812 > 10.12.19.23.1044: UDP, length 0
16:17:13.968014 IP 10.12.100.171.58812 > 10.12.19.23.5002: UDP, length 0
16:17:13.968021 IP 10.12.100.171.58812 > 10.12.19.23.41971: UDP, length 0
16:17:14.008934 IP 10.12.100.171.58813 > 10.12.19.23.32770: UDP, length 0
16:17:14.008953 IP 10.12.100.171.58813 > 10.12.19.23.16548: UDP, length 0
16:17:14.011364 IP 10.12.100.171.58813 > 10.12.19.23.657: UDP, length 0
16:17:14.013748 IP 10.12.100.171.58813 > 10.12.19.23.30656: UDP, length 0
16:17:14.013769 IP 10.12.100.171.58813 > 10.12.19.23.16433: UDP, length 0
16:17:14.013771 IP 10.12.100.171.58813 > 10.12.19.23.49306: UDP, length 0
16:17:14.013772 IP 10.12.100.171.58813 > 10.12.19.23.20710: UDP, length 0
16:17:14.016208 IP 10.12.100.171.58813 > 10.12.19.23.1044: UDP, length 0
16:17:14.018277 IP 10.12.100.171.58813 > 10.12.19.23.41971: UDP, length 0
16:17:14.018284 IP 10.12.100.171.58813 > 10.12.19.23.5002: UDP, length 0
16:17:14.059379 IP 10.12.100.171.58812 > 10.12.19.23.1032: UDP, length 0
16:17:14.059392 IP 10.12.100.171.58812 > 10.12.19.23.1200: UDP, length 0
16:17:14.061669 IP 10.12.100.171.58812 > 10.12.19.23.25462: UDP, length 0
16:17:14.063876 IP 10.12.100.171.58812 > 10.12.19.23.28122: UDP, length 0
16:17:14.063884 IP 10.12.100.171.58812 > 10.12.19.23.49190: UDP, length 0
16:17:14.063886 IP 10.12.100.171.58812 > 10.12.19.23.4000: UDP, length 0
16:17:14.063887 IP 10.12.100.171.58812 > 10.12.19.23.6002: UDP, length 0
16:17:14.066236 IP 10.12.100.171.58812 > 10.12.19.23.17417: UDP, length 0
16:17:14.068652 IP 10.12.100.171.58812 > 10.12.19.23.49156: UDP, length 0
16:17:14.068658 IP 10.12.100.171.58812 > 10.12.19.23.17321: UDP, length 0
16:17:14.109908 IP 10.12.100.171.58813 > 10.12.19.23.1200: UDP, length 0
16:17:14.109931 IP 10.12.100.171.58813 > 10.12.19.23.1032: UDP, length 0
16:17:14.112404 IP 10.12.100.171.58813 > 10.12.19.23.25462: UDP, length 0
16:17:14.114599 IP 10.12.100.171.58813 > 10.12.19.23.6002: UDP, length 0
16:17:14.114632 IP 10.12.100.171.58813 > 10.12.19.23.4000: UDP, length 0
16:17:14.114634 IP 10.12.100.171.58813 > 10.12.19.23.49190: UDP, length 0
16:17:14.114635 IP 10.12.100.171.58813 > 10.12.19.23.28122: UDP, length 0
16:17:14.117090 IP 10.12.100.171.58813 > 10.12.19.23.17417: UDP, length 0
16:17:14.119323 IP 10.12.100.171.58813 > 10.12.19.23.17321: UDP, length 0
16:17:14.119330 IP 10.12.100.171.58813 > 10.12.19.23.49156: UDP, length 0
16:17:14.160037 IP 10.12.100.171.58812 > 10.12.19.23.18818: UDP, length 0
16:17:14.160052 IP 10.12.100.171.58812 > 10.12.19.23.21366: UDP, length 0
16:17:14.162756 IP 10.12.100.171.58812 > 10.12.19.23.1048: UDP, length 0
16:17:14.165086 IP 10.12.100.171.58812 > 10.12.19.23.1037: UDP, length 0
16:17:14.165092 IP 10.12.100.171.58812 > 10.12.19.23.22109: UDP, length 0
16:17:14.165094 IP 10.12.100.171.58812 > 10.12.19.23.983: UDP, length 0
16:17:14.165095 IP 10.12.100.171.58812 > 10.12.19.23.21644: UDP, length 0
16:17:14.167481 IP 10.12.100.171.58812 > 10.12.19.23.16939: UDP, length 0
16:17:14.169825 IP 10.12.100.171.58812 > 10.12.19.23.40732: UDP, length 0
16:17:14.169832 IP 10.12.100.171.58812 > 10.12.19.23.59765: UDP, length 0
16:17:14.211212 IP 10.12.100.171.58813 > 10.12.19.23.21366: UDP, length 0
16:17:14.211244 IP 10.12.100.171.58813 > 10.12.19.23.18818: UDP, length 0
16:17:14.213556 IP 10.12.100.171.58813 > 10.12.19.23.1048: UDP, length 0
16:17:14.215859 IP 10.12.100.171.58813 > 10.12.19.23.21644: UDP, length 0
16:17:14.215866 IP 10.12.100.171.58813 > 10.12.19.23.983: UDP, length 0
16:17:14.215915 IP 10.12.100.171.58813 > 10.12.19.23.22109: UDP, length 0
16:17:14.215918 IP 10.12.100.171.58813 > 10.12.19.23.1037: UDP, length 0
16:17:14.218291 IP 10.12.100.171.58813 > 10.12.19.23.16939: UDP, length 0
16:17:14.220847 IP 10.12.100.171.58813 > 10.12.19.23.59765: UDP, length 0
16:17:14.220866 IP 10.12.100.171.58813 > 10.12.19.23.40732: UDP, length 0
16:17:14.261230 IP 10.12.100.171.58812 > 10.12.19.23.36489: UDP, length 0
16:17:14.263588 IP 10.12.100.171.58812 > 10.12.19.23.1029: UDP, length 0
16:17:14.263597 IP 10.12.100.171.58812 > 10.12.19.23.34579: UDP, length 0
16:17:14.266134 IP 10.12.100.171.58812 > 10.12.19.23.17573: UDP, length 0
16:17:14.266140 IP 10.12.100.171.58812 > 10.12.19.23.27473: UDP, length 0
16:17:14.266142 IP 10.12.100.171.58812 > 10.12.19.23.17762: UDP, length 0
16:17:14.266143 IP 10.12.100.171.58812 > 10.12.19.23.19719: UDP, length 0
16:17:14.268656 IP 10.12.100.171.58812 > 10.12.19.23.32345: UDP, length 0
16:17:14.271046 IP 10.12.100.171.58812 > 10.12.19.23.21948: UDP, length 0
16:17:14.271053 IP 10.12.100.171.58812 > 10.12.19.23.500: isakmp: phase 1 I ident
16:17:14.312531 IP 10.12.100.171.58813 > 10.12.19.23.36489: UDP, length 0
16:17:14.315003 IP 10.12.100.171.58813 > 10.12.19.23.34579: UDP, length 0
16:17:14.315011 IP 10.12.100.171.58813 > 10.12.19.23.1029: UDP, length 0
16:17:14.317498 IP 10.12.100.171.58813 > 10.12.19.23.19719: UDP, length 0
16:17:14.317505 IP 10.12.100.171.58813 > 10.12.19.23.17762: UDP, length 0
16:17:14.317563 IP 10.12.100.171.58813 > 10.12.19.23.27473: UDP, length 0
16:17:14.317566 IP 10.12.100.171.58813 > 10.12.19.23.17573: UDP, length 0
16:17:14.319844 IP 10.12.100.171.58813 > 10.12.19.23.32345: UDP, length 0
16:17:14.322206 IP 10.12.100.171.58813 > 10.12.19.23.500: isakmp: phase 1 I ident
16:17:14.322212 IP 10.12.100.171.58813 > 10.12.19.23.21948: UDP, length 0
16:17:14.362794 IP 10.12.100.171.58812 > 10.12.19.23.31337: UDP, length 0
16:17:14.365496 IP 10.12.100.171.58812 > 10.12.19.23.1022: UDP, length 0
16:17:14.365514 IP 10.12.100.171.58812 > 10.12.19.23.31335: UDP, length 0
16:17:14.368103 IP 10.12.100.171.58812 > 10.12.19.23.16420: UDP, length 0
16:17:14.368122 IP 10.12.100.171.58812 > 10.12.19.23.45928: UDP, length 0
16:17:14.368124 IP 10.12.100.171.58812 > 10.12.19.23.800: UDP, length 0
16:17:14.368203 IP 10.12.100.171.58812 > 10.12.19.23.20: UDP, length 0
16:17:14.370274 IP 10.12.100.171.58812 > 10.12.19.23.59846: UDP, length 0
16:17:14.372787 IP 10.12.100.171.58812 > 10.12.19.23.21318: UDP, length 0
16:17:14.372806 IP 10.12.100.171.58812 > 10.12.19.23.217: UDP, length 0
16:17:14.413149 IP 10.12.100.171.58813 > 10.12.19.23.31337: UDP, length 0
