11:52:15.046107 ARP, Request who-has 10.12.19.23 (ff:ff:ff:ff:ff:ff) tell 10.12.100.44, length 46
11:52:15.247194 IP 10.12.100.44.44251 > 10.12.19.23.7626: sctp (1) [COOKIE ECHO] 
11:52:15.247251 IP 10.12.100.44.44251 > 10.12.19.23.11999: sctp (1) [COOKIE ECHO] 
11:52:15.247253 IP 10.12.100.44.44251 > 10.12.19.23.5061: sctp (1) [COOKIE ECHO] 
11:52:15.247254 IP 10.12.100.44.44251 > 10.12.19.23.1812: sctp (1) [COOKIE ECHO] 
11:52:15.247256 IP 10.12.100.44.44251 > 10.12.19.23.20: sctp (1) [COOKIE ECHO] 
11:52:15.247257 IP 10.12.100.44.44251 > 10.12.19.23.2945: sctp (1) [COOKIE ECHO] 
11:52:15.247259 IP 10.12.100.44.44251 > 10.12.19.23.2905: sctp (1) [COOKIE ECHO] 
11:52:15.247349 IP 10.12.100.44.44251 > 10.12.19.23.14001: sctp (1) [COOKIE ECHO] 
11:52:15.247352 IP 10.12.100.44.44251 > 10.12.19.23.4740: sctp (1) [COOKIE ECHO] 
11:52:15.247353 IP 10.12.100.44.44251 > 10.12.19.23.7: sctp (1) [COOKIE ECHO] 
11:52:16.298974 IP 10.12.100.44.44252 > 10.12.19.23.7: sctp (1) [COOKIE ECHO] 
11:52:16.298997 IP 10.12.100.44.44252 > 10.12.19.23.4740: sctp (1) [COOKIE ECHO] 
11:52:16.298999 IP 10.12.100.44.44252 > 10.12.19.23.14001: sctp (1) [COOKIE ECHO] 
11:52:16.299082 IP 10.12.100.44.44252 > 10.12.19.23.2905: sctp (1) [COOKIE ECHO] 
11:52:16.299091 IP 10.12.100.44.44252 > 10.12.19.23.2945: sctp (1) [COOKIE ECHO] 
11:52:16.299093 IP 10.12.100.44.44252 > 10.12.19.23.20: sctp (1) [COOKIE ECHO] 
11:52:16.299094 IP 10.12.100.44.44252 > 10.12.19.23.1812: sctp (1) [COOKIE ECHO] 
11:52:16.299096 IP 10.12.100.44.44252 > 10.12.19.23.5061: sctp (1) [COOKIE ECHO] 
11:52:16.299146 IP 10.12.100.44.44252 > 10.12.19.23.11999: sctp (1) [COOKIE ECHO] 
11:52:16.299149 IP 10.12.100.44.44252 > 10.12.19.23.7626: sctp (1) [COOKIE ECHO] 
11:52:16.350083 IP 10.12.100.44.44251 > 10.12.19.23.1813: sctp (1) [COOKIE ECHO] 
11:52:16.350104 IP 10.12.100.44.44251 > 10.12.19.23.20049: sctp (1) [COOKIE ECHO] 
11:52:16.350106 IP 10.12.100.44.44251 > 10.12.19.23.21: sctp (1) [COOKIE ECHO] 
11:52:16.350120 IP 10.12.100.44.44251 > 10.12.19.23.29168: sctp (1) [COOKIE ECHO] 
11:52:16.350122 IP 10.12.100.44.44251 > 10.12.19.23.5091: sctp (1) [COOKIE ECHO] 
11:52:16.350123 IP 10.12.100.44.44251 > 10.12.19.23.5675: sctp (1) [COOKIE ECHO] 
11:52:16.350245 IP 10.12.100.44.44251 > 10.12.19.23.5060: sctp (1) [COOKIE ECHO] 
11:52:16.350249 IP 10.12.100.44.44251 > 10.12.19.23.11998: sctp (1) [COOKIE ECHO] 
11:52:16.350250 IP 10.12.100.44.44251 > 10.12.19.23.9084: sctp (1) [COOKIE ECHO] 
11:52:16.350251 IP 10.12.100.44.44251 > 10.12.19.23.2225: sctp (1) [COOKIE ECHO] 
11:52:16.400306 IP 10.12.100.44.44252 > 10.12.19.23.5060: sctp (1) [COOKIE ECHO] 
11:52:16.400340 IP 10.12.100.44.44252 > 10.12.19.23.5675: sctp (1) [COOKIE ECHO] 
11:52:16.400341 IP 10.12.100.44.44252 > 10.12.19.23.5091: sctp (1) [COOKIE ECHO] 
11:52:16.400343 IP 10.12.100.44.44252 > 10.12.19.23.29168: sctp (1) [COOKIE ECHO] 
11:52:16.400359 IP 10.12.100.44.44252 > 10.12.19.23.21: sctp (1) [COOKIE ECHO] 
11:52:16.400426 IP 10.12.100.44.44252 > 10.12.19.23.20049: sctp (1) [COOKIE ECHO] 
11:52:16.400429 IP 10.12.100.44.44252 > 10.12.19.23.1813: sctp (1) [COOKIE ECHO] 
11:52:16.402755 IP 10.12.100.44.44252 > 10.12.19.23.2225: sctp (1) [COOKIE ECHO] 
11:52:16.402764 IP 10.12.100.44.44252 > 10.12.19.23.9084: sctp (1) [COOKIE ECHO] 
11:52:16.402766 IP 10.12.100.44.44252 > 10.12.19.23.11998: sctp (1) [COOKIE ECHO] 
11:52:16.451033 IP 10.12.100.44.44251 > 10.12.19.23.9899: sctp (1) [COOKIE ECHO] 
11:52:16.451067 IP 10.12.100.44.44251 > 10.12.19.23.9: sctp (1) [COOKIE ECHO] 
11:52:16.451069 IP 10.12.100.44.44251 > 10.12.19.23.3864: sctp (1) [COOKIE ECHO] 
11:52:16.451071 IP 10.12.100.44.44251 > 10.12.19.23.6706: sctp[ForCES LP] (1) [COOKIE ECHO] 
11:52:16.451072 IP 10.12.100.44.44251 > 10.12.19.23.9082: sctp (1) [COOKIE ECHO] 
11:52:16.451155 IP 10.12.100.44.44251 > 10.12.19.23.3863: sctp (1) [COOKIE ECHO] 
11:52:16.451158 IP 10.12.100.44.44251 > 10.12.19.23.22: sctp (1) [COOKIE ECHO] 
11:52:16.453430 IP 10.12.100.44.44251 > 10.12.19.23.9902: sctp (1) [COOKIE ECHO] 
11:52:16.453437 IP 10.12.100.44.44251 > 10.12.19.23.11997: sctp (1) [COOKIE ECHO] 
11:52:16.453438 IP 10.12.100.44.44251 > 10.12.19.23.2944: sctp (1) [COOKIE ECHO] 
11:52:16.501111 IP 10.12.100.44.44252 > 10.12.19.23.9: sctp (1) [COOKIE ECHO] 
11:52:16.501132 IP 10.12.100.44.44252 > 10.12.19.23.9899: sctp (1) [COOKIE ECHO] 
11:52:16.503528 IP 10.12.100.44.44252 > 10.12.19.23.2944: sctp (1) [COOKIE ECHO] 
11:52:16.503535 IP 10.12.100.44.44252 > 10.12.19.23.11997: sctp (1) [COOKIE ECHO] 
11:52:16.503537 IP 10.12.100.44.44252 > 10.12.19.23.9902: sctp (1) [COOKIE ECHO] 
11:52:16.503566 IP 10.12.100.44.44252 > 10.12.19.23.22: sctp (1) [COOKIE ECHO] 
11:52:16.503569 IP 10.12.100.44.44252 > 10.12.19.23.3863: sctp (1) [COOKIE ECHO] 
11:52:16.503570 IP 10.12.100.44.44252 > 10.12.19.23.9082: sctp (1) [COOKIE ECHO] 
11:52:16.503635 IP 10.12.100.44.44252 > 10.12.19.23.6706: sctp[ForCES LP] (1) [COOKIE ECHO] 
11:52:16.503638 IP 10.12.100.44.44252 > 10.12.19.23.3864: sctp (1) [COOKIE ECHO] 
11:52:16.551372 IP 10.12.100.44.44251 > 10.12.19.23.6704: sctp[ForCES HP] (1) [COOKIE ECHO] 
11:52:16.551386 IP 10.12.100.44.44251 > 10.12.19.23.8471: sctp (1) [COOKIE ECHO] 
11:52:16.553850 IP 10.12.100.44.44251 > 10.12.19.23.5672: sctp (1) [COOKIE ECHO] 
11:52:16.553857 IP 10.12.100.44.44251 > 10.12.19.23.9900: sctp (1) [COOKIE ECHO] 
11:52:16.553920 IP 10.12.100.44.44251 > 10.12.19.23.4739: sctp (1) [COOKIE ECHO] 
11:52:16.553924 IP 10.12.100.44.44251 > 10.12.19.23.3868: sctp (1) [COOKIE ECHO] 
11:52:16.553926 IP 10.12.100.44.44251 > 10.12.19.23.1167: sctp (1) [COOKIE ECHO] 
11:52:16.553927 IP 10.12.100.44.44251 > 10.12.19.23.3097: sctp (1) [COOKIE ECHO] 
11:52:16.554011 IP 10.12.100.44.44251 > 10.12.19.23.2904: sctp (1) [COOKIE ECHO] 
11:52:16.554014 IP 10.12.100.44.44251 > 10.12.19.23.443: sctp (1) [COOKIE ECHO] 
11:52:16.601386 IP 10.12.100.44.44252 > 10.12.19.23.6704: sctp[ForCES HP] (1) [COOKIE ECHO] 
11:52:16.603904 IP 10.12.100.44.44252 > 10.12.19.23.5672: sctp (1) [COOKIE ECHO] 
11:52:16.603912 IP 10.12.100.44.44252 > 10.12.19.23.8471: sctp (1) [COOKIE ECHO] 
11:52:16.606326 IP 10.12.100.44.44252 > 10.12.19.23.443: sctp (1) [COOKIE ECHO] 
11:52:16.606333 IP 10.12.100.44.44252 > 10.12.19.23.2904: sctp (1) [COOKIE ECHO] 
11:52:16.606334 IP 10.12.100.44.44252 > 10.12.19.23.3097: sctp (1) [COOKIE ECHO] 
11:52:16.606336 IP 10.12.100.44.44252 > 10.12.19.23.1167: sctp (1) [COOKIE ECHO] 
11:52:16.606377 IP 10.12.100.44.44252 > 10.12.19.23.3868: sctp (1) [COOKIE ECHO] 
11:52:16.606380 IP 10.12.100.44.44252 > 10.12.19.23.4739: sctp (1) [COOKIE ECHO] 
11:52:16.606381 IP 10.12.100.44.44252 > 10.12.19.23.9900: sctp (1) [COOKIE ECHO] 
11:52:16.651544 IP 10.12.100.44.44251 > 10.12.19.23.36422: sctp (1) [COOKIE ECHO] 
11:52:16.654159 IP 10.12.100.44.44251 > 10.12.19.23.3565: sctp (1) [COOKIE ECHO] 
11:52:16.654168 IP 10.12.100.44.44251 > 10.12.19.23.2049: sctp (1) [COOKIE ECHO] 
11:52:16.656727 IP 10.12.100.44.44251 > 10.12.19.23.179: sctp (1) [COOKIE ECHO] 
11:52:16.656734 IP 10.12.100.44.44251 > 10.12.19.23.9901: sctp (1) [COOKIE ECHO] 
11:52:16.656736 IP 10.12.100.44.44251 > 10.12.19.23.6705: sctp[ForCES MP] (1) [COOKIE ECHO] 
11:52:16.656737 IP 10.12.100.44.44251 > 10.12.19.23.36412: sctp (1) [COOKIE ECHO] 
11:52:16.656782 IP 10.12.100.44.44251 > 10.12.19.23.5090: sctp (1) [COOKIE ECHO] 
11:52:16.656785 IP 10.12.100.44.44251 > 10.12.19.23.29169: sctp (1) [COOKIE ECHO] 
11:52:16.656786 IP 10.12.100.44.44251 > 10.12.19.23.80: sctp (1) [COOKIE ECHO] 
11:52:16.701894 IP 10.12.100.44.44252 > 10.12.19.23.36422: sctp (1) [COOKIE ECHO] 
11:52:16.704655 IP 10.12.100.44.44252 > 10.12.19.23.2049: sctp (1) [COOKIE ECHO] 
11:52:16.704662 IP 10.12.100.44.44252 > 10.12.19.23.3565: sctp (1) [COOKIE ECHO] 
11:52:16.706985 IP 10.12.100.44.44252 > 10.12.19.23.80: sctp (1) [COOKIE ECHO] 
11:52:16.707008 IP 10.12.100.44.44252 > 10.12.19.23.29169: sctp (1) [COOKIE ECHO] 
11:52:16.707009 IP 10.12.100.44.44252 > 10.12.19.23.5090: sctp (1) [COOKIE ECHO] 
11:52:16.707011 IP 10.12.100.44.44252 > 10.12.19.23.36412: sctp (1) [COOKIE ECHO] 
11:52:16.707109 IP 10.12.100.44.44252 > 10.12.19.23.6705: sctp[ForCES MP] (1) [COOKIE ECHO] 
11:52:16.707112 IP 10.12.100.44.44252 > 10.12.19.23.9901: sctp (1) [COOKIE ECHO] 
11:52:16.707189 IP 10.12.100.44.44252 > 10.12.19.23.179: sctp (1) [COOKIE ECHO] 
11:52:16.752256 IP 10.12.100.44.44251 > 10.12.19.23.2427: sctp (1) [COOKIE ECHO] 
11:52:16.755236 IP 10.12.100.44.44251 > 10.12.19.23.29118: sctp (1) [COOKIE ECHO] 
11:52:16.803029 IP 10.12.100.44.44252 > 10.12.19.23.2427: sctp (1) [COOKIE ECHO] 
11:52:16.805427 IP 10.12.100.44.44252 > 10.12.19.23.29118: sctp (1) [COOKIE ECHO] 
