21:00:27.724397 ARP, Request who-has 10.12.10.5 (ff:ff:ff:ff:ff:ff) tell 10.12.254.254, length 46
21:00:29.992006 IP 10.12.254.254 > 224.0.0.13: PIMv2, Hello, length 30
21:00:31.727936 ARP, Request who-has 10.12.10.5 (ff:ff:ff:ff:ff:ff) tell 10.12.254.254, length 46
21:00:35.645324 ARP, Request who-has 10.12.19.23 (08:00:27:d1:82:df) tell 10.12.5.11, length 46
21:00:35.645339 ARP, Reply 10.12.19.23 is-at 08:00:27:d1:82:df, length 28
21:00:35.645353 IP 10.12.5.11.49385 > 10.12.19.23.1111: Flags [S], seq 4068998624, win 65535, options [mss 1460,nop,wscale 5,nop,nop,TS val 902210404 ecr 0,sackOK,eol], length 0
21:00:35.754516 IP 10.12.5.11.49386 > 10.12.19.23.2222: Flags [S], seq 1529460068, win 65535, options [mss 1460,nop,wscale 5,nop,nop,TS val 902210511 ecr 0,sackOK,eol], length 0
21:00:35.859339 IP 10.12.5.11.49387 > 10.12.19.23.3333: Flags [S], seq 2039451170, win 65535, options [mss 1460,nop,wscale 5,nop,nop,TS val 902210614 ecr 0,sackOK,eol], length 0
21:00:35.967635 IP 10.12.5.11.49388 > 10.12.19.23.4444: Flags [S], seq 4258602801, win 65535, options [mss 1460,nop,wscale 5,nop,nop,TS val 902210721 ecr 0,sackOK,eol], length 0
21:00:36.132729 IP 10.12.5.11.49389 > 10.12.19.23.1992: Flags [S], seq 3266460645, win 65535, options [mss 1460,nop,wscale 5,nop,nop,TS val 902210884 ecr 0,sackOK,eol], length 0
21:00:36.132765 IP 10.12.19.23.1992 > 10.12.5.11.49389: Flags [S.], seq 256634578, ack 3266460646, win 28960, options [mss 1460,sackOK,TS val 515877766 ecr 902210884,nop,wscale 7], length 0
21:00:36.132912 IP 10.12.5.11.49389 > 10.12.19.23.1992: Flags [.], ack 1, win 4117, options [nop,nop,TS val 902210884 ecr 515877766], length 0
21:00:36.134986 IP 10.12.5.11.49389 > 10.12.19.23.1992: Flags [P.], 
21:00:36.135004 IP 10.12.19.23.1992 > 10.12.5.11.49389: Flags [.], 
21:00:36.162553 IP 10.12.19.23.1992 > 10.12.5.11.49389: Flags [P.], 
21:00:36.162703 IP 10.12.5.11.49389 > 10.12.19.23.1992: Flags [.], 
21:00:36.163292 IP 10.12.19.23.1992 > 10.12.5.11.49389: Flags [P.], 
21:00:36.163460 IP 10.12.5.11.49389 > 10.12.19.23.1992: Flags [.], 
21:00:36.165211 IP 10.12.5.11.49389 > 10.12.19.23.1992: Flags [P.], 
21:00:36.208671 IP 10.12.19.23.1992 > 10.12.5.11.49389: Flags [.], 
21:00:36.208929 IP 10.12.5.11.49389 > 10.12.19.23.1992: Flags [P.], 
21:00:36.208952 IP 10.12.19.23.1992 > 10.12.5.11.49389: Flags [.],
21:00:36.211990 IP 10.12.19.23.1992 > 10.12.5.11.49389: Flags [P.],
21:00:36.212173 IP 10.12.5.11.49389 > 10.12.19.23.1992: Flags [.], 
21:00:36.216494 IP 10.12.5.11.49389 > 10.12.19.23.1992: Flags [P.], 
21:00:36.261753 IP 10.12.19.23.1992 > 10.12.5.11.49389: Flags [.], 
21:00:36.261944 IP 10.12.5.11.49389 > 10.12.19.23.1992: Flags [P.], 
21:00:36.261957 IP 10.12.19.23.1992 > 10.12.5.11.49389: Flags [.],
21:00:36.262098 IP 10.12.19.23.1992 > 10.12.5.11.49389: Flags [P.],
21:00:36.262317 IP 10.12.5.11.49389 > 10.12.19.23.1992: Flags [.], 
21:00:36.262327 IP 10.12.5.11.49389 > 10.12.19.23.1992: Flags [P.], seq 1562:1630, ack 1618, win 4096, options [nop,nop,TS val 90221100
21:00:36.263660 IP 10.12.19.23.1992 > 10.12.5.11.49389: Flags [P.], seq 1618:1662, ack 1630, win 249, options [nop,nop,TS val 515877897
21:00:36.263810 IP 10.12.5.11.49389 > 10.12.19.23.1992: Flags [.], ack 1662, win 4094, options [nop,nop,TS val 902211009 ecr 515877897]
21:00:36.263943 IP 10.12.5.11.49389 > 10.12.19.23.1992: Flags [P.], seq 1630:2002, ack 1662, win 4096, options [nop,nop,TS val 90221100
21:00:36.300783 IP 10.12.19.23.1992 > 10.12.5.11.49389: Flags [P.], seq 1662:1994, ack 2002, win 272, options [nop,nop,TS val 515877934
21:00:36.300971 IP 10.12.5.11.49389 > 10.12.19.23.1992: Flags [.], ack 1994, win 4085, options [nop,nop,TS val 902211046 ecr 515877934]
21:00:36.303797 IP 10.12.5.11.49389 > 10.12.19.23.1992: Flags [P.], seq 2002:2654, ack 1994, win 4096, options [nop,nop,TS val 90221104
21:00:36.305796 IP 10.12.19.23.1992 > 10.12.5.11.49389: Flags [P.], seq 1994:2022, ack 2654, win 294, options [nop,nop,TS val 515877939
21:00:36.305981 IP 10.12.5.11.49389 > 10.12.19.23.1992: Flags [.], ack 2022, win 4095, options [nop,nop,TS val 902211050 ecr 515877939]
21:00:36.306200 IP 10.12.5.11.49389 > 10.12.19.23.1992: Flags [P.], seq 2654:2766, ack 2022, win 4096, options [nop,nop,TS val 90221105
21:00:36.349333 IP 10.12.19.23.1992 > 10.12.5.11.49389: Flags [.], ack 2766, win 294, options [nop,nop,TS val 515877983 ecr 902211050],
21:00:37.107013 IP 10.12.19.23.1992 > 10.12.5.11.49389: Flags [P.], seq 2022:2522, ack 2766, win 294, options [nop,nop,TS val 515878740
21:00:37.107229 IP 10.12.5.11.49389 > 10.12.19.23.1992: Flags [.], ack 2522, win 4080, options [nop,nop,TS val 902211848 ecr 515878740]
21:00:37.107256 IP 10.12.19.23.1992 > 10.12.5.11.49389: Flags [P.], seq 2522:2566, ack 2766, win 294, options [nop,nop,TS val 515878741
21:00:37.107394 IP 10.12.5.11.49389 > 10.12.19.23.1992: Flags [.], ack 2566, win 4094, options [nop,nop,TS val 902211848 ecr 515878741]
21:00:37.107601 IP 10.12.5.11.49389 > 10.12.19.23.1992: Flags [P.], seq 2766:3286, ack 2566, win 4096, options [nop,nop,TS val 90221184
21:00:37.107624 IP 10.12.19.23.1992 > 10.12.5.11.49389: Flags [.], ack 3286, win 316, options [nop,nop,TS val 515878741 ecr 902211848],
21:00:37.108413 IP 10.12.19.23.1992 > 10.12.5.11.49389: Flags [P.], seq 2566:2674, ack 3286, win 316, options [nop,nop,TS val 515878742
21:00:37.108617 IP 10.12.5.11.49389 > 10.12.19.23.1992: Flags [.], ack 2674, win 4092, options [nop,nop,TS val 902211849 ecr 515878742]
21:00:37.108795 IP 10.12.19.23.1992 > 10.12.5.11.49389: Flags [P.], seq 2674:2774, ack 3286, win 316, options [nop,nop,TS val 515878742
21:00:37.108859 IP 10.12.19.23.1992 > 10.12.5.11.49389: Flags [P.], seq 2774:2810, ack 3286, win 316, options [nop,nop,TS val 515878742
21:00:37.108965 IP 10.12.5.11.49389 > 10.12.19.23.1992: Flags [.], ack 2774, win 4092, options [nop,nop,TS val 902211849 ecr 515878742]
21:00:37.108972 IP 10.12.5.11.49389 > 10.12.19.23.1992: Flags [.], ack 2810, win 4094, options [nop,nop,TS val 902211849 ecr 515878742]
21:00:37.109046 IP 10.12.19.23.1992 > 10.12.5.11.49389: Flags [P.], seq 2810:2846, ack 3286, win 316, options [nop,nop,TS val 515878742
21:00:37.109153 IP 10.12.19.23.1992 > 10.12.5.11.49389: Flags [P.], seq 2846:2922, ack 3286, win 316, options [nop,nop,TS val 515878742
21:00:37.109175 IP 10.12.5.11.49389 > 10.12.19.23.1992: Flags [.], ack 2846, win 4094, options [nop,nop,TS val 902211849 ecr 515878742]
21:00:37.109223 IP 10.12.19.23.1992 > 10.12.5.11.49389: Flags [P.], seq 2922:2958, ack 3286, win 316, options [nop,nop,TS val 515878743
21:00:37.109243 IP 10.12.5.11.49389 > 10.12.19.23.1992: Flags [.], ack 2922, win 4093, options [nop,nop,TS val 902211849 ecr 515878742]
21:00:37.109304 IP 10.12.19.23.1992 > 10.12.5.11.49389: Flags [P.], seq 2958:3042, ack 3286, win 316, options [nop,nop,TS val 515878743
21:00:37.109348 IP 10.12.5.11.49389 > 10.12.19.23.1992: Flags [.], ack 2958, win 4094, options [nop,nop,TS val 902211849 ecr 515878743]
21:00:37.109403 IP 10.12.19.23.1992 > 10.12.5.11.49389: Flags [P.], seq 3042:3078, ack 3286, win 316, options [nop,nop,TS val 515878743
21:00:37.109437 IP 10.12.5.11.49389 > 10.12.19.23.1992: Flags [.], ack 3042, win 4093, options [nop,nop,TS val 902211849 ecr 515878743]
21:00:37.109530 IP 10.12.5.11.49389 > 10.12.19.23.1992: Flags [.], ack 3078, win 4094, options [nop,nop,TS val 902211849 ecr 515878743]
21:00:37.109607 IP 10.12.19.23.1992 > 10.12.5.11.49389: Flags [P.], seq 3078:3162, ack 3286, win 316, options [nop,nop,TS val 515878743
21:00:37.109683 IP 10.12.19.23.1992 > 10.12.5.11.49389: Flags [P.], seq 3162:3198, ack 3286, win 316, options [nop,nop,TS val 515878743
21:00:37.109773 IP 10.12.5.11.49389 > 10.12.19.23.1992: Flags [.], ack 3162, win 4093, options [nop,nop,TS val 902211850 ecr 515878743]
21:00:37.109795 IP 10.12.5.11.49389 > 10.12.19.23.1992: Flags [.], ack 3198, win 4094, options [nop,nop,TS val 902211850 ecr 515878743]
21:00:37.109860 IP 10.12.19.23.1992 > 10.12.5.11.49389: Flags [P.], seq 3198:3234, ack 3286, win 316, options [nop,nop,TS val 515878743 ecr 902211850], length 36
21:00:37.109962 IP 10.12.19.23.1992 > 10.12.5.11.49389: Flags [P.], seq 3234:3326, ack 3286, win 316, options [nop,nop,TS val 515878743 ecr 902211850], length 92
21:00:37.109998 IP 10.12.5.11.49389 > 10.12.19.23.1992: Flags [.], ack 3234, win 4094, options [nop,nop,TS val 902211850 ecr 515878743], length 0
21:00:37.110073 IP 10.12.19.23.1992 > 10.12.5.11.49389: Flags [P.], seq 3326:3362, ack 3286, win 316, options [nop,nop,TS val 515878743 ecr 902211850], length 36
21:00:37.110094 IP 10.12.5.11.49389 > 10.12.19.23.1992: Flags [.], ack 3326, win 4093, options [nop,nop,TS val 902211850 ecr 515878743], length 0
21:00:37.110182 IP 10.12.5.11.49389 > 10.12.19.23.1992: Flags [.], ack 3362, win 4094, options [nop,nop,TS val 902211850 ecr 515878743], length 0
21:00:37.110250 IP 10.12.19.23.1992 > 10.12.5.11.49389: Flags [P.], seq 3362:3398, ack 3286, win 316, options [nop,nop,TS val 515878744 ecr 902211850], length 36
21:00:37.110316 IP 10.12.19.23.1992 > 10.12.5.11.49389: Flags [P.], seq 3398:3498, ack 3286, win 316, options [nop,nop,TS val 515878744 ecr 902211850], length 100
21:00:37.110360 IP 10.12.5.11.49389 > 10.12.19.23.1992: Flags [.], ack 3398, win 4094, options [nop,nop,TS val 902211850 ecr 515878744], length 0
21:00:37.110435 IP 10.12.5.11.49389 > 10.12.19.23.1992: Flags [.], ack 3498, win 4092, options [nop,nop,TS val 902211850 ecr 515878744], length 0
21:00:37.110504 IP 10.12.19.23.1992 > 10.12.5.11.49389: Flags [P.], seq 3498:3534, ack 3286, win 316, options [nop,nop,TS val 515878744 ecr 902211850], length 36
21:00:37.110608 IP 10.12.5.11.49389 > 10.12.19.23.1992: Flags [.], ack 3534, win 4094, options [nop,nop,TS val 902211850 ecr 515878744], length 0
21:00:37.110653 IP 10.12.19.23.1992 > 10.12.5.11.49389: Flags [P.], seq 3534:3634, ack 3286, win 316, options [nop,nop,TS val 515878744 ecr 902211850], length 100
21:00:37.110733 IP 10.12.19.23.1992 > 10.12.5.11.49389: Flags [P.], seq 3634:3670, ack 3286, win 316, options [nop,nop,TS val 515878744 ecr 902211850], length 36
21:00:37.110807 IP 10.12.5.11.49389 > 10.12.19.23.1992: Flags [.], ack 3634, win 4092, options [nop,nop,TS val 902211851 ecr 515878744], length 0
21:00:37.110812 IP 10.12.5.11.49389 > 10.12.19.23.1992: Flags [.], ack 3670, win 4094, options [nop,nop,TS val 902211851 ecr 515878744], length 0
21:00:37.110854 IP 10.12.19.23.1992 > 10.12.5.11.49389: Flags [P.], seq 3670:3778, ack 3286, win 316, options [nop,nop,TS val 515878744 ecr 902211851], length 108
21:00:37.110911 IP 10.12.19.23.1992 > 10.12.5.11.49389: Flags [P.], seq 3778:3814, ack 3286, win 316, options [nop,nop,TS val 515878744 ecr 902211851], length 36
21:00:37.111007 IP 10.12.5.11.49389 > 10.12.19.23.1992: Flags [.], ack 3778, win 4092, options [nop,nop,TS val 902211851 ecr 515878744], length 0
21:00:37.111012 IP 10.12.5.11.49389 > 10.12.19.23.1992: Flags [.], ack 3814, win 4094, options [nop,nop,TS val 902211851 ecr 515878744], length 0
21:00:37.111052 IP 10.12.19.23.1992 > 10.12.5.11.49389: Flags [P.], seq 3814:3874, ack 3286, win 316, options [nop,nop,TS val 515878744 ecr 902211851], length 60
21:00:37.111137 IP 10.12.19.23.1992 > 10.12.5.11.49389: Flags [P.], seq 3874:3910, ack 3286, win 316, options [nop,nop,TS val 515878744 ecr 902211851], length 36
21:00:37.111220 IP 10.12.5.11.49389 > 10.12.19.23.1992: Flags [.], ack 3874, win 4094, options [nop,nop,TS val 902211851 ecr 515878744], length 0
21:00:37.111241 IP 10.12.5.11.49389 > 10.12.19.23.1992: Flags [.], ack 3910, win 4094, options [nop,nop,TS val 902211851 ecr 515878744], length 0
21:00:37.111348 IP 10.12.19.23.1992 > 10.12.5.11.49389: Flags [P.], seq 3910:3946, ack 3286, win 316, options [nop,nop,TS val 515878745 ecr 902211851], length 36
21:00:37.111464 IP 10.12.19.23.1992 > 10.12.5.11.49389: Flags [P.], seq 3946:4054, ack 3286, win 316, options [nop,nop,TS val 515878745 ecr 902211851], length 108
21:00:37.111500 IP 10.12.5.11.49389 > 10.12.19.23.1992: Flags [.], ack 3946, win 4094, options [nop,nop,TS val 902211851 ecr 515878745], length 0
21:00:37.111573 IP 10.12.19.23.1992 > 10.12.5.11.49389: Flags [P.], seq 4054:4090, ack 3286, win 316, options [nop,nop,TS val 515878745 ecr 902211851], length 36
21:00:37.111594 IP 10.12.5.11.49389 > 10.12.19.23.1992: Flags [.], ack 4054, win 4092, options [nop,nop,TS val 902211851 ecr 515878745], length 0
21:00:37.111668 IP 10.12.5.11.49389 > 10.12.19.23.1992: Flags [.], ack 4090, win 4094, options [nop,nop,TS val 902211851 ecr 515878745], length 0
21:00:37.111696 IP 10.12.19.23.1992 > 10.12.5.11.49389: Flags [P.], seq 4090:4126, ack 3286, win 316, options [nop,nop,TS val 515878745 ecr 902211851], length 36
21:00:37.111776 IP 10.12.19.23.1992 > 10.12.5.11.49389: Flags [P.], seq 4126:4194, ack 3286, win 316, options [nop,nop,TS val 515878745 ecr 902211851], length 68
21:00:37.111809 IP 10.12.5.11.49389 > 10.12.19.23.1992: Flags [.], ack 4126, win 4094, options [nop,nop,TS val 902211852 ecr 515878745], length 0
21:00:37.111901 IP 10.12.5.11.49389 > 10.12.19.23.1992: Flags [.], ack 4194, win 4093, options [nop,nop,TS val 902211852 ecr 515878745], length 0
21:00:37.111945 IP 10.12.19.23.1992 > 10.12.5.11.49389: Flags [P.], seq 4194:4230, ack 3286, win 316, options [nop,nop,TS val 515878745 ecr 902211852], length 36
21:00:37.112068 IP 10.12.5.11.49389 > 10.12.19.23.1992: Flags [.], ack 4230, win 4094, options [nop,nop,TS val 902211852 ecr 515878745], length 0
21:00:37.112125 IP 10.12.19.23.1992 > 10.12.5.11.49389: Flags [P.], seq 4230:4266, ack 3286, win 316, options [nop,nop,TS val 515878745 ecr 902211852], length 36
21:00:37.112209 IP 10.12.19.23.1992 > 10.12.5.11.49389: Flags [P.], seq 4266:4326, ack 3286, win 316, options [nop,nop,TS val 515878745 ecr 902211852], length 60
21:00:37.112244 IP 10.12.5.11.49389 > 10.12.19.23.1992: Flags [.], ack 4266, win 4094, options [nop,nop,TS val 902211852 ecr 515878745], length 0
21:00:37.112349 IP 10.12.5.11.49389 > 10.12.19.23.1992: Flags [.], ack 4326, win 4094, options [nop,nop,TS val 902211852 ecr 515878745], length 0
21:00:37.112433 IP 10.12.19.23.1992 > 10.12.5.11.49389: Flags [P.], seq 4326:4362, ack 3286, win 316, options [nop,nop,TS val 515878746 ecr 902211852], length 36
21:00:37.112600 IP 10.12.5.11.49389 > 10.12.19.23.1992: Flags [.], ack 4362, win 4094, options [nop,nop,TS val 902211852 ecr 515878746], length 0
21:00:37.112767 IP 10.12.19.23.1992 > 10.12.5.11.49389: Flags [P.], seq 4362:4430, ack 3286, win 316, options [nop,nop,TS val 515878746 ecr 902211852], length 68
21:00:37.112814 IP 10.12.19.23.1992 > 10.12.5.11.49389: Flags [P.], seq 4430:4466, ack 3286, win 316, options [nop,nop,TS val 515878746 ecr 902211852], length 36
21:00:37.112908 IP 10.12.5.11.49389 > 10.12.19.23.1992: Flags [.], ack 4430, win 4093, options [nop,nop,TS val 902211853 ecr 515878746], length 0
21:00:37.112915 IP 10.12.5.11.49389 > 10.12.19.23.1992: Flags [.], ack 4466, win 4094, options [nop,nop,TS val 902211853 ecr 515878746], length 0
21:00:37.112977 IP 10.12.19.23.1992 > 10.12.5.11.49389: Flags [P.], seq 4466:4502, ack 3286, win 316, options [nop,nop,TS val 515878746 ecr 902211853], length 36
21:00:37.113036 IP 10.12.19.23.1992 > 10.12.5.11.49389: Flags [P.], seq 4502:4538, ack 3286, win 316, options [nop,nop,TS val 515878746 ecr 902211853], length 36
21:00:37.113067 IP 10.12.5.11.49389 > 10.12.19.23.1992: Flags [.], ack 4502, win 4094, options [nop,nop,TS val 902211853 ecr 515878746], length 0
21:00:37.113123 IP 10.12.5.11.49389 > 10.12.19.23.1992: Flags [.], ack 4538, win 4094, options [nop,nop,TS val 902211853 ecr 515878746], length 0
21:00:37.114815 IP 10.12.19.23.1992 > 10.12.5.11.49389: Flags [P.], seq 4538:4638, ack 3286, win 316, options [nop,nop,TS val 515878748 ecr 902211853], length 100
21:00:37.114975 IP 10.12.5.11.49389 > 10.12.19.23.1992: Flags [.], ack 4638, win 4092, options [nop,nop,TS val 902211855 ecr 515878748], length 0
21:00:37.155201 IP 10.12.19.23.1992 > 10.12.5.11.49389: Flags [P.], seq 4638:4738, ack 3286, win 316, options [nop,nop,TS val 515878788 ecr 902211855], length 100
21:00:37.155400 IP 10.12.5.11.49389 > 10.12.19.23.1992: Flags [.], ack 4738, win 4092, options [nop,nop,TS val 902211895 ecr 515878788], length 0
21:00:38.925219 IP 10.12.10.3 > 10.12.255.255: ICMP echo request, id 211, seq 0, length 64
21:00:39.731885 ARP, Request who-has 10.12.10.5 (ff:ff:ff:ff:ff:ff) tell 10.12.254.254, length 46
21:00:40.229890 IP 10.12.1.3.5353 > 224.0.0.251.5353: 0 [1a] [4q] PTR (QM)? _afpovertcp._tcp.local. PTR (QM)? _smb._tcp.local. PTR (QM)? _rfb._tcp.local. PTR (QM)? _adisk._tcp.local. (97)
21:00:40.229919 IP6 fe80::c33:1b5b:17bd:481e.5353 > ff02::fb.5353: 0 [1a] [4q] PTR (QM)? _afpovertcp._tcp.local. PTR (QM)? _smb._tcp.local. PTR (QM)? _rfb._tcp.local. PTR (QM)? _adisk._tcp.local. (97)
21:00:41.095325 IP 10.12.5.11.49389 > 10.12.19.23.1992: Flags [P.], seq 3286:3322, ack 4738, win 4096, options [nop,nop,TS val 902215820 ecr 515878788], length 36
21:00:41.095491 IP 10.12.19.23.1992 > 10.12.5.11.49389: Flags [P.], seq 4738:4774, ack 3322, win 316, options [nop,nop,TS val 515882729 ecr 902215820], length 36
21:00:41.095700 IP 10.12.5.11.49389 > 10.12.19.23.1992: Flags [.], ack 4774, win 4094, options [nop,nop,TS val 902215820 ecr 515882729], length 0
21:00:41.158976 IP 10.12.5.11.49389 > 10.12.19.23.1992: Flags [P.], seq 3322:3358, ack 4774, win 4096, options [nop,nop,TS val 902215883 ecr 515882729], length 36
21:00:41.159147 IP 10.12.19.23.1992 > 10.12.5.11.49389: Flags [P.], seq 4774:4810, ack 3358, win 316, options [nop,nop,TS val 515882792 ecr 902215883], length 36
21:00:41.159327 IP 10.12.5.11.49389 > 10.12.19.23.1992: Flags [.], ack 4810, win 4094, options [nop,nop,TS val 902215883 ecr 515882792], length 0
21:00:42.101725 IP 10.12.5.11.49389 > 10.12.19.23.1992: Flags [P.], seq 3358:3394, ack 4810, win 4096, options [nop,nop,TS val 902216824 ecr 515882792], length 36
21:00:42.101863 IP 10.12.19.23.1992 > 10.12.5.11.49389: Flags [P.], seq 4810:4846, ack 3394, win 316, options [nop,nop,TS val 515883735 ecr 902216824], length 36
21:00:42.102016 IP 10.12.5.11.49389 > 10.12.19.23.1992: Flags [.], ack 4846, win 4094, options [nop,nop,TS val 902216824 ecr 515883735], length 0
21:00:42.103363 IP 10.12.19.23.1992 > 10.12.5.11.49389: Flags [P.], seq 4846:4946, ack 3394, win 316, options [nop,nop,TS val 515883737 ecr 902216824], length 100
21:00:42.103553 IP 10.12.5.11.49389 > 10.12.19.23.1992: Flags [.], ack 4946, win 4092, options [nop,nop,TS val 902216825 ecr 515883737], length 0
21:00:43.039895 IP 10.12.3.9.57621 > 10.12.255.255.57621: UDP, length 44
21:00:48.383322 IP 10.12.5.11.49389 > 10.12.19.23.1992: Flags [P.], seq 3394:3430, ack 4946, win 4096, options [nop,nop,TS val 902223096 ecr 515883737], length 36
21:00:48.383509 IP 10.12.19.23.1992 > 10.12.5.11.49389: Flags [P.], seq 4946:4982, ack 3430, win 316, options [nop,nop,TS val 515890017 ecr 902223096], length 36
21:00:48.383685 IP 10.12.5.11.49389 > 10.12.19.23.1992: Flags [.], ack 4982, win 4094, options [nop,nop,TS val 902223096 ecr 515890017], length 0
21:00:48.446968 IP 10.12.5.11.49389 > 10.12.19.23.1992: Flags [P.], seq 3430:3466, ack 4982, win 4096, options [nop,nop,TS val 902223158 ecr 515890017], length 36
21:00:48.447122 IP 10.12.19.23.1992 > 10.12.5.11.49389: Flags [P.], seq 4982:5018, ack 3466, win 316, options [nop,nop,TS val 515890080 ecr 902223158], length 36
21:00:48.447279 IP 10.12.5.11.49389 > 10.12.19.23.1992: Flags [.], ack 5018, win 4094, options [nop,nop,TS val 902223158 ecr 515890080], length 0
21:00:48.678829 IP 10.12.5.11.49389 > 10.12.19.23.1992: Flags [P.], seq 3466:3502, ack 5018, win 4096, options [nop,nop,TS val 902223388 ecr 515890080], length 36
21:00:48.678986 IP 10.12.19.23.1992 > 10.12.5.11.49389: Flags [P.], seq 5018:5054, ack 3502, win 316, options [nop,nop,TS val 515890312 ecr 902223388], length 36
21:00:48.679139 IP 10.12.5.11.49389 > 10.12.19.23.1992: Flags [.], ack 5054, win 4094, options [nop,nop,TS val 902223388 ecr 515890312], length 0
21:00:48.823386 IP 10.12.5.11.49389 > 10.12.19.23.1992: Flags [P.], seq 3502:3538, ack 5054, win 4096, options [nop,nop,TS val 902223531 ecr 515890312], length 36
21:00:48.823533 IP 10.12.19.23.1992 > 10.12.5.11.49389: Flags [P.], seq 5054:5090, ack 3538, win 316, options [nop,nop,TS val 515890457 ecr 902223531], length 36
21:00:48.823734 IP 10.12.5.11.49389 > 10.12.19.23.1992: Flags [.], ack 5090, win 4094, options [nop,nop,TS val 902223531 ecr 515890457], length 0
21:00:49.813891 IP 10.12.5.11.49389 > 10.12.19.23.1992: Flags [P.], seq 3538:3574, ack 5090, win 4096, options [nop,nop,TS val 902224520 ecr 515890457], length 36
21:00:49.814156 IP 10.12.19.23.1992 > 10.12.5.11.49389: Flags [P.], seq 5090:5190, ack 3574, win 316, options [nop,nop,TS val 515891447 ecr 902224520], length 100
21:00:49.814325 IP 10.12.5.11.49389 > 10.12.19.23.1992: Flags [.], ack 5190, win 4092, options [nop,nop,TS val 902224520 ecr 515891447], length 0
21:00:51.998845 IP 10.12.5.11.49389 > 10.12.19.23.1992: Flags [P.], seq 3574:3610, ack 5190, win 4096, options [nop,nop,TS val 902226702 ecr 515891447], length 36
21:00:51.999000 IP 10.12.19.23.1992 > 10.12.5.11.49389: Flags [P.], seq 5190:5226, ack 3610, win 316, options [nop,nop,TS val 515893632 ecr 902226702], length 36
21:00:51.999185 IP 10.12.5.11.49389 > 10.12.19.23.1992: Flags [.], ack 5226, win 4094, options [nop,nop,TS val 902226702 ecr 515893632], length 0
21:00:52.191270 IP 10.12.5.11.49389 > 10.12.19.23.1992: Flags [P.], seq 3610:3646, ack 5226, win 4096, options [nop,nop,TS val 902226893 ecr 515893632], length 36
21:00:52.191429 IP 10.12.19.23.1992 > 10.12.5.11.49389: Flags [P.], seq 5226:5262, ack 3646, win 316, options [nop,nop,TS val 515893824 ecr 902226893], length 36
21:00:52.191664 IP 10.12.5.11.49389 > 10.12.19.23.1992: Flags [.], ack 5262, win 4094, options [nop,nop,TS val 902226893 ecr 515893824], length 0
21:00:52.479343 IP 10.12.5.11.49389 > 10.12.19.23.1992: Flags [P.], seq 3646:3682, ack 5262, win 4096, options [nop,nop,TS val 902227180 ecr 515893824], length 36
21:00:52.479504 IP 10.12.19.23.1992 > 10.12.5.11.49389: Flags [P.], seq 5262:5298, ack 3682, win 316, options [nop,nop,TS val 515894112 ecr 902227180], length 36
21:00:52.479680 IP 10.12.5.11.49389 > 10.12.19.23.1992: Flags [.], ack 5298, win 4094, options [nop,nop,TS val 902227180 ecr 515894112], length 0
21:00:52.639020 IP 10.12.5.11.49389 > 10.12.19.23.1992: Flags [P.], seq 3682:3718, ack 5298, win 4096, options [nop,nop,TS val 902227339 ecr 515894112], length 36
21:00:52.639185 IP 10.12.19.23.1992 > 10.12.5.11.49389: Flags [P.], seq 5298:5334, ack 3718, win 316, options [nop,nop,TS val 515894272 ecr 902227339], length 36
21:00:52.639342 IP 10.12.5.11.49389 > 10.12.19.23.1992: Flags [.], ack 5334, win 4094, options [nop,nop,TS val 902227339 ecr 515894272], length 0
21:00:53.663467 IP 10.12.5.11.49389 > 10.12.19.23.1992: Flags [P.], seq 3718:3754, ack 5334, win 4096, options [nop,nop,TS val 902228360 ecr 515894272], length 36
21:00:53.663630 IP 10.12.19.23.1992 > 10.12.5.11.49389: Flags [P.], seq 5334:5378, ack 3754, win 316, options [nop,nop,TS val 515895297 ecr 902228360], length 44
21:00:53.663825 IP 10.12.5.11.49389 > 10.12.19.23.1992: Flags [.], ack 5378, win 4094, options [nop,nop,TS val 902228360 ecr 515895297], length 0
21:00:53.823422 IP 10.12.5.11.49389 > 10.12.19.23.1992: Flags [P.], seq 3754:3790, ack 5378, win 4096, options [nop,nop,TS val 902228519 ecr 515895297], length 36
21:00:53.823592 IP 10.12.19.23.1992 > 10.12.5.11.49389: Flags [P.], seq 5378:5422, ack 3790, win 316, options [nop,nop,TS val 515895457 ecr 902228519], length 44
21:00:53.823772 IP 10.12.5.11.49389 > 10.12.19.23.1992: Flags [.], ack 5422, win 4094, options [nop,nop,TS val 902228519 ecr 515895457], length 0
21:00:53.983092 IP 10.12.5.11.49389 > 10.12.19.23.1992: Flags [P.], seq 3790:3826, ack 5422, win 4096, options [nop,nop,TS val 902228678 ecr 515895457], length 36
21:00:53.983251 IP 10.12.19.23.1992 > 10.12.5.11.49389: Flags [P.], seq 5422:5466, ack 3826, win 316, options [nop,nop,TS val 515895616 ecr 902228678], length 44
21:00:53.983448 IP 10.12.5.11.49389 > 10.12.19.23.1992: Flags [.], ack 5466, win 4094, options [nop,nop,TS val 902228678 ecr 515895616], length 0
21:00:54.143302 IP 10.12.5.11.49389 > 10.12.19.23.1992: Flags [P.], seq 3826:3862, ack 5466, win 4096, options [nop,nop,TS val 902228837 ecr 515895616], length 36
21:00:54.143465 IP 10.12.19.23.1992 > 10.12.5.11.49389: Flags [P.], seq 5466:5510, ack 3862, win 316, options [nop,nop,TS val 515895776 ecr 902228837], length 44
21:00:54.143671 IP 10.12.5.11.49389 > 10.12.19.23.1992: Flags [.], ack 5510, win 4094, options [nop,nop,TS val 902228837 ecr 515895776], length 0
21:00:54.303497 IP 10.12.5.11.49389 > 10.12.19.23.1992: Flags [P.], seq 3862:3898, ack 5510, win 4096, options [nop,nop,TS val 902228994 ecr 515895776], length 36
21:00:54.303662 IP 10.12.19.23.1992 > 10.12.5.11.49389: Flags [P.], seq 5510:5546, ack 3898, win 316, options [nop,nop,TS val 515895937 ecr 902228994], length 36
21:00:54.303825 IP 10.12.5.11.49389 > 10.12.19.23.1992: Flags [.], ack 5546, win 4094, options [nop,nop,TS val 902228994 ecr 515895937], length 0
21:00:54.371041 IP 10.12.2.15.57621 > 10.12.255.255.57621: UDP, length 44
21:00:54.637616 IP 10.12.5.11.49389 > 10.12.19.23.1992: Flags [P.], seq 3898:3934, ack 5546, win 4096, options [nop,nop,TS val 902229326 ecr 515895937], length 36
21:00:54.637819 IP 10.12.19.23.1992 > 10.12.5.11.49389: Flags [P.], seq 5546:5582, ack 3934, win 316, options [nop,nop,TS val 515896271 ecr 902229326], length 36
21:00:54.637962 IP 10.12.5.11.49389 > 10.12.19.23.1992: Flags [.], ack 5582, win 4094, options [nop,nop,TS val 902229326 ecr 515896271], length 0
21:00:54.958051 IP 10.12.10.14.5353 > 224.0.0.251.5353: 0*- [0q] 3/0/0 PTR e2r10p14._ssh._tcp.local., PTR e2r10p14._sftp-ssh._tcp.local., PTR e2r10p14 [78:7b:8a:c4:e4:43]._workstation._tcp.local. (139)
21:00:54.958067 IP6 fe80::ca2:f646:96cc:3c19.5353 > ff02::fb.5353: 0*- [0q] 3/0/0 PTR e2r10p14._ssh._tcp.local., PTR e2r10p14._sftp-ssh._tcp.local., PTR e2r10p14 [78:7b:8a:c4:e4:43]._workstation._tcp.local. (139)
21:00:54.959293 IP 10.12.10.14.5353 > 224.0.0.251.5353: 0*- [0q] 3/0/0 PTR e2r10p14._ssh._tcp.local., PTR e2r10p14._sftp-ssh._tcp.local., PTR e2r10p14 [78:7b:8a:c4:e4:43]._workstation._tcp.local. (139)
21:00:54.959299 IP6 fe80::ca2:f646:96cc:3c19.5353 > ff02::fb.5353: 0*- [0q] 3/0/0 PTR e2r10p14._ssh._tcp.local., PTR e2r10p14._sftp-ssh._tcp.local., PTR e2r10p14 [78:7b:8a:c4:e4:43]._workstation._tcp.local. (139)
21:00:55.886604 IP 10.12.5.11.49389 > 10.12.19.23.1992: Flags [P.], seq 3934:3978, ack 5582, win 4096, options [nop,nop,TS val 902230572 ecr 515896271], length 44
21:00:55.886765 IP 10.12.19.23.1992 > 10.12.5.11.49389: Flags [P.], seq 5582:5626, ack 3978, win 316, options [nop,nop,TS val 515897520 ecr 902230572], length 44
21:00:55.886997 IP 10.12.5.11.49389 > 10.12.19.23.1992: Flags [.], ack 5626, win 4094, options [nop,nop,TS val 902230572 ecr 515897520], length 0
21:00:56.021892 IP 10.12.5.11.49389 > 10.12.19.23.1992: Flags [P.], seq 3978:4022, ack 5626, win 4096, options [nop,nop,TS val 902230707 ecr 515897520], length 44
21:00:56.022115 IP 10.12.19.23.1992 > 10.12.5.11.49389: Flags [P.], seq 5626:5670, ack 4022, win 316, options [nop,nop,TS val 515897655 ecr 902230707], length 44
21:00:56.022285 IP 10.12.5.11.49389 > 10.12.19.23.1992: Flags [.], ack 5670, win 4094, options [nop,nop,TS val 902230707 ecr 515897655], length 0
21:00:56.198072 IP 10.12.5.11.49389 > 10.12.19.23.1992: Flags [P.], seq 4022:4066, ack 5670, win 4096, options [nop,nop,TS val 902230882 ecr 515897655], length 44
21:00:56.198290 IP 10.12.19.23.1992 > 10.12.5.11.49389: Flags [P.], seq 5670:5714, ack 4066, win 316, options [nop,nop,TS val 515897831 ecr 902230882], length 44
21:00:56.198511 IP 10.12.5.11.49389 > 10.12.19.23.1992: Flags [.], ack 5714, win 4094, options [nop,nop,TS val 902230882 ecr 515897831], length 0
21:00:56.494009 IP 10.12.5.11.49389 > 10.12.19.23.1992: Flags [P.], seq 4066:4110, ack 5714, win 4096, options [nop,nop,TS val 902231176 ecr 515897831], length 44
21:00:56.536587 IP 10.12.19.23.1992 > 10.12.5.11.49389: Flags [.], ack 4110, win 316, options [nop,nop,TS val 515898169 ecr 902231176], length 0
21:00:56.790208 IP 10.12.5.11.49389 > 10.12.19.23.1992: Flags [P.], seq 4110:4154, ack 5714, win 4096, options [nop,nop,TS val 902231470 ecr 515898169], length 44
21:00:56.790244 IP 10.12.19.23.1992 > 10.12.5.11.49389: Flags [.], ack 4154, win 316, options [nop,nop,TS val 515898423 ecr 902231470], length 0
21:00:56.932982 IP 10.12.2.14.57621 > 10.12.255.255.57621: UDP, length 44
21:00:57.152780 IP 10.12.254.254 > 224.0.0.13: PIMv2, Hello, length 30
21:00:57.750004 IP 10.12.5.11.49389 > 10.12.19.23.1992: Flags [P.], seq 4154:4190, ack 5714, win 4096, options [nop,nop,TS val 902232427 ecr 515898423], length 36
21:00:57.750030 IP 10.12.19.23.1992 > 10.12.5.11.49389: Flags [.], ack 4190, win 316, options [nop,nop,TS val 515899383 ecr 902232427], length 0
21:00:57.752197 IP 10.12.19.23.1992 > 10.12.5.11.49389: Flags [P.], seq 5714:5766, ack 4190, win 316, options [nop,nop,TS val 515899385 ecr 902232427], length 52
21:00:57.752416 IP 10.12.5.11.49389 > 10.12.19.23.1992: Flags [.], ack 5766, win 4094, options [nop,nop,TS val 902232429 ecr 515899385], length 0
21:00:58.806024 IP 10.12.5.11.49389 > 10.12.19.23.1992: Flags [P.], seq 4190:4226, ack 5766, win 4096, options [nop,nop,TS val 902233475 ecr 515899385], length 36
21:00:58.806152 IP 10.12.19.23.1992 > 10.12.5.11.49389: Flags [P.], seq 5766:5802, ack 4226, win 316, options [nop,nop,TS val 515900439 ecr 902233475], length 36
21:00:58.806342 IP 10.12.5.11.49389 > 10.12.19.23.1992: Flags [.], ack 5802, win 4094, options [nop,nop,TS val 902233475 ecr 515900439], length 0
21:00:59.046114 IP 10.12.5.11.49389 > 10.12.19.23.1992: Flags [P.], seq 4226:4262, ack 5802, win 4096, options [nop,nop,TS val 902233714 ecr 515900439], length 36
21:00:59.046236 IP 10.12.19.23.1992 > 10.12.5.11.49389: Flags [P.], seq 5802:5838, ack 4262, win 316, options [nop,nop,TS val 515900679 ecr 902233714], length 36
21:00:59.046454 IP 10.12.5.11.49389 > 10.12.19.23.1992: Flags [.], ack 5838, win 4094, options [nop,nop,TS val 902233714 ecr 515900679], length 0
21:00:59.230064 IP 10.12.5.11.49389 > 10.12.19.23.1992: Flags [P.], seq 4262:4298, ack 5838, win 4096, options [nop,nop,TS val 902233896 ecr 515900679], length 36
21:00:59.230181 IP 10.12.19.23.1992 > 10.12.5.11.49389: Flags [P.], seq 5838:5874, ack 4298, win 316, options [nop,nop,TS val 515900863 ecr 902233896], length 36
21:00:59.230317 IP 10.12.5.11.49389 > 10.12.19.23.1992: Flags [.], ack 5874, win 4094, options [nop,nop,TS val 902233896 ecr 515900863], length 0
21:00:59.845831 IP 10.12.5.11.49389 > 10.12.19.23.1992: Flags [P.], seq 4298:4334, ack 5874, win 4096, options [nop,nop,TS val 902234511 ecr 515900863], length 36
21:00:59.845956 IP 10.12.19.23.1992 > 10.12.5.11.49389: Flags [P.], seq 5874:5910, ack 4334, win 316, options [nop,nop,TS val 515901479 ecr 902234511], length 36
21:00:59.846154 IP 10.12.5.11.49389 > 10.12.19.23.1992: Flags [.], ack 5910, win 4094, options [nop,nop,TS val 902234511 ecr 515901479], length 0
21:01:02.134105 IP 10.12.5.11.49389 > 10.12.19.23.1992: Flags [P.], seq 4334:4370, ack 5910, win 4096, options [nop,nop,TS val 902236793 ecr 515901479], length 36
21:01:02.134250 IP 10.12.19.23.1992 > 10.12.5.11.49389: Flags [P.], seq 5910:5946, ack 4370, win 316, options [nop,nop,TS val 515903767 ecr 902236793], length 36
21:01:02.134443 IP 10.12.5.11.49389 > 10.12.19.23.1992: Flags [.], ack 5946, win 4094, options [nop,nop,TS val 902236793 ecr 515903767], length 0
21:01:02.172637 IP 10.12.19.23.1992 > 10.12.5.11.49389: Flags [P.], seq 5946:6014, ack 4370, win 316, options [nop,nop,TS val 515903805 ecr 902236793], length 68
21:01:02.172961 IP 10.12.5.11.49389 > 10.12.19.23.1992: Flags [.], ack 6014, win 4093, options [nop,nop,TS val 902236831 ecr 515903805], length 0
21:01:04.145456 IP 10.12.5.11.49389 > 10.12.19.23.1992: Flags [P.], seq 4370:4406, ack 6014, win 4096, options [nop,nop,TS val 902238802 ecr 515903805], length 36
21:01:04.145653 IP 10.12.19.23.1992 > 10.12.5.11.49389: Flags [P.], seq 6014:6050, ack 4406, win 316, options [nop,nop,TS val 515905778 ecr 902238802], length 36
21:01:04.145877 IP 10.12.5.11.49389 > 10.12.19.23.1992: Flags [.], ack 6050, win 4094, options [nop,nop,TS val 902238802 ecr 515905778], length 0
21:01:04.231211 IP 10.12.5.11.49389 > 10.12.19.23.1992: Flags [P.], seq 4406:4442, ack 6050, win 4096, options [nop,nop,TS val 902238887 ecr 515905778], length 36
21:01:04.231366 IP 10.12.19.23.1992 > 10.12.5.11.49389: Flags [P.], seq 6050:6086, ack 4442, win 316, options [nop,nop,TS val 515905864 ecr 902238887], length 36
21:01:04.231553 IP 10.12.5.11.49389 > 10.12.19.23.1992: Flags [.], ack 6086, win 4094, options [nop,nop,TS val 902238887 ecr 515905864], length 0
21:01:04.407755 IP 10.12.5.11.49389 > 10.12.19.23.1992: Flags [P.], seq 4442:4478, ack 6086, win 4096, options [nop,nop,TS val 902239063 ecr 515905864], length 36
21:01:04.407914 IP 10.12.19.23.1992 > 10.12.5.11.49389: Flags [P.], seq 6086:6122, ack 4478, win 316, options [nop,nop,TS val 515906041 ecr 902239063], length 36
21:01:04.408114 IP 10.12.5.11.49389 > 10.12.19.23.1992: Flags [.], ack 6122, win 4094, options [nop,nop,TS val 902239063 ecr 515906041], length 0
21:01:05.359312 IP 10.12.5.11.49389 > 10.12.19.23.1992: Flags [P.], seq 4478:4514, ack 6122, win 4096, options [nop,nop,TS val 902240012 ecr 515906041], length 36
21:01:05.359483 IP 10.12.19.23.1992 > 10.12.5.11.49389: Flags [P.], seq 6122:6158, ack 4514, win 316, options [nop,nop,TS val 515906992 ecr 902240012], length 36
21:01:05.359698 IP 10.12.5.11.49389 > 10.12.19.23.1992: Flags [.], ack 6158, win 4094, options [nop,nop,TS val 902240012 ecr 515906992], length 0
21:01:05.711445 IP 10.12.5.11.49389 > 10.12.19.23.1992: Flags [P.], seq 4514:4550, ack 6158, win 4096, options [nop,nop,TS val 902240363 ecr 515906992], length 36
21:01:05.711637 IP 10.12.19.23.1992 > 10.12.5.11.49389: Flags [P.], seq 6158:6194, ack 4550, win 316, options [nop,nop,TS val 515907344 ecr 902240363], length 36
21:01:05.711818 IP 10.12.5.11.49389 > 10.12.19.23.1992: Flags [.], ack 6194, win 4094, options [nop,nop,TS val 902240363 ecr 515907344], length 0
21:01:06.231781 IP 10.12.5.11.49389 > 10.12.19.23.1992: Flags [P.], seq 4550:4586, ack 6194, win 4096, options [nop,nop,TS val 902240881 ecr 515907344], length 36
21:01:06.233646 IP 10.12.19.23.1992 > 10.12.5.11.49389: Flags [P.], seq 6194:6238, ack 4586, win 316, options [nop,nop,TS val 515907866 ecr 902240881], length 44
21:01:06.233821 IP 10.12.5.11.49389 > 10.12.19.23.1992: Flags [.], ack 6238, win 4094, options [nop,nop,TS val 902240883 ecr 515907866], length 0
21:01:07.214044 IP 10.12.5.11.49389 > 10.12.19.23.1992: Flags [P.], seq 4586:4622, ack 6238, win 4096, options [nop,nop,TS val 902241858 ecr 515907866], length 36
21:01:07.214230 IP 10.12.19.23.1992 > 10.12.5.11.49389: Flags [P.], seq 6238:6274, ack 4622, win 316, options [nop,nop,TS val 515908847 ecr 902241858], length 36
21:01:07.214421 IP 10.12.5.11.49389 > 10.12.19.23.1992: Flags [.], ack 6274, win 4094, options [nop,nop,TS val 902241858 ecr 515908847], length 0
21:01:07.214574 IP 10.12.19.23.1992 > 10.12.5.11.49389: Flags [P.], seq 6274:6350, ack 4622, win 316, options [nop,nop,TS val 515908847 ecr 902241858], length 76
21:01:07.214807 IP 10.12.5.11.49389 > 10.12.19.23.1992: Flags [.], ack 6350, win 4093, options [nop,nop,TS val 902241858 ecr 515908847], length 0
21:01:08.334275 IP 10.12.5.11.49389 > 10.12.19.23.1992: Flags [P.], seq 4622:4666, ack 6350, win 4096, options [nop,nop,TS val 902242977 ecr 515908847], length 44
21:01:08.334446 IP 10.12.19.23.1992 > 10.12.5.11.49389: Flags [P.], seq 6350:6394, ack 4666, win 316, options [nop,nop,TS val 515909967 ecr 902242977], length 44
21:01:08.334634 IP 10.12.5.11.49389 > 10.12.19.23.1992: Flags [.], ack 6394, win 4094, options [nop,nop,TS val 902242977 ecr 515909967], length 0
21:01:09.800881 IP 10.12.11.3.5353 > 224.0.0.251.5353: 0 [14q] PTR (QM)? _airport._tcp.local. PTR (QM)? _raop._tcp.local. PTR (QM)? _airplay._tcp.local. PTR (QM)? _googlecast._tcp.local. PTR (QM)? _uscan._tcp.local. PTR (QM)? _uscans._tcp.local. PTR (QM)? _ippusb._tcp.local. PTR (QM)? _scanner._tcp.local. PTR (QM)? _ipp._tcp.local. PTR (QM)? _ipps._tcp.local. PTR (QM)? _printer._tcp.local. PTR (QM)? _pdl-datastream._tcp.local. PTR (QM)? _ptp._tcp.local. PTR (QM)? _privet._tcp.local. (223)
21:01:09.800896 IP6 fe80::10a9:7186:a71f:d591.5353 > ff02::fb.5353: 0 [14q] PTR (QM)? _airport._tcp.local. PTR (QM)? _raop._tcp.local. PTR (QM)? _airplay._tcp.local. PTR (QM)? _googlecast._tcp.local. PTR (QM)? _uscan._tcp.local. PTR (QM)? _uscans._tcp.local. PTR (QM)? _ippusb._tcp.local. PTR (QM)? _scanner._tcp.local. PTR (QM)? _ipp._tcp.local. PTR (QM)? _ipps._tcp.local. PTR (QM)? _printer._tcp.local. PTR (QM)? _pdl-datastream._tcp.local. PTR (QM)? _ptp._tcp.local. PTR (QM)? _privet._tcp.local. (223)
21:01:10.055645 IP 10.12.5.11.49389 > 10.12.19.23.1992: Flags [P.], seq 4666:4702, ack 6394, win 4096, options [nop,nop,TS val 902244691 ecr 515909967], length 36
21:01:10.055807 IP 10.12.19.23.1992 > 10.12.5.11.49389: Flags [P.], seq 6394:6430, ack 4702, win 316, options [nop,nop,TS val 515911688 ecr 902244691], length 36
21:01:10.056015 IP 10.12.5.11.49389 > 10.12.19.23.1992: Flags [.], ack 6430, win 4094, options [nop,nop,TS val 902244691 ecr 515911688], length 0
21:01:10.311556 IP 10.12.5.11.49389 > 10.12.19.23.1992: Flags [P.], seq 4702:4738, ack 6430, win 4096, options [nop,nop,TS val 902244945 ecr 515911688], length 36
21:01:10.311710 IP 10.12.19.23.1992 > 10.12.5.11.49389: Flags [P.], seq 6430:6466, ack 4738, win 316, options [nop,nop,TS val 515911944 ecr 902244945], length 36
21:01:10.311882 IP 10.12.5.11.49389 > 10.12.19.23.1992: Flags [.], ack 6466, win 4094, options [nop,nop,TS val 902244945 ecr 515911944], length 0
21:01:10.464353 IP 10.12.5.11.49389 > 10.12.19.23.1992: Flags [P.], seq 4738:4774, ack 6466, win 4096, options [nop,nop,TS val 902245096 ecr 515911944], length 36
21:01:10.466382 IP 10.12.19.23.1992 > 10.12.5.11.49389: Flags [P.], seq 6466:6510, ack 4774, win 316, options [nop,nop,TS val 515912099 ecr 902245096], length 44
21:01:10.466596 IP 10.12.5.11.49389 > 10.12.19.23.1992: Flags [.], ack 6510, win 4094, options [nop,nop,TS val 902245098 ecr 515912099], length 0
21:01:10.719360 ARP, Request who-has 10.12.10.5 (ff:ff:ff:ff:ff:ff) tell 10.12.254.254, length 46
21:01:11.438170 IP 10.12.5.11.49389 > 10.12.19.23.1992: Flags [P.], seq 4774:4810, ack 6510, win 4096, options [nop,nop,TS val 902246066 ecr 515912099], length 36
21:01:11.438313 IP 10.12.19.23.1992 > 10.12.5.11.49389: Flags [P.], seq 6510:6546, ack 4810, win 316, options [nop,nop,TS val 515913071 ecr 902246066], length 36
21:01:11.438516 IP 10.12.5.11.49389 > 10.12.19.23.1992: Flags [.], ack 6546, win 4094, options [nop,nop,TS val 902246066 ecr 515913071], length 0
21:01:11.438731 IP 10.12.19.23.1992 > 10.12.5.11.49389: Flags [P.], seq 6546:6646, ack 4810, win 316, options [nop,nop,TS val 515913071 ecr 902246066], length 100
21:01:11.438935 IP 10.12.5.11.49389 > 10.12.19.23.1992: Flags [.], ack 6646, win 4092, options [nop,nop,TS val 902246066 ecr 515913071], length 0
21:01:12.671599 IP 10.12.5.11.49389 > 10.12.19.23.1992: Flags [P.], seq 4810:4846, ack 6646, win 4096, options [nop,nop,TS val 902247297 ecr 515913071], length 36
21:01:12.671757 IP 10.12.19.23.1992 > 10.12.5.11.49389: Flags [P.], seq 6646:6682, ack 4846, win 316, options [nop,nop,TS val 515914304 ecr 902247297], length 36
21:01:12.671970 IP 10.12.5.11.49389 > 10.12.19.23.1992: Flags [.], ack 6682, win 4094, options [nop,nop,TS val 902247297 ecr 515914304], length 0
21:01:12.723268 ARP, Request who-has 10.12.10.5 (ff:ff:ff:ff:ff:ff) tell 10.12.254.254, length 46
21:01:12.782755 IP 10.12.5.11.49389 > 10.12.19.23.1992: Flags [P.], seq 4846:4882, ack 6682, win 4096, options [nop,nop,TS val 902247407 ecr 515914304], length 36
21:01:12.782925 IP 10.12.19.23.1992 > 10.12.5.11.49389: Flags [P.], seq 6682:6718, ack 4882, win 316, options [nop,nop,TS val 515914416 ecr 902247407], length 36
21:01:12.783017 IP 10.12.5.11.49389 > 10.12.19.23.1992: Flags [.], ack 6718, win 4094, options [nop,nop,TS val 902247407 ecr 515914416], length 0
21:01:13.031760 IP 10.12.5.11.49389 > 10.12.19.23.1992: Flags [P.], seq 4882:4918, ack 6718, win 4096, options [nop,nop,TS val 902247655 ecr 515914416], length 36
21:01:13.031922 IP 10.12.19.23.1992 > 10.12.5.11.49389: Flags [P.], seq 6718:6754, ack 4918, win 316, options [nop,nop,TS val 515914665 ecr 902247655], length 36
21:01:13.032113 IP 10.12.5.11.49389 > 10.12.19.23.1992: Flags [.], ack 6754, win 4094, options [nop,nop,TS val 902247655 ecr 515914665], length 0
21:01:13.199245 IP 10.12.5.11.49389 > 10.12.19.23.1992: Flags [P.], seq 4918:4954, ack 6754, win 4096, options [nop,nop,TS val 902247821 ecr 515914665], length 36
21:01:13.199406 IP 10.12.19.23.1992 > 10.12.5.11.49389: Flags [P.], seq 6754:6790, ack 4954, win 316, options [nop,nop,TS val 515914832 ecr 902247821], length 36
21:01:13.199557 IP 10.12.5.11.49389 > 10.12.19.23.1992: Flags [.], ack 6790, win 4094, options [nop,nop,TS val 902247821 ecr 515914832], length 0
21:01:16.343672 IP 10.12.5.11.49389 > 10.12.19.23.1992: Flags [P.], seq 4954:4990, ack 6790, win 4096, options [nop,nop,TS val 902250961 ecr 515914832], length 36
21:01:16.343828 IP 10.12.19.23.1992 > 10.12.5.11.49389: Flags [P.], seq 6790:6826, ack 4990, win 316, options [nop,nop,TS val 515917976 ecr 902250961], length 36
21:01:16.344039 IP 10.12.5.11.49389 > 10.12.19.23.1992: Flags [.], ack 6826, win 4094, options [nop,nop,TS val 902250961 ecr 515917976], length 0
21:01:16.463676 IP 10.12.5.11.49389 > 10.12.19.23.1992: Flags [P.], seq 4990:5026, ack 6826, win 4096, options [nop,nop,TS val 902251080 ecr 515917976], length 36
21:01:16.463834 IP 10.12.19.23.1992 > 10.12.5.11.49389: Flags [P.], seq 6826:6862, ack 5026, win 316, options [nop,nop,TS val 515918096 ecr 902251080], length 36
21:01:16.464002 IP 10.12.5.11.49389 > 10.12.19.23.1992: Flags [.], ack 6862, win 4094, options [nop,nop,TS val 902251080 ecr 515918096], length 0
21:01:16.679684 IP 10.12.5.11.49389 > 10.12.19.23.1992: Flags [P.], seq 5026:5062, ack 6862, win 4096, options [nop,nop,TS val 902251295 ecr 515918096], length 36
21:01:16.679842 IP 10.12.19.23.1992 > 10.12.5.11.49389: Flags [P.], seq 6862:6898, ack 5062, win 316, options [nop,nop,TS val 515918312 ecr 902251295], length 36
21:01:16.680041 IP 10.12.5.11.49389 > 10.12.19.23.1992: Flags [.], ack 6898, win 4094, options [nop,nop,TS val 902251295 ecr 515918312], length 0
21:01:16.726715 ARP, Request who-has 10.12.10.5 (ff:ff:ff:ff:ff:ff) tell 10.12.254.254, length 46
21:01:16.823735 IP 10.12.5.11.49389 > 10.12.19.23.1992: Flags [P.], seq 5062:5098, ack 6898, win 4096, options [nop,nop,TS val 902251438 ecr 515918312], length 36
21:01:16.829088 IP 10.12.19.23.1992 > 10.12.5.11.49389: Flags [P.], seq 6898:6934, ack 5098, win 316, options [nop,nop,TS val 515918462 ecr 902251438], length 36
21:01:16.829187 IP 10.12.19.23.1992 > 10.12.5.11.49389: Flags [P.], seq 6934:6970, ack 5098, win 316, options [nop,nop,TS val 515918462 ecr 902251438], length 36
21:01:16.829257 IP 10.12.5.11.49389 > 10.12.19.23.1992: Flags [.], ack 6934, win 4094, options [nop,nop,TS val 902251443 ecr 515918462], length 0
21:01:16.829410 IP 10.12.5.11.49389 > 10.12.19.23.1992: Flags [.], ack 6970, win 4094, options [nop,nop,TS val 902251443 ecr 515918462], length 0
21:01:18.560027 IP 10.12.5.11.49389 > 10.12.19.23.1992: Flags [P.], seq 5098:5134, ack 6970, win 4096, options [nop,nop,TS val 902253160 ecr 515918462], length 36
21:01:18.560194 IP 10.12.19.23.1992 > 10.12.5.11.49389: Flags [P.], seq 6970:7006, ack 5134, win 316, options [nop,nop,TS val 515920193 ecr 902253160], length 36
21:01:18.560391 IP 10.12.5.11.49389 > 10.12.19.23.1992: Flags [.], ack 7006, win 4094, options [nop,nop,TS val 902253160 ecr 515920193], length 0
21:01:18.735789 IP 10.12.5.11.49389 > 10.12.19.23.1992: Flags [P.], seq 5134:5170, ack 7006, win 4096, options [nop,nop,TS val 902253334 ecr 515920193], length 36
21:01:18.735951 IP 10.12.19.23.1992 > 10.12.5.11.49389: Flags [P.], seq 7006:7042, ack 5170, win 316, options [nop,nop,TS val 515920368 ecr 902253334], length 36
21:01:18.736141 IP 10.12.5.11.49389 > 10.12.19.23.1992: Flags [.], ack 7042, win 4094, options [nop,nop,TS val 902253334 ecr 515920368], length 0
21:01:18.943753 IP 10.12.5.11.49389 > 10.12.19.23.1992: Flags [P.], seq 5170:5206, ack 7042, win 4096, options [nop,nop,TS val 902253541 ecr 515920368], length 36
21:01:18.948982 IP 10.12.19.23.1992 > 10.12.5.11.49389: Flags [P.], seq 7042:7086, ack 5206, win 316, options [nop,nop,TS val 515920581 ecr 902253541], length 44
21:01:18.949251 IP 10.12.5.11.49389 > 10.12.19.23.1992: Flags [.], ack 7086, win 4094, options [nop,nop,TS val 902253545 ecr 515920581], length 0
21:01:20.150371 IP 10.12.5.11.49389 > 10.12.19.23.1992: Flags [P.], seq 5206:5242, ack 7086, win 4096, options [nop,nop,TS val 902254744 ecr 515920581], length 36
21:01:20.150515 IP 10.12.19.23.1992 > 10.12.5.11.49389: Flags [P.], seq 7086:7122, ack 5242, win 316, options [nop,nop,TS val 515921783 ecr 902254744], length 36
21:01:20.150686 IP 10.12.5.11.49389 > 10.12.19.23.1992: Flags [.], ack 7122, win 4094, options [nop,nop,TS val 902254744 ecr 515921783], length 0
21:01:20.159958 IP 10.12.19.23.1992 > 10.12.5.11.49389: Flags [P.], seq 7122:7166, ack 5242, win 316, options [nop,nop,TS val 515921792 ecr 902254744], length 44
21:01:20.160139 IP 10.12.19.23.1992 > 10.12.5.11.49389: Flags [P.], seq 7166:7234, ack 5242, win 316, options [nop,nop,TS val 515921793 ecr 902254744], length 68
21:01:20.160192 IP 10.12.5.11.49389 > 10.12.19.23.1992: Flags [.], ack 7166, win 4094, options [nop,nop,TS val 902254753 ecr 515921792], length 0
21:01:20.160260 IP 10.12.5.11.49389 > 10.12.19.23.1992: Flags [.], ack 7234, win 4093, options [nop,nop,TS val 902254753 ecr 515921793], length 0
21:01:20.160826 IP 10.12.19.23.1992 > 10.12.5.11.49389: Flags [P.], seq 7234:7350, ack 5242, win 316, options [nop,nop,TS val 515921793 ecr 902254753], length 116
21:01:20.161008 IP 10.12.5.11.49389 > 10.12.19.23.1992: Flags [.], ack 7350, win 4092, options [nop,nop,TS val 902254753 ecr 515921793], length 0
21:01:20.174412 IP 10.12.19.23.1992 > 10.12.5.11.49389: Flags [P.], seq 7350:7402, ack 5242, win 316, options [nop,nop,TS val 515921807 ecr 902254753], length 52
21:01:20.174631 IP 10.12.5.11.49389 > 10.12.19.23.1992: Flags [.], ack 7402, win 4094, options [nop,nop,TS val 902254767 ecr 515921807], length 0
21:01:20.242228 IP 10.12.19.23.1992 > 10.12.5.11.49389: Flags [P.], seq 7402:7454, ack 5242, win 316, options [nop,nop,TS val 515921875 ecr 902254767], length 52
21:01:20.242303 IP 10.12.19.23.1992 > 10.12.5.11.49389: Flags [P.], seq 7454:7506, ack 5242, win 316, options [nop,nop,TS val 515921875 ecr 902254767], length 52
21:01:20.242415 IP 10.12.5.11.49389 > 10.12.19.23.1992: Flags [.], ack 7454, win 4094, options [nop,nop,TS val 902254834 ecr 515921875], length 0
21:01:20.242441 IP 10.12.5.11.49389 > 10.12.19.23.1992: Flags [.], ack 7506, win 4094, options [nop,nop,TS val 902254834 ecr 515921875], length 0
21:01:20.242487 IP 10.12.19.23.1992 > 10.12.5.11.49389: Flags [P.], seq 7506:7550, ack 5242, win 316, options [nop,nop,TS val 515921875 ecr 902254834], length 44
21:01:20.242589 IP 10.12.19.23.1992 > 10.12.5.11.49389: Flags [P.], seq 7550:7602, ack 5242, win 316, options [nop,nop,TS val 515921875 ecr 902254834], length 52
21:01:20.242654 IP 10.12.5.11.49389 > 10.12.19.23.1992: Flags [.], ack 7550, win 4094, options [nop,nop,TS val 902254834 ecr 515921875], length 0
21:01:20.242661 IP 10.12.5.11.49389 > 10.12.19.23.1992: Flags [.], ack 7602, win 4094, options [nop,nop,TS val 902254834 ecr 515921875], length 0
21:01:20.242829 IP 10.12.5.11.49389 > 10.12.19.23.1992: Flags [P.], seq 5242:5286, ack 7602, win 4096, options [nop,nop,TS val 902254834 ecr 515921875], length 44
21:01:20.243051 IP 10.12.5.11.49389 > 10.12.19.23.1992: Flags [P.], seq 5286:5330, ack 7602, win 4096, options [nop,nop,TS val 902254834 ecr 515921875], length 44
21:01:20.243056 IP 10.12.5.11.49389 > 10.12.19.23.1992: Flags [P.], seq 5330:5406, ack 7602, win 4096, options [nop,nop,TS val 902254834 ecr 515921875], length 76
21:01:20.243087 IP 10.12.19.23.1992 > 10.12.5.11.49389: Flags [.], ack 5406, win 316, options [nop,nop,TS val 515921876 ecr 902254834], length 0
21:01:20.248769 IP 10.12.19.23.1992 > 10.12.5.11.49389: Flags [P.], seq 7602:9678, ack 5406, win 316, options [nop,nop,TS val 515921881 ecr 902254834], length 2076
21:01:20.248964 IP 10.12.5.11.49389 > 10.12.19.23.1992: Flags [.], ack 9678, win 4031, options [nop,nop,TS val 902254840 ecr 515921881], length 0
21:01:20.252071 IP 10.12.19.23.1992 > 10.12.5.11.49389: Flags [P.], seq 9678:11346, ack 5406, win 316, options [nop,nop,TS val 515921885 ecr 902254840], length 1668
21:01:20.252274 IP 10.12.5.11.49389 > 10.12.19.23.1992: Flags [.], ack 11346, win 4043, options [nop,nop,TS val 902254843 ecr 515921885], length 0
21:01:20.252406 IP 10.12.19.23.1992 > 10.12.5.11.49389: Flags [P.], seq 11346:11390, ack 5406, win 316, options [nop,nop,TS val 515921885 ecr 902254843], length 44
21:01:20.252554 IP 10.12.5.11.49389 > 10.12.19.23.1992: Flags [.], ack 11390, win 4094, options [nop,nop,TS val 902254843 ecr 515921885], length 0
21:01:20.982611 IP 10.12.5.11.49389 > 10.12.19.23.1992: Flags [P.], seq 5406:5450, ack 11390, win 4096, options [nop,nop,TS val 902255570 ecr 515921885], length 44
21:01:20.982794 IP 10.12.19.23.1992 > 10.12.5.11.49389: Flags [P.], seq 11390:11450, ack 5450, win 316, options [nop,nop,TS val 515922615 ecr 902255570], length 60
21:01:20.982989 IP 10.12.5.11.49389 > 10.12.19.23.1992: Flags [.], ack 11450, win 4094, options [nop,nop,TS val 902255570 ecr 515922615], length 0
21:01:20.983219 IP 10.12.19.23.1992 > 10.12.5.11.49389: Flags [P.], seq 11450:11534, ack 5450, win 316, options [nop,nop,TS val 515922616 ecr 902255570], length 84
21:01:20.983468 IP 10.12.5.11.49389 > 10.12.19.23.1992: Flags [.], ack 11534, win 4093, options [nop,nop,TS val 902255570 ecr 515922616], length 0
21:01:21.483873 IP 10.12.5.11.49389 > 10.12.19.23.1992: Flags [P.], seq 5450:5494, ack 11534, win 4096, options [nop,nop,TS val 902256069 ecr 515922616], length 44
21:01:21.484040 IP 10.12.19.23.1992 > 10.12.5.11.49389: Flags [P.], seq 11534:11594, ack 5494, win 316, options [nop,nop,TS val 515923116 ecr 902256069], length 60
21:01:21.484192 IP 10.12.5.11.49389 > 10.12.19.23.1992: Flags [.], ack 11594, win 4094, options [nop,nop,TS val 902256069 ecr 515923116], length 0
21:01:21.484419 IP 10.12.19.23.1992 > 10.12.5.11.49389: Flags [P.], seq 11594:11678, ack 5494, win 316, options [nop,nop,TS val 515923117 ecr 902256069], length 84
21:01:21.484555 IP 10.12.5.11.49389 > 10.12.19.23.1992: Flags [.], ack 11678, win 4093, options [nop,nop,TS val 902256069 ecr 515923117], length 0
21:01:21.569909 IP 10.12.5.11.49389 > 10.12.19.23.1992: Flags [P.], seq 5494:5538, ack 11678, win 4096, options [nop,nop,TS val 902256155 ecr 515923117], length 44
21:01:21.570088 IP 10.12.19.23.1992 > 10.12.5.11.49389: Flags [P.], seq 11678:11738, ack 5538, win 316, options [nop,nop,TS val 515923203 ecr 902256155], length 60
21:01:21.570287 IP 10.12.5.11.49389 > 10.12.19.23.1992: Flags [.], ack 11738, win 4094, options [nop,nop,TS val 902256155 ecr 515923203], length 0
21:01:21.570431 IP 10.12.19.23.1992 > 10.12.5.11.49389: Flags [P.], seq 11738:11822, ack 5538, win 316, options [nop,nop,TS val 515923203 ecr 902256155], length 84
21:01:21.570646 IP 10.12.5.11.49389 > 10.12.19.23.1992: Flags [.], ack 11822, win 4093, options [nop,nop,TS val 902256155 ecr 515923203], length 0
21:01:21.657707 IP 10.12.5.11.49389 > 10.12.19.23.1992: Flags [P.], seq 5538:5582, ack 11822, win 4096, options [nop,nop,TS val 902256242 ecr 515923203], length 44
21:01:21.657892 IP 10.12.19.23.1992 > 10.12.5.11.49389: Flags [P.], seq 11822:11882, ack 5582, win 316, options [nop,nop,TS val 515923290 ecr 902256242], length 60
21:01:21.658087 IP 10.12.5.11.49389 > 10.12.19.23.1992: Flags [.], ack 11882, win 4094, options [nop,nop,TS val 902256242 ecr 515923290], length 0
21:01:21.658229 IP 10.12.19.23.1992 > 10.12.5.11.49389: Flags [P.], seq 11882:11966, ack 5582, win 316, options [nop,nop,TS val 515923291 ecr 902256242], length 84
21:01:21.658442 IP 10.12.5.11.49389 > 10.12.19.23.1992: Flags [.], ack 11966, win 4093, options [nop,nop,TS val 902256242 ecr 515923291], length 0
21:01:22.062598 IP 10.12.5.11.49389 > 10.12.19.23.1992: Flags [P.], seq 5582:5626, ack 11966, win 4096, options [nop,nop,TS val 902256646 ecr 515923291], length 44
21:01:22.062770 IP 10.12.19.23.1992 > 10.12.5.11.49389: Flags [P.], seq 11966:12026, ack 5626, win 316, options [nop,nop,TS val 515923695 ecr 902256646], length 60
21:01:22.062966 IP 10.12.5.11.49389 > 10.12.19.23.1992: Flags [.], ack 12026, win 4094, options [nop,nop,TS val 902256646 ecr 515923695], length 0
21:01:22.063110 IP 10.12.19.23.1992 > 10.12.5.11.49389: Flags [P.], seq 12026:12110, ack 5626, win 316, options [nop,nop,TS val 515923696 ecr 902256646], length 84
21:01:22.063307 IP 10.12.5.11.49389 > 10.12.19.23.1992: Flags [.], ack 12110, win 4093, options [nop,nop,TS val 902256646 ecr 515923696], length 0
21:01:22.238282 IP 10.12.5.11.49389 > 10.12.19.23.1992: Flags [P.], seq 5626:5670, ack 12110, win 4096, options [nop,nop,TS val 902256820 ecr 515923696], length 44
21:01:22.238451 IP 10.12.19.23.1992 > 10.12.5.11.49389: Flags [P.], seq 12110:12170, ack 5670, win 316, options [nop,nop,TS val 515923871 ecr 902256820], length 60
21:01:22.238649 IP 10.12.5.11.49389 > 10.12.19.23.1992: Flags [.], ack 12170, win 4094, options [nop,nop,TS val 902256820 ecr 515923871], length 0
21:01:22.238791 IP 10.12.19.23.1992 > 10.12.5.11.49389: Flags [P.], seq 12170:12254, ack 5670, win 316, options [nop,nop,TS val 515923871 ecr 902256820], length 84
21:01:22.238935 IP 10.12.5.11.49389 > 10.12.19.23.1992: Flags [.], ack 12254, win 4093, options [nop,nop,TS val 902256820 ecr 515923871], length 0
21:01:22.390692 IP 10.12.5.11.49389 > 10.12.19.23.1992: Flags [P.], seq 5670:5714, ack 12254, win 4096, options [nop,nop,TS val 902256972 ecr 515923871], length 44
21:01:22.390996 IP 10.12.19.23.1992 > 10.12.5.11.49389: Flags [P.], seq 12254:12314, ack 5714, win 316, options [nop,nop,TS val 515924023 ecr 902256972], length 60
21:01:22.391186 IP 10.12.5.11.49389 > 10.12.19.23.1992: Flags [.], ack 12314, win 4094, options [nop,nop,TS val 902256972 ecr 515924023], length 0
21:01:22.391459 IP 10.12.19.23.1992 > 10.12.5.11.49389: Flags [P.], seq 12314:12398, ack 5714, win 316, options [nop,nop,TS val 515924024 ecr 902256972], length 84
21:01:22.391629 IP 10.12.5.11.49389 > 10.12.19.23.1992: Flags [.], ack 12398, win 4093, options [nop,nop,TS val 902256972 ecr 515924024], length 0
21:01:22.526347 IP 10.12.5.11.49389 > 10.12.19.23.1992: Flags [P.], seq 5714:5758, ack 12398, win 4096, options [nop,nop,TS val 902257107 ecr 515924024], length 44
21:01:22.526559 IP 10.12.19.23.1992 > 10.12.5.11.49389: Flags [P.], seq 12398:12458, ack 5758, win 316, options [nop,nop,TS val 515924159 ecr 902257107], length 60
21:01:22.526755 IP 10.12.5.11.49389 > 10.12.19.23.1992: Flags [.], ack 12458, win 4094, options [nop,nop,TS val 902257107 ecr 515924159], length 0
21:01:22.526911 IP 10.12.19.23.1992 > 10.12.5.11.49389: Flags [P.], seq 12458:12542, ack 5758, win 316, options [nop,nop,TS val 515924159 ecr 902257107], length 84
21:01:22.527103 IP 10.12.5.11.49389 > 10.12.19.23.1992: Flags [.], ack 12542, win 4093, options [nop,nop,TS val 902257107 ecr 515924159], length 0
21:01:22.638333 IP 10.12.5.11.49389 > 10.12.19.23.1992: Flags [P.], seq 5758:5802, ack 12542, win 4096, options [nop,nop,TS val 902257218 ecr 515924159], length 44
21:01:22.638532 IP 10.12.19.23.1992 > 10.12.5.11.49389: Flags [P.], seq 12542:12602, ack 5802, win 316, options [nop,nop,TS val 515924271 ecr 902257218], length 60
21:01:22.638700 IP 10.12.5.11.49389 > 10.12.19.23.1992: Flags [.], ack 12602, win 4094, options [nop,nop,TS val 902257218 ecr 515924271], length 0
21:01:22.638875 IP 10.12.19.23.1992 > 10.12.5.11.49389: Flags [P.], seq 12602:12686, ack 5802, win 316, options [nop,nop,TS val 515924271 ecr 902257218], length 84
21:01:22.639024 IP 10.12.5.11.49389 > 10.12.19.23.1992: Flags [.], ack 12686, win 4093, options [nop,nop,TS val 902257218 ecr 515924271], length 0
21:01:22.822536 IP 10.12.5.11.49389 > 10.12.19.23.1992: Flags [P.], seq 5802:5846, ack 12686, win 4096, options [nop,nop,TS val 902257401 ecr 515924271], length 44
21:01:22.822707 IP 10.12.19.23.1992 > 10.12.5.11.49389: Flags [P.], seq 12686:12746, ack 5846, win 316, options [nop,nop,TS val 515924455 ecr 902257401], length 60
21:01:22.822857 IP 10.12.5.11.49389 > 10.12.19.23.1992: Flags [.], ack 12746, win 4094, options [nop,nop,TS val 902257401 ecr 515924455], length 0
21:01:22.823012 IP 10.12.19.23.1992 > 10.12.5.11.49389: Flags [P.], seq 12746:12830, ack 5846, win 316, options [nop,nop,TS val 515924455 ecr 902257401], length 84
21:01:22.823208 IP 10.12.5.11.49389 > 10.12.19.23.1992: Flags [.], ack 12830, win 4093, options [nop,nop,TS val 902257401 ecr 515924455], length 0
21:01:22.990592 IP 10.12.5.11.49389 > 10.12.19.23.1992: Flags [P.], seq 5846:5890, ack 12830, win 4096, options [nop,nop,TS val 902257568 ecr 515924455], length 44
21:01:22.990766 IP 10.12.19.23.1992 > 10.12.5.11.49389: Flags [P.], seq 12830:12890, ack 5890, win 316, options [nop,nop,TS val 515924623 ecr 902257568], length 60
21:01:22.990967 IP 10.12.5.11.49389 > 10.12.19.23.1992: Flags [.], ack 12890, win 4094, options [nop,nop,TS val 902257568 ecr 515924623], length 0
21:01:22.991106 IP 10.12.19.23.1992 > 10.12.5.11.49389: Flags [P.], seq 12890:12974, ack 5890, win 316, options [nop,nop,TS val 515924624 ecr 902257568], length 84
21:01:22.991250 IP 10.12.5.11.49389 > 10.12.19.23.1992: Flags [.], ack 12974, win 4093, options [nop,nop,TS val 902257568 ecr 515924624], length 0
21:01:23.134511 IP 10.12.5.11.49389 > 10.12.19.23.1992: Flags [P.], seq 5890:5934, ack 12974, win 4096, options [nop,nop,TS val 902257711 ecr 515924624], length 44
21:01:23.134698 IP 10.12.19.23.1992 > 10.12.5.11.49389: Flags [P.], seq 12974:13034, ack 5934, win 316, options [nop,nop,TS val 515924767 ecr 902257711], length 60
21:01:23.134892 IP 10.12.5.11.49389 > 10.12.19.23.1992: Flags [.], ack 13034, win 4094, options [nop,nop,TS val 902257711 ecr 515924767], length 0
21:01:23.135038 IP 10.12.19.23.1992 > 10.12.5.11.49389: Flags [P.], seq 13034:13118, ack 5934, win 316, options [nop,nop,TS val 515924767 ecr 902257711], length 84
21:01:23.135208 IP 10.12.5.11.49389 > 10.12.19.23.1992: Flags [.], ack 13118, win 4093, options [nop,nop,TS val 902257711 ecr 515924767], length 0
21:01:23.278502 IP 10.12.5.11.49389 > 10.12.19.23.1992: Flags [P.], seq 5934:5978, ack 13118, win 4096, options [nop,nop,TS val 902257854 ecr 515924767], length 44
21:01:23.278670 IP 10.12.19.23.1992 > 10.12.5.11.49389: Flags [P.], seq 13118:13178, ack 5978, win 316, options [nop,nop,TS val 515924911 ecr 902257854], length 60
21:01:23.278893 IP 10.12.5.11.49389 > 10.12.19.23.1992: Flags [.], ack 13178, win 4094, options [nop,nop,TS val 902257854 ecr 515924911], length 0
21:01:23.279049 IP 10.12.19.23.1992 > 10.12.5.11.49389: Flags [P.], seq 13178:13262, ack 5978, win 316, options [nop,nop,TS val 515924911 ecr 902257854], length 84
21:01:23.279192 IP 10.12.5.11.49389 > 10.12.19.23.1992: Flags [.], ack 13262, win 4093, options [nop,nop,TS val 902257854 ecr 515924911], length 0
21:01:23.430542 IP 10.12.5.11.49389 > 10.12.19.23.1992: Flags [P.], seq 5978:6022, ack 13262, win 4096, options [nop,nop,TS val 902258005 ecr 515924911], length 44
21:01:23.430718 IP 10.12.19.23.1992 > 10.12.5.11.49389: Flags [P.], seq 13262:13322, ack 6022, win 316, options [nop,nop,TS val 515925063 ecr 902258005], length 60
21:01:23.430885 IP 10.12.5.11.49389 > 10.12.19.23.1992: Flags [.], ack 13322, win 4094, options [nop,nop,TS val 902258005 ecr 515925063], length 0
21:01:23.431047 IP 10.12.19.23.1992 > 10.12.5.11.49389: Flags [P.], seq 13322:13406, ack 6022, win 316, options [nop,nop,TS val 515925063 ecr 902258005], length 84
21:01:23.431252 IP 10.12.5.11.49389 > 10.12.19.23.1992: Flags [.], ack 13406, win 4093, options [nop,nop,TS val 902258005 ecr 515925063], length 0
21:01:23.590534 IP 10.12.5.11.49389 > 10.12.19.23.1992: Flags [P.], seq 6022:6066, ack 13406, win 4096, options [nop,nop,TS val 902258163 ecr 515925063], length 44
21:01:23.590711 IP 10.12.19.23.1992 > 10.12.5.11.49389: Flags [P.], seq 13406:13466, ack 6066, win 316, options [nop,nop,TS val 515925223 ecr 902258163], length 60
21:01:23.590877 IP 10.12.5.11.49389 > 10.12.19.23.1992: Flags [.], ack 13466, win 4094, options [nop,nop,TS val 902258163 ecr 515925223], length 0
21:01:23.591074 IP 10.12.19.23.1992 > 10.12.5.11.49389: Flags [P.], seq 13466:13550, ack 6066, win 316, options [nop,nop,TS val 515925223 ecr 902258163], length 84
21:01:23.591221 IP 10.12.5.11.49389 > 10.12.19.23.1992: Flags [.], ack 13550, win 4093, options [nop,nop,TS val 902258163 ecr 515925223], length 0
21:01:23.758318 IP 10.12.5.11.49389 > 10.12.19.23.1992: Flags [P.], seq 6066:6110, ack 13550, win 4096, options [nop,nop,TS val 902258330 ecr 515925223], length 44
21:01:23.758531 IP 10.12.19.23.1992 > 10.12.5.11.49389: Flags [P.], seq 13550:13610, ack 6110, win 316, options [nop,nop,TS val 515925391 ecr 902258330], length 60
21:01:23.758700 IP 10.12.5.11.49389 > 10.12.19.23.1992: Flags [.], ack 13610, win 4094, options [nop,nop,TS val 902258330 ecr 515925391], length 0
21:01:23.758908 IP 10.12.19.23.1992 > 10.12.5.11.49389: Flags [P.], seq 13610:13694, ack 6110, win 316, options [nop,nop,TS val 515925391 ecr 902258330], length 84
21:01:23.759076 IP 10.12.5.11.49389 > 10.12.19.23.1992: Flags [.], ack 13694, win 4093, options [nop,nop,TS val 902258330 ecr 515925391], length 0
21:01:23.918422 IP 10.12.5.11.49389 > 10.12.19.23.1992: Flags [P.], seq 6110:6154, ack 13694, win 4096, options [nop,nop,TS val 902258489 ecr 515925391], length 44
21:01:23.918603 IP 10.12.19.23.1992 > 10.12.5.11.49389: Flags [P.], seq 13694:13754, ack 6154, win 316, options [nop,nop,TS val 515925551 ecr 902258489], length 60
21:01:23.918794 IP 10.12.5.11.49389 > 10.12.19.23.1992: Flags [.], ack 13754, win 4094, options [nop,nop,TS val 902258489 ecr 515925551], length 0
21:01:23.918981 IP 10.12.19.23.1992 > 10.12.5.11.49389: Flags [P.], seq 13754:13838, ack 6154, win 316, options [nop,nop,TS val 515925551 ecr 902258489], length 84
21:01:23.919136 IP 10.12.5.11.49389 > 10.12.19.23.1992: Flags [.], ack 13838, win 4093, options [nop,nop,TS val 902258489 ecr 515925551], length 0
21:01:24.134472 IP 10.12.5.11.49389 > 10.12.19.23.1992: Flags [P.], seq 6154:6198, ack 13838, win 4096, options [nop,nop,TS val 902258704 ecr 515925551], length 44
21:01:24.134640 IP 10.12.19.23.1992 > 10.12.5.11.49389: Flags [P.], seq 13838:13898, ack 6198, win 316, options [nop,nop,TS val 515925767 ecr 902258704], length 60
21:01:24.134834 IP 10.12.5.11.49389 > 10.12.19.23.1992: Flags [.], ack 13898, win 4094, options [nop,nop,TS val 902258704 ecr 515925767], length 0
21:01:24.134981 IP 10.12.19.23.1992 > 10.12.5.11.49389: Flags [P.], seq 13898:13982, ack 6198, win 316, options [nop,nop,TS val 515925767 ecr 902258704], length 84
21:01:24.135196 IP 10.12.5.11.49389 > 10.12.19.23.1992: Flags [.], ack 13982, win 4093, options [nop,nop,TS val 902258704 ecr 515925767], length 0
21:01:24.730641 ARP, Request who-has 10.12.10.5 (ff:ff:ff:ff:ff:ff) tell 10.12.254.254, length 46
21:01:25.654569 IP 10.12.5.11.49389 > 10.12.19.23.1992: Flags [P.], seq 6198:6242, ack 13982, win 4096, options [nop,nop,TS val 902260216 ecr 515925767], length 44
21:01:25.654746 IP 10.12.19.23.1992 > 10.12.5.11.49389: Flags [P.], seq 13982:14042, ack 6242, win 316, options [nop,nop,TS val 515927287 ecr 902260216], length 60
21:01:25.654941 IP 10.12.5.11.49389 > 10.12.19.23.1992: Flags [.], ack 14042, win 4094, options [nop,nop,TS val 902260216 ecr 515927287], length 0
21:01:25.655089 IP 10.12.19.23.1992 > 10.12.5.11.49389: Flags [P.], seq 14042:14126, ack 6242, win 316, options [nop,nop,TS val 515927287 ecr 902260216], length 84
21:01:25.655268 IP 10.12.5.11.49389 > 10.12.19.23.1992: Flags [.], ack 14126, win 4093, options [nop,nop,TS val 902260216 ecr 515927287], length 0
21:01:26.790887 IP 10.12.254.254 > 224.0.0.13: PIMv2, Hello, length 30
21:01:26.953603 IP 10.12.3.9.57621 > 10.12.255.255.57621: UDP, length 44
21:01:27.456063 IP 10.12.5.11.49389 > 10.12.19.23.1992: Flags [P.], seq 6242:6278, ack 14126, win 4096, options [nop,nop,TS val 902262016 ecr 515927287], length 36
21:01:27.456233 IP 10.12.19.23.1992 > 10.12.5.11.49389: Flags [P.], seq 14126:14186, ack 6278, win 316, options [nop,nop,TS val 515929089 ecr 902262016], length 60
21:01:27.456398 IP 10.12.5.11.49389 > 10.12.19.23.1992: Flags [.], ack 14186, win 4094, options [nop,nop,TS val 902262016 ecr 515929089], length 0
21:01:27.556847 IP 10.12.19.23.1992 > 10.12.5.11.49389: Flags [P.], seq 14186:14238, ack 6278, win 316, options [nop,nop,TS val 515929189 ecr 902262016], length 52
21:01:27.556938 IP 10.12.19.23.1992 > 10.12.5.11.49389: Flags [P.], seq 14238:14290, ack 6278, win 316, options [nop,nop,TS val 515929189 ecr 902262016], length 52
21:01:27.557013 IP 10.12.5.11.49389 > 10.12.19.23.1992: Flags [.], ack 14238, win 4094, options [nop,nop,TS val 902262115 ecr 515929189], length 0
21:01:27.557026 IP 10.12.5.11.49389 > 10.12.19.23.1992: Flags [.], ack 14290, win 4094, options [nop,nop,TS val 902262115 ecr 515929189], length 0
21:01:27.557086 IP 10.12.19.23.1992 > 10.12.5.11.49389: Flags [P.], seq 14290:14350, ack 6278, win 316, options [nop,nop,TS val 515929189 ecr 902262115], length 60
21:01:27.557200 IP 10.12.5.11.49389 > 10.12.19.23.1992: Flags [.], ack 14350, win 4094, options [nop,nop,TS val 902262115 ecr 515929189], length 0
21:01:27.696573 IP 10.12.5.11.49389 > 10.12.19.23.1992: Flags [P.], seq 6278:6314, ack 14350, win 4096, options [nop,nop,TS val 902262252 ecr 515929189], length 36
21:01:27.696749 IP 10.12.19.23.1992 > 10.12.5.11.49389: Flags [P.], seq 14350:14410, ack 6314, win 316, options [nop,nop,TS val 515929329 ecr 902262252], length 60
21:01:27.696913 IP 10.12.5.11.49389 > 10.12.19.23.1992: Flags [.], ack 14410, win 4094, options [nop,nop,TS val 902262252 ecr 515929329], length 0
21:01:27.696934 IP 10.12.19.23.1992 > 10.12.5.11.49389: Flags [P.], seq 14410:14462, ack 6314, win 316, options [nop,nop,TS val 515929329 ecr 902262252], length 52
21:01:27.697054 IP 10.12.5.11.49389 > 10.12.19.23.1992: Flags [.], ack 14462, win 4094, options [nop,nop,TS val 902262252 ecr 515929329], length 0
21:01:27.697085 IP 10.12.19.23.1992 > 10.12.5.11.49389: Flags [P.], seq 14462:14506, ack 6314, win 316, options [nop,nop,TS val 515929329 ecr 902262252], length 44
21:01:27.697193 IP 10.12.5.11.49389 > 10.12.19.23.1992: Flags [.], ack 14506, win 4094, options [nop,nop,TS val 902262252 ecr 515929329], length 0
21:01:27.697237 IP 10.12.19.23.1992 > 10.12.5.11.49389: Flags [P.], seq 14506:14550, ack 6314, win 316, options [nop,nop,TS val 515929330 ecr 902262252], length 44
21:01:27.697311 IP 10.12.5.11.49389 > 10.12.19.23.1992: Flags [.], ack 14550, win 4094, options [nop,nop,TS val 902262252 ecr 515929330], length 0
21:01:27.976254 IP 10.12.5.11.49389 > 10.12.19.23.1992: Flags [P.], seq 6314:6350, ack 14550, win 4096, options [nop,nop,TS val 902262530 ecr 515929330], length 36
21:01:27.976456 IP 10.12.19.23.1992 > 10.12.5.11.49389: Flags [P.], seq 14550:14586, ack 6350, win 316, options [nop,nop,TS val 515929609 ecr 902262530], length 36
21:01:27.976657 IP 10.12.5.11.49389 > 10.12.19.23.1992: Flags [.], ack 14586, win 4094, options [nop,nop,TS val 902262530 ecr 515929609], length 0
21:01:27.976694 IP 10.12.19.23.1992 > 10.12.5.11.49389: Flags [P.], seq 14586:14638, ack 6350, win 316, options [nop,nop,TS val 515929609 ecr 902262530], length 52
21:01:27.976781 IP 10.12.5.11.49389 > 10.12.19.23.1992: Flags [.], ack 14638, win 4094, options [nop,nop,TS val 902262530 ecr 515929609], length 0
21:01:28.934658 IP 10.12.5.11.49389 > 10.12.19.23.1992: Flags [P.], seq 6350:6386, ack 14638, win 4096, options [nop,nop,TS val 902263486 ecr 515929609], length 36
21:01:28.934809 IP 10.12.19.23.1992 > 10.12.5.11.49389: Flags [P.], seq 14638:14674, ack 6386, win 316, options [nop,nop,TS val 515930567 ecr 902263486], length 36
21:01:28.935010 IP 10.12.5.11.49389 > 10.12.19.23.1992: Flags [.], ack 14674, win 4094, options [nop,nop,TS val 902263486 ecr 515930567], length 0
21:01:28.935364 IP 10.12.19.23.1992 > 10.12.5.11.49389: Flags [P.], seq 14674:14718, ack 6386, win 316, options [nop,nop,TS val 515930568 ecr 902263486], length 44
21:01:28.935437 IP 10.12.19.23.1992 > 10.12.5.11.49389: Flags [P.], seq 14718:14762, ack 6386, win 316, options [nop,nop,TS val 515930568 ecr 902263486], length 44
21:01:28.935536 IP 10.12.5.11.49389 > 10.12.19.23.1992: Flags [.], ack 14718, win 4094, options [nop,nop,TS val 902263486 ecr 515930568], length 0
21:01:28.935616 IP 10.12.5.11.49389 > 10.12.19.23.1992: Flags [.], ack 14762, win 4094, options [nop,nop,TS val 902263486 ecr 515930568], length 0
21:01:29.036290 IP 10.12.19.23.1992 > 10.12.5.11.49389: Flags [P.], seq 14762:14830, ack 6386, win 316, options [nop,nop,TS val 515930669 ecr 902263486], length 68
21:01:29.036381 IP 10.12.19.23.1992 > 10.12.5.11.49389: Flags [P.], seq 14830:14890, ack 6386, win 316, options [nop,nop,TS val 515930669 ecr 902263486], length 60
21:01:29.036485 IP 10.12.5.11.49389 > 10.12.19.23.1992: Flags [.], ack 14830, win 4093, options [nop,nop,TS val 902263587 ecr 515930669], length 0
21:01:29.036497 IP 10.12.5.11.49389 > 10.12.19.23.1992: Flags [.], ack 14890, win 4094, options [nop,nop,TS val 902263587 ecr 515930669], length 0
21:01:29.037143 IP 10.12.19.23.1992 > 10.12.5.11.49389: Flags [P.], seq 14890:14990, ack 6386, win 316, options [nop,nop,TS val 515930669 ecr 902263587], length 100
21:01:29.037364 IP 10.12.5.11.49389 > 10.12.19.23.1992: Flags [.], ack 14990, win 4092, options [nop,nop,TS val 902263587 ecr 515930669], length 0
