19:19:38.104595 IP 10.12.100.171.39438 > 10.12.19.23.23: Flags [S],
19:19:38.155092 IP 10.12.100.171.39438 > 10.12.19.23.111: Flags [S], 
19:19:38.255331 IP 10.12.19.23.443 > 10.12.100.171.39439: Flags [S.], 
19:19:38.255331 IP 10.12.19.23.443 > 10.12.100.171.39439: Flags [S.], 
19:19:38.155186 IP 10.12.100.171.39438 > 10.12.19.23.113: Flags [S],
19:19:38.207691 IP 10.12.100.171.39436 > 10.12.19.23.3325: Flags [S],
19:19:38.207778 IP 10.12.100.171.39436 > 10.12.19.23.54328: Flags [S], 
19:19:38.255287 IP 10.12.100.171.39439 > 10.12.19.23.443: Flags [S],
19:19:38.255331 IP 10.12.19.23.443 > 10.12.100.171.39439: Flags [S.], 
19:19:38.255331 IP 10.12.19.23.443 > 10.12.100.171.39439: Flags [S.], 
19:19:38.255331 IP 10.12.19.23.443 > 10.12.100.171.39439: Flags [S.], 
19:19:38.255345 IP 10.12.100.171.39436 > 10.12.19.23.264: Flags [S], 
19:19:38.464581 IP 10.12.100.171.39437 > 10.12.19.23.1972: Flags [S], 
19:19:38.464626 IP 10.12.100.171.39437 > 10.12.19.23.7201: Flags [S], 
19:19:38.255331 IP 10.12.19.23.443 > 10.12.100.171.39439: Flags [S.], 
19:19:38.255331 IP 10.12.19.23.443 > 10.12.100.171.39439: Flags [S.], 
19:19:38.966525 IP 10.12.100.171.39437 > 10.12.19.23.2013: Flags [S], 
19:19:38.969185 IP 10.12.100.171.39436 > 10.12.19.23.1036: Flags [S], 

21:00:36.134986 IP 10.12.5.11.49389 > 10.12.19.23.1992: Flags [P.],
21:00:36.135004 IP 10.12.19.23.1992 > 10.12.5.11.49389: Flags [.],
21:00:36.162553 IP 10.12.19.23.1992 > 10.12.5.11.49389: Flags [P.],
21:00:36.162703 IP 10.12.5.11.49389 > 10.12.19.23.1992: Flags [.],
21:00:36.163292 IP 10.12.19.23.1992 > 10.12.5.11.49389: Flags [P.],
21:00:36.163460 IP 10.12.5.11.49389 > 10.12.19.23.1992: Flags [.],
21:00:36.165211 IP 10.12.5.11.49389 > 10.12.19.23.1992: Flags [P.],
21:00:36.208671 IP 10.12.19.23.1992 > 10.12.5.11.49389: Flags [.],
21:00:36.208929 IP 10.12.5.11.49389 > 10.12.19.23.1992: Flags [P.],
21:00:36.208952 IP 10.12.19.23.1992 > 10.12.5.11.49389: Flags [.],
21:00:36.211990 IP 10.12.19.23.1992 > 10.12.5.11.49389: Flags [P.],
21:00:36.212173 IP 10.12.5.11.49389 > 10.12.19.23.1992: Flags [.],
21:00:36.216494 IP 10.12.5.11.49389 > 10.12.19.23.1992: Flags [P.],
21:00:36.261753 IP 10.12.19.23.1992 > 10.12.5.11.49389: Flags [.],
21:00:36.261944 IP 10.12.5.11.49389 > 10.12.19.23.1992: Flags [P.],
21:00:36.261957 IP 10.12.19.23.1992 > 10.12.5.11.49389: Flags [.],
21:00:36.262098 IP 10.12.19.23.1992 > 10.12.5.11.49389: Flags [P.],
21:00:36.262317 IP 10.12.5.11.49389 > 10.12.19.23.1992: Flags [.],

