16:13:34.297605 IP6 fe80::a00:27ff:fea0:484e > ff02::2: ICMP6, router solicitation, length 16
16:13:36.336015 IP 10.12.254.254 > 224.0.0.13: PIMv2, Hello, length 30
16:13:36.391462 IP 10.12.13.5.5353 > 224.0.0.251.5353: 0 PTR (QU)? _googlecast._tcp.local. (40)
16:13:36.391478 IP6 fe80::c88:8696:fbe8:e71a.5353 > ff02::fb.5353: 0 PTR (QU)? _googlecast._tcp.local. (40)
16:13:37.395193 IP 10.12.13.5.5353 > 224.0.0.251.5353: 0 PTR (QM)? _googlecast._tcp.local. (40)
16:13:37.395210 IP6 fe80::c88:8696:fbe8:e71a.5353 > ff02::fb.5353: 0 PTR (QM)? _googlecast._tcp.local. (40)
16:13:37.970886 IP 10.12.3.13.57621 > 10.12.255.255.57621: UDP, length 44
16:13:39.516506 ARP, Request who-has 10.12.19.23 (ff:ff:ff:ff:ff:ff) tell 10.12.100.171, length 46
16:13:39.516535 ARP, Reply 10.12.19.23 is-at 08:00:27:d1:82:df, length 28
16:13:39.717399 ARP, Request who-has 10.12.19.23 tell 10.12.100.171, length 46
16:13:39.717413 ARP, Reply 10.12.19.23 is-at 08:00:27:d1:82:df, length 28
16:13:39.717582 IP 10.12.100.171.47554 > 10.12.19.23.587: Flags [S], seq 2535653928, win 1024, options [mss 1460], length 0
16:13:39.717597 IP 10.12.100.171.47554 > 10.12.19.23.139: Flags [S], seq 2535653928, win 1024, options [mss 1460], length 0
16:13:39.717599 IP 10.12.100.171.47554 > 10.12.19.23.80: Flags [S], seq 2535653928, win 1024, options [mss 1460], length 0
16:13:39.717631 IP 10.12.19.23.80 > 10.12.100.171.47554: Flags [S.], seq 3810897094, ack 2535653929, win 29200, options [mss 1460], length 0
16:13:39.717642 IP 10.12.100.171.47554 > 10.12.19.23.22: Flags [S], seq 2535653928, win 1024, options [mss 1460], length 0
16:13:39.717658 IP 10.12.100.171.47554 > 10.12.19.23.113: Flags [S], seq 2535653928, win 1024, options [mss 1460], length 0
16:13:39.717660 IP 10.12.100.171.47554 > 10.12.19.23.5900: Flags [S], seq 2535653928, win 1024, options [mss 1460], length 0
16:13:39.717661 IP 10.12.100.171.47554 > 10.12.19.23.995: Flags [S], seq 2535653928, win 1024, options [mss 1460], length 0
16:13:39.717662 IP 10.12.100.171.47554 > 10.12.19.23.443: Flags [S], seq 2535653928, win 1024, options [mss 1460], length 0
16:13:39.717683 IP 10.12.19.23.443 > 10.12.100.171.47554: Flags [R.], seq 0, ack 2535653929, win 0, length 0
16:13:39.717688 IP 10.12.100.171.47554 > 10.12.19.23.21: Flags [S], seq 2535653928, win 1024, options [mss 1460], length 0
16:13:39.717690 IP 10.12.100.171.47554 > 10.12.19.23.53: Flags [S], seq 2535653928, win 1024, options [mss 1460], length 0
16:13:39.717828 IP 10.12.100.171.47554 > 10.12.19.23.80: Flags [R], seq 2535653929, win 0, length 0
16:13:40.168016 IP 10.12.13.5.5353 > 224.0.0.251.5353: 0 [10q] PTR (QM)? _uscan._tcp.local. PTR (QM)? _ipp._tcp.local. PTR (QM)? _uscans._tcp.local. PTR (QM)? _ippusb._tcp.local. PTR (QM)? _scanner._tcp.local. PTR (QM)? _ipps._tcp.local. PTR (QM)? _printer._tcp.local. PTR (QM)? _pdl-datastream._tcp.local. PTR (QM)? _ptp._tcp.local. PTR (QM)? _googlecast._tcp.local. (167)
16:13:40.168057 IP6 fe80::c88:8696:fbe8:e71a.5353 > ff02::fb.5353: 0 [10q] PTR (QM)? _uscan._tcp.local. PTR (QM)? _ipp._tcp.local. PTR (QM)? _uscans._tcp.local. PTR (QM)? _ippusb._tcp.local. PTR (QM)? _scanner._tcp.local. PTR (QM)? _ipps._tcp.local. PTR (QM)? _printer._tcp.local. PTR (QM)? _pdl-datastream._tcp.local. PTR (QM)? _ptp._tcp.local. PTR (QM)? _googlecast._tcp.local. (167)
16:13:40.770714 IP 10.12.100.171.47555 > 10.12.19.23.53: Flags [S], seq 2535588393, win 1024, options [mss 1460], length 0
16:13:40.770737 IP 10.12.100.171.47555 > 10.12.19.23.21: Flags [S], seq 2535588393, win 1024, options [mss 1460], length 0
16:13:40.770767 IP 10.12.100.171.47555 > 10.12.19.23.995: Flags [S], seq 2535588393, win 1024, options [mss 1460], length 0
16:13:40.770769 IP 10.12.100.171.47555 > 10.12.19.23.5900: Flags [S], seq 2535588393, win 1024, options [mss 1460], length 0
16:13:40.770770 IP 10.12.100.171.47555 > 10.12.19.23.113: Flags [S], seq 2535588393, win 1024, options [mss 1460], length 0
16:13:40.770771 IP 10.12.100.171.47555 > 10.12.19.23.22: Flags [S], seq 2535588393, win 1024, options [mss 1460], length 0
16:13:40.770830 IP 10.12.100.171.47555 > 10.12.19.23.139: Flags [S], seq 2535588393, win 1024, options [mss 1460], length 0
16:13:40.770833 IP 10.12.100.171.47555 > 10.12.19.23.587: Flags [S], seq 2535588393, win 1024, options [mss 1460], length 0
16:13:40.770835 IP 10.12.100.171.47554 > 10.12.19.23.135: Flags [S], seq 2535653928, win 1024, options [mss 1460], length 0
16:13:40.770898 IP 10.12.100.171.47554 > 10.12.19.23.110: Flags [S], seq 2535653928, win 1024, options [mss 1460], length 0
16:13:40.770901 IP 10.12.100.171.47554 > 10.12.19.23.993: Flags [S], seq 2535653928, win 1024, options [mss 1460], length 0
16:13:40.770902 IP 10.12.100.171.47554 > 10.12.19.23.23: Flags [S], seq 2535653928, win 1024, options [mss 1460], length 0
16:13:40.770942 IP 10.12.100.171.47554 > 10.12.19.23.554: Flags [S], seq 2535653928, win 1024, options [mss 1460], length 0
16:13:40.771013 IP 10.12.100.171.47554 > 10.12.19.23.3306: Flags [S], seq 2535653928, win 1024, options [mss 1460], length 0
16:13:40.821382 IP 10.12.100.171.47555 > 10.12.19.23.3306: Flags [S], seq 2535588393, win 1024, options [mss 1460], length 0
16:13:40.821404 IP 10.12.100.171.47555 > 10.12.19.23.554: Flags [S], seq 2535588393, win 1024, options [mss 1460], length 0
16:13:40.821407 IP 10.12.100.171.47555 > 10.12.19.23.23: Flags [S], seq 2535588393, win 1024, options [mss 1460], length 0
16:13:40.821488 IP 10.12.100.171.47555 > 10.12.19.23.993: Flags [S], seq 2535588393, win 1024, options [mss 1460], length 0
16:13:40.821491 IP 10.12.100.171.47555 > 10.12.19.23.110: Flags [S], seq 2535588393, win 1024, options [mss 1460], length 0
16:13:40.821493 IP 10.12.100.171.47555 > 10.12.19.23.135: Flags [S], seq 2535588393, win 1024, options [mss 1460], length 0
16:13:40.821494 IP 10.12.100.171.47554 > 10.12.19.23.1723: Flags [S], seq 2535653928, win 1024, options [mss 1460], length 0
16:13:40.821533 IP 10.12.100.171.47554 > 10.12.19.23.8080: Flags [S], seq 2535653928, win 1024, options [mss 1460], length 0
16:13:40.821536 IP 10.12.100.171.47554 > 10.12.19.23.445: Flags [S], seq 2535653928, win 1024, options [mss 1460], length 0
16:13:40.821538 IP 10.12.100.171.47554 > 10.12.19.23.199: Flags [S], seq 2535653928, win 1024, options [mss 1460], length 0
16:13:40.821669 IP 10.12.100.171.47554 > 10.12.19.23.111: Flags [S], seq 2535653928, win 1024, options [mss 1460], length 0
16:13:40.821689 IP 10.12.100.171.47554 > 10.12.19.23.1720: Flags [S], seq 2535653928, win 1024, options [mss 1460], length 0
16:13:40.821691 IP 10.12.100.171.47554 > 10.12.19.23.25: Flags [S], seq 2535653928, win 1024, options [mss 1460], length 0
16:13:40.821692 IP 10.12.100.171.47554 > 10.12.19.23.3389: Flags [S], seq 2535653928, win 1024, options [mss 1460], length 0
16:13:40.871566 IP 10.12.100.171.47555 > 10.12.19.23.1723: Flags [S], seq 2535588393, win 1024, options [mss 1460], length 0
16:13:40.871597 IP 10.12.100.171.47554 > 10.12.19.23.8888: Flags [S], seq 2535653928, win 1024, options [mss 1460], length 0
16:13:40.871612 IP 10.12.100.171.47554 > 10.12.19.23.143: Flags [S], seq 2535653928, win 1024, options [mss 1460], length 0
16:13:40.871613 IP 10.12.100.171.47554 > 10.12.19.23.1025: Flags [S], seq 2535653928, win 1024, options [mss 1460], length 0
16:13:40.871615 IP 10.12.100.171.47554 > 10.12.19.23.256: Flags [S], seq 2535653928, win 1024, options [mss 1460], length 0
16:13:40.871680 IP 10.12.100.171.47554 > 10.12.19.23.6123: Flags [S], seq 2535653928, win 1024, options [mss 1460], length 0
16:13:40.871683 IP 10.12.100.171.47554 > 10.12.19.23.1067: Flags [S], seq 2535653928, win 1024, options [mss 1460], length 0
16:13:40.874159 IP 10.12.100.171.47555 > 10.12.19.23.3389: Flags [S], seq 2535588393, win 1024, options [mss 1460], length 0
16:13:40.874168 IP 10.12.100.171.47555 > 10.12.19.23.25: Flags [S], seq 2535588393, win 1024, options [mss 1460], length 0
16:13:40.874169 IP 10.12.100.171.47555 > 10.12.19.23.1720: Flags [S], seq 2535588393, win 1024, options [mss 1460], length 0
16:13:40.874171 IP 10.12.100.171.47555 > 10.12.19.23.111: Flags [S], seq 2535588393, win 1024, options [mss 1460], length 0
16:13:40.874218 IP 10.12.100.171.47555 > 10.12.19.23.199: Flags [S], seq 2535588393, win 1024, options [mss 1460], length 0
16:13:40.874221 IP 10.12.100.171.47555 > 10.12.19.23.445: Flags [S], seq 2535588393, win 1024, options [mss 1460], length 0
16:13:40.874223 IP 10.12.100.171.47555 > 10.12.19.23.8080: Flags [S], seq 2535588393, win 1024, options [mss 1460], length 0
16:13:40.922925 IP 10.12.100.171.47555 > 10.12.19.23.1067: Flags [S], seq 2535588393, win 1024, options [mss 1460], length 0
16:13:40.922948 IP 10.12.100.171.47555 > 10.12.19.23.6123: Flags [S], seq 2535588393, win 1024, options [mss 1460], length 0
16:13:40.922950 IP 10.12.100.171.47555 > 10.12.19.23.256: Flags [S], seq 2535588393, win 1024, options [mss 1460], length 0
16:13:40.922952 IP 10.12.100.171.47555 > 10.12.19.23.1025: Flags [S], seq 2535588393, win 1024, options [mss 1460], length 0
16:13:40.922953 IP 10.12.100.171.47555 > 10.12.19.23.143: Flags [S], seq 2535588393, win 1024, options [mss 1460], length 0
16:13:40.923022 IP 10.12.100.171.47555 > 10.12.19.23.8888: Flags [S], seq 2535588393, win 1024, options [mss 1460], length 0
16:13:40.923026 IP 10.12.100.171.47554 > 10.12.19.23.4848: Flags [S], seq 2535653928, win 1024, options [mss 1460], length 0
16:13:40.925471 IP 10.12.100.171.47554 > 10.12.19.23.1151: Flags [S], seq 2535653928, win 1024, options [mss 1460], length 0
16:13:40.925480 IP 10.12.100.171.47554 > 10.12.19.23.1213: Flags [S], seq 2535653928, win 1024, options [mss 1460], length 0
16:13:40.925506 IP 10.12.100.171.47554 > 10.12.19.23.6792: Flags [S], seq 2535653928, win 1024, options [mss 1460], length 0
16:13:40.925553 IP 10.12.100.171.47554 > 10.12.19.23.8649: Flags [S], seq 2535653928, win 1024, options [mss 1460], length 0
16:13:40.925595 IP 10.12.100.171.47554 > 10.12.19.23.3878: Flags [S], seq 2535653928, win 1024, options [mss 1460], length 0
16:13:40.925636 IP 10.12.100.171.47554 > 10.12.19.23.593: Flags [S], seq 2535653928, win 1024, options [mss 1460], length 0
16:13:40.925639 IP 10.12.100.171.47554 > 10.12.19.23.2003: Flags [S], seq 2535653928, win 1024, options [mss 1460], length 0
16:13:40.973058 IP 10.12.100.171.47557 > 10.12.19.23.443: Flags [S], seq 2518876968, win 1024, options [mss 1460], length 0
16:13:40.973090 IP 10.12.19.23.443 > 10.12.100.171.47557: Flags [R.], seq 0, ack 2518876969, win 0, length 0
16:13:40.973103 IP 10.12.100.171.47554 > 10.12.19.23.6689: Flags [S], seq 2535653928, win 1024, options [mss 1460], length 0
16:13:40.973261 IP 10.12.100.171.47554 > 10.12.19.23.50300: Flags [S], seq 2535653928, win 1024, options [mss 1460], length 0
16:13:40.973281 IP 10.12.100.171.47554 > 10.12.19.23.24: Flags [S], seq 2535653928, win 1024, options [mss 1460], length 0
16:13:40.973283 IP 10.12.100.171.47554 > 10.12.19.23.5961: Flags [S], seq 2535653928, win 1024, options [mss 1460], length 0
16:13:40.975546 IP 10.12.100.171.47555 > 10.12.19.23.4848: Flags [S], seq 2535588393, win 1024, options [mss 1460], length 0
16:13:40.975567 IP 10.12.100.171.47554 > 10.12.19.23.4: Flags [S], seq 2535653928, win 1024, options [mss 1460], length 0
16:13:40.977942 IP 10.12.100.171.47555 > 10.12.19.23.2003: Flags [S], seq 2535588393, win 1024, options [mss 1460], length 0
16:13:40.977968 IP 10.12.100.171.47555 > 10.12.19.23.593: Flags [S], seq 2535588393, win 1024, options [mss 1460], length 0
16:13:40.977969 IP 10.12.100.171.47555 > 10.12.19.23.3878: Flags [S], seq 2535588393, win 1024, options [mss 1460], length 0
16:13:40.977971 IP 10.12.100.171.47555 > 10.12.19.23.8649: Flags [S], seq 2535588393, win 1024, options [mss 1460], length 0
16:13:40.978030 IP 10.12.100.171.47555 > 10.12.19.23.6792: Flags [S], seq 2535588393, win 1024, options [mss 1460], length 0
16:13:40.978033 IP 10.12.100.171.47555 > 10.12.19.23.1213: Flags [S], seq 2535588393, win 1024, options [mss 1460], length 0
16:13:40.978035 IP 10.12.100.171.47555 > 10.12.19.23.1151: Flags [S], seq 2535588393, win 1024, options [mss 1460], length 0
16:13:41.030575 IP 10.12.100.171.47555 > 10.12.19.23.4: Flags [S], seq 2535588393, win 1024, options [mss 1460], length 0
16:13:41.080631 IP 10.12.100.171.47555 > 10.12.19.23.5961: Flags [S], seq 2535588393, win 1024, options [mss 1460], length 0
16:13:41.133487 IP 10.12.100.171.47555 > 10.12.19.23.24: Flags [S], seq 2535588393, win 1024, options [mss 1460], length 0
16:13:41.133510 IP 10.12.100.171.47555 > 10.12.19.23.50300: Flags [S], seq 2535588393, win 1024, options [mss 1460], length 0
16:13:41.133512 IP 10.12.100.171.47555 > 10.12.19.23.6689: Flags [S], seq 2535588393, win 1024, options [mss 1460], length 0
16:13:41.133514 IP 10.12.100.171.47554 > 10.12.19.23.9503: Flags [S], seq 2535653928, win 1024, options [mss 1460], length 0
16:13:41.133566 IP 10.12.100.171.47554 > 10.12.19.23.32: Flags [S], seq 2535653928, win 1024, options [mss 1460], length 0
16:13:41.133570 IP 10.12.100.171.47554 > 10.12.19.23.912: Flags [S], seq 2535653928, win 1024, options [mss 1460], length 0
16:13:41.133572 IP 10.12.100.171.47554 > 10.12.19.23.6112: Flags [S], seq 2535653928, win 1024, options [mss 1460], length 0
16:13:41.133635 IP 10.12.100.171.47554 > 10.12.19.23.10180: Flags [S], seq 2535653928, win 1024, options [mss 1460], length 0
16:13:41.133639 IP 10.12.100.171.47554 > 10.12.19.23.18988: Flags [S], seq 2535653928, win 1024, options [mss 1460], length 0
16:13:41.133640 IP 10.12.100.171.47554 > 10.12.19.23.425: Flags [S], seq 2535653928, win 1024, options [mss 1460], length 0
16:13:41.184420 IP 10.12.100.171.47555 > 10.12.19.23.425: Flags [S], seq 2535588393, win 1024, options [mss 1460], length 0
16:13:41.184443 IP 10.12.100.171.47555 > 10.12.19.23.18988: Flags [S], seq 2535588393, win 1024, options [mss 1460], length 0
16:13:41.184445 IP 10.12.100.171.47555 > 10.12.19.23.10180: Flags [S], seq 2535588393, win 1024, options [mss 1460], length 0
16:13:41.184447 IP 10.12.100.171.47555 > 10.12.19.23.6112: Flags [S], seq 2535588393, win 1024, options [mss 1460], length 0
16:13:41.184448 IP 10.12.100.171.47555 > 10.12.19.23.912: Flags [S], seq 2535588393, win 1024, options [mss 1460], length 0
16:13:41.184449 IP 10.12.100.171.47555 > 10.12.19.23.32: Flags [S], seq 2535588393, win 1024, options [mss 1460], length 0
16:13:41.184507 IP 10.12.100.171.47555 > 10.12.19.23.9503: Flags [S], seq 2535588393, win 1024, options [mss 1460], length 0
16:13:41.184549 IP 10.12.100.171.47554 > 10.12.19.23.1147: Flags [S], seq 2535653928, win 1024, options [mss 1460], length 0
16:13:41.184552 IP 10.12.100.171.47554 > 10.12.19.23.10243: Flags [S], seq 2535653928, win 1024, options [mss 1460], length 0
16:13:41.184553 IP 10.12.100.171.47554 > 10.12.19.23.6004: Flags [S], seq 2535653928, win 1024, options [mss 1460], length 0
16:13:41.234903 IP 10.12.100.171.47555 > 10.12.19.23.6004: Flags [S], seq 2535588393, win 1024, options [mss 1460], length 0
16:13:41.234910 IP 10.12.100.171.47555 > 10.12.19.23.10243: Flags [S], seq 2535588393, win 1024, options [mss 1460], length 0
16:13:41.234912 IP 10.12.100.171.47555 > 10.12.19.23.1147: Flags [S], seq 2535588393, win 1024, options [mss 1460], length 0
16:13:41.234957 IP 10.12.100.171.47554 > 10.12.19.23.12174: Flags [S], seq 2535653928, win 1024, options [mss 1460], length 0
16:13:41.234960 IP 10.12.100.171.47554 > 10.12.19.23.1658: Flags [S], seq 2535653928, win 1024, options [mss 1460], length 0
16:13:41.234961 IP 10.12.100.171.47554 > 10.12.19.23.9040: Flags [S], seq 2535653928, win 1024, options [mss 1460], length 0
16:13:41.235004 IP 10.12.100.171.47554 > 10.12.19.23.1059: Flags [S], seq 2535653928, win 1024, options [mss 1460], length 0
16:13:41.235007 IP 10.12.100.171.47554 > 10.12.19.23.88: Flags [S], seq 2535653928, win 1024, options [mss 1460], length 0
16:13:41.235009 IP 10.12.100.171.47554 > 10.12.19.23.5544: Flags [S], seq 2535653928, win 1024, options [mss 1460], length 0
16:13:41.235071 IP 10.12.100.171.47554 > 10.12.19.23.32781: Flags [S], seq 2535653928, win 1024, options [mss 1460], length 0
16:13:41.285331 IP 10.12.100.171.47555 > 10.12.19.23.32781: Flags [S], seq 2535588393, win 1024, options [mss 1460], length 0
16:13:41.285339 IP 10.12.100.171.47555 > 10.12.19.23.5544: Flags [S], seq 2535588393, win 1024, options [mss 1460], length 0
16:13:41.285341 IP 10.12.100.171.47555 > 10.12.19.23.88: Flags [S], seq 2535588393, win 1024, options [mss 1460], length 0
16:13:41.285380 IP 10.12.100.171.47555 > 10.12.19.23.1059: Flags [S], seq 2535588393, win 1024, options [mss 1460], length 0
16:13:41.285383 IP 10.12.100.171.47555 > 10.12.19.23.9040: Flags [S], seq 2535588393, win 1024, options [mss 1460], length 0
16:13:41.285385 IP 10.12.100.171.47555 > 10.12.19.23.1658: Flags [S], seq 2535588393, win 1024, options [mss 1460], length 0
16:13:41.285386 IP 10.12.100.171.47555 > 10.12.19.23.12174: Flags [S], seq 2535588393, win 1024, options [mss 1460], length 0
16:13:41.285433 IP 10.12.100.171.47554 > 10.12.19.23.27355: Flags [S], seq 2535653928, win 1024, options [mss 1460], length 0
16:13:41.285437 IP 10.12.100.171.47554 > 10.12.19.23.264: Flags [S], seq 2535653928, win 1024, options [mss 1460], length 0
16:13:41.285477 IP 10.12.100.171.47554 > 10.12.19.23.1001: Flags [S], seq 2535653928, win 1024, options [mss 1460], length 0
16:13:41.334924 IP 10.12.13.5.5353 > 224.0.0.251.5353: 0 PTR (QU)? _privet._tcp.local. (36)
16:13:41.334940 IP6 fe80::c88:8696:fbe8:e71a.5353 > ff02::fb.5353: 0 PTR (QU)? _privet._tcp.local. (36)
16:13:41.335619 IP 10.12.100.171.47555 > 10.12.19.23.1001: Flags [S], seq 2535588393, win 1024, options [mss 1460], length 0
16:13:41.335632 IP 10.12.100.171.47555 > 10.12.19.23.264: Flags [S], seq 2535588393, win 1024, options [mss 1460], length 0
16:13:41.335634 IP 10.12.100.171.47555 > 10.12.19.23.27355: Flags [S], seq 2535588393, win 1024, options [mss 1460], length 0
16:13:41.335676 IP 10.12.100.171.47554 > 10.12.19.23.6667: Flags [S], seq 2535653928, win 1024, options [mss 1460], length 0
16:13:41.335679 IP 10.12.100.171.47554 > 10.12.19.23.50636: Flags [S], seq 2535653928, win 1024, options [mss 1460], length 0
16:13:41.335680 IP 10.12.100.171.47554 > 10.12.19.23.3800: Flags [S], seq 2535653928, win 1024, options [mss 1460], length 0
16:13:41.335723 IP 10.12.100.171.47554 > 10.12.19.23.144: Flags [S], seq 2535653928, win 1024, options [mss 1460], length 0
16:13:41.335726 IP 10.12.100.171.47554 > 10.12.19.23.1914: Flags [S], seq 2535653928, win 1024, options [mss 1460], length 0
16:13:41.335727 IP 10.12.100.171.47554 > 10.12.19.23.49157: Flags [S], seq 2535653928, win 1024, options [mss 1460], length 0
16:13:41.335790 IP 10.12.100.171.47554 > 10.12.19.23.1296: Flags [S], seq 2535653928, win 1024, options [mss 1460], length 0
16:13:41.385769 IP 10.12.100.171.47554 > 10.12.19.23.6839: Flags [S], seq 2535653928, win 1024, options [mss 1460], length 0
16:13:41.388097 IP 10.12.100.171.47555 > 10.12.19.23.1296: Flags [S], seq 2535588393, win 1024, options [mss 1460], length 0
16:13:41.388104 IP 10.12.100.171.47555 > 10.12.19.23.49157: Flags [S], seq 2535588393, win 1024, options [mss 1460], length 0
16:13:41.388121 IP 10.12.100.171.47555 > 10.12.19.23.1914: Flags [S], seq 2535588393, win 1024, options [mss 1460], length 0
16:13:41.388123 IP 10.12.100.171.47555 > 10.12.19.23.144: Flags [S], seq 2535588393, win 1024, options [mss 1460], length 0
16:13:41.388216 IP 10.12.100.171.47555 > 10.12.19.23.3800: Flags [S], seq 2535588393, win 1024, options [mss 1460], length 0
16:13:41.388235 IP 10.12.100.171.47555 > 10.12.19.23.50636: Flags [S], seq 2535588393, win 1024, options [mss 1460], length 0
16:13:41.388236 IP 10.12.100.171.47555 > 10.12.19.23.6667: Flags [S], seq 2535588393, win 1024, options [mss 1460], length 0
16:13:41.388323 IP 10.12.100.171.47554 > 10.12.19.23.1000: Flags [S], seq 2535653928, win 1024, options [mss 1460], length 0
16:13:41.388342 IP 10.12.100.171.47554 > 10.12.19.23.16993: Flags [S], seq 2535653928, win 1024, options [mss 1460], length 0
16:13:41.435902 IP 10.12.100.171.47555 > 10.12.19.23.6839: Flags [S], seq 2535588393, win 1024, options [mss 1460], length 0
16:13:41.438604 IP 10.12.100.171.47555 > 10.12.19.23.16993: Flags [S], seq 2535588393, win 1024, options [mss 1460], length 0
16:13:41.438612 IP 10.12.100.171.47555 > 10.12.19.23.1000: Flags [S], seq 2535588393, win 1024, options [mss 1460], length 0
16:13:41.438628 IP 10.12.100.171.47554 > 10.12.19.23.2602: Flags [S], seq 2535653928, win 1024, options [mss 1460], length 0
16:13:41.438629 IP 10.12.100.171.47554 > 10.12.19.23.15004: Flags [S], seq 2535653928, win 1024, options [mss 1460], length 0
16:13:41.438747 IP 10.12.100.171.47554 > 10.12.19.23.9878: Flags [S], seq 2535653928, win 1024, options [mss 1460], length 0
16:13:41.438751 IP 10.12.100.171.47554 > 10.12.19.23.1097: Flags [S], seq 2535653928, win 1024, options [mss 1460], length 0
16:13:41.438752 IP 10.12.100.171.47554 > 10.12.19.23.163: Flags [S], seq 2535653928, win 1024, options [mss 1460], length 0
16:13:41.438823 IP 10.12.100.171.47554 > 10.12.19.23.7938: Flags [S], seq 2535653928, win 1024, options [mss 1460], length 0
16:13:41.438885 IP 10.12.100.171.47554 > 10.12.19.23.1783: Flags [S], seq 2535653928, win 1024, options [mss 1460], length 0
16:13:41.486164 IP 10.12.100.171.47554 > 10.12.19.23.22939: Flags [S], seq 2535653928, win 1024, options [mss 1460], length 0
16:13:41.489076 IP 10.12.100.171.47555 > 10.12.19.23.1783: Flags [S], seq 2535588393, win 1024, options [mss 1460], length 0
16:13:41.489084 IP 10.12.100.171.47555 > 10.12.19.23.7938: Flags [S], seq 2535588393, win 1024, options [mss 1460], length 0
16:13:41.489189 IP 10.12.100.171.47555 > 10.12.19.23.163: Flags [S], seq 2535588393, win 1024, options [mss 1460], length 0
16:13:41.489192 IP 10.12.100.171.47555 > 10.12.19.23.1097: Flags [S], seq 2535588393, win 1024, options [mss 1460], length 0
16:13:41.489194 IP 10.12.100.171.47555 > 10.12.19.23.9878: Flags [S], seq 2535588393, win 1024, options [mss 1460], length 0
16:13:41.489292 IP 10.12.100.171.47555 > 10.12.19.23.15004: Flags [S], seq 2535588393, win 1024, options [mss 1460], length 0
16:13:41.489295 IP 10.12.100.171.47555 > 10.12.19.23.2602: Flags [S], seq 2535588393, win 1024, options [mss 1460], length 0
16:13:41.489297 IP 10.12.100.171.47554 > 10.12.19.23.1132: Flags [S], seq 2535653928, win 1024, options [mss 1460], length 0
16:13:41.489392 IP 10.12.100.171.47554 > 10.12.19.23.40911: Flags [S], seq 2535653928, win 1024, options [mss 1460], length 0
16:13:41.536319 IP 10.12.100.171.47555 > 10.12.19.23.22939: Flags [S], seq 2535588393, win 1024, options [mss 1460], length 0
16:13:41.539653 IP 10.12.100.171.47555 > 10.12.19.23.40911: Flags [S], seq 2535588393, win 1024, options [mss 1460], length 0
16:13:41.539662 IP 10.12.100.171.47555 > 10.12.19.23.1132: Flags [S], seq 2535588393, win 1024, options [mss 1460], length 0
16:13:41.539664 IP 10.12.100.171.47554 > 10.12.19.23.1801: Flags [S], seq 2535653928, win 1024, options [mss 1460], length 0
16:13:41.539732 IP 10.12.100.171.47554 > 10.12.19.23.211: Flags [S], seq 2535653928, win 1024, options [mss 1460], length 0
16:13:41.539735 IP 10.12.100.171.47554 > 10.12.19.23.888: Flags [S], seq 2535653928, win 1024, options [mss 1460], length 0
16:13:41.539737 IP 10.12.100.171.47554 > 10.12.19.23.9929: Flags [S], seq 2535653928, win 1024, options [mss 1460], length 0
16:13:41.539776 IP 10.12.100.171.47554 > 10.12.19.23.3851: Flags [S], seq 2535653928, win 1024, options [mss 1460], length 0
16:13:41.539818 IP 10.12.100.171.47554 > 10.12.19.23.8333: Flags [S], seq 2535653928, win 1024, options [mss 1460], length 0
16:13:41.539833 IP 10.12.100.171.47554 > 10.12.19.23.14441: Flags [S], seq 2535653928, win 1024, options [mss 1460], length 0
16:13:41.586610 IP 10.12.100.171.47554 > 10.12.19.23.8031: Flags [S], seq 2535653928, win 1024, options [mss 1460], length 0
16:13:41.589797 IP 10.12.100.171.47554 > 10.12.19.23.1154: Flags [S], seq 2535653928, win 1024, options [mss 1460], length 0
16:13:41.589812 IP 10.12.100.171.47554 > 10.12.19.23.2035: Flags [S], seq 2535653928, win 1024, options [mss 1460], length 0
16:13:41.592106 IP 10.12.100.171.47555 > 10.12.19.23.14441: Flags [S], seq 2535588393, win 1024, options [mss 1460], length 0
16:13:41.592120 IP 10.12.100.171.47555 > 10.12.19.23.8333: Flags [S], seq 2535588393, win 1024, options [mss 1460], length 0
16:13:41.592122 IP 10.12.100.171.47555 > 10.12.19.23.3851: Flags [S], seq 2535588393, win 1024, options [mss 1460], length 0
16:13:41.592124 IP 10.12.100.171.47555 > 10.12.19.23.9929: Flags [S], seq 2535588393, win 1024, options [mss 1460], length 0
16:13:41.592125 IP 10.12.100.171.47555 > 10.12.19.23.888: Flags [S], seq 2535588393, win 1024, options [mss 1460], length 0
16:13:41.592197 IP 10.12.100.171.47555 > 10.12.19.23.211: Flags [S], seq 2535588393, win 1024, options [mss 1460], length 0
16:13:41.592201 IP 10.12.100.171.47555 > 10.12.19.23.1801: Flags [S], seq 2535588393, win 1024, options [mss 1460], length 0
16:13:41.636791 IP 10.12.100.171.47555 > 10.12.19.23.8031: Flags [S], seq 2535588393, win 1024, options [mss 1460], length 0
16:13:41.640206 IP 10.12.100.171.47555 > 10.12.19.23.2035: Flags [S], seq 2535588393, win 1024, options [mss 1460], length 0
16:13:41.640218 IP 10.12.100.171.47555 > 10.12.19.23.1154: Flags [S], seq 2535588393, win 1024, options [mss 1460], length 0
16:13:41.642458 IP 10.12.100.171.47554 > 10.12.19.23.2103: Flags [S], seq 2535653928, win 1024, options [mss 1460], length 0
16:13:41.642468 IP 10.12.100.171.47554 > 10.12.19.23.2967: Flags [S], seq 2535653928, win 1024, options [mss 1460], length 0
16:13:41.642470 IP 10.12.100.171.47554 > 10.12.19.23.3689: Flags [S], seq 2535653928, win 1024, options [mss 1460], length 0
16:13:41.642472 IP 10.12.100.171.47554 > 10.12.19.23.1062: Flags [S], seq 2535653928, win 1024, options [mss 1460], length 0
16:13:41.642474 IP 10.12.100.171.47554 > 10.12.19.23.5922: Flags [S], seq 2535653928, win 1024, options [mss 1460], length 0
16:13:41.642545 IP 10.12.100.171.47554 > 10.12.19.23.27353: Flags [S], seq 2535653928, win 1024, options [mss 1460], length 0
16:13:41.642548 IP 10.12.100.171.47554 > 10.12.19.23.57797: Flags [S], seq 2535653928, win 1024, options [mss 1460], length 0
16:13:41.687985 IP 10.12.100.171.47554 > 10.12.19.23.7777: Flags [S], seq 2535653928, win 1024, options [mss 1460], length 0
16:13:41.690369 IP 10.12.100.171.47554 > 10.12.19.23.1287: Flags [S], seq 2535653928, win 1024, options [mss 1460], length 0
16:13:41.690389 IP 10.12.100.171.47554 > 10.12.19.23.9100: Flags [S], seq 2535653928, win 1024, options [mss 1460], length 0
16:13:41.692816 IP 10.12.100.171.47555 > 10.12.19.23.57797: Flags [S], seq 2535588393, win 1024, options [mss 1460], length 0
16:13:41.692825 IP 10.12.100.171.47555 > 10.12.19.23.27353: Flags [S], seq 2535588393, win 1024, options [mss 1460], length 0
16:13:41.692827 IP 10.12.100.171.47555 > 10.12.19.23.5922: Flags [S], seq 2535588393, win 1024, options [mss 1460], length 0
16:13:41.692828 IP 10.12.100.171.47555 > 10.12.19.23.1062: Flags [S], seq 2535588393, win 1024, options [mss 1460], length 0
16:13:41.692830 IP 10.12.100.171.47555 > 10.12.19.23.3689: Flags [S], seq 2535588393, win 1024, options [mss 1460], length 0
16:13:41.692897 IP 10.12.100.171.47555 > 10.12.19.23.2967: Flags [S], seq 2535588393, win 1024, options [mss 1460], length 0
16:13:41.692901 IP 10.12.100.171.47555 > 10.12.19.23.2103: Flags [S], seq 2535588393, win 1024, options [mss 1460], length 0
16:13:41.738392 IP 10.12.100.171.47555 > 10.12.19.23.7777: Flags [S], seq 2535588393, win 1024, options [mss 1460], length 0
16:13:41.740883 IP 10.12.100.171.47555 > 10.12.19.23.9100: Flags [S], seq 2535588393, win 1024, options [mss 1460], length 0
16:13:41.740903 IP 10.12.100.171.47555 > 10.12.19.23.1287: Flags [S], seq 2535588393, win 1024, options [mss 1460], length 0
16:13:41.743266 IP 10.12.100.171.47554 > 10.12.19.23.15000: Flags [S], seq 2535653928, win 1024, options [mss 1460], length 0
16:13:41.743286 IP 10.12.100.171.47554 > 10.12.19.23.9101: Flags [S], seq 2535653928, win 1024, options [mss 1460], length 0
16:13:41.743288 IP 10.12.100.171.47554 > 10.12.19.23.2909: Flags [S], seq 2535653928, win 1024, options [mss 1460], length 0
16:13:41.743289 IP 10.12.100.171.47554 > 10.12.19.23.2040: Flags [S], seq 2535653928, win 1024, options [mss 1460], length 0
16:13:41.743290 IP 10.12.100.171.47554 > 10.12.19.23.5002: Flags [S], seq 2535653928, win 1024, options [mss 1460], length 0
16:13:41.743353 IP 10.12.100.171.47554 > 10.12.19.23.5859: Flags [S], seq 2535653928, win 1024, options [mss 1460], length 0
16:13:41.743357 IP 10.12.100.171.47554 > 10.12.19.23.3283: Flags [S], seq 2535653928, win 1024, options [mss 1460], length 0
16:13:41.788701 IP 10.12.100.171.47554 > 10.12.19.23.2005: Flags [S], seq 2535653928, win 1024, options [mss 1460], length 0
16:13:41.791189 IP 10.12.100.171.47554 > 10.12.19.23.668: Flags [S], seq 2535653928, win 1024, options [mss 1460], length 0
16:13:41.791208 IP 10.12.100.171.47554 > 10.12.19.23.49165: Flags [S], seq 2535653928, win 1024, options [mss 1460], length 0
16:13:41.793504 IP 10.12.100.171.47555 > 10.12.19.23.3283: Flags [S], seq 2535588393, win 1024, options [mss 1460], length 0
16:13:41.793511 IP 10.12.100.171.47555 > 10.12.19.23.5859: Flags [S], seq 2535588393, win 1024, options [mss 1460], length 0
16:13:41.793513 IP 10.12.100.171.47555 > 10.12.19.23.5002: Flags [S], seq 2535588393, win 1024, options [mss 1460], length 0
16:13:41.793514 IP 10.12.100.171.47555 > 10.12.19.23.2040: Flags [S], seq 2535588393, win 1024, options [mss 1460], length 0
16:13:41.793561 IP 10.12.100.171.47555 > 10.12.19.23.2909: Flags [S], seq 2535588393, win 1024, options [mss 1460], length 0
16:13:41.793602 IP 10.12.100.171.47555 > 10.12.19.23.9101: Flags [S], seq 2535588393, win 1024, options [mss 1460], length 0
16:13:41.793643 IP 10.12.100.171.47555 > 10.12.19.23.15000: Flags [S], seq 2535588393, win 1024, options [mss 1460], length 0
16:13:41.838729 IP 10.12.100.171.47555 > 10.12.19.23.2005: Flags [S], seq 2535588393, win 1024, options [mss 1460], length 0
16:13:41.841704 IP 10.12.100.171.47555 > 10.12.19.23.49165: Flags [S], seq 2535588393, win 1024, options [mss 1460], length 0
16:13:41.841724 IP 10.12.100.171.47555 > 10.12.19.23.668: Flags [S], seq 2535588393, win 1024, options [mss 1460], length 0
16:13:41.843923 IP 10.12.100.171.47554 > 10.12.19.23.5633: Flags [S], seq 2535653928, win 1024, options [mss 1460], length 0
16:13:41.843944 IP 10.12.100.171.47554 > 10.12.19.23.3003: Flags [S], seq 2535653928, win 1024, options [mss 1460], length 0
16:13:41.843946 IP 10.12.100.171.47554 > 10.12.19.23.691: Flags [S], seq 2535653928, win 1024, options [mss 1460], length 0
16:13:41.843947 IP 10.12.100.171.47554 > 10.12.19.23.5907: Flags [S], seq 2535653928, win 1024, options [mss 1460], length 0
16:13:41.843995 IP 10.12.100.171.47554 > 10.12.19.23.5226: Flags [S], seq 2535653928, win 1024, options [mss 1460], length 0
16:13:41.843998 IP 10.12.100.171.47554 > 10.12.19.23.2301: Flags [S], seq 2535653928, win 1024, options [mss 1460], length 0
16:13:41.844000 IP 10.12.100.171.47554 > 10.12.19.23.8008: Flags [S], seq 2535653928, win 1024, options [mss 1460], length 0
16:13:41.888966 IP 10.12.100.171.47554 > 10.12.19.23.16001: Flags [S], seq 2535653928, win 1024, options [mss 1460], length 0
16:13:41.891945 IP 10.12.100.171.47554 > 10.12.19.23.515: Flags [S], seq 2535653928, win 1024, options [mss 1460], length 0
16:13:41.891965 IP 10.12.100.171.47554 > 10.12.19.23.3351: Flags [S], seq 2535653928, win 1024, options [mss 1460], length 0
16:13:41.894116 IP 10.12.100.171.47555 > 10.12.19.23.2301: Flags [S], seq 2535588393, win 1024, options [mss 1460], length 0
16:13:41.894140 IP 10.12.100.171.47555 > 10.12.19.23.5226: Flags [S], seq 2535588393, win 1024, options [mss 1460], length 0
16:13:41.894142 IP 10.12.100.171.47555 > 10.12.19.23.5907: Flags [S], seq 2535588393, win 1024, options [mss 1460], length 0
16:13:41.894144 IP 10.12.100.171.47555 > 10.12.19.23.691: Flags [S], seq 2535588393, win 1024, options [mss 1460], length 0
16:13:41.894241 IP 10.12.100.171.47555 > 10.12.19.23.3003: Flags [S], seq 2535588393, win 1024, options [mss 1460], length 0
16:13:41.894245 IP 10.12.100.171.47555 > 10.12.19.23.5633: Flags [S], seq 2535588393, win 1024, options [mss 1460], length 0
16:13:41.896669 IP 10.12.100.171.47555 > 10.12.19.23.8008: Flags [S], seq 2535588393, win 1024, options [mss 1460], length 0
16:13:41.939289 IP 10.12.100.171.47555 > 10.12.19.23.16001: Flags [S], seq 2535588393, win 1024, options [mss 1460], length 0
16:13:41.942403 IP 10.12.100.171.47555 > 10.12.19.23.3351: Flags [S], seq 2535588393, win 1024, options [mss 1460], length 0
16:13:41.942418 IP 10.12.100.171.47555 > 10.12.19.23.515: Flags [S], seq 2535588393, win 1024, options [mss 1460], length 0
16:13:41.944842 IP 10.12.100.171.47554 > 10.12.19.23.8084: Flags [S], seq 2535653928, win 1024, options [mss 1460], length 0
16:13:41.944882 IP 10.12.100.171.47554 > 10.12.19.23.311: Flags [S], seq 2535653928, win 1024, options [mss 1460], length 0
16:13:41.944884 IP 10.12.100.171.47554 > 10.12.19.23.18040: Flags [S], seq 2535653928, win 1024, options [mss 1460], length 0
16:13:41.944885 IP 10.12.100.171.47554 > 10.12.19.23.1840: Flags [S], seq 2535653928, win 1024, options [mss 1460], length 0
16:13:41.944887 IP 10.12.100.171.47554 > 10.12.19.23.1050: Flags [S], seq 2535653928, win 1024, options [mss 1460], length 0
16:13:41.945049 IP 10.12.100.171.47554 > 10.12.19.23.8400: Flags [S], seq 2535653928, win 1024, options [mss 1460], length 0
16:13:41.947544 IP 10.12.100.171.47554 > 10.12.19.23.12000: Flags [S], seq 2535653928, win 1024, options [mss 1460], length 0
16:13:41.989693 IP 10.12.100.171.47554 > 10.12.19.23.5952: Flags [S], seq 2535653928, win 1024, options [mss 1460], length 0
16:13:41.992741 IP 10.12.100.171.47554 > 10.12.19.23.6100: Flags [S], seq 2535653928, win 1024, options [mss 1460], length 0
16:13:41.992748 IP 10.12.100.171.47554 > 10.12.19.23.1049: Flags [S], seq 2535653928, win 1024, options [mss 1460], length 0
16:13:41.995177 IP 10.12.100.171.47555 > 10.12.19.23.8400: Flags [S], seq 2535588393, win 1024, options [mss 1460], length 0
16:13:41.995184 IP 10.12.100.171.47555 > 10.12.19.23.1050: Flags [S], seq 2535588393, win 1024, options [mss 1460], length 0
16:13:41.995186 IP 10.12.100.171.47555 > 10.12.19.23.1840: Flags [S], seq 2535588393, win 1024, options [mss 1460], length 0
16:13:41.995228 IP 10.12.100.171.47555 > 10.12.19.23.18040: Flags [S], seq 2535588393, win 1024, options [mss 1460], length 0
16:13:41.995231 IP 10.12.100.171.47555 > 10.12.19.23.311: Flags [S], seq 2535588393, win 1024, options [mss 1460], length 0
16:13:41.995232 IP 10.12.100.171.47555 > 10.12.19.23.8084: Flags [S], seq 2535588393, win 1024, options [mss 1460], length 0
16:13:41.998055 IP 10.12.100.171.47555 > 10.12.19.23.12000: Flags [S], seq 2535588393, win 1024, options [mss 1460], length 0
16:13:42.039954 IP 10.12.100.171.47555 > 10.12.19.23.5952: Flags [S], seq 2535588393, win 1024, options [mss 1460], length 0
16:13:42.042910 IP 10.12.100.171.47555 > 10.12.19.23.1049: Flags [S], seq 2535588393, win 1024, options [mss 1460], length 0
16:13:42.042918 IP 10.12.100.171.47555 > 10.12.19.23.6100: Flags [S], seq 2535588393, win 1024, options [mss 1460], length 0
16:13:42.045687 IP 10.12.100.171.47554 > 10.12.19.23.2144: Flags [S], seq 2535653928, win 1024, options [mss 1460], length 0
16:13:42.045694 IP 10.12.100.171.47554 > 10.12.19.23.1503: Flags [S], seq 2535653928, win 1024, options [mss 1460], length 0
16:13:42.045740 IP 10.12.100.171.47554 > 10.12.19.23.24444: Flags [S], seq 2535653928, win 1024, options [mss 1460], length 0
16:13:42.045743 IP 10.12.100.171.47554 > 10.12.19.23.27000: Flags [S], seq 2535653928, win 1024, options [mss 1460], length 0
16:13:42.045745 IP 10.12.100.171.47554 > 10.12.19.23.81: Flags [S], seq 2535653928, win 1024, options [mss 1460], length 0
16:13:42.045780 IP 10.12.100.171.47554 > 10.12.19.23.1328: Flags [S], seq 2535653928, win 1024, options [mss 1460], length 0
16:13:42.048515 IP 10.12.100.171.47554 > 10.12.19.23.3546: Flags [S], seq 2535653928, win 1024, options [mss 1460], length 0
16:13:42.090339 IP 10.12.100.171.47554 > 10.12.19.23.6969: Flags [S], seq 2535653928, win 1024, options [mss 1460], length 0
16:13:42.093145 IP 10.12.100.171.47554 > 10.12.19.23.1322: Flags [S], seq 2535653928, win 1024, options [mss 1460], length 0
16:13:42.093152 IP 10.12.100.171.47554 > 10.12.19.23.8222: Flags [S], seq 2535653928, win 1024, options [mss 1460], length 0
16:13:42.095873 IP 10.12.100.171.47555 > 10.12.19.23.1328: Flags [S], seq 2535588393, win 1024, options [mss 1460], length 0
16:13:42.095880 IP 10.12.100.171.47555 > 10.12.19.23.81: Flags [S], seq 2535588393, win 1024, options [mss 1460], length 0
16:13:42.095881 IP 10.12.100.171.47555 > 10.12.19.23.27000: Flags [S], seq 2535588393, win 1024, options [mss 1460], length 0
16:13:42.095922 IP 10.12.100.171.47555 > 10.12.19.23.24444: Flags [S], seq 2535588393, win 1024, options [mss 1460], length 0
16:13:42.095961 IP 10.12.100.171.47555 > 10.12.19.23.1503: Flags [S], seq 2535588393, win 1024, options [mss 1460], length 0
16:13:42.095964 IP 10.12.100.171.47555 > 10.12.19.23.2144: Flags [S], seq 2535588393, win 1024, options [mss 1460], length 0
16:13:42.098733 IP 10.12.100.171.47555 > 10.12.19.23.3546: Flags [S], seq 2535588393, win 1024, options [mss 1460], length 0
16:13:42.140532 IP 10.12.100.171.47555 > 10.12.19.23.6969: Flags [S], seq 2535588393, win 1024, options [mss 1460], length 0
16:13:42.143489 IP 10.12.100.171.47555 > 10.12.19.23.8222: Flags [S], seq 2535588393, win 1024, options [mss 1460], length 0
16:13:42.143504 IP 10.12.100.171.47555 > 10.12.19.23.1322: Flags [S], seq 2535588393, win 1024, options [mss 1460], length 0
16:13:42.145983 IP 10.12.100.171.47554 > 10.12.19.23.2179: Flags [S], seq 2535653928, win 1024, options [mss 1460], length 0
16:13:42.146006 IP 10.12.100.171.47554 > 10.12.19.23.34572: Flags [S], seq 2535653928, win 1024, options [mss 1460], length 0
16:13:42.148366 IP 10.12.100.171.47554 > 10.12.19.23.28201: Flags [S], seq 2535653928, win 1024, options [mss 1460], length 0
16:13:42.148389 IP 10.12.100.171.47554 > 10.12.19.23.1056: Flags [S], seq 2535653928, win 1024, options [mss 1460], length 0
16:13:42.148391 IP 10.12.100.171.47554 > 10.12.19.23.2702: Flags [S], seq 2535653928, win 1024, options [mss 1460], length 0
16:13:42.148392 IP 10.12.100.171.47554 > 10.12.19.23.49155: Flags [S], seq 2535653928, win 1024, options [mss 1460], length 0
16:13:42.150725 IP 10.12.100.171.47554 > 10.12.19.23.6001: Flags [S], seq 2535653928, win 1024, options [mss 1460], length 0
16:13:42.190876 IP 10.12.100.171.47554 > 10.12.19.23.3128: Flags [S], seq 2535653928, win 1024, options [mss 1460], length 0
16:13:42.193891 IP 10.12.100.171.47554 > 10.12.19.23.64680: Flags [S], seq 2535653928, win 1024, options [mss 1460], length 0
16:13:42.193911 IP 10.12.100.171.47554 > 10.12.19.23.1165: Flags [S], seq 2535653928, win 1024, options [mss 1460], length 0
16:13:42.196553 IP 10.12.100.171.47555 > 10.12.19.23.34572: Flags [S], seq 2535588393, win 1024, options [mss 1460], length 0
16:13:42.196560 IP 10.12.100.171.47555 > 10.12.19.23.2179: Flags [S], seq 2535588393, win 1024, options [mss 1460], length 0
16:13:42.198905 IP 10.12.100.171.47555 > 10.12.19.23.49155: Flags [S], seq 2535588393, win 1024, options [mss 1460], length 0
16:13:42.198913 IP 10.12.100.171.47555 > 10.12.19.23.2702: Flags [S], seq 2535588393, win 1024, options [mss 1460], length 0
16:13:42.198915 IP 10.12.100.171.47555 > 10.12.19.23.1056: Flags [S], seq 2535588393, win 1024, options [mss 1460], length 0
16:13:42.198916 IP 10.12.100.171.47555 > 10.12.19.23.28201: Flags [S], seq 2535588393, win 1024, options [mss 1460], length 0
