16:15:56.647538 IP 10.12.254.254 > 224.0.0.13: PIMv2, Hello, length 30
16:15:57.739539 IP 10.12.4.13.57621 > 10.12.255.255.57621: UDP, length 44
16:15:58.561593 ARP, Request who-has 10.12.19.23 (ff:ff:ff:ff:ff:ff) tell 10.12.100.171, length 46
16:15:58.561622 ARP, Reply 10.12.19.23 is-at 08:00:27:d1:82:df, length 28
16:15:58.762377 IP 10.12.100.171.53854 > 10.12.19.23.1025: Flags [S], seq 1652677343, win 29200, options [mss 1460,sackOK,TS val 8577367 ecr 0,nop,wscale 7], length 0
16:15:58.762397 IP 10.12.100.171.34059 > 10.12.19.23.995: Flags [S], seq 949207779, win 29200, options [mss 1460,sackOK,TS val 8577367 ecr 0,nop,wscale 7], length 0
16:15:58.762399 IP 10.12.100.171.44881 > 10.12.19.23.53: Flags [S], seq 3962446337, win 29200, options [mss 1460,sackOK,TS val 8577367 ecr 0,nop,wscale 7], length 0
16:15:58.762400 IP 10.12.100.171.38409 > 10.12.19.23.113: Flags [S], seq 2138192858, win 29200, options [mss 1460,sackOK,TS val 8577367 ecr 0,nop,wscale 7], length 0
16:15:58.762402 IP 10.12.100.171.45211 > 10.12.19.23.80: Flags [S], seq 2569485901, win 29200, options [mss 1460,sackOK,TS val 8577367 ecr 0,nop,wscale 7], length 0
16:15:58.762419 IP 10.12.19.23.80 > 10.12.100.171.45211: Flags [S.], seq 2226701854, ack 2569485902, win 28960, options [mss 1460,sackOK,TS val 1615935491 ecr 8577367,nop,wscale 7], length 0
16:15:58.762431 IP 10.12.100.171.44808 > 10.12.19.23.993: Flags [S], seq 3928400705, win 29200, options [mss 1460,sackOK,TS val 8577367 ecr 0,nop,wscale 7], length 0
16:15:58.762521 IP 10.12.100.171.37006 > 10.12.19.23.1720: Flags [S], seq 1951311615, win 29200, options [mss 1460,sackOK,TS val 8577367 ecr 0,nop,wscale 7], length 0
16:15:58.762525 IP 10.12.100.171.40809 > 10.12.19.23.443: Flags [S], seq 2203212554, win 29200, options [mss 1460,sackOK,TS val 8577367 ecr 0,nop,wscale 7], length 0
16:15:58.762546 IP 10.12.19.23.443 > 10.12.100.171.40809: Flags [R.], seq 0, ack 2203212555, win 0, length 0
16:15:58.762567 IP 10.12.100.171.45211 > 10.12.19.23.80: Flags [.], ack 1, win 229, options [nop,nop,TS val 8577367 ecr 1615935491], length 0
16:15:58.762641 IP 10.12.100.171.49757 > 10.12.19.23.25: Flags [S], seq 2284623989, win 29200, options [mss 1460,sackOK,TS val 8577367 ecr 0,nop,wscale 7], length 0
16:15:58.762762 IP 10.12.100.171.57426 > 10.12.19.23.139: Flags [S], seq 3301403640, win 29200, options [mss 1460,sackOK,TS val 8577367 ecr 0,nop,wscale 7], length 0
16:15:58.762782 IP 10.12.100.171.45211 > 10.12.19.23.80: Flags [R.], seq 1, ack 1, win 229, options [nop,nop,TS val 8577367 ecr 1615935491], length 0
16:15:58.762883 IP 10.12.100.171.55992 > 10.12.19.23.3306: Flags [S], seq 3594573988, win 29200, options [mss 1460,sackOK,TS val 8577367 ecr 0,nop,wscale 7], length 0
16:15:58.762904 IP 10.12.100.171.47917 > 10.12.19.23.8888: Flags [S], seq 718263510, win 29200, options [mss 1460,sackOK,TS val 8577367 ecr 0,nop,wscale 7], length 0
16:15:58.762906 IP 10.12.100.171.59317 > 10.12.19.23.110: Flags [S], seq 2171878243, win 29200, options [mss 1460,sackOK,TS val 8577367 ecr 0,nop,wscale 7], length 0
16:15:58.762907 IP 10.12.100.171.45239 > 10.12.19.23.256: Flags [S], seq 4231064458, win 29200, options [mss 1460,sackOK,TS val 8577367 ecr 0,nop,wscale 7], length 0
16:15:59.762907 IP 10.12.100.171.49757 > 10.12.19.23.25: Flags [S], seq 2284623989, win 29200, options [mss 1460,sackOK,TS val 8577617 ecr 0,nop,wscale 7], length 0
16:15:59.762928 IP 10.12.100.171.57426 > 10.12.19.23.139: Flags [S], seq 3301403640, win 29200, options [mss 1460,sackOK,TS val 8577617 ecr 0,nop,wscale 7], length 0
16:15:59.762930 IP 10.12.100.171.55992 > 10.12.19.23.3306: Flags [S], seq 3594573988, win 29200, options [mss 1460,sackOK,TS val 8577617 ecr 0,nop,wscale 7], length 0
16:15:59.762931 IP 10.12.100.171.47917 > 10.12.19.23.8888: Flags [S], seq 718263510, win 29200, options [mss 1460,sackOK,TS val 8577617 ecr 0,nop,wscale 7], length 0
16:15:59.762970 IP 10.12.100.171.59317 > 10.12.19.23.110: Flags [S], seq 2171878243, win 29200, options [mss 1460,sackOK,TS val 8577617 ecr 0,nop,wscale 7], length 0
16:15:59.762973 IP 10.12.100.171.45239 > 10.12.19.23.256: Flags [S], seq 4231064458, win 29200, options [mss 1460,sackOK,TS val 8577617 ecr 0,nop,wscale 7], length 0
16:15:59.814914 IP 10.12.100.171.45240 > 10.12.19.23.256: Flags [S], seq 933793935, win 29200, options [mss 1460,sackOK,TS val 8577630 ecr 0,nop,wscale 7], length 0
16:15:59.814950 IP 10.12.100.171.59320 > 10.12.19.23.110: Flags [S], seq 1496574708, win 29200, options [mss 1460,sackOK,TS val 8577630 ecr 0,nop,wscale 7], length 0
16:15:59.814952 IP 10.12.100.171.47922 > 10.12.19.23.8888: Flags [S], seq 3151953576, win 29200, options [mss 1460,sackOK,TS val 8577630 ecr 0,nop,wscale 7], length 0
16:15:59.814954 IP 10.12.100.171.55999 > 10.12.19.23.3306: Flags [S], seq 326653072, win 29200, options [mss 1460,sackOK,TS val 8577630 ecr 0,nop,wscale 7], length 0
16:15:59.814955 IP 10.12.100.171.57435 > 10.12.19.23.139: Flags [S], seq 3973805414, win 29200, options [mss 1460,sackOK,TS val 8577630 ecr 0,nop,wscale 7], length 0
16:15:59.815094 IP 10.12.100.171.49768 > 10.12.19.23.25: Flags [S], seq 690782967, win 29200, options [mss 1460,sackOK,TS val 8577630 ecr 0,nop,wscale 7], length 0
16:15:59.815177 IP 10.12.100.171.37020 > 10.12.19.23.1720: Flags [S], seq 2755442787, win 29200, options [mss 1460,sackOK,TS val 8577630 ecr 0,nop,wscale 7], length 0
16:15:59.815243 IP 10.12.100.171.44824 > 10.12.19.23.993: Flags [S], seq 3595991952, win 29200, options [mss 1460,sackOK,TS val 8577630 ecr 0,nop,wscale 7], length 0
16:15:59.815324 IP 10.12.100.171.38428 > 10.12.19.23.113: Flags [S], seq 2294531560, win 29200, options [mss 1460,sackOK,TS val 8577630 ecr 0,nop,wscale 7], length 0
16:15:59.815388 IP 10.12.100.171.44902 > 10.12.19.23.53: Flags [S], seq 1338330705, win 29200, options [mss 1460,sackOK,TS val 8577630 ecr 0,nop,wscale 7], length 0
16:15:59.815467 IP 10.12.100.171.34082 > 10.12.19.23.995: Flags [S], seq 1302612532, win 29200, options [mss 1460,sackOK,TS val 8577630 ecr 0,nop,wscale 7], length 0
16:15:59.815555 IP 10.12.100.171.53879 > 10.12.19.23.1025: Flags [S], seq 641091251, win 29200, options [mss 1460,sackOK,TS val 8577630 ecr 0,nop,wscale 7], length 0
16:15:59.865027 IP 10.12.100.171.45733 > 10.12.19.23.111: Flags [S], seq 2548356991, win 29200, options [mss 1460,sackOK,TS val 8577642 ecr 0,nop,wscale 7], length 0
16:15:59.865050 IP 10.12.100.171.59787 > 10.12.19.23.445: Flags [S], seq 2598995309, win 29200, options [mss 1460,sackOK,TS val 8577642 ecr 0,nop,wscale 7], length 0
16:15:59.865208 IP 10.12.100.171.37754 > 10.12.19.23.199: Flags [S], seq 1759177862, win 29200, options [mss 1460,sackOK,TS val 8577642 ecr 0,nop,wscale 7], length 0
16:15:59.865313 IP 10.12.100.171.35221 > 10.12.19.23.5900: Flags [S], seq 2925626026, win 29200, options [mss 1460,sackOK,TS val 8577642 ecr 0,nop,wscale 7], length 0
16:15:59.865316 IP 10.12.100.171.51813 > 10.12.19.23.8080: Flags [S], seq 2905058847, win 29200, options [mss 1460,sackOK,TS val 8577642 ecr 0,nop,wscale 7], length 0
16:15:59.865397 IP 10.12.100.171.32818 > 10.12.19.23.3389: Flags [S], seq 3074058659, win 29200, options [mss 1460,sackOK,TS val 8577642 ecr 0,nop,wscale 7], length 0
16:15:59.865501 IP 10.12.100.171.56108 > 10.12.19.23.587: Flags [S], seq 1463210265, win 29200, options [mss 1460,sackOK,TS val 8577642 ecr 0,nop,wscale 7], length 0
16:15:59.865505 IP 10.12.100.171.40528 > 10.12.19.23.143: Flags [S], seq 3358060453, win 29200, options [mss 1460,sackOK,TS val 8577642 ecr 0,nop,wscale 7], length 0
16:15:59.865569 IP 10.12.100.171.55380 > 10.12.19.23.554: Flags [S], seq 1308571120, win 29200, options [mss 1460,sackOK,TS val 8577642 ecr 0,nop,wscale 7], length 0
16:15:59.865626 IP 10.12.100.171.46775 > 10.12.19.23.135: Flags [S], seq 3305995880, win 29200, options [mss 1460,sackOK,TS val 8577642 ecr 0,nop,wscale 7], length 0
16:15:59.865650 IP 10.12.100.171.33676 > 10.12.19.23.21: Flags [S], seq 2435873033, win 29200, options [mss 1460,sackOK,TS val 8577642 ecr 0,nop,wscale 7], length 0
16:15:59.865652 IP 10.12.100.171.60606 > 10.12.19.23.22: Flags [S], seq 1732435027, win 29200, options [mss 1460,sackOK,TS val 8577642 ecr 0,nop,wscale 7], length 0
16:15:59.915264 IP 10.12.100.171.37764 > 10.12.19.23.199: Flags [S], seq 2386573918, win 29200, options [mss 1460,sackOK,TS val 8577655 ecr 0,nop,wscale 7], length 0
16:15:59.915278 IP 10.12.100.171.59799 > 10.12.19.23.445: Flags [S], seq 2463147315, win 29200, options [mss 1460,sackOK,TS val 8577655 ecr 0,nop,wscale 7], length 0
16:15:59.915280 IP 10.12.100.171.45747 > 10.12.19.23.111: Flags [S], seq 284379557, win 29200, options [mss 1460,sackOK,TS val 8577655 ecr 0,nop,wscale 7], length 0
16:15:59.915361 IP 10.12.100.171.35233 > 10.12.19.23.5900: Flags [S], seq 2092683234, win 29200, options [mss 1460,sackOK,TS val 8577655 ecr 0,nop,wscale 7], length 0
16:15:59.915365 IP 10.12.100.171.51825 > 10.12.19.23.8080: Flags [S], seq 1106401351, win 29200, options [mss 1460,sackOK,TS val 8577655 ecr 0,nop,wscale 7], length 0
16:15:59.915367 IP 10.12.100.171.32830 > 10.12.19.23.3389: Flags [S], seq 630080904, win 29200, options [mss 1460,sackOK,TS val 8577655 ecr 0,nop,wscale 7], length 0
16:15:59.915513 IP 10.12.100.171.56120 > 10.12.19.23.587: Flags [S], seq 3046134397, win 29200, options [mss 1460,sackOK,TS val 8577655 ecr 0,nop,wscale 7], length 0
16:15:59.915521 IP 10.12.100.171.40540 > 10.12.19.23.143: Flags [S], seq 3169217526, win 29200, options [mss 1460,sackOK,TS val 8577655 ecr 0,nop,wscale 7], length 0
16:15:59.915619 IP 10.12.100.171.55392 > 10.12.19.23.554: Flags [S], seq 2871780869, win 29200, options [mss 1460,sackOK,TS val 8577655 ecr 0,nop,wscale 7], length 0
16:15:59.915640 IP 10.12.100.171.46787 > 10.12.19.23.135: Flags [S], seq 1217146419, win 29200, options [mss 1460,sackOK,TS val 8577655 ecr 0,nop,wscale 7], length 0
16:15:59.915686 IP 10.12.100.171.60617 > 10.12.19.23.22: Flags [S], seq 4212463634, win 29200, options [mss 1460,sackOK,TS val 8577655 ecr 0,nop,wscale 7], length 0
16:15:59.915755 IP 10.12.100.171.33689 > 10.12.19.23.21: Flags [S], seq 494887483, win 29200, options [mss 1460,sackOK,TS val 8577655 ecr 0,nop,wscale 7], length 0
16:15:59.965246 IP 10.12.100.171.51891 > 10.12.19.23.1723: Flags [S], seq 3917893953, win 29200, options [mss 1460,sackOK,TS val 8577667 ecr 0,nop,wscale 7], length 0
16:15:59.965255 IP 10.12.100.171.46480 > 10.12.19.23.23: Flags [S], seq 1873713191, win 29200, options [mss 1460,sackOK,TS val 8577667 ecr 0,nop,wscale 7], length 0
16:15:59.965292 IP 10.12.100.171.46693 > 10.12.19.23.464: Flags [S], seq 460175700, win 29200, options [mss 1460,sackOK,TS val 8577667 ecr 0,nop,wscale 7], length 0
16:15:59.965295 IP 10.12.100.171.40126 > 10.12.19.23.1434: Flags [S], seq 554193419, win 29200, options [mss 1460,sackOK,TS val 8577667 ecr 0,nop,wscale 7], length 0
16:15:59.965351 IP 10.12.100.171.52050 > 10.12.19.23.6001: Flags [S], seq 918048966, win 29200, options [mss 1460,sackOK,TS val 8577667 ecr 0,nop,wscale 7], length 0
16:15:59.965354 IP 10.12.100.171.54354 > 10.12.19.23.3659: Flags [S], seq 3598202506, win 29200, options [mss 1460,sackOK,TS val 8577667 ecr 0,nop,wscale 7], length 0
16:15:59.965521 IP 10.12.100.171.43279 > 10.12.19.23.32773: Flags [S], seq 2710109906, win 29200, options [mss 1460,sackOK,TS val 8577667 ecr 0,nop,wscale 7], length 0
16:15:59.965529 IP 10.12.100.171.37315 > 10.12.19.23.2121: Flags [S], seq 3663281762, win 29200, options [mss 1460,sackOK,TS val 8577667 ecr 0,nop,wscale 7], length 0
16:15:59.965621 IP 10.12.100.171.35094 > 10.12.19.23.7800: Flags [S], seq 3158069101, win 29200, options [mss 1460,sackOK,TS val 8577667 ecr 0,nop,wscale 7], length 0
16:15:59.965629 IP 10.12.100.171.60336 > 10.12.19.23.726: Flags [S], seq 774930882, win 29200, options [mss 1460,sackOK,TS val 8577667 ecr 0,nop,wscale 7], length 0
16:15:59.965716 IP 10.12.100.171.52083 > 10.12.19.23.992: Flags [S], seq 2295652155, win 29200, options [mss 1460,sackOK,TS val 8577667 ecr 0,nop,wscale 7], length 0
16:15:59.965767 IP 10.12.100.171.49440 > 10.12.19.23.9999: Flags [S], seq 178237263, win 29200, options [mss 1460,sackOK,TS val 8577667 ecr 0,nop,wscale 7], length 0
16:16:00.015608 IP 10.12.100.171.40864 > 10.12.19.23.443: Flags [S], seq 315705220, win 29200, options [mss 1460,sackOK,TS val 8577680 ecr 0,nop,wscale 7], length 0
16:16:00.015639 IP 10.12.19.23.443 > 10.12.100.171.40864: Flags [R.], seq 0, ack 315705221, win 0, length 0
16:16:00.015652 IP 10.12.100.171.54362 > 10.12.19.23.3659: Flags [S], seq 989279807, win 29200, options [mss 1460,sackOK,TS val 8577680 ecr 0,nop,wscale 7], length 0
16:16:00.015656 IP 10.12.100.171.52060 > 10.12.19.23.6001: Flags [S], seq 2122970305, win 29200, options [mss 1460,sackOK,TS val 8577680 ecr 0,nop,wscale 7], length 0
16:16:00.015657 IP 10.12.100.171.40138 > 10.12.19.23.1434: Flags [S], seq 2895692916, win 29200, options [mss 1460,sackOK,TS val 8577680 ecr 0,nop,wscale 7], length 0
16:16:00.015659 IP 10.12.100.171.46707 > 10.12.19.23.464: Flags [S], seq 3471679409, win 29200, options [mss 1460,sackOK,TS val 8577680 ecr 0,nop,wscale 7], length 0
16:16:00.015661 IP 10.12.100.171.46496 > 10.12.19.23.23: Flags [S], seq 2618244204, win 29200, options [mss 1460,sackOK,TS val 8577680 ecr 0,nop,wscale 7], length 0
16:16:00.015772 IP 10.12.100.171.52091 > 10.12.19.23.992: Flags [S], seq 3676722313, win 29200, options [mss 1460,sackOK,TS val 8577680 ecr 0,nop,wscale 7], length 0
16:16:00.015876 IP 10.12.100.171.60346 > 10.12.19.23.726: Flags [S], seq 806854945, win 29200, options [mss 1460,sackOK,TS val 8577680 ecr 0,nop,wscale 7], length 0
16:16:00.015885 IP 10.12.100.171.35106 > 10.12.19.23.7800: Flags [S], seq 1302889980, win 29200, options [mss 1460,sackOK,TS val 8577680 ecr 0,nop,wscale 7], length 0
16:16:00.015887 IP 10.12.100.171.37329 > 10.12.19.23.2121: Flags [S], seq 2380283115, win 29200, options [mss 1460,sackOK,TS val 8577680 ecr 0,nop,wscale 7], length 0
16:16:00.015888 IP 10.12.100.171.43295 > 10.12.19.23.32773: Flags [S], seq 3836388729, win 29200, options [mss 1460,sackOK,TS val 8577680 ecr 0,nop,wscale 7], length 0
16:16:00.016042 IP 10.12.100.171.49452 > 10.12.19.23.9999: Flags [S], seq 173916477, win 29200, options [mss 1460,sackOK,TS val 8577680 ecr 0,nop,wscale 7], length 0
16:16:00.016062 IP 10.12.100.171.51915 > 10.12.19.23.1723: Flags [S], seq 1286800776, win 29200, options [mss 1460,sackOK,TS val 8577680 ecr 0,nop,wscale 7], length 0
16:16:00.016064 IP 10.12.100.171.59127 > 10.12.19.23.3031: Flags [S], seq 3148524620, win 29200, options [mss 1460,sackOK,TS val 8577680 ecr 0,nop,wscale 7], length 0
16:16:00.016065 IP 10.12.100.171.32805 > 10.12.19.23.255: Flags [S], seq 2110461982, win 29200, options [mss 1460,sackOK,TS val 8577680 ecr 0,nop,wscale 7], length 0
16:16:00.016111 IP 10.12.100.171.56232 > 10.12.19.23.3871: Flags [S], seq 2269059723, win 29200, options [mss 1460,sackOK,TS val 8577680 ecr 0,nop,wscale 7], length 0
16:16:00.016158 IP 10.12.100.171.55429 > 10.12.19.23.1001: Flags [S], seq 2191618508, win 29200, options [mss 1460,sackOK,TS val 8577680 ecr 0,nop,wscale 7], length 0
16:16:00.016162 IP 10.12.100.171.38957 > 10.12.19.23.8011: Flags [S], seq 4205313131, win 29200, options [mss 1460,sackOK,TS val 8577680 ecr 0,nop,wscale 7], length 0
16:16:00.016163 IP 10.12.100.171.32967 > 10.12.19.23.5190: Flags [S], seq 712284121, win 29200, options [mss 1460,sackOK,TS val 8577680 ecr 0,nop,wscale 7], length 0
16:16:00.016165 IP 10.12.100.171.49377 > 10.12.19.23.51493: Flags [S], seq 2464378822, win 29200, options [mss 1460,sackOK,TS val 8577680 ecr 0,nop,wscale 7], length 0
16:16:00.016224 IP 10.12.100.171.33875 > 10.12.19.23.19101: Flags [S], seq 1118334847, win 29200, options [mss 1460,sackOK,TS val 8577680 ecr 0,nop,wscale 7], length 0
16:16:00.016227 IP 10.12.100.171.37922 > 10.12.19.23.32775: Flags [S], seq 3351917358, win 29200, options [mss 1460,sackOK,TS val 8577680 ecr 0,nop,wscale 7], length 0
16:16:00.016229 IP 10.12.100.171.40589 > 10.12.19.23.32778: Flags [S], seq 1169635017, win 29200, options [mss 1460,sackOK,TS val 8577680 ecr 0,nop,wscale 7], length 0
16:16:00.016296 IP 10.12.100.171.39390 > 10.12.19.23.6788: Flags [S], seq 1023260558, win 29200, options [mss 1460,sackOK,TS val 8577680 ecr 0,nop,wscale 7], length 0
16:16:00.016299 IP 10.12.100.171.40775 > 10.12.19.23.6543: Flags [S], seq 4113299769, win 29200, options [mss 1460,sackOK,TS val 8577680 ecr 0,nop,wscale 7], length 0
16:16:00.016301 IP 10.12.100.171.57297 > 10.12.19.23.4003: Flags [S], seq 1360445293, win 29200, options [mss 1460,sackOK,TS val 8577680 ecr 0,nop,wscale 7], length 0
16:16:00.016433 IP 10.12.100.171.56933 > 10.12.19.23.9535: Flags [S], seq 3451634533, win 29200, options [mss 1460,sackOK,TS val 8577680 ecr 0,nop,wscale 7], length 0
16:16:00.016440 IP 10.12.100.171.49062 > 10.12.19.23.32785: Flags [S], seq 4043333794, win 29200, options [mss 1460,sackOK,TS val 8577680 ecr 0,nop,wscale 7], length 0
16:16:00.016441 IP 10.12.100.171.37660 > 10.12.19.23.8007: Flags [S], seq 401693987, win 29200, options [mss 1460,sackOK,TS val 8577680 ecr 0,nop,wscale 7], length 0
16:16:00.016443 IP 10.12.100.171.54783 > 10.12.19.23.6100: Flags [S], seq 1036518498, win 29200, options [mss 1460,sackOK,TS val 8577680 ecr 0,nop,wscale 7], length 0
16:16:00.016504 IP 10.12.100.171.44329 > 10.12.19.23.497: Flags [S], seq 3700863686, win 29200, options [mss 1460,sackOK,TS val 8577680 ecr 0,nop,wscale 7], length 0
16:16:00.016508 IP 10.12.100.171.33506 > 10.12.19.23.3268: Flags [S], seq 1870273315, win 29200, options [mss 1460,sackOK,TS val 8577680 ecr 0,nop,wscale 7], length 0
16:16:00.016522 IP 10.12.100.171.34254 > 10.12.19.23.4444: Flags [S], seq 2826375857, win 29200, options [mss 1460,sackOK,TS val 8577680 ecr 0,nop,wscale 7], length 0
16:16:00.016663 IP 10.12.100.171.35369 > 10.12.19.23.425: Flags [S], seq 3623392908, win 29200, options [mss 1460,sackOK,TS val 8577680 ecr 0,nop,wscale 7], length 0
16:16:00.016666 IP 10.12.100.171.34868 > 10.12.19.23.16113: Flags [S], seq 530396921, win 29200, options [mss 1460,sackOK,TS val 8577680 ecr 0,nop,wscale 7], length 0
16:16:00.016668 IP 10.12.100.171.54727 > 10.12.19.23.1031: Flags [S], seq 1388696035, win 29200, options [mss 1460,sackOK,TS val 8577680 ecr 0,nop,wscale 7], length 0
16:16:00.016786 IP 10.12.100.171.35892 > 10.12.19.23.50006: Flags [S], seq 2753926134, win 29200, options [mss 1460,sackOK,TS val 8577680 ecr 0,nop,wscale 7], length 0
16:16:00.016793 IP 10.12.100.171.47093 > 10.12.19.23.1052: Flags [S], seq 2609557841, win 29200, options [mss 1460,sackOK,TS val 8577680 ecr 0,nop,wscale 7], length 0
16:16:00.016795 IP 10.12.100.171.56899 > 10.12.19.23.7200: Flags [S], seq 1083759720, win 29200, options [mss 1460,sackOK,TS val 8577680 ecr 0,nop,wscale 7], length 0
16:16:00.016861 IP 10.12.100.171.51524 > 10.12.19.23.10012: Flags [S], seq 2700228570, win 29200, options [mss 1460,sackOK,TS val 8577680 ecr 0,nop,wscale 7], length 0
16:16:00.016868 IP 10.12.100.171.57304 > 10.12.19.23.1032: Flags [S], seq 1813599134, win 29200, options [mss 1460,sackOK,TS val 8577680 ecr 0,nop,wscale 7], length 0
16:16:00.016870 IP 10.12.100.171.33347 > 10.12.19.23.163: Flags [S], seq 471971232, win 29200, options [mss 1460,sackOK,TS val 8577680 ecr 0,nop,wscale 7], length 0
16:16:00.016950 IP 10.12.100.171.37788 > 10.12.19.23.9100: Flags [S], seq 143266162, win 29200, options [mss 1460,sackOK,TS val 8577680 ecr 0,nop,wscale 7], length 0
16:16:00.016953 IP 10.12.100.171.46082 > 10.12.19.23.7676: Flags [S], seq 3670626052, win 29200, options [mss 1460,sackOK,TS val 8577680 ecr 0,nop,wscale 7], length 0
16:16:00.016955 IP 10.12.100.171.38026 > 10.12.19.23.4343: Flags [S], seq 1615624321, win 29200, options [mss 1460,sackOK,TS val 8577680 ecr 0,nop,wscale 7], length 0
16:16:00.017032 IP 10.12.100.171.42360 > 10.12.19.23.1863: Flags [S], seq 4076586888, win 29200, options [mss 1460,sackOK,TS val 8577680 ecr 0,nop,wscale 7], length 0
16:16:00.017035 IP 10.12.100.171.33155 > 10.12.19.23.2045: Flags [S], seq 1296240093, win 29200, options [mss 1460,sackOK,TS val 8577680 ecr 0,nop,wscale 7], length 0
16:16:00.017037 IP 10.12.100.171.56454 > 10.12.19.23.8600: Flags [S], seq 2624309345, win 29200, options [mss 1460,sackOK,TS val 8577680 ecr 0,nop,wscale 7], length 0
16:16:00.017082 IP 10.12.100.171.37497 > 10.12.19.23.1503: Flags [S], seq 3081656563, win 29200, options [mss 1460,sackOK,TS val 8577680 ecr 0,nop,wscale 7], length 0
16:16:00.017085 IP 10.12.100.171.34976 > 10.12.19.23.49163: Flags [S], seq 465443706, win 29200, options [mss 1460,sackOK,TS val 8577680 ecr 0,nop,wscale 7], length 0
16:16:00.017130 IP 10.12.100.171.51222 > 10.12.19.23.5269: Flags [S], seq 121928490, win 29200, options [mss 1460,sackOK,TS val 8577680 ecr 0,nop,wscale 7], length 0
16:16:00.017133 IP 10.12.100.171.40950 > 10.12.19.23.49156: Flags [S], seq 1229386187, win 29200, options [mss 1460,sackOK,TS val 8577680 ecr 0,nop,wscale 7], length 0
16:16:00.017168 IP 10.12.100.171.60466 > 10.12.19.23.5910: Flags [S], seq 2405823395, win 29200, options [mss 1460,sackOK,TS val 8577680 ecr 0,nop,wscale 7], length 0
16:16:00.017209 IP 10.12.100.171.37030 > 10.12.19.23.3006: Flags [S], seq 472833949, win 29200, options [mss 1460,sackOK,TS val 8577680 ecr 0,nop,wscale 7], length 0
16:16:00.017212 IP 10.12.100.171.34445 > 10.12.19.23.3546: Flags [S], seq 4040832224, win 29200, options [mss 1460,sackOK,TS val 8577680 ecr 0,nop,wscale 7], length 0
16:16:00.017253 IP 10.12.100.171.49074 > 10.12.19.23.32770: Flags [S], seq 3466026406, win 29200, options [mss 1460,sackOK,TS val 8577680 ecr 0,nop,wscale 7], length 0
16:16:00.017256 IP 10.12.100.171.47939 > 10.12.19.23.912: Flags [S], seq 3410460986, win 29200, options [mss 1460,sackOK,TS val 8577680 ecr 0,nop,wscale 7], length 0
16:16:00.017296 IP 10.12.100.171.35396 > 10.12.19.23.1022: Flags [S], seq 2428122871, win 29200, options [mss 1460,sackOK,TS val 8577680 ecr 0,nop,wscale 7], length 0
16:16:00.017299 IP 10.12.100.171.33635 > 10.12.19.23.8085: Flags [S], seq 2188058532, win 29200, options [mss 1460,sackOK,TS val 8577680 ecr 0,nop,wscale 7], length 0
16:16:00.017332 IP 10.12.100.171.56011 > 10.12.19.23.1082: Flags [S], seq 1548492262, win 29200, options [mss 1460,sackOK,TS val 8577680 ecr 0,nop,wscale 7], length 0
16:16:00.017371 IP 10.12.100.171.33743 > 10.12.19.23.1046: Flags [S], seq 1081094301, win 29200, options [mss 1460,sackOK,TS val 8577680 ecr 0,nop,wscale 7], length 0
16:16:00.017377 IP 10.12.100.171.36225 > 10.12.19.23.1141: Flags [S], seq 538271652, win 29200, options [mss 1460,sackOK,TS val 8577680 ecr 0,nop,wscale 7], length 0
16:16:00.017415 IP 10.12.100.171.43398 > 10.12.19.23.3260: Flags [S], seq 1920948676, win 29200, options [mss 1460,sackOK,TS val 8577680 ecr 0,nop,wscale 7], length 0
16:16:00.017418 IP 10.12.100.171.36597 > 10.12.19.23.2393: Flags [S], seq 2821477244, win 29200, options [mss 1460,sackOK,TS val 8577680 ecr 0,nop,wscale 7], length 0
16:16:00.017461 IP 10.12.100.171.54525 > 10.12.19.23.15004: Flags [S], seq 42432571, win 29200, options [mss 1460,sackOK,TS val 8577680 ecr 0,nop,wscale 7], length 0
16:16:00.017501 IP 10.12.100.171.59083 > 10.12.19.23.6580: Flags [S], seq 440476162, win 29200, options [mss 1460,sackOK,TS val 8577680 ecr 0,nop,wscale 7], length 0
16:16:00.017505 IP 10.12.100.171.60137 > 10.12.19.23.2718: Flags [S], seq 3162376065, win 29200, options [mss 1460,sackOK,TS val 8577680 ecr 0,nop,wscale 7], length 0
16:16:00.017544 IP 10.12.100.171.54053 > 10.12.19.23.5033: Flags [S], seq 1623480444, win 29200, options [mss 1460,sackOK,TS val 8577680 ecr 0,nop,wscale 7], length 0
16:16:00.017547 IP 10.12.100.171.46813 > 10.12.19.23.843: Flags [S], seq 809935583, win 29200, options [mss 1460,sackOK,TS val 8577680 ecr 0,nop,wscale 7], length 0
16:16:00.017589 IP 10.12.100.171.42378 > 10.12.19.23.13783: Flags [S], seq 497160918, win 29200, options [mss 1460,sackOK,TS val 8577680 ecr 0,nop,wscale 7], length 0
16:16:00.017592 IP 10.12.100.171.36237 > 10.12.19.23.17988: Flags [S], seq 970072318, win 29200, options [mss 1460,sackOK,TS val 8577680 ecr 0,nop,wscale 7], length 0
16:16:00.017631 IP 10.12.100.171.40436 > 10.12.19.23.70: Flags [S], seq 1175740990, win 29200, options [mss 1460,sackOK,TS val 8577680 ecr 0,nop,wscale 7], length 0
16:16:00.017634 IP 10.12.100.171.50321 > 10.12.19.23.40193: Flags [S], seq 2351553989, win 29200, options [mss 1460,sackOK,TS val 8577680 ecr 0,nop,wscale 7], length 0
16:16:00.017667 IP 10.12.100.171.40875 > 10.12.19.23.14000: Flags [S], seq 1453063740, win 29200, options [mss 1460,sackOK,TS val 8577680 ecr 0,nop,wscale 7], length 0
16:16:00.017706 IP 10.12.100.171.38468 > 10.12.19.23.3878: Flags [S], seq 1789726046, win 29200, options [mss 1460,sackOK,TS val 8577680 ecr 0,nop,wscale 7], length 0
16:16:00.065690 IP 10.12.100.171.48706 > 10.12.19.23.1236: Flags [S], seq 2419924269, win 29200, options [mss 1460,sackOK,TS val 8577692 ecr 0,nop,wscale 7], length 0
16:16:00.065741 IP 10.12.100.171.58491 > 10.12.19.23.8010: Flags [S], seq 1903723093, win 29200, options [mss 1460,sackOK,TS val 8577692 ecr 0,nop,wscale 7], length 0
16:16:00.065743 IP 10.12.100.171.48208 > 10.12.19.23.6789: Flags [S], seq 2401386973, win 29200, options [mss 1460,sackOK,TS val 8577692 ecr 0,nop,wscale 7], length 0
16:16:00.065745 IP 10.12.100.171.35177 > 10.12.19.23.2492: Flags [S], seq 756772035, win 29200, options [mss 1460,sackOK,TS val 8577692 ecr 0,nop,wscale 7], length 0
16:16:00.065796 IP 10.12.100.171.54420 > 10.12.19.23.8193: Flags [S], seq 649639469, win 29200, options [mss 1460,sackOK,TS val 8577692 ecr 0,nop,wscale 7], length 0
16:16:00.065895 IP 10.12.100.171.36805 > 10.12.19.23.1148: Flags [S], seq 775842086, win 29200, options [mss 1460,sackOK,TS val 8577693 ecr 0,nop,wscale 7], length 0
16:16:00.065980 IP 10.12.100.171.43781 > 10.12.19.23.4443: Flags [S], seq 3535396416, win 29200, options [mss 1460,sackOK,TS val 8577693 ecr 0,nop,wscale 7], length 0
16:16:00.065983 IP 10.12.100.171.32894 > 10.12.19.23.6003: Flags [S], seq 2634612955, win 29200, options [mss 1460,sackOK,TS val 8577693 ecr 0,nop,wscale 7], length 0
16:16:00.066041 IP 10.12.100.171.56847 > 10.12.19.23.1666: Flags [S], seq 870737785, win 29200, options [mss 1460,sackOK,TS val 8577693 ecr 0,nop,wscale 7], length 0
16:16:00.066057 IP 10.12.100.171.32875 > 10.12.19.23.255: Flags [S], seq 365791141, win 29200, options [mss 1460,sackOK,TS val 8577693 ecr 0,nop,wscale 7], length 0
16:16:00.066140 IP 10.12.100.171.59199 > 10.12.19.23.3031: Flags [S], seq 197770674, win 29200, options [mss 1460,sackOK,TS val 8577693 ecr 0,nop,wscale 7], length 0
16:16:00.066144 IP 10.12.100.171.54505 > 10.12.19.23.1037: Flags [S], seq 3264392277, win 29200, options [mss 1460,sackOK,TS val 8577693 ecr 0,nop,wscale 7], length 0
16:16:00.066209 IP 10.12.100.171.55823 > 10.12.19.23.82: Flags [S], seq 600326572, win 29200, options [mss 1460,sackOK,TS val 8577693 ecr 0,nop,wscale 7], length 0
16:16:00.066225 IP 10.12.100.171.51582 > 10.12.19.23.2006: Flags [S], seq 1392506228, win 29200, options [mss 1460,sackOK,TS val 8577693 ecr 0,nop,wscale 7], length 0
16:16:00.066335 IP 10.12.100.171.40656 > 10.12.19.23.32778: Flags [S], seq 4168970112, win 29200, options [mss 1460,sackOK,TS val 8577693 ecr 0,nop,wscale 7], length 0
16:16:00.066344 IP 10.12.100.171.37991 > 10.12.19.23.32775: Flags [S], seq 946166010, win 29200, options [mss 1460,sackOK,TS val 8577693 ecr 0,nop,wscale 7], length 0
16:16:00.066346 IP 10.12.100.171.33946 > 10.12.19.23.19101: Flags [S], seq 1297899238, win 29200, options [mss 1460,sackOK,TS val 8577693 ecr 0,nop,wscale 7], length 0
16:16:00.066428 IP 10.12.100.171.49450 > 10.12.19.23.51493: Flags [S], seq 2951115015, win 29200, options [mss 1460,sackOK,TS val 8577693 ecr 0,nop,wscale 7], length 0
16:16:00.066431 IP 10.12.100.171.33042 > 10.12.19.23.5190: Flags [S], seq 1626128792, win 29200, options [mss 1460,sackOK,TS val 8577693 ecr 0,nop,wscale 7], length 0
16:16:00.066502 IP 10.12.100.171.39034 > 10.12.19.23.8011: Flags [S], seq 3131271731, win 29200, options [mss 1460,sackOK,TS val 8577693 ecr 0,nop,wscale 7], length 0
16:16:00.066505 IP 10.12.100.171.55508 > 10.12.19.23.1001: Flags [S], seq 3358969953, win 29200, options [mss 1460,sackOK,TS val 8577693 ecr 0,nop,wscale 7], length 0
16:16:00.066573 IP 10.12.100.171.56313 > 10.12.19.23.3871: Flags [S], seq 508436691, win 29200, options [mss 1460,sackOK,TS val 8577693 ecr 0,nop,wscale 7], length 0
16:16:00.066614 IP 10.12.100.171.35433 > 10.12.19.23.425: Flags [S], seq 2477092626, win 29200, options [mss 1460,sackOK,TS val 8577693 ecr 0,nop,wscale 7], length 0
16:16:00.066669 IP 10.12.100.171.34320 > 10.12.19.23.4444: Flags [S], seq 1181253877, win 29200, options [mss 1460,sackOK,TS val 8577693 ecr 0,nop,wscale 7], length 0
16:16:00.066687 IP 10.12.100.171.33574 > 10.12.19.23.3268: Flags [S], seq 2301514394, win 29200, options [mss 1460,sackOK,TS val 8577693 ecr 0,nop,wscale 7], length 0
16:16:00.066740 IP 10.12.100.171.44399 > 10.12.19.23.497: Flags [S], seq 1376128570, win 29200, options [mss 1460,sackOK,TS val 8577693 ecr 0,nop,wscale 7], length 0
16:16:00.066758 IP 10.12.100.171.54855 > 10.12.19.23.6100: Flags [S], seq 3915943834, win 29200, options [mss 1460,sackOK,TS val 8577693 ecr 0,nop,wscale 7], length 0
16:16:00.066859 IP 10.12.100.171.37734 > 10.12.19.23.8007: Flags [S], seq 3152748260, win 29200, options [mss 1460,sackOK,TS val 8577693 ecr 0,nop,wscale 7], length 0
16:16:00.066863 IP 10.12.100.171.49138 > 10.12.19.23.32785: Flags [S], seq 3079969055, win 29200, options [mss 1460,sackOK,TS val 8577693 ecr 0,nop,wscale 7], length 0
16:16:00.066942 IP 10.12.100.171.57011 > 10.12.19.23.9535: Flags [S], seq 2590941325, win 29200, options [mss 1460,sackOK,TS val 8577693 ecr 0,nop,wscale 7], length 0
16:16:00.066958 IP 10.12.100.171.57377 > 10.12.19.23.4003: Flags [S], seq 1824361889, win 29200, options [mss 1460,sackOK,TS val 8577693 ecr 0,nop,wscale 7], length 0
16:16:00.067000 IP 10.12.100.171.40857 > 10.12.19.23.6543: Flags [S], seq 481781094, win 29200, options [mss 1460,sackOK,TS val 8577693 ecr 0,nop,wscale 7], length 0
16:16:00.067003 IP 10.12.100.171.39474 > 10.12.19.23.6788: Flags [S], seq 2715998392, win 29200, options [mss 1460,sackOK,TS val 8577693 ecr 0,nop,wscale 7], length 0
16:16:00.067043 IP 10.12.100.171.33217 > 10.12.19.23.2045: Flags [S], seq 721198852, win 29200, options [mss 1460,sackOK,TS val 8577693 ecr 0,nop,wscale 7], length 0
16:16:00.067089 IP 10.12.100.171.42424 > 10.12.19.23.1863: Flags [S], seq 3893110419, win 29200, options [mss 1460,sackOK,TS val 8577693 ecr 0,nop,wscale 7], length 0
16:16:00.067092 IP 10.12.100.171.38092 > 10.12.19.23.4343: Flags [S], seq 998736359, win 29200, options [mss 1460,sackOK,TS val 8577693 ecr 0,nop,wscale 7], length 0
16:16:00.067128 IP 10.12.100.171.46150 > 10.12.19.23.7676: Flags [S], seq 1207683154, win 29200, options [mss 1460,sackOK,TS val 8577693 ecr 0,nop,wscale 7], length 0
16:16:00.067171 IP 10.12.100.171.37858 > 10.12.19.23.9100: Flags [S], seq 219490330, win 29200, options [mss 1460,sackOK,TS val 8577693 ecr 0,nop,wscale 7], length 0
16:16:00.067174 IP 10.12.100.171.33419 > 10.12.19.23.163: Flags [S], seq 233714417, win 29200, options [mss 1460,sackOK,TS val 8577693 ecr 0,nop,wscale 7], length 0
16:16:00.067214 IP 10.12.100.171.57378 > 10.12.19.23.1032: Flags [S], seq 949044860, win 29200, options [mss 1460,sackOK,TS val 8577693 ecr 0,nop,wscale 7], length 0
16:16:00.067218 IP 10.12.100.171.51600 > 10.12.19.23.10012: Flags [S], seq 959199462, win 29200, options [mss 1460,sackOK,TS val 8577693 ecr 0,nop,wscale 7], length 0
16:16:00.067258 IP 10.12.100.171.56977 > 10.12.19.23.7200: Flags [S], seq 501133421, win 29200, options [mss 1460,sackOK,TS val 8577693 ecr 0,nop,wscale 7], length 0
16:16:00.067261 IP 10.12.100.171.47173 > 10.12.19.23.1052: Flags [S], seq 3404335298, win 29200, options [mss 1460,sackOK,TS val 8577693 ecr 0,nop,wscale 7], length 0
16:16:00.067302 IP 10.12.100.171.35974 > 10.12.19.23.50006: Flags [S], seq 2543073191, win 29200, options [mss 1460,sackOK,TS val 8577693 ecr 0,nop,wscale 7], length 0
16:16:00.067305 IP 10.12.100.171.54811 > 10.12.19.23.1031: Flags [S], seq 2475778188, win 29200, options [mss 1460,sackOK,TS val 8577693 ecr 0,nop,wscale 7], length 0
16:16:00.067378 IP 10.12.100.171.34954 > 10.12.19.23.16113: Flags [S], seq 115970464, win 29200, options [mss 1460,sackOK,TS val 8577693 ecr 0,nop,wscale 7], length 0
16:16:00.067382 IP 10.12.100.171.33804 > 10.12.19.23.1046: Flags [S], seq 642180731, win 29200, options [mss 1460,sackOK,TS val 8577693 ecr 0,nop,wscale 7], length 0
16:16:00.067423 IP 10.12.100.171.56074 > 10.12.19.23.1082: Flags [S], seq 3032860845, win 29200, options [mss 1460,sackOK,TS val 8577693 ecr 0,nop,wscale 7], length 0
16:16:00.067427 IP 10.12.100.171.33700 > 10.12.19.23.8085: Flags [S], seq 2677789319, win 29200, options [mss 1460,sackOK,TS val 8577693 ecr 0,nop,wscale 7], length 0
16:16:00.067467 IP 10.12.100.171.35463 > 10.12.19.23.1022: Flags [S], seq 368045144, win 29200, options [mss 1460,sackOK,TS val 8577693 ecr 0,nop,wscale 7], length 0
16:16:00.067471 IP 10.12.100.171.48008 > 10.12.19.23.912: Flags [S], seq 3233573569, win 29200, options [mss 1460,sackOK,TS val 8577693 ecr 0,nop,wscale 7], length 0
16:16:00.067515 IP 10.12.100.171.49145 > 10.12.19.23.32770: Flags [S], seq 113412543, win 29200, options [mss 1460,sackOK,TS val 8577693 ecr 0,nop,wscale 7], length 0
16:16:00.067518 IP 10.12.100.171.34518 > 10.12.19.23.3546: Flags [S], seq 4064632034, win 29200, options [mss 1460,sackOK,TS val 8577693 ecr 0,nop,wscale 7], length 0
16:16:00.067559 IP 10.12.100.171.37105 > 10.12.19.23.3006: Flags [S], seq 3421170061, win 29200, options [mss 1460,sackOK,TS val 8577693 ecr 0,nop,wscale 7], length 0
16:16:00.067562 IP 10.12.100.171.60543 > 10.12.19.23.5910: Flags [S], seq 3386640824, win 29200, options [mss 1460,sackOK,TS val 8577693 ecr 0,nop,wscale 7], length 0
16:16:00.067604 IP 10.12.100.171.41029 > 10.12.19.23.49156: Flags [S], seq 2806857615, win 29200, options [mss 1460,sackOK,TS val 8577693 ecr 0,nop,wscale 7], length 0
16:16:00.067608 IP 10.12.100.171.51303 > 10.12.19.23.5269: Flags [S], seq 2098674461, win 29200, options [mss 1460,sackOK,TS val 8577693 ecr 0,nop,wscale 7], length 0
16:16:00.067651 IP 10.12.100.171.35059 > 10.12.19.23.49163: Flags [S], seq 4238350523, win 29200, options [mss 1460,sackOK,TS val 8577693 ecr 0,nop,wscale 7], length 0
16:16:00.067654 IP 10.12.100.171.37582 > 10.12.19.23.1503: Flags [S], seq 1389865880, win 29200, options [mss 1460,sackOK,TS val 8577693 ecr 0,nop,wscale 7], length 0
16:16:00.067694 IP 10.12.100.171.56541 > 10.12.19.23.8600: Flags [S], seq 3161756949, win 29200, options [mss 1460,sackOK,TS val 8577693 ecr 0,nop,wscale 7], length 0
16:16:00.067736 IP 10.12.100.171.38529 > 10.12.19.23.3878: Flags [S], seq 2354358538, win 29200, options [mss 1460,sackOK,TS val 8577693 ecr 0,nop,wscale 7], length 0
16:16:00.067777 IP 10.12.100.171.40938 > 10.12.19.23.14000: Flags [S], seq 3122445208, win 29200, options [mss 1460,sackOK,TS val 8577693 ecr 0,nop,wscale 7], length 0
16:16:00.067780 IP 10.12.100.171.50386 > 10.12.19.23.40193: Flags [S], seq 1175641774, win 29200, options [mss 1460,sackOK,TS val 8577693 ecr 0,nop,wscale 7], length 0
16:16:00.067820 IP 10.12.100.171.40503 > 10.12.19.23.70: Flags [S], seq 2022810529, win 29200, options [mss 1460,sackOK,TS val 8577693 ecr 0,nop,wscale 7], length 0
16:16:00.067823 IP 10.12.100.171.36306 > 10.12.19.23.17988: Flags [S], seq 3729756308, win 29200, options [mss 1460,sackOK,TS val 8577693 ecr 0,nop,wscale 7], length 0
16:16:00.067953 IP 10.12.100.171.42449 > 10.12.19.23.13783: Flags [S], seq 1848148607, win 29200, options [mss 1460,sackOK,TS val 8577693 ecr 0,nop,wscale 7], length 0
16:16:00.067962 IP 10.12.100.171.46886 > 10.12.19.23.843: Flags [S], seq 3757906926, win 29200, options [mss 1460,sackOK,TS val 8577693 ecr 0,nop,wscale 7], length 0
16:16:00.067963 IP 10.12.100.171.54128 > 10.12.19.23.5033: Flags [S], seq 2236280838, win 29200, options [mss 1460,sackOK,TS val 8577693 ecr 0,nop,wscale 7], length 0
16:16:00.067965 IP 10.12.100.171.60214 > 10.12.19.23.2718: Flags [S], seq 4072285646, win 29200, options [mss 1460,sackOK,TS val 8577693 ecr 0,nop,wscale 7], length 0
16:16:00.068048 IP 10.12.100.171.59162 > 10.12.19.23.6580: Flags [S], seq 4231500064, win 29200, options [mss 1460,sackOK,TS val 8577693 ecr 0,nop,wscale 7], length 0
16:16:00.068064 IP 10.12.100.171.54606 > 10.12.19.23.15004: Flags [S], seq 888407843, win 29200, options [mss 1460,sackOK,TS val 8577693 ecr 0,nop,wscale 7], length 0
16:16:00.068117 IP 10.12.100.171.36680 > 10.12.19.23.2393: Flags [S], seq 3799410074, win 29200, options [mss 1460,sackOK,TS val 8577693 ecr 0,nop,wscale 7], length 0
16:16:00.068120 IP 10.12.100.171.43483 > 10.12.19.23.3260: Flags [S], seq 1909089632, win 29200, options [mss 1460,sackOK,TS val 8577693 ecr 0,nop,wscale 7], length 0
16:16:00.068171 IP 10.12.100.171.36312 > 10.12.19.23.1141: Flags [S], seq 2772843560, win 29200, options [mss 1460,sackOK,TS val 8577693 ecr 0,nop,wscale 7], length 0
16:16:00.115727 IP 10.12.100.171.48780 > 10.12.19.23.1236: Flags [S], seq 3722376047, win 29200, options [mss 1460,sackOK,TS val 8577705 ecr 0,nop,wscale 7], length 0
16:16:00.115749 IP 10.12.100.171.58565 > 10.12.19.23.8010: Flags [S], seq 1171438321, win 29200, options [mss 1460,sackOK,TS val 8577705 ecr 0,nop,wscale 7], length 0
16:16:00.115803 IP 10.12.100.171.48282 > 10.12.19.23.6789: Flags [S], seq 275196324, win 29200, options [mss 1460,sackOK,TS val 8577705 ecr 0,nop,wscale 7], length 0
16:16:00.115806 IP 10.12.100.171.35251 > 10.12.19.23.2492: Flags [S], seq 2762208234, win 29200, options [mss 1460,sackOK,TS val 8577705 ecr 0,nop,wscale 7], length 0
16:16:00.115840 IP 10.12.100.171.54494 > 10.12.19.23.8193: Flags [S], seq 3799608344, win 29200, options [mss 1460,sackOK,TS val 8577705 ecr 0,nop,wscale 7], length 0
16:16:00.115843 IP 10.12.100.171.36879 > 10.12.19.23.1148: Flags [S], seq 2734518049, win 29200, options [mss 1460,sackOK,TS val 8577705 ecr 0,nop,wscale 7], length 0
16:16:00.115986 IP 10.12.100.171.43855 > 10.12.19.23.4443: Flags [S], seq 2275331303, win 29200, options [mss 1460,sackOK,TS val 8577705 ecr 0,nop,wscale 7], length 0
16:16:00.116005 IP 10.12.100.171.32968 > 10.12.19.23.6003: Flags [S], seq 811494400, win 29200, options [mss 1460,sackOK,TS val 8577705 ecr 0,nop,wscale 7], length 0
16:16:00.116101 IP 10.12.100.171.56921 > 10.12.19.23.1666: Flags [S], seq 3476663286, win 29200, options [mss 1460,sackOK,TS val 8577705 ecr 0,nop,wscale 7], length 0
16:16:00.116124 IP 10.12.100.171.37116 > 10.12.19.23.1658: Flags [S], seq 907295131, win 29200, options [mss 1460,sackOK,TS val 8577705 ecr 0,nop,wscale 7], length 0
16:16:00.116125 IP 10.12.100.171.44164 > 10.12.19.23.31337: Flags [S], seq 1994436132, win 29200, options [mss 1460,sackOK,TS val 8577705 ecr 0,nop,wscale 7], length 0
16:16:00.116171 IP 10.12.100.171.54579 > 10.12.19.23.1037: Flags [S], seq 3431626060, win 29200, options [mss 1460,sackOK,TS val 8577705 ecr 0,nop,wscale 7], length 0
16:16:00.116175 IP 10.12.100.171.55897 > 10.12.19.23.82: Flags [S], seq 1700766317, win 29200, options [mss 1460,sackOK,TS val 8577705 ecr 0,nop,wscale 7], length 0
16:16:00.116296 IP 10.12.100.171.51656 > 10.12.19.23.2006: Flags [S], seq 4234427991, win 29200, options [mss 1460,sackOK,TS val 8577705 ecr 0,nop,wscale 7], length 0
16:16:00.116316 IP 10.12.100.171.56869 > 10.12.19.23.5988: Flags [S], seq 3816172639, win 29200, options [mss 1460,sackOK,TS val 8577705 ecr 0,nop,wscale 7], length 0
16:16:00.116363 IP 10.12.100.171.46533 > 10.12.19.23.800: Flags [S], seq 1172742988, win 29200, options [mss 1460,sackOK,TS val 8577705 ecr 0,nop,wscale 7], length 0
16:16:00.116366 IP 10.12.100.171.42228 > 10.12.19.23.1063: Flags [S], seq 666673185, win 29200, options [mss 1460,sackOK,TS val 8577705 ecr 0,nop,wscale 7], length 0
