11:38:52.494404 ARP, Request who-has 10.12.19.23 (ff:ff:ff:ff:ff:ff) tell 10.12.100.44, length 46
11:38:52.695113 IP 10.12.100.44.63818 > 10.12.19.23.1419: UDP, length 0
11:38:52.695176 IP 10.12.100.44.63818 > 10.12.19.23.19165: UDP, length 0
11:38:52.695179 IP 10.12.100.44.63818 > 10.12.19.23.21131: UDP, length 0
11:38:52.695180 IP 10.12.100.44.63818 > 10.12.19.23.20288: UDP, length 0
11:38:52.695182 IP 10.12.100.44.63818 > 10.12.19.23.40732: UDP, length 0
11:38:52.695183 IP 10.12.100.44.63818 > 10.12.19.23.53571: UDP, length 0
11:38:52.695261 IP 10.12.100.44.63818 > 10.12.19.23.48455: UDP, length 0
11:38:52.695264 IP 10.12.100.44.63818 > 10.12.19.23.21780: UDP, length 0
11:38:52.695265 IP 10.12.100.44.63818 > 10.12.19.23.44185: UDP, length 0
11:38:52.695306 IP 10.12.100.44.63818 > 10.12.19.23.17638: UDP, length 0
11:38:53.747307 IP 10.12.100.44.63819 > 10.12.19.23.17638: UDP, length 0
11:38:53.747328 IP 10.12.100.44.63819 > 10.12.19.23.44185: UDP, length 0
11:38:53.747329 IP 10.12.100.44.63819 > 10.12.19.23.21780: UDP, length 0
11:38:53.747331 IP 10.12.100.44.63819 > 10.12.19.23.48455: UDP, length 0
11:38:53.747332 IP 10.12.100.44.63819 > 10.12.19.23.53571: UDP, length 0
11:38:53.747385 IP 10.12.100.44.63819 > 10.12.19.23.40732: UDP, length 0
11:38:53.747389 IP 10.12.100.44.63819 > 10.12.19.23.20288: UDP, length 0
11:38:53.747391 IP 10.12.100.44.63819 > 10.12.19.23.21131: UDP, length 0
11:38:53.747472 IP 10.12.100.44.63819 > 10.12.19.23.19165: UDP, length 0
11:38:53.747480 IP 10.12.100.44.63819 > 10.12.19.23.1419: UDP, length 0
11:38:53.797617 IP 10.12.100.44.63818 > 10.12.19.23.177: UDP, length 7
11:38:53.797630 IP 10.12.100.44.63818 > 10.12.19.23.25462: UDP, length 0
11:38:53.797632 IP 10.12.100.44.63818 > 10.12.19.23.57410: UDP, length 0
11:38:53.797634 IP 10.12.100.44.63818 > 10.12.19.23.1484: UDP, length 0
11:38:53.797635 IP 10.12.100.44.63818 > 10.12.19.23.49207: UDP, length 0
11:38:53.797688 IP 10.12.100.44.63818 > 10.12.19.23.19936: UDP, length 0
11:38:53.797691 IP 10.12.100.44.63818 > 10.12.19.23.32818: UDP, length 0
11:38:53.797692 IP 10.12.100.44.63818 > 10.12.19.23.16970: UDP, length 0
11:38:53.797757 IP 10.12.100.44.63818 > 10.12.19.23.814: UDP, length 0
11:38:53.797759 IP 10.12.100.44.63818 > 10.12.19.23.32385: UDP, length 0
11:38:53.848915 IP 10.12.100.44.63819 > 10.12.19.23.32385: UDP, length 0
11:38:53.848936 IP 10.12.100.44.63819 > 10.12.19.23.814: UDP, length 0
11:38:53.848938 IP 10.12.100.44.63819 > 10.12.19.23.16970: UDP, length 0
11:38:53.848939 IP 10.12.100.44.63819 > 10.12.19.23.32818: UDP, length 0
11:38:53.848940 IP 10.12.100.44.63819 > 10.12.19.23.19936: UDP, length 0
11:38:53.848942 IP 10.12.100.44.63819 > 10.12.19.23.49207: UDP, length 0
11:38:53.849001 IP 10.12.100.44.63819 > 10.12.19.23.1484: UDP, length 0
11:38:53.849005 IP 10.12.100.44.63819 > 10.12.19.23.57410: UDP, length 0
11:38:53.849006 IP 10.12.100.44.63819 > 10.12.19.23.25462: UDP, length 0
11:38:53.849051 IP 10.12.100.44.63819 > 10.12.19.23.177: UDP, length 7
11:38:53.899287 IP 10.12.100.44.63818 > 10.12.19.23.1054: UDP, length 0
11:38:53.899307 IP 10.12.100.44.63818 > 10.12.19.23.38615: UDP, length 0
11:38:53.899308 IP 10.12.100.44.63818 > 10.12.19.23.959: UDP, length 0
11:38:53.899310 IP 10.12.100.44.63818 > 10.12.19.23.31681: UDP, length 0
11:38:53.899350 IP 10.12.100.44.63818 > 10.12.19.23.464: UDP, length 0
11:38:53.899352 IP 10.12.100.44.63818 > 10.12.19.23.1782: UDP, length 0
11:38:53.899354 IP 10.12.100.44.63818 > 10.12.19.23.64513: UDP, length 0
11:38:53.899398 IP 10.12.100.44.63818 > 10.12.19.23.6001: UDP, length 0
11:38:53.899401 IP 10.12.100.44.63818 > 10.12.19.23.62699: UDP, length 0
11:38:53.899402 IP 10.12.100.44.63818 > 10.12.19.23.2967: UDP, length 0
11:38:53.949514 IP 10.12.100.44.63819 > 10.12.19.23.1782: UDP, length 0
11:38:53.949535 IP 10.12.100.44.63819 > 10.12.19.23.464: UDP, length 0
11:38:53.949537 IP 10.12.100.44.63819 > 10.12.19.23.31681: UDP, length 0
11:38:53.949538 IP 10.12.100.44.63819 > 10.12.19.23.959: UDP, length 0
11:38:53.949636 IP 10.12.100.44.63819 > 10.12.19.23.38615: UDP, length 0
11:38:53.949639 IP 10.12.100.44.63819 > 10.12.19.23.1054: UDP, length 0
11:38:53.952019 IP 10.12.100.44.63819 > 10.12.19.23.2967: UDP, length 0
11:38:53.952027 IP 10.12.100.44.63819 > 10.12.19.23.62699: UDP, length 0
11:38:53.952029 IP 10.12.100.44.63819 > 10.12.19.23.6001: UDP, length 0
11:38:53.952044 IP 10.12.100.44.63819 > 10.12.19.23.64513: UDP, length 0
11:38:53.999924 IP 10.12.100.44.63818 > 10.12.19.23.16918: UDP, length 0
11:38:53.999937 IP 10.12.100.44.63818 > 10.12.19.23.21803: UDP, length 0
11:38:53.999939 IP 10.12.100.44.63818 > 10.12.19.23.19197: UDP, length 0
11:38:53.999940 IP 10.12.100.44.63818 > 10.12.19.23.19141: UDP, length 0
11:38:53.999957 IP 10.12.100.44.63818 > 10.12.19.23.17424: UDP, length 0
11:38:54.000028 IP 10.12.100.44.63818 > 10.12.19.23.58797: UDP, length 0
11:38:54.002310 IP 10.12.100.44.63818 > 10.12.19.23.17423: UDP, length 0
11:38:54.002318 IP 10.12.100.44.63818 > 10.12.19.23.59207: UDP, length 0
11:38:54.002378 IP 10.12.100.44.63818 > 10.12.19.23.16674: UDP, length 0
11:38:54.002381 IP 10.12.100.44.63818 > 10.12.19.23.49176: UDP, length 0
11:38:54.050304 IP 10.12.100.44.63819 > 10.12.19.23.58797: UDP, length 0
11:38:54.050325 IP 10.12.100.44.63819 > 10.12.19.23.17424: UDP, length 0
11:38:54.050327 IP 10.12.100.44.63819 > 10.12.19.23.19141: UDP, length 0
11:38:54.050329 IP 10.12.100.44.63819 > 10.12.19.23.19197: UDP, length 0
11:38:54.050330 IP 10.12.100.44.63819 > 10.12.19.23.21803: UDP, length 0
11:38:54.050406 IP 10.12.100.44.63819 > 10.12.19.23.16918: UDP, length 0
11:38:54.053004 IP 10.12.100.44.63819 > 10.12.19.23.49176: UDP, length 0
11:38:54.053027 IP 10.12.100.44.63819 > 10.12.19.23.16674: UDP, length 0
11:38:54.053029 IP 10.12.100.44.63819 > 10.12.19.23.59207: UDP, length 0
11:38:54.053030 IP 10.12.100.44.63819 > 10.12.19.23.17423: UDP, length 0
11:38:54.100752 IP 10.12.100.44.63818 > 10.12.19.23.497: UDP, length 0
11:38:54.100772 IP 10.12.100.44.63818 > 10.12.19.23.27444: UDP, length 0
11:38:54.100774 IP 10.12.100.44.63818 > 10.12.19.23.1000: UDP, length 0
11:38:54.100775 IP 10.12.100.44.63818 > 10.12.19.23.18543: UDP, length 0
11:38:54.100854 IP 10.12.100.44.63818 > 10.12.19.23.31731: UDP, length 0
11:38:54.100858 IP 10.12.100.44.63818 > 10.12.19.23.19017: UDP, length 0
11:38:54.103311 IP 10.12.100.44.63818 > 10.12.19.23.49166: UDP, length 0
11:38:54.103333 IP 10.12.100.44.63818 > 10.12.19.23.500: isakmp: phase 1 I ident
11:38:54.103335 IP 10.12.100.44.63818 > 10.12.19.23.40866: UDP, length 0
11:38:54.103337 IP 10.12.100.44.63818 > 10.12.19.23.32768: UDP, length 0
11:38:54.150769 IP 10.12.100.44.63819 > 10.12.19.23.497: UDP, length 0
11:38:54.153113 IP 10.12.100.44.63819 > 10.12.19.23.19017: UDP, length 0
11:38:54.153165 IP 10.12.100.44.63819 > 10.12.19.23.31731: UDP, length 0
11:38:54.153168 IP 10.12.100.44.63819 > 10.12.19.23.18543: UDP, length 0
11:38:54.153169 IP 10.12.100.44.63819 > 10.12.19.23.1000: UDP, length 0
11:38:54.153220 IP 10.12.100.44.63819 > 10.12.19.23.27444: UDP, length 0
11:38:54.155596 IP 10.12.100.44.63819 > 10.12.19.23.32768: UDP, length 0
11:38:54.155616 IP 10.12.100.44.63819 > 10.12.19.23.40866: UDP, length 0
11:38:54.155619 IP 10.12.100.44.63819 > 10.12.19.23.500: isakmp: phase 1 I ident
11:38:54.155671 IP 10.12.100.44.63819 > 10.12.19.23.49166: UDP, length 0
11:38:54.201083 IP 10.12.100.44.63818 > 10.12.19.23.21318: UDP, length 0
11:38:54.203504 IP 10.12.100.44.63818 > 10.12.19.23.28547: UDP, length 0
11:38:54.203512 IP 10.12.100.44.63818 > 10.12.19.23.20120: UDP, length 0
11:38:54.203514 IP 10.12.100.44.63818 > 10.12.19.23.9001: UDP, length 0
11:38:54.203515 IP 10.12.100.44.63818 > 10.12.19.23.32528: UDP, length 0
11:38:54.203577 IP 10.12.100.44.63818 > 10.12.19.23.20019: UDP, length 0
11:38:54.205911 IP 10.12.100.44.63818 > 10.12.19.23.16829: UDP, length 0
11:38:54.205919 IP 10.12.100.44.63818 > 10.12.19.23.1012: UDP, length 0
11:38:54.205921 IP 10.12.100.44.63818 > 10.12.19.23.17629: UDP, length 0
11:38:54.205923 IP 10.12.100.44.63818 > 10.12.19.23.17006: UDP, length 0
11:38:54.251366 IP 10.12.100.44.63819 > 10.12.19.23.21318: UDP, length 0
11:38:54.254086 IP 10.12.100.44.63819 > 10.12.19.23.20019: UDP, length 0
11:38:54.254095 IP 10.12.100.44.63819 > 10.12.19.23.32528: UDP, length 0
11:38:54.254097 IP 10.12.100.44.63819 > 10.12.19.23.9001: UDP, length 0
11:38:54.254098 IP 10.12.100.44.63819 > 10.12.19.23.20120: UDP, length 0
11:38:54.254099 IP 10.12.100.44.63819 > 10.12.19.23.28547: UDP, length 0
11:38:54.256658 IP 10.12.100.44.63819 > 10.12.19.23.17006: UDP, length 0
11:38:54.256666 IP 10.12.100.44.63819 > 10.12.19.23.17629: UDP, length 0
11:38:54.256680 IP 10.12.100.44.63819 > 10.12.19.23.1012: UDP, length 0
11:38:54.256682 IP 10.12.100.44.63819 > 10.12.19.23.16829: UDP, length 0
11:38:54.301975 IP 10.12.100.44.63818 > 10.12.19.23.21060: UDP, length 0
11:38:54.304354 IP 10.12.100.44.63818 > 10.12.19.23.19663: UDP, length 0
11:38:54.304363 IP 10.12.100.44.63818 > 10.12.19.23.21247: UDP, length 0
11:38:54.304364 IP 10.12.100.44.63818 > 10.12.19.23.47772: UDP, length 0
11:38:54.304366 IP 10.12.100.44.63818 > 10.12.19.23.21454: UDP, length 0
11:38:54.304367 IP 10.12.100.44.63818 > 10.12.19.23.786: UDP, length 0
11:38:54.307023 IP 10.12.100.44.63818 > 10.12.19.23.18991: UDP, length 0
11:38:54.307045 IP 10.12.100.44.63818 > 10.12.19.23.21898: UDP, length 0
11:38:54.307046 IP 10.12.100.44.63818 > 10.12.19.23.23040: UDP, length 0
11:38:54.307048 IP 10.12.100.44.63818 > 10.12.19.23.45928: UDP, length 0
11:38:54.353070 IP 10.12.100.44.63819 > 10.12.19.23.21060: UDP, length 0
11:38:54.355142 IP 10.12.100.44.63819 > 10.12.19.23.786: UDP, length 0
11:38:54.355150 IP 10.12.100.44.63819 > 10.12.19.23.21454: UDP, length 0
11:38:54.355152 IP 10.12.100.44.63819 > 10.12.19.23.47772: UDP, length 0
11:38:54.355153 IP 10.12.100.44.63819 > 10.12.19.23.21247: UDP, length 0
11:38:54.355154 IP 10.12.100.44.63819 > 10.12.19.23.19663: UDP, length 0
11:38:54.357596 IP 10.12.100.44.63819 > 10.12.19.23.45928: UDP, length 0
11:38:54.357617 IP 10.12.100.44.63819 > 10.12.19.23.23040: UDP, length 0
11:38:54.357618 IP 10.12.100.44.63819 > 10.12.19.23.21898: UDP, length 0
11:38:54.357620 IP 10.12.100.44.63819 > 10.12.19.23.18991: UDP, length 0
11:38:54.403714 IP 10.12.100.44.63818 > 10.12.19.23.5050: UDP, length 0
11:38:54.406118 IP 10.12.100.44.63818 > 10.12.19.23.41524: UDP, length 0
11:38:54.406126 IP 10.12.100.44.63818 > 10.12.19.23.18888: UDP, length 0
11:38:54.406128 IP 10.12.100.44.63818 > 10.12.19.23.57172: UDP, length 0
11:38:54.406129 IP 10.12.100.44.63818 > 10.12.19.23.1055: UDP, length 0
11:38:54.406131 IP 10.12.100.44.63818 > 10.12.19.23.18331: UDP, length 0
11:38:54.408597 IP 10.12.100.44.63818 > 10.12.19.23.983: UDP, length 0
11:38:54.408604 IP 10.12.100.44.63818 > 10.12.19.23.1433: UDP, length 0
11:38:54.408606 IP 10.12.100.44.63818 > 10.12.19.23.18830: UDP, length 0
11:38:54.408699 IP 10.12.100.44.63818 > 10.12.19.23.57958: UDP, length 0
11:38:54.454371 IP 10.12.100.44.63819 > 10.12.19.23.5050: UDP, length 0
11:38:54.456737 IP 10.12.100.44.63819 > 10.12.19.23.18331: UDP, length 0
11:38:54.456744 IP 10.12.100.44.63819 > 10.12.19.23.1055: UDP, length 0
11:38:54.456746 IP 10.12.100.44.63819 > 10.12.19.23.57172: UDP, length 0
11:38:54.456807 IP 10.12.100.44.63819 > 10.12.19.23.18888: UDP, length 0
11:38:54.456810 IP 10.12.100.44.63819 > 10.12.19.23.41524: UDP, length 0
11:38:54.459205 IP 10.12.100.44.63819 > 10.12.19.23.57958: UDP, length 0
11:38:54.459212 IP 10.12.100.44.63819 > 10.12.19.23.18830: UDP, length 0
11:38:54.459272 IP 10.12.100.44.63819 > 10.12.19.23.1433: UDP, length 0
11:38:54.459275 IP 10.12.100.44.63819 > 10.12.19.23.983: UDP, length 0
11:38:54.504771 IP 10.12.100.44.63818 > 10.12.19.23.18996: UDP, length 0
11:38:54.507139 IP 10.12.100.44.63818 > 10.12.19.23.34855: UDP, length 0
11:38:54.507147 IP 10.12.100.44.63818 > 10.12.19.23.685: UDP, length 0
11:38:54.507148 IP 10.12.100.44.63818 > 10.12.19.23.32771: UDP, length 0
11:38:54.507150 IP 10.12.100.44.63818 > 10.12.19.23.1057: UDP, length 0
11:38:54.507192 IP 10.12.100.44.63818 > 10.12.19.23.2049: NFS request xid 0 40 null
11:38:54.509366 IP 10.12.100.44.63818 > 10.12.19.23.18985: UDP, length 0
11:38:54.509374 IP 10.12.100.44.63818 > 10.12.19.23.1049: UDP, length 0
11:38:54.509376 IP 10.12.100.44.63818 > 10.12.19.23.2222: UDP, length 0
11:38:54.509378 IP 10.12.100.44.63818 > 10.12.19.23.18869: UDP, length 0
11:38:54.554932 IP 10.12.100.44.63819 > 10.12.19.23.18996: UDP, length 0
11:38:54.557665 IP 10.12.100.44.63819 > 10.12.19.23.2049: NFS request xid 0 40 null
11:38:54.557673 IP 10.12.100.44.63819 > 10.12.19.23.1057: UDP, length 0
11:38:54.557675 IP 10.12.100.44.63819 > 10.12.19.23.32771: UDP, length 0
11:38:54.557676 IP 10.12.100.44.63819 > 10.12.19.23.685: UDP, length 0
11:38:54.557678 IP 10.12.100.44.63819 > 10.12.19.23.34855: UDP, length 0
11:38:54.560214 IP 10.12.100.44.63819 > 10.12.19.23.18869: UDP, length 0
11:38:54.560222 IP 10.12.100.44.63819 > 10.12.19.23.2222: UDP, length 0
11:38:54.560223 IP 10.12.100.44.63819 > 10.12.19.23.1049: UDP, length 0
11:38:54.560225 IP 10.12.100.44.63819 > 10.12.19.23.18985: UDP, length 0
11:38:54.605172 IP 10.12.100.44.63818 > 10.12.19.23.19489: UDP, length 0
11:38:54.607866 IP 10.12.100.44.63818 > 10.12.19.23.25157: UDP, length 0
11:38:54.607875 IP 10.12.100.44.63818 > 10.12.19.23.1056: UDP, length 0
11:38:54.607877 IP 10.12.100.44.63818 > 10.12.19.23.54711: UDP, length 0
11:38:54.607878 IP 10.12.100.44.63818 > 10.12.19.23.3: UDP, length 0
11:38:54.607927 IP 10.12.100.44.63818 > 10.12.19.23.49190: UDP, length 0
11:38:54.610394 IP 10.12.100.44.63818 > 10.12.19.23.21525: UDP, length 0
11:38:54.610460 IP 10.12.100.44.63818 > 10.12.19.23.16947: UDP, length 0
11:38:54.610464 IP 10.12.100.44.63818 > 10.12.19.23.20031: UDP, length 0
11:38:54.610515 IP 10.12.100.44.63818 > 10.12.19.23.52503: UDP, length 0
11:38:54.655470 IP 10.12.100.44.63819 > 10.12.19.23.19489: UDP, length 0
11:38:54.658459 IP 10.12.100.44.63819 > 10.12.19.23.49190: UDP, length 0
11:38:54.658484 IP 10.12.100.44.63819 > 10.12.19.23.3: UDP, length 0
11:38:54.658486 IP 10.12.100.44.63819 > 10.12.19.23.54711: UDP, length 0
11:38:54.658487 IP 10.12.100.44.63819 > 10.12.19.23.1056: UDP, length 0
11:38:54.658488 IP 10.12.100.44.63819 > 10.12.19.23.25157: UDP, length 0
11:38:54.661043 IP 10.12.100.44.63819 > 10.12.19.23.52503: UDP, length 0
11:38:54.661063 IP 10.12.100.44.63819 > 10.12.19.23.20031: UDP, length 0
11:38:54.661065 IP 10.12.100.44.63819 > 10.12.19.23.16947: UDP, length 0
11:38:54.661161 IP 10.12.100.44.63819 > 10.12.19.23.21525: UDP, length 0
11:38:54.705617 IP 10.12.100.44.63818 > 10.12.19.23.21514: UDP, length 0
11:38:54.708817 IP 10.12.100.44.63818 > 10.12.19.23.49197: UDP, length 0
11:38:54.708825 IP 10.12.100.44.63818 > 10.12.19.23.3702: UDP, length 0
11:38:54.708827 IP 10.12.100.44.63818 > 10.12.19.23.781: UDP, length 0
11:38:54.708829 IP 10.12.100.44.63818 > 10.12.19.23.23608: UDP, length 0
11:38:54.708875 IP 10.12.100.44.63818 > 10.12.19.23.38412: UDP, length 0
11:38:54.711392 IP 10.12.100.44.63818 > 10.12.19.23.29977: UDP, length 0
11:38:54.711400 IP 10.12.100.44.63818 > 10.12.19.23.5355: UDP, length 0
11:38:54.711402 IP 10.12.100.44.63818 > 10.12.19.23.42577: UDP, length 0
11:38:54.711404 IP 10.12.100.44.63818 > 10.12.19.23.9876: UDP, length 0
11:38:54.756094 IP 10.12.100.44.63819 > 10.12.19.23.21514: UDP, length 0
11:38:54.759365 IP 10.12.100.44.63819 > 10.12.19.23.38412: UDP, length 0
11:38:54.759385 IP 10.12.100.44.63819 > 10.12.19.23.23608: UDP, length 0
11:38:54.759472 IP 10.12.100.44.63819 > 10.12.19.23.781: UDP, length 0
11:38:54.759477 IP 10.12.100.44.63819 > 10.12.19.23.3702: UDP, length 0
11:38:54.759479 IP 10.12.100.44.63819 > 10.12.19.23.49197: UDP, length 0
11:38:54.761664 IP 10.12.100.44.63819 > 10.12.19.23.9876: UDP, length 0
11:38:54.761699 IP 10.12.100.44.63819 > 10.12.19.23.42577: UDP, length 0
11:38:54.761701 IP 10.12.100.44.63819 > 10.12.19.23.5355: UDP, length 0
11:38:54.761703 IP 10.12.100.44.63819 > 10.12.19.23.29977: UDP, length 0
11:38:54.806939 IP 10.12.100.44.63818 > 10.12.19.23.22123: UDP, length 0
11:38:54.809910 IP 10.12.100.44.63818 > 10.12.19.23.50164: UDP, length 0
11:38:54.809931 IP 10.12.100.44.63818 > 10.12.19.23.53838: UDP, length 0
11:38:54.809933 IP 10.12.100.44.63818 > 10.12.19.23.34038: UDP, length 0
11:38:54.809934 IP 10.12.100.44.63818 > 10.12.19.23.27473: UDP, length 0
11:38:54.809982 IP 10.12.100.44.63818 > 10.12.19.23.217: UDP, length 0
11:38:54.812457 IP 10.12.100.44.63818 > 10.12.19.23.16832: UDP, length 0
11:38:54.812477 IP 10.12.100.44.63818 > 10.12.19.23.32931: UDP, length 0
11:38:54.812478 IP 10.12.100.44.63818 > 10.12.19.23.20423: UDP, length 0
11:38:54.812553 IP 10.12.100.44.63818 > 10.12.19.23.17207: UDP, length 0
11:38:54.858146 IP 10.12.100.44.63819 > 10.12.19.23.22123: UDP, length 0
11:38:54.860420 IP 10.12.100.44.63819 > 10.12.19.23.217: UDP, length 0
11:38:54.860445 IP 10.12.100.44.63819 > 10.12.19.23.27473: UDP, length 0
11:38:54.860447 IP 10.12.100.44.63819 > 10.12.19.23.34038: UDP, length 0
11:38:54.860448 IP 10.12.100.44.63819 > 10.12.19.23.53838: UDP, length 0
11:38:54.860526 IP 10.12.100.44.63819 > 10.12.19.23.50164: UDP, length 0
11:38:54.863099 IP 10.12.100.44.63819 > 10.12.19.23.17207: UDP, length 0
11:38:54.863107 IP 10.12.100.44.63819 > 10.12.19.23.20423: UDP, length 0
11:38:54.863108 IP 10.12.100.44.63819 > 10.12.19.23.32931: UDP, length 0
11:38:54.863138 IP 10.12.100.44.63819 > 10.12.19.23.16832: UDP, length 0
11:38:54.908703 IP 10.12.100.44.63818 > 10.12.19.23.16420: UDP, length 0
11:38:54.911174 IP 10.12.100.44.63818 > 10.12.19.23.1100: UDP, length 0
11:38:54.911181 IP 10.12.100.44.63818 > 10.12.19.23.18004: UDP, length 0
11:38:54.911183 IP 10.12.100.44.63818 > 10.12.19.23.1804: UDP, length 0
11:38:54.911242 IP 10.12.100.44.63818 > 10.12.19.23.39888: UDP, length 0
11:38:54.911245 IP 10.12.100.44.63818 > 10.12.19.23.49220: UDP, length 0
11:38:54.913618 IP 10.12.100.44.63818 > 10.12.19.23.18958: UDP, length 0
11:38:54.913640 IP 10.12.100.44.63818 > 10.12.19.23.17468: UDP, length 0
11:38:54.913641 IP 10.12.100.44.63818 > 10.12.19.23.1485: UDP, length 0
11:38:54.913643 IP 10.12.100.44.63818 > 10.12.19.23.49262: UDP, length 0
11:38:54.958913 IP 10.12.100.44.63819 > 10.12.19.23.16420: UDP, length 0
11:38:54.961547 IP 10.12.100.44.63819 > 10.12.19.23.49220: UDP, length 0
11:38:54.961556 IP 10.12.100.44.63819 > 10.12.19.23.39888: UDP, length 0
11:38:54.961558 IP 10.12.100.44.63819 > 10.12.19.23.1804: UDP, length 0
11:38:54.961560 IP 10.12.100.44.63819 > 10.12.19.23.18004: UDP, length 0
11:38:54.961561 IP 10.12.100.44.63819 > 10.12.19.23.1100: UDP, length 0
11:38:54.964000 IP 10.12.100.44.63819 > 10.12.19.23.49262: UDP, length 0
11:38:54.964007 IP 10.12.100.44.63819 > 10.12.19.23.1485: UDP, length 0
11:38:54.964009 IP 10.12.100.44.63819 > 10.12.19.23.17468: UDP, length 0
11:38:54.964089 IP 10.12.100.44.63819 > 10.12.19.23.18958: UDP, length 0
11:38:55.010162 IP 10.12.100.44.63818 > 10.12.19.23.35702: UDP, length 0
11:38:55.012478 IP 10.12.100.44.63818 > 10.12.19.23.997: UDP, length 0
11:38:55.012486 IP 10.12.100.44.63818 > 10.12.19.23.1200: UDP, length 0
11:38:55.012488 IP 10.12.100.44.63818 > 10.12.19.23.49214: UDP, length 0
11:38:55.012489 IP 10.12.100.44.63818 > 10.12.19.23.37: UDP, length 0
11:38:55.012535 IP 10.12.100.44.63818 > 10.12.19.23.45441: UDP, length 0
11:38:55.014921 IP 10.12.100.44.63818 > 10.12.19.23.1022: UDP, length 0
11:38:55.014942 IP 10.12.100.44.63818 > 10.12.19.23.32773: UDP, length 0
11:38:55.014943 IP 10.12.100.44.63818 > 10.12.19.23.34862: UDP, length 0
11:38:55.014945 IP 10.12.100.44.63818 > 10.12.19.23.514: [|syslog]
11:38:55.060266 IP 10.12.100.44.63819 > 10.12.19.23.35702: UDP, length 0
11:38:55.062614 IP 10.12.100.44.63819 > 10.12.19.23.49214: UDP, length 0
11:38:55.062623 IP 10.12.100.44.63819 > 10.12.19.23.1200: UDP, length 0
11:38:55.062624 IP 10.12.100.44.63819 > 10.12.19.23.997: UDP, length 0
11:38:55.065039 IP 10.12.100.44.63819 > 10.12.19.23.514: [|syslog]
11:38:55.065048 IP 10.12.100.44.63819 > 10.12.19.23.34862: UDP, length 0
11:38:55.065062 IP 10.12.100.44.63819 > 10.12.19.23.32773: UDP, length 0
11:38:55.065064 IP 10.12.100.44.63819 > 10.12.19.23.1022: UDP, length 0
11:38:55.065121 IP 10.12.100.44.63819 > 10.12.19.23.45441: UDP, length 0
11:38:55.065260 IP 10.12.100.44.63819 > 10.12.19.23.37: UDP, length 0
11:38:55.110518 IP 10.12.100.44.63818 > 10.12.19.23.22914: UDP, length 0
11:38:55.112817 IP 10.12.100.44.63818 > 10.12.19.23.27482: UDP, length 0
11:38:55.112824 IP 10.12.100.44.63818 > 10.12.19.23.44179: UDP, length 0
11:38:55.112826 IP 10.12.100.44.63818 > 10.12.19.23.24644: UDP, length 0
11:38:55.115120 IP 10.12.100.44.63818 > 10.12.19.23.23679: UDP, length 0
11:38:55.115127 IP 10.12.100.44.63818 > 10.12.19.23.28493: UDP, length 0
11:38:55.115128 IP 10.12.100.44.63818 > 10.12.19.23.18255: UDP, length 0
11:38:55.117369 IP 10.12.100.44.63818 > 10.12.19.23.40915: UDP, length 0
11:38:55.117375 IP 10.12.100.44.63818 > 10.12.19.23.53589: UDP, length 0
11:38:55.117377 IP 10.12.100.44.63818 > 10.12.19.23.21: UDP, length 0
11:38:55.161010 IP 10.12.100.44.63819 > 10.12.19.23.22914: UDP, length 0
11:38:55.163216 IP 10.12.100.44.63819 > 10.12.19.23.24644: UDP, length 0
11:38:55.163226 IP 10.12.100.44.63819 > 10.12.19.23.44179: UDP, length 0
11:38:55.163227 IP 10.12.100.44.63819 > 10.12.19.23.27482: UDP, length 0
11:38:55.165519 IP 10.12.100.44.63819 > 10.12.19.23.18255: UDP, length 0
11:38:55.165528 IP 10.12.100.44.63819 > 10.12.19.23.28493: UDP, length 0
11:38:55.165529 IP 10.12.100.44.63819 > 10.12.19.23.23679: UDP, length 0
11:38:55.167889 IP 10.12.100.44.63819 > 10.12.19.23.21: UDP, length 0
11:38:55.167896 IP 10.12.100.44.63819 > 10.12.19.23.53589: UDP, length 0
11:38:55.167898 IP 10.12.100.44.63819 > 10.12.19.23.40915: UDP, length 0
11:38:55.211415 IP 10.12.100.44.63818 > 10.12.19.23.1101: UDP, length 0
11:38:55.213990 IP 10.12.100.44.63818 > 10.12.19.23.1046: UDP, length 0
11:38:55.213998 IP 10.12.100.44.63818 > 10.12.19.23.39213: UDP, length 0
11:38:55.214077 IP 10.12.100.44.63818 > 10.12.19.23.41446: UDP, length 0
11:38:55.216632 IP 10.12.100.44.63818 > 10.12.19.23.20525: UDP, length 0
11:38:55.216641 IP 10.12.100.44.63818 > 10.12.19.23.16573: UDP, length 0
11:38:55.216643 IP 10.12.100.44.63818 > 10.12.19.23.19682: UDP, length 0
11:38:55.219142 IP 10.12.100.44.63818 > 10.12.19.23.34578: UDP, length 0
11:38:55.219149 IP 10.12.100.44.63818 > 10.12.19.23.16938: UDP, length 0
11:38:55.219151 IP 10.12.100.44.63818 > 10.12.19.23.33030: UDP, length 0
11:38:55.261498 IP 10.12.100.44.63819 > 10.12.19.23.1101: UDP, length 0
11:38:55.264287 IP 10.12.100.44.63819 > 10.12.19.23.41446: UDP, length 0
11:38:55.264309 IP 10.12.100.44.63819 > 10.12.19.23.39213: UDP, length 0
11:38:55.264310 IP 10.12.100.44.63819 > 10.12.19.23.1046: UDP, length 0
11:38:55.267181 IP 10.12.100.44.63819 > 10.12.19.23.19682: UDP, length 0
11:38:55.267192 IP 10.12.100.44.63819 > 10.12.19.23.16573: UDP, length 0
11:38:55.267194 IP 10.12.100.44.63819 > 10.12.19.23.20525: UDP, length 0
11:38:55.269628 IP 10.12.100.44.63819 > 10.12.19.23.33030: UDP, length 0
11:38:55.269651 IP 10.12.100.44.63819 > 10.12.19.23.16938: UDP, length 0
11:38:55.269653 IP 10.12.100.44.63819 > 10.12.19.23.34578: UDP, length 0
11:38:55.311806 IP 10.12.100.44.63818 > 10.12.19.23.18666: UDP, length 0
11:38:55.314511 IP 10.12.100.44.63818 > 10.12.19.23.49360: UDP, length 0
11:38:55.314533 IP 10.12.100.44.63818 > 10.12.19.23.19935: UDP, length 0
11:38:55.314535 IP 10.12.100.44.63818 > 10.12.19.23.19616: UDP, length 0
11:38:55.317613 IP 10.12.100.44.63818 > 10.12.19.23.48489: UDP, length 0
11:38:55.317620 IP 10.12.100.44.63818 > 10.12.19.23.39217: UDP, length 0
11:38:55.317622 IP 10.12.100.44.63818 > 10.12.19.23.19718: UDP, length 0
11:38:55.320007 IP 10.12.100.44.63818 > 10.12.19.23.19995: UDP, length 0
11:38:55.320014 IP 10.12.100.44.63818 > 10.12.19.23.57409: UDP, length 0
11:38:55.320015 IP 10.12.100.44.63818 > 10.12.19.23.902: UDP, length 0
11:38:55.362095 IP 10.12.100.44.63819 > 10.12.19.23.18666: UDP, length 0
11:38:55.364952 IP 10.12.100.44.63819 > 10.12.19.23.19616: UDP, length 0
11:38:55.364967 IP 10.12.100.44.63819 > 10.12.19.23.19935: UDP, length 0
11:38:55.365028 IP 10.12.100.44.63819 > 10.12.19.23.49360: UDP, length 0
11:38:55.368185 IP 10.12.100.44.63819 > 10.12.19.23.19718: UDP, length 0
11:38:55.368237 IP 10.12.100.44.63819 > 10.12.19.23.39217: UDP, length 0
11:38:55.368239 IP 10.12.100.44.63819 > 10.12.19.23.48489: UDP, length 0
11:38:55.370563 IP 10.12.100.44.63819 > 10.12.19.23.902: UDP, length 0
11:38:55.370570 IP 10.12.100.44.63819 > 10.12.19.23.57409: UDP, length 0
11:38:55.370572 IP 10.12.100.44.63819 > 10.12.19.23.19995: UDP, length 0
11:38:55.413316 IP 10.12.100.44.63818 > 10.12.19.23.1081: UDP, length 0
11:38:55.415799 IP 10.12.100.44.63818 > 10.12.19.23.21655: UDP, length 0
11:38:55.415806 IP 10.12.100.44.63818 > 10.12.19.23.19933: UDP, length 0
11:38:55.415808 IP 10.12.100.44.63818 > 10.12.19.23.20146: UDP, length 0
11:38:55.418678 IP 10.12.100.44.63818 > 10.12.19.23.36669: UDP, length 0
11:38:55.418684 IP 10.12.100.44.63818 > 10.12.19.23.33866: UDP, length 0
11:38:55.418686 IP 10.12.100.44.63818 > 10.12.19.23.49178: UDP, length 0
11:38:55.421259 IP 10.12.100.44.63818 > 10.12.19.23.32776: UDP, length 0
11:38:55.421265 IP 10.12.100.44.63818 > 10.12.19.23.20: UDP, length 0
11:38:55.421324 IP 10.12.100.44.63818 > 10.12.19.23.1036: UDP, length 0
11:38:55.463522 IP 10.12.100.44.63819 > 10.12.19.23.1081: UDP, length 0
11:38:55.466168 IP 10.12.100.44.63819 > 10.12.19.23.20146: UDP, length 0
11:38:55.466177 IP 10.12.100.44.63819 > 10.12.19.23.19933: UDP, length 0
11:38:55.466178 IP 10.12.100.44.63819 > 10.12.19.23.21655: UDP, length 0
11:38:55.469200 IP 10.12.100.44.63819 > 10.12.19.23.49178: UDP, length 0
11:38:55.469220 IP 10.12.100.44.63819 > 10.12.19.23.33866: UDP, length 0
11:38:55.469221 IP 10.12.100.44.63819 > 10.12.19.23.36669: UDP, length 0
11:38:55.471858 IP 10.12.100.44.63819 > 10.12.19.23.1036: UDP, length 0
11:38:55.471877 IP 10.12.100.44.63819 > 10.12.19.23.20: UDP, length 0
11:38:55.471879 IP 10.12.100.44.63819 > 10.12.19.23.32776: UDP, length 0
11:38:55.513731 IP 10.12.100.44.63818 > 10.12.19.23.17592: UDP, length 0
11:38:55.516328 IP 10.12.100.44.63818 > 10.12.19.23.21104: UDP, length 0
11:38:55.516337 IP 10.12.100.44.63818 > 10.12.19.23.43195: UDP, length 0
11:38:55.516353 IP 10.12.100.44.63818 > 10.12.19.23.44508: UDP, length 0
11:38:55.519353 IP 10.12.100.44.63818 > 10.12.19.23.17674: UDP, length 0
11:38:55.519359 IP 10.12.100.44.63818 > 10.12.19.23.20679: UDP, length 0
11:38:55.519361 IP 10.12.100.44.63818 > 10.12.19.23.43686: UDP, length 0
11:38:55.522142 IP 10.12.100.44.63818 > 10.12.19.23.16919: UDP, length 0
11:38:55.522148 IP 10.12.100.44.63818 > 10.12.19.23.40441: UDP, length 0
11:38:55.522149 IP 10.12.100.44.63818 > 10.12.19.23.49209: UDP, length 0
11:38:55.565042 IP 10.12.100.44.63819 > 10.12.19.23.17592: UDP, length 0
11:38:55.567518 IP 10.12.100.44.63819 > 10.12.19.23.44508: UDP, length 0
11:38:55.567528 IP 10.12.100.44.63819 > 10.12.19.23.43195: UDP, length 0
11:38:55.567530 IP 10.12.100.44.63819 > 10.12.19.23.21104: UDP, length 0
11:38:55.569597 IP 10.12.100.44.63819 > 10.12.19.23.43686: UDP, length 0
11:38:55.569604 IP 10.12.100.44.63819 > 10.12.19.23.20679: UDP, length 0
11:38:55.569605 IP 10.12.100.44.63819 > 10.12.19.23.17674: UDP, length 0
11:38:55.572603 IP 10.12.100.44.63819 > 10.12.19.23.49209: UDP, length 0
11:38:55.572622 IP 10.12.100.44.63819 > 10.12.19.23.40441: UDP, length 0
11:38:55.572624 IP 10.12.100.44.63819 > 10.12.19.23.16919: UDP, length 0
11:38:55.615347 IP 10.12.100.44.63818 > 10.12.19.23.20424: UDP, length 0
11:38:55.618034 IP 10.12.100.44.63818 > 10.12.19.23.33249: UDP, length 0
11:38:55.618042 IP 10.12.100.44.63818 > 10.12.19.23.41638: UDP, length 0
11:38:55.618044 IP 10.12.100.44.63818 > 10.12.19.23.26872: UDP, length 0
11:38:55.620517 IP 10.12.100.44.63818 > 10.12.19.23.17237: UDP, length 0
11:38:55.620524 IP 10.12.100.44.63818 > 10.12.19.23.49393: UDP, length 0
11:38:55.620526 IP 10.12.100.44.63818 > 10.12.19.23.1072: UDP, length 0
11:38:55.622966 IP 10.12.100.44.63818 > 10.12.19.23.4008: UDP, length 0
11:38:55.623052 IP 10.12.100.44.63818 > 10.12.19.23.22124: UDP, length 0
11:38:55.623055 IP 10.12.100.44.63818 > 10.12.19.23.17494: UDP, length 0
11:38:55.665633 IP 10.12.100.44.63819 > 10.12.19.23.20424: UDP, length 0
11:38:55.668261 IP 10.12.100.44.63819 > 10.12.19.23.26872: UDP, length 0
11:38:55.668268 IP 10.12.100.44.63819 > 10.12.19.23.41638: UDP, length 0
11:38:55.668270 IP 10.12.100.44.63819 > 10.12.19.23.33249: UDP, length 0
11:38:55.671054 IP 10.12.100.44.63819 > 10.12.19.23.1072: UDP, length 0
11:38:55.671062 IP 10.12.100.44.63819 > 10.12.19.23.49393: UDP, length 0
11:38:55.671063 IP 10.12.100.44.63819 > 10.12.19.23.17237: UDP, length 0
11:38:55.673517 IP 10.12.100.44.63819 > 10.12.19.23.17494: UDP, length 0
11:38:55.673525 IP 10.12.100.44.63819 > 10.12.19.23.22124: UDP, length 0
11:38:55.673526 IP 10.12.100.44.63819 > 10.12.19.23.4008: UDP, length 0
11:38:55.715713 IP 10.12.100.44.63818 > 10.12.19.23.38293: UDP, length 0
11:38:55.718704 IP 10.12.100.44.63818 > 10.12.19.23.6004: UDP, length 0
11:38:55.718711 IP 10.12.100.44.63818 > 10.12.19.23.47915: UDP, length 0
11:38:55.718712 IP 10.12.100.44.63818 > 10.12.19.23.407: UDP, length 0
11:38:55.721360 IP 10.12.100.44.63818 > 10.12.19.23.47624: UDP, length 0
11:38:55.721367 IP 10.12.100.44.63818 > 10.12.19.23.1885: UDP, length 0
11:38:55.721368 IP 10.12.100.44.63818 > 10.12.19.23.36778: UDP, length 0
11:38:55.723733 IP 10.12.100.44.63818 > 10.12.19.23.40711: UDP, length 0
11:38:55.723825 IP 10.12.100.44.63818 > 10.12.19.23.1038: UDP, length 0
11:38:55.723828 IP 10.12.100.44.63818 > 10.12.19.23.19294: UDP, length 0
11:38:55.766556 IP 10.12.100.44.63819 > 10.12.19.23.38293: UDP, length 0
11:38:55.769191 IP 10.12.100.44.63819 > 10.12.19.23.407: UDP, length 0
11:38:55.769214 IP 10.12.100.44.63819 > 10.12.19.23.47915: UDP, length 0
11:38:55.769216 IP 10.12.100.44.63819 > 10.12.19.23.6004: UDP, length 0
11:38:55.771896 IP 10.12.100.44.63819 > 10.12.19.23.36778: UDP, length 0
11:38:55.771902 IP 10.12.100.44.63819 > 10.12.19.23.1885: UDP, length 0
11:38:55.771904 IP 10.12.100.44.63819 > 10.12.19.23.47624: UDP, length 0
11:38:55.774283 IP 10.12.100.44.63819 > 10.12.19.23.19294: UDP, length 0
11:38:55.774290 IP 10.12.100.44.63819 > 10.12.19.23.1038: UDP, length 0
11:38:55.774291 IP 10.12.100.44.63819 > 10.12.19.23.40711: UDP, length 0
11:38:55.816636 IP 10.12.100.44.63818 > 10.12.19.23.18818: UDP, length 0
11:38:55.819560 IP 10.12.100.44.63818 > 10.12.19.23.49222: UDP, length 0
11:38:55.819579 IP 10.12.100.44.63818 > 10.12.19.23.21902: UDP, length 0
11:38:55.819581 IP 10.12.100.44.63818 > 10.12.19.23.49306: UDP, length 0
11:38:55.822049 IP 10.12.100.44.63818 > 10.12.19.23.49191: UDP, length 0
11:38:55.822057 IP 10.12.100.44.63818 > 10.12.19.23.37813: UDP, length 0
11:38:55.822059 IP 10.12.100.44.63818 > 10.12.19.23.21364: UDP, length 0
11:38:55.824445 IP 10.12.100.44.63818 > 10.12.19.23.9877: UDP, length 0
11:38:55.824457 IP 10.12.100.44.63818 > 10.12.19.23.49167: UDP, length 0
11:38:55.824459 IP 10.12.100.44.63818 > 10.12.19.23.427: UDP, length 54
11:38:55.866999 IP 10.12.100.44.63819 > 10.12.19.23.18818: UDP, length 0
11:38:55.870112 IP 10.12.100.44.63819 > 10.12.19.23.49306: UDP, length 0
11:38:55.870123 IP 10.12.100.44.63819 > 10.12.19.23.21902: UDP, length 0
11:38:55.870125 IP 10.12.100.44.63819 > 10.12.19.23.49222: UDP, length 0
11:38:55.872535 IP 10.12.100.44.63819 > 10.12.19.23.21364: UDP, length 0
11:38:55.872542 IP 10.12.100.44.63819 > 10.12.19.23.37813: UDP, length 0
11:38:55.872544 IP 10.12.100.44.63819 > 10.12.19.23.49191: UDP, length 0
11:38:55.874865 IP 10.12.100.44.63819 > 10.12.19.23.427: UDP, length 54
11:38:55.874883 IP 10.12.100.44.63819 > 10.12.19.23.49167: UDP, length 0
11:38:55.874897 IP 10.12.100.44.63819 > 10.12.19.23.9877: UDP, length 0
11:38:55.917685 IP 10.12.100.44.63818 > 10.12.19.23.16433: UDP, length 0
11:38:55.920420 IP 10.12.100.44.63818 > 10.12.19.23.19541: UDP, length 0
11:38:55.920427 IP 10.12.100.44.63818 > 10.12.19.23.32774: UDP, length 0
11:38:55.920429 IP 10.12.100.44.63818 > 10.12.19.23.36893: UDP, length 0
11:38:55.922778 IP 10.12.100.44.63818 > 10.12.19.23.37602: UDP, length 0
11:38:55.922785 IP 10.12.100.44.63818 > 10.12.19.23.51717: UDP, length 0
11:38:55.922786 IP 10.12.100.44.63818 > 10.12.19.23.54807: UDP, length 0
11:38:55.925023 IP 10.12.100.44.63818 > 10.12.19.23.21298: UDP, length 0
11:38:55.925030 IP 10.12.100.44.63818 > 10.12.19.23.49162: UDP, length 0
11:38:55.925032 IP 10.12.100.44.63818 > 10.12.19.23.16912: UDP, length 0
11:38:55.967977 IP 10.12.100.44.63819 > 10.12.19.23.16433: UDP, length 0
11:38:55.970987 IP 10.12.100.44.63819 > 10.12.19.23.36893: UDP, length 0
11:38:55.970996 IP 10.12.100.44.63819 > 10.12.19.23.32774: UDP, length 0
11:38:55.970998 IP 10.12.100.44.63819 > 10.12.19.23.19541: UDP, length 0
11:38:55.973583 IP 10.12.100.44.63819 > 10.12.19.23.54807: UDP, length 0
11:38:55.973592 IP 10.12.100.44.63819 > 10.12.19.23.51717: UDP, length 0
11:38:55.973594 IP 10.12.100.44.63819 > 10.12.19.23.37602: UDP, length 0
11:38:55.976165 IP 10.12.100.44.63819 > 10.12.19.23.16912: UDP, length 0
11:38:55.976172 IP 10.12.100.44.63819 > 10.12.19.23.49162: UDP, length 0
11:38:55.976174 IP 10.12.100.44.63819 > 10.12.19.23.21298: UDP, length 0
11:38:56.018064 IP 10.12.100.44.63818 > 10.12.19.23.434: UDP, length 0
11:38:56.021180 IP 10.12.100.44.63818 > 10.12.19.23.137: NBT UDP PACKET(137): QUERY; REQUEST; BROADCAST
11:38:56.021223 IP 10.12.100.44.63818 > 10.12.19.23.57977: UDP, length 0
11:38:56.021227 IP 10.12.100.44.63818 > 10.12.19.23.22799: UDP, length 0
11:38:56.023757 IP 10.12.100.44.63818 > 10.12.19.23.49: UDP, length 0
11:38:56.023766 IP 10.12.100.44.63818 > 10.12.19.23.3664: UDP, length 0
11:38:56.023829 IP 10.12.100.44.63818 > 10.12.19.23.6971: UDP, length 0
11:38:56.026359 IP 10.12.100.44.63818 > 10.12.19.23.40019: UDP, length 0
11:38:56.026367 IP 10.12.100.44.63818 > 10.12.19.23.1457: UDP, length 0
11:38:56.026426 IP 10.12.100.44.63818 > 10.12.19.23.33459: UDP, length 0
11:38:56.068395 IP 10.12.100.44.63819 > 10.12.19.23.434: UDP, length 0
11:38:56.071755 IP 10.12.100.44.63819 > 10.12.19.23.22799: UDP, length 0
11:38:56.071776 IP 10.12.100.44.63819 > 10.12.19.23.57977: UDP, length 0
11:38:56.071793 IP 10.12.100.44.63819 > 10.12.19.23.137: NBT UDP PACKET(137): QUERY; REQUEST; BROADCAST
11:38:56.074120 IP 10.12.100.44.63819 > 10.12.19.23.6971: UDP, length 0
11:38:56.074126 IP 10.12.100.44.63819 > 10.12.19.23.3664: UDP, length 0
11:38:56.074140 IP 10.12.100.44.63819 > 10.12.19.23.49: UDP, length 0
11:38:56.076728 IP 10.12.100.44.63819 > 10.12.19.23.33459: UDP, length 0
11:38:56.076750 IP 10.12.100.44.63819 > 10.12.19.23.1457: UDP, length 0
11:38:56.076751 IP 10.12.100.44.63819 > 10.12.19.23.40019: UDP, length 0
11:38:56.119268 IP 10.12.100.44.63818 > 10.12.19.23.43824: UDP, length 0
11:38:56.122172 IP 10.12.100.44.63818 > 10.12.19.23.16972: UDP, length 0
11:38:56.122179 IP 10.12.100.44.63818 > 10.12.19.23.27892: UDP, length 0
11:38:56.122181 IP 10.12.100.44.63818 > 10.12.19.23.17490: UDP, length 0
11:38:56.124598 IP 10.12.100.44.63818 > 10.12.19.23.55043: UDP, length 0
11:38:56.124620 IP 10.12.100.44.63818 > 10.12.19.23.21083: UDP, length 0
11:38:56.124622 IP 10.12.100.44.63818 > 10.12.19.23.49179: UDP, length 0
11:38:56.127032 IP 10.12.100.44.63818 > 10.12.19.23.37144: UDP, length 0
11:38:56.127038 IP 10.12.100.44.63818 > 10.12.19.23.24606: UDP, length 0
11:38:56.127040 IP 10.12.100.44.63818 > 10.12.19.23.965: UDP, length 0
11:38:56.169771 IP 10.12.100.44.63819 > 10.12.19.23.43824: UDP, length 0
11:38:56.172460 IP 10.12.100.44.63819 > 10.12.19.23.17490: UDP, length 0
11:38:56.172472 IP 10.12.100.44.63819 > 10.12.19.23.27892: UDP, length 0
11:38:56.172474 IP 10.12.100.44.63819 > 10.12.19.23.16972: UDP, length 0
11:38:56.174990 IP 10.12.100.44.63819 > 10.12.19.23.49179: UDP, length 0
11:38:56.175007 IP 10.12.100.44.63819 > 10.12.19.23.21083: UDP, length 0
11:38:56.175009 IP 10.12.100.44.63819 > 10.12.19.23.55043: UDP, length 0
11:38:56.177555 IP 10.12.100.44.63819 > 10.12.19.23.965: UDP, length 0
11:38:56.177576 IP 10.12.100.44.63819 > 10.12.19.23.24606: UDP, length 0
11:38:56.177578 IP 10.12.100.44.63819 > 10.12.19.23.37144: UDP, length 0
11:38:56.220231 IP 10.12.100.44.63818 > 10.12.19.23.47981: UDP, length 0
11:38:56.222685 IP 10.12.100.44.63818 > 10.12.19.23.49158: UDP, length 0
11:38:56.222692 IP 10.12.100.44.63818 > 10.12.19.23.23557: UDP, length 0
11:38:56.222694 IP 10.12.100.44.63818 > 10.12.19.23.17077: UDP, length 0
11:38:56.225487 IP 10.12.100.44.63818 > 10.12.19.23.20366: UDP, length 0
11:38:56.225494 IP 10.12.100.44.63818 > 10.12.19.23.17787: UDP, length 0
11:38:56.225496 IP 10.12.100.44.63818 > 10.12.19.23.9200: UDP, length 0
11:38:56.228043 IP 10.12.100.44.63818 > 10.12.19.23.49259: UDP, length 0
11:38:56.228049 IP 10.12.100.44.63818 > 10.12.19.23.23354: UDP, length 0
11:38:56.228051 IP 10.12.100.44.63818 > 10.12.19.23.19022: UDP, length 0
11:38:56.270686 IP 10.12.100.44.63819 > 10.12.19.23.47981: UDP, length 0
11:38:56.273053 IP 10.12.100.44.63819 > 10.12.19.23.17077: UDP, length 0
11:38:56.273060 IP 10.12.100.44.63819 > 10.12.19.23.23557: UDP, length 0
11:38:56.273074 IP 10.12.100.44.63819 > 10.12.19.23.49158: UDP, length 0
11:38:56.275849 IP 10.12.100.44.63819 > 10.12.19.23.9200: UDP, length 0
11:38:56.275856 IP 10.12.100.44.63819 > 10.12.19.23.17787: UDP, length 0
11:38:56.275858 IP 10.12.100.44.63819 > 10.12.19.23.20366: UDP, length 0
11:38:56.278279 IP 10.12.100.44.63819 > 10.12.19.23.19022: UDP, length 0
11:38:56.278298 IP 10.12.100.44.63819 > 10.12.19.23.23354: UDP, length 0
11:38:56.278299 IP 10.12.100.44.63819 > 10.12.19.23.49259: UDP, length 0
11:38:56.320927 IP 10.12.100.44.63818 > 10.12.19.23.21621: UDP, length 0
11:38:56.323565 IP 10.12.100.44.63818 > 10.12.19.23.59193: UDP, length 0
11:38:56.323574 IP 10.12.100.44.63818 > 10.12.19.23.19632: UDP, length 0
11:38:56.323615 IP 10.12.100.44.63818 > 10.12.19.23.32769: UDP, length 0
11:38:56.325956 IP 10.12.100.44.63818 > 10.12.19.23.7: UDP, length 4
11:38:56.325977 IP 10.12.100.44.63818 > 10.12.19.23.9199: UDP, length 0
11:38:56.326063 IP 10.12.100.44.63818 > 10.12.19.23.57843: UDP, length 0
11:38:56.328704 IP 10.12.100.44.63818 > 10.12.19.23.3659: UDP, length 0
11:38:56.328712 IP 10.12.100.44.63818 > 10.12.19.23.512: UDP, length 0
11:38:56.328713 IP 10.12.100.44.63818 > 10.12.19.23.24279: UDP, length 0
11:38:56.370996 IP 10.12.100.44.63819 > 10.12.19.23.21621: UDP, length 0
11:38:56.374157 IP 10.12.100.44.63819 > 10.12.19.23.32769: UDP, length 0
11:38:56.374173 IP 10.12.100.44.63819 > 10.12.19.23.19632: UDP, length 0
11:38:56.374175 IP 10.12.100.44.63819 > 10.12.19.23.59193: UDP, length 0
11:38:56.376643 IP 10.12.100.44.63819 > 10.12.19.23.57843: UDP, length 0
11:38:56.376682 IP 10.12.100.44.63819 > 10.12.19.23.9199: UDP, length 0
11:38:56.376683 IP 10.12.100.44.63819 > 10.12.19.23.7: UDP, length 4
11:38:56.379162 IP 10.12.100.44.63819 > 10.12.19.23.24279: UDP, length 0
11:38:56.379188 IP 10.12.100.44.63819 > 10.12.19.23.512: UDP, length 0
11:38:56.379189 IP 10.12.100.44.63819 > 10.12.19.23.3659: UDP, length 0
11:38:56.421315 IP 10.12.100.44.63818 > 10.12.19.23.64080: UDP, length 0
11:38:56.424607 IP 10.12.100.44.63818 > 10.12.19.23.17205: UDP, length 0
11:38:56.424614 IP 10.12.100.44.63818 > 10.12.19.23.25240: UDP, length 0
11:38:56.424616 IP 10.12.100.44.63818 > 10.12.19.23.20791: UDP, length 0
11:38:56.427212 IP 10.12.100.44.63818 > 10.12.19.23.18994: UDP, length 0
11:38:56.427219 IP 10.12.100.44.63818 > 10.12.19.23.50497: UDP, length 0
11:38:56.427220 IP 10.12.100.44.63818 > 10.12.19.23.19222: UDP, length 0
