11:44:14.061309 ARP, Request who-has 10.12.19.23 (ff:ff:ff:ff:ff:ff) tell 10.12.100.44, length 46
11:44:14.261706 IP 10.12.100.44.45007 > 10.12.19.23.1720: Flags [FPU], seq 3743758929, win 1024, urg 0, length 0
11:44:14.261724 IP 10.12.100.44.45007 > 10.12.19.23.1723: Flags [FPU], seq 3743758929, win 1024, urg 0, length 0
11:44:14.261725 IP 10.12.100.44.45007 > 10.12.19.23.139: Flags [FPU], seq 3743758929, win 1024, urg 0, length 0
11:44:14.261726 IP 10.12.100.44.45007 > 10.12.19.23.80: Flags [FPU], seq 3743758929, win 1024, urg 0, length 0
11:44:14.261731 IP 10.12.100.44.45007 > 10.12.19.23.587: Flags [FPU], seq 3743758929, win 1024, urg 0, length 0
11:44:14.261744 IP 10.12.100.44.45007 > 10.12.19.23.143: Flags [FPU], seq 3743758929, win 1024, urg 0, length 0
11:44:14.261799 IP 10.12.100.44.45007 > 10.12.19.23.993: Flags [FPU], seq 3743758929, win 1024, urg 0, length 0
11:44:14.261802 IP 10.12.100.44.45007 > 10.12.19.23.1025: Flags [FPU], seq 3743758929, win 1024, urg 0, length 0
11:44:14.261803 IP 10.12.100.44.45007 > 10.12.19.23.22: Flags [FPU], seq 3743758929, win 1024, urg 0, length 0
11:44:14.261877 IP 10.12.100.44.45007 > 10.12.19.23.199: Flags [FPU], seq 3743758929, win 1024, urg 0, length 0
11:44:15.313477 IP 10.12.100.44.45008 > 10.12.19.23.199: Flags [FPU], seq 3743693392, win 1024, urg 0, length 0
11:44:15.313522 IP 10.12.100.44.45008 > 10.12.19.23.22: Flags [FPU], seq 3743693392, win 1024, urg 0, length 0
11:44:15.313524 IP 10.12.100.44.45008 > 10.12.19.23.1025: Flags [FPU], seq 3743693392, win 1024, urg 0, length 0
11:44:15.313525 IP 10.12.100.44.45008 > 10.12.19.23.993: Flags [FPU], seq 3743693392, win 1024, urg 0, length 0
11:44:15.313526 IP 10.12.100.44.45008 > 10.12.19.23.143: Flags [FPU], seq 3743693392, win 1024, urg 0, length 0
11:44:15.313527 IP 10.12.100.44.45008 > 10.12.19.23.587: Flags [FPU], seq 3743693392, win 1024, urg 0, length 0
11:44:15.313643 IP 10.12.100.44.45008 > 10.12.19.23.80: Flags [FPU], seq 3743693392, win 1024, urg 0, length 0
11:44:15.313649 IP 10.12.100.44.45008 > 10.12.19.23.139: Flags [FPU], seq 3743693392, win 1024, urg 0, length 0
11:44:15.313650 IP 10.12.100.44.45008 > 10.12.19.23.1723: Flags [FPU], seq 3743693392, win 1024, urg 0, length 0
11:44:15.313724 IP 10.12.100.44.45008 > 10.12.19.23.1720: Flags [FPU], seq 3743693392, win 1024, urg 0, length 0
11:44:15.363653 IP 10.12.100.44.45007 > 10.12.19.23.25: Flags [FPU], seq 3743758929, win 1024, urg 0, length 0
11:44:15.363661 IP 10.12.100.44.45007 > 10.12.19.23.8080: Flags [FPU], seq 3743758929, win 1024, urg 0, length 0
11:44:15.363663 IP 10.12.100.44.45007 > 10.12.19.23.21: Flags [FPU], seq 3743758929, win 1024, urg 0, length 0
11:44:15.363725 IP 10.12.100.44.45007 > 10.12.19.23.3306: Flags [FPU], seq 3743758929, win 1024, urg 0, length 0
11:44:15.363740 IP 10.12.100.44.45007 > 10.12.19.23.5900: Flags [FPU], seq 3743758929, win 1024, urg 0, length 0
11:44:15.363741 IP 10.12.100.44.45007 > 10.12.19.23.23: Flags [FPU], seq 3743758929, win 1024, urg 0, length 0
11:44:15.363742 IP 10.12.100.44.45007 > 10.12.19.23.53: Flags [FPU], seq 3743758929, win 1024, urg 0, length 0
11:44:15.366337 IP 10.12.100.44.45007 > 10.12.19.23.443: Flags [FPU], seq 3743758929, win 1024, urg 0, length 0
11:44:15.366378 IP 10.12.100.44.45007 > 10.12.19.23.3389: Flags [FPU], seq 3743758929, win 1024, urg 0, length 0
11:44:15.366380 IP 10.12.100.44.45007 > 10.12.19.23.110: Flags [FPU], seq 3743758929, win 1024, urg 0, length 0
11:44:15.413990 IP 10.12.100.44.45008 > 10.12.19.23.53: Flags [FPU], seq 3743693392, win 1024, urg 0, length 0
11:44:15.414004 IP 10.12.100.44.45008 > 10.12.19.23.23: Flags [FPU], seq 3743693392, win 1024, urg 0, length 0
11:44:15.414005 IP 10.12.100.44.45008 > 10.12.19.23.5900: Flags [FPU], seq 3743693392, win 1024, urg 0, length 0
11:44:15.414006 IP 10.12.100.44.45008 > 10.12.19.23.3306: Flags [FPU], seq 3743693392, win 1024, urg 0, length 0
11:44:15.414051 IP 10.12.100.44.45008 > 10.12.19.23.21: Flags [FPU], seq 3743693392, win 1024, urg 0, length 0
11:44:15.414053 IP 10.12.100.44.45008 > 10.12.19.23.8080: Flags [FPU], seq 3743693392, win 1024, urg 0, length 0
11:44:15.414054 IP 10.12.100.44.45008 > 10.12.19.23.25: Flags [FPU], seq 3743693392, win 1024, urg 0, length 0
11:44:15.416805 IP 10.12.100.44.45008 > 10.12.19.23.110: Flags [FPU], seq 3743693392, win 1024, urg 0, length 0
11:44:15.416812 IP 10.12.100.44.45008 > 10.12.19.23.3389: Flags [FPU], seq 3743693392, win 1024, urg 0, length 0
11:44:15.416813 IP 10.12.100.44.45008 > 10.12.19.23.443: Flags [FPU], seq 3743693392, win 1024, urg 0, length 0
11:44:16.468076 IP 10.12.100.44.45009 > 10.12.19.23.3389: Flags [FPU], seq 3743890003, win 1024, urg 0, length 0
11:44:16.468094 IP 10.12.100.44.45009 > 10.12.19.23.110: Flags [FPU], seq 3743890003, win 1024, urg 0, length 0
11:44:16.468095 IP 10.12.100.44.45009 > 10.12.19.23.25: Flags [FPU], seq 3743890003, win 1024, urg 0, length 0
11:44:16.468096 IP 10.12.100.44.45009 > 10.12.19.23.8080: Flags [FPU], seq 3743890003, win 1024, urg 0, length 0
11:44:16.468097 IP 10.12.100.44.45009 > 10.12.19.23.21: Flags [FPU], seq 3743890003, win 1024, urg 0, length 0
11:44:16.468144 IP 10.12.100.44.45009 > 10.12.19.23.3306: Flags [FPU], seq 3743890003, win 1024, urg 0, length 0
11:44:16.468147 IP 10.12.100.44.45009 > 10.12.19.23.5900: Flags [FPU], seq 3743890003, win 1024, urg 0, length 0
11:44:16.468147 IP 10.12.100.44.45009 > 10.12.19.23.23: Flags [FPU], seq 3743890003, win 1024, urg 0, length 0
11:44:16.518204 IP 10.12.100.44.45009 > 10.12.19.23.53: Flags [FPU], seq 3743890003, win 1024, urg 0, length 0
11:44:16.518222 IP 10.12.100.44.45009 > 10.12.19.23.1720: Flags [FPU], seq 3743890003, win 1024, urg 0, length 0
11:44:16.518224 IP 10.12.100.44.45009 > 10.12.19.23.1723: Flags [FPU], seq 3743890003, win 1024, urg 0, length 0
11:44:16.518225 IP 10.12.100.44.45009 > 10.12.19.23.139: Flags [FPU], seq 3743890003, win 1024, urg 0, length 0
11:44:16.520747 IP 10.12.100.44.45009 > 10.12.19.23.80: Flags [FPU], seq 3743890003, win 1024, urg 0, length 0
11:44:16.520757 IP 10.12.100.44.45009 > 10.12.19.23.587: Flags [FPU], seq 3743890003, win 1024, urg 0, length 0
11:44:16.520759 IP 10.12.100.44.45009 > 10.12.19.23.143: Flags [FPU], seq 3743890003, win 1024, urg 0, length 0
11:44:16.520760 IP 10.12.100.44.45009 > 10.12.19.23.993: Flags [FPU], seq 3743890003, win 1024, urg 0, length 0
11:44:16.568771 IP 10.12.100.44.45009 > 10.12.19.23.1025: Flags [FPU], seq 3743890003, win 1024, urg 0, length 0
11:44:16.568799 IP 10.12.100.44.45009 > 10.12.19.23.22: Flags [FPU], seq 3743890003, win 1024, urg 0, length 0
11:44:16.568801 IP 10.12.100.44.45009 > 10.12.19.23.199: Flags [FPU], seq 3743890003, win 1024, urg 0, length 0
11:44:16.568802 IP 10.12.100.44.45007 > 10.12.19.23.135: Flags [FPU], seq 3743758929, win 1024, urg 0, length 0
11:44:16.571230 IP 10.12.100.44.45007 > 10.12.19.23.111: Flags [FPU], seq 3743758929, win 1024, urg 0, length 0
11:44:16.571237 IP 10.12.100.44.45007 > 10.12.19.23.995: Flags [FPU], seq 3743758929, win 1024, urg 0, length 0
11:44:16.571239 IP 10.12.100.44.45007 > 10.12.19.23.554: Flags [FPU], seq 3743758929, win 1024, urg 0, length 0
11:44:16.571240 IP 10.12.100.44.45007 > 10.12.19.23.445: Flags [FPU], seq 3743758929, win 1024, urg 0, length 0
11:44:16.619431 IP 10.12.100.44.45008 > 10.12.19.23.135: Flags [FPU], seq 3743693392, win 1024, urg 0, length 0
11:44:16.619481 IP 10.12.100.44.45007 > 10.12.19.23.113: Flags [FPU], seq 3743758929, win 1024, urg 0, length 0
11:44:16.619482 IP 10.12.100.44.45007 > 10.12.19.23.8888: Flags [FPU], seq 3743758929, win 1024, urg 0, length 0
11:44:16.619483 IP 10.12.100.44.45007 > 10.12.19.23.256: Flags [FPU], seq 3743758929, win 1024, urg 0, length 0
11:44:16.621952 IP 10.12.100.44.45008 > 10.12.19.23.445: Flags [FPU], seq 3743693392, win 1024, urg 0, length 0
11:44:16.621959 IP 10.12.100.44.45008 > 10.12.19.23.554: Flags [FPU], seq 3743693392, win 1024, urg 0, length 0
11:44:16.621960 IP 10.12.100.44.45008 > 10.12.19.23.995: Flags [FPU], seq 3743693392, win 1024, urg 0, length 0
11:44:16.621961 IP 10.12.100.44.45008 > 10.12.19.23.111: Flags [FPU], seq 3743693392, win 1024, urg 0, length 0
11:44:16.670040 IP 10.12.100.44.45010 > 10.12.19.23.443: Flags [FPU], seq 3726981969, win 1024, urg 0, length 0
11:44:16.670083 IP 10.12.100.44.45008 > 10.12.19.23.256: Flags [FPU], seq 3743693392, win 1024, urg 0, length 0
11:44:16.670085 IP 10.12.100.44.45008 > 10.12.19.23.8888: Flags [FPU], seq 3743693392, win 1024, urg 0, length 0
11:44:16.670086 IP 10.12.100.44.45008 > 10.12.19.23.113: Flags [FPU], seq 3743693392, win 1024, urg 0, length 0
11:44:16.672526 IP 10.12.100.44.45009 > 10.12.19.23.111: Flags [FPU], seq 3743890003, win 1024, urg 0, length 0
11:44:16.672533 IP 10.12.100.44.45009 > 10.12.19.23.995: Flags [FPU], seq 3743890003, win 1024, urg 0, length 0
11:44:16.672534 IP 10.12.100.44.45009 > 10.12.19.23.554: Flags [FPU], seq 3743890003, win 1024, urg 0, length 0
11:44:16.672625 IP 10.12.100.44.45009 > 10.12.19.23.445: Flags [FPU], seq 3743890003, win 1024, urg 0, length 0
11:44:16.722971 IP 10.12.100.44.45009 > 10.12.19.23.113: Flags [FPU], seq 3743890003, win 1024, urg 0, length 0
11:44:16.773277 IP 10.12.100.44.45009 > 10.12.19.23.8888: Flags [FPU], seq 3743890003, win 1024, urg 0, length 0
11:44:16.824268 IP 10.12.100.44.45009 > 10.12.19.23.256: Flags [FPU], seq 3743890003, win 1024, urg 0, length 0
11:44:16.876668 IP 10.12.100.44.45009 > 10.12.19.23.135: Flags [FPU], seq 3743890003, win 1024, urg 0, length 0
11:44:16.876698 IP 10.12.100.44.45007 > 10.12.19.23.783: Flags [FPU], seq 3743758929, win 1024, urg 0, length 0
11:44:16.876699 IP 10.12.100.44.45007 > 10.12.19.23.10082: Flags [FPU], seq 3743758929, win 1024, urg 0, length 0
11:44:16.876700 IP 10.12.100.44.45007 > 10.12.19.23.49175: Flags [FPU], seq 3743758929, win 1024, urg 0, length 0
11:44:16.876790 IP 10.12.100.44.45007 > 10.12.19.23.32774: Flags [FPU], seq 3743758929, win 1024, urg 0, length 0
11:44:16.926896 IP 10.12.100.44.45008 > 10.12.19.23.32774: Flags [FPU], seq 3743693392, win 1024, urg 0, length 0
11:44:16.926927 IP 10.12.100.44.45008 > 10.12.19.23.49175: Flags [FPU], seq 3743693392, win 1024, urg 0, length 0
11:44:16.926928 IP 10.12.100.44.45008 > 10.12.19.23.10082: Flags [FPU], seq 3743693392, win 1024, urg 0, length 0
11:44:16.926929 IP 10.12.100.44.45008 > 10.12.19.23.783: Flags [FPU], seq 3743693392, win 1024, urg 0, length 0
11:44:16.926930 IP 10.12.100.44.45007 > 10.12.19.23.3826: Flags [FPU], seq 3743758929, win 1024, urg 0, length 0
11:44:16.978158 IP 10.12.100.44.45008 > 10.12.19.23.3826: Flags [FPU], seq 3743693392, win 1024, urg 0, length 0
11:44:16.978204 IP 10.12.100.44.45009 > 10.12.19.23.783: Flags [FPU], seq 3743890003, win 1024, urg 0, length 0
11:44:16.978205 IP 10.12.100.44.45009 > 10.12.19.23.10082: Flags [FPU], seq 3743890003, win 1024, urg 0, length 0
11:44:16.978206 IP 10.12.100.44.45009 > 10.12.19.23.49175: Flags [FPU], seq 3743890003, win 1024, urg 0, length 0
11:44:16.978207 IP 10.12.100.44.45009 > 10.12.19.23.32774: Flags [FPU], seq 3743890003, win 1024, urg 0, length 0
11:44:17.028668 IP 10.12.100.44.45009 > 10.12.19.23.3826: Flags [FPU], seq 3743890003, win 1024, urg 0, length 0
11:44:17.028697 IP 10.12.100.44.45007 > 10.12.19.23.1111: Flags [FPU], seq 3743758929, win 1024, urg 0, length 0
11:44:17.028699 IP 10.12.100.44.45007 > 10.12.19.23.32783: Flags [FPU], seq 3743758929, win 1024, urg 0, length 0
11:44:17.028700 IP 10.12.100.44.45007 > 10.12.19.23.7999: Flags [FPU], seq 3743758929, win 1024, urg 0, length 0
11:44:17.028801 IP 10.12.100.44.45007 > 10.12.19.23.1443: Flags [FPU], seq 3743758929, win 1024, urg 0, length 0
11:44:17.078782 IP 10.12.100.44.45008 > 10.12.19.23.1111: Flags [FPU], seq 3743693392, win 1024, urg 0, length 0
11:44:17.078804 IP 10.12.100.44.45007 > 10.12.19.23.6009: Flags [FPU], seq 3743758929, win 1024, urg 0, length 0
11:44:17.081394 IP 10.12.100.44.45008 > 10.12.19.23.1443: Flags [FPU], seq 3743693392, win 1024, urg 0, length 0
11:44:17.081416 IP 10.12.100.44.45008 > 10.12.19.23.7999: Flags [FPU], seq 3743693392, win 1024, urg 0, length 0
11:44:17.081417 IP 10.12.100.44.45008 > 10.12.19.23.32783: Flags [FPU], seq 3743693392, win 1024, urg 0, length 0
11:44:17.129003 IP 10.12.100.44.45008 > 10.12.19.23.6009: Flags [FPU], seq 3743693392, win 1024, urg 0, length 0
11:44:17.129021 IP 10.12.100.44.45009 > 10.12.19.23.1111: Flags [FPU], seq 3743890003, win 1024, urg 0, length 0
11:44:17.131810 IP 10.12.100.44.45009 > 10.12.19.23.32783: Flags [FPU], seq 3743890003, win 1024, urg 0, length 0
11:44:17.131816 IP 10.12.100.44.45009 > 10.12.19.23.7999: Flags [FPU], seq 3743890003, win 1024, urg 0, length 0
11:44:17.131867 IP 10.12.100.44.45009 > 10.12.19.23.1443: Flags [FPU], seq 3743890003, win 1024, urg 0, length 0
11:44:17.180221 IP 10.12.100.44.45009 > 10.12.19.23.6009: Flags [FPU], seq 3743890003, win 1024, urg 0, length 0
11:44:17.180239 IP 10.12.100.44.45007 > 10.12.19.23.1072: Flags [FPU], seq 3743758929, win 1024, urg 0, length 0
11:44:17.182611 IP 10.12.100.44.45007 > 10.12.19.23.6689: Flags [FPU], seq 3743758929, win 1024, urg 0, length 0
11:44:17.182618 IP 10.12.100.44.45007 > 10.12.19.23.340: Flags [FPU], seq 3743758929, win 1024, urg 0, length 0
11:44:17.182620 IP 10.12.100.44.45007 > 10.12.19.23.1038: Flags [FPU], seq 3743758929, win 1024, urg 0, length 0
11:44:17.230315 IP 10.12.100.44.45008 > 10.12.19.23.1072: Flags [FPU], seq 3743693392, win 1024, urg 0, length 0
11:44:17.230346 IP 10.12.100.44.45007 > 10.12.19.23.264: Flags [FPU], seq 3743758929, win 1024, urg 0, length 0
11:44:17.233072 IP 10.12.100.44.45008 > 10.12.19.23.1038: Flags [FPU], seq 3743693392, win 1024, urg 0, length 0
11:44:17.233080 IP 10.12.100.44.45008 > 10.12.19.23.340: Flags [FPU], seq 3743693392, win 1024, urg 0, length 0
11:44:17.233081 IP 10.12.100.44.45008 > 10.12.19.23.6689: Flags [FPU], seq 3743693392, win 1024, urg 0, length 0
11:44:17.280468 IP 10.12.100.44.45008 > 10.12.19.23.264: Flags [FPU], seq 3743693392, win 1024, urg 0, length 0
11:44:17.280487 IP 10.12.100.44.45009 > 10.12.19.23.1072: Flags [FPU], seq 3743890003, win 1024, urg 0, length 0
11:44:17.283201 IP 10.12.100.44.45009 > 10.12.19.23.6689: Flags [FPU], seq 3743890003, win 1024, urg 0, length 0
11:44:17.283214 IP 10.12.100.44.45009 > 10.12.19.23.340: Flags [FPU], seq 3743890003, win 1024, urg 0, length 0
11:44:17.283215 IP 10.12.100.44.45009 > 10.12.19.23.1038: Flags [FPU], seq 3743890003, win 1024, urg 0, length 0
11:44:17.330771 IP 10.12.100.44.45009 > 10.12.19.23.264: Flags [FPU], seq 3743890003, win 1024, urg 0, length 0
11:44:17.330789 IP 10.12.100.44.45007 > 10.12.19.23.7200: Flags [FPU], seq 3743758929, win 1024, urg 0, length 0
11:44:17.333294 IP 10.12.100.44.45007 > 10.12.19.23.2100: Flags [FPU], seq 3743758929, win 1024, urg 0, length 0
11:44:17.335716 IP 10.12.100.44.45007 > 10.12.19.23.5901: Flags [FPU], seq 3743758929, win 1024, urg 0, length 0
11:44:17.335725 IP 10.12.100.44.45007 > 10.12.19.23.49157: Flags [FPU], seq 3743758929, win 1024, urg 0, length 0
11:44:17.381874 IP 10.12.100.44.45008 > 10.12.19.23.7200: Flags [FPU], seq 3743693392, win 1024, urg 0, length 0
11:44:17.381890 IP 10.12.100.44.45007 > 10.12.19.23.43: Flags [FPU], seq 3743758929, win 1024, urg 0, length 0
11:44:17.384164 IP 10.12.100.44.45008 > 10.12.19.23.2100: Flags [FPU], seq 3743693392, win 1024, urg 0, length 0
11:44:17.386418 IP 10.12.100.44.45008 > 10.12.19.23.49157: Flags [FPU], seq 3743693392, win 1024, urg 0, length 0
11:44:17.386424 IP 10.12.100.44.45008 > 10.12.19.23.5901: Flags [FPU], seq 3743693392, win 1024, urg 0, length 0
11:44:17.432225 IP 10.12.100.44.45008 > 10.12.19.23.43: Flags [FPU], seq 3743693392, win 1024, urg 0, length 0
11:44:17.432256 IP 10.12.100.44.45009 > 10.12.19.23.7200: Flags [FPU], seq 3743890003, win 1024, urg 0, length 0
11:44:17.434804 IP 10.12.100.44.45009 > 10.12.19.23.2100: Flags [FPU], seq 3743890003, win 1024, urg 0, length 0
11:44:17.437325 IP 10.12.100.44.45009 > 10.12.19.23.5901: Flags [FPU], seq 3743890003, win 1024, urg 0, length 0
11:44:17.437331 IP 10.12.100.44.45009 > 10.12.19.23.49157: Flags [FPU], seq 3743890003, win 1024, urg 0, length 0
11:44:17.482527 IP 10.12.100.44.45009 > 10.12.19.23.43: Flags [FPU], seq 3743890003, win 1024, urg 0, length 0
11:44:17.482547 IP 10.12.100.44.45007 > 10.12.19.23.9877: Flags [FPU], seq 3743758929, win 1024, urg 0, length 0
11:44:17.485332 IP 10.12.100.44.45007 > 10.12.19.23.1169: Flags [FPU], seq 3743758929, win 1024, urg 0, length 0
11:44:17.487496 IP 10.12.100.44.45007 > 10.12.19.23.9898: Flags [FPU], seq 3743758929, win 1024, urg 0, length 0
11:44:17.487507 IP 10.12.100.44.45007 > 10.12.19.23.49154: Flags [FPU], seq 3743758929, win 1024, urg 0, length 0
11:44:17.533017 IP 10.12.100.44.45008 > 10.12.19.23.9877: Flags [FPU], seq 3743693392, win 1024, urg 0, length 0
11:44:17.533034 IP 10.12.100.44.45007 > 10.12.19.23.7496: Flags [FPU], seq 3743758929, win 1024, urg 0, length 0
11:44:17.535563 IP 10.12.100.44.45008 > 10.12.19.23.1169: Flags [FPU], seq 3743693392, win 1024, urg 0, length 0
11:44:17.538141 IP 10.12.100.44.45008 > 10.12.19.23.49154: Flags [FPU], seq 3743693392, win 1024, urg 0, length 0
11:44:17.538217 IP 10.12.100.44.45008 > 10.12.19.23.9898: Flags [FPU], seq 3743693392, win 1024, urg 0, length 0
11:44:17.584228 IP 10.12.100.44.45008 > 10.12.19.23.7496: Flags [FPU], seq 3743693392, win 1024, urg 0, length 0
11:44:17.584240 IP 10.12.100.44.45009 > 10.12.19.23.9877: Flags [FPU], seq 3743890003, win 1024, urg 0, length 0
11:44:17.586556 IP 10.12.100.44.45009 > 10.12.19.23.1169: Flags [FPU], seq 3743890003, win 1024, urg 0, length 0
11:44:17.589088 IP 10.12.100.44.45009 > 10.12.19.23.9898: Flags [FPU], seq 3743890003, win 1024, urg 0, length 0
11:44:17.589095 IP 10.12.100.44.45009 > 10.12.19.23.49154: Flags [FPU], seq 3743890003, win 1024, urg 0, length 0
11:44:17.634898 IP 10.12.100.44.45009 > 10.12.19.23.7496: Flags [FPU], seq 3743890003, win 1024, urg 0, length 0
11:44:17.634928 IP 10.12.100.44.45007 > 10.12.19.23.2869: Flags [FPU], seq 3743758929, win 1024, urg 0, length 0
11:44:17.637433 IP 10.12.100.44.45007 > 10.12.19.23.5004: Flags [FPU], seq 3743758929, win 1024, urg 0, length 0
11:44:17.639953 IP 10.12.100.44.45007 > 10.12.19.23.465: Flags [FPU], seq 3743758929, win 1024, urg 0, length 0
11:44:17.639959 IP 10.12.100.44.45007 > 10.12.19.23.7201: Flags [FPU], seq 3743758929, win 1024, urg 0, length 0
11:44:17.685132 IP 10.12.100.44.45008 > 10.12.19.23.2869: Flags [FPU], seq 3743693392, win 1024, urg 0, length 0
11:44:17.685160 IP 10.12.100.44.45007 > 10.12.19.23.1175: Flags [FPU], seq 3743758929, win 1024, urg 0, length 0
11:44:17.687837 IP 10.12.100.44.45008 > 10.12.19.23.5004: Flags [FPU], seq 3743693392, win 1024, urg 0, length 0
11:44:17.690139 IP 10.12.100.44.45008 > 10.12.19.23.7201: Flags [FPU], seq 3743693392, win 1024, urg 0, length 0
11:44:17.690146 IP 10.12.100.44.45008 > 10.12.19.23.465: Flags [FPU], seq 3743693392, win 1024, urg 0, length 0
11:44:17.735077 IP 10.12.100.44.45009 > 10.12.19.23.2869: Flags [FPU], seq 3743890003, win 1024, urg 0, length 0
11:44:17.737587 IP 10.12.100.44.45008 > 10.12.19.23.1175: Flags [FPU], seq 3743693392, win 1024, urg 0, length 0
11:44:17.739731 IP 10.12.100.44.45009 > 10.12.19.23.5004: Flags [FPU], seq 3743890003, win 1024, urg 0, length 0
11:44:17.742258 IP 10.12.100.44.45009 > 10.12.19.23.465: Flags [FPU], seq 3743890003, win 1024, urg 0, length 0
11:44:17.742263 IP 10.12.100.44.45009 > 10.12.19.23.7201: Flags [FPU], seq 3743890003, win 1024, urg 0, length 0
11:44:17.786268 IP 10.12.100.44.45007 > 10.12.19.23.10629: Flags [FPU], seq 3743758929, win 1024, urg 0, length 0
11:44:17.788784 IP 10.12.100.44.45009 > 10.12.19.23.1175: Flags [FPU], seq 3743890003, win 1024, urg 0, length 0
11:44:17.791277 IP 10.12.100.44.45007 > 10.12.19.23.54328: Flags [FPU], seq 3743758929, win 1024, urg 0, length 0
11:44:17.793617 IP 10.12.100.44.45007 > 10.12.19.23.1217: Flags [FPU], seq 3743758929, win 1024, urg 0, length 0
11:44:17.793635 IP 10.12.100.44.45007 > 10.12.19.23.11111: Flags [FPU], seq 3743758929, win 1024, urg 0, length 0
11:44:17.836678 IP 10.12.100.44.45008 > 10.12.19.23.10629: Flags [FPU], seq 3743693392, win 1024, urg 0, length 0
11:44:17.839260 IP 10.12.100.44.45007 > 10.12.19.23.2144: Flags [FPU], seq 3743758929, win 1024, urg 0, length 0
11:44:17.841681 IP 10.12.100.44.45008 > 10.12.19.23.54328: Flags [FPU], seq 3743693392, win 1024, urg 0, length 0
11:44:17.844042 IP 10.12.100.44.45008 > 10.12.19.23.11111: Flags [FPU], seq 3743693392, win 1024, urg 0, length 0
11:44:17.844048 IP 10.12.100.44.45008 > 10.12.19.23.1217: Flags [FPU], seq 3743693392, win 1024, urg 0, length 0
11:44:17.887153 IP 10.12.100.44.45009 > 10.12.19.23.10629: Flags [FPU], seq 3743890003, win 1024, urg 0, length 0
11:44:17.889560 IP 10.12.100.44.45008 > 10.12.19.23.2144: Flags [FPU], seq 3743693392, win 1024, urg 0, length 0
11:44:17.891922 IP 10.12.100.44.45009 > 10.12.19.23.54328: Flags [FPU], seq 3743890003, win 1024, urg 0, length 0
11:44:17.894186 IP 10.12.100.44.45009 > 10.12.19.23.1217: Flags [FPU], seq 3743890003, win 1024, urg 0, length 0
11:44:17.894204 IP 10.12.100.44.45009 > 10.12.19.23.11111: Flags [FPU], seq 3743890003, win 1024, urg 0, length 0
11:44:17.937406 IP 10.12.100.44.45011 > 10.12.19.23.443: Flags [FPU], seq 3710203985, win 1024, urg 0, length 0
11:44:17.940035 IP 10.12.100.44.45009 > 10.12.19.23.2144: Flags [FPU], seq 3743890003, win 1024, urg 0, length 0
11:44:17.942392 IP 10.12.100.44.45007 > 10.12.19.23.7435: Flags [FPU], seq 3743758929, win 1024, urg 0, length 0
11:44:17.944655 IP 10.12.100.44.45007 > 10.12.19.23.3003: Flags [FPU], seq 3743758929, win 1024, urg 0, length 0
11:44:17.944661 IP 10.12.100.44.45007 > 10.12.19.23.648: Flags [FPU], seq 3743758929, win 1024, urg 0, length 0
11:44:17.995339 IP 10.12.100.44.45008 > 10.12.19.23.648: Flags [FPU], seq 3743693392, win 1024, urg 0, length 0
11:44:18.045692 IP 10.12.100.44.45009 > 10.12.19.23.648: Flags [FPU], seq 3743890003, win 1024, urg 0, length 0
11:44:18.098467 IP 10.12.100.44.45008 > 10.12.19.23.3003: Flags [FPU], seq 3743693392, win 1024, urg 0, length 0
11:44:18.098514 IP 10.12.100.44.45008 > 10.12.19.23.7435: Flags [FPU], seq 3743693392, win 1024, urg 0, length 0
11:44:18.098516 IP 10.12.100.44.45007 > 10.12.19.23.464: Flags [FPU], seq 3743758929, win 1024, urg 0, length 0
11:44:18.148774 IP 10.12.100.44.45008 > 10.12.19.23.464: Flags [FPU], seq 3743693392, win 1024, urg 0, length 0
11:44:18.148792 IP 10.12.100.44.45009 > 10.12.19.23.7435: Flags [FPU], seq 3743890003, win 1024, urg 0, length 0
11:44:18.148794 IP 10.12.100.44.45009 > 10.12.19.23.3003: Flags [FPU], seq 3743890003, win 1024, urg 0, length 0
11:44:18.199149 IP 10.12.100.44.45009 > 10.12.19.23.464: Flags [FPU], seq 3743890003, win 1024, urg 0, length 0
11:44:18.199193 IP 10.12.100.44.45007 > 10.12.19.23.8000: Flags [FPU], seq 3743758929, win 1024, urg 0, length 0
11:44:18.199194 IP 10.12.100.44.45007 > 10.12.19.23.1079: Flags [FPU], seq 3743758929, win 1024, urg 0, length 0
11:44:18.250056 IP 10.12.100.44.45008 > 10.12.19.23.1079: Flags [FPU], seq 3743693392, win 1024, urg 0, length 0
11:44:18.250085 IP 10.12.100.44.45008 > 10.12.19.23.8000: Flags [FPU], seq 3743693392, win 1024, urg 0, length 0
11:44:18.250087 IP 10.12.100.44.45007 > 10.12.19.23.5432: Flags [FPU], seq 3743758929, win 1024, urg 0, length 0
11:44:18.301082 IP 10.12.100.44.45008 > 10.12.19.23.5432: Flags [FPU], seq 3743693392, win 1024, urg 0, length 0
11:44:18.301126 IP 10.12.100.44.45009 > 10.12.19.23.8000: Flags [FPU], seq 3743890003, win 1024, urg 0, length 0
11:44:18.301128 IP 10.12.100.44.45009 > 10.12.19.23.1079: Flags [FPU], seq 3743890003, win 1024, urg 0, length 0
11:44:18.351531 IP 10.12.100.44.45009 > 10.12.19.23.5432: Flags [FPU], seq 3743890003, win 1024, urg 0, length 0
11:44:18.351548 IP 10.12.100.44.45007 > 10.12.19.23.714: Flags [FPU], seq 3743758929, win 1024, urg 0, length 0
11:44:18.351550 IP 10.12.100.44.45007 > 10.12.19.23.32773: Flags [FPU], seq 3743758929, win 1024, urg 0, length 0
11:44:18.401774 IP 10.12.100.44.45008 > 10.12.19.23.32773: Flags [FPU], seq 3743693392, win 1024, urg 0, length 0
11:44:18.401787 IP 10.12.100.44.45008 > 10.12.19.23.714: Flags [FPU], seq 3743693392, win 1024, urg 0, length 0
11:44:18.401788 IP 10.12.100.44.45007 > 10.12.19.23.1085: Flags [FPU], seq 3743758929, win 1024, urg 0, length 0
11:44:18.451801 IP 10.12.100.44.45009 > 10.12.19.23.32773: Flags [FPU], seq 3743890003, win 1024, urg 0, length 0
11:44:18.454146 IP 10.12.100.44.45008 > 10.12.19.23.1085: Flags [FPU], seq 3743693392, win 1024, urg 0, length 0
11:44:18.454152 IP 10.12.100.44.45009 > 10.12.19.23.714: Flags [FPU], seq 3743890003, win 1024, urg 0, length 0
11:44:18.502917 IP 10.12.100.44.45007 > 10.12.19.23.3261: Flags [FPU], seq 3743758929, win 1024, urg 0, length 0
11:44:18.505492 IP 10.12.100.44.45009 > 10.12.19.23.1085: Flags [FPU], seq 3743890003, win 1024, urg 0, length 0
11:44:18.505511 IP 10.12.100.44.45007 > 10.12.19.23.3476: Flags [FPU], seq 3743758929, win 1024, urg 0, length 0
11:44:18.553838 IP 10.12.100.44.45008 > 10.12.19.23.3261: Flags [FPU], seq 3743693392, win 1024, urg 0, length 0
11:44:18.556324 IP 10.12.100.44.45008 > 10.12.19.23.3476: Flags [FPU], seq 3743693392, win 1024, urg 0, length 0
11:44:18.556331 IP 10.12.100.44.45007 > 10.12.19.23.2065: Flags [FPU], seq 3743758929, win 1024, urg 0, length 0
11:44:18.604135 IP 10.12.100.44.45009 > 10.12.19.23.3261: Flags [FPU], seq 3743890003, win 1024, urg 0, length 0
11:44:18.606712 IP 10.12.100.44.45008 > 10.12.19.23.2065: Flags [FPU], seq 3743693392, win 1024, urg 0, length 0
11:44:18.606730 IP 10.12.100.44.45009 > 10.12.19.23.3476: Flags [FPU], seq 3743890003, win 1024, urg 0, length 0
11:44:18.654357 IP 10.12.100.44.45007 > 10.12.19.23.1066: Flags [FPU], seq 3743758929, win 1024, urg 0, length 0
11:44:18.657209 IP 10.12.100.44.45009 > 10.12.19.23.2065: Flags [FPU], seq 3743890003, win 1024, urg 0, length 0
11:44:18.657215 IP 10.12.100.44.45007 > 10.12.19.23.50389: Flags [FPU], seq 3743758929, win 1024, urg 0, length 0
11:44:18.704700 IP 10.12.100.44.45008 > 10.12.19.23.1066: Flags [FPU], seq 3743693392, win 1024, urg 0, length 0
11:44:18.707699 IP 10.12.100.44.45008 > 10.12.19.23.50389: Flags [FPU], seq 3743693392, win 1024, urg 0, length 0
11:44:18.707705 IP 10.12.100.44.45007 > 10.12.19.23.5500: Flags [FPU], seq 3743758929, win 1024, urg 0, length 0
11:44:18.754948 IP 10.12.100.44.45009 > 10.12.19.23.1066: Flags [FPU], seq 3743890003, win 1024, urg 0, length 0
11:44:18.758056 IP 10.12.100.44.45008 > 10.12.19.23.5500: Flags [FPU], seq 3743693392, win 1024, urg 0, length 0
11:44:18.758075 IP 10.12.100.44.45009 > 10.12.19.23.50389: Flags [FPU], seq 3743890003, win 1024, urg 0, length 0
11:44:18.805228 IP 10.12.100.44.45007 > 10.12.19.23.9040: Flags [FPU], seq 3743758929, win 1024, urg 0, length 0
11:44:18.808387 IP 10.12.100.44.45009 > 10.12.19.23.5500: Flags [FPU], seq 3743890003, win 1024, urg 0, length 0
11:44:18.808393 IP 10.12.100.44.45007 > 10.12.19.23.61900: Flags [FPU], seq 3743758929, win 1024, urg 0, length 0
11:44:18.855496 IP 10.12.100.44.45008 > 10.12.19.23.9040: Flags [FPU], seq 3743693392, win 1024, urg 0, length 0
11:44:18.858829 IP 10.12.100.44.45008 > 10.12.19.23.61900: Flags [FPU], seq 3743693392, win 1024, urg 0, length 0
11:44:18.858848 IP 10.12.100.44.45007 > 10.12.19.23.3945: Flags [FPU], seq 3743758929, win 1024, urg 0, length 0
11:44:18.905821 IP 10.12.100.44.45009 > 10.12.19.23.9040: Flags [FPU], seq 3743890003, win 1024, urg 0, length 0
11:44:18.909375 IP 10.12.100.44.45008 > 10.12.19.23.3945: Flags [FPU], seq 3743693392, win 1024, urg 0, length 0
11:44:18.909397 IP 10.12.100.44.45009 > 10.12.19.23.61900: Flags [FPU], seq 3743890003, win 1024, urg 0, length 0
11:44:18.956005 IP 10.12.100.44.45007 > 10.12.19.23.5959: Flags [FPU], seq 3743758929, win 1024, urg 0, length 0
11:44:18.960001 IP 10.12.100.44.45009 > 10.12.19.23.3945: Flags [FPU], seq 3743890003, win 1024, urg 0, length 0
11:44:18.960007 IP 10.12.100.44.45007 > 10.12.19.23.1090: Flags [FPU], seq 3743758929, win 1024, urg 0, length 0
11:44:19.006255 IP 10.12.100.44.45008 > 10.12.19.23.5959: Flags [FPU], seq 3743693392, win 1024, urg 0, length 0
11:44:19.010700 IP 10.12.100.44.45008 > 10.12.19.23.1090: Flags [FPU], seq 3743693392, win 1024, urg 0, length 0
11:44:19.010707 IP 10.12.100.44.45007 > 10.12.19.23.6007: Flags [FPU], seq 3743758929, win 1024, urg 0, length 0
11:44:19.056818 IP 10.12.100.44.45009 > 10.12.19.23.5959: Flags [FPU], seq 3743890003, win 1024, urg 0, length 0
11:44:19.061012 IP 10.12.100.44.45008 > 10.12.19.23.6007: Flags [FPU], seq 3743693392, win 1024, urg 0, length 0
11:44:19.061087 IP 10.12.100.44.45009 > 10.12.19.23.1090: Flags [FPU], seq 3743890003, win 1024, urg 0, length 0
11:44:19.107022 IP 10.12.100.44.45007 > 10.12.19.23.646: Flags [FPU], seq 3743758929, win 1024, urg 0, length 0
11:44:19.111672 IP 10.12.100.44.45009 > 10.12.19.23.6007: Flags [FPU], seq 3743890003, win 1024, urg 0, length 0
11:44:19.111680 IP 10.12.100.44.45007 > 10.12.19.23.1199: Flags [FPU], seq 3743758929, win 1024, urg 0, length 0
11:44:19.157308 IP 10.12.100.44.45008 > 10.12.19.23.646: Flags [FPU], seq 3743693392, win 1024, urg 0, length 0
11:44:19.162492 IP 10.12.100.44.45008 > 10.12.19.23.1199: Flags [FPU], seq 3743693392, win 1024, urg 0, length 0
11:44:19.162506 IP 10.12.100.44.45007 > 10.12.19.23.56738: Flags [FPU], seq 3743758929, win 1024, urg 0, length 0
11:44:19.208472 IP 10.12.100.44.45012 > 10.12.19.23.443: Flags [FPU], seq 3693427025, win 1024, urg 0, length 0
11:44:19.213224 IP 10.12.100.44.45008 > 10.12.19.23.56738: Flags [FPU], seq 3743693392, win 1024, urg 0, length 0
11:44:19.213231 IP 10.12.100.44.45009 > 10.12.19.23.1199: Flags [FPU], seq 3743890003, win 1024, urg 0, length 0
11:44:19.265990 IP 10.12.100.44.45009 > 10.12.19.23.56738: Flags [FPU], seq 3743890003, win 1024, urg 0, length 0
11:44:19.266009 IP 10.12.100.44.45009 > 10.12.19.23.646: Flags [FPU], seq 3743890003, win 1024, urg 0, length 0
11:44:19.316336 IP 10.12.100.44.45007 > 10.12.19.23.524: Flags [FPU], seq 3743758929, win 1024, urg 0, length 0
11:44:19.316355 IP 10.12.100.44.45007 > 10.12.19.23.5221: Flags [FPU], seq 3743758929, win 1024, urg 0, length 0
11:44:19.366570 IP 10.12.100.44.45008 > 10.12.19.23.5221: Flags [FPU], seq 3743693392, win 1024, urg 0, length 0
11:44:19.366589 IP 10.12.100.44.45008 > 10.12.19.23.524: Flags [FPU], seq 3743693392, win 1024, urg 0, length 0
11:44:19.416796 IP 10.12.100.44.45009 > 10.12.19.23.524: Flags [FPU], seq 3743890003, win 1024, urg 0, length 0
11:44:19.416804 IP 10.12.100.44.45009 > 10.12.19.23.5221: Flags [FPU], seq 3743890003, win 1024, urg 0, length 0
11:44:19.467535 IP 10.12.100.44.45007 > 10.12.19.23.50006: Flags [FPU], seq 3743758929, win 1024, urg 0, length 0
11:44:19.467564 IP 10.12.100.44.45007 > 10.12.19.23.4279: Flags [FPU], seq 3743758929, win 1024, urg 0, length 0
11:44:19.518653 IP 10.12.100.44.45008 > 10.12.19.23.4279: Flags [FPU], seq 3743693392, win 1024, urg 0, length 0
11:44:19.518674 IP 10.12.100.44.45008 > 10.12.19.23.50006: Flags [FPU], seq 3743693392, win 1024, urg 0, length 0
11:44:19.568813 IP 10.12.100.44.45009 > 10.12.19.23.50006: Flags [FPU], seq 3743890003, win 1024, urg 0, length 0
11:44:19.568830 IP 10.12.100.44.45009 > 10.12.19.23.4279: Flags [FPU], seq 3743890003, win 1024, urg 0, length 0
11:44:19.619111 IP 10.12.100.44.45007 > 10.12.19.23.42510: Flags [FPU], seq 3743758929, win 1024, urg 0, length 0
11:44:19.619154 IP 10.12.100.44.45007 > 10.12.19.23.2103: Flags [FPU], seq 3743758929, win 1024, urg 0, length 0
11:44:19.669253 IP 10.12.100.44.45008 > 10.12.19.23.2103: Flags [FPU], seq 3743693392, win 1024, urg 0, length 0
11:44:19.669271 IP 10.12.100.44.45008 > 10.12.19.23.42510: Flags [FPU], seq 3743693392, win 1024, urg 0, length 0
11:44:19.719491 IP 10.12.100.44.45009 > 10.12.19.23.42510: Flags [FPU], seq 3743890003, win 1024, urg 0, length 0
11:44:19.719509 IP 10.12.100.44.45009 > 10.12.19.23.2103: Flags [FPU], seq 3743890003, win 1024, urg 0, length 0
11:44:19.769987 IP 10.12.100.44.45007 > 10.12.19.23.1244: Flags [FPU], seq 3743758929, win 1024, urg 0, length 0
11:44:19.770005 IP 10.12.100.44.45007 > 10.12.19.23.8008: Flags [FPU], seq 3743758929, win 1024, urg 0, length 0
11:44:19.821030 IP 10.12.100.44.45008 > 10.12.19.23.8008: Flags [FPU], seq 3743693392, win 1024, urg 0, length 0
11:44:19.821055 IP 10.12.100.44.45008 > 10.12.19.23.1244: Flags [FPU], seq 3743693392, win 1024, urg 0, length 0
11:44:19.871151 IP 10.12.100.44.45009 > 10.12.19.23.8008: Flags [FPU], seq 3743890003, win 1024, urg 0, length 0
11:44:19.873657 IP 10.12.100.44.45009 > 10.12.19.23.1244: Flags [FPU], seq 3743890003, win 1024, urg 0, length 0
11:44:19.921486 IP 10.12.100.44.45007 > 10.12.19.23.14000: Flags [FPU], seq 3743758929, win 1024, urg 0, length 0
11:44:19.924069 IP 10.12.100.44.45007 > 10.12.19.23.3301: Flags [FPU], seq 3743758929, win 1024, urg 0, length 0
11:44:19.972196 IP 10.12.100.44.45008 > 10.12.19.23.14000: Flags [FPU], seq 3743693392, win 1024, urg 0, length 0
11:44:19.974621 IP 10.12.100.44.45008 > 10.12.19.23.3301: Flags [FPU], seq 3743693392, win 1024, urg 0, length 0
11:44:20.022578 IP 10.12.100.44.45009 > 10.12.19.23.14000: Flags [FPU], seq 3743890003, win 1024, urg 0, length 0
11:44:20.024925 IP 10.12.100.44.45009 > 10.12.19.23.3301: Flags [FPU], seq 3743890003, win 1024, urg 0, length 0
11:44:20.073022 IP 10.12.100.44.45007 > 10.12.19.23.5061: Flags [FPU], seq 3743758929, win 1024, urg 0, length 0
11:44:20.075685 IP 10.12.100.44.45007 > 10.12.19.23.5922: Flags [FPU], seq 3743758929, win 1024, urg 0, length 0
11:44:20.123235 IP 10.12.100.44.45008 > 10.12.19.23.5061: Flags [FPU], seq 3743693392, win 1024, urg 0, length 0
11:44:20.126150 IP 10.12.100.44.45008 > 10.12.19.23.5922: Flags [FPU], seq 3743693392, win 1024, urg 0, length 0
11:44:20.173529 IP 10.12.100.44.45009 > 10.12.19.23.5061: Flags [FPU], seq 3743890003, win 1024, urg 0, length 0
11:44:20.176470 IP 10.12.100.44.45009 > 10.12.19.23.5922: Flags [FPU], seq 3743890003, win 1024, urg 0, length 0
11:44:20.223711 IP 10.12.100.44.45007 > 10.12.19.23.1533: Flags [FPU], seq 3743758929, win 1024, urg 0, length 0
11:44:20.227010 IP 10.12.100.44.45007 > 10.12.19.23.2525: Flags [FPU], seq 3743758929, win 1024, urg 0, length 0
11:44:20.274572 IP 10.12.100.44.45008 > 10.12.19.23.1533: Flags [FPU], seq 3743693392, win 1024, urg 0, length 0
11:44:20.277228 IP 10.12.100.44.45008 > 10.12.19.23.2525: Flags [FPU], seq 3743693392, win 1024, urg 0, length 0
11:44:20.324809 IP 10.12.100.44.45009 > 10.12.19.23.1533: Flags [FPU], seq 3743890003, win 1024, urg 0, length 0
11:44:20.327541 IP 10.12.100.44.45009 > 10.12.19.23.2525: Flags [FPU], seq 3743890003, win 1024, urg 0, length 0
11:44:20.375125 IP 10.12.100.44.45007 > 10.12.19.23.1287: Flags [FPU], seq 3743758929, win 1024, urg 0, length 0
11:44:20.375140 ARP, Reply 10.12.100.44 is-at 08:00:27:32:44:68, length 46
11:44:20.377938 IP 10.12.100.44.45007 > 10.12.19.23.3914: Flags [FPU], seq 3743758929, win 1024, urg 0, length 0
11:44:20.425682 IP 10.12.100.44.45008 > 10.12.19.23.1287: Flags [FPU], seq 3743693392, win 1024, urg 0, length 0
11:44:20.428279 IP 10.12.100.44.45008 > 10.12.19.23.3914: Flags [FPU], seq 3743693392, win 1024, urg 0, length 0
11:44:20.476158 IP 10.12.100.44.45013 > 10.12.19.23.443: Flags [FPU], seq 3676651089, win 1024, urg 0, length 0
11:44:20.478722 IP 10.12.100.44.45009 > 10.12.19.23.3914: Flags [FPU], seq 3743890003, win 1024, urg 0, length 0
11:44:20.528904 IP 10.12.100.44.45009 > 10.12.19.23.1287: Flags [FPU], seq 3743890003, win 1024, urg 0, length 0
11:44:20.579399 IP 10.12.100.44.45007 > 10.12.19.23.2009: Flags [FPU], seq 3743758929, win 1024, urg 0, length 0
11:44:20.630260 IP 10.12.100.44.45008 > 10.12.19.23.2009: Flags [FPU], seq 3743693392, win 1024, urg 0, length 0
11:44:20.682758 IP 10.12.100.44.45009 > 10.12.19.23.2009: Flags [FPU], seq 3743890003, win 1024, urg 0, length 0
11:44:20.682778 IP 10.12.100.44.45007 > 10.12.19.23.1721: Flags [FPU], seq 3743758929, win 1024, urg 0, length 0
11:44:20.733315 IP 10.12.100.44.45008 > 10.12.19.23.1721: Flags [FPU], seq 3743693392, win 1024, urg 0, length 0
11:44:20.733332 IP 10.12.100.44.45007 > 10.12.19.23.912: Flags [FPU], seq 3743758929, win 1024, urg 0, length 0
11:44:20.783847 IP 10.12.100.44.45008 > 10.12.19.23.912: Flags [FPU], seq 3743693392, win 1024, urg 0, length 0
11:44:20.783866 IP 10.12.100.44.45009 > 10.12.19.23.1721: Flags [FPU], seq 3743890003, win 1024, urg 0, length 0
11:44:20.834015 IP 10.12.100.44.45009 > 10.12.19.23.912: Flags [FPU], seq 3743890003, win 1024, urg 0, length 0
11:44:20.836147 IP 10.12.100.44.45007 > 10.12.19.23.7911: Flags [FPU], seq 3743758929, win 1024, urg 0, length 0
11:44:20.884071 IP 10.12.100.44.45007 > 10.12.19.23.10025: Flags [FPU], seq 3743758929, win 1024, urg 0, length 0
11:44:20.886580 IP 10.12.100.44.45008 > 10.12.19.23.7911: Flags [FPU], seq 3743693392, win 1024, urg 0, length 0
11:44:20.935026 IP 10.12.100.44.45008 > 10.12.19.23.10025: Flags [FPU], seq 3743693392, win 1024, urg 0, length 0
11:44:20.937551 IP 10.12.100.44.45009 > 10.12.19.23.7911: Flags [FPU], seq 3743890003, win 1024, urg 0, length 0
11:44:20.985332 IP 10.12.100.44.45009 > 10.12.19.23.10025: Flags [FPU], seq 3743890003, win 1024, urg 0, length 0
11:44:20.987758 IP 10.12.100.44.45007 > 10.12.19.23.27000: Flags [FPU], seq 3743758929, win 1024, urg 0, length 0
11:44:21.035727 IP 10.12.100.44.45007 > 10.12.19.23.6668: Flags [FPU], seq 3743758929, win 1024, urg 0, length 0
11:44:21.038282 IP 10.12.100.44.45008 > 10.12.19.23.27000: Flags [FPU], seq 3743693392, win 1024, urg 0, length 0
11:44:21.086059 IP 10.12.100.44.45008 > 10.12.19.23.6668: Flags [FPU], seq 3743693392, win 1024, urg 0, length 0
11:44:21.088810 IP 10.12.100.44.45009 > 10.12.19.23.27000: Flags [FPU], seq 3743890003, win 1024, urg 0, length 0
11:44:21.137135 IP 10.12.100.44.45009 > 10.12.19.23.6668: Flags [FPU], seq 3743890003, win 1024, urg 0, length 0
11:44:21.139673 IP 10.12.100.44.45007 > 10.12.19.23.35500: Flags [FPU], seq 3743758929, win 1024, urg 0, length 0
11:44:21.187604 IP 10.12.100.44.45007 > 10.12.19.23.20000: Flags [FPU], seq 3743758929, win 1024, urg 0, length 0
11:44:21.190301 IP 10.12.100.44.45008 > 10.12.19.23.35500: Flags [FPU], seq 3743693392, win 1024, urg 0, length 0
11:44:21.238246 IP 10.12.100.44.45008 > 10.12.19.23.20000: Flags [FPU], seq 3743693392, win 1024, urg 0, length 0
11:44:21.240771 IP 10.12.100.44.45009 > 10.12.19.23.35500: Flags [FPU], seq 3743890003, win 1024, urg 0, length 0
11:44:21.288850 IP 10.12.100.44.45009 > 10.12.19.23.20000: Flags [FPU], seq 3743890003, win 1024, urg 0, length 0
11:44:21.291245 IP 10.12.100.44.45007 > 10.12.19.23.9091: Flags [FPU], seq 3743758929, win 1024, urg 0, length 0
11:44:21.338850 IP 10.12.100.44.45007 > 10.12.19.23.28201: Flags [FPU], seq 3743758929, win 1024, urg 0, length 0
11:44:21.341417 IP 10.12.100.44.45008 > 10.12.19.23.9091: Flags [FPU], seq 3743693392, win 1024, urg 0, length 0
11:44:21.389129 IP 10.12.100.44.45008 > 10.12.19.23.28201: Flags [FPU], seq 3743693392, win 1024, urg 0, length 0
11:44:21.391939 IP 10.12.100.44.45009 > 10.12.19.23.9091: Flags [FPU], seq 3743890003, win 1024, urg 0, length 0
11:44:21.439435 IP 10.12.100.44.45009 > 10.12.19.23.28201: Flags [FPU], seq 3743890003, win 1024, urg 0, length 0
11:44:21.442516 IP 10.12.100.44.45007 > 10.12.19.23.1583: Flags [FPU], seq 3743758929, win 1024, urg 0, length 0
11:44:21.489964 IP 10.12.100.44.45007 > 10.12.19.23.683: Flags [FPU], seq 3743758929, win 1024, urg 0, length 0
11:44:21.493002 IP 10.12.100.44.45008 > 10.12.19.23.1583: Flags [FPU], seq 3743693392, win 1024, urg 0, length 0
11:44:21.540098 IP 10.12.100.44.45008 > 10.12.19.23.683: Flags [FPU], seq 3743693392, win 1024, urg 0, length 0
