11:41:04.437501 ARP, Request who-has 10.12.19.23 (ff:ff:ff:ff:ff:ff) tell 10.12.100.44, length 46
11:41:04.638190 IP 10.12.100.44.38798 > 10.12.19.23.2944: sctp (1) [INIT] [init tag: 427314996] [rwnd: 32768] [OS: 10] [MIS: 2048] [init TSN: 4148486306] 
11:41:04.638240 IP 10.12.100.44.38798 > 10.12.19.23.22: sctp (1) [INIT] [init tag: 467858508] [rwnd: 32768] [OS: 10] [MIS: 2048] [init TSN: 203923044] 
11:41:04.638255 IP 10.12.100.44.38798 > 10.12.19.23.9900: sctp (1) [INIT] [init tag: 682614840] [rwnd: 32768] [OS: 10] [MIS: 2048] [init TSN: 1330263405] 
11:41:04.638256 IP 10.12.100.44.38798 > 10.12.19.23.36412: sctp (1) [INIT] [init tag: 305523810] [rwnd: 32768] [OS: 10] [MIS: 2048] [init TSN: 1106091006] 
11:41:04.638257 IP 10.12.100.44.38798 > 10.12.19.23.2945: sctp (1) [INIT] [init tag: 4222355513] [rwnd: 32768] [OS: 10] [MIS: 2048] [init TSN: 1062072326] 
11:41:04.638259 IP 10.12.100.44.38798 > 10.12.19.23.29168: sctp (1) [INIT] [init tag: 3178631748] [rwnd: 32768] [OS: 10] [MIS: 2048] [init TSN: 3662430955] 
11:41:04.638312 IP 10.12.100.44.38798 > 10.12.19.23.1167: sctp (1) [INIT] [init tag: 1839101206] [rwnd: 32768] [OS: 10] [MIS: 2048] [init TSN: 3387317562] 
11:41:04.638315 IP 10.12.100.44.38798 > 10.12.19.23.9082: sctp (1) [INIT] [init tag: 3597809408] [rwnd: 32768] [OS: 10] [MIS: 2048] [init TSN: 892394995] 
11:41:04.638317 IP 10.12.100.44.38798 > 10.12.19.23.7: sctp (1) [INIT] [init tag: 2115697977] [rwnd: 32768] [OS: 10] [MIS: 2048] [init TSN: 1040569887] 
11:41:04.638383 IP 10.12.100.44.38798 > 10.12.19.23.11997: sctp (1) [INIT] [init tag: 3169597561] [rwnd: 32768] [OS: 10] [MIS: 2048] [init TSN: 3077174003] 
11:41:05.691558 IP 10.12.100.44.38799 > 10.12.19.23.11997: sctp (1) [INIT] [init tag: 2365277385] [rwnd: 32768] [OS: 10] [MIS: 2048] [init TSN: 1211046915] 
11:41:05.691580 IP 10.12.100.44.38799 > 10.12.19.23.7: sctp (1) [INIT] [init tag: 2233437141] [rwnd: 32768] [OS: 10] [MIS: 2048] [init TSN: 3249604669] 
11:41:05.691582 IP 10.12.100.44.38799 > 10.12.19.23.9082: sctp (1) [INIT] [init tag: 472543252] [rwnd: 32768] [OS: 10] [MIS: 2048] [init TSN: 1721895580] 
11:41:05.691583 IP 10.12.100.44.38799 > 10.12.19.23.1167: sctp (1) [INIT] [init tag: 561695618] [rwnd: 32768] [OS: 10] [MIS: 2048] [init TSN: 1490789857] 
11:41:05.691585 IP 10.12.100.44.38799 > 10.12.19.23.29168: sctp (1) [INIT] [init tag: 3262972911] [rwnd: 32768] [OS: 10] [MIS: 2048] [init TSN: 1564814563] 
11:41:05.691586 IP 10.12.100.44.38799 > 10.12.19.23.2945: sctp (1) [INIT] [init tag: 3344682159] [rwnd: 32768] [OS: 10] [MIS: 2048] [init TSN: 1240309574] 
11:41:05.691642 IP 10.12.100.44.38799 > 10.12.19.23.36412: sctp (1) [INIT] [init tag: 588675664] [rwnd: 32768] [OS: 10] [MIS: 2048] [init TSN: 3624697234] 
11:41:05.691646 IP 10.12.100.44.38799 > 10.12.19.23.9900: sctp (1) [INIT] [init tag: 3790128374] [rwnd: 32768] [OS: 10] [MIS: 2048] [init TSN: 1842673511] 
11:41:05.691647 IP 10.12.100.44.38799 > 10.12.19.23.22: sctp (1) [INIT] [init tag: 903558087] [rwnd: 32768] [OS: 10] [MIS: 2048] [init TSN: 284298401] 
11:41:05.691687 IP 10.12.100.44.38799 > 10.12.19.23.2944: sctp (1) [INIT] [init tag: 3767315512] [rwnd: 32768] [OS: 10] [MIS: 2048] [init TSN: 3140004603] 
11:41:05.741567 IP 10.12.100.44.38798 > 10.12.19.23.4740: sctp (1) [INIT] [init tag: 1902729270] [rwnd: 32768] [OS: 10] [MIS: 2048] [init TSN: 3933175694] 
11:41:05.743931 IP 10.12.100.44.38798 > 10.12.19.23.9084: sctp (1) [INIT] [init tag: 1043228030] [rwnd: 32768] [OS: 10] [MIS: 2048] [init TSN: 2412396028] 
11:41:05.743940 IP 10.12.100.44.38798 > 10.12.19.23.179: sctp (1) [INIT] [init tag: 909738693] [rwnd: 32768] [OS: 10] [MIS: 2048] [init TSN: 1486094869] 
11:41:05.743942 IP 10.12.100.44.38798 > 10.12.19.23.3864: sctp (1) [INIT] [init tag: 3089505163] [rwnd: 32768] [OS: 10] [MIS: 2048] [init TSN: 3648267824] 
11:41:05.743943 IP 10.12.100.44.38798 > 10.12.19.23.6706: sctp[ForCES LP] (1) [INIT] [init tag: 3138276282] [rwnd: 32768] [OS: 10] [MIS: 2048] [init TSN: 3463692758] 
11:41:05.744004 IP 10.12.100.44.38798 > 10.12.19.23.21: sctp (1) [INIT] [init tag: 739959440] [rwnd: 32768] [OS: 10] [MIS: 2048] [init TSN: 4251239158] 
11:41:05.744020 IP 10.12.100.44.38798 > 10.12.19.23.9902: sctp (1) [INIT] [init tag: 545713252] [rwnd: 32768] [OS: 10] [MIS: 2048] [init TSN: 3262571447] 
11:41:05.744021 IP 10.12.100.44.38798 > 10.12.19.23.11999: sctp (1) [INIT] [init tag: 893868121] [rwnd: 32768] [OS: 10] [MIS: 2048] [init TSN: 4094212340] 
11:41:05.744090 IP 10.12.100.44.38798 > 10.12.19.23.7626: sctp (1) [INIT] [init tag: 2119096948] [rwnd: 32768] [OS: 10] [MIS: 2048] [init TSN: 934735371] 
11:41:05.744093 IP 10.12.100.44.38798 > 10.12.19.23.8471: sctp (1) [INIT] [init tag: 3944841389] [rwnd: 32768] [OS: 10] [MIS: 2048] [init TSN: 1024818651] 
11:41:05.792650 IP 10.12.100.44.38799 > 10.12.19.23.4740: sctp (1) [INIT] [init tag: 840980579] [rwnd: 32768] [OS: 10] [MIS: 2048] [init TSN: 3556493567] 
11:41:05.795142 IP 10.12.100.44.38799 > 10.12.19.23.8471: sctp (1) [INIT] [init tag: 1739830991] [rwnd: 32768] [OS: 10] [MIS: 2048] [init TSN: 59947533] 
11:41:05.795152 IP 10.12.100.44.38799 > 10.12.19.23.7626: sctp (1) [INIT] [init tag: 2356608976] [rwnd: 32768] [OS: 10] [MIS: 2048] [init TSN: 3742215980] 
11:41:05.795153 IP 10.12.100.44.38799 > 10.12.19.23.11999: sctp (1) [INIT] [init tag: 1364380557] [rwnd: 32768] [OS: 10] [MIS: 2048] [init TSN: 3277026510] 
11:41:05.795155 IP 10.12.100.44.38799 > 10.12.19.23.9902: sctp (1) [INIT] [init tag: 787356222] [rwnd: 32768] [OS: 10] [MIS: 2048] [init TSN: 2002253390] 
11:41:05.795156 IP 10.12.100.44.38799 > 10.12.19.23.21: sctp (1) [INIT] [init tag: 2707975041] [rwnd: 32768] [OS: 10] [MIS: 2048] [init TSN: 1703685960] 
11:41:05.795204 IP 10.12.100.44.38799 > 10.12.19.23.6706: sctp[ForCES LP] (1) [INIT] [init tag: 1819866676] [rwnd: 32768] [OS: 10] [MIS: 2048] [init TSN: 511738052] 
11:41:05.795232 IP 10.12.100.44.38799 > 10.12.19.23.3864: sctp (1) [INIT] [init tag: 2651054977] [rwnd: 32768] [OS: 10] [MIS: 2048] [init TSN: 507230135] 
11:41:05.795234 IP 10.12.100.44.38799 > 10.12.19.23.179: sctp (1) [INIT] [init tag: 2701480886] [rwnd: 32768] [OS: 10] [MIS: 2048] [init TSN: 1313384056] 
11:41:05.795235 IP 10.12.100.44.38799 > 10.12.19.23.9084: sctp (1) [INIT] [init tag: 1351794342] [rwnd: 32768] [OS: 10] [MIS: 2048] [init TSN: 4262783326] 
11:41:05.842881 IP 10.12.100.44.38798 > 10.12.19.23.5672: sctp (1) [INIT] [init tag: 3066428076] [rwnd: 32768] [OS: 10] [MIS: 2048] [init TSN: 4215313681] 
11:41:05.845262 IP 10.12.100.44.38798 > 10.12.19.23.5090: sctp (1) [INIT] [init tag: 50981606] [rwnd: 32768] [OS: 10] [MIS: 2048] [init TSN: 3592364071] 
11:41:05.845271 IP 10.12.100.44.38798 > 10.12.19.23.80: sctp (1) [INIT] [init tag: 1800271188] [rwnd: 32768] [OS: 10] [MIS: 2048] [init TSN: 2242230270] 
11:41:05.845273 IP 10.12.100.44.38798 > 10.12.19.23.4739: sctp (1) [INIT] [init tag: 3889638356] [rwnd: 32768] [OS: 10] [MIS: 2048] [init TSN: 2339317854] 
11:41:05.845349 IP 10.12.100.44.38798 > 10.12.19.23.29169: sctp (1) [INIT] [init tag: 1340879317] [rwnd: 32768] [OS: 10] [MIS: 2048] [init TSN: 471111540] 
11:41:05.847879 IP 10.12.100.44.38798 > 10.12.19.23.20049: sctp (1) [INIT] [init tag: 1594222071] [rwnd: 32768] [OS: 10] [MIS: 2048] [init TSN: 1648160063] 
11:41:05.847888 IP 10.12.100.44.38798 > 10.12.19.23.1812: sctp (1) [INIT] [init tag: 2285831666] [rwnd: 32768] [OS: 10] [MIS: 2048] [init TSN: 4085339394] 
11:41:05.847890 IP 10.12.100.44.38798 > 10.12.19.23.20: sctp (1) [INIT] [init tag: 3469515058] [rwnd: 32768] [OS: 10] [MIS: 2048] [init TSN: 465912264] 
11:41:05.847891 IP 10.12.100.44.38798 > 10.12.19.23.36422: sctp (1) [INIT] [init tag: 2038635260] [rwnd: 32768] [OS: 10] [MIS: 2048] [init TSN: 2986398249] 
11:41:05.847925 IP 10.12.100.44.38798 > 10.12.19.23.2904: sctp (1) [INIT] [init tag: 1730267018] [rwnd: 32768] [OS: 10] [MIS: 2048] [init TSN: 526312069] 
11:41:05.893632 IP 10.12.100.44.38799 > 10.12.19.23.5672: sctp (1) [INIT] [init tag: 1288334513] [rwnd: 32768] [OS: 10] [MIS: 2048] [init TSN: 339966243] 
11:41:05.895965 IP 10.12.100.44.38799 > 10.12.19.23.29169: sctp (1) [INIT] [init tag: 2214329888] [rwnd: 32768] [OS: 10] [MIS: 2048] [init TSN: 1639329764] 
11:41:05.895972 IP 10.12.100.44.38799 > 10.12.19.23.4739: sctp (1) [INIT] [init tag: 3982308940] [rwnd: 32768] [OS: 10] [MIS: 2048] [init TSN: 73348949] 
11:41:05.895974 IP 10.12.100.44.38799 > 10.12.19.23.80: sctp (1) [INIT] [init tag: 2179374835] [rwnd: 32768] [OS: 10] [MIS: 2048] [init TSN: 3286413801] 
11:41:05.896007 IP 10.12.100.44.38799 > 10.12.19.23.5090: sctp (1) [INIT] [init tag: 359487191] [rwnd: 32768] [OS: 10] [MIS: 2048] [init TSN: 615078550] 
11:41:05.898460 IP 10.12.100.44.38799 > 10.12.19.23.2904: sctp (1) [INIT] [init tag: 2307821213] [rwnd: 32768] [OS: 10] [MIS: 2048] [init TSN: 26213418] 
11:41:05.898467 IP 10.12.100.44.38799 > 10.12.19.23.36422: sctp (1) [INIT] [init tag: 2587567557] [rwnd: 32768] [OS: 10] [MIS: 2048] [init TSN: 3798333025] 
11:41:05.898469 IP 10.12.100.44.38799 > 10.12.19.23.20: sctp (1) [INIT] [init tag: 141335195] [rwnd: 32768] [OS: 10] [MIS: 2048] [init TSN: 2840899039] 
11:41:05.898470 IP 10.12.100.44.38799 > 10.12.19.23.1812: sctp (1) [INIT] [init tag: 4280305447] [rwnd: 32768] [OS: 10] [MIS: 2048] [init TSN: 159499280] 
11:41:05.898520 IP 10.12.100.44.38799 > 10.12.19.23.20049: sctp (1) [INIT] [init tag: 1597790963] [rwnd: 32768] [OS: 10] [MIS: 2048] [init TSN: 1969603417] 
11:41:05.943692 IP 10.12.100.44.38798 > 10.12.19.23.1813: sctp (1) [INIT] [init tag: 276665219] [rwnd: 32768] [OS: 10] [MIS: 2048] [init TSN: 895829032] 
11:41:05.946360 IP 10.12.100.44.38798 > 10.12.19.23.5061: sctp (1) [INIT] [init tag: 2006393920] [rwnd: 32768] [OS: 10] [MIS: 2048] [init TSN: 2304363038] 
11:41:05.946471 IP 10.12.100.44.38798 > 10.12.19.23.3868: sctp (1) [INIT] [init tag: 1723983015] [rwnd: 32768] [OS: 10] [MIS: 2048] [init TSN: 3536656005] 
11:41:05.946474 IP 10.12.100.44.38798 > 10.12.19.23.2049: sctp (1) [INIT] [init tag: 2018252103] [rwnd: 32768] [OS: 10] [MIS: 2048] [init TSN: 3317573197] 
11:41:05.946476 IP 10.12.100.44.38798 > 10.12.19.23.3565: sctp (1) [INIT] [init tag: 3227454321] [rwnd: 32768] [OS: 10] [MIS: 2048] [init TSN: 758363839] 
11:41:05.948900 IP 10.12.100.44.38798 > 10.12.19.23.5060: sctp (1) [INIT] [init tag: 205072540] [rwnd: 32768] [OS: 10] [MIS: 2048] [init TSN: 2067130846] 
11:41:05.948928 IP 10.12.100.44.38798 > 10.12.19.23.2225: sctp (1) [INIT] [init tag: 2548308158] [rwnd: 32768] [OS: 10] [MIS: 2048] [init TSN: 4040534224] 
11:41:05.948929 IP 10.12.100.44.38798 > 10.12.19.23.6705: sctp[ForCES MP] (1) [INIT] [init tag: 3903506723] [rwnd: 32768] [OS: 10] [MIS: 2048] [init TSN: 3387359415] 
11:41:05.948931 IP 10.12.100.44.38798 > 10.12.19.23.5675: sctp (1) [INIT] [init tag: 3389839047] [rwnd: 32768] [OS: 10] [MIS: 2048] [init TSN: 512343141] 
11:41:05.948932 IP 10.12.100.44.38798 > 10.12.19.23.6704: sctp[ForCES HP] (1) [INIT] [init tag: 1639914903] [rwnd: 32768] [OS: 10] [MIS: 2048] [init TSN: 2726796799] 
11:41:05.994054 IP 10.12.100.44.38799 > 10.12.19.23.1813: sctp (1) [INIT] [init tag: 3530751042] [rwnd: 32768] [OS: 10] [MIS: 2048] [init TSN: 1662615748] 
11:41:05.996879 IP 10.12.100.44.38799 > 10.12.19.23.3565: sctp (1) [INIT] [init tag: 4071356192] [rwnd: 32768] [OS: 10] [MIS: 2048] [init TSN: 1162982674] 
11:41:05.996887 IP 10.12.100.44.38799 > 10.12.19.23.2049: sctp (1) [INIT] [init tag: 1373857138] [rwnd: 32768] [OS: 10] [MIS: 2048] [init TSN: 3905152163] 
11:41:05.996889 IP 10.12.100.44.38799 > 10.12.19.23.3868: sctp (1) [INIT] [init tag: 2356635068] [rwnd: 32768] [OS: 10] [MIS: 2048] [init TSN: 1628274887] 
11:41:05.996975 IP 10.12.100.44.38799 > 10.12.19.23.5061: sctp (1) [INIT] [init tag: 4060648304] [rwnd: 32768] [OS: 10] [MIS: 2048] [init TSN: 1736760232] 
11:41:05.999566 IP 10.12.100.44.38799 > 10.12.19.23.6704: sctp[ForCES HP] (1) [INIT] [init tag: 947229805] [rwnd: 32768] [OS: 10] [MIS: 2048] [init TSN: 326605684] 
11:41:05.999574 IP 10.12.100.44.38799 > 10.12.19.23.5675: sctp (1) [INIT] [init tag: 2613238339] [rwnd: 32768] [OS: 10] [MIS: 2048] [init TSN: 2828184094] 
11:41:05.999576 IP 10.12.100.44.38799 > 10.12.19.23.6705: sctp[ForCES MP] (1) [INIT] [init tag: 3457445627] [rwnd: 32768] [OS: 10] [MIS: 2048] [init TSN: 2688917499] 
11:41:05.999577 IP 10.12.100.44.38799 > 10.12.19.23.2225: sctp (1) [INIT] [init tag: 3087665197] [rwnd: 32768] [OS: 10] [MIS: 2048] [init TSN: 2615141124] 
11:41:05.999637 IP 10.12.100.44.38799 > 10.12.19.23.5060: sctp (1) [INIT] [init tag: 3290446341] [rwnd: 32768] [OS: 10] [MIS: 2048] [init TSN: 1540161115] 
11:41:06.044839 IP 10.12.100.44.38798 > 10.12.19.23.11998: sctp (1) [INIT] [init tag: 6630686] [rwnd: 32768] [OS: 10] [MIS: 2048] [init TSN: 1201752860] 
11:41:06.047175 IP 10.12.100.44.38798 > 10.12.19.23.2427: sctp (1) [INIT] [init tag: 911414524] [rwnd: 32768] [OS: 10] [MIS: 2048] [init TSN: 1843011642] 
11:41:06.047185 IP 10.12.100.44.38798 > 10.12.19.23.9: sctp (1) [INIT] [init tag: 4201093026] [rwnd: 32768] [OS: 10] [MIS: 2048] [init TSN: 1795036573] 
11:41:06.047186 IP 10.12.100.44.38798 > 10.12.19.23.2905: sctp (1) [INIT] [init tag: 1880986398] [rwnd: 32768] [OS: 10] [MIS: 2048] [init TSN: 1371090715] 
11:41:06.047238 IP 10.12.100.44.38798 > 10.12.19.23.3097: sctp (1) [INIT] [init tag: 2135522012] [rwnd: 32768] [OS: 10] [MIS: 2048] [init TSN: 2232596432] 
11:41:06.049656 IP 10.12.100.44.38798 > 10.12.19.23.3863: sctp (1) [INIT] [init tag: 3833859211] [rwnd: 32768] [OS: 10] [MIS: 2048] [init TSN: 2291260740] 
11:41:06.049665 IP 10.12.100.44.38798 > 10.12.19.23.5091: sctp (1) [INIT] [init tag: 483343885] [rwnd: 32768] [OS: 10] [MIS: 2048] [init TSN: 3108653213] 
11:41:06.049667 IP 10.12.100.44.38798 > 10.12.19.23.9899: sctp (1) [INIT] [init tag: 4053149490] [rwnd: 32768] [OS: 10] [MIS: 2048] [init TSN: 1595221916] 
11:41:06.049716 IP 10.12.100.44.38798 > 10.12.19.23.14001: sctp (1) [INIT] [init tag: 908017169] [rwnd: 32768] [OS: 10] [MIS: 2048] [init TSN: 2304647688] 
11:41:06.052220 IP 10.12.100.44.38798 > 10.12.19.23.443: sctp (1) [INIT] [init tag: 45265550] [rwnd: 32768] [OS: 10] [MIS: 2048] [init TSN: 755124075] 
11:41:06.095103 IP 10.12.100.44.38799 > 10.12.19.23.11998: sctp (1) [INIT] [init tag: 3248443133] [rwnd: 32768] [OS: 10] [MIS: 2048] [init TSN: 3675685451] 
11:41:06.097389 IP 10.12.100.44.38799 > 10.12.19.23.3097: sctp (1) [INIT] [init tag: 2406676301] [rwnd: 32768] [OS: 10] [MIS: 2048] [init TSN: 1855666309] 
11:41:06.097398 IP 10.12.100.44.38799 > 10.12.19.23.2905: sctp (1) [INIT] [init tag: 2178581589] [rwnd: 32768] [OS: 10] [MIS: 2048] [init TSN: 3929178125] 
11:41:06.097400 IP 10.12.100.44.38799 > 10.12.19.23.9: sctp (1) [INIT] [init tag: 3714704975] [rwnd: 32768] [OS: 10] [MIS: 2048] [init TSN: 817431439] 
11:41:06.097461 IP 10.12.100.44.38799 > 10.12.19.23.2427: sctp (1) [INIT] [init tag: 806522475] [rwnd: 32768] [OS: 10] [MIS: 2048] [init TSN: 3980210854] 
11:41:06.099984 IP 10.12.100.44.38799 > 10.12.19.23.14001: sctp (1) [INIT] [init tag: 2250667275] [rwnd: 32768] [OS: 10] [MIS: 2048] [init TSN: 1195036366] 
11:41:06.100006 IP 10.12.100.44.38799 > 10.12.19.23.9899: sctp (1) [INIT] [init tag: 406891922] [rwnd: 32768] [OS: 10] [MIS: 2048] [init TSN: 2956558781] 
11:41:06.100008 IP 10.12.100.44.38799 > 10.12.19.23.5091: sctp (1) [INIT] [init tag: 3002315110] [rwnd: 32768] [OS: 10] [MIS: 2048] [init TSN: 155016286] 
11:41:06.100010 IP 10.12.100.44.38799 > 10.12.19.23.3863: sctp (1) [INIT] [init tag: 4278275624] [rwnd: 32768] [OS: 10] [MIS: 2048] [init TSN: 131006932] 
11:41:06.102520 IP 10.12.100.44.38799 > 10.12.19.23.443: sctp (1) [INIT] [init tag: 3678895568] [rwnd: 32768] [OS: 10] [MIS: 2048] [init TSN: 1915786981] 
11:41:06.145369 IP 10.12.100.44.38798 > 10.12.19.23.9901: sctp (1) [INIT] [init tag: 4237544920] [rwnd: 32768] [OS: 10] [MIS: 2048] [init TSN: 2166978192] 
11:41:06.147884 IP 10.12.100.44.38798 > 10.12.19.23.29118: sctp (1) [INIT] [init tag: 2041990060] [rwnd: 32768] [OS: 10] [MIS: 2048] [init TSN: 664236713] 
11:41:06.196170 IP 10.12.100.44.38799 > 10.12.19.23.9901: sctp (1) [INIT] [init tag: 2023410241] [rwnd: 32768] [OS: 10] [MIS: 2048] [init TSN: 292801384] 
11:41:06.198556 IP 10.12.100.44.38799 > 10.12.19.23.29118: sctp (1) [INIT] [init tag: 4116748016] [rwnd: 32768] [OS: 10] [MIS: 2048] [init TSN: 2927325551] 
