16:18:05.880041 IP 10.12.9.6.5353 > 224.0.0.251.5353: 0 PTR (QM)? _privet._tcp.local. (36)
16:18:05.880059 IP6 fe80::c8:6c94:57c7:6a24.5353 > ff02::fb.5353: 0 PTR (QM)? _privet._tcp.local. (36)
16:18:07.205234 IP 10.12.9.6.5353 > 224.0.0.251.5353: 0 [4q] PTR (QM)? _airport._tcp.local. PTR (QM)? _googlecast._tcp.local. PTR (QM)? _raop._tcp.local. PTR (QM)? _airplay._tcp.local. (82)
16:18:07.205251 IP6 fe80::c8:6c94:57c7:6a24.5353 > ff02::fb.5353: 0 [4q] PTR (QM)? _airport._tcp.local. PTR (QM)? _googlecast._tcp.local. PTR (QM)? _raop._tcp.local. PTR (QM)? _airplay._tcp.local. (82)
16:18:07.809542 ARP, Request who-has 10.12.19.23 (ff:ff:ff:ff:ff:ff) tell 10.12.100.171, length 46
16:18:07.809558 ARP, Reply 10.12.19.23 is-at 08:00:27:d1:82:df, length 28
16:18:08.010550 IP 10.12.100.171.60816 > 10.12.19.23.9084: sctp (1) [INIT] [init tag: 2333583808] [rwnd: 32768] [OS: 10] [MIS: 2048] [init TSN: 465316092] 
16:18:08.010570 IP 10.12.100.171.60816 > 10.12.19.23.9: sctp (1) [INIT] [init tag: 2728163332] [rwnd: 32768] [OS: 10] [MIS: 2048] [init TSN: 4176022168] 
16:18:08.010571 IP 10.12.100.171.60816 > 10.12.19.23.29168: sctp (1) [INIT] [init tag: 2717978761] [rwnd: 32768] [OS: 10] [MIS: 2048] [init TSN: 2440159455] 
16:18:08.010572 IP 10.12.100.171.60816 > 10.12.19.23.5060: sctp (1) [INIT] [init tag: 4099137105] [rwnd: 32768] [OS: 10] [MIS: 2048] [init TSN: 2828331768] 
16:18:08.010619 IP 10.12.100.171.60816 > 10.12.19.23.9900: sctp (1) [INIT] [init tag: 2809838976] [rwnd: 32768] [OS: 10] [MIS: 2048] [init TSN: 4260274011] 
16:18:08.010621 IP 10.12.100.171.60816 > 10.12.19.23.9899: sctp (1) [INIT] [init tag: 34534568] [rwnd: 32768] [OS: 10] [MIS: 2048] [init TSN: 890742188] 
16:18:08.010623 IP 10.12.100.171.60816 > 10.12.19.23.29118: sctp (1) [INIT] [init tag: 4229576276] [rwnd: 32768] [OS: 10] [MIS: 2048] [init TSN: 4245631988] 
16:18:08.010693 IP 10.12.100.171.60816 > 10.12.19.23.2944: sctp (1) [INIT] [init tag: 2713797685] [rwnd: 32768] [OS: 10] [MIS: 2048] [init TSN: 3977903834] 
16:18:08.010699 IP 10.12.100.171.60816 > 10.12.19.23.3863: sctp (1) [INIT] [init tag: 3555219598] [rwnd: 32768] [OS: 10] [MIS: 2048] [init TSN: 1289588313] 
16:18:08.010701 IP 10.12.100.171.60816 > 10.12.19.23.9082: sctp (1) [INIT] [init tag: 2364775098] [rwnd: 32768] [OS: 10] [MIS: 2048] [init TSN: 1272188627] 
16:18:09.062556 IP 10.12.100.171.60817 > 10.12.19.23.9082: sctp (1) [INIT] [init tag: 710901079] [rwnd: 32768] [OS: 10] [MIS: 2048] [init TSN: 2289455744] 
16:18:09.062576 IP 10.12.100.171.60817 > 10.12.19.23.3863: sctp (1) [INIT] [init tag: 196149133] [rwnd: 32768] [OS: 10] [MIS: 2048] [init TSN: 3441215009] 
16:18:09.062578 IP 10.12.100.171.60817 > 10.12.19.23.2944: sctp (1) [INIT] [init tag: 1897252921] [rwnd: 32768] [OS: 10] [MIS: 2048] [init TSN: 1502763237] 
16:18:09.062579 IP 10.12.100.171.60817 > 10.12.19.23.29118: sctp (1) [INIT] [init tag: 4202574276] [rwnd: 32768] [OS: 10] [MIS: 2048] [init TSN: 3846447303] 
16:18:09.062580 IP 10.12.100.171.60817 > 10.12.19.23.9899: sctp (1) [INIT] [init tag: 3238742264] [rwnd: 32768] [OS: 10] [MIS: 2048] [init TSN: 3350076475] 
16:18:09.062582 IP 10.12.100.171.60817 > 10.12.19.23.9900: sctp (1) [INIT] [init tag: 1346765892] [rwnd: 32768] [OS: 10] [MIS: 2048] [init TSN: 1376138705] 
16:18:09.062663 IP 10.12.100.171.60817 > 10.12.19.23.5060: sctp (1) [INIT] [init tag: 527442951] [rwnd: 32768] [OS: 10] [MIS: 2048] [init TSN: 2414178618] 
16:18:09.062666 IP 10.12.100.171.60817 > 10.12.19.23.29168: sctp (1) [INIT] [init tag: 440183902] [rwnd: 32768] [OS: 10] [MIS: 2048] [init TSN: 2094567506] 
16:18:09.062668 IP 10.12.100.171.60817 > 10.12.19.23.9: sctp (1) [INIT] [init tag: 2170295450] [rwnd: 32768] [OS: 10] [MIS: 2048] [init TSN: 3204737772] 
16:18:09.062737 IP 10.12.100.171.60817 > 10.12.19.23.9084: sctp (1) [INIT] [init tag: 2955389231] [rwnd: 32768] [OS: 10] [MIS: 2048] [init TSN: 4117810174] 
16:18:09.113138 IP 10.12.100.171.60816 > 10.12.19.23.6705: sctp[ForCES MP] (1) [INIT] [init tag: 2145496394] [rwnd: 32768] [OS: 10] [MIS: 2048] [init TSN: 1803374074] 
16:18:09.113159 IP 10.12.100.171.60816 > 10.12.19.23.5091: sctp (1) [INIT] [init tag: 4093226960] [rwnd: 32768] [OS: 10] [MIS: 2048] [init TSN: 2378419050] 
16:18:09.113160 IP 10.12.100.171.60816 > 10.12.19.23.14001: sctp (1) [INIT] [init tag: 1253101207] [rwnd: 32768] [OS: 10] [MIS: 2048] [init TSN: 704736800] 
16:18:09.113162 IP 10.12.100.171.60816 > 10.12.19.23.36412: sctp (1) [INIT] [init tag: 3995522725] [rwnd: 32768] [OS: 10] [MIS: 2048] [init TSN: 3967726585] 
16:18:09.113163 IP 10.12.100.171.60816 > 10.12.19.23.179: sctp (1) [INIT] [init tag: 3888883377] [rwnd: 32768] [OS: 10] [MIS: 2048] [init TSN: 1136821206] 
16:18:09.113165 IP 10.12.100.171.60816 > 10.12.19.23.2904: sctp (1) [INIT] [init tag: 3237910434] [rwnd: 32768] [OS: 10] [MIS: 2048] [init TSN: 726144505] 
16:18:09.113250 IP 10.12.100.171.60816 > 10.12.19.23.7626: sctp (1) [INIT] [init tag: 3690134420] [rwnd: 32768] [OS: 10] [MIS: 2048] [init TSN: 3516489100] 
16:18:09.113253 IP 10.12.100.171.60816 > 10.12.19.23.2905: sctp (1) [INIT] [init tag: 416157051] [rwnd: 32768] [OS: 10] [MIS: 2048] [init TSN: 4129086403] 
16:18:09.113255 IP 10.12.100.171.60816 > 10.12.19.23.20: sctp (1) [INIT] [init tag: 3692479120] [rwnd: 32768] [OS: 10] [MIS: 2048] [init TSN: 3136034118] 
16:18:09.113308 IP 10.12.100.171.60816 > 10.12.19.23.22: sctp (1) [INIT] [init tag: 2765043607] [rwnd: 32768] [OS: 10] [MIS: 2048] [init TSN: 4109074557] 
16:18:09.163408 IP 10.12.100.171.60817 > 10.12.19.23.2905: sctp (1) [INIT] [init tag: 673614929] [rwnd: 32768] [OS: 10] [MIS: 2048] [init TSN: 1924703925] 
16:18:09.163442 IP 10.12.100.171.60817 > 10.12.19.23.7626: sctp (1) [INIT] [init tag: 1170714649] [rwnd: 32768] [OS: 10] [MIS: 2048] [init TSN: 3113050979] 
16:18:09.163443 IP 10.12.100.171.60817 > 10.12.19.23.2904: sctp (1) [INIT] [init tag: 1715234853] [rwnd: 32768] [OS: 10] [MIS: 2048] [init TSN: 1175403577] 
16:18:09.163445 IP 10.12.100.171.60817 > 10.12.19.23.179: sctp (1) [INIT] [init tag: 285465981] [rwnd: 32768] [OS: 10] [MIS: 2048] [init TSN: 1733675850] 
16:18:09.163446 IP 10.12.100.171.60817 > 10.12.19.23.36412: sctp (1) [INIT] [init tag: 4275001398] [rwnd: 32768] [OS: 10] [MIS: 2048] [init TSN: 1614793881] 
16:18:09.163447 IP 10.12.100.171.60817 > 10.12.19.23.14001: sctp (1) [INIT] [init tag: 2065866725] [rwnd: 32768] [OS: 10] [MIS: 2048] [init TSN: 2066819148] 
16:18:09.163532 IP 10.12.100.171.60817 > 10.12.19.23.5091: sctp (1) [INIT] [init tag: 2096029595] [rwnd: 32768] [OS: 10] [MIS: 2048] [init TSN: 1475667871] 
16:18:09.163535 IP 10.12.100.171.60817 > 10.12.19.23.6705: sctp[ForCES MP] (1) [INIT] [init tag: 639578317] [rwnd: 32768] [OS: 10] [MIS: 2048] [init TSN: 2070912434] 
16:18:09.165883 IP 10.12.100.171.60817 > 10.12.19.23.22: sctp (1) [INIT] [init tag: 4269358607] [rwnd: 32768] [OS: 10] [MIS: 2048] [init TSN: 2949540817] 
16:18:09.165904 IP 10.12.100.171.60817 > 10.12.19.23.20: sctp (1) [INIT] [init tag: 3985957766] [rwnd: 32768] [OS: 10] [MIS: 2048] [init TSN: 734021246] 
16:18:09.213854 IP 10.12.100.171.60816 > 10.12.19.23.9902: sctp (1) [INIT] [init tag: 2643578844] [rwnd: 32768] [OS: 10] [MIS: 2048] [init TSN: 2692194690] 
16:18:09.213875 IP 10.12.100.171.60816 > 10.12.19.23.3864: sctp (1) [INIT] [init tag: 1844673540] [rwnd: 32768] [OS: 10] [MIS: 2048] [init TSN: 3100507889] 
16:18:09.213877 IP 10.12.100.171.60816 > 10.12.19.23.36422: sctp (1) [INIT] [init tag: 572543142] [rwnd: 32768] [OS: 10] [MIS: 2048] [init TSN: 1693158431] 
16:18:09.213878 IP 10.12.100.171.60816 > 10.12.19.23.4739: sctp (1) [INIT] [init tag: 4231899198] [rwnd: 32768] [OS: 10] [MIS: 2048] [init TSN: 188581231] 
16:18:09.213966 IP 10.12.100.171.60816 > 10.12.19.23.8471: sctp (1) [INIT] [init tag: 756806870] [rwnd: 32768] [OS: 10] [MIS: 2048] [init TSN: 4282570480] 
16:18:09.213969 IP 10.12.100.171.60816 > 10.12.19.23.1812: sctp (1) [INIT] [init tag: 2704103932] [rwnd: 32768] [OS: 10] [MIS: 2048] [init TSN: 2164882767] 
16:18:09.213971 IP 10.12.100.171.60816 > 10.12.19.23.5675: sctp (1) [INIT] [init tag: 4198300474] [rwnd: 32768] [OS: 10] [MIS: 2048] [init TSN: 1628448164] 
16:18:09.214064 IP 10.12.100.171.60816 > 10.12.19.23.1813: sctp (1) [INIT] [init tag: 3067802827] [rwnd: 32768] [OS: 10] [MIS: 2048] [init TSN: 3245388968] 
16:18:09.216573 IP 10.12.100.171.60816 > 10.12.19.23.1167: sctp (1) [INIT] [init tag: 3474628435] [rwnd: 32768] [OS: 10] [MIS: 2048] [init TSN: 1713200588] 
16:18:09.216591 IP 10.12.100.171.60816 > 10.12.19.23.6704: sctp[ForCES HP] (1) [INIT] [init tag: 4161170992] [rwnd: 32768] [OS: 10] [MIS: 2048] [init TSN: 2756676189] 
16:18:09.264089 IP 10.12.100.171.60817 > 10.12.19.23.5675: sctp (1) [INIT] [init tag: 3829540295] [rwnd: 32768] [OS: 10] [MIS: 2048] [init TSN: 3192982406] 
16:18:09.264097 IP 10.12.100.171.60817 > 10.12.19.23.1812: sctp (1) [INIT] [init tag: 2808533762] [rwnd: 32768] [OS: 10] [MIS: 2048] [init TSN: 2161590186] 
16:18:09.264098 IP 10.12.100.171.60817 > 10.12.19.23.8471: sctp (1) [INIT] [init tag: 1138678056] [rwnd: 32768] [OS: 10] [MIS: 2048] [init TSN: 3020527403] 
16:18:09.264099 IP 10.12.100.171.60817 > 10.12.19.23.4739: sctp (1) [INIT] [init tag: 3505659090] [rwnd: 32768] [OS: 10] [MIS: 2048] [init TSN: 1637665401] 
16:18:09.264150 IP 10.12.100.171.60817 > 10.12.19.23.36422: sctp (1) [INIT] [init tag: 2515607447] [rwnd: 32768] [OS: 10] [MIS: 2048] [init TSN: 373412051] 
16:18:09.264153 IP 10.12.100.171.60817 > 10.12.19.23.3864: sctp (1) [INIT] [init tag: 2430707416] [rwnd: 32768] [OS: 10] [MIS: 2048] [init TSN: 3574162074] 
16:18:09.264154 IP 10.12.100.171.60817 > 10.12.19.23.9902: sctp (1) [INIT] [init tag: 3765517866] [rwnd: 32768] [OS: 10] [MIS: 2048] [init TSN: 55779241] 
16:18:09.266691 IP 10.12.100.171.60817 > 10.12.19.23.6704: sctp[ForCES HP] (1) [INIT] [init tag: 1088570112] [rwnd: 32768] [OS: 10] [MIS: 2048] [init TSN: 1655782168] 
16:18:09.266698 IP 10.12.100.171.60817 > 10.12.19.23.1167: sctp (1) [INIT] [init tag: 1256291228] [rwnd: 32768] [OS: 10] [MIS: 2048] [init TSN: 2388512799] 
16:18:09.266756 IP 10.12.100.171.60817 > 10.12.19.23.1813: sctp (1) [INIT] [init tag: 3945273388] [rwnd: 32768] [OS: 10] [MIS: 2048] [init TSN: 387386370] 
16:18:09.314461 IP 10.12.100.171.60816 > 10.12.19.23.80: sctp (1) [INIT] [init tag: 3288819622] [rwnd: 32768] [OS: 10] [MIS: 2048] [init TSN: 365022385] 
16:18:09.314482 IP 10.12.100.171.60816 > 10.12.19.23.11997: sctp (1) [INIT] [init tag: 373465740] [rwnd: 32768] [OS: 10] [MIS: 2048] [init TSN: 4007954035] 
16:18:09.314484 IP 10.12.100.171.60816 > 10.12.19.23.11998: sctp (1) [INIT] [init tag: 1961686660] [rwnd: 32768] [OS: 10] [MIS: 2048] [init TSN: 4180541822] 
16:18:09.314485 IP 10.12.100.171.60816 > 10.12.19.23.9901: sctp (1) [INIT] [init tag: 481083573] [rwnd: 32768] [OS: 10] [MIS: 2048] [init TSN: 2131572423] 
16:18:09.314487 IP 10.12.100.171.60816 > 10.12.19.23.3868: sctp (1) [INIT] [init tag: 1749769738] [rwnd: 32768] [OS: 10] [MIS: 2048] [init TSN: 3887059977] 
16:18:09.314530 IP 10.12.100.171.60816 > 10.12.19.23.2225: sctp (1) [INIT] [init tag: 979411605] [rwnd: 32768] [OS: 10] [MIS: 2048] [init TSN: 1534455469] 
16:18:09.314533 IP 10.12.100.171.60816 > 10.12.19.23.2049: sctp (1) [INIT] [init tag: 3686144752] [rwnd: 32768] [OS: 10] [MIS: 2048] [init TSN: 1436151518] 
16:18:09.317221 IP 10.12.100.171.60816 > 10.12.19.23.7: sctp (1) [INIT] [init tag: 2524471890] [rwnd: 32768] [OS: 10] [MIS: 2048] [init TSN: 1490132258] 
16:18:09.317228 IP 10.12.100.171.60816 > 10.12.19.23.20049: sctp (1) [INIT] [init tag: 258794396] [rwnd: 32768] [OS: 10] [MIS: 2048] [init TSN: 1570567532] 
16:18:09.317229 IP 10.12.100.171.60816 > 10.12.19.23.11999: sctp (1) [INIT] [init tag: 1015358547] [rwnd: 32768] [OS: 10] [MIS: 2048] [init TSN: 2888870382] 
16:18:09.365033 IP 10.12.100.171.60817 > 10.12.19.23.2049: sctp (1) [INIT] [init tag: 349908545] [rwnd: 32768] [OS: 10] [MIS: 2048] [init TSN: 2384786034] 
16:18:09.365052 IP 10.12.100.171.60817 > 10.12.19.23.2225: sctp (1) [INIT] [init tag: 3829111126] [rwnd: 32768] [OS: 10] [MIS: 2048] [init TSN: 507763182] 
16:18:09.365054 IP 10.12.100.171.60817 > 10.12.19.23.3868: sctp (1) [INIT] [init tag: 538078773] [rwnd: 32768] [OS: 10] [MIS: 2048] [init TSN: 2442178540] 
16:18:09.365055 IP 10.12.100.171.60817 > 10.12.19.23.9901: sctp (1) [INIT] [init tag: 3633609587] [rwnd: 32768] [OS: 10] [MIS: 2048] [init TSN: 1345118277] 
16:18:09.365056 IP 10.12.100.171.60817 > 10.12.19.23.11998: sctp (1) [INIT] [init tag: 1724671062] [rwnd: 32768] [OS: 10] [MIS: 2048] [init TSN: 1164680792] 
16:18:09.365108 IP 10.12.100.171.60817 > 10.12.19.23.11997: sctp (1) [INIT] [init tag: 517605190] [rwnd: 32768] [OS: 10] [MIS: 2048] [init TSN: 4263568102] 
16:18:09.365111 IP 10.12.100.171.60817 > 10.12.19.23.80: sctp (1) [INIT] [init tag: 2254231991] [rwnd: 32768] [OS: 10] [MIS: 2048] [init TSN: 2699850004] 
16:18:09.367547 IP 10.12.100.171.60817 > 10.12.19.23.11999: sctp (1) [INIT] [init tag: 919513807] [rwnd: 32768] [OS: 10] [MIS: 2048] [init TSN: 3634588835] 
16:18:09.367554 IP 10.12.100.171.60817 > 10.12.19.23.20049: sctp (1) [INIT] [init tag: 119640523] [rwnd: 32768] [OS: 10] [MIS: 2048] [init TSN: 1809096077] 
16:18:09.367555 IP 10.12.100.171.60817 > 10.12.19.23.7: sctp (1) [INIT] [init tag: 2975931370] [rwnd: 32768] [OS: 10] [MIS: 2048] [init TSN: 2330984469] 
16:18:09.415632 IP 10.12.100.171.60816 > 10.12.19.23.6706: sctp[ForCES LP] (1) [INIT] [init tag: 373339820] [rwnd: 32768] [OS: 10] [MIS: 2048] [init TSN: 3864878647] 
16:18:09.415652 IP 10.12.100.171.60816 > 10.12.19.23.2945: sctp (1) [INIT] [init tag: 3081962402] [rwnd: 32768] [OS: 10] [MIS: 2048] [init TSN: 440314549] 
16:18:09.415653 IP 10.12.100.171.60816 > 10.12.19.23.3097: sctp (1) [INIT] [init tag: 2247916843] [rwnd: 32768] [OS: 10] [MIS: 2048] [init TSN: 2796241792] 
16:18:09.415655 IP 10.12.100.171.60816 > 10.12.19.23.443: sctp (1) [INIT] [init tag: 2424376103] [rwnd: 32768] [OS: 10] [MIS: 2048] [init TSN: 1818284352] 
16:18:09.415695 IP 10.12.100.171.60816 > 10.12.19.23.21: sctp (1) [INIT] [init tag: 1904992263] [rwnd: 32768] [OS: 10] [MIS: 2048] [init TSN: 3878469452] 
16:18:09.415698 IP 10.12.100.171.60816 > 10.12.19.23.29169: sctp (1) [INIT] [init tag: 1602317845] [rwnd: 32768] [OS: 10] [MIS: 2048] [init TSN: 623330278] 
16:18:09.415699 IP 10.12.100.171.60816 > 10.12.19.23.3565: sctp (1) [INIT] [init tag: 4267520835] [rwnd: 32768] [OS: 10] [MIS: 2048] [init TSN: 251588620] 
16:18:09.418157 IP 10.12.100.171.60816 > 10.12.19.23.2427: sctp (1) [INIT] [init tag: 690145770] [rwnd: 32768] [OS: 10] [MIS: 2048] [init TSN: 726626805] 
16:18:09.418164 IP 10.12.100.171.60816 > 10.12.19.23.4740: sctp (1) [INIT] [init tag: 9581893] [rwnd: 32768] [OS: 10] [MIS: 2048] [init TSN: 4080863057] 
16:18:09.418166 IP 10.12.100.171.60816 > 10.12.19.23.5090: sctp (1) [INIT] [init tag: 544796940] [rwnd: 32768] [OS: 10] [MIS: 2048] [init TSN: 3079730588] 
16:18:09.465841 IP 10.12.100.171.60817 > 10.12.19.23.3565: sctp (1) [INIT] [init tag: 709982292] [rwnd: 32768] [OS: 10] [MIS: 2048] [init TSN: 3831821902] 
16:18:09.465848 IP 10.12.100.171.60817 > 10.12.19.23.29169: sctp (1) [INIT] [init tag: 3154468034] [rwnd: 32768] [OS: 10] [MIS: 2048] [init TSN: 3451752521] 
16:18:09.465849 IP 10.12.100.171.60817 > 10.12.19.23.21: sctp (1) [INIT] [init tag: 433569491] [rwnd: 32768] [OS: 10] [MIS: 2048] [init TSN: 3952309248] 
16:18:09.465963 IP 10.12.100.171.60817 > 10.12.19.23.443: sctp (1) [INIT] [init tag: 562127932] [rwnd: 32768] [OS: 10] [MIS: 2048] [init TSN: 3690343791] 
16:18:09.465968 IP 10.12.100.171.60817 > 10.12.19.23.3097: sctp (1) [INIT] [init tag: 750344112] [rwnd: 32768] [OS: 10] [MIS: 2048] [init TSN: 3279137393] 
16:18:09.465970 IP 10.12.100.171.60817 > 10.12.19.23.2945: sctp (1) [INIT] [init tag: 3698804749] [rwnd: 32768] [OS: 10] [MIS: 2048] [init TSN: 1162109477] 
16:18:09.465971 IP 10.12.100.171.60817 > 10.12.19.23.6706: sctp[ForCES LP] (1) [INIT] [init tag: 3535765078] [rwnd: 32768] [OS: 10] [MIS: 2048] [init TSN: 1956242323] 
16:18:09.468594 IP 10.12.100.171.60817 > 10.12.19.23.5090: sctp (1) [INIT] [init tag: 1959329880] [rwnd: 32768] [OS: 10] [MIS: 2048] [init TSN: 3281578726] 
16:18:09.468602 IP 10.12.100.171.60817 > 10.12.19.23.4740: sctp (1) [INIT] [init tag: 1057144823] [rwnd: 32768] [OS: 10] [MIS: 2048] [init TSN: 16428723] 
16:18:09.468603 IP 10.12.100.171.60817 > 10.12.19.23.2427: sctp (1) [INIT] [init tag: 1692405828] [rwnd: 32768] [OS: 10] [MIS: 2048] [init TSN: 3728944445] 
16:18:09.516098 IP 10.12.100.171.60816 > 10.12.19.23.5672: sctp (1) [INIT] [init tag: 2245382793] [rwnd: 32768] [OS: 10] [MIS: 2048] [init TSN: 3459755305] 
16:18:09.516112 IP 10.12.100.171.60816 > 10.12.19.23.5061: sctp (1) [INIT] [init tag: 4274026979] [rwnd: 32768] [OS: 10] [MIS: 2048] [init TSN: 3106614152] 
16:18:09.567596 IP 10.12.100.171.60817 > 10.12.19.23.5061: sctp (1) [INIT] [init tag: 2114389592] [rwnd: 32768] [OS: 10] [MIS: 2048] [init TSN: 2330469201] 
16:18:09.567602 IP 10.12.100.171.60817 > 10.12.19.23.5672: sctp (1) [INIT] [init tag: 1668283810] [rwnd: 32768] [OS: 10] [MIS: 2048] [init TSN: 1112001848] 
